training:id:admin	training:source	qa:training_group	training:country	training:country_iso_3166_1	training:program	training:course_title	training:delivery_unit	training:recipient_unit	qa:training_start_date	training:start_date	qa:training_end_date	training:end_date	training:location	training:quantity	training:total_cost	qa:training_source_url	training:status:admin	qa:training_date_first_seen	qa:training_date_scraped	qa:hash
61547f61-0a99-4d9f-8bf1-a2510a27d9c0	03221d24-92ea-4ccc-a6a2-bd88dbfcd9fb	2001_2002_Africa_fmtrpt.tsv	Angola	AGO	DoS Africa Region, Angola, Africa Center for Strategic Studies, FY01	Senior Leader Seminar		Ministry of Foreign Affairs MOD	1/29/01	2001-01-29	2/9/01	2001-02-09	Libreville Gabon	2	9667	https://2009-2017.state.gov/documents/organization/10964.pdf	Not checked against source; verify accuracy before use	2002-03	2019-07-16	a2f7f0fd901affd9cbffb695b5ec888c
f2f32d63-35d9-44d0-b8c6-b3953e501a9f	03221d24-92ea-4ccc-a6a2-bd88dbfcd9fb	2001_2002_Africa_fmtrpt.tsv	Benin	BEN	DoS Africa Region, Benin, International Military Education and Training (IMET), FY01	AIRBORNE		Army, Ground Forces, 1st Batallion, Combined-Arms	5/7/01	2001-05-07	5/12/01	2001-05-12	FT BENNING GA 31905-5468	1	1296	https://2009-2017.state.gov/documents/organization/10964.pdf	Not checked against source; verify accuracy before use	2002-03	2019-07-16	c26befa74e465f1fa11348b4b7e644e1
904cca00-9278-462c-a2eb-47b8f07a6c2c	03221d24-92ea-4ccc-a6a2-bd88dbfcd9fb	2001_2002_Africa_fmtrpt.tsv	Benin	BEN	DoS Africa Region, Benin, International Military Education and Training (IMET), FY01	AMERICAN LANGUAGE COURSE		Air Force, on training in the US	1/22/01	2001-01-22	6/8/01	2001-06-08	LACKLAND AFB, TX 78236	1	18241	https://2009-2017.state.gov/documents/organization/10964.pdf	Not checked against source; verify accuracy before use	2002-03	2019-07-16	082b2e767c7bd70cebf340560c3a76a6
c4aa4af8-edfa-433b-8464-b5c52a79b201	03221d24-92ea-4ccc-a6a2-bd88dbfcd9fb	2001_2002_Africa_fmtrpt.tsv	Benin	BEN	DoS Africa Region, Benin, International Military Education and Training (IMET), FY01	AMERICAN LANGUAGE COURSE		on training in the US	4/9/01	2001-04-09	8/24/01	2001-08-24	LACKLAND AFB, TX 78236	1	13944	https://2009-2017.state.gov/documents/organization/10964.pdf	Not checked against source; verify accuracy before use	2002-03	2019-07-16	28dd8e8627f30e703c47cb98f7908cb5
44113026-31cf-4455-a8de-27910354348b	03221d24-92ea-4ccc-a6a2-bd88dbfcd9fb	2001_2002_Africa_fmtrpt.tsv	Benin	BEN	DoS Africa Region, Benin, International Military Education and Training (IMET), FY01	AMERICAN LANGUAGE CRS		Navy, Posted at General Chief of Staff Headquarters	5/7/01	2001-05-07	9/21/01	2001-09-21	LACKLAND AFB, TX 78236-5259	1	14044	https://2009-2017.state.gov/documents/organization/10964.pdf	Not checked against source; verify accuracy before use	2002-03	2019-07-16	448378a050ef168d57d13e403023db9d
bbf52f16-9acc-4a18-bbf8-fcd1b3fdd6c5	03221d24-92ea-4ccc-a6a2-bd88dbfcd9fb	2001_2002_Africa_fmtrpt.tsv	Benin	BEN	DoS Africa Region, Benin, International Military Education and Training (IMET), FY01	AMERICAN LANGUAGE CRS		Navy, Posted at Genreal Chief of Staff Headquarters	11/27/00	2000-11-27	1/5/01	2001-01-05	LACKLAND AFB, TX 78236-5259	1	10485	https://2009-2017.state.gov/documents/organization/10964.pdf	Not checked against source; verify accuracy before use	2002-03	2019-07-16	d10a8a19e5c317138d6bb28b06d2c359
5c6b3c27-5f11-49c1-a1c8-dc854f7c9960	03221d24-92ea-4ccc-a6a2-bd88dbfcd9fb	2001_2002_Africa_fmtrpt.tsv	Benin	BEN	DoS Africa Region, Benin, International Military Education and Training (IMET), FY01	ENGLISH LANGUAGE CRSE		Army, Ground Forces, 1st Batallion, Combined-Arms	12/11/00	2000-12-11	4/27/01	2001-04-27	SAN ANTONIO TX 78236-5259	1	14607	https://2009-2017.state.gov/documents/organization/10964.pdf	Not checked against source; verify accuracy before use	2002-03	2019-07-16	7a56e660212477261636fe70e8d72ee6
82ffaa21-7f49-4625-a70d-b527eddf2c00	03221d24-92ea-4ccc-a6a2-bd88dbfcd9fb	2001_2002_Africa_fmtrpt.tsv	Benin	BEN	DoS Africa Region, Benin, International Military Education and Training (IMET), FY01	ENGLISH LANGUAGE CRSE		Army, Ground Forces, 1st Balallion, Military Engineering	4/16/01	2001-04-16	8/31/01	2001-08-31	SAN ANTONIO TX 78236-5259	1	14607	https://2009-2017.state.gov/documents/organization/10964.pdf	Not checked against source; verify accuracy before use	2002-03	2019-07-16	5d346eda7f0274def37e519825b8b668
bd29e97d-887e-4638-ae34-df6607487306	03221d24-92ea-4ccc-a6a2-bd88dbfcd9fb	2001_2002_Africa_fmtrpt.tsv	Benin	BEN	DoS Africa Region, Benin, International Military Education and Training (IMET), FY01	INTL OFF SCH (FOR AC&SC)		Air Force, on training in the US	6/18/01	2001-06-18	7/27/01	2001-07-27	MAXWELL AFB, AL 36112-6323	1	10509	https://2009-2017.state.gov/documents/organization/10964.pdf	Not checked against source; verify accuracy before use	2002-03	2019-07-16	3d1c49c4b3b24d0b2336bf2b3dbe427a
11e2e17b-d908-4b79-8c1e-44b150b62661	03221d24-92ea-4ccc-a6a2-bd88dbfcd9fb	2001_2002_Africa_fmtrpt.tsv	Benin	BEN	DoS Africa Region, Benin, International Military Education and Training (IMET), FY01	INTL OFF SCH (FOR AC&SC)		Air Force, on training in the US	6/18/01	2001-06-18	7/27/01	2001-07-27	MAXWELL AFB, AL 36112-6323	1	6870	https://2009-2017.state.gov/documents/organization/10964.pdf	Not checked against source; verify accuracy before use	2002-03	2019-07-16	25ad33005be46af2b8eaf8f7f4172407
46b9f812-4144-45d2-ba60-4c3bee5e45ba	03221d24-92ea-4ccc-a6a2-bd88dbfcd9fb	2001_2002_Africa_fmtrpt.tsv	Benin	BEN	DoS Africa Region, Benin, International Military Education and Training (IMET), FY01	JOINT TRANSITION COURSE		Navy, General Chief of Staff Headquarters	7/2/01	2001-07-02	7/6/01	2001-07-06	NORFOLK, VA 23511-1702	1	2081	https://2009-2017.state.gov/documents/organization/10964.pdf	Not checked against source; verify accuracy before use	2002-03	2019-07-16	0adc04b2b93c915b8544703465c30960
ca7db888-4106-4a43-924b-bb37310ca139	03221d24-92ea-4ccc-a6a2-bd88dbfcd9fb	2001_2002_Africa_fmtrpt.tsv	Benin	BEN	DoS Africa Region, Benin, International Military Education and Training (IMET), FY01	JT/COMB STAFF OFFICER SCHL		Navy, General Chief of Staff Headquarters	7/9/01	2001-07-09	9/28/01	2001-09-28	NORFOLK, VA 23511-1702	1	10425	https://2009-2017.state.gov/documents/organization/10964.pdf	Not checked against source; verify accuracy before use	2002-03	2019-07-16	a6091ace0ac93ccce6036091c0fdf014
b2e79fab-816f-43a1-b0f3-6b31c7b64a0a	03221d24-92ea-4ccc-a6a2-bd88dbfcd9fb	2001_2002_Africa_fmtrpt.tsv	Benin	BEN	DoS Africa Region, Benin, International Military Education and Training (IMET), FY01	LANG LAB MAINT / CASSETTE		Air Force, on training in the US	12/11/00	2000-12-11	2/2/01	2001-02-02	LACKLAND AFB, TX 78236	1	4871	https://2009-2017.state.gov/documents/organization/10964.pdf	Not checked against source; verify accuracy before use	2002-03	2019-07-16	4530ffd3d006d9a3c4745d90672c9bcc
261732a3-e443-490b-a580-fcc65e1f2804	03221d24-92ea-4ccc-a6a2-bd88dbfcd9fb	2001_2002_Africa_fmtrpt.tsv	Benin	BEN	DoS Africa Region, Benin, International Military Education and Training (IMET), FY01	MET REGIONAL DIILS		Navy (2), Air Force (2), National Gendarmerie (8), Ground Forces (8), Ministry of Foreign Aaffairs (4), Ministry of Interior (6), Red Cross (3), Ministry pf Justice (4), Ministry of National Defense (3)	7/23/01	2001-07-23	7/27/01	2001-07-27	Benin	45	32329	https://2009-2017.state.gov/documents/organization/10964.pdf	Not checked against source; verify accuracy before use	2002-03	2019-07-16	8fe65df9bec2b8cae1189d753c7d7410
c576f8c2-e564-4555-94af-13e9f9972258	03221d24-92ea-4ccc-a6a2-bd88dbfcd9fb	2001_2002_Africa_fmtrpt.tsv	Benin	BEN	DoS Africa Region, Benin, International Military Education and Training (IMET), FY01	NAVAL STAFF COLLEGE		Navy, Posted at General Chief of Staff Headquarters	1/11/01	2001-01-11	6/15/01	2001-06-15	NEWPORT, RI 02841-1207	1	22587	https://2009-2017.state.gov/documents/organization/10964.pdf	Not checked against source; verify accuracy before use	2002-03	2019-07-16	8b515dd3e7caecb0e4ae4797888aada9
825d1c89-5c5f-4522-892d-292e4019e445	03221d24-92ea-4ccc-a6a2-bd88dbfcd9fb	2001_2002_Africa_fmtrpt.tsv	Benin	BEN	DoS Africa Region, Benin, International Military Education and Training (IMET), FY01	OJT COMM/ELECT TNG-CONUS		Air Force, on training in the US	10/30/00	2000-10-30	11/24/00	2000-11-24		1	2903	https://2009-2017.state.gov/documents/organization/10964.pdf	Not checked against source; verify accuracy before use	2002-03	2019-07-16	9e96e21c304e51510264a7725f608858
38739215-c6e5-4de5-8f96-17648f005931	03221d24-92ea-4ccc-a6a2-bd88dbfcd9fb	2001_2002_Africa_fmtrpt.tsv	Benin	BEN	DoS Africa Region, Benin, International Military Education and Training (IMET), FY01	PATHFINDER		Army, Ground Forces, Combined-Arms	6/18/01	2001-06-18	7/9/01	2001-07-09	FT BENNING GA 31905-5468	1	222	https://2009-2017.state.gov/documents/organization/10964.pdf	Not checked against source; verify accuracy before use	2002-03	2019-07-16	14bf87ce5b8a29b7084fc4dcb3f1d9c5
da0e8415-ff24-4f9c-84ba-1cdf8cbb6da7	03221d24-92ea-4ccc-a6a2-bd88dbfcd9fb	2001_2002_Africa_fmtrpt.tsv	Benin	BEN	Africa Region, Benin, International Military Education and Training (IMET), FY01	SPECIALIZED ENG LANG TNG		Army, Posted at Ministry of National Defense	6/18/01	2001-06-18	8/17/01	2001-08-17	LACKLAND AFB, TX 78236	1	8708	https://2009-2017.state.gov/documents/organization/10964.pdf	Not checked against source; verify accuracy before use	2002-03	2019-07-16	d5a09a158a2aaeca3f08bd66fce10b13
db4543d2-6b79-479f-89a3-0dd24d5ba8ca	03221d24-92ea-4ccc-a6a2-bd88dbfcd9fb	2001_2002_Africa_fmtrpt.tsv	Benin	BEN	DoS Africa Region, Benin, African Crisis Response Initiative, FY01	ACRI FT-4	3RD SFGA	ARMY	4/30/01	2001-04-30	5/25/01	2001-05-25	BENIN	634	450000	https://2009-2017.state.gov/documents/organization/10964.pdf	Not checked against source; verify accuracy before use	2002-03	2019-07-16	aba66c1ce0552cda3e05559ebab9bd90
cf07d023-73d6-44af-86d4-2550aa2b8479	03221d24-92ea-4ccc-a6a2-bd88dbfcd9fb	2001_2002_Africa_fmtrpt.tsv	Benin	BEN	DoS Africa Region, Benin, Africa Center for Strategic Studies, FY01	Senior Leader Seminar		MOD Ministry of Foreign Affairs NGO	1/29/01	2001-01-29	2/9/01	2001-02-09	Libreville Gabon	2	7837	https://2009-2017.state.gov/documents/organization/10964.pdf	Not checked against source; verify accuracy before use	2002-03	2019-07-16	284bca2c1b0c1a0469f06905102a39d4
e9351780-b2ce-4c95-90fd-f8597da1fd43	03221d24-92ea-4ccc-a6a2-bd88dbfcd9fb	2001_2002_Africa_fmtrpt.tsv	Benin	BEN	DoS Africa Region, Benin, Africa Center for Strategic Studies, FY01	Sub-Regional Seminar		MOD MFA	8/20/01	2001-08-20	8/24/01	2001-08-24	Accra Ghana	3	5072	https://2009-2017.state.gov/documents/organization/10964.pdf	Not checked against source; verify accuracy before use	2002-03	2019-07-16	7399cc544fe9bb78b4688e857544fbf4
8b690707-79a4-43f5-b57f-00a212d5110c	03221d24-92ea-4ccc-a6a2-bd88dbfcd9fb	2001_2002_Africa_fmtrpt.tsv	Botswana	BWA	DoS Africa Region, Botswana, Non-Security Assistance, Unified Command (Note 4), FY01	JCET	3/3 SFG	BDF COMMANDO BATTALION	6/4/01	2001-06-04	7/6/01	2001-07-06	GABARONE	50	82000	https://2009-2017.state.gov/documents/organization/10964.pdf	Not checked against source; verify accuracy before use	2002-03	2019-07-16	fac6f600cadfc4986516e77ebfd5ce20
6210c6f2-659d-4588-853b-25bfef357c4f	03221d24-92ea-4ccc-a6a2-bd88dbfcd9fb	2001_2002_Africa_fmtrpt.tsv	Botswana	BWA	DoS Africa Region, Botswana, Non-Security Assistance, Unified Command (Note 4), FY01	JCET	3/3 SFG	BDF BDR COMMANDO BATTALION (12), BDR HEADQUARTERS (8), BDF	6/4/01	2001-06-04	7/6/01	2001-07-06	GABOROME	32	82000	https://2009-2017.state.gov/documents/organization/10964.pdf	Not checked against source; verify accuracy before use	2002-03	2019-07-16	08f6f050fe328dc0655eb338d1e85aad
35a6e153-d768-4bad-b882-5639a728274d	03221d24-92ea-4ccc-a6a2-bd88dbfcd9fb	2001_2002_Africa_fmtrpt.tsv	Botswana	BWA	DoS Africa Region, Botswana, International Military Education and Training (IMET), FY01	ACCOUNTING & FINANCE/ *		FINANCE	6/4/01	2001-06-04	6/8/01	2001-06-08	SHEPPARD AFB TX 76311-2367	1	549	https://2009-2017.state.gov/documents/organization/10964.pdf	Not checked against source; verify accuracy before use	2002-03	2019-07-16	7e1f2f5b7a79db2256ad5f5944f14d63
11d9009e-49af-441a-bb86-908af1eec71e	03221d24-92ea-4ccc-a6a2-bd88dbfcd9fb	2001_2002_Africa_fmtrpt.tsv	Botswana	BWA	DoS Africa Region, Botswana, International Military Education and Training (IMET), FY01	AEROSP PROP APR (T/T ENG)		AIR ARM	4/20/01	2001-04-20	7/30/01	2001-07-30	SHEPPARD AFB TX 76311-2367	1	7733	https://2009-2017.state.gov/documents/organization/10964.pdf	Not checked against source; verify accuracy before use	2002-03	2019-07-16	7e5516a3ec975bdaeb744e89816c881a
8b742b8b-4099-4ffa-882b-135392eca149	03221d24-92ea-4ccc-a6a2-bd88dbfcd9fb	2001_2002_Africa_fmtrpt.tsv	Botswana	BWA	DoS Africa Region, Botswana, International Military Education and Training (IMET), FY01	AMEDD OBC ALL CORPS (MS)		MEDICAL CORPS	7/16/01	2001-07-16	9/28/01	2001-09-28	FT SAM HOUSTON TX 78234-6100	1	11577	https://2009-2017.state.gov/documents/organization/10964.pdf	Not checked against source; verify accuracy before use	2002-03	2019-07-16	c77b7e2b80094ac0c9b2bc469b2933da
e0ef3131-eaa5-4d27-a4bd-139a69bce91e	03221d24-92ea-4ccc-a6a2-bd88dbfcd9fb	2001_2002_Africa_fmtrpt.tsv	Botswana	BWA	DoS Africa Region, Botswana, International Military Education and Training (IMET), FY01	ARMOR CAPTAINS CAREER		ARMOUR	1/22/01	2001-01-22	5/25/01	2001-05-25	FT KNOX KY 40121-5234	1	10634	https://2009-2017.state.gov/documents/organization/10964.pdf	Not checked against source; verify accuracy before use	2002-03	2019-07-16	f9c173fe5627cdef7ba3f4db200e0842
8f03fb1a-0c50-4803-a5b1-311297f77e24	03221d24-92ea-4ccc-a6a2-bd88dbfcd9fb	2001_2002_Africa_fmtrpt.tsv	Botswana	BWA	DoS Africa Region, Botswana, International Military Education and Training (IMET), FY01	ARMOR CPT CAREER CRS PREP		ARMOUR	1/8/01	2001-01-08	1/19/01	2001-01-19	FT KNOX KY 40121-5234	1	5779	https://2009-2017.state.gov/documents/organization/10964.pdf	Not checked against source; verify accuracy before use	2002-03	2019-07-16	6bd68169b33687ff080f9888a3c5bb2b
778bccc7-97c7-4424-bf09-84f4299eaf62	03221d24-92ea-4ccc-a6a2-bd88dbfcd9fb	2001_2002_Africa_fmtrpt.tsv	Botswana	BWA	DoS Africa Region, Botswana, International Military Education and Training (IMET), FY01	CAVALRY LEADER		ARMOUR	6/4/01	2001-06-04	6/22/01	2001-06-22	FT KNOX KY 40121-5234	1	2292	https://2009-2017.state.gov/documents/organization/10964.pdf	Not checked against source; verify accuracy before use	2002-03	2019-07-16	2191c52556d35068b78a02bf526e84f6
6bc4b2ca-d6d2-47d7-86fc-3e861c5fd3b9	03221d24-92ea-4ccc-a6a2-bd88dbfcd9fb	2001_2002_Africa_fmtrpt.tsv	Botswana	BWA	DoS Africa Region, Botswana, International Military Education and Training (IMET), FY01	CIV-MIL SID - AFRICA		DISATER MANAGEMENT, OFFICE OF THE PRESIDENT	10/16/00	2000-10-16	10/27/00	2000-10-27	HURLBURT FIELD, FL 32544-5826	1	5887	https://2009-2017.state.gov/documents/organization/10964.pdf	Not checked against source; verify accuracy before use	2002-03	2019-07-16	58f974467f5b4f6c99319d616ed8d2ca
530f37be-4963-4a90-8542-d1e7a867d9fa	03221d24-92ea-4ccc-a6a2-bd88dbfcd9fb	2001_2002_Africa_fmtrpt.tsv	Botswana	BWA	DoS Africa Region, Botswana, International Military Education and Training (IMET), FY01	CIV-MIL SID - AFRICA		MECHANICAL ENGINEERS REGIMENT	10/16/00	2000-10-16	10/27/00	2000-10-27	HURLBURT FIELD, FL 32544-5826	1	5887	https://2009-2017.state.gov/documents/organization/10964.pdf	Not checked against source; verify accuracy before use	2002-03	2019-07-16	338273e389fe332d331ee65d6e871404
a3fcf141-3332-451d-b456-1613ccbaacf6	03221d24-92ea-4ccc-a6a2-bd88dbfcd9fb	2001_2002_Africa_fmtrpt.tsv	Botswana	BWA	DoS Africa Region, Botswana, International Military Education and Training (IMET), FY01	CIV-MIL SID - AFRICA		CORPS OF ARMAMENT SERVICES (CAS)	10/16/00	2000-10-16	10/27/00	2000-10-27	HURLBURT FIELD, FL 32544-5826	1	5887	https://2009-2017.state.gov/documents/organization/10964.pdf	Not checked against source; verify accuracy before use	2002-03	2019-07-16	ac07fe41ccfba298370948adc28ba48d
5204ce22-86f5-40ba-af30-f5903f90e95c	03221d24-92ea-4ccc-a6a2-bd88dbfcd9fb	2001_2002_Africa_fmtrpt.tsv	Botswana	BWA	DoS Africa Region, Botswana, International Military Education and Training (IMET), FY01	COMB STRAT INTEL TNG PRGM		INTELLIGENCE	4/16/01	2001-04-16	6/1/01	2001-06-01	WASHINGTON DC 20340-5100	1	8397	https://2009-2017.state.gov/documents/organization/10964.pdf	Not checked against source; verify accuracy before use	2002-03	2019-07-16	5e3e13ef9f515ad0ee7dba83fc20b001
df339018-214a-4b12-88a9-9dfbb6e63bcd	03221d24-92ea-4ccc-a6a2-bd88dbfcd9fb	2001_2002_Africa_fmtrpt.tsv	Botswana	BWA	DoS Africa Region, Botswana, International Military Education and Training (IMET), FY01	CONST EQUIP RPR SUPV-BNCOC		COMBAT ENGINEERS REGIMENT	7/12/01	2001-07-12	9/11/01	2001-09-11	FT LEONARD WOOD MO 65473-5000	1	7153	https://2009-2017.state.gov/documents/organization/10964.pdf	Not checked against source; verify accuracy before use	2002-03	2019-07-16	2622c19758ca63c595a7705d3f0bce82
4cfa67a2-7ac3-4d6d-b8df-4a35f6b29041	03221d24-92ea-4ccc-a6a2-bd88dbfcd9fb	2001_2002_Africa_fmtrpt.tsv	Botswana	BWA	DoS Africa Region, Botswana, International Military Education and Training (IMET), FY01	CONSTRUCTION EQUIP REPAIR		COMBAT ENGINEER	6/4/01	2001-06-04	7/30/01	2001-07-30	FT LEONARD WOOD MO 65473-5000	1	3760	https://2009-2017.state.gov/documents/organization/10964.pdf	Not checked against source; verify accuracy before use	2002-03	2019-07-16	f4371fcecc212f22d2ea2cd632bcd16c
216b5d60-6c1c-4bb5-adbc-d6e0ec01d571	03221d24-92ea-4ccc-a6a2-bd88dbfcd9fb	2001_2002_Africa_fmtrpt.tsv	Botswana	BWA	DoS Africa Region, Botswana, International Military Education and Training (IMET), FY01	FA OFF ADV PREP-ALLIED OFF		18TH FA REGT	4/12/01	2001-04-12	5/4/01	2001-05-04	FT SILL OK 73503	1	6522	https://2009-2017.state.gov/documents/organization/10964.pdf	Not checked against source; verify accuracy before use	2002-03	2019-07-16	09d46aa048c26f5a78894d6f9e095753
e7e73b2f-400d-4dba-bc5e-a6b4450d4429	03221d24-92ea-4ccc-a6a2-bd88dbfcd9fb	2001_2002_Africa_fmtrpt.tsv	Botswana	BWA	Africa Region, Botswana, International Military Education and Training (IMET), FY01	FIELD ARTY CAPTAINS CAREER		18TH FA REGT	5/8/01	2001-05-08	9/13/01	2001-09-13	FT SILL OK 73503	1	11915	https://2009-2017.state.gov/documents/organization/10964.pdf	Not checked against source; verify accuracy before use	2002-03	2019-07-16	c17d4e2f8d62a923e89d0d4a8477083c
f005efeb-256f-42ad-adee-91dc7dc78e01	03221d24-92ea-4ccc-a6a2-bd88dbfcd9fb	2001_2002_Africa_fmtrpt.tsv	Botswana	BWA	Africa Region, Botswana, International Military Education and Training (IMET), FY01	FINANCIAL MGMT STAFF OFCR		FINANCE	4/30/01	2001-04-30	6/1/01	2001-06-01	SHEPPARD AFB TX 76311-2367	1	4966	https://2009-2017.state.gov/documents/organization/10964.pdf	Not checked against source; verify accuracy before use	2002-03	2019-07-16	8f720c02614de6927febfc26671bd9bf
94bef97a-e793-45dc-a976-5cdb31577e78	03221d24-92ea-4ccc-a6a2-bd88dbfcd9fb	2001_2002_Africa_fmtrpt.tsv	Botswana	BWA	Africa Region, Botswana, International Military Education and Training (IMET), FY01	GEN CONST EQUIP OPERATOR		COMBAT ENGINEER	4/9/01	2001-04-09	5/24/01	2001-05-24	FT LEONARD WOOD MO 65473-5000	1	6271	https://2009-2017.state.gov/documents/organization/10964.pdf	Not checked against source; verify accuracy before use	2002-03	2019-07-16	9e123966dd0403f456c0cef724b45171
4752fc65-678d-49c1-bb47-639539d5e647	03221d24-92ea-4ccc-a6a2-bd88dbfcd9fb	2001_2002_Africa_fmtrpt.tsv	Botswana	BWA	Africa Region, Botswana, International Military Education and Training (IMET), FY01	HOSTAGE NEGOTIATIONS		MILITARY POLICE	3/26/01	2001-03-26	4/6/01	2001-04-06	FT LEONARD WOOD MO 65473-5000	1	1510	https://2009-2017.state.gov/documents/organization/10964.pdf	Not checked against source; verify accuracy before use	2002-03	2019-07-16	86e5f8ef30b193394fddc4c0c430f720
4f75e219-0a0d-4c0c-b632-6d64e46110b0	03221d24-92ea-4ccc-a6a2-bd88dbfcd9fb	2001_2002_Africa_fmtrpt.tsv	Botswana	BWA	Africa Region, Botswana, International Military Education and Training (IMET), FY01	INSTRUCTOR TRAINING		COMBAT ENGINEERS REGIMENT	8/6/01	2001-08-06	8/24/01	2001-08-24	FT LEONARD WOOD MO 65473-5000	1	1763	https://2009-2017.state.gov/documents/organization/10964.pdf	Not checked against source; verify accuracy before use	2002-03	2019-07-16	a3e576e3a2c5ae3b30537bb2737c22e2
024a8200-70a2-4d34-b125-dee260f20c7f	03221d24-92ea-4ccc-a6a2-bd88dbfcd9fb	2001_2002_Africa_fmtrpt.tsv	Botswana	BWA	Africa Region, Botswana, International Military Education and Training (IMET), FY01	INSTRUCTOR TRAINING		COMBAT ENGINEER	8/6/01	2001-08-06	8/24/01	2001-08-24	FT LEONARD WOOD MO 65473-5000	1	1541	https://2009-2017.state.gov/documents/organization/10964.pdf	Not checked against source; verify accuracy before use	2002-03	2019-07-16	073ced47286ba19ad2ac8069c92a7e26
961b2549-7763-440d-a0fd-6fd8b792cda0	03221d24-92ea-4ccc-a6a2-bd88dbfcd9fb	2001_2002_Africa_fmtrpt.tsv	Botswana	BWA	Africa Region, Botswana, International Military Education and Training (IMET), FY01	INSTRUCTOR TRAINING COURSE		ARMOURED BDE HQ	9/10/01	2001-09-10	9/26/01	2001-09-26	FT LEE VA 23801-1509	1	3127	https://2009-2017.state.gov/documents/organization/10964.pdf	Not checked against source; verify accuracy before use	2002-03	2019-07-16	96ea56c92b322a010ab6fca7e37d02a1
6fdbb76a-e0e8-4a3a-ba88-e016016a9d71	03221d24-92ea-4ccc-a6a2-bd88dbfcd9fb	2001_2002_Africa_fmtrpt.tsv	Botswana	BWA	Africa Region, Botswana, International Military Education and Training (IMET), FY01	INSTRUCTOR TRAINING COURSE		MEDICAL CORPS	5/7/01	2001-05-07	5/23/01	2001-05-23	FT LEE VA 23801-1509	1	1991	https://2009-2017.state.gov/documents/organization/10964.pdf	Not checked against source; verify accuracy before use	2002-03	2019-07-16	2a62bf80fa6a087badb8c711bb334e08
96770e0e-de66-4b6d-b11e-19b3de6d6c98	03221d24-92ea-4ccc-a6a2-bd88dbfcd9fb	2001_2002_Africa_fmtrpt.tsv	Botswana	BWA	Africa Region, Botswana, International Military Education and Training (IMET), FY01	INTERNATIONAL OFFICER PREP		11TH MEDIUM ARTILLERY REGIMENT	6/19/01	2001-06-19	7/6/01	2001-07-06	FT LEAVENWORTH KS 66027-1352	1	5757	https://2009-2017.state.gov/documents/organization/10964.pdf	Not checked against source; verify accuracy before use	2002-03	2019-07-16	4c651f98118a4e441c7dbb93d6e0a7ba
cda8957b-3fb9-458f-ae67-d8be42823dec	03221d24-92ea-4ccc-a6a2-bd88dbfcd9fb	2001_2002_Africa_fmtrpt.tsv	Botswana	BWA	Africa Region, Botswana, International Military Education and Training (IMET), FY01	INTL OFF SCH (FOR AC&SC)		AIR ARM	6/18/01	2001-06-18	7/27/01	2001-07-27	MAXWELL AFB, AL 36112-6323	1	8638	https://2009-2017.state.gov/documents/organization/10964.pdf	Not checked against source; verify accuracy before use	2002-03	2019-07-16	a1e696cc4ca7434f471a27a6299a15f1
de11e2e4-829a-48f2-9192-2df97228c8bc	03221d24-92ea-4ccc-a6a2-bd88dbfcd9fb	2001_2002_Africa_fmtrpt.tsv	Botswana	BWA	Africa Region, Botswana, International Military Education and Training (IMET), FY01	MEDICAL SPECIALIST		MEDICAL CORPS	5/7/01	2001-05-07	7/17/01	2001-07-17	FT SAM HOUSTON TX 78234-6100	1	10430	https://2009-2017.state.gov/documents/organization/10964.pdf	Not checked against source; verify accuracy before use	2002-03	2019-07-16	836681a8dcac9b765bb5c4ffbb2f10a6
6b16d7e7-2ba9-45a7-88ee-d1e569e657a9	03221d24-92ea-4ccc-a6a2-bd88dbfcd9fb	2001_2002_Africa_fmtrpt.tsv	Botswana	BWA	Africa Region, Botswana, International Military Education and Training (IMET), FY01	MET CIV-MILITARY RELATIONS		BDF HQ	4/2/01	2001-04-02	4/4/01	2001-04-04	Botswana	0	4518	https://2009-2017.state.gov/documents/organization/10964.pdf	Not checked against source; verify accuracy before use	2002-03	2019-07-16	b47b844e8b671013a9ca7ba8f0745cf0
675f6f90-2b59-4002-8ee7-1b4e0f02e071	03221d24-92ea-4ccc-a6a2-bd88dbfcd9fb	2001_2002_Africa_fmtrpt.tsv	Botswana	BWA	Africa Region, Botswana, International Military Education and Training (IMET), FY01	MET DIILS ASSESS OF ISSUES		BDF HQ	5/21/01	2001-05-21	5/24/01	2001-05-24	Botswana	0	11028	https://2009-2017.state.gov/documents/organization/10964.pdf	Not checked against source; verify accuracy before use	2002-03	2019-07-16	a31e9819dff092b848e4dc99ff5c27d8
a474b4a3-fc05-4200-8b92-1ad0845fc43f	03221d24-92ea-4ccc-a6a2-bd88dbfcd9fb	2001_2002_Africa_fmtrpt.tsv	Botswana	BWA	Africa Region, Botswana, International Military Education and Training (IMET), FY01	MET REGIONAL CIV-MIL RELS		BDF HQ	6/25/01	2001-06-25	6/29/01	2001-06-29	Botswana	62	41254	https://2009-2017.state.gov/documents/organization/10964.pdf	Not checked against source; verify accuracy before use	2002-03	2019-07-16	75c9c69b0fbcca9e8d55323dd0124a61
533c1340-db86-48d0-abb9-db37b2028904	03221d24-92ea-4ccc-a6a2-bd88dbfcd9fb	2001_2002_Africa_fmtrpt.tsv	Botswana	BWA	Africa Region, Botswana, International Military Education and Training (IMET), FY01	MILITARY POLICE INVESTIG		MILITARY POLICE	1/23/01	2001-01-23	3/20/01	2001-03-20	FT LEONARD WOOD MO 65473-5000	1	7538	https://2009-2017.state.gov/documents/organization/10964.pdf	Not checked against source; verify accuracy before use	2002-03	2019-07-16	0706fb12761d2aeab5e2fff1a945971c
67a17555-3a89-4d81-bb97-8552aa6a27c1	03221d24-92ea-4ccc-a6a2-bd88dbfcd9fb	2001_2002_Africa_fmtrpt.tsv	Botswana	BWA	Africa Region, Botswana, International Military Education and Training (IMET), FY01	OBC INTERNATION ENR PREP		COMBAT ENGINEER'S REGIMENT	7/2/01	2001-07-02	7/6/01	2001-07-06	FT LEONARD WOOD MO 65473-5000	1	4121	https://2009-2017.state.gov/documents/organization/10964.pdf	Not checked against source; verify accuracy before use	2002-03	2019-07-16	ff7e7d2b805e5d39648da63abd1cccdb
b697173c-495c-4a67-a845-450ced1c540c	03221d24-92ea-4ccc-a6a2-bd88dbfcd9fb	2001_2002_Africa_fmtrpt.tsv	Botswana	BWA	Africa Region, Botswana, International Military Education and Training (IMET), FY01	OJT OPERATIONS TNG-CONUS		COMBAT ENGINEERS REGIMENT	9/12/01	2001-09-12	9/26/01	2001-09-26	FT LEONARD WOOD MO 65473-5000	1	1257	https://2009-2017.state.gov/documents/organization/10964.pdf	Not checked against source; verify accuracy before use	2002-03	2019-07-16	ed3ab2a346c1534c9d8a3b9b33a28188
b764ece7-d7f3-4e32-8ea2-3c9cb4964aee	03221d24-92ea-4ccc-a6a2-bd88dbfcd9fb	2001_2002_Africa_fmtrpt.tsv	Botswana	BWA	Africa Region, Botswana, International Military Education and Training (IMET), FY01	OJT OPERATIONS TNG-CONUS		MILITARY POLICE	4/16/01	2001-04-16	4/27/01	2001-04-27	FT LEONARD WOOD MO 65473-5000	1	1670	https://2009-2017.state.gov/documents/organization/10964.pdf	Not checked against source; verify accuracy before use	2002-03	2019-07-16	fc26616f7203f2811f8258c52abba314
89facdcb-6c24-4b45-a662-1301f4a18c47	03221d24-92ea-4ccc-a6a2-bd88dbfcd9fb	2001_2002_Africa_fmtrpt.tsv	Botswana	BWA	Africa Region, Botswana, International Military Education and Training (IMET), FY01	PATIENT ADMIN SPECIALIST		MEDICAL CORPS	7/23/01	2001-07-23	8/10/01	2001-08-10	FT SAM HOUSTON TX 78234-6100	1	2442	https://2009-2017.state.gov/documents/organization/10964.pdf	Not checked against source; verify accuracy before use	2002-03	2019-07-16	516a2099899e4b135a8e59b1e32a6ea2
fb4de3dc-6c14-4374-b2fa-bd6c627449b6	03221d24-92ea-4ccc-a6a2-bd88dbfcd9fb	2001_2002_Africa_fmtrpt.tsv	Botswana	BWA	Africa Region, Botswana, International Military Education and Training (IMET), FY01	PROTECTIVE SERVICES TNG		MILITARY POLICE	4/30/01	2001-04-30	5/18/01	2001-05-18	FT LEONARD WOOD MO 65473-5000	1	1836	https://2009-2017.state.gov/documents/organization/10964.pdf	Not checked against source; verify accuracy before use	2002-03	2019-07-16	c56c998d320806f10872b5eb02bad291
3882310c-60a5-453a-93cc-4ff51e5446f3	03221d24-92ea-4ccc-a6a2-bd88dbfcd9fb	2001_2002_Africa_fmtrpt.tsv	Botswana	BWA	Africa Region, Botswana, International Military Education and Training (IMET), FY01	QM OFFICER BASIC		MEDICAL CORPS	1/16/01	2001-01-16	4/27/01	2001-04-27	FT LEE VA 23801-1509	1	11331	https://2009-2017.state.gov/documents/organization/10964.pdf	Not checked against source; verify accuracy before use	2002-03	2019-07-16	ffe9626b0efb59ea71fdfac5017c5d9d
30358e4e-65b7-4a2c-8f68-6917d1fa9dac	03221d24-92ea-4ccc-a6a2-bd88dbfcd9fb	2001_2002_Africa_fmtrpt.tsv	Botswana	BWA	Africa Region, Botswana, International Military Education and Training (IMET), FY01	SIG OFF ADV PREP-INTER OFF		SIGNALS	6/8/01	2001-06-08	6/25/01	2001-06-25	FT GORDON GA 30905-5154	1	6269	https://2009-2017.state.gov/documents/organization/10964.pdf	Not checked against source; verify accuracy before use	2002-03	2019-07-16	c1ccebf25338cdacb31cfaec1f0acded
5c25d096-37ae-4947-b79b-15c67c178798	03221d24-92ea-4ccc-a6a2-bd88dbfcd9fb	2001_2002_Africa_fmtrpt.tsv	Botswana	BWA	Africa Region, Botswana, International Military Education and Training (IMET), FY01	SPEC INVES CRS (SIC)		AIR ARM	1/4/01	2001-01-04	3/16/01	2001-03-16	ANDREWS AFB, MD 20331-5064	1	11943	https://2009-2017.state.gov/documents/organization/10964.pdf	Not checked against source; verify accuracy before use	2002-03	2019-07-16	cfdd76a29a3ad34da39c384b40a18b39
5938f1bc-3750-4676-aee0-52a3eb18181d	03221d24-92ea-4ccc-a6a2-bd88dbfcd9fb	2001_2002_Africa_fmtrpt.tsv	Botswana	BWA	Africa Region, Botswana, International Military Education and Training (IMET), FY01	SR INTERNATIONAL DEF MGT		OPERATIONS-BDF HQ	6/25/01	2001-06-25	7/20/01	2001-07-20	MONTEREY, CA 93943-5201	1	8407	https://2009-2017.state.gov/documents/organization/10964.pdf	Not checked against source; verify accuracy before use	2002-03	2019-07-16	1a9a2dacf8e4c1907ff862eabccfa4b4
eb221a14-0e0c-4e97-8e9b-c832972b7780	03221d24-92ea-4ccc-a6a2-bd88dbfcd9fb	2001_2002_Africa_fmtrpt.tsv	Botswana	BWA	Africa Region, Botswana, International Military Education and Training (IMET), FY01	STAND ARMY RETAIL SUP SYS		MEDICAL CORPS	6/4/01	2001-06-04	6/22/01	2001-06-22	FT LEE VA 23801-1509	1	2360	https://2009-2017.state.gov/documents/organization/10964.pdf	Not checked against source; verify accuracy before use	2002-03	2019-07-16	0f4c0bf9f689413655faab367ea070ed
2c154fb4-0287-4193-9146-016565053bc3	03221d24-92ea-4ccc-a6a2-bd88dbfcd9fb	2001_2002_Africa_fmtrpt.tsv	Botswana	BWA	Africa Region, Botswana, International Military Education and Training (IMET), FY01	SUPPLY & SERVICE MGT OFF		ARMOURED BDE HQ	7/9/01	2001-07-09	8/15/01	2001-08-15	FT LEE VA 23801-1509	1	6301	https://2009-2017.state.gov/documents/organization/10964.pdf	Not checked against source; verify accuracy before use	2002-03	2019-07-16	85ce3eab312d932d893374ae88256cdf
b2b4b851-bcdb-4fd0-9332-87f20cc2ab78	03221d24-92ea-4ccc-a6a2-bd88dbfcd9fb	2001_2002_Africa_fmtrpt.tsv	Botswana	BWA	Africa Region, Botswana, International Military Education and Training (IMET), FY01	TATS COMBAT ENGINEER		COMBAT ENGINEERS REGIMENT	6/11/01	2001-06-11	7/24/01	2001-07-24	FT LEONARD WOOD MO 65473-5000	1	6084	https://2009-2017.state.gov/documents/organization/10964.pdf	Not checked against source; verify accuracy before use	2002-03	2019-07-16	28a59d35dd39212db75e8373f9b95b31
15bfa091-9cb3-4341-8e7e-2ab4c875d559	03221d24-92ea-4ccc-a6a2-bd88dbfcd9fb	2001_2002_Africa_fmtrpt.tsv	Botswana	BWA	Africa Region, Botswana, International Military Education and Training (IMET), FY01	U.S. ARMY SGT MAJOR PREP		FORCE TRAINING ESTABLISHMENT	7/23/01	2001-07-23	8/10/01	2001-08-10	FT BLISS TX 79918-8002	1	4818	https://2009-2017.state.gov/documents/organization/10964.pdf	Not checked against source; verify accuracy before use	2002-03	2019-07-16	d0e8b2867026060488b369c12a0f755b
10d0b5d3-f61f-4f0a-9af2-b9a64d8c0eb3	03221d24-92ea-4ccc-a6a2-bd88dbfcd9fb	2001_2002_Africa_fmtrpt.tsv	Botswana	BWA	Africa Region, Botswana, International Military Education and Training (IMET), FY01	USA C&GSC OFF PREPARATORY		11TH MEDIUM ARTILLERY REGIMENT	7/9/01	2001-07-09	7/20/01	2001-07-20	FT LEAVENWORTH KS 66027-1352	1	1590	https://2009-2017.state.gov/documents/organization/10964.pdf	Not checked against source; verify accuracy before use	2002-03	2019-07-16	d24ad788766200e24c44533763b9d864
134183f7-4cf9-41b8-ab88-6229ca8efe2d	03221d24-92ea-4ccc-a6a2-bd88dbfcd9fb	2001_2002_Africa_fmtrpt.tsv	Botswana	BWA	DoS Africa Region, Botswana, Africa Center for Strategic Studies, FY01	Senior Leader Seminar		MOD DOD	1/29/01	2001-01-29	2/9/01	2001-02-09	Libreville Gabon	2	8694	https://2009-2017.state.gov/documents/organization/10964.pdf	Not checked against source; verify accuracy before use	2002-03	2019-07-16	aa34ec6cdda727ec63b9d3f9302fc3ef
33a15362-cbe9-4e19-95e9-92566f2dd56d	03221d24-92ea-4ccc-a6a2-bd88dbfcd9fb	2001_2002_Africa_fmtrpt.tsv	Burkina Faso	BFA	DoS Africa Region, Burkina Faso, Africa Center for Strategic Studies, FY01	Senior Leader Seminar		Ministry of Foreign Affairs Presidential Advisor	1/29/01	2001-01-29	2/9/01	2001-02-09	Libreville Gabon	3	8112	https://2009-2017.state.gov/documents/organization/10964.pdf	Not checked against source; verify accuracy before use	2002-03	2019-07-16	7e3a3ace3d886c98d00553bab5be84a7
447a6aa5-a420-48db-a177-332ae959638b	03221d24-92ea-4ccc-a6a2-bd88dbfcd9fb	2001_2002_Africa_fmtrpt.tsv	Burkina Faso	BFA	Africa Region, Burkina Faso, Africa Center for Strategic Studies, FY01	Sub-Regional Seminar		MOD MFA	8/20/01	2001-08-20	8/24/01	2001-08-24	Accra Ghana	5	5603	https://2009-2017.state.gov/documents/organization/10964.pdf	Not checked against source; verify accuracy before use	2002-03	2019-07-16	1147386ffb9d04eb62371897b1447c44
feab5fe4-c92b-4602-8621-ed3218e9a335	03221d24-92ea-4ccc-a6a2-bd88dbfcd9fb	2001_2002_Africa_fmtrpt.tsv	Burundi	BDI	DoS Africa Region, Burundi, Africa Center for Strategic Studies, FY01	Senior Leader Seminar		MOD	1/29/01	2001-01-29	2/9/01	2001-02-09	Libreville Gabon	2	8243	https://2009-2017.state.gov/documents/organization/10964.pdf	Not checked against source; verify accuracy before use	2002-03	2019-07-16	2c0b09f4694e6bf3755e6b87ded2daed
6e969357-c741-4185-bb21-eebd20fb916d	03221d24-92ea-4ccc-a6a2-bd88dbfcd9fb	2001_2002_Africa_fmtrpt.tsv	Cameroon	CMR	DoS Africa Region, Cameroon, International Military Education and Training (IMET), FY01	ALLIED OFF PREP-INF OAC		INTERNATIONAL MILITARY EDUCATION SCHOOL, ARMY, YAOUNDE	3/12/01	2001-03-12	3/16/01	2001-03-16	FT BENNING GA 31905-5468	1	5979	https://2009-2017.state.gov/documents/organization/10964.pdf	Not checked against source; verify accuracy before use	2002-03	2019-07-16	9d95ee2729378f9b7c726e0c7b936b91
91e51a3f-131a-49b4-a676-2ba20fafe3c1	03221d24-92ea-4ccc-a6a2-bd88dbfcd9fb	2001_2002_Africa_fmtrpt.tsv	Cameroon	CMR	DoS Africa Region, Cameroon, International Military Education and Training (IMET), FY01	ARMY-PCHT			1/15/01	2001-01-15	9/30/01	2001-09-30		0	1316	https://2009-2017.state.gov/documents/organization/10964.pdf	Not checked against source; verify accuracy before use	2002-03	2019-07-16	ce1f907d2fea118a1e740b29c5e0ddca
ac0bb640-0f6a-406a-93b1-5ecaa5f6e01f	03221d24-92ea-4ccc-a6a2-bd88dbfcd9fb	2001_2002_Africa_fmtrpt.tsv	Cameroon	CMR	DoS Africa Region, Cameroon, International Military Education and Training (IMET), FY01	CIV-MIL SID - AFRICA		AIR FORCE, DOUALA	10/16/00	2000-10-16	10/27/00	2000-10-27	HURLBURT FIELD, FL 32544-5826	1	7408	https://2009-2017.state.gov/documents/organization/10964.pdf	Not checked against source; verify accuracy before use	2002-03	2019-07-16	ccb24606cfc99713c5cf24b476af6a1a
a3e7c447-728c-46f0-8e1c-9b54c247d41b	03221d24-92ea-4ccc-a6a2-bd88dbfcd9fb	2001_2002_Africa_fmtrpt.tsv	Cameroon	CMR	DoS Africa Region, Cameroon, International Military Education and Training (IMET), FY01	CIV-MIL SID - AFRICA		MINISTRY OF DEFENSE	10/16/00	2000-10-16	10/27/00	2000-10-27	HURLBURT FIELD, FL 32544-5826	1	7408	https://2009-2017.state.gov/documents/organization/10964.pdf	Not checked against source; verify accuracy before use	2002-03	2019-07-16	3d6dc891c2d9ecaf5307233019629321
9c7876bc-87a0-4ca6-919a-7e710b95c87b	03221d24-92ea-4ccc-a6a2-bd88dbfcd9fb	2001_2002_Africa_fmtrpt.tsv	Cameroon	CMR	DoS Africa Region, Cameroon, International Military Education and Training (IMET), FY01	ENGINEER OFFICER BASIC		COMPANY, HEADQUARTERS	2/12/01	2001-02-12	6/12/01	2001-06-12	FT LEONARD WOOD MO 65473-5000	1	1465	https://2009-2017.state.gov/documents/organization/10964.pdf	Not checked against source; verify accuracy before use	2002-03	2019-07-16	cb3ef11147cadb9a99dcfb7b44a609cb
f33c0378-03b3-42e6-a30d-f367a7f181e8	03221d24-92ea-4ccc-a6a2-bd88dbfcd9fb	2001_2002_Africa_fmtrpt.tsv	Cameroon	CMR	DoS Africa Region, Cameroon, International Military Education and Training (IMET), FY01	INFANTRY CAPTS CAREER CRS		INTERNATIONAL MILITARY EDUCATION, ARMY, YAOUNDE	3/19/01	2001-03-19	7/24/01	2001-07-24	FT BENNING GA 31905-5468	1	10479	https://2009-2017.state.gov/documents/organization/10964.pdf	Not checked against source; verify accuracy before use	2002-03	2019-07-16	c17ba0353fcd37e5fe07bd83bd978f85
da36133f-5e15-404d-b2c5-9252f0be5458	03221d24-92ea-4ccc-a6a2-bd88dbfcd9fb	2001_2002_Africa_fmtrpt.tsv	Cameroon	CMR	DoS Africa Region, Cameroon, International Military Education and Training (IMET), FY01	INTL MARITIME OFF		NAVAL BASE, DOUALA	1/16/01	2001-01-16	3/23/01	2001-03-23	YORKTOWN, VA 23690-5000	1	14336	https://2009-2017.state.gov/documents/organization/10964.pdf	Not checked against source; verify accuracy before use	2002-03	2019-07-16	4ee35807f738099b7d7a0245a4bec3ae
47f3f45f-cac3-4fc5-9ade-ca0070aa58c9	03221d24-92ea-4ccc-a6a2-bd88dbfcd9fb	2001_2002_Africa_fmtrpt.tsv	Cameroon	CMR	DoS Africa Region, Cameroon, International Military Education and Training (IMET), FY01	INTL OFF SCH (FOR AC&SC)		HQ AIR FORCE	6/18/01	2001-06-18	7/27/01	2001-07-27	MAXWELL AFB, AL 36112-6323	1	11356	https://2009-2017.state.gov/documents/organization/10964.pdf	Not checked against source; verify accuracy before use	2002-03	2019-07-16	0c9b4cf2b342f00c725dfc52f11e1b05
e881e7db-10ff-41f5-89bd-1143f977aa17	03221d24-92ea-4ccc-a6a2-bd88dbfcd9fb	2001_2002_Africa_fmtrpt.tsv	Cameroon	CMR	DoS Africa Region, Cameroon, International Military Education and Training (IMET), FY01	INTL OFF SCH (FOR AWC)		DOUALA AIR FORCE BASE	6/11/01	2001-06-11	7/20/01	2001-07-20	MAXWELL AFB, AL 36112-6323	1	10551	https://2009-2017.state.gov/documents/organization/10964.pdf	Not checked against source; verify accuracy before use	2002-03	2019-07-16	207d15813645c3da8569a857f187771b
cf2a9d20-f08b-40fb-9404-19457e95fd83	03221d24-92ea-4ccc-a6a2-bd88dbfcd9fb	2001_2002_Africa_fmtrpt.tsv	Cameroon	CMR	DoS Africa Region, Cameroon, International Military Education and Training (IMET), FY01	MIL & PCKEEP OPS IAW ROL		CANCEL	4/16/01	2001-04-16	5/18/01	2001-05-18	NEWPORT, RI 02841-1523	1	16708	https://2009-2017.state.gov/documents/organization/10964.pdf	Not checked against source; verify accuracy before use	2002-03	2019-07-16	9b5f7d4ca02e89fc202702495f5db4ed
03b126c4-d32a-489b-88cb-c54f58ee0853	03221d24-92ea-4ccc-a6a2-bd88dbfcd9fb	2001_2002_Africa_fmtrpt.tsv	Cameroon	CMR	DoS Africa Region, Cameroon, International Military Education and Training (IMET), FY01	NAVAL STAFF COLLEGE		NAVAL HEADQUARTERS DOUALA, CAMEROON	1/11/01	2001-01-11	6/15/01	2001-06-15	NEWPORT, RI 02841-1207	1	27268	https://2009-2017.state.gov/documents/organization/10964.pdf	Not checked against source; verify accuracy before use	2002-03	2019-07-16	6a2abd955d7418f4cc6c4acd7c5385c9
c155fc00-729b-46e0-aaf1-bf5d311f9024	03221d24-92ea-4ccc-a6a2-bd88dbfcd9fb	2001_2002_Africa_fmtrpt.tsv	Cameroon	CMR	DoS Africa Region, Cameroon, International Military Education and Training (IMET), FY01	OBC INTERNATION ENR PREP		COMPANY, HEADQUARTERS	2/5/01	2001-02-05	2/9/01	2001-02-09	FT LEONARD WOOD MO 65473-5000	1	209	https://2009-2017.state.gov/documents/organization/10964.pdf	Not checked against source; verify accuracy before use	2002-03	2019-07-16	7f3c33373f16981e5c6b545d757c11e8
1825d809-b6de-4ff2-b3f4-f18cc2acf9b9	03221d24-92ea-4ccc-a6a2-bd88dbfcd9fb	2001_2002_Africa_fmtrpt.tsv	Cameroon	CMR	DoS Africa Region, Cameroon, International Military Education and Training (IMET), FY01	PATROL CFT OPS RIVER ENV		NAVY, YAOUNDE	1/19/01	2001-01-19	3/15/01	2001-03-15	STENNIS SPACE CENTER, MS 39529-7099	1	10558	https://2009-2017.state.gov/documents/organization/10964.pdf	Not checked against source; verify accuracy before use	2002-03	2019-07-16	85b2eb647982666f326cf6c25c79e5ac
976dabf6-c75c-4298-8c54-d8fe792c098e	03221d24-92ea-4ccc-a6a2-bd88dbfcd9fb	2001_2002_Africa_fmtrpt.tsv	Cameroon	CMR	DoS Africa Region, Cameroon, International Military Education and Training (IMET), FY01	RULE OF LAW&DISCP MIL OPS		NAVY, YAOUNDE	3/19/01	2001-03-19	3/23/01	2001-03-23	STENNIS SPACE CENTER, MS 39529-7099	1	440	https://2009-2017.state.gov/documents/organization/10964.pdf	Not checked against source; verify accuracy before use	2002-03	2019-07-16	82fa7d04e9ce3af35951e97b68ce6ff4
01be4b84-683d-4750-a84c-970f014f44f4	03221d24-92ea-4ccc-a6a2-bd88dbfcd9fb	2001_2002_Africa_fmtrpt.tsv	Cameroon	CMR	DoS Africa Region, Cameroon, International Military Education and Training (IMET), FY01	TRAINING AIDS & DEVICES			1/15/01	2001-01-15	9/30/01	2001-09-30		0	6580	https://2009-2017.state.gov/documents/organization/10964.pdf	Not checked against source; verify accuracy before use	2002-03	2019-07-16	fb2ede8871abc04a394de8401da2a23e
546fa4c8-6f52-4370-b9eb-8fca867b4328	03221d24-92ea-4ccc-a6a2-bd88dbfcd9fb	2001_2002_Africa_fmtrpt.tsv	Cameroon	CMR	DoS Africa Region, Cameroon, Africa Center for Strategic Studies, FY01	Senior Leader Seminar		MOD Ministry of Foreign Affairs NGO	1/29/01	2001-01-29	2/9/01	2001-02-09	Libreville Gabon	2	7534	https://2009-2017.state.gov/documents/organization/10964.pdf	Not checked against source; verify accuracy before use	2002-03	2019-07-16	c5d51a546ec06436df3c8a255ef69c8e
1eb263d9-33bf-4344-b403-8edeb9d3321d	03221d24-92ea-4ccc-a6a2-bd88dbfcd9fb	2001_2002_Africa_fmtrpt.tsv	Cape Verde (Republic of)	CPV	DoS Africa Region, Cape Verde (Republic of), International Military Education and Training (IMET), FY01	INFORMATION SYSTEMS MGT		1st Region Personnel	4/2/01	2001-04-02	8/17/01	2001-08-17	FT GORDON GA 30905-5154	1	11330	https://2009-2017.state.gov/documents/organization/10964.pdf	Not checked against source; verify accuracy before use	2002-03	2019-07-16	1447c28317197cf643636fb766833bb2
b7fabd61-9203-499f-baee-cabcfe506563	03221d24-92ea-4ccc-a6a2-bd88dbfcd9fb	2001_2002_Africa_fmtrpt.tsv	Cape Verde (Republic of)	CPV	DoS Africa Region, Cape Verde (Republic of), Africa Center for Strategic Studies, FY01	Sub-Regional Seminar		MOD MFA	8/20/01	2001-08-20	8/24/01	2001-08-24	Accra Ghana	4	5749	https://2009-2017.state.gov/documents/organization/10964.pdf	Not checked against source; verify accuracy before use	2002-03	2019-07-16	0ff567c6aef51eca4ae1b6205eec8952
9c0881e3-c4e6-4558-8180-8d278a5b8ad0	03221d24-92ea-4ccc-a6a2-bd88dbfcd9fb	2001_2002_Africa_fmtrpt.tsv	Central African Republic	RCA	DoS Africa Region, Central African Republic, International Military Education and Training (IMET), FY01	AMERICAN LANGUAGE COURSE		BSS	4/9/01	2001-04-09	9/28/01	2001-09-28	LACKLAND AFB, TX 78236	1	16926	https://2009-2017.state.gov/documents/organization/10964.pdf	Not checked against source; verify accuracy before use	2002-03	2019-07-16	9288c09c6a19be3322ce006cc376c388
9214d039-43fd-4c57-ae9a-dfcc34ec977c	03221d24-92ea-4ccc-a6a2-bd88dbfcd9fb	2001_2002_Africa_fmtrpt.tsv	Central African Republic	RCA	DoS Africa Region, Central African Republic, International Military Education and Training (IMET), FY01	ENGINEER OFF CPT CAREER		Engineer Unit	5/7/01	2001-05-07	9/12/01	2001-09-12	FT LEONARD WOOD MO 65473-5000	1	11402	https://2009-2017.state.gov/documents/organization/10964.pdf	Not checked against source; verify accuracy before use	2002-03	2019-07-16	43596a876b59b1449da3772c59161e9b
d71c7bf9-a4e4-4ea1-97e7-8414f0ac5bff	03221d24-92ea-4ccc-a6a2-bd88dbfcd9fb	2001_2002_Africa_fmtrpt.tsv	Central African Republic	RCA	DoS Africa Region, Central African Republic, International Military Education and Training (IMET), FY01	ENGINEER OFF CPT CAREER		Engineer Unit	5/7/01	2001-05-07	9/12/01	2001-09-12	FT LEONARD WOOD MO 65473-5000	1	11402	https://2009-2017.state.gov/documents/organization/10964.pdf	Not checked against source; verify accuracy before use	2002-03	2019-07-16	43596a876b59b1449da3772c59161e9b
30056f00-955d-439b-bb02-654860b8e2af	03221d24-92ea-4ccc-a6a2-bd88dbfcd9fb	2001_2002_Africa_fmtrpt.tsv	Central African Republic	RCA	DoS Africa Region, Central African Republic, International Military Education and Training (IMET), FY01	ENGLISH LANGUAGE CRSE		Engineer Unit	1/29/01	2001-01-29	4/13/01	2001-04-13	SAN ANTONIO TX 78236-5259	1	9630	https://2009-2017.state.gov/documents/organization/10964.pdf	Not checked against source; verify accuracy before use	2002-03	2019-07-16	25984f517c4f3d21d105e9caacc1e13e
d3adf3b4-d196-40b9-88ff-d33c010b1f65	03221d24-92ea-4ccc-a6a2-bd88dbfcd9fb	2001_2002_Africa_fmtrpt.tsv	Central African Republic	RCA	DoS Africa Region, Central African Republic, International Military Education and Training (IMET), FY01	ENGLISH LANGUAGE CRSE		Engineer Unit	1/29/01	2001-01-29	4/13/01	2001-04-13	SAN ANTONIO TX 78236-5259	1	9630	https://2009-2017.state.gov/documents/organization/10964.pdf	Not checked against source; verify accuracy before use	2002-03	2019-07-16	25984f517c4f3d21d105e9caacc1e13e
4ceecb77-2dc3-4847-831c-8756584ffe79	03221d24-92ea-4ccc-a6a2-bd88dbfcd9fb	2001_2002_Africa_fmtrpt.tsv	Central African Republic	RCA	DoS Africa Region, Central African Republic, International Military Education and Training (IMET), FY01	OAC INTL STUDENT ENGR PREP		Enginer Unit	4/30/01	2001-04-30	5/4/01	2001-05-04	FT LEONARD WOOD MO 65473-5000	1	1605	https://2009-2017.state.gov/documents/organization/10964.pdf	Not checked against source; verify accuracy before use	2002-03	2019-07-16	a8dc5229639ad6265b79dc43d97c511a
abcda273-2d1e-4b34-858e-f8dfad68140f	03221d24-92ea-4ccc-a6a2-bd88dbfcd9fb	2001_2002_Africa_fmtrpt.tsv	Central African Republic	RCA	DoS Africa Region, Central African Republic, International Military Education and Training (IMET), FY01	OAC INTL STUDENT ENGR PREP		Engineer Unit	4/30/01	2001-04-30	5/4/01	2001-05-04	FT LEONARD WOOD MO 65473-5000	1	1605	https://2009-2017.state.gov/documents/organization/10964.pdf	Not checked against source; verify accuracy before use	2002-03	2019-07-16	a9c8036c7fc953404bc788b40ec04319
62039999-64ff-489f-b5eb-b27eaf6963e0	03221d24-92ea-4ccc-a6a2-bd88dbfcd9fb	2001_2002_Africa_fmtrpt.tsv	Central African Republic	RCA	DoS Africa Region, Central African Republic, International Military Education and Training (IMET), FY01	TAT-LANGUAGE LAB INSTALL		Engineer Unit - No students were trained	1/17/01	2001-01-17	9/30/01	2001-09-30	Central African Republic	0	20000	https://2009-2017.state.gov/documents/organization/10964.pdf	Not checked against source; verify accuracy before use	2002-03	2019-07-16	6afabfcef10ab924ba5843edf1c23eca
2f56ae96-485b-4f25-887d-74ce8dd5d051	03221d24-92ea-4ccc-a6a2-bd88dbfcd9fb	2001_2002_Africa_fmtrpt.tsv	Central African Republic	RCA	DoS Africa Region, Central African Republic, Africa Center for Strategic Studies, FY01	Senior Leader Seminar		MOD	1/29/01	2001-01-29	2/9/01	2001-02-09	Libreville Gabon	2	7992	https://2009-2017.state.gov/documents/organization/10964.pdf	Not checked against source; verify accuracy before use	2002-03	2019-07-16	789775b887d17743add01979e71742fc
e6f51779-7123-4bcb-b79c-d54132b51945	03221d24-92ea-4ccc-a6a2-bd88dbfcd9fb	2001_2002_Africa_fmtrpt.tsv	Chad	TCD	DoS Africa Region, Chad, International Military Education and Training (IMET), FY01	CIV-MIL SID - AFRICA		Office of the Chief of Staff to	10/16/00	2000-10-16	10/27/00	2000-10-27	HURLBURT FIELD, FL 32544-5826	1	1790	https://2009-2017.state.gov/documents/organization/10964.pdf	Not checked against source; verify accuracy before use	2002-03	2019-07-16	43f7e56ac10709f23d31f2e85604ad49
e1434499-06c7-406a-9181-50fc6e716605	03221d24-92ea-4ccc-a6a2-bd88dbfcd9fb	2001_2002_Africa_fmtrpt.tsv	Chad	TCD	DoS Africa Region, Chad, International Military Education and Training (IMET), FY01	CIV-MIL SID - AFRICA		Rapid Intervention Force FIR	10/16/00	2000-10-16	10/27/00	2000-10-27	HURLBURT FIELD, FL 32544-5826	1	1790	https://2009-2017.state.gov/documents/organization/10964.pdf	Not checked against source; verify accuracy before use	2002-03	2019-07-16	820b9df7d295571bf61261bee6375aac
b4c68228-a5d9-49a7-bb15-2b7e0209471e	03221d24-92ea-4ccc-a6a2-bd88dbfcd9fb	2001_2002_Africa_fmtrpt.tsv	Chad	TCD	DoS Africa Region, Chad, International Military Education and Training (IMET), FY01	DRMI SEMINAR - OVERSEAS		Human Ressources Division, MOD	6/4/01	2001-06-04	6/15/01	2001-06-15	Chad	1	2378	https://2009-2017.state.gov/documents/organization/10964.pdf	Not checked against source; verify accuracy before use	2002-03	2019-07-16	646b488612642649aa1dcf83c9c79dae
5f7b4a07-9a0d-4aad-a673-95b271cc5f16	03221d24-92ea-4ccc-a6a2-bd88dbfcd9fb	2001_2002_Africa_fmtrpt.tsv	Chad	TCD	DoS Africa Region, Chad, International Military Education and Training (IMET), FY01	DRMI SEMINAR - OVERSEAS		Military Cooperation Office, MOD	6/4/01	2001-06-04	6/15/01	2001-06-15	Chad	1	2378	https://2009-2017.state.gov/documents/organization/10964.pdf	Not checked against source; verify accuracy before use	2002-03	2019-07-16	d0dd16b88eb48770aaacc7faf2594176
787002ba-960c-4ab5-99e1-960f10535e04	03221d24-92ea-4ccc-a6a2-bd88dbfcd9fb	2001_2002_Africa_fmtrpt.tsv	Chad	TCD	DoS Africa Region, Chad, International Military Education and Training (IMET), FY01	ENGLISH LANGUAGE CRSE		Interarm School GEMIA, Camp 27	4/9/01	2001-04-09	8/24/01	2001-08-24	SAN ANTONIO TX 78236-5259	1	4965	https://2009-2017.state.gov/documents/organization/10964.pdf	Not checked against source; verify accuracy before use	2002-03	2019-07-16	8221f2a1a5aab13151006883f60ed03b
7da7dccf-e373-400f-9c60-1635c03c0060	03221d24-92ea-4ccc-a6a2-bd88dbfcd9fb	2001_2002_Africa_fmtrpt.tsv	Chad	TCD	DoS Africa Region, Chad, International Military Education and Training (IMET), FY01	ENGLISH LANGUAGE CRSE		Material and Housing Command EMB, Presidency	3/26/01	2001-03-26	8/10/01	2001-08-10	SAN ANTONIO TX 78236-5259	1	4965	https://2009-2017.state.gov/documents/organization/10964.pdf	Not checked against source; verify accuracy before use	2002-03	2019-07-16	1c7808d4d1c7460bfa8567c6e49ac1b1
64edfab3-a4e1-40f9-aaf7-b7dfd02b6e71	03221d24-92ea-4ccc-a6a2-bd88dbfcd9fb	2001_2002_Africa_fmtrpt.tsv	Chad	TCD	Africa Region, Chad, International Military Education and Training (IMET), FY01	LANG LAB MAINT / CASSETTE		Direction for Financial and Administrative Affairs DIRSAFI	6/4/01	2001-06-04	7/27/01	2001-07-27	LACKLAND AFB, TX 78236	1	2030	https://2009-2017.state.gov/documents/organization/10964.pdf	Not checked against source; verify accuracy before use	2002-03	2019-07-16	a611c0bb233713e7860ba4269d221cd9
3d90ba80-bf97-494d-9152-3df6a1969c45	03221d24-92ea-4ccc-a6a2-bd88dbfcd9fb	2001_2002_Africa_fmtrpt.tsv	Chad	TCD	Africa Region, Chad, International Military Education and Training (IMET), FY01	LANGUAGE INSTRUCTOR/BASIC		Direction for Financial and Administrative Affairs DIRSAFI	10/16/00	2000-10-16	4/13/01	2001-04-13	LACKLAND AFB, TX 78236	1	6680	https://2009-2017.state.gov/documents/organization/10964.pdf	Not checked against source; verify accuracy before use	2002-03	2019-07-16	bd6afb98081aceba8490bb17f735d43e
70ac6321-48f8-4f6c-b4a6-75a941b472ad	03221d24-92ea-4ccc-a6a2-bd88dbfcd9fb	2001_2002_Africa_fmtrpt.tsv	Chad	TCD	Africa Region, Chad, International Military Education and Training (IMET), FY01	MANAGING INTL CONFLICT MIC		Public Prosecutor Department, N'Djamena Law Court	5/21/01	2001-05-21	5/25/01	2001-05-25	NEWPORT, RI 02841-1523	1	630	https://2009-2017.state.gov/documents/organization/10964.pdf	Not checked against source; verify accuracy before use	2002-03	2019-07-16	2c465b2bef87618434fadfad78d5c2ba
f26e260e-a6df-47b9-ba17-18339f452a23	03221d24-92ea-4ccc-a6a2-bd88dbfcd9fb	2001_2002_Africa_fmtrpt.tsv	Chad	TCD	Africa Region, Chad, International Military Education and Training (IMET), FY01	MEDICAL STRATEGIC LDR CRS		General Hospital for National Reference	6/4/01	2001-06-04	7/6/01	2001-07-06	FT SAM HOUSTON TX 78234-6100	1	179	https://2009-2017.state.gov/documents/organization/10964.pdf	Not checked against source; verify accuracy before use	2002-03	2019-07-16	1b5754b33c1e11ca20cda64dc28ab19b
11d03142-5f23-4c75-9927-32510659a136	03221d24-92ea-4ccc-a6a2-bd88dbfcd9fb	2001_2002_Africa_fmtrpt.tsv	Chad	TCD	Africa Region, Chad, International Military Education and Training (IMET), FY01	MIL & PCKEEP OPS IAW ROL		Public Prosecutor Department, N'Djamena Law Court	4/16/01	2001-04-16	5/18/01	2001-05-18	NEWPORT, RI 02841-1523	1	10352	https://2009-2017.state.gov/documents/organization/10964.pdf	Not checked against source; verify accuracy before use	2002-03	2019-07-16	149b0130f6a7b16f966edd694c6dec7c
2236abc1-a103-481b-9785-8a3e1fe1098f	03221d24-92ea-4ccc-a6a2-bd88dbfcd9fb	2001_2002_Africa_fmtrpt.tsv	Chad	TCD	Africa Region, Chad, International Military Education and Training (IMET), FY01	OBC INTERNATION ENR PREP		Interarm School GEMIA, Camp 27	9/10/01	2001-09-10	9/14/01	2001-09-14	FT LEONARD WOOD MO 65473-5000	1	209	https://2009-2017.state.gov/documents/organization/10964.pdf	Not checked against source; verify accuracy before use	2002-03	2019-07-16	53c5211f84773dbbd4f50da246120285
2e05e27e-bf11-4316-80b6-cbc49aa7d998	03221d24-92ea-4ccc-a6a2-bd88dbfcd9fb	2001_2002_Africa_fmtrpt.tsv	Chad	TCD	Africa Region, Chad, International Military Education and Training (IMET), FY01	OJT COMM/ELECT TNG-CONUS		Direction for Financial and Administrative Affairs DIRSAFI	4/16/01	2001-04-16	5/11/01	2001-05-11		1	856	https://2009-2017.state.gov/documents/organization/10964.pdf	Not checked against source; verify accuracy before use	2002-03	2019-07-16	c6caa192b39cc4666e60e41c816e2ff4
45126f97-5158-4335-a2f2-aced1ddcf163	03221d24-92ea-4ccc-a6a2-bd88dbfcd9fb	2001_2002_Africa_fmtrpt.tsv	Chad	TCD	DoS Africa Region, Chad, Foreign Military Financing (FMF), FY01	C130 COPILOT INIT QUAL SIN		Air Force Operations Division, Adji-Kossei AFB	3/14/01	2001-03-14	7/20/01	2001-07-20	LITTLE ROCK AFB, AR 72099-5000	1	66400	https://2009-2017.state.gov/documents/organization/10964.pdf	Not checked against source; verify accuracy before use	2002-03	2019-07-16	09a7c9c42d72f85e5fbbb3c61f2da4d8
e74f547d-d892-4798-8f71-398e936d0114	03221d24-92ea-4ccc-a6a2-bd88dbfcd9fb	2001_2002_Africa_fmtrpt.tsv	Chad	TCD	DoS Africa Region, Chad, Foreign Military Financing (FMF), FY01	MET CIV-MILITARY RELATIONS		METhosted at Novotel N'Djamena 22-26 January 2001. 60 mixed participants Civilian/Military from MOD, HQ, Army, Air Force, Gendarmerie, National & Namadic Guard, Rapid Intervention Force, Presidency Military Cabinet, National Assembly, Government, Press and Civil Society attended this MET.	1/22/01	2001-01-22	1/26/01	2001-01-26	Chad	30	45150	https://2009-2017.state.gov/documents/organization/10964.pdf	Not checked against source; verify accuracy before use	2002-03	2019-07-16	f3e823b7f7b389d39dd60e515959ce0d
42d896cc-ebd0-4452-8a17-df466ffa3a54	03221d24-92ea-4ccc-a6a2-bd88dbfcd9fb	2001_2002_Africa_fmtrpt.tsv	Chad	TCD	DoS Africa Region, Chad, Foreign Military Financing (FMF), FY01	PHYSIO TNG / ORIGINAL		Air Force Operations Division, Adji-Kossei AFB	3/12/01	2001-03-12	3/13/01	2001-03-13	LITTLE ROCK AFB, AR 72099-5000	1	250	https://2009-2017.state.gov/documents/organization/10964.pdf	Not checked against source; verify accuracy before use	2002-03	2019-07-16	ba3229680937cf98a7cc2444dbd4090f
7b91da1f-bd71-4079-90b0-0e112148a2f4	03221d24-92ea-4ccc-a6a2-bd88dbfcd9fb	2001_2002_Africa_fmtrpt.tsv	Chad	TCD	DoS Africa Region, Chad, Foreign Military Financing (FMF), FY01	SPECIALIZED ENG LANG TNG		Air Force Operations Division, Adji-Kossei AFB	1/2/01	2001-01-02	3/2/01	2001-03-02	LACKLAND AFB, TX 78236	1	2270	https://2009-2017.state.gov/documents/organization/10964.pdf	Not checked against source; verify accuracy before use	2002-03	2019-07-16	c7f47d26304efaf53fb736602262579f
34824f51-a130-4a08-9594-83a5dbb51f5d	03221d24-92ea-4ccc-a6a2-bd88dbfcd9fb	2001_2002_Africa_fmtrpt.tsv	Chad	TCD	DoS Africa Region, Chad, Africa Center for Strategic Studies, FY01	Senior Leader Seminar		Civilian Government DOD	1/29/01	2001-01-29	2/9/01	2001-02-09	Libreville Gabon	2	8082	https://2009-2017.state.gov/documents/organization/10964.pdf	Not checked against source; verify accuracy before use	2002-03	2019-07-16	93b1c68e6dc4a6127a66cd21ff862fff
6af59659-19d7-4fd5-b956-95a781f91cf1	03221d24-92ea-4ccc-a6a2-bd88dbfcd9fb	2001_2002_Africa_fmtrpt.tsv	Comoros	COM	DoS Africa Region, Comoros, Africa Center for Strategic Studies, FY01	Senior Leader Seminar		MOD	1/29/01	2001-01-29	2/9/01	2001-02-09	Libreville Gabon	3	7889	https://2009-2017.state.gov/documents/organization/10964.pdf	Not checked against source; verify accuracy before use	2002-03	2019-07-16	a6f26ce965bd5cca4c337797515fb301
b87caf16-036d-47f5-b69b-8ff7bbc25006	03221d24-92ea-4ccc-a6a2-bd88dbfcd9fb	2001_2002_Africa_fmtrpt.tsv	Cote d'Ivoire	CIV	DoS Africa Region, Cote d'Ivoire, Africa Center for Strategic Studies, FY01	Senior Leader Seminar		Ministry of Foreign Affairs MOD MOD NGO	1/29/01	2001-01-29	2/9/01	2001-02-09	Libreville Gabon	2	7824	https://2009-2017.state.gov/documents/organization/10964.pdf	Not checked against source; verify accuracy before use	2002-03	2019-07-16	11f44df10b0b3b3c545aca6de83f63ac
8ebe8125-da9e-4f05-9487-ffd0f7e18874	03221d24-92ea-4ccc-a6a2-bd88dbfcd9fb	2001_2002_Africa_fmtrpt.tsv	Cote d'Ivoire	CIV	DoS Africa Region, Cote d'Ivoire, Africa Center for Strategic Studies, FY01	Sub-Regional Seminar		MOD MFA	8/20/01	2001-08-20	8/24/01	2001-08-24	Accra Ghana	5	5342	https://2009-2017.state.gov/documents/organization/10964.pdf	Not checked against source; verify accuracy before use	2002-03	2019-07-16	7da0aab94b9da1fe9c0df177d30a4fd4
45d5c152-85a7-461c-9004-15d943ee44ed	03221d24-92ea-4ccc-a6a2-bd88dbfcd9fb	2001_2002_Africa_fmtrpt.tsv	Djibouti	DJI	DoS Africa Region, Djibouti, International Military Education and Training (IMET), FY01	ADV ENGLISH LANGUAGE PGM		Djiboutian Navy	6/18/01	2001-06-18	8/31/01	2001-08-31	LACKLAND AFB, TX 78236-5259	1	8995	https://2009-2017.state.gov/documents/organization/10964.pdf	Not checked against source; verify accuracy before use	2002-03	2019-07-16	11f9b0976f483d487a39ad01d8893a11
3988212e-c5b1-4605-8989-da0297d28fb1	03221d24-92ea-4ccc-a6a2-bd88dbfcd9fb	2001_2002_Africa_fmtrpt.tsv	Djibouti	DJI	DoS Africa Region, Djibouti, International Military Education and Training (IMET), FY01	GENERAL ENGLISH ONLY		Djiboutian Air Force	12/11/00	2000-12-11	1/5/01	2001-01-05	LACKLAND AFB, TX 78236	1	1857	https://2009-2017.state.gov/documents/organization/10964.pdf	Not checked against source; verify accuracy before use	2002-03	2019-07-16	37089943fee503166480011b84eb18b7
ed894c64-469d-4c17-a6c2-30a6de536e00	03221d24-92ea-4ccc-a6a2-bd88dbfcd9fb	2001_2002_Africa_fmtrpt.tsv	Djibouti	DJI	DoS Africa Region, Djibouti, International Military Education and Training (IMET), FY01	LANG LAB MAINT / CASSETTE		Djiboutian Air Force	2/9/01	2001-02-09	3/30/01	2001-03-30	LACKLAND AFB, TX 78236	1	3892	https://2009-2017.state.gov/documents/organization/10964.pdf	Not checked against source; verify accuracy before use	2002-03	2019-07-16	12e76d063aae566a508f72ec5f43255d
21ee4e4e-2889-40cc-b247-859b8dfd41ac	03221d24-92ea-4ccc-a6a2-bd88dbfcd9fb	2001_2002_Africa_fmtrpt.tsv	Djibouti	DJI	DoS Africa Region, Djibouti, International Military Education and Training (IMET), FY01	OJT COMM/ELECT TNG-CONUS		Djiboutian Air Force	1/16/01	2001-01-16	2/9/01	2001-02-09		1	2196	https://2009-2017.state.gov/documents/organization/10964.pdf	Not checked against source; verify accuracy before use	2002-03	2019-07-16	2cb2953d0286c95516c1f68f0778775c
5b58684a-e80d-4475-beaa-dd21a389507c	03221d24-92ea-4ccc-a6a2-bd88dbfcd9fb	2001_2002_Africa_fmtrpt.tsv	Djibouti	DJI	DoS Africa Region, Djibouti, International Military Education and Training (IMET), FY01	SPEC ENG LANG TRNG (SET)		Djiboutian Navy	12/25/00	2000-12-25	2/22/01	2001-02-22	LACKLAND AFB, TX 78236-5259	1	10995	https://2009-2017.state.gov/documents/organization/10964.pdf	Not checked against source; verify accuracy before use	2002-03	2019-07-16	e9e900c0bbaefc35054c676fd3601e51
013907d9-f01b-4874-b022-23ea94dc147e	03221d24-92ea-4ccc-a6a2-bd88dbfcd9fb	2001_2002_Africa_fmtrpt.tsv	Djibouti	DJI	DoS Africa Region, Djibouti, International Military Education and Training (IMET), FY01	SPEC ENG LANG TRNG (SET)		Djiboutian Navy	7/23/01	2001-07-23	9/21/01	2001-09-21	LACKLAND AFB, TX 78236-5259	1	7456	https://2009-2017.state.gov/documents/organization/10964.pdf	Not checked against source; verify accuracy before use	2002-03	2019-07-16	86bbc910b34f6d2af4b6b2ebf8e0f8c8
70256495-2227-478e-ab58-16bf9682256e	03221d24-92ea-4ccc-a6a2-bd88dbfcd9fb	2001_2002_Africa_fmtrpt.tsv	Djibouti	DJI	DoS Africa Region, Djibouti, International Military Education and Training (IMET), FY01	SPECIALIZED ENG LANG TNG		Djiboutian Air Force	12/4/00	2000-12-04	2/2/01	2001-02-02	LACKLAND AFB, TX 78236	1	1135	https://2009-2017.state.gov/documents/organization/10964.pdf	Not checked against source; verify accuracy before use	2002-03	2019-07-16	f63df16e9369f6e3043e313a96805426
8f0b85b6-0a14-403f-957b-23cdc9ca008c	03221d24-92ea-4ccc-a6a2-bd88dbfcd9fb	2001_2002_Africa_fmtrpt.tsv	Djibouti	DJI	DoS Africa Region, Djibouti, International Military Education and Training (IMET), FY01	TOEFL PREPARATION		Djiboutian Navy	2/26/01	2001-02-26	6/15/01	2001-06-15	LACKLAND AFB, TX 78236	1	11335	https://2009-2017.state.gov/documents/organization/10964.pdf	Not checked against source; verify accuracy before use	2002-03	2019-07-16	dbd4b31063f6bc123728c2ab365eba33
09022ac4-3eee-4c54-9a0b-c8b6c16f1c45	03221d24-92ea-4ccc-a6a2-bd88dbfcd9fb	2001_2002_Africa_fmtrpt.tsv	Djibouti	DJI	DoS Africa Region, Djibouti, International Military Education and Training (IMET), FY01	TOEFL PREPARATION COURSE		Djiboutian Army	2/26/01	2001-02-26	6/15/01	2001-06-15		1	12000	https://2009-2017.state.gov/documents/organization/10964.pdf	Not checked against source; verify accuracy before use	2002-03	2019-07-16	d16002d53758be9c3cfc9b1160ba9302
9bb81690-5f7b-4080-b101-206561f5cd4a	03221d24-92ea-4ccc-a6a2-bd88dbfcd9fb	2001_2002_Africa_fmtrpt.tsv	Djibouti	DJI	DoS Africa Region, Djibouti, Africa Center for Strategic Studies, FY01	Senior Leader Seminar		MOD	1/29/01	2001-01-29	2/9/01	2001-02-09	Libreville Gabon	2	8519	https://2009-2017.state.gov/documents/organization/10964.pdf	Not checked against source; verify accuracy before use	2002-03	2019-07-16	a1ad88e3b21af9bc4a29809243ba84d4
82e82bbb-f3e0-40a9-919a-a3147569e717	03221d24-92ea-4ccc-a6a2-bd88dbfcd9fb	2001_2002_Africa_fmtrpt.tsv	Eritrea	ERI	DoS Africa Region, Eritrea, International Military Education and Training (IMET), FY01	ARMY-PCHT			10/1/00	2000-10-01	9/30/01	2001-09-30		0	490	https://2009-2017.state.gov/documents/organization/10964.pdf	Not checked against source; verify accuracy before use	2002-03	2019-07-16	ac8ca505911acbe8d0c48ec841bd9bbd
7dc9eec7-8873-4675-872c-c34e769d6d85	03221d24-92ea-4ccc-a6a2-bd88dbfcd9fb	2001_2002_Africa_fmtrpt.tsv	Eritrea	ERI	DoS Africa Region, Eritrea, International Military Education and Training (IMET), FY01	DRUG PREV & DEMAND REDUCT		Eritrean Special Police (Maritime/Counter Drug)	8/19/01	2001-08-19	8/24/01	2001-08-24	San Luis Obispo CA 93403-4209	1	3023	https://2009-2017.state.gov/documents/organization/10964.pdf	Not checked against source; verify accuracy before use	2002-03	2019-07-16	8a3ae11d65d764b4d340b54aec591237
db3cd3c1-263e-4f67-93d0-46dd199b9b8b	03221d24-92ea-4ccc-a6a2-bd88dbfcd9fb	2001_2002_Africa_fmtrpt.tsv	Eritrea	ERI	DoS Africa Region, Eritrea, International Military Education and Training (IMET), FY01	DRUG PREV & DEMAND REDUCT		Eritrean Special Police (Maritime/Counter Drug)	8/19/01	2001-08-19	8/24/01	2001-08-24	San Luis Obispo CA 93403-4209	1	3023	https://2009-2017.state.gov/documents/organization/10964.pdf	Not checked against source; verify accuracy before use	2002-03	2019-07-16	8a3ae11d65d764b4d340b54aec591237
31087bff-e7ff-43a2-9e29-f1c2240203b7	03221d24-92ea-4ccc-a6a2-bd88dbfcd9fb	2001_2002_Africa_fmtrpt.tsv	Eritrea	ERI	DoS Africa Region, Eritrea, International Military Education and Training (IMET), FY01	DRUG PREV & DEMAND REDUCT		Eritrean Special Police (Maritime/Counter Drug)	8/19/01	2001-08-19	8/24/01	2001-08-24	San Luis Obispo CA 93403-4209	1	3023	https://2009-2017.state.gov/documents/organization/10964.pdf	Not checked against source; verify accuracy before use	2002-03	2019-07-16	8a3ae11d65d764b4d340b54aec591237
40ce59be-a322-46f0-93f1-8b7c871133f1	03221d24-92ea-4ccc-a6a2-bd88dbfcd9fb	2001_2002_Africa_fmtrpt.tsv	Eritrea	ERI	Africa Region, Eritrea, International Military Education and Training (IMET), FY01	DRUG PREV & DEMAND REDUCT		Eritrean Special Police (Maritime/Counter Drug)	8/19/01	2001-08-19	8/24/01	2001-08-24	San Luis Obispo CA 93403-4209	1	3023	https://2009-2017.state.gov/documents/organization/10964.pdf	Not checked against source; verify accuracy before use	2002-03	2019-07-16	2a525cf4bef1d019adf1c3f4836f6685
ce00a3f3-c81e-49bf-aa4d-b1b372b0ad82	03221d24-92ea-4ccc-a6a2-bd88dbfcd9fb	2001_2002_Africa_fmtrpt.tsv	Eritrea	ERI	Africa Region, Eritrea, International Military Education and Training (IMET), FY01	MET DIILS ASSESS OF ISSUES		Navy	8/27/01	2001-08-27	8/31/01	2001-08-31	Eritrea	0	14400	https://2009-2017.state.gov/documents/organization/10964.pdf	Not checked against source; verify accuracy before use	2002-03	2019-07-16	d33488ac0af446712ed5bbd6fb713989
4411eea2-7a38-4223-9fec-d664f22031c3	03221d24-92ea-4ccc-a6a2-bd88dbfcd9fb	2001_2002_Africa_fmtrpt.tsv	Eritrea	ERI	Africa Region, Eritrea, International Military Education and Training (IMET), FY01	MIL SPT TO CIVIL AUTHORIES		Eritrean Special Police (Maritime/Counter Drug)	8/12/01	2001-08-12	8/17/01	2001-08-17	San Luis Obispo CA 93403-4209	1	7945	https://2009-2017.state.gov/documents/organization/10964.pdf	Not checked against source; verify accuracy before use	2002-03	2019-07-16	25e120f29d758b99ae699a757ad4d0d6
d5b90d03-9869-4490-aaff-80822d6235c1	03221d24-92ea-4ccc-a6a2-bd88dbfcd9fb	2001_2002_Africa_fmtrpt.tsv	Eritrea	ERI	Africa Region, Eritrea, International Military Education and Training (IMET), FY01	MIL SPT TO CIVIL AUTHORIES		Eritrean Special Police (Maritime/Counter Drug)	8/12/01	2001-08-12	8/17/01	2001-08-17	San Luis Obispo CA 93403-4209	1	7945	https://2009-2017.state.gov/documents/organization/10964.pdf	Not checked against source; verify accuracy before use	2002-03	2019-07-16	25e120f29d758b99ae699a757ad4d0d6
fd71b17a-e2d3-47f9-8578-d12a12dec844	03221d24-92ea-4ccc-a6a2-bd88dbfcd9fb	2001_2002_Africa_fmtrpt.tsv	Eritrea	ERI	Africa Region, Eritrea, International Military Education and Training (IMET), FY01	MIL SPT TO CIVIL AUTHORIES		Eritrean Special Police (Maritime/Counter Drug)	8/12/01	2001-08-12	8/17/01	2001-08-17	San Luis Obispo CA 93403-4209	1	7945	https://2009-2017.state.gov/documents/organization/10964.pdf	Not checked against source; verify accuracy before use	2002-03	2019-07-16	25e120f29d758b99ae699a757ad4d0d6
f4ab642c-7b2c-4042-9749-d4264ddc1c40	03221d24-92ea-4ccc-a6a2-bd88dbfcd9fb	2001_2002_Africa_fmtrpt.tsv	Eritrea	ERI	Africa Region, Eritrea, International Military Education and Training (IMET), FY01	MIL SPT TO CIVIL AUTHORIES		Eritrean Special Police (Maritime/Counter Drug)	8/12/01	2001-08-12	8/17/01	2001-08-17	San Luis Obispo CA 93403-4209	1	7945	https://2009-2017.state.gov/documents/organization/10964.pdf	Not checked against source; verify accuracy before use	2002-03	2019-07-16	25e120f29d758b99ae699a757ad4d0d6
9ab10667-fa7f-427f-8c6d-79ae782147b3	03221d24-92ea-4ccc-a6a2-bd88dbfcd9fb	2001_2002_Africa_fmtrpt.tsv	Eritrea	ERI	Africa Region, Eritrea, International Military Education and Training (IMET), FY01	SPEC ENG LANG TRNG (SET)		Eritrean Navy	8/13/01	2001-08-13	9/21/01	2001-09-21	LACKLAND AFB, TX 78236-5259	1	7596	https://2009-2017.state.gov/documents/organization/10964.pdf	Not checked against source; verify accuracy before use	2002-03	2019-07-16	7683c421dc408a472b989d06628d7ee4
cfa46cda-2d94-4e76-a47a-846d331494e7	03221d24-92ea-4ccc-a6a2-bd88dbfcd9fb	2001_2002_Africa_fmtrpt.tsv	Eritrea	ERI	Africa Region, Eritrea, International Military Education and Training (IMET), FY01	TRAINING AIDS & DEVICES			10/1/00	2000-10-01	9/30/01	2001-09-30		0	2450	https://2009-2017.state.gov/documents/organization/10964.pdf	Not checked against source; verify accuracy before use	2002-03	2019-07-16	231b3a9849db63f4754bce43e544ccfd
003a6c13-7fc5-4d00-8872-9c0d7f681d43	03221d24-92ea-4ccc-a6a2-bd88dbfcd9fb	2001_2002_Africa_fmtrpt.tsv	Eritrea	ERI	DoS Africa Region, Eritrea, Africa Center for Strategic Studies, FY01	Senior Leader Seminar		MOD Ministry of Foreign Affairs	1/29/01	2001-01-29	2/9/01	2001-02-09	Libreville Gabon	2	11492	https://2009-2017.state.gov/documents/organization/10964.pdf	Not checked against source; verify accuracy before use	2002-03	2019-07-16	e8cbe8ea50d7d322aeb83b6b118a6011
4615bf90-fc3d-431f-91b9-24af8ed3602d	03221d24-92ea-4ccc-a6a2-bd88dbfcd9fb	2001_2002_Africa_fmtrpt.tsv	Ethiopia	ETH	DoS Africa Region, Ethiopia, Africa Center for Strategic Studies, FY01	Senior Leader Seminar		MOD	1/29/01	2001-01-29	2/9/01	2001-02-09	Libreville Gabon	2	8850	https://2009-2017.state.gov/documents/organization/10964.pdf	Not checked against source; verify accuracy before use	2002-03	2019-07-16	d0cb1f637de8d7269fb20ec44bd51f5f
77211f1a-7ddd-4fc2-9ccf-3517f69dbd2a	03221d24-92ea-4ccc-a6a2-bd88dbfcd9fb	2001_2002_Africa_fmtrpt.tsv	Ethiopia	ETH	DoS Africa Region, Ethiopia, Africa Center for Strategic Studies, FY01	Sub-Regional Seminar		MOD MFA	8/20/01	2001-08-20	8/24/01	2001-08-24	Accra Ghana	2	5431	https://2009-2017.state.gov/documents/organization/10964.pdf	Not checked against source; verify accuracy before use	2002-03	2019-07-16	1922315463ac34a83ff72f607f4c090d
cfc2d24b-f0d8-4dac-94a7-b3bb300f6bce	03221d24-92ea-4ccc-a6a2-bd88dbfcd9fb	2001_2002_Africa_fmtrpt.tsv	Gabon	GAB	DoS Africa Region, Gabon, Non-Security Assistance, Unified Command (Note 4), FY01	JCET	NSWU-10, SBU-22	GABON NAVY'S COMPANY OF MARINES(15)6TH BATTALION FRENCH MARINES (5)	4/7/01	2001-04-07	5/15/01	2001-05-15	PORT GENTILE	20	89000	https://2009-2017.state.gov/documents/organization/10964.pdf	Not checked against source; verify accuracy before use	2002-03	2019-07-16	05ea2f0371c8c482d63a9be8f03570fc
8c510e09-30ea-42b3-98b2-31399decb227	03221d24-92ea-4ccc-a6a2-bd88dbfcd9fb	2001_2002_Africa_fmtrpt.tsv	Gabon	GAB	DoS Africa Region, Gabon, International Military Education and Training (IMET), FY01	ARMY-PCHT			5/24/01	2001-05-24	9/30/01	2001-09-30		0	9677	https://2009-2017.state.gov/documents/organization/10964.pdf	Not checked against source; verify accuracy before use	2002-03	2019-07-16	ca7e33bc566e5afea0828dcc92553eab
5f5c8d2f-20bd-49f2-af83-c11b4f3e530c	03221d24-92ea-4ccc-a6a2-bd88dbfcd9fb	2001_2002_Africa_fmtrpt.tsv	Gabon	GAB	DoS Africa Region, Gabon, International Military Education and Training (IMET), FY01	INTL OFF SCH (FOR AWC)		Air Force - Armed Forces Headquarters	6/11/01	2001-06-11	7/20/01	2001-07-20	MAXWELL AFB, AL 36112-6323	1	5706	https://2009-2017.state.gov/documents/organization/10964.pdf	Not checked against source; verify accuracy before use	2002-03	2019-07-16	faf73bacb201834b83a79c64f57dc503
716e8b6e-9d7a-4617-a5ff-c49295a6e4ea	03221d24-92ea-4ccc-a6a2-bd88dbfcd9fb	2001_2002_Africa_fmtrpt.tsv	Gabon	GAB	DoS Africa Region, Gabon, International Military Education and Training (IMET), FY01	LANGUAGE INSTRUCTOR/BASIC		Air Force - Light Aviation Unit	10/16/00	2000-10-16	4/20/01	2001-04-20	LACKLAND AFB, TX 78236	1	13242	https://2009-2017.state.gov/documents/organization/10964.pdf	Not checked against source; verify accuracy before use	2002-03	2019-07-16	205e597a071fc68ef2b0ac2baf5f89bb
a4ebfeda-f102-41b4-acac-2db7399192fc	03221d24-92ea-4ccc-a6a2-bd88dbfcd9fb	2001_2002_Africa_fmtrpt.tsv	Gabon	GAB	DoS Africa Region, Gabon, International Military Education and Training (IMET), FY01	SPECIALIZED ENG LANG TNG		Air Force - Armed Forces Headquarters	4/2/01	2001-04-02	6/1/01	2001-06-01	LACKLAND AFB, TX 78236	1	9685	https://2009-2017.state.gov/documents/organization/10964.pdf	Not checked against source; verify accuracy before use	2002-03	2019-07-16	097e0fc7ca43daade7b08f7b4bea353d
7e4f4bd7-c475-48ba-ab4c-50022fc9ed20	03221d24-92ea-4ccc-a6a2-bd88dbfcd9fb	2001_2002_Africa_fmtrpt.tsv	Gabon	GAB	Africa Region, Gabon, International Military Education and Training (IMET), FY01	TRAINING AIDS & DEVICES			5/24/01	2001-05-24	9/30/01	2001-09-30		0	25134	https://2009-2017.state.gov/documents/organization/10964.pdf	Not checked against source; verify accuracy before use	2002-03	2019-07-16	159ec2bb0d9ff595ef54e245fd1b6cec
ab517120-d60d-4e61-b904-8f4f91d76795	03221d24-92ea-4ccc-a6a2-bd88dbfcd9fb	2001_2002_Africa_fmtrpt.tsv	Gabon	GAB	Africa Region, Gabon, International Military Education and Training (IMET), FY01	TRAINING AIDS & DEVICES			5/24/01	2001-05-24	9/30/01	2001-09-30		0	434	https://2009-2017.state.gov/documents/organization/10964.pdf	Not checked against source; verify accuracy before use	2002-03	2019-07-16	77d4d36552c893d5caf7e13f1c13c3d9
0937dc3f-df1f-4ebd-a06a-c5ce8d4a0c20	03221d24-92ea-4ccc-a6a2-bd88dbfcd9fb	2001_2002_Africa_fmtrpt.tsv	Gabon	GAB	Africa Region, Gabon, International Military Education and Training (IMET), FY01	TRAINING AIDS & DEVICES			5/24/01	2001-05-24	9/30/01	2001-09-30		0	1180	https://2009-2017.state.gov/documents/organization/10964.pdf	Not checked against source; verify accuracy before use	2002-03	2019-07-16	4516666405b460fac8cbb8fbe88896a6
491e8a02-26d4-4bc4-bb5a-f3b17674391c	03221d24-92ea-4ccc-a6a2-bd88dbfcd9fb	2001_2002_Africa_fmtrpt.tsv	Gabon	GAB	Africa Region, Gabon, International Military Education and Training (IMET), FY01	TRAINING AIDS & DEVICES			5/24/01	2001-05-24	9/30/01	2001-09-30		0	5187	https://2009-2017.state.gov/documents/organization/10964.pdf	Not checked against source; verify accuracy before use	2002-03	2019-07-16	2724186b4707560dca6993344794af2c
47f647c9-7626-453c-afcd-989a43b94f12	03221d24-92ea-4ccc-a6a2-bd88dbfcd9fb	2001_2002_Africa_fmtrpt.tsv	Gabon	GAB	Africa Region, Gabon, International Military Education and Training (IMET), FY01	TRAINING AIDS & DEVICES			5/24/01	2001-05-24	9/30/01	2001-09-30		0	16450	https://2009-2017.state.gov/documents/organization/10964.pdf	Not checked against source; verify accuracy before use	2002-03	2019-07-16	e48f80ae3a92fff9d5f4e2075d24f8a5
40cb4a6c-045b-417d-9104-48c417eeb26a	03221d24-92ea-4ccc-a6a2-bd88dbfcd9fb	2001_2002_Africa_fmtrpt.tsv	Gabon	GAB	DoS Africa Region, Gabon, Africa Center for Strategic Studies, FY01	Senior Leader Seminar		MOD	1/29/01	2001-01-29	2/9/01	2001-02-09	Libreville Gabon	1	7464	https://2009-2017.state.gov/documents/organization/10964.pdf	Not checked against source; verify accuracy before use	2002-03	2019-07-16	e07b83132ab64af6b6c1877ac399e138
0f812169-ac95-4403-b2c2-9e2a4b1b77b4	03221d24-92ea-4ccc-a6a2-bd88dbfcd9fb	2001_2002_Africa_fmtrpt.tsv	Gabon	GAB	DoS Africa Region, Gabon, Africa Center for Strategic Studies, FY01	Senior Leader Seminar		MOD	1/29/01	2001-01-29	2/9/01	2001-02-09	Libreville Gabon	6	7142	https://2009-2017.state.gov/documents/organization/10964.pdf	Not checked against source; verify accuracy before use	2002-03	2019-07-16	71f46d499c4498c76d4f9717b5bc2a5c
5e1c4014-bb56-4c3e-8cf0-729b9f641f3c	03221d24-92ea-4ccc-a6a2-bd88dbfcd9fb	2001_2002_Africa_fmtrpt.tsv	Gambia	GMB	DoS Africa Region, Gambia, Africa Center for Strategic Studies, FY01	Senior Leader Seminar		DOD	1/29/01	2001-01-29	2/9/01	2001-02-09	Libreville Gabon	2	8128	https://2009-2017.state.gov/documents/organization/10964.pdf	Not checked against source; verify accuracy before use	2002-03	2019-07-16	813ff4649755565496b937edb028fbe8
b23e21c6-2421-4431-acd0-60e0a47d6532	03221d24-92ea-4ccc-a6a2-bd88dbfcd9fb	2001_2002_Africa_fmtrpt.tsv	Gambia	GMB	DoS Africa Region, Gambia, Africa Center for Strategic Studies, FY01	Sub-Regional Seminar		MOD MFA	8/20/01	2001-08-20	8/24/01	2001-08-24	Accra Ghana	4	5401	https://2009-2017.state.gov/documents/organization/10964.pdf	Not checked against source; verify accuracy before use	2002-03	2019-07-16	49855adbcd6501e1dbaa5f7191459a78
84c92bf8-d6f5-4b8b-ac2a-5c4490167280	03221d24-92ea-4ccc-a6a2-bd88dbfcd9fb	2001_2002_Africa_fmtrpt.tsv	Ghana	GHA	DoS Africa Region, Ghana, Non-Security Assistance, Unified Command (Note 4), FY01	JCET	96 CA BN	SECOND INF BN (02), THIRD INF BN (02), FOURTH INF BN (01), FIFTH INF BN (02), SIXTH INF BN(02), 48 ENG REGT (02), MOR REGT (02), RECCE REGT (02), MILITARY HOSPITAL (09), ARMY HQ (09), AIR FORCE HQ (06)	4/20/01	2001-04-20	5/15/01	2001-05-15	ACCRA	39	33000	https://2009-2017.state.gov/documents/organization/10964.pdf	Not checked against source; verify accuracy before use	2002-03	2019-07-16	1820811bd5a010afc050707b439ff01c
f41c2a94-aa4f-4355-902a-fc1d6e953510	03221d24-92ea-4ccc-a6a2-bd88dbfcd9fb	2001_2002_Africa_fmtrpt.tsv	Ghana	GHA	DoS Africa Region, Ghana, Non-Security Assistance, Unified Command (Note 4), FY01	JCET	2/3 SFG	5TH BATTALION - 112ND BATTALION - 123RD BATTALION - 11AIRBORNE BATTALION - 11	4/7/01	2001-04-07	5/25/01	2001-05-25	ACCRA	45	62000	https://2009-2017.state.gov/documents/organization/10964.pdf	Not checked against source; verify accuracy before use	2002-03	2019-07-16	acc223c012c0eaf4d8d5870a02ef3d85
1958a25b-919a-4de2-9c93-4dc8898ce8a1	03221d24-92ea-4ccc-a6a2-bd88dbfcd9fb	2001_2002_Africa_fmtrpt.tsv	Ghana	GHA	DoS Africa Region, Ghana, Non-Security Assistance, Unified Command (Note 4), FY01	JCET	2/3 SFG	5TH BATTALION - 112ND BATTALION - 123RD BATTALION - 11AIRBORNE BATTALION - 11	4/7/01	2001-04-07	5/25/01	2001-05-25	ACCRA	45	62000	https://2009-2017.state.gov/documents/organization/10964.pdf	Not checked against source; verify accuracy before use	2002-03	2019-07-16	acc223c012c0eaf4d8d5870a02ef3d85
50f63287-7a07-43ea-b1d5-7c5b3dacb92e	03221d24-92ea-4ccc-a6a2-bd88dbfcd9fb	2001_2002_Africa_fmtrpt.tsv	Ghana	GHA	DoS Africa Region, Ghana, International Military Education and Training (IMET), FY01	AIRBORNE		AIRBORNE TRAINING SCHOOL, TAMALE	1/16/01	2001-01-16	2/2/01	2001-02-02	FT BENNING GA 31905-5468	1	2842	https://2009-2017.state.gov/documents/organization/10964.pdf	Not checked against source; verify accuracy before use	2002-03	2019-07-16	90f0f20b00d01a785989895273041820
f718de91-a21e-46eb-92c0-bf4f3e9c8b9e	03221d24-92ea-4ccc-a6a2-bd88dbfcd9fb	2001_2002_Africa_fmtrpt.tsv	Ghana	GHA	Africa Region, Ghana, International Military Education and Training (IMET), FY01	AIRBORNE		AIRBORNE TRAININ SCHOOL, TAMALE	2/5/01	2001-02-05	2/23/01	2001-02-23	FT BENNING GA 31905-5468	1	746	https://2009-2017.state.gov/documents/organization/10964.pdf	Not checked against source; verify accuracy before use	2002-03	2019-07-16	a235ae3b0a6d4c2e37a294f26fb2a446
7b97fd69-bbe8-4ee4-9d27-85c56956bf17	03221d24-92ea-4ccc-a6a2-bd88dbfcd9fb	2001_2002_Africa_fmtrpt.tsv	Ghana	GHA	Africa Region, Ghana, International Military Education and Training (IMET), FY01	AIRBORNE		AIRBORNE TRAINING SCHOOL, TAMALE	2/5/01	2001-02-05	2/23/01	2001-02-23	FT BENNING GA 31905-5468	1	1357	https://2009-2017.state.gov/documents/organization/10964.pdf	Not checked against source; verify accuracy before use	2002-03	2019-07-16	6845a8e290a0ed70cf2dbf890d3241d5
2422911e-7f19-4ca6-a596-109796f0e634	03221d24-92ea-4ccc-a6a2-bd88dbfcd9fb	2001_2002_Africa_fmtrpt.tsv	Ghana	GHA	Africa Region, Ghana, International Military Education and Training (IMET), FY01	AIRBORNE		AIRBIRNE TRAINING SCHOOL, TAMALE	2/24/01	2001-02-24	3/2/01	2001-03-02	FT BENNING GA 31905-5468	1	473	https://2009-2017.state.gov/documents/organization/10964.pdf	Not checked against source; verify accuracy before use	2002-03	2019-07-16	90893be2c7a70f9cfd6092298db0b16b
032892c0-8e2f-4114-8aef-cb5be6b28d24	03221d24-92ea-4ccc-a6a2-bd88dbfcd9fb	2001_2002_Africa_fmtrpt.tsv	Ghana	GHA	Africa Region, Ghana, International Military Education and Training (IMET), FY01	AIRCRAFT MAINTENANCE OFF		AIR FORCE STATION, TAKORADI	4/4/01	2001-04-04	7/12/01	2001-07-12	SHEPPARD AFB TX 76311-2367	1	6203	https://2009-2017.state.gov/documents/organization/10964.pdf	Not checked against source; verify accuracy before use	2002-03	2019-07-16	73243f37b895aa2d6eb950835a637dab
9c93313b-bdd3-4f3d-b508-905b3219e9f8	03221d24-92ea-4ccc-a6a2-bd88dbfcd9fb	2001_2002_Africa_fmtrpt.tsv	Ghana	GHA	Africa Region, Ghana, International Military Education and Training (IMET), FY01	ARMOR CPT CAREER CRS PREP		ARMOR BATTALION, ARAKAN BARRACKS, ACCRA	7/16/01	2001-07-16	8/3/01	2001-08-03	FT KNOX KY 40121-5234	1	4080	https://2009-2017.state.gov/documents/organization/10964.pdf	Not checked against source; verify accuracy before use	2002-03	2019-07-16	25fbdf0df980cfaab54d809f5dd3977b
a02849bd-1ea3-4fe7-9b4e-7276143042b1	03221d24-92ea-4ccc-a6a2-bd88dbfcd9fb	2001_2002_Africa_fmtrpt.tsv	Ghana	GHA	Africa Region, Ghana, International Military Education and Training (IMET), FY01	CIV-MIL SID - AFRICA		DIRECTORATE OF MILITARY INTELLIGENCE, BURMA CAMP, ACCRA	10/16/00	2000-10-16	10/27/00	2000-10-27	HURLBURT FIELD, FL 32544-5826	1	6056	https://2009-2017.state.gov/documents/organization/10964.pdf	Not checked against source; verify accuracy before use	2002-03	2019-07-16	f0681d99c71f54a9c9193cfa8a406675
95eab84d-d121-4734-be2f-950254c33302	03221d24-92ea-4ccc-a6a2-bd88dbfcd9fb	2001_2002_Africa_fmtrpt.tsv	Ghana	GHA	Africa Region, Ghana, International Military Education and Training (IMET), FY01	CIV-MIL SID - AFRICA		MINISTRY OF DEFENSE, BURMA CAMP, ACCRA	10/16/00	2000-10-16	10/27/00	2000-10-27	HURLBURT FIELD, FL 32544-5826	1	6058	https://2009-2017.state.gov/documents/organization/10964.pdf	Not checked against source; verify accuracy before use	2002-03	2019-07-16	04026958f26d43af7ec296339e23f9b5
9f7ecf33-2dbb-43a9-a4be-269dc531c1d6	03221d24-92ea-4ccc-a6a2-bd88dbfcd9fb	2001_2002_Africa_fmtrpt.tsv	Ghana	GHA	Africa Region, Ghana, International Military Education and Training (IMET), FY01	COMB STRAT INTEL TNG PRGM		DIRECTORATE OF DEFENSE INTELLIGENCE, BURMA CAMP, ACCRA	7/9/01	2001-07-09	8/24/01	2001-08-24	WASHINGTON DC 20340-5100	1	5325	https://2009-2017.state.gov/documents/organization/10964.pdf	Not checked against source; verify accuracy before use	2002-03	2019-07-16	e033c0b51f3781b26038ca14d6a830a9
d60548f5-bdb8-4ace-ae8c-ee0657f54c90	03221d24-92ea-4ccc-a6a2-bd88dbfcd9fb	2001_2002_Africa_fmtrpt.tsv	Ghana	GHA	Africa Region, Ghana, International Military Education and Training (IMET), FY01	COMB STRAT INTEL TNG PRGM		DIRECTORATE OF DEFENSE INTELLIGENCE, BURMA CAMP, ACCRA	4/16/01	2001-04-16	6/1/01	2001-06-01	WASHINGTON DC 20340-5100	1	5325	https://2009-2017.state.gov/documents/organization/10964.pdf	Not checked against source; verify accuracy before use	2002-03	2019-07-16	2e4d2af815595af885bf25b7ab0be5a7
ed777009-9262-4b20-b9c8-6f36b7cc8315	03221d24-92ea-4ccc-a6a2-bd88dbfcd9fb	2001_2002_Africa_fmtrpt.tsv	Ghana	GHA	Africa Region, Ghana, International Military Education and Training (IMET), FY01	COMBINED LOG CPT CAREER		MILITARY ACADEMY AND TRAINING SCHOOL. TESHIE	3/19/01	2001-03-19	5/1/01	2001-05-01	FT LEE VA 23801-1705	1	3619	https://2009-2017.state.gov/documents/organization/10964.pdf	Not checked against source; verify accuracy before use	2002-03	2019-07-16	7043246f58db8d064e0315f5b3954b8d
657d13cc-831b-4c6d-b071-e6d6a4bab1d9	03221d24-92ea-4ccc-a6a2-bd88dbfcd9fb	2001_2002_Africa_fmtrpt.tsv	Ghana	GHA	Africa Region, Ghana, International Military Education and Training (IMET), FY01	COMBINED LOG CPT CAREER		MILITARY ACADEMY AND TRAINING SCHOOL, TESHIE	6/11/01	2001-06-11	7/26/01	2001-07-26	FT LEE VA 23801-1705	1	4126	https://2009-2017.state.gov/documents/organization/10964.pdf	Not checked against source; verify accuracy before use	2002-03	2019-07-16	7f41164f8e080b3f22815216ed6c20b3
bfa9f55e-5912-4bcb-b326-085e806dae17	03221d24-92ea-4ccc-a6a2-bd88dbfcd9fb	2001_2002_Africa_fmtrpt.tsv	Ghana	GHA	Africa Region, Ghana, International Military Education and Training (IMET), FY01	COMBINED LOG OFF		MILITARY ACADEMY AND TRAINING SCHOOL, TESHIE	5/4/01	2001-05-04	6/8/01	2001-06-08	FT EUSTIS VA 23604-5481	1	4016	https://2009-2017.state.gov/documents/organization/10964.pdf	Not checked against source; verify accuracy before use	2002-03	2019-07-16	d66d2e41d98c3545f93fde67aa541fa7
2a7f7d9f-ca6a-4c3e-b946-f65658e10ba3	03221d24-92ea-4ccc-a6a2-bd88dbfcd9fb	2001_2002_Africa_fmtrpt.tsv	Ghana	GHA	Africa Region, Ghana, International Military Education and Training (IMET), FY01	CRISIS CMD/CTRL - SR MGRS		NAVAL TRADE SCHOOL, SEKONDI	6/11/01	2001-06-11	6/22/01	2001-06-22	YORKTOWN, VA 23690-5000	1	1909	https://2009-2017.state.gov/documents/organization/10964.pdf	Not checked against source; verify accuracy before use	2002-03	2019-07-16	0efabdac93c5e7cb07a99fd9e06a2df3
9bada262-df7a-4fe9-b5f0-1e033b7163c9	03221d24-92ea-4ccc-a6a2-bd88dbfcd9fb	2001_2002_Africa_fmtrpt.tsv	Ghana	GHA	Africa Region, Ghana, International Military Education and Training (IMET), FY01	DAMAGE CONTROL A		NAVAL TRADE SCHOOL, SEKONDI	4/2/01	2001-04-02	7/6/01	2001-07-06	YORKTOWN, VA 23690-5000	1	6823	https://2009-2017.state.gov/documents/organization/10964.pdf	Not checked against source; verify accuracy before use	2002-03	2019-07-16	96ff72c153791aec033f9b4de73f1274
e3de65e3-f043-4ada-b42f-cb450d237997	03221d24-92ea-4ccc-a6a2-bd88dbfcd9fb	2001_2002_Africa_fmtrpt.tsv	Ghana	GHA	Africa Region, Ghana, International Military Education and Training (IMET), FY01	ENGINEER OFF CPT CAREER		48 ENGINEER REGIMENT, TESHIE	11/13/00	2000-11-13	4/4/01	2001-04-04	FT LEONARD WOOD MO 65473-5000	1	12116	https://2009-2017.state.gov/documents/organization/10964.pdf	Not checked against source; verify accuracy before use	2002-03	2019-07-16	9fef95f4da5e4d13e8b3736fafa99697
f838bd8e-a57d-4d99-ae52-4286804558f1	03221d24-92ea-4ccc-a6a2-bd88dbfcd9fb	2001_2002_Africa_fmtrpt.tsv	Ghana	GHA	Africa Region, Ghana, International Military Education and Training (IMET), FY01	ENGLISH LANGUAGE CRSE		DIRECTORATE OF PUBLIC RELATIONS, BURMA CAMP,	11/20/00	2000-11-20	5/11/01	2001-05-11	SAN ANTONIO TX 78236-5259	1	12942	https://2009-2017.state.gov/documents/organization/10964.pdf	Not checked against source; verify accuracy before use	2002-03	2019-07-16	72de5bdf0df370a504af93bfd454e887
6bac35fb-1be5-42e9-8f0e-050bd1e2e8be	03221d24-92ea-4ccc-a6a2-bd88dbfcd9fb	2001_2002_Africa_fmtrpt.tsv	Ghana	GHA	Africa Region, Ghana, International Military Education and Training (IMET), FY01	FINANCE OFFICER ADV		PAY OFFICE, BURMA CAMP,	1/18/01	2001-01-18	5/24/01	2001-05-24	FT JACKSON SC 29207-7040	1	15163	https://2009-2017.state.gov/documents/organization/10964.pdf	Not checked against source; verify accuracy before use	2002-03	2019-07-16	91d8f8b82e4bfedc306120733dd7b30b
b752712f-6b99-449b-a6ed-1dfe7e5ffaa4	03221d24-92ea-4ccc-a6a2-bd88dbfcd9fb	2001_2002_Africa_fmtrpt.tsv	Ghana	GHA	Africa Region, Ghana, International Military Education and Training (IMET), FY01	FLT SAFETY OFF (SATP/FSO)		AIR FORCE HEADQUARTERS, BURMA CAMP, ACCRA	6/22/01	2001-06-22	8/31/01	2001-08-31	KIRTLAND AFB, NM 87117-5608	1	8916	https://2009-2017.state.gov/documents/organization/10964.pdf	Not checked against source; verify accuracy before use	2002-03	2019-07-16	58c18e292287256aa288ed6a315744fc
b6f4220b-4f33-4e0d-83fa-147ea559c2a2	03221d24-92ea-4ccc-a6a2-bd88dbfcd9fb	2001_2002_Africa_fmtrpt.tsv	Ghana	GHA	Africa Region, Ghana, International Military Education and Training (IMET), FY01	FLYING SAFETY/ *		AIR FORCE HEADQUARTERS, BURMA CAMP,ACCRA	9/3/01	2001-09-03	9/14/01	2001-09-14	LAUGHLIN AFB, TX 78843-5222	1	1147	https://2009-2017.state.gov/documents/organization/10964.pdf	Not checked against source; verify accuracy before use	2002-03	2019-07-16	37ee5a95eb0c3117b50f70fd22f560d5
4d8efe02-d5f3-4f56-be97-35062d4f5620	03221d24-92ea-4ccc-a6a2-bd88dbfcd9fb	2001_2002_Africa_fmtrpt.tsv	Ghana	GHA	Africa Region, Ghana, International Military Education and Training (IMET), FY01	INFORMATION SYSTEMS MGT		DIRECTORATE OF DATA PROCESSING, BURMA CAMP, ACCRA	1/4/01	2001-01-04	5/23/01	2001-05-23	FT GORDON GA 30905-5154	1	12129	https://2009-2017.state.gov/documents/organization/10964.pdf	Not checked against source; verify accuracy before use	2002-03	2019-07-16	b77192ed00afbeea6339fb8acf22be81
f82cabcf-aa07-42fe-bbb6-46813ae085c6	03221d24-92ea-4ccc-a6a2-bd88dbfcd9fb	2001_2002_Africa_fmtrpt.tsv	Ghana	GHA	Africa Region, Ghana, International Military Education and Training (IMET), FY01	INSTRUCTOR TRAINING COURSE		AIRBORNE TRAINING SCHOOL,TAMALE	6/4/01	2001-06-04	6/20/01	2001-06-20	FT LEE VA 23801-1509	1	1903	https://2009-2017.state.gov/documents/organization/10964.pdf	Not checked against source; verify accuracy before use	2002-03	2019-07-16	5694055825598720ffaa1270f64afb4e
d3ec754a-f8f8-47a7-b91b-1b9687cbdaee	03221d24-92ea-4ccc-a6a2-bd88dbfcd9fb	2001_2002_Africa_fmtrpt.tsv	Ghana	GHA	Africa Region, Ghana, International Military Education and Training (IMET), FY01	INSTRUCTOR		NAVAL BASE, SEKONDI	7/30/01	2001-07-30	8/22/01	2001-08-22	SAN DIEGO, CA 92136-5588	1	2713	https://2009-2017.state.gov/documents/organization/10964.pdf	Not checked against source; verify accuracy before use	2002-03	2019-07-16	97b50b97f8bd4accd6d507edfe619c17
32f8c5a2-02d5-4576-a0eb-6761ee8c0eeb	03221d24-92ea-4ccc-a6a2-bd88dbfcd9fb	2001_2002_Africa_fmtrpt.tsv	Ghana	GHA	Africa Region, Ghana, International Military Education and Training (IMET), FY01	INT OFFICER INTEL ADVANCE		ARMY HEADQUARTERS, BURMA CAMP,ACCRA	3/22/01	2001-03-22	7/6/01	2001-07-06	FT HUACHUCA AZ 85613-7000	1	15672	https://2009-2017.state.gov/documents/organization/10964.pdf	Not checked against source; verify accuracy before use	2002-03	2019-07-16	e1cbf110b9b78a16cad6f8c86ba5ec99
e5cf16fc-abf0-4de4-9382-443c91ee6c27	03221d24-92ea-4ccc-a6a2-bd88dbfcd9fb	2001_2002_Africa_fmtrpt.tsv	Ghana	GHA	Africa Region, Ghana, International Military Education and Training (IMET), FY01	INTERNATIONAL OFF LOG PREP		MILITARY ACADEMY AND TRAINING SCHOOL, TESHIE	3/5/01	2001-03-05	3/16/01	2001-03-16	FT LEE VA 23801-1705	1	2693	https://2009-2017.state.gov/documents/organization/10964.pdf	Not checked against source; verify accuracy before use	2002-03	2019-07-16	40f14abacfa305e3a1223cc51a9cdb1b
30eda698-2f21-491a-832b-24d1b84a3c82	03221d24-92ea-4ccc-a6a2-bd88dbfcd9fb	2001_2002_Africa_fmtrpt.tsv	Ghana	GHA	Africa Region, Ghana, International Military Education and Training (IMET), FY01	INTERNATIONAL OFFICER PREP		MILITARY ACADEMY AND TRAINING SCHOOL, TESHIE	6/19/01	2001-06-19	7/6/01	2001-07-06	FT LEAVENWORTH KS 66027-1352	1	2797	https://2009-2017.state.gov/documents/organization/10964.pdf	Not checked against source; verify accuracy before use	2002-03	2019-07-16	7e27f9c5d0a006e9c89f1fd691ca3403
03a5298f-5fa6-4ee2-884e-549c7d665418	03221d24-92ea-4ccc-a6a2-bd88dbfcd9fb	2001_2002_Africa_fmtrpt.tsv	Ghana	GHA	Africa Region, Ghana, International Military Education and Training (IMET), FY01	INTL MARITIME OFF		NAVAL TRADE SCHOOL, SEKONDI	7/2/01	2001-07-02	9/7/01	2001-09-07	YORKTOWN, VA 23690-5000	1	10300	https://2009-2017.state.gov/documents/organization/10964.pdf	Not checked against source; verify accuracy before use	2002-03	2019-07-16	f3d170c6ac0ca266b2655a456bf86c56
5c70ac53-4b10-443f-9ac3-c831f79b6003	03221d24-92ea-4ccc-a6a2-bd88dbfcd9fb	2001_2002_Africa_fmtrpt.tsv	Ghana	GHA	Africa Region, Ghana, International Military Education and Training (IMET), FY01	INTL NAV INTEL FORNOFF PAC		NAVAL BASE, SEKONDI	7/2/01	2001-07-02	7/13/01	2001-07-13	SAN DIEGO, CA 92101-1031	1	2440	https://2009-2017.state.gov/documents/organization/10964.pdf	Not checked against source; verify accuracy before use	2002-03	2019-07-16	70981664f8e0f8501f9c8052d0bcf901
5343fff5-9581-4431-a786-bd304bdc0c50	03221d24-92ea-4ccc-a6a2-bd88dbfcd9fb	2001_2002_Africa_fmtrpt.tsv	Ghana	GHA	Africa Region, Ghana, International Military Education and Training (IMET), FY01	INTL OFF SCH & SOS		AIR FORCE STATION, TAMALE	1/8/01	2001-01-08	3/30/01	2001-03-30	MAXWELL AFB, AL 36112-6323	1	8370	https://2009-2017.state.gov/documents/organization/10964.pdf	Not checked against source; verify accuracy before use	2002-03	2019-07-16	439ab2e1f1cf354ae882effebfc75123
cb184b8c-9e55-462f-8564-a330252919dc	03221d24-92ea-4ccc-a6a2-bd88dbfcd9fb	2001_2002_Africa_fmtrpt.tsv	Ghana	GHA	Africa Region, Ghana, International Military Education and Training (IMET), FY01	INTL OFF SCH (FOR AC&SC)		AIR FORCE STATION,TAKORADI	6/18/01	2001-06-18	7/27/01	2001-07-27	MAXWELL AFB, AL 36112-6323	1	5843	https://2009-2017.state.gov/documents/organization/10964.pdf	Not checked against source; verify accuracy before use	2002-03	2019-07-16	179a3eaef7ea685527a15d8ab59f48b5
14ca0f9e-efba-4398-a632-b4141ddb0845	03221d24-92ea-4ccc-a6a2-bd88dbfcd9fb	2001_2002_Africa_fmtrpt.tsv	Ghana	GHA	Africa Region, Ghana, International Military Education and Training (IMET), FY01	JUMPMASTER		AIRBORNE TRAINING SCHOOL, TAMALE	2/26/01	2001-02-26	3/9/01	2001-03-09	FT BENNING GA 31905-5468	1	2366	https://2009-2017.state.gov/documents/organization/10964.pdf	Not checked against source; verify accuracy before use	2002-03	2019-07-16	c829980ed4b3bf299962342e0e59667d
feda8cbd-25fd-4798-9c67-46f8698748d1	03221d24-92ea-4ccc-a6a2-bd88dbfcd9fb	2001_2002_Africa_fmtrpt.tsv	Ghana	GHA	Africa Region, Ghana, International Military Education and Training (IMET), FY01	JUMPMASTER		AIRBORNE TRAINING SCHOOL, TAMALE	10/30/00	2000-10-30	11/13/00	2000-11-13	FT BENNING GA 31905-5468	1	158	https://2009-2017.state.gov/documents/organization/10964.pdf	Not checked against source; verify accuracy before use	2002-03	2019-07-16	1e53026e09adcc8d218b5459c8536461
d1f0c493-1a94-4fbf-9cc1-7d7d47002253	03221d24-92ea-4ccc-a6a2-bd88dbfcd9fb	2001_2002_Africa_fmtrpt.tsv	Ghana	GHA	Africa Region, Ghana, International Military Education and Training (IMET), FY01	MET DIILS		a) 24 from the Ghana Armed Forces Directorate Of Training, Burma Camp, Accra (b) 1 from the Office of the President, The Castle Osu, Accra (c) 1 from Serious Fraud Office, Old Parliament House, P.O. BOX AC80, Accra (d) 1 from the Ghana Police Headquarters, Accra (e) 1 from the Ghana Intergrity and Initiative, Osu, Accra (f) 1 from the Ghana Bar Association, Ghana Literacy Building, Adabraka, Accra (g) 1 from the Attorney-Generals Office, Accra	9/3/01	2001-09-03	9/7/01	2001-09-07	Ghana	24	28850	https://2009-2017.state.gov/documents/organization/10964.pdf	Not checked against source; verify accuracy before use	2002-03	2019-07-16	7074df107588fb7657192fa7703c73bb
35cdfdd3-896b-44f2-b55c-d7bae09c2189	03221d24-92ea-4ccc-a6a2-bd88dbfcd9fb	2001_2002_Africa_fmtrpt.tsv	Ghana	GHA	Africa Region, Ghana, International Military Education and Training (IMET), FY01	MET REGIONAL DIILS		NJS NEWPORT, RHODE ISLAND	7/23/01	2001-07-23	7/27/01	2001-07-27	Ghana	1	1299	https://2009-2017.state.gov/documents/organization/10964.pdf	Not checked against source; verify accuracy before use	2002-03	2019-07-16	596f39aa44c9bf16b28aed86bb80deeb
4a07862d-9a9c-445b-980d-5161eb9fb380	03221d24-92ea-4ccc-a6a2-bd88dbfcd9fb	2001_2002_Africa_fmtrpt.tsv	Ghana	GHA	Africa Region, Ghana, International Military Education and Training (IMET), FY01	MET REGIONAL DIILS		NJS NEWPORT, RHODE ISLAND	7/23/01	2001-07-23	7/27/01	2001-07-27	Ghana	1	1299	https://2009-2017.state.gov/documents/organization/10964.pdf	Not checked against source; verify accuracy before use	2002-03	2019-07-16	596f39aa44c9bf16b28aed86bb80deeb
6c06e306-f287-46bb-9f63-dfd292abb218	03221d24-92ea-4ccc-a6a2-bd88dbfcd9fb	2001_2002_Africa_fmtrpt.tsv	Ghana	GHA	Africa Region, Ghana, International Military Education and Training (IMET), FY01	MET REGIONAL DIILS		NJS NEWPORT RHODE ISLAND	7/23/01	2001-07-23	7/27/01	2001-07-27	Ghana	1	1299	https://2009-2017.state.gov/documents/organization/10964.pdf	Not checked against source; verify accuracy before use	2002-03	2019-07-16	596f39aa44c9bf16b28aed86bb80deeb
c4b0b7b9-ab28-4952-bff8-d809995ab107	03221d24-92ea-4ccc-a6a2-bd88dbfcd9fb	2001_2002_Africa_fmtrpt.tsv	Ghana	GHA	Africa Region, Ghana, International Military Education and Training (IMET), FY01	MET REGIONAL DIILS		NJS NEWPORT RHODE ISLAND	7/23/01	2001-07-23	7/27/01	2001-07-27	Ghana	1	1299	https://2009-2017.state.gov/documents/organization/10964.pdf	Not checked against source; verify accuracy before use	2002-03	2019-07-16	596f39aa44c9bf16b28aed86bb80deeb
02c98803-f853-4558-acbb-d3d958c5ae39	03221d24-92ea-4ccc-a6a2-bd88dbfcd9fb	2001_2002_Africa_fmtrpt.tsv	Ghana	GHA	Africa Region, Ghana, International Military Education and Training (IMET), FY01	OAC INTL STUDENT ENGR PREP		48 ENGINEER REGIMENT, TESHIE	11/6/00	2000-11-06	11/10/00	2000-11-10	FT LEONARD WOOD MO 65473-5000	1	1878	https://2009-2017.state.gov/documents/organization/10964.pdf	Not checked against source; verify accuracy before use	2002-03	2019-07-16	f032d3402c6c1a571d38d996132b287f
36519e25-b323-404d-9ba3-5fb2cf8a77e0	03221d24-92ea-4ccc-a6a2-bd88dbfcd9fb	2001_2002_Africa_fmtrpt.tsv	Ghana	GHA	Africa Region, Ghana, International Military Education and Training (IMET), FY01	OAC INTL STUDENT MP PREP		MILITARY POLICE HEADQUARTERS, BURMA CAMP, ACCRA	8/6/01	2001-08-06	8/10/01	2001-08-10	FT LEONARD WOOD MO 65473-5000	1	1988	https://2009-2017.state.gov/documents/organization/10964.pdf	Not checked against source; verify accuracy before use	2002-03	2019-07-16	454b7da946d01e853c17616ed65f91e1
4389cd23-28e5-424a-8824-0ee9550e91cd	03221d24-92ea-4ccc-a6a2-bd88dbfcd9fb	2001_2002_Africa_fmtrpt.tsv	Ghana	GHA	Africa Region, Ghana, International Military Education and Training (IMET), FY01	PARACHUTE RIGGER		AIRBORNE TRAINING SCHOOL, TAMALE	3/19/01	2001-03-19	5/25/01	2001-05-25	FT LEE VA 23801-1509	1	5021	https://2009-2017.state.gov/documents/organization/10964.pdf	Not checked against source; verify accuracy before use	2002-03	2019-07-16	55d1b1bd31765df72ab2205933538466
823a5e26-cfda-4a5f-b146-caf5bee6e4ef	03221d24-92ea-4ccc-a6a2-bd88dbfcd9fb	2001_2002_Africa_fmtrpt.tsv	Ghana	GHA	Africa Region, Ghana, International Military Education and Training (IMET), FY01	PATROL CFT OPS RIVER ENV		NAVAL TRAINING, BURMA CAMP, ACCRA	1/19/01	2001-01-19	3/15/01	2001-03-15	STENNIS SPACE CENTER, MS 39529-7099	1	6622	https://2009-2017.state.gov/documents/organization/10964.pdf	Not checked against source; verify accuracy before use	2002-03	2019-07-16	78285c41020a63e9d5cae166c7a9cb20
02a77646-909a-41e9-940f-61d5657ff319	03221d24-92ea-4ccc-a6a2-bd88dbfcd9fb	2001_2002_Africa_fmtrpt.tsv	Ghana	GHA	Africa Region, Ghana, International Military Education and Training (IMET), FY01	PUBLIC AFFAIRS OFFICER		DIRECTORATE OF PUBLIC RELATIONS, BURMA CAMP,	5/22/01	2001-05-22	7/24/01	2001-07-24	FT GEORGE G. MEADE MD 20755-5620	1	7663	https://2009-2017.state.gov/documents/organization/10964.pdf	Not checked against source; verify accuracy before use	2002-03	2019-07-16	d714d04991d80b4138535f6f62d6a0c5
3faff216-4aa0-436c-8e27-d1eedffbb0d2	03221d24-92ea-4ccc-a6a2-bd88dbfcd9fb	2001_2002_Africa_fmtrpt.tsv	Ghana	GHA	Africa Region, Ghana, International Military Education and Training (IMET), FY01	RANGER		UNKNOWN TO GHANA	10/7/00	2000-10-07	11/3/00	2000-11-03	FT BENNING GA 31905-5468	1	3192	https://2009-2017.state.gov/documents/organization/10964.pdf	Not checked against source; verify accuracy before use	2002-03	2019-07-16	c0e9512f9ca808ee00941f73e4ee00da
15eb9315-bfe4-4f96-a9fa-033bb72ee2a3	03221d24-92ea-4ccc-a6a2-bd88dbfcd9fb	2001_2002_Africa_fmtrpt.tsv	Ghana	GHA	Africa Region, Ghana, International Military Education and Training (IMET), FY01	SR INTERNATIONAL DEF MGT		CHIEF DIRECTOR, MINISTRY OF DEFENSE	6/25/01	2001-06-25	7/20/01	2001-07-20	MONTEREY, CA 93943-5201	1	6335	https://2009-2017.state.gov/documents/organization/10964.pdf	Not checked against source; verify accuracy before use	2002-03	2019-07-16	07f93dc5da6b547801ced8471218723b
8e5acbd3-757c-4349-a1c6-97c7e93d9798	03221d24-92ea-4ccc-a6a2-bd88dbfcd9fb	2001_2002_Africa_fmtrpt.tsv	Ghana	GHA	Africa Region, Ghana, International Military Education and Training (IMET), FY01	USA C&GSC OFF PREPARATORY		MILITARY ACADEMY AND TRAINING SCHOOL, TESHIE	7/9/01	2001-07-09	7/20/01	2001-07-20	FT LEAVENWORTH KS 66027-1352	1	1380	https://2009-2017.state.gov/documents/organization/10964.pdf	Not checked against source; verify accuracy before use	2002-03	2019-07-16	e0a946114f5257731b75a275485d5435
f066a3f9-08a4-4661-8ea7-5494e76101af	03221d24-92ea-4ccc-a6a2-bd88dbfcd9fb	2001_2002_Africa_fmtrpt.tsv	Ghana	GHA	DoS Africa Region, Ghana, Foreign Military Financing (FMF), FY01	HOT SHIP XFER 180 FT PAC		GNS ANZONE, SEKONDI NAVAL BASE,SEKONDI	5/1/01	2001-05-01	5/12/01	2001-05-12	ALAMEDA, CA 94501-5100	1	0	https://2009-2017.state.gov/documents/organization/10964.pdf	Not checked against source; verify accuracy before use	2002-03	2019-07-16	7622ef123c9c9d87625e84a65805ec1a
de760c8f-1eca-4598-a9fe-d36a0424301e	03221d24-92ea-4ccc-a6a2-bd88dbfcd9fb	2001_2002_Africa_fmtrpt.tsv	Ghana	GHA	DoS Africa Region, Ghana, Foreign Military Financing (FMF), FY01	HOT SHIP XFER 180 FT PAC		GNS ANZONE, SEKONDI NAVAL BASE, SEKONDI	5/1/01	2001-05-01	5/12/01	2001-05-12	ALAMEDA, CA 94501-5100	1	0	https://2009-2017.state.gov/documents/organization/10964.pdf	Not checked against source; verify accuracy before use	2002-03	2019-07-16	7622ef123c9c9d87625e84a65805ec1a
54bed1bb-dad4-436b-98e4-a4bb4d16ed89	03221d24-92ea-4ccc-a6a2-bd88dbfcd9fb	2001_2002_Africa_fmtrpt.tsv	Ghana	GHA	DoS Africa Region, Ghana, Foreign Military Financing (FMF), FY01	HOT SHIP XFER 180 FT PAC		GNS ANZONE, SEKONDI NAVAL BASE SEKONDI	5/1/01	2001-05-01	5/12/01	2001-05-12	ALAMEDA, CA 94501-5100	1	0	https://2009-2017.state.gov/documents/organization/10964.pdf	Not checked against source; verify accuracy before use	2002-03	2019-07-16	7622ef123c9c9d87625e84a65805ec1a
2037e6b9-a5c2-4914-a4cc-45c2de7a1abb	03221d24-92ea-4ccc-a6a2-bd88dbfcd9fb	2001_2002_Africa_fmtrpt.tsv	Ghana	GHA	DoS Africa Region, Ghana, Foreign Military Financing (FMF), FY01	HOT SHIP XFER 180 FT PAC		GNS ANZONE, SEKONDI NAVAL BASE, SEKONDI	5/1/01	2001-05-01	5/12/01	2001-05-12	ALAMEDA, CA 94501-5100	1	0	https://2009-2017.state.gov/documents/organization/10964.pdf	Not checked against source; verify accuracy before use	2002-03	2019-07-16	7622ef123c9c9d87625e84a65805ec1a
18e080a8-dcc8-433a-a8c0-6f700668e9f9	03221d24-92ea-4ccc-a6a2-bd88dbfcd9fb	2001_2002_Africa_fmtrpt.tsv	Ghana	GHA	DoS Africa Region, Ghana, Foreign Military Financing (FMF), FY01	HOT SHIP XFER 180 FT PAC		GNS ANZONE, SEKONDI NAVAL BASE, SEKONDI	5/1/01	2001-05-01	5/12/01	2001-05-12	ALAMEDA, CA 94501-5100	1	0	https://2009-2017.state.gov/documents/organization/10964.pdf	Not checked against source; verify accuracy before use	2002-03	2019-07-16	7622ef123c9c9d87625e84a65805ec1a
6d370335-6226-4a5f-ba06-b928c16e8b20	03221d24-92ea-4ccc-a6a2-bd88dbfcd9fb	2001_2002_Africa_fmtrpt.tsv	Ghana	GHA	DoS Africa Region, Ghana, Foreign Military Financing (FMF), FY01	HOT SHIP XFER 180 FT PAC		GNS ANZONE, SEKONDI NAVAL BASE, SEKONDI	5/1/01	2001-05-01	5/12/01	2001-05-12	ALAMEDA, CA 94501-5100	1	0	https://2009-2017.state.gov/documents/organization/10964.pdf	Not checked against source; verify accuracy before use	2002-03	2019-07-16	7622ef123c9c9d87625e84a65805ec1a
8a783e75-cb42-4f16-824b-5f48d137e1eb	03221d24-92ea-4ccc-a6a2-bd88dbfcd9fb	2001_2002_Africa_fmtrpt.tsv	Ghana	GHA	DoS Africa Region, Ghana, Foreign Military Financing (FMF), FY01	HOT SHIP XFER 180 FT PAC		GNS ANZONE, SEKONDI NAVAL BASE,SEKONDI	5/1/01	2001-05-01	5/12/01	2001-05-12	ALAMEDA, CA 94501-5100	1	0	https://2009-2017.state.gov/documents/organization/10964.pdf	Not checked against source; verify accuracy before use	2002-03	2019-07-16	7622ef123c9c9d87625e84a65805ec1a
463f4ab1-041c-4602-b217-9663a6ddb220	03221d24-92ea-4ccc-a6a2-bd88dbfcd9fb	2001_2002_Africa_fmtrpt.tsv	Ghana	GHA	DoS Africa Region, Ghana, Foreign Military Financing (FMF), FY01	HOT SHIP XFER 180 FT PAC		GNS ANZONE, SEKONDI NAVAL BASE, SEKONDI	5/1/01	2001-05-01	5/12/01	2001-05-12	ALAMEDA, CA 94501-5100	1	0	https://2009-2017.state.gov/documents/organization/10964.pdf	Not checked against source; verify accuracy before use	2002-03	2019-07-16	7622ef123c9c9d87625e84a65805ec1a
252689cc-0ffd-4ef6-ae80-6652d251e66d	03221d24-92ea-4ccc-a6a2-bd88dbfcd9fb	2001_2002_Africa_fmtrpt.tsv	Ghana	GHA	DoS Africa Region, Ghana, Foreign Military Financing (FMF), FY01	HOT SHIP XFER 180 FT PAC		GNS ANZONE, SEKONDI NAVAL BAS, SEKONDI	5/1/01	2001-05-01	5/12/01	2001-05-12	ALAMEDA, CA 94501-5100	1	0	https://2009-2017.state.gov/documents/organization/10964.pdf	Not checked against source; verify accuracy before use	2002-03	2019-07-16	1e5624a2c46885f989acbe538a8c5dc7
f038a16c-c9cd-497d-a8e2-23c73419c8c9	03221d24-92ea-4ccc-a6a2-bd88dbfcd9fb	2001_2002_Africa_fmtrpt.tsv	Ghana	GHA	DoS Africa Region, Ghana, Foreign Military Financing (FMF), FY01	HOT SHIP XFER 180 FT PAC		GNS ANZONE, SEKONDI NAVAL BASE, SEKONDI	5/1/01	2001-05-01	5/12/01	2001-05-12	ALAMEDA, CA 94501-5100	1	0	https://2009-2017.state.gov/documents/organization/10964.pdf	Not checked against source; verify accuracy before use	2002-03	2019-07-16	7622ef123c9c9d87625e84a65805ec1a
99ae0392-85fc-470a-abd7-7d074e89d820	03221d24-92ea-4ccc-a6a2-bd88dbfcd9fb	2001_2002_Africa_fmtrpt.tsv	Ghana	GHA	DoS Africa Region, Ghana, Foreign Military Financing (FMF), FY01	HOT SHIP XFER 180 FT PAC		GNS ANZONE, SEKONDI NAVAL BASE, SEKONDI	5/1/01	2001-05-01	5/12/01	2001-05-12	ALAMEDA, CA 94501-5100	1	0	https://2009-2017.state.gov/documents/organization/10964.pdf	Not checked against source; verify accuracy before use	2002-03	2019-07-16	7622ef123c9c9d87625e84a65805ec1a
4570c510-df30-4fea-bb5d-b3ff65062fb6	03221d24-92ea-4ccc-a6a2-bd88dbfcd9fb	2001_2002_Africa_fmtrpt.tsv	Ghana	GHA	DoS Africa Region, Ghana, Foreign Military Financing (FMF), FY01	HOT SHIP XFER 180 FT PAC		GNS ANZONE. SEKONDI NAVAL BASE, SEKONDI	5/1/01	2001-05-01	5/12/01	2001-05-12	ALAMEDA, CA 94501-5100	1	0	https://2009-2017.state.gov/documents/organization/10964.pdf	Not checked against source; verify accuracy before use	2002-03	2019-07-16	7622ef123c9c9d87625e84a65805ec1a
10a3f317-6d61-400b-ab92-3dc6d0dcd15d	03221d24-92ea-4ccc-a6a2-bd88dbfcd9fb	2001_2002_Africa_fmtrpt.tsv	Ghana	GHA	DoS Africa Region, Ghana, Foreign Military Financing (FMF), FY01	HOT SHIP XFER 180 FT PAC		GNS ANZONE SEKONDI NAVAL BASE,SEKONDI	5/1/01	2001-05-01	5/12/01	2001-05-12	ALAMEDA, CA 94501-5100	1	0	https://2009-2017.state.gov/documents/organization/10964.pdf	Not checked against source; verify accuracy before use	2002-03	2019-07-16	7622ef123c9c9d87625e84a65805ec1a
24c65cc8-65cf-44be-afa0-6707f25ee530	03221d24-92ea-4ccc-a6a2-bd88dbfcd9fb	2001_2002_Africa_fmtrpt.tsv	Ghana	GHA	DoS Africa Region, Ghana, Foreign Military Financing (FMF), FY01	HOT SHIP XFER 180 FT PAC		GNS ANZONE, SEKONDI NAVAL BASE, SEKONDI	5/1/01	2001-05-01	5/12/01	2001-05-12	ALAMEDA, CA 94501-5100	1	0	https://2009-2017.state.gov/documents/organization/10964.pdf	Not checked against source; verify accuracy before use	2002-03	2019-07-16	7622ef123c9c9d87625e84a65805ec1a
065cfe4f-3a87-4ee7-974a-d5dd81c9d8a5	03221d24-92ea-4ccc-a6a2-bd88dbfcd9fb	2001_2002_Africa_fmtrpt.tsv	Ghana	GHA	DoS Africa Region, Ghana, Foreign Military Financing (FMF), FY01	HOT SHIP XFER 180 FT PAC		GNS ANZONE, SEKONDI NAVAL BASE, SEKONDI	5/1/01	2001-05-01	5/12/01	2001-05-12	ALAMEDA, CA 94501-5100	1	0	https://2009-2017.state.gov/documents/organization/10964.pdf	Not checked against source; verify accuracy before use	2002-03	2019-07-16	7622ef123c9c9d87625e84a65805ec1a
19396d75-1321-4800-8eab-8a7bb5d74d1c	03221d24-92ea-4ccc-a6a2-bd88dbfcd9fb	2001_2002_Africa_fmtrpt.tsv	Ghana	GHA	DoS Africa Region, Ghana, Foreign Military Financing (FMF), FY01	HOT SHIP XFER 180 FT PAC		GNS ANZONE SEKONDI NAVAL BASE, SEKONDI	5/1/01	2001-05-01	5/12/01	2001-05-12	ALAMEDA, CA 94501-5100	1	0	https://2009-2017.state.gov/documents/organization/10964.pdf	Not checked against source; verify accuracy before use	2002-03	2019-07-16	7622ef123c9c9d87625e84a65805ec1a
5887c9b4-00d5-4b67-956e-ff4ec1f032a8	03221d24-92ea-4ccc-a6a2-bd88dbfcd9fb	2001_2002_Africa_fmtrpt.tsv	Ghana	GHA	DoS Africa Region, Ghana, Foreign Military Financing (FMF), FY01	HOT SHIP XFER 180 FT PAC		GNS ANZONE, SEKONDI NAVAL BASE, SEKONDI	5/1/01	2001-05-01	5/12/01	2001-05-12	ALAMEDA, CA 94501-5100	1	0	https://2009-2017.state.gov/documents/organization/10964.pdf	Not checked against source; verify accuracy before use	2002-03	2019-07-16	7622ef123c9c9d87625e84a65805ec1a
acb2997c-406f-49f5-b471-74ccef249f7a	03221d24-92ea-4ccc-a6a2-bd88dbfcd9fb	2001_2002_Africa_fmtrpt.tsv	Ghana	GHA	DoS Africa Region, Ghana, Foreign Military Financing (FMF), FY01	HOT SHIP XFER 180 FT PAC		GNS ANZONE, SEKONDI NAVAL BASE, SEKONDI	5/1/01	2001-05-01	5/12/01	2001-05-12	ALAMEDA, CA 94501-5100	1	0	https://2009-2017.state.gov/documents/organization/10964.pdf	Not checked against source; verify accuracy before use	2002-03	2019-07-16	7622ef123c9c9d87625e84a65805ec1a
4085be19-f3bc-497b-ba9e-0df703706fc8	03221d24-92ea-4ccc-a6a2-bd88dbfcd9fb	2001_2002_Africa_fmtrpt.tsv	Ghana	GHA	DoS Africa Region, Ghana, Foreign Military Financing (FMF), FY01	HOT SHIP XFER 180 FT PAC		GNS ANZONE, SEKONDI NAVAL BASE, SEKONDI	5/1/01	2001-05-01	5/12/01	2001-05-12	ALAMEDA, CA 94501-5100	1	0	https://2009-2017.state.gov/documents/organization/10964.pdf	Not checked against source; verify accuracy before use	2002-03	2019-07-16	7622ef123c9c9d87625e84a65805ec1a
2b9a04ea-8188-450a-a913-01424850e7a8	03221d24-92ea-4ccc-a6a2-bd88dbfcd9fb	2001_2002_Africa_fmtrpt.tsv	Ghana	GHA	DoS Africa Region, Ghana, Foreign Military Financing (FMF), FY01	HOT SHIP XFER 180 FT PAC		GNS ANZONE, SEKONDI NAVAL BASE, SEKONDI	5/1/01	2001-05-01	5/12/01	2001-05-12	ALAMEDA, CA 94501-5100	1	0	https://2009-2017.state.gov/documents/organization/10964.pdf	Not checked against source; verify accuracy before use	2002-03	2019-07-16	7622ef123c9c9d87625e84a65805ec1a
4f1e7f32-26da-4677-9792-b98ee29d5503	03221d24-92ea-4ccc-a6a2-bd88dbfcd9fb	2001_2002_Africa_fmtrpt.tsv	Ghana	GHA	DoS Africa Region, Ghana, Foreign Military Financing (FMF), FY01	HOT SHIP XFER 180 FT PAC		GNS ANZONE, SEKONDI NAVAL BASE, SEKONDI	5/1/01	2001-05-01	5/12/01	2001-05-12	ALAMEDA, CA 94501-5100	1	0	https://2009-2017.state.gov/documents/organization/10964.pdf	Not checked against source; verify accuracy before use	2002-03	2019-07-16	7622ef123c9c9d87625e84a65805ec1a
c4c76d5a-ca15-4362-81a4-739f09af6fee	03221d24-92ea-4ccc-a6a2-bd88dbfcd9fb	2001_2002_Africa_fmtrpt.tsv	Ghana	GHA	Africa Region, Ghana, Foreign Military Financing (FMF), FY01	HOT SHIP XFER 180 FT PAC		GNS ANZONE, SEKONDI NAVAL BASE, SEKONDI	5/1/01	2001-05-01	5/12/01	2001-05-12	ALAMEDA, CA 94501-5100	1	0	https://2009-2017.state.gov/documents/organization/10964.pdf	Not checked against source; verify accuracy before use	2002-03	2019-07-16	c910217670c0025eb2d2b93fb60704f2
25bbdc79-a4c9-45db-bc6f-7b1e4bddc0dc	03221d24-92ea-4ccc-a6a2-bd88dbfcd9fb	2001_2002_Africa_fmtrpt.tsv	Ghana	GHA	Africa Region, Ghana, Foreign Military Financing (FMF), FY01	HOT SHIP XFER 180 FT PAC		GNS ANZONE SEKONDI NAVAL BASE, SEKONDI	5/1/01	2001-05-01	5/12/01	2001-05-12	ALAMEDA, CA 94501-5100	1	0	https://2009-2017.state.gov/documents/organization/10964.pdf	Not checked against source; verify accuracy before use	2002-03	2019-07-16	c910217670c0025eb2d2b93fb60704f2
c53590a6-e643-4562-bb4e-d1035d2e90c4	03221d24-92ea-4ccc-a6a2-bd88dbfcd9fb	2001_2002_Africa_fmtrpt.tsv	Ghana	GHA	Africa Region, Ghana, Foreign Military Financing (FMF), FY01	HOT SHIP XFER 180 FT PAC		GNS ANZONE, SEKONDI NAVAL BASE SEKONDI	3/6/01	2001-03-06	5/12/01	2001-05-12	ALAMEDA, CA 94501-5100	1	0	https://2009-2017.state.gov/documents/organization/10964.pdf	Not checked against source; verify accuracy before use	2002-03	2019-07-16	57a21f72602e810b02401ad5758f346c
51175bdd-0f90-426a-b992-5433392f6e7e	03221d24-92ea-4ccc-a6a2-bd88dbfcd9fb	2001_2002_Africa_fmtrpt.tsv	Ghana	GHA	Africa Region, Ghana, Foreign Military Financing (FMF), FY01	HOT SHIP XFER 180 FT PAC		GNS ANZONE, SEKONDI NAVAL BASE,SEKONDI	3/6/01	2001-03-06	5/12/01	2001-05-12	ALAMEDA, CA 94501-5100	1	0	https://2009-2017.state.gov/documents/organization/10964.pdf	Not checked against source; verify accuracy before use	2002-03	2019-07-16	57a21f72602e810b02401ad5758f346c
192a6405-ed3a-4a29-b3d9-5395b6e3c3ad	03221d24-92ea-4ccc-a6a2-bd88dbfcd9fb	2001_2002_Africa_fmtrpt.tsv	Ghana	GHA	Africa Region, Ghana, Foreign Military Financing (FMF), FY01	HOT SHIP XFER 180 FT PAC		GNS ANZONE, SEKONDI NAVAL BASE,SEKONDI	3/6/01	2001-03-06	5/12/01	2001-05-12	ALAMEDA, CA 94501-5100	1	0	https://2009-2017.state.gov/documents/organization/10964.pdf	Not checked against source; verify accuracy before use	2002-03	2019-07-16	57a21f72602e810b02401ad5758f346c
3cb09d56-f0c3-434a-a357-b279d2bb654d	03221d24-92ea-4ccc-a6a2-bd88dbfcd9fb	2001_2002_Africa_fmtrpt.tsv	Ghana	GHA	Africa Region, Ghana, Foreign Military Financing (FMF), FY01	HOT SHIP XFER 180 FT PAC		GNS ANZONE, SEKONDI NAVAL BASE, SEKONDI	5/1/01	2001-05-01	5/12/01	2001-05-12	ALAMEDA, CA 94501-5100	1	0	https://2009-2017.state.gov/documents/organization/10964.pdf	Not checked against source; verify accuracy before use	2002-03	2019-07-16	c910217670c0025eb2d2b93fb60704f2
719d93dd-760b-48da-a6e3-b5add1588b63	03221d24-92ea-4ccc-a6a2-bd88dbfcd9fb	2001_2002_Africa_fmtrpt.tsv	Ghana	GHA	Africa Region, Ghana, Foreign Military Financing (FMF), FY01	HOT SHIP XFER 180 FT PAC		GNS ANZONE,SEKONDI NAVAL BASE, SEKONDI	3/6/01	2001-03-06	5/12/01	2001-05-12	ALAMEDA, CA 94501-5100	1	0	https://2009-2017.state.gov/documents/organization/10964.pdf	Not checked against source; verify accuracy before use	2002-03	2019-07-16	57a21f72602e810b02401ad5758f346c
40c20900-1dee-47bd-a69a-38ca1dc11e5a	03221d24-92ea-4ccc-a6a2-bd88dbfcd9fb	2001_2002_Africa_fmtrpt.tsv	Ghana	GHA	Africa Region, Ghana, Foreign Military Financing (FMF), FY01	HOT SHIP XFER 180 FT PAC		GNS ANZONE, SEKONDI NAVAL BASE, SEKONDI	3/6/01	2001-03-06	5/12/01	2001-05-12	ALAMEDA, CA 94501-5100	1	0	https://2009-2017.state.gov/documents/organization/10964.pdf	Not checked against source; verify accuracy before use	2002-03	2019-07-16	57a21f72602e810b02401ad5758f346c
64d524fe-ddbd-4526-8840-7a7fe1c67fc9	03221d24-92ea-4ccc-a6a2-bd88dbfcd9fb	2001_2002_Africa_fmtrpt.tsv	Ghana	GHA	Africa Region, Ghana, Foreign Military Financing (FMF), FY01	HOT SHIP XFER 180 FT PAC		GNS ANZONE, SEKONDI NAVAL BASE, SEKONDI	3/6/01	2001-03-06	5/12/01	2001-05-12	ALAMEDA, CA 94501-5100	1	0	https://2009-2017.state.gov/documents/organization/10964.pdf	Not checked against source; verify accuracy before use	2002-03	2019-07-16	57a21f72602e810b02401ad5758f346c
68640571-a1f7-4a05-a5a3-7815f48f48d1	03221d24-92ea-4ccc-a6a2-bd88dbfcd9fb	2001_2002_Africa_fmtrpt.tsv	Ghana	GHA	Africa Region, Ghana, Foreign Military Financing (FMF), FY01	HOT SHIP XFER 180 FT PAC		GNS ANZONE, SEKONDI NAVAL BASE,SEKONDI	3/6/01	2001-03-06	5/12/01	2001-05-12	ALAMEDA, CA 94501-5100	1	0	https://2009-2017.state.gov/documents/organization/10964.pdf	Not checked against source; verify accuracy before use	2002-03	2019-07-16	57a21f72602e810b02401ad5758f346c
ded1d518-ff7a-46bc-bd43-e45628d9c9a8	03221d24-92ea-4ccc-a6a2-bd88dbfcd9fb	2001_2002_Africa_fmtrpt.tsv	Ghana	GHA	Africa Region, Ghana, Foreign Military Financing (FMF), FY01	HOT SHIP XFER 180 FT PAC		GNS ANZONE,SEKONDI NAVAL BASE, SEKONDI	3/6/01	2001-03-06	5/12/01	2001-05-12	ALAMEDA, CA 94501-5100	1	0	https://2009-2017.state.gov/documents/organization/10964.pdf	Not checked against source; verify accuracy before use	2002-03	2019-07-16	57a21f72602e810b02401ad5758f346c
f43827e8-fdd3-4a60-b3cf-d64c96b49311	03221d24-92ea-4ccc-a6a2-bd88dbfcd9fb	2001_2002_Africa_fmtrpt.tsv	Ghana	GHA	Africa Region, Ghana, Foreign Military Financing (FMF), FY01	HOT SHIP XFER 180 FT PAC		GNS ANZONE, SEKONDI NAVAL BASE, SEKONDI	3/6/01	2001-03-06	5/12/01	2001-05-12	ALAMEDA, CA 94501-5100	1	0	https://2009-2017.state.gov/documents/organization/10964.pdf	Not checked against source; verify accuracy before use	2002-03	2019-07-16	57a21f72602e810b02401ad5758f346c
34413adc-6c9e-45d9-bbcf-f7127593723e	03221d24-92ea-4ccc-a6a2-bd88dbfcd9fb	2001_2002_Africa_fmtrpt.tsv	Ghana	GHA	Africa Region, Ghana, Foreign Military Financing (FMF), FY01	HOT SHIP XFER 180 FT PAC		GNS ANZONE, SEKONDI NAVAL BASE, SEKONDI	3/6/01	2001-03-06	5/12/01	2001-05-12	ALAMEDA, CA 94501-5100	1	0	https://2009-2017.state.gov/documents/organization/10964.pdf	Not checked against source; verify accuracy before use	2002-03	2019-07-16	57a21f72602e810b02401ad5758f346c
a9feb6fb-d605-425e-b568-ff92e2dc8e74	03221d24-92ea-4ccc-a6a2-bd88dbfcd9fb	2001_2002_Africa_fmtrpt.tsv	Ghana	GHA	Africa Region, Ghana, Foreign Military Financing (FMF), FY01	HOT SHIP XFER 180 FT PAC		GNS ANZONE, SEKONDI NAVAL BASE SEKONDI	3/6/01	2001-03-06	5/12/01	2001-05-12	ALAMEDA, CA 94501-5100	1	0	https://2009-2017.state.gov/documents/organization/10964.pdf	Not checked against source; verify accuracy before use	2002-03	2019-07-16	57a21f72602e810b02401ad5758f346c
d26ba79c-588b-4c7f-9c38-f6e61f194d6c	03221d24-92ea-4ccc-a6a2-bd88dbfcd9fb	2001_2002_Africa_fmtrpt.tsv	Ghana	GHA	Africa Region, Ghana, Foreign Military Financing (FMF), FY01	HOT SHIP XFER 180 FT PAC		GNS ANZONE, SEKONDI NAVAL BASE, SEKONDI	5/1/01	2001-05-01	5/12/01	2001-05-12	ALAMEDA, CA 94501-5100	1	0	https://2009-2017.state.gov/documents/organization/10964.pdf	Not checked against source; verify accuracy before use	2002-03	2019-07-16	c910217670c0025eb2d2b93fb60704f2
ff43db73-7a54-4b2b-a94f-123b3159aeab	03221d24-92ea-4ccc-a6a2-bd88dbfcd9fb	2001_2002_Africa_fmtrpt.tsv	Ghana	GHA	Africa Region, Ghana, Foreign Military Financing (FMF), FY01	HOT SHIP XFER 180 FT PAC		GNS ANZONE, SEKONDI NAVAL BASE, SEKONDI	5/1/01	2001-05-01	5/12/01	2001-05-12	ALAMEDA, CA 94501-5100	1	0	https://2009-2017.state.gov/documents/organization/10964.pdf	Not checked against source; verify accuracy before use	2002-03	2019-07-16	c910217670c0025eb2d2b93fb60704f2
dc76258f-3664-4b8f-8901-69a646b30ac1	03221d24-92ea-4ccc-a6a2-bd88dbfcd9fb	2001_2002_Africa_fmtrpt.tsv	Ghana	GHA	Africa Region, Ghana, Foreign Military Financing (FMF), FY01	HOT SHIP XFER 180 FT PAC		GNS ANZONE, SEKONDI NAVAL BASE, SEKONDI	5/1/01	2001-05-01	5/12/01	2001-05-12	ALAMEDA, CA 94501-5100	1	0	https://2009-2017.state.gov/documents/organization/10964.pdf	Not checked against source; verify accuracy before use	2002-03	2019-07-16	c910217670c0025eb2d2b93fb60704f2
74842b10-95b4-4929-9d18-eebe39420ac8	03221d24-92ea-4ccc-a6a2-bd88dbfcd9fb	2001_2002_Africa_fmtrpt.tsv	Ghana	GHA	Africa Region, Ghana, Foreign Military Financing (FMF), FY01	HOT SHIP XFER 180 FT PAC		GNS ANZONE, SEKONDI NAVAL BASE,SEKONDI	5/1/01	2001-05-01	5/12/01	2001-05-12	ALAMEDA, CA 94501-5100	1	0	https://2009-2017.state.gov/documents/organization/10964.pdf	Not checked against source; verify accuracy before use	2002-03	2019-07-16	c910217670c0025eb2d2b93fb60704f2
c47a8dc5-1112-42bc-b070-a91c755f2829	03221d24-92ea-4ccc-a6a2-bd88dbfcd9fb	2001_2002_Africa_fmtrpt.tsv	Ghana	GHA	Africa Region, Ghana, Foreign Military Financing (FMF), FY01	HOT SHIP XFER 180 FT PAC		GNS ANZONE, SEKONDI NAVAL BASE, SEKONDI	5/1/01	2001-05-01	5/12/01	2001-05-12	ALAMEDA, CA 94501-5100	1	0	https://2009-2017.state.gov/documents/organization/10964.pdf	Not checked against source; verify accuracy before use	2002-03	2019-07-16	c910217670c0025eb2d2b93fb60704f2
991c23f2-83ac-4e0c-aadd-2d63d7b39bbe	03221d24-92ea-4ccc-a6a2-bd88dbfcd9fb	2001_2002_Africa_fmtrpt.tsv	Ghana	GHA	Africa Region, Ghana, Foreign Military Financing (FMF), FY01	HOT SHIP XFER 180 FT PAC		GNS ANZONE, SEKONDI NAVAL BASE SEKONDI	5/1/01	2001-05-01	5/12/01	2001-05-12	ALAMEDA, CA 94501-5100	1	0	https://2009-2017.state.gov/documents/organization/10964.pdf	Not checked against source; verify accuracy before use	2002-03	2019-07-16	c910217670c0025eb2d2b93fb60704f2
dfe47f13-f1f8-4cf8-92b1-00dd1f31a455	03221d24-92ea-4ccc-a6a2-bd88dbfcd9fb	2001_2002_Africa_fmtrpt.tsv	Ghana	GHA	Africa Region, Ghana, Foreign Military Financing (FMF), FY01	HOT SHIP XFER 180 FT PAC		GNS ANZONE, SEKONDI NAVAL BASE, SEKONDI	5/1/01	2001-05-01	5/12/01	2001-05-12	ALAMEDA, CA 94501-5100	1	0	https://2009-2017.state.gov/documents/organization/10964.pdf	Not checked against source; verify accuracy before use	2002-03	2019-07-16	c910217670c0025eb2d2b93fb60704f2
629a22a6-396b-4df6-8eb3-aa122cd6d31d	03221d24-92ea-4ccc-a6a2-bd88dbfcd9fb	2001_2002_Africa_fmtrpt.tsv	Ghana	GHA	Africa Region, Ghana, Foreign Military Financing (FMF), FY01	HOT SHIP XFER 180 FT PAC		GNS ANZONE, SEKONDI NAVAL BASE, SEKONDI	5/1/01	2001-05-01	5/12/01	2001-05-12	ALAMEDA, CA 94501-5100	1	0	https://2009-2017.state.gov/documents/organization/10964.pdf	Not checked against source; verify accuracy before use	2002-03	2019-07-16	c910217670c0025eb2d2b93fb60704f2
b8dcc468-80c5-4209-acde-6aae584112c1	03221d24-92ea-4ccc-a6a2-bd88dbfcd9fb	2001_2002_Africa_fmtrpt.tsv	Ghana	GHA	Africa Region, Ghana, Foreign Military Financing (FMF), FY01	HOT SHIP XFER 180 FT PAC		GNS ANZONE, SEKONDI NAVAL BASE, SEKONDI	5/1/01	2001-05-01	5/12/01	2001-05-12	ALAMEDA, CA 94501-5100	1	0	https://2009-2017.state.gov/documents/organization/10964.pdf	Not checked against source; verify accuracy before use	2002-03	2019-07-16	c910217670c0025eb2d2b93fb60704f2
ebbb278b-9512-461f-85eb-0ebc038dee75	03221d24-92ea-4ccc-a6a2-bd88dbfcd9fb	2001_2002_Africa_fmtrpt.tsv	Ghana	GHA	Africa Region, Ghana, Foreign Military Financing (FMF), FY01	HOT SHIP XFER 180 FT PAC		GNS ANZONE, SEKONDI NAVAL BASE, SEKONDI	5/1/01	2001-05-01	5/12/01	2001-05-12	ALAMEDA, CA 94501-5100	1	0	https://2009-2017.state.gov/documents/organization/10964.pdf	Not checked against source; verify accuracy before use	2002-03	2019-07-16	c910217670c0025eb2d2b93fb60704f2
37ce3831-7d61-444d-bdd6-869ce72da7bf	03221d24-92ea-4ccc-a6a2-bd88dbfcd9fb	2001_2002_Africa_fmtrpt.tsv	Ghana	GHA	Africa Region, Ghana, Foreign Military Financing (FMF), FY01	HOT SHIP XFER 180 FT PAC		GNS ANZONE, SEKONDI NAVAL BASE, SEKONDI	5/1/01	2001-05-01	5/12/01	2001-05-12	ALAMEDA, CA 94501-5100	1	0	https://2009-2017.state.gov/documents/organization/10964.pdf	Not checked against source; verify accuracy before use	2002-03	2019-07-16	c910217670c0025eb2d2b93fb60704f2
8c02ae41-ac5f-43fa-972f-eb8528fa0d25	03221d24-92ea-4ccc-a6a2-bd88dbfcd9fb	2001_2002_Africa_fmtrpt.tsv	Ghana	GHA	Africa Region, Ghana, Foreign Military Financing (FMF), FY01	HOT SHIP XFER 180 FT PAC		GNS ANZONE, SEKONDI NAVAL BASE, SEKONDI	5/1/01	2001-05-01	5/12/01	2001-05-12	ALAMEDA, CA 94501-5100	1	0	https://2009-2017.state.gov/documents/organization/10964.pdf	Not checked against source; verify accuracy before use	2002-03	2019-07-16	c910217670c0025eb2d2b93fb60704f2
d510ec81-ac18-4dab-879d-d58c8c89af78	03221d24-92ea-4ccc-a6a2-bd88dbfcd9fb	2001_2002_Africa_fmtrpt.tsv	Ghana	GHA	Africa Region, Ghana, Foreign Military Financing (FMF), FY01	HOT SHIP XFER 180 FT PAC		GNS ANZONE, SEKONDI NMAVAL BASE, SEKONDI	5/1/01	2001-05-01	5/12/01	2001-05-12	ALAMEDA, CA 94501-5100	1	0	https://2009-2017.state.gov/documents/organization/10964.pdf	Not checked against source; verify accuracy before use	2002-03	2019-07-16	f1cfe3f583a343c17d8645f436bf1bdd
666c408f-37e6-45f8-842c-405c836260bc	03221d24-92ea-4ccc-a6a2-bd88dbfcd9fb	2001_2002_Africa_fmtrpt.tsv	Ghana	GHA	Africa Region, Ghana, Foreign Military Financing (FMF), FY01	HOT SHIP XFER 180 FT PAC		GNS ANZONE, SEKONDI NAVAL BASE. SEKONDI	5/1/01	2001-05-01	5/12/01	2001-05-12	ALAMEDA, CA 94501-5100	1	0	https://2009-2017.state.gov/documents/organization/10964.pdf	Not checked against source; verify accuracy before use	2002-03	2019-07-16	c910217670c0025eb2d2b93fb60704f2
8025cc7b-06bb-4d20-ad0d-52fbbbe3afda	03221d24-92ea-4ccc-a6a2-bd88dbfcd9fb	2001_2002_Africa_fmtrpt.tsv	Ghana	GHA	Africa Region, Ghana, Foreign Military Financing (FMF), FY01	HOT SHIP XFER 180 FT PAC		GNS ANZONE, SEKONDI ,NAVAL BASE, SEKONDI	3/6/01	2001-03-06	5/12/01	2001-05-12	ALAMEDA, CA 94501-5100	1	0	https://2009-2017.state.gov/documents/organization/10964.pdf	Not checked against source; verify accuracy before use	2002-03	2019-07-16	57a21f72602e810b02401ad5758f346c
136a278b-dfb6-4ac7-ac4c-b112b2baa9ca	03221d24-92ea-4ccc-a6a2-bd88dbfcd9fb	2001_2002_Africa_fmtrpt.tsv	Ghana	GHA	Africa Region, Ghana, Foreign Military Financing (FMF), FY01	HOT SHIP XFER 180 FT PAC		GNS ANZONE, SEKONDI NAVAL BASE, SEKONDI	5/1/01	2001-05-01	5/12/01	2001-05-12	ALAMEDA, CA 94501-5100	1	0	https://2009-2017.state.gov/documents/organization/10964.pdf	Not checked against source; verify accuracy before use	2002-03	2019-07-16	c910217670c0025eb2d2b93fb60704f2
56c131ce-2824-464c-b918-938f5f07cc34	03221d24-92ea-4ccc-a6a2-bd88dbfcd9fb	2001_2002_Africa_fmtrpt.tsv	Ghana	GHA	Africa Region, Ghana, Foreign Military Financing (FMF), FY01	HOT SHIP XFER 180 FT PAC		GNS ANZONE SEKONDI NAVAL BASE, SEKONDI	5/1/01	2001-05-01	5/12/01	2001-05-12	ALAMEDA, CA 94501-5100	1	0	https://2009-2017.state.gov/documents/organization/10964.pdf	Not checked against source; verify accuracy before use	2002-03	2019-07-16	c910217670c0025eb2d2b93fb60704f2
073bea9b-ea29-4654-8eec-05711614e768	03221d24-92ea-4ccc-a6a2-bd88dbfcd9fb	2001_2002_Africa_fmtrpt.tsv	Ghana	GHA	Africa Region, Ghana, Foreign Military Financing (FMF), FY01	OJT 180 FT HOT SHIP TRSFR		MINISTER OF DEFENSE, BURMA CAMP, ACCRA	3/6/01	2001-03-06	5/12/01	2001-05-12	ALAMEDA, CA 94501-5100	1	13634	https://2009-2017.state.gov/documents/organization/10964.pdf	Not checked against source; verify accuracy before use	2002-03	2019-07-16	34141c6c7ab8ff87dc6e5a577de69519
2ac45664-15d7-4b0b-8f85-34938a25423f	03221d24-92ea-4ccc-a6a2-bd88dbfcd9fb	2001_2002_Africa_fmtrpt.tsv	Ghana	GHA	DoS Africa Region, Ghana, Africa Center for Strategic Studies, FY01	Senior Leader Seminar		MOD Ministry of Foreign Affairs	1/29/01	2001-01-29	2/9/01	2001-02-09	Libreville Gabon	2	8110	https://2009-2017.state.gov/documents/organization/10964.pdf	Not checked against source; verify accuracy before use	2002-03	2019-07-16	451e8a05448377d09ceb78ea63940f90
eb105847-52da-48b0-bc58-6fe86d2a3a23	03221d24-92ea-4ccc-a6a2-bd88dbfcd9fb	2001_2002_Africa_fmtrpt.tsv	Ghana	GHA	DoS Africa Region, Ghana, Africa Center for Strategic Studies, FY01	Sub-Regional Seminar		MOD MFA	8/20/01	2001-08-20	8/24/01	2001-08-24	Accra Ghana	4	5072	https://2009-2017.state.gov/documents/organization/10964.pdf	Not checked against source; verify accuracy before use	2002-03	2019-07-16	0439dceea767beb203b098fbd225b937
86eab7dd-5cb8-4e97-a890-d0e52dc41222	03221d24-92ea-4ccc-a6a2-bd88dbfcd9fb	2001_2002_Africa_fmtrpt.tsv	Ghana	GHA	DoS Africa Region, Ghana, Africa Center for Strategic Studies, FY01	Sub-Regional Seminar		MOD MFA	8/20/01	2001-08-20	8/24/01	2001-08-24	Accra Ghana	7	4982	https://2009-2017.state.gov/documents/organization/10964.pdf	Not checked against source; verify accuracy before use	2002-03	2019-07-16	35fe4267b1acd20edaae2f2df64b3321
efd92e59-5552-4c70-a9da-5b361b7359dd	03221d24-92ea-4ccc-a6a2-bd88dbfcd9fb	2001_2002_Africa_fmtrpt.tsv	Guinea	GIN	DoS Africa Region, Guinea, Non-Security Assistance, Unified Command (Note 4), FY01	JCET	96 CA BN	GUINEA NAVY	10/15/00	2000-10-15	11/25/00	2000-11-25		50	32000	https://2009-2017.state.gov/documents/organization/10964.pdf	Not checked against source; verify accuracy before use	2002-03	2019-07-16	30a8c162a1ed30707217dc5f32ee0aa8
2aa422d6-0dbb-45c0-b42c-cdc1a706aad3	03221d24-92ea-4ccc-a6a2-bd88dbfcd9fb	2001_2002_Africa_fmtrpt.tsv	Guinea	GIN	DoS Africa Region, Guinea, Non-Security Assistance, Unified Command (Note 4), FY01	JCET	1/3 SFG	MARINE COMMANDO UNIT, GUINEA NAVY	10/15/00	2000-10-15	11/25/00	2000-11-25		120	68000	https://2009-2017.state.gov/documents/organization/10964.pdf	Not checked against source; verify accuracy before use	2002-03	2019-07-16	4af0092542ff0ad67c560bb304e86fad
88e301e5-9970-48f6-8981-2046486587f1	03221d24-92ea-4ccc-a6a2-bd88dbfcd9fb	2001_2002_Africa_fmtrpt.tsv	Guinea	GIN	DoS Africa Region, Guinea, International Military Education and Training (IMET), FY01	AMERICAN LANGUAGE COURSE		Air Force Chief of Staff of the Air Force Gbesia Air Base, Conakry, GV	3/19/01	2001-03-19	7/13/01	2001-07-13	LACKLAND AFB, TX 78236	1	11916	https://2009-2017.state.gov/documents/organization/10964.pdf	Not checked against source; verify accuracy before use	2002-03	2019-07-16	5c6b79a4811303ece0393aeadaf02e69
867d3a99-2723-4727-9ce1-77f08030eeba	03221d24-92ea-4ccc-a6a2-bd88dbfcd9fb	2001_2002_Africa_fmtrpt.tsv	Guinea	GIN	DoS Africa Region, Guinea, International Military Education and Training (IMET), FY01	AMERICAN LANGUAGE COURSE		Air Force: Chief of Staff of the Air Force Gbesia Air base, Conakry, GV	6/11/01	2001-06-11	9/7/01	2001-09-07	LACKLAND AFB, TX 78236	1	11104	https://2009-2017.state.gov/documents/organization/10964.pdf	Not checked against source; verify accuracy before use	2002-03	2019-07-16	b623098946d04c1faf20cbeae604b35b
fa649329-3db0-456b-9d9b-39bbfede5c57	03221d24-92ea-4ccc-a6a2-bd88dbfcd9fb	2001_2002_Africa_fmtrpt.tsv	Guinea	GIN	DoS Africa Region, Guinea, International Military Education and Training (IMET), FY01	DRMI SEMINAR - OVERSEAS		Navy	6/4/01	2001-06-04	6/15/01	2001-06-15	Guinea	1	4328	https://2009-2017.state.gov/documents/organization/10964.pdf	Not checked against source; verify accuracy before use	2002-03	2019-07-16	9464f97959f2c52270b925e36bee033e
621dbf0f-7672-4c50-ab3c-a781467792e7	03221d24-92ea-4ccc-a6a2-bd88dbfcd9fb	2001_2002_Africa_fmtrpt.tsv	Guinea	GIN	Africa Region, Guinea, International Military Education and Training (IMET), FY01	DRMI SEMINAR - OVERSEAS		Navy	6/4/01	2001-06-04	6/15/01	2001-06-15	Guinea	1	4328	https://2009-2017.state.gov/documents/organization/10964.pdf	Not checked against source; verify accuracy before use	2002-03	2019-07-16	8338bc67aacf6c8dc828f5a25300cc34
0fec1c4c-530d-439a-a733-dfdfe99b7298	03221d24-92ea-4ccc-a6a2-bd88dbfcd9fb	2001_2002_Africa_fmtrpt.tsv	Guinea	GIN	Africa Region, Guinea, International Military Education and Training (IMET), FY01	ENGLISH LANGUAGE CRSE		Army Chief of Staff of the Army, Camp Samory Conakry	3/26/01	2001-03-26	7/20/01	2001-07-20	SAN ANTONIO TX 78236-5259	1	11962	https://2009-2017.state.gov/documents/organization/10964.pdf	Not checked against source; verify accuracy before use	2002-03	2019-07-16	8371263274f5f3e5dadf2988d5b0a3fb
968a4591-a62e-4c5b-9dfc-545f12a7ddb0	03221d24-92ea-4ccc-a6a2-bd88dbfcd9fb	2001_2002_Africa_fmtrpt.tsv	Guinea	GIN	Africa Region, Guinea, International Military Education and Training (IMET), FY01	INFORMATION MANAGEMENT		Air Force Chief of Staff of the Air	7/16/01	2001-07-16	9/5/01	2001-09-05	KEESLER AFB, MS 39534-2354	1	2767	https://2009-2017.state.gov/documents/organization/10964.pdf	Not checked against source; verify accuracy before use	2002-03	2019-07-16	be4ff17a676e3c4bd92f6d979ec9c45e
31909db9-abc1-4ce9-a603-22e41d97d944	03221d24-92ea-4ccc-a6a2-bd88dbfcd9fb	2001_2002_Africa_fmtrpt.tsv	Guinea	GIN	Africa Region, Guinea, International Military Education and Training (IMET), FY01	APR		Force Gbesia Air Base, Conakry, GV								https://2009-2017.state.gov/documents/organization/10964.pdf	Not checked against source; verify accuracy before use	2002-03	2019-07-16	3484f4da83a9177380d294fe6e0ccc9f
71c72473-440f-45f7-920c-33bd98971fcd	03221d24-92ea-4ccc-a6a2-bd88dbfcd9fb	2001_2002_Africa_fmtrpt.tsv	Guinea	GIN	Africa Region, Guinea, International Military Education and Training (IMET), FY01	MET DIILS		35 participants from the Navy HQ.	3/19/01	2001-03-19	3/23/01	2001-03-23	Guinea	71	28850	https://2009-2017.state.gov/documents/organization/10964.pdf	Not checked against source; verify accuracy before use	2002-03	2019-07-16	13d50f5eec0ecc75aa74773e07152b34
3d36bce7-0d9c-4568-bd92-a19b89197522	03221d24-92ea-4ccc-a6a2-bd88dbfcd9fb	2001_2002_Africa_fmtrpt.tsv	Guinea	GIN	Africa Region, Guinea, International Military Education and Training (IMET), FY01	OBSERVER (ECL70)		Air Force Chief of Staff of the Air Force Gbesia Air Base, Conakry, GV	10/6/00	2000-10-06	10/19/00	2000-10-19	SHEPPARD AFB TX 76311-2367	1	678	https://2009-2017.state.gov/documents/organization/10964.pdf	Not checked against source; verify accuracy before use	2002-03	2019-07-16	65b7dfd80ec49cbc348adc6757b68f74
839184f9-45ab-4ac0-a60c-931cbff508b3	03221d24-92ea-4ccc-a6a2-bd88dbfcd9fb	2001_2002_Africa_fmtrpt.tsv	Guinea	GIN	Africa Region, Guinea, International Military Education and Training (IMET), FY01	TAT-LANGUAGE LAB INSTALL		Army: Installed at Camp Alpha Yaya, Guinea	8/1/01	2001-08-01	9/30/01	2001-09-30	Guinea	0	18000	https://2009-2017.state.gov/documents/organization/10964.pdf	Not checked against source; verify accuracy before use	2002-03	2019-07-16	86e79fa0a58939718ad939f10ba33173
e2ebafe3-8c4d-4d06-8c8d-8c151d40dd2d	03221d24-92ea-4ccc-a6a2-bd88dbfcd9fb	2001_2002_Africa_fmtrpt.tsv	Guinea	GIN	DoS Africa Region, Guinea, Africa Center for Strategic Studies, FY01	Senior Leader Seminar		MOD	1/29/01	2001-01-29	2/9/01	2001-02-09	Libreville Gabon	2	8355	https://2009-2017.state.gov/documents/organization/10964.pdf	Not checked against source; verify accuracy before use	2002-03	2019-07-16	8772df9bfe4101612d9e65b907582d69
800040b7-79de-4deb-97fe-b1a0b57ee942	03221d24-92ea-4ccc-a6a2-bd88dbfcd9fb	2001_2002_Africa_fmtrpt.tsv	Guinea	GIN	DoS Africa Region, Guinea, Africa Center for Strategic Studies, FY01	Sub-Regional Seminar		MOD MFA	8/20/01	2001-08-20	8/24/01	2001-08-24	Accra Ghana	3	5655	https://2009-2017.state.gov/documents/organization/10964.pdf	Not checked against source; verify accuracy before use	2002-03	2019-07-16	e9928c4de6242d9aad18ad3fdea2ff01
3213ce88-23e2-4068-9572-60e8ada76b2a	03221d24-92ea-4ccc-a6a2-bd88dbfcd9fb	2001_2002_Africa_fmtrpt.tsv	Guinea - Bissau	GNB	DoS Africa Region, Guinea - Bissau, International Military Education and Training (IMET), FY01	ENGLISH LANGUAGE CRSE		Cancellation - Delete	2/19/01	2001-02-19	7/6/01	2001-07-06	SAN ANTONIO TX 78236-5259	1	2483	https://2009-2017.state.gov/documents/organization/10964.pdf	Not checked against source; verify accuracy before use	2002-03	2019-07-16	15c893ab52f5c5dfcc78d1d2f99d3251
4c5220d1-7bea-4919-80d9-94b8b49bcc6d	03221d24-92ea-4ccc-a6a2-bd88dbfcd9fb	2001_2002_Africa_fmtrpt.tsv	Guinea - Bissau	GNB	DoS Africa Region, Guinea - Bissau, Africa Center for Strategic Studies, FY01	Senior Leader Seminar		MOD	1/29/01	2001-01-29	2/9/01	2001-02-09	Libreville Gabon	2	7464	https://2009-2017.state.gov/documents/organization/10964.pdf	Not checked against source; verify accuracy before use	2002-03	2019-07-16	fe5ff562390d988345a260d8b4e6131a
c7a578ca-dca0-4e44-975a-4211e07b25d3	03221d24-92ea-4ccc-a6a2-bd88dbfcd9fb	2001_2002_Africa_fmtrpt.tsv	Guinea - Bissau	GNB	DoS Africa Region, Guinea - Bissau, Africa Center for Strategic Studies, FY01	Sub-Regional Seminar		MOD MFA	8/20/01	2001-08-20	8/24/01	2001-08-24	Accra Ghana	1	6510	https://2009-2017.state.gov/documents/organization/10964.pdf	Not checked against source; verify accuracy before use	2002-03	2019-07-16	df78804f526a47c7b0009c78b51e02c3
7705808b-957e-44d0-9bba-1f66e46fb113	03221d24-92ea-4ccc-a6a2-bd88dbfcd9fb	2001_2002_Africa_fmtrpt.tsv	Kenya	KEN	DoS Africa Region, Kenya, Non-Security Assistance, Unified Command (Note 4), FY01	Port Vul/Sec Assess	USCG International Training Division	Kenya Navy Port Authority Reps	3/19/01	2001-03-19	3/23/01	2001-03-23	Mombasa, KE	30	50000	https://2009-2017.state.gov/documents/organization/10964.pdf	Not checked against source; verify accuracy before use	2002-03	2019-07-16	ec99cfd90cbdcc85d2957bf332ab5387
a99d0ab7-cb90-4648-8e06-f3c707fcfd68	03221d24-92ea-4ccc-a6a2-bd88dbfcd9fb	2001_2002_Africa_fmtrpt.tsv	Kenya	KEN	DoS Africa Region, Kenya, International Military Education and Training (IMET), FY01	AEROSPACE GRD EQ TECHN		TECHNICAL WING - LAIKIPIA AIR BASE	1/16/01	2001-01-16	2/27/01	2001-02-27	SHEPPARD AFB TX 76311-2367	1	2658	https://2009-2017.state.gov/documents/organization/10964.pdf	Not checked against source; verify accuracy before use	2002-03	2019-07-16	28aa065508e5c371af8297f0b7bd7dcc
d27e7f8c-67b0-40a6-b1a0-c02a3bc8e290	03221d24-92ea-4ccc-a6a2-bd88dbfcd9fb	2001_2002_Africa_fmtrpt.tsv	Kenya	KEN	Africa Region, Kenya, International Military Education and Training (IMET), FY01	AIR DEF ARTY OFF ADV		KDOD Army	5/9/01	2001-05-09	9/14/01	2001-09-14	FT BLISS TX 79916-1001	1	10900	https://2009-2017.state.gov/documents/organization/10964.pdf	Not checked against source; verify accuracy before use	2002-03	2019-07-16	77817c2d097d2f757a7213e1ba01f410
39a3e280-2ed1-481f-818d-7625558dc6c5	03221d24-92ea-4ccc-a6a2-bd88dbfcd9fb	2001_2002_Africa_fmtrpt.tsv	Kenya	KEN	Africa Region, Kenya, International Military Education and Training (IMET), FY01	ALLIED OFF PREP-INF OAC		KA - Infantry (AFTC)	1/8/01	2001-01-08	1/12/01	2001-01-12	FT BENNING GA 31905-5468	1	3841	https://2009-2017.state.gov/documents/organization/10964.pdf	Not checked against source; verify accuracy before use	2002-03	2019-07-16	a7e907263d8abfb4b7bc3f8d24cf88cd
36e23bb3-aada-4be7-87d2-f701dc4450fd	03221d24-92ea-4ccc-a6a2-bd88dbfcd9fb	2001_2002_Africa_fmtrpt.tsv	Kenya	KEN	Africa Region, Kenya, International Military Education and Training (IMET), FY01	ARMOR CAPTAINS CAREER		KDOD Army	5/7/01	2001-05-07	9/14/01	2001-09-14	FT KNOX KY 40121-5234	1	11005	https://2009-2017.state.gov/documents/organization/10964.pdf	Not checked against source; verify accuracy before use	2002-03	2019-07-16	4d5c9c8a29622387feca187263affa04
14c81741-b1a6-46f0-871c-6bf327b4a5c5	03221d24-92ea-4ccc-a6a2-bd88dbfcd9fb	2001_2002_Africa_fmtrpt.tsv	Kenya	KEN	Africa Region, Kenya, International Military Education and Training (IMET), FY01	ARMOR CPT CAREER CRS PREP		KDOD Army	4/16/01	2001-04-16	5/4/01	2001-05-04	FT KNOX KY 40121-5234	1	6072	https://2009-2017.state.gov/documents/organization/10964.pdf	Not checked against source; verify accuracy before use	2002-03	2019-07-16	346cf5578f169a2506f6d1fb015c398f
5ef3e238-4984-4dbd-a75c-7c222f48d21e	03221d24-92ea-4ccc-a6a2-bd88dbfcd9fb	2001_2002_Africa_fmtrpt.tsv	Kenya	KEN	Africa Region, Kenya, International Military Education and Training (IMET), FY01	BASIC MANPOWER & QUAL MGT		KDOD Navy	5/8/01	2001-05-08	6/26/01	2001-06-26	KEESLER AFB, MS 39534-2354	1	2727	https://2009-2017.state.gov/documents/organization/10964.pdf	Not checked against source; verify accuracy before use	2002-03	2019-07-16	abb1791f96b186a03d5bd07569ed9fdb
77e7e315-422f-4a1c-b52a-cecd6e44f6a2	03221d24-92ea-4ccc-a6a2-bd88dbfcd9fb	2001_2002_Africa_fmtrpt.tsv	Kenya	KEN	Africa Region, Kenya, International Military Education and Training (IMET), FY01	BASIC PERSONNEL OFFICER		KDOD Navy	7/2/01	2001-07-02	8/2/01	2001-08-02	KEESLER AFB, MS 39534-2354	1	2159	https://2009-2017.state.gov/documents/organization/10964.pdf	Not checked against source; verify accuracy before use	2002-03	2019-07-16	e286727216b6713371b56cdcfd0361d7
3ccc6b76-c59f-4fb9-8878-924abc2dedcb	03221d24-92ea-4ccc-a6a2-bd88dbfcd9fb	2001_2002_Africa_fmtrpt.tsv	Kenya	KEN	Africa Region, Kenya, International Military Education and Training (IMET), FY01	CIV-MIL SID - AFRICA		Air Force	10/16/00	2000-10-16	10/27/00	2000-10-27	HURLBURT FIELD, FL 32544-5826	1	895	https://2009-2017.state.gov/documents/organization/10964.pdf	Not checked against source; verify accuracy before use	2002-03	2019-07-16	394d14db19e1c79f651b6a1daa4e85e6
690a2a3e-a9b0-4c8a-a1c6-433c710cf94c	03221d24-92ea-4ccc-a6a2-bd88dbfcd9fb	2001_2002_Africa_fmtrpt.tsv	Kenya	KEN	Africa Region, Kenya, International Military Education and Training (IMET), FY01	CIV-MIL SID - AFRICA		Air Force	10/16/00	2000-10-16	10/27/00	2000-10-27	HURLBURT FIELD, FL 32544-5826	1	895	https://2009-2017.state.gov/documents/organization/10964.pdf	Not checked against source; verify accuracy before use	2002-03	2019-07-16	394d14db19e1c79f651b6a1daa4e85e6
49f0ce94-48fd-46d2-b4ea-66a1cfeebac4	03221d24-92ea-4ccc-a6a2-bd88dbfcd9fb	2001_2002_Africa_fmtrpt.tsv	Kenya	KEN	Africa Region, Kenya, International Military Education and Training (IMET), FY01	CIVIL AFFAIRS		Kenyan DOD Army	2/12/01	2001-02-12	3/16/01	2001-03-16	FT BRAGG NC 28310	1	2899	https://2009-2017.state.gov/documents/organization/10964.pdf	Not checked against source; verify accuracy before use	2002-03	2019-07-16	3859efd301d1dbe3cff856c1877f9b6a
ba74787f-30c0-4d9e-9820-8768333e628d	03221d24-92ea-4ccc-a6a2-bd88dbfcd9fb	2001_2002_Africa_fmtrpt.tsv	Kenya	KEN	Africa Region, Kenya, International Military Education and Training (IMET), FY01	COMBINED LOG CPT CAREER		Kenya Army/SOT	1/17/01	2001-01-17	3/2/01	2001-03-02	FT LEE VA 23801-1705	1	3775	https://2009-2017.state.gov/documents/organization/10964.pdf	Not checked against source; verify accuracy before use	2002-03	2019-07-16	aaac22c92a3234972e5b9560b37de52f
003875ed-257b-4125-ad8b-bf881cc4ccac	03221d24-92ea-4ccc-a6a2-bd88dbfcd9fb	2001_2002_Africa_fmtrpt.tsv	Kenya	KEN	Africa Region, Kenya, International Military Education and Training (IMET), FY01	COMBINED LOG CPT CAREER		Kenya Army/SOT	4/10/01	2001-04-10	5/24/01	2001-05-24	FT LEE VA 23801-1705	1	4026	https://2009-2017.state.gov/documents/organization/10964.pdf	Not checked against source; verify accuracy before use	2002-03	2019-07-16	ec2ee63d8475d9462672b42c62343bd4
00a68828-d5c8-42d4-89d5-e58b39fdbaf5	03221d24-92ea-4ccc-a6a2-bd88dbfcd9fb	2001_2002_Africa_fmtrpt.tsv	Kenya	KEN	Africa Region, Kenya, International Military Education and Training (IMET), FY01	COMBINED LOG OFF		Kenya Army/SOT	3/5/01	2001-03-05	4/6/01	2001-04-06	FT EUSTIS VA 23604-5481	1	3845	https://2009-2017.state.gov/documents/organization/10964.pdf	Not checked against source; verify accuracy before use	2002-03	2019-07-16	cb8011d05d33d235d9311e659998f3f7
b23deff0-98f7-45a3-9586-56a6f3d5e4d2	03221d24-92ea-4ccc-a6a2-bd88dbfcd9fb	2001_2002_Africa_fmtrpt.tsv	Kenya	KEN	Africa Region, Kenya, International Military Education and Training (IMET), FY01	COMM & INFO OFFICER (BCOT)		KDOD Navy	2/5/01	2001-02-05	5/4/01	2001-05-04	KEESLER AFB, MS 39534-2354	1	7768	https://2009-2017.state.gov/documents/organization/10964.pdf	Not checked against source; verify accuracy before use	2002-03	2019-07-16	dac32f70f3fe605085d7072ebe482524
3bd313c6-ce05-4d78-863d-e78ca59a5bdd	03221d24-92ea-4ccc-a6a2-bd88dbfcd9fb	2001_2002_Africa_fmtrpt.tsv	Kenya	KEN	Africa Region, Kenya, International Military Education and Training (IMET), FY01	CONTR BRIDGE SIMULATOR		Kenya Navy Fleet	8/16/01	2001-08-16	8/17/01	2001-08-17	SAN DIEGO, CA 92155-5490	1	3945	https://2009-2017.state.gov/documents/organization/10964.pdf	Not checked against source; verify accuracy before use	2002-03	2019-07-16	bdabe026e789dafd1fc94b4294581354
2682f25d-ad4b-4e54-a242-106b2fd1e6d0	03221d24-92ea-4ccc-a6a2-bd88dbfcd9fb	2001_2002_Africa_fmtrpt.tsv	Kenya	KEN	Africa Region, Kenya, International Military Education and Training (IMET), FY01	ELECTRONIC PRINCIPLES		Moi Air Base, Tech Maintenance Unit	3/12/01	2001-03-12	7/16/01	2001-07-16	KEESLER AFB, MS 39534-2354	1	6096	https://2009-2017.state.gov/documents/organization/10964.pdf	Not checked against source; verify accuracy before use	2002-03	2019-07-16	2fb2d6c879fedc2a0d8356a3c52f738c
eb9286de-08fc-49ac-a317-cf9d4440142a	03221d24-92ea-4ccc-a6a2-bd88dbfcd9fb	2001_2002_Africa_fmtrpt.tsv	Kenya	KEN	Africa Region, Kenya, International Military Education and Training (IMET), FY01	ENGINEER OFF CPT CAREER		KDOD Army	5/7/01	2001-05-07	9/12/01	2001-09-12	FT LEONARD WOOD MO 65473-5000	1	11100	https://2009-2017.state.gov/documents/organization/10964.pdf	Not checked against source; verify accuracy before use	2002-03	2019-07-16	2ad7cc04bd75a85d70f21a7b61ddfbe7
f8c1586c-fdd6-474d-9a1a-5c718f1ff6c3	03221d24-92ea-4ccc-a6a2-bd88dbfcd9fb	2001_2002_Africa_fmtrpt.tsv	Kenya	KEN	Africa Region, Kenya, International Military Education and Training (IMET), FY01	INFANTRY CAPTS CAREER CRS		KA - Infantry (AFTC)	1/16/01	2001-01-16	5/22/01	2001-05-22	FT BENNING GA 31905-5468	1	10379	https://2009-2017.state.gov/documents/organization/10964.pdf	Not checked against source; verify accuracy before use	2002-03	2019-07-16	79182550f6c13c51bb50261e80e52c04
834ab3b5-fc42-42a3-821a-bd80c905a526	03221d24-92ea-4ccc-a6a2-bd88dbfcd9fb	2001_2002_Africa_fmtrpt.tsv	Kenya	KEN	Africa Region, Kenya, International Military Education and Training (IMET), FY01	INSTRUCTOR TRAINING		KAF - Military Police	7/9/01	2001-07-09	7/27/01	2001-07-27	FT LEONARD WOOD MO 65473-5000	1	1940	https://2009-2017.state.gov/documents/organization/10964.pdf	Not checked against source; verify accuracy before use	2002-03	2019-07-16	a20717e04524b1589d540295ab5cc5dc
62af8e1e-1a43-40aa-8e87-e412664a90c9	03221d24-92ea-4ccc-a6a2-bd88dbfcd9fb	2001_2002_Africa_fmtrpt.tsv	Kenya	KEN	Africa Region, Kenya, International Military Education and Training (IMET), FY01	INT OFFICER INTEL ADVANCE		Kenyan Army Intelligence	1/18/01	2001-01-18	5/4/01	2001-05-04	FT HUACHUCA AZ 85613-7000	1	17968	https://2009-2017.state.gov/documents/organization/10964.pdf	Not checked against source; verify accuracy before use	2002-03	2019-07-16	25d869a7ed85dabac06db174f52e8f3a
60afaa0a-8b04-4b99-874c-622e282e28f3	03221d24-92ea-4ccc-a6a2-bd88dbfcd9fb	2001_2002_Africa_fmtrpt.tsv	Kenya	KEN	Africa Region, Kenya, International Military Education and Training (IMET), FY01	INTERNATIONAL OAC PREP		KDOD Army	4/23/01	2001-04-23	5/4/01	2001-05-04	FT BLISS TX 79916-1001	1	4387	https://2009-2017.state.gov/documents/organization/10964.pdf	Not checked against source; verify accuracy before use	2002-03	2019-07-16	3a85f431a61671f09383c04e9589b94d
4682b81a-4637-4791-9580-b6d35d2c69b6	03221d24-92ea-4ccc-a6a2-bd88dbfcd9fb	2001_2002_Africa_fmtrpt.tsv	Kenya	KEN	Africa Region, Kenya, International Military Education and Training (IMET), FY01	INTERNATIONAL OFF LOG PREP		Kenya Army/SOT	1/2/01	2001-01-02	1/12/01	2001-01-12	FT LEE VA 23801-1705	1	4633	https://2009-2017.state.gov/documents/organization/10964.pdf	Not checked against source; verify accuracy before use	2002-03	2019-07-16	5fd262848a36a00765e20b3ef93bd476
55ccf3a2-f444-4809-bc43-c4eae971b19a	03221d24-92ea-4ccc-a6a2-bd88dbfcd9fb	2001_2002_Africa_fmtrpt.tsv	Kenya	KEN	Africa Region, Kenya, International Military Education and Training (IMET), FY01	INTERNATIONAL OFFICER PREP		KDOD Army Engineers	6/19/01	2001-06-19	7/6/01	2001-07-06	FT LEAVENWORTH KS 66027-1352	1	5149	https://2009-2017.state.gov/documents/organization/10964.pdf	Not checked against source; verify accuracy before use	2002-03	2019-07-16	a98ab384c470bb644b9f1d70d4bbef28
5eac33df-665d-453d-a3f1-86421c3e882c	03221d24-92ea-4ccc-a6a2-bd88dbfcd9fb	2001_2002_Africa_fmtrpt.tsv	Kenya	KEN	Africa Region, Kenya, International Military Education and Training (IMET), FY01	INTL OFF SCH (FOR AC&SC)		Moi Air Base, HQW	6/18/01	2001-06-18	7/27/01	2001-07-27	MAXWELL AFB, AL 36112-6323	1	9247	https://2009-2017.state.gov/documents/organization/10964.pdf	Not checked against source; verify accuracy before use	2002-03	2019-07-16	59291d22021811e3a6f8afcfca962f0d
bba269d8-4f8c-4bf3-afd1-a20a04683afd	03221d24-92ea-4ccc-a6a2-bd88dbfcd9fb	2001_2002_Africa_fmtrpt.tsv	Kenya	KEN	Africa Region, Kenya, International Military Education and Training (IMET), FY01	INTL OFF SCH (FOR AWC)		KHQ Air Force	6/11/01	2001-06-11	7/20/01	2001-07-20	MAXWELL AFB, AL 36112-6323	1	9357	https://2009-2017.state.gov/documents/organization/10964.pdf	Not checked against source; verify accuracy before use	2002-03	2019-07-16	8d9d78fe0718ff9225bfe11cd6b62775
eda0e051-e5f7-494b-89c0-e21f2c70bdcb	03221d24-92ea-4ccc-a6a2-bd88dbfcd9fb	2001_2002_Africa_fmtrpt.tsv	Kenya	KEN	Africa Region, Kenya, International Military Education and Training (IMET), FY01	MET DRMI - OVERSEAS		KDOD Army, AF, Navy	10/23/00	2000-10-23	11/3/00	2000-11-03	Kenya	38	92278	https://2009-2017.state.gov/documents/organization/10964.pdf	Not checked against source; verify accuracy before use	2002-03	2019-07-16	2428fab1a59a43665a6e44356edf3d55
dcf7be10-7bcf-4240-a4cd-b9433f54f478	03221d24-92ea-4ccc-a6a2-bd88dbfcd9fb	2001_2002_Africa_fmtrpt.tsv	Kenya	KEN	Africa Region, Kenya, International Military Education and Training (IMET), FY01	MILITARY POLICE CPT CAREER		KAF - Military Police	11/13/00	2000-11-13	4/4/01	2001-04-04	FT LEONARD WOOD MO 65473-5000	1	11349	https://2009-2017.state.gov/documents/organization/10964.pdf	Not checked against source; verify accuracy before use	2002-03	2019-07-16	52c8084b2d033f2be709c10340f00a46
20544f09-04dc-47c3-92a6-b7491559e4fc	03221d24-92ea-4ccc-a6a2-bd88dbfcd9fb	2001_2002_Africa_fmtrpt.tsv	Kenya	KEN	Africa Region, Kenya, International Military Education and Training (IMET), FY01	MILITARY POLICE INVESTIG		KAF - Military Police	4/18/01	2001-04-18	6/13/01	2001-06-13	FT LEONARD WOOD MO 65473-5000	1	4544	https://2009-2017.state.gov/documents/organization/10964.pdf	Not checked against source; verify accuracy before use	2002-03	2019-07-16	94b59160b4688791bb8ee92a33798362
c9d8194a-ae12-4f69-bf92-c5db2e834315	03221d24-92ea-4ccc-a6a2-bd88dbfcd9fb	2001_2002_Africa_fmtrpt.tsv	Kenya	KEN	Africa Region, Kenya, International Military Education and Training (IMET), FY01	OAC INTL STUDENT ENGR PREP		KDOD Army	4/30/01	2001-04-30	5/4/01	2001-05-04	FT LEONARD WOOD MO 65473-5000	1	3870	https://2009-2017.state.gov/documents/organization/10964.pdf	Not checked against source; verify accuracy before use	2002-03	2019-07-16	9359fbcc9a77112a868dd507a03fc6c4
299716f9-71c0-4934-8dcc-a09b53443e0c	03221d24-92ea-4ccc-a6a2-bd88dbfcd9fb	2001_2002_Africa_fmtrpt.tsv	Kenya	KEN	Africa Region, Kenya, International Military Education and Training (IMET), FY01	OAC INTL STUDENT MP PREP		KAF - Military Police	11/6/00	2000-11-06	11/10/00	2000-11-10	FT LEONARD WOOD MO 65473-5000	1	3980	https://2009-2017.state.gov/documents/organization/10964.pdf	Not checked against source; verify accuracy before use	2002-03	2019-07-16	71166b6df400cc2d8cb60aa7956e58dc
377b813b-7f96-456c-ab50-6c9e033a241e	03221d24-92ea-4ccc-a6a2-bd88dbfcd9fb	2001_2002_Africa_fmtrpt.tsv	Kenya	KEN	Africa Region, Kenya, International Military Education and Training (IMET), FY01	OJT AFLOAT CONUS - PACFLT		Kenya Navy Fleet	8/20/01	2001-08-20	9/21/01	2001-09-21		1	1900	https://2009-2017.state.gov/documents/organization/10964.pdf	Not checked against source; verify accuracy before use	2002-03	2019-07-16	fa7c18fe99510f185a37c58111386580
c8e6e75a-0fde-4961-ab4c-bd440217b4f6	03221d24-92ea-4ccc-a6a2-bd88dbfcd9fb	2001_2002_Africa_fmtrpt.tsv	Kenya	KEN	Africa Region, Kenya, International Military Education and Training (IMET), FY01	OJT OPERATIONS TNG-CONUS		KAF - Military Police	6/15/01	2001-06-15	7/6/01	2001-07-06	FT LEONARD WOOD MO 65473-5000	1	1815	https://2009-2017.state.gov/documents/organization/10964.pdf	Not checked against source; verify accuracy before use	2002-03	2019-07-16	9063810ee8320ccfcd55ebf5991b7ec9
f0e5fb7d-0edb-477b-9394-7836012b03b7	03221d24-92ea-4ccc-a6a2-bd88dbfcd9fb	2001_2002_Africa_fmtrpt.tsv	Kenya	KEN	Africa Region, Kenya, International Military Education and Training (IMET), FY01	PMEL APPRENTICE (USAF)		Moi Air Base, Tech Maintenance Unit	7/23/01	2001-07-23	9/20/01	2001-09-20	KEESLER AFB, MS 39534-2354	1	4220	https://2009-2017.state.gov/documents/organization/10964.pdf	Not checked against source; verify accuracy before use	2002-03	2019-07-16	04cc11232e2a34bdf85cce3ab5a8ac6b
6bf4245b-baab-41ac-b06f-9e7169da5e29	03221d24-92ea-4ccc-a6a2-bd88dbfcd9fb	2001_2002_Africa_fmtrpt.tsv	Kenya	KEN	Africa Region, Kenya, International Military Education and Training (IMET), FY01	PSYCHOLOGICAL OPERATIONS		Kenyan DOD Army	1/8/01	2001-01-08	2/9/01	2001-02-09	FT BRAGG NC 28310	1	5739	https://2009-2017.state.gov/documents/organization/10964.pdf	Not checked against source; verify accuracy before use	2002-03	2019-07-16	bd0de14301090bb86080f6ee3abbee68
f7e35221-b92b-4a62-aada-e2527cd128ee	03221d24-92ea-4ccc-a6a2-bd88dbfcd9fb	2001_2002_Africa_fmtrpt.tsv	Kenya	KEN	Africa Region, Kenya, International Military Education and Training (IMET), FY01	SIG OFF ADV PREP-INTER OFF		Kenyan DOD Army	1/3/01	2001-01-03	1/19/01	2001-01-19	FT GORDON GA 30905-5154	1	5661	https://2009-2017.state.gov/documents/organization/10964.pdf	Not checked against source; verify accuracy before use	2002-03	2019-07-16	a80f860e3dabb915b89b1562911beb1b
1f51a2c3-2afb-4365-a050-e573bb266c30	03221d24-92ea-4ccc-a6a2-bd88dbfcd9fb	2001_2002_Africa_fmtrpt.tsv	Kenya	KEN	Africa Region, Kenya, International Military Education and Training (IMET), FY01	SIGNAL CAPTAINS CAREER CRS		Kenyan DOD Army	1/22/01	2001-01-22	5/24/01	2001-05-24	FT GORDON GA 30905-5154	1	11222	https://2009-2017.state.gov/documents/organization/10964.pdf	Not checked against source; verify accuracy before use	2002-03	2019-07-16	96c3c29e947e4d022a3c36ec401fe087
5e7d50c3-2686-45b1-a0ad-73c382155e9d	03221d24-92ea-4ccc-a6a2-bd88dbfcd9fb	2001_2002_Africa_fmtrpt.tsv	Kenya	KEN	Africa Region, Kenya, International Military Education and Training (IMET), FY01	SPECIALIZED ENG LANG TNG		Moi Air Base, Tech Maintenance Unit	1/8/01	2001-01-08	3/9/01	2001-03-09	LACKLAND AFB, TX 78236	1	7280	https://2009-2017.state.gov/documents/organization/10964.pdf	Not checked against source; verify accuracy before use	2002-03	2019-07-16	870f0b3d03b6db8ec18c74215e3998a3
d7316577-de6a-4cf2-afc8-883c7b4ca406	03221d24-92ea-4ccc-a6a2-bd88dbfcd9fb	2001_2002_Africa_fmtrpt.tsv	Kenya	KEN	Africa Region, Kenya, International Military Education and Training (IMET), FY01	SWOS - INTL		Kenya Navy Fleet	4/30/01	2001-04-30	8/13/01	2001-08-13	SAN DIEGO, CA 92155-5099	1	11585	https://2009-2017.state.gov/documents/organization/10964.pdf	Not checked against source; verify accuracy before use	2002-03	2019-07-16	9c1ff2db05da27a9307cc7d7fadc5cc4
1079b7be-f0ae-424b-be39-7b458bb7e1ac	03221d24-92ea-4ccc-a6a2-bd88dbfcd9fb	2001_2002_Africa_fmtrpt.tsv	Kenya	KEN	Africa Region, Kenya, International Military Education and Training (IMET), FY01	USA C&GSC OFF PREPARATORY		KDOD Army Engineers	7/9/01	2001-07-09	7/20/01	2001-07-20	FT LEAVENWORTH KS 66027-1352	1	1590	https://2009-2017.state.gov/documents/organization/10964.pdf	Not checked against source; verify accuracy before use	2002-03	2019-07-16	1088f8e3387462a315a5cd6d09dad9b3
540019c5-2752-445f-8451-4e8e0fa9f98b	03221d24-92ea-4ccc-a6a2-bd88dbfcd9fb	2001_2002_Africa_fmtrpt.tsv	Kenya	KEN	DoS Africa Region, Kenya, Section 506 (Note 1), FY01	MTT PORT SECURITY, VUL ASM		Kenyan Navy	3/19/01	2001-03-19	3/23/01	2001-03-23	Kenya	27	0	https://2009-2017.state.gov/documents/organization/10964.pdf	Not checked against source; verify accuracy before use	2002-03	2019-07-16	a2f3cbed6b44168cc1e7bd9d339107ca
46fb1e74-8440-459d-9e97-50f243c928da	03221d24-92ea-4ccc-a6a2-bd88dbfcd9fb	2001_2002_Africa_fmtrpt.tsv	Kenya	KEN	DoS Africa Region, Kenya, African Crisis Response Initiative, FY01	ACRI BRIGADE STAFF INITIAL	MARCENT	ARMY	4/2/01	2001-04-02	5/25/01	2001-05-25	KENYA	360	1600000	https://2009-2017.state.gov/documents/organization/10964.pdf	Not checked against source; verify accuracy before use	2002-03	2019-07-16	1029472a417cb4b0c30a8d354ace05dd
d4b43d74-f5fb-4efd-a245-4a6b7d444b32	03221d24-92ea-4ccc-a6a2-bd88dbfcd9fb	2001_2002_Africa_fmtrpt.tsv	Kenya	KEN	DoS Africa Region, Kenya, African Crisis Response Initiative, FY01	ACRI FT-1	5TH SFGA	ARMY	5/15/01	2001-05-15	6/12/01	2001-06-12	KENYA	140	70000	https://2009-2017.state.gov/documents/organization/10964.pdf	Not checked against source; verify accuracy before use	2002-03	2019-07-16	60881fef9d15cd83526e92cb23c875e5
890886b5-18f8-4f1c-975b-627456d2f12e	03221d24-92ea-4ccc-a6a2-bd88dbfcd9fb	2001_2002_Africa_fmtrpt.tsv	Kenya	KEN	DoS Africa Region, Kenya, African Crisis Response Initiative, FY01	ACRI INITIAL TRAINING	5TH SFGA	ARMY	10/2/00	2000-10-02	12/1/00	2000-12-01	KENYA	800	800000	https://2009-2017.state.gov/documents/organization/10964.pdf	Not checked against source; verify accuracy before use	2002-03	2019-07-16	0d72d21e18bc0a0b8bfa54821d940e29
e6754eff-7452-4591-953b-1d2dc8f89622	03221d24-92ea-4ccc-a6a2-bd88dbfcd9fb	2001_2002_Africa_fmtrpt.tsv	Kenya	KEN	DoS Africa Region, Kenya, Africa Center for Strategic Studies, FY01	Senior Leader Seminar		MOD Civilian Government Ministry of National Security	1/29/01	2001-01-29	2/9/01	2001-02-09	Libreville Gabon	2	8841	https://2009-2017.state.gov/documents/organization/10964.pdf	Not checked against source; verify accuracy before use	2002-03	2019-07-16	502662677397a5db9f371e30b94eb790
63ed3592-d853-480f-9f9c-8842da075959	03221d24-92ea-4ccc-a6a2-bd88dbfcd9fb	2001_2002_Africa_fmtrpt.tsv	Lesotho	LSO	DoS Africa Region, Lesotho, International Military Education and Training (IMET), FY01	AMEDD OBC ALL CORPS (MS)		Military Hospital	7/16/01	2001-07-16	9/28/01	2001-09-28	FT SAM HOUSTON TX 78234-6100	1	11999	https://2009-2017.state.gov/documents/organization/10964.pdf	Not checked against source; verify accuracy before use	2002-03	2019-07-16	6e5de6bf8e4400687c1e97c3c10c55f0
5a846793-b4ff-45de-8bf5-7c0783a17923	03221d24-92ea-4ccc-a6a2-bd88dbfcd9fb	2001_2002_Africa_fmtrpt.tsv	Lesotho	LSO	DoS Africa Region, Lesotho, International Military Education and Training (IMET), FY01	CIV-MIL SID - AFRICA		Air Force	10/16/00	2000-10-16	10/27/00	2000-10-27	HURLBURT FIELD, FL 32544-5826	1	1790	https://2009-2017.state.gov/documents/organization/10964.pdf	Not checked against source; verify accuracy before use	2002-03	2019-07-16	954b2d3213425d466a1378d59ece5228
519b6b59-b555-4cc4-b930-0b179553fe1f	03221d24-92ea-4ccc-a6a2-bd88dbfcd9fb	2001_2002_Africa_fmtrpt.tsv	Lesotho	LSO	DoS Africa Region, Lesotho, International Military Education and Training (IMET), FY01	CIV-MIL SID - AFRICA		Military School	10/16/00	2000-10-16	10/27/00	2000-10-27	HURLBURT FIELD, FL 32544-5826	1	6032	https://2009-2017.state.gov/documents/organization/10964.pdf	Not checked against source; verify accuracy before use	2002-03	2019-07-16	2532e5b2dbf261e793c5889718d45266
b8772fb1-c9c3-4d81-9451-6ad710258780	03221d24-92ea-4ccc-a6a2-bd88dbfcd9fb	2001_2002_Africa_fmtrpt.tsv	Lesotho	LSO	DoS Africa Region, Lesotho, International Military Education and Training (IMET), FY01	CIVIL AFFAIRS		Air Wing	2/12/01	2001-02-12	3/16/01	2001-03-16	FT BRAGG NC 28310	1	6700	https://2009-2017.state.gov/documents/organization/10964.pdf	Not checked against source; verify accuracy before use	2002-03	2019-07-16	40aeeefcc5b91d9370be0cc95d612408
093619d3-de1a-403b-be4f-ab943b4e1f65	03221d24-92ea-4ccc-a6a2-bd88dbfcd9fb	2001_2002_Africa_fmtrpt.tsv	Lesotho	LSO	DoS Africa Region, Lesotho, International Military Education and Training (IMET), FY01	MET CIV-MILITARY RELATIONS		Variopus departments (National Security Service, Military intelligence, media, political parties, NGOS, University, Police, Military hospital	8/20/01	2001-08-20	8/24/01	2001-08-24	Lesotho	48	28619	https://2009-2017.state.gov/documents/organization/10964.pdf	Not checked against source; verify accuracy before use	2002-03	2019-07-16	160a1fc0ef3a5b285830661e0f3bfd49
92855361-59de-426d-8fea-4587448e15ef	03221d24-92ea-4ccc-a6a2-bd88dbfcd9fb	2001_2002_Africa_fmtrpt.tsv	Lesotho	LSO	DoS Africa Region, Lesotho, International Military Education and Training (IMET), FY01	MET REGIONAL CIV-MIL RELS		Military hospital Quantity is 1 not 30	6/25/01	2001-06-25	6/29/01	2001-06-29	Lesotho	1	400	https://2009-2017.state.gov/documents/organization/10964.pdf	Not checked against source; verify accuracy before use	2002-03	2019-07-16	c1c2155f64531a959f00f5f1aae469ce
8687462f-f580-43c0-a87c-dce48bb0a35e	03221d24-92ea-4ccc-a6a2-bd88dbfcd9fb	2001_2002_Africa_fmtrpt.tsv	Lesotho	LSO	DoS Africa Region, Lesotho, International Military Education and Training (IMET), FY01	MET REGIONAL CIV-MIL RELS		Military Hospital Quantity is 1 not 30	6/25/01	2001-06-25	6/29/01	2001-06-29	Lesotho	1	400	https://2009-2017.state.gov/documents/organization/10964.pdf	Not checked against source; verify accuracy before use	2002-03	2019-07-16	5f0f6c836acfcacd211d2036a289ea2d
a3cf4625-f3fd-404e-bdcd-c8185287044f	03221d24-92ea-4ccc-a6a2-bd88dbfcd9fb	2001_2002_Africa_fmtrpt.tsv	Lesotho	LSO	DoS Africa Region, Lesotho, International Military Education and Training (IMET), FY01	MET REGIONAL DIILS		Logistics Quantity is 1 not 30	2/12/01	2001-02-12	2/16/01	2001-02-16	Lesotho	1	0	https://2009-2017.state.gov/documents/organization/10964.pdf	Not checked against source; verify accuracy before use	2002-03	2019-07-16	c3862cfd81ca80f4c6f3b2b6120b37c1
c04fbf81-23fa-4d22-9250-70485463197a	03221d24-92ea-4ccc-a6a2-bd88dbfcd9fb	2001_2002_Africa_fmtrpt.tsv	Lesotho	LSO	DoS Africa Region, Lesotho, International Military Education and Training (IMET), FY01	MET REGIONAL DIILS		Administration Quantity is 1 not 30	2/12/01	2001-02-12	2/16/01	2001-02-16	Lesotho	1	0	https://2009-2017.state.gov/documents/organization/10964.pdf	Not checked against source; verify accuracy before use	2002-03	2019-07-16	90dc9ea2c9c3639f08f9db92f6f78ad2
691c14c0-1e15-40e3-a181-d8f297818a54	03221d24-92ea-4ccc-a6a2-bd88dbfcd9fb	2001_2002_Africa_fmtrpt.tsv	Lesotho	LSO	DoS Africa Region, Lesotho, International Military Education and Training (IMET), FY01	MET REGIONAL DIILS		Legal Division Quantity is 1 not 30	2/12/01	2001-02-12	2/16/01	2001-02-16	Lesotho	1	0	https://2009-2017.state.gov/documents/organization/10964.pdf	Not checked against source; verify accuracy before use	2002-03	2019-07-16	43274fd4e8adb2a9ac0a32cae1bf797d
99c6706e-11e1-4adb-a519-340246338b39	03221d24-92ea-4ccc-a6a2-bd88dbfcd9fb	2001_2002_Africa_fmtrpt.tsv	Lesotho	LSO	DoS Africa Region, Lesotho, International Military Education and Training (IMET), FY01	MET REGIONAL DIILS		Legal Division Quantity is 1 not 30	2/12/01	2001-02-12	2/16/01	2001-02-16	Lesotho	1	0	https://2009-2017.state.gov/documents/organization/10964.pdf	Not checked against source; verify accuracy before use	2002-03	2019-07-16	43274fd4e8adb2a9ac0a32cae1bf797d
188d6826-3e76-459e-a616-229f859cf118	03221d24-92ea-4ccc-a6a2-bd88dbfcd9fb	2001_2002_Africa_fmtrpt.tsv	Lesotho	LSO	DoS Africa Region, Lesotho, International Military Education and Training (IMET), FY01	MET REGIONAL DIILS		Ministry of Defense Quantity is 1 not 30	2/12/01	2001-02-12	2/16/01	2001-02-16	Lesotho	1	0	https://2009-2017.state.gov/documents/organization/10964.pdf	Not checked against source; verify accuracy before use	2002-03	2019-07-16	339b5d386c361b89cfcf1af44fc17f6b
81f18e26-659e-4e22-a972-f9ab463f5b07	03221d24-92ea-4ccc-a6a2-bd88dbfcd9fb	2001_2002_Africa_fmtrpt.tsv	Lesotho	LSO	DoS Africa Region, Lesotho, International Military Education and Training (IMET), FY01	MET REGIONAL DIILS		Military hospital Quantity is 1 not 30	2/12/01	2001-02-12	2/16/01	2001-02-16	Lesotho	1	0	https://2009-2017.state.gov/documents/organization/10964.pdf	Not checked against source; verify accuracy before use	2002-03	2019-07-16	e782e1d31cf8c1bb89893bbbe967c5c6
e06be8cd-e653-44b9-b23d-f5ced2268861	03221d24-92ea-4ccc-a6a2-bd88dbfcd9fb	2001_2002_Africa_fmtrpt.tsv	Lesotho	LSO	DoS Africa Region, Lesotho, International Military Education and Training (IMET), FY01	MET REGIONAL DIILS		Commander's Office Quantity is 1 not 30	2/12/01	2001-02-12	2/16/01	2001-02-16	Lesotho	1	0	https://2009-2017.state.gov/documents/organization/10964.pdf	Not checked against source; verify accuracy before use	2002-03	2019-07-16	f6e0acea058571a3643bec60fbb273c5
879283f5-c17c-43ff-a762-d6c7ae1f2a35	03221d24-92ea-4ccc-a6a2-bd88dbfcd9fb	2001_2002_Africa_fmtrpt.tsv	Lesotho	LSO	DoS Africa Region, Lesotho, International Military Education and Training (IMET), FY01	MET REGIONAL DIILS		Transport Quantity is 1 not 30	2/12/01	2001-02-12	2/16/01	2001-02-16	Lesotho	1	0	https://2009-2017.state.gov/documents/organization/10964.pdf	Not checked against source; verify accuracy before use	2002-03	2019-07-16	e2cde145e15a37588d558294ab1f680b
678cc6eb-1a1c-4a6c-a901-ad0a45e621ef	03221d24-92ea-4ccc-a6a2-bd88dbfcd9fb	2001_2002_Africa_fmtrpt.tsv	Lesotho	LSO	DoS Africa Region, Lesotho, International Military Education and Training (IMET), FY01	MET REGIONAL DIILS		Engineering Division Quantity is 1 not 30	2/12/01	2001-02-12	2/16/01	2001-02-16	Lesotho	1	0	https://2009-2017.state.gov/documents/organization/10964.pdf	Not checked against source; verify accuracy before use	2002-03	2019-07-16	77aa65564efbdb911402b10cc0078f35
12615be8-5559-4e43-b49b-10cf61c60001	03221d24-92ea-4ccc-a6a2-bd88dbfcd9fb	2001_2002_Africa_fmtrpt.tsv	Lesotho	LSO	DoS Africa Region, Lesotho, International Military Education and Training (IMET), FY01	MET REGIONAL DIILS		Military School Quantity is 1 not 30	2/12/01	2001-02-12	2/16/01	2001-02-16	Lesotho	1	0	https://2009-2017.state.gov/documents/organization/10964.pdf	Not checked against source; verify accuracy before use	2002-03	2019-07-16	373c85a0e6fa535e5095b41b2ea9429b
53811e3b-c74f-47f9-8a3f-688f7fb83135	03221d24-92ea-4ccc-a6a2-bd88dbfcd9fb	2001_2002_Africa_fmtrpt.tsv	Lesotho	LSO	DoS Africa Region, Lesotho, International Military Education and Training (IMET), FY01	SPECIALIZED ENG LANG TNG		Accounts Department	7/23/01	2001-07-23	9/21/01	2001-09-21	LACKLAND AFB, TX 78236	1	8306	https://2009-2017.state.gov/documents/organization/10964.pdf	Not checked against source; verify accuracy before use	2002-03	2019-07-16	63b3eaa94d211f600cce0a335e7304ce
17094f15-a28d-4a83-8ba4-caf9d1fd7fe9	03221d24-92ea-4ccc-a6a2-bd88dbfcd9fb	2001_2002_Africa_fmtrpt.tsv	Lesotho	LSO	DoS Africa Region, Lesotho, Africa Center for Strategic Studies, FY01	Senior Leader Seminar		MOD Presidential Advisor	1/29/01	2001-01-29	2/9/01	2001-02-09	Libreville Gabon	2	8844	https://2009-2017.state.gov/documents/organization/10964.pdf	Not checked against source; verify accuracy before use	2002-03	2019-07-16	a09085f0312a8035ab812dcf03cbe4f6
c9332096-5863-4e07-83d9-9b2db6f5f922	03221d24-92ea-4ccc-a6a2-bd88dbfcd9fb	2001_2002_Africa_fmtrpt.tsv	Madagascar	MDG	DoS Africa Region, Madagascar, International Military Education and Training (IMET), FY01	CIV-MIL SID - AFRICA		Army	10/15/00	2000-10-15	10/15/00	2000-10-15	HURLBURT FIELD, FL 32544-5826	1	7221	https://2009-2017.state.gov/documents/organization/10964.pdf	Not checked against source; verify accuracy before use	2002-03	2019-07-16	231afb25dfec8d3ccc90f53ae099010e
99fea2ca-c5e3-4b9d-931d-d98c234750c4	03221d24-92ea-4ccc-a6a2-bd88dbfcd9fb	2001_2002_Africa_fmtrpt.tsv	Madagascar	MDG	DoS Africa Region, Madagascar, Asia-Pacific Center, FY01	Executive Course 00-3	U.S. military staff and faculty	Officer's Training Center	10/2/00	2000-10-02	12/15/00	2000-12-15	Asia-Pacific Center for Security Studies Honolulu, Hawaii	1	11483	https://2009-2017.state.gov/documents/organization/10964.pdf	Not checked against source; verify accuracy before use	2002-03	2019-07-16	e5be4d407a9f0a38e0f9819ab96d782f
6ea3e878-147f-4d93-81f6-3217deff4fa5	03221d24-92ea-4ccc-a6a2-bd88dbfcd9fb	2001_2002_Africa_fmtrpt.tsv	Madagascar	MDG	DoS Africa Region, Madagascar, Asia-Pacific Center, FY01	Executive Course 01-1	U.S. military staff and faculty	Army	1/22/01	2001-01-22	4/12/01	2001-04-12	Asia-Pacific Center for Security Studies Honolulu, Hawaii	1	17113	https://2009-2017.state.gov/documents/organization/10964.pdf	Not checked against source; verify accuracy before use	2002-03	2019-07-16	32e696985f8fa348a758c04c7a3eeadb
ffcd49f4-dc4f-4865-85cc-98dbd2f2dd73	03221d24-92ea-4ccc-a6a2-bd88dbfcd9fb	2001_2002_Africa_fmtrpt.tsv	Madagascar	MDG	DoS Africa Region, Madagascar, Asia-Pacific Center, FY01	Executive Course 01-2	U.S. military staff and faculty	Navy	5/21/01	2001-05-21	8/9/01	2001-08-09	Asia-Pacific Center for Security Studies Honolulu, Hawaii	1	16966	https://2009-2017.state.gov/documents/organization/10964.pdf	Not checked against source; verify accuracy before use	2002-03	2019-07-16	a5b9e774e0990a7f306c3aef12bd196a
6eaa5e48-1c5f-444e-97f6-217a3a112de5	03221d24-92ea-4ccc-a6a2-bd88dbfcd9fb	2001_2002_Africa_fmtrpt.tsv	Madagascar	MDG	DoS Africa Region, Madagascar, Africa Center for Strategic Studies, FY01	Senior Leader Seminar		MOD Ministry of Foreign Affairs	1/29/01	2001-01-29	2/9/01	2001-02-09	Libreville Gabon	2	8587	https://2009-2017.state.gov/documents/organization/10964.pdf	Not checked against source; verify accuracy before use	2002-03	2019-07-16	847e2228584feade87715a77499a5aaf
1f1a312a-663d-4dca-9196-3dd691f0a251	03221d24-92ea-4ccc-a6a2-bd88dbfcd9fb	2001_2002_Africa_fmtrpt.tsv	Malawi	MWI	DoS Africa Region, Malawi, Non-Security Assistance, Unified Command (Note 4), FY01	JCET	96 CA BN	SEE ATTATCHED AMEMBASSY MESSAGE DTG 300535Z JAN 01 FOR LIST OF 32 MEMBERS OF THE MALAWI ARMY PARTICIPATING IN EMI2001JCET040W.	2/28/01	2001-02-28	3/30/01	2001-03-30	LILONGWE	32	34000	https://2009-2017.state.gov/documents/organization/10964.pdf	Not checked against source; verify accuracy before use	2002-03	2019-07-16	7241bdfdec5a27bf8528ac8985bfad59
f978d180-93e2-419d-9ced-e602bd41a348	03221d24-92ea-4ccc-a6a2-bd88dbfcd9fb	2001_2002_Africa_fmtrpt.tsv	Malawi	MWI	DoS Africa Region, Malawi, International Military Education and Training (IMET), FY01	ADJ GEN OFFICER BASIC		CHILUMBA GARRISON	6/19/01	2001-06-19	9/26/01	2001-09-26	FT JACKSON SC 29207-7040	1	13989	https://2009-2017.state.gov/documents/organization/10964.pdf	Not checked against source; verify accuracy before use	2002-03	2019-07-16	cad1e5edfc2f0929ad2feee6ff93d8d9
d3173a32-eeee-4ee2-8d45-360972e578ae	03221d24-92ea-4ccc-a6a2-bd88dbfcd9fb	2001_2002_Africa_fmtrpt.tsv	Malawi	MWI	DoS Africa Region, Malawi, International Military Education and Training (IMET), FY01	AIRBORNE		INFANTRY	4/30/01	2001-04-30	5/18/01	2001-05-18	FT BENNING GA 31905-5468	1	221	https://2009-2017.state.gov/documents/organization/10964.pdf	Not checked against source; verify accuracy before use	2002-03	2019-07-16	deb1aa6fb7b84c88219f1082e901fcaa
40da8215-1dbb-4aff-8b2f-6ff01250e45b	03221d24-92ea-4ccc-a6a2-bd88dbfcd9fb	2001_2002_Africa_fmtrpt.tsv	Malawi	MWI	DoS Africa Region, Malawi, International Military Education and Training (IMET), FY01	ALLIED OFF PREP-INF OAC		INFANTRY	7/30/01	2001-07-30	8/3/01	2001-08-03	FT BENNING GA 31905-5468	1	4799	https://2009-2017.state.gov/documents/organization/10964.pdf	Not checked against source; verify accuracy before use	2002-03	2019-07-16	d342a69ee827d256e457f244876433da
6a6312a1-bf70-45ae-a30f-5651f4932a63	03221d24-92ea-4ccc-a6a2-bd88dbfcd9fb	2001_2002_Africa_fmtrpt.tsv	Malawi	MWI	DoS Africa Region, Malawi, International Military Education and Training (IMET), FY01	CIV-MIL SID - AFRICA		Air Force	10/16/00	2000-10-16	10/27/00	2000-10-27	HURLBURT FIELD, FL 32544-5826	1	6278	https://2009-2017.state.gov/documents/organization/10964.pdf	Not checked against source; verify accuracy before use	2002-03	2019-07-16	37448cac20767ba06aa81aa155f915b0
ed020299-2495-4de1-9879-96b73f539ad4	03221d24-92ea-4ccc-a6a2-bd88dbfcd9fb	2001_2002_Africa_fmtrpt.tsv	Malawi	MWI	DoS Africa Region, Malawi, International Military Education and Training (IMET), FY01	CIV-MIL SID - AFRICA		Air Force	10/16/00	2000-10-16	10/27/00	2000-10-27	HURLBURT FIELD, FL 32544-5826	1	6278	https://2009-2017.state.gov/documents/organization/10964.pdf	Not checked against source; verify accuracy before use	2002-03	2019-07-16	37448cac20767ba06aa81aa155f915b0
4f653bb4-e879-46dc-a696-00efe09ed182	03221d24-92ea-4ccc-a6a2-bd88dbfcd9fb	2001_2002_Africa_fmtrpt.tsv	Malawi	MWI	DoS Africa Region, Malawi, International Military Education and Training (IMET), FY01	CIV-MIL SID - AFRICA		Air Force	10/16/00	2000-10-16	10/27/00	2000-10-27	HURLBURT FIELD, FL 32544-5826	1	6278	https://2009-2017.state.gov/documents/organization/10964.pdf	Not checked against source; verify accuracy before use	2002-03	2019-07-16	37448cac20767ba06aa81aa155f915b0
52d2ab61-f0c4-45a5-add5-3c514a92684f	03221d24-92ea-4ccc-a6a2-bd88dbfcd9fb	2001_2002_Africa_fmtrpt.tsv	Malawi	MWI	DoS Africa Region, Malawi, International Military Education and Training (IMET), FY01	INFANTRY OFFICER BASIC		PARACHUTE BATTALLION	2/26/01	2001-02-26	6/22/01	2001-06-22	FT BENNING GA 31905-5468	1	13700	https://2009-2017.state.gov/documents/organization/10964.pdf	Not checked against source; verify accuracy before use	2002-03	2019-07-16	0d2f05c574e8ffce3da2705770889f74
a8613372-a669-43a2-885f-f134869b61de	03221d24-92ea-4ccc-a6a2-bd88dbfcd9fb	2001_2002_Africa_fmtrpt.tsv	Malawi	MWI	DoS Africa Region, Malawi, International Military Education and Training (IMET), FY01	INSTRUCTOR TNG COURSE		Army	10/2/00	2000-10-02	10/13/00	2000-10-13	FT BENNING GA 31905-5468	1	1372	https://2009-2017.state.gov/documents/organization/10964.pdf	Not checked against source; verify accuracy before use	2002-03	2019-07-16	7243dfcadca7ea5792b307398d137d84
a60bcfc0-a0d5-4ee6-87eb-89b422cf61a3	03221d24-92ea-4ccc-a6a2-bd88dbfcd9fb	2001_2002_Africa_fmtrpt.tsv	Malawi	MWI	DoS Africa Region, Malawi, International Military Education and Training (IMET), FY01	INSTRUCTOR TRAINING		Army	3/5/01	2001-03-05	3/16/01	2001-03-16	FT GORDON GA 30905-5154	1	1910	https://2009-2017.state.gov/documents/organization/10964.pdf	Not checked against source; verify accuracy before use	2002-03	2019-07-16	5f3fbb39e2d9cf2326f21717ad889908
9de251bf-a318-4b94-a790-ce2fc6e3d71d	03221d24-92ea-4ccc-a6a2-bd88dbfcd9fb	2001_2002_Africa_fmtrpt.tsv	Malawi	MWI	DoS Africa Region, Malawi, International Military Education and Training (IMET), FY01	INSTRUCTOR TRAINING		SUPPORT BATTALION	6/4/01	2001-06-04	6/15/01	2001-06-15	FT GORDON GA 30905-5154	1	2606	https://2009-2017.state.gov/documents/organization/10964.pdf	Not checked against source; verify accuracy before use	2002-03	2019-07-16	1b2bea4d0cf4efe4bd5df57d6e24ff75
c13698b4-9920-4617-901e-7f44ce3c9d94	03221d24-92ea-4ccc-a6a2-bd88dbfcd9fb	2001_2002_Africa_fmtrpt.tsv	Malawi	MWI	DoS Africa Region, Malawi, International Military Education and Training (IMET), FY01	INTERNATIONAL OFFICER PREP		DIRECTORATE OF MILITARY OPERATIONS	6/19/01	2001-06-19	7/6/01	2001-07-06	FT LEAVENWORTH KS 66027-1352	1	6057	https://2009-2017.state.gov/documents/organization/10964.pdf	Not checked against source; verify accuracy before use	2002-03	2019-07-16	849167acf2fe20457f3f1618cab97b4b
b04ee6aa-70da-49e9-a734-c2bb7f945eed	03221d24-92ea-4ccc-a6a2-bd88dbfcd9fb	2001_2002_Africa_fmtrpt.tsv	Malawi	MWI	DoS Africa Region, Malawi, International Military Education and Training (IMET), FY01	JAG OFFICER BASIC		HEADQUARTRES MALAWI ARMY	2/2/01	2001-02-02	4/13/01	2001-04-13	CHARLOTTESVILLE VA 22903-1781	1	9001	https://2009-2017.state.gov/documents/organization/10964.pdf	Not checked against source; verify accuracy before use	2002-03	2019-07-16	256bac21b14d2da089cf6302d818dc4d
c4a92e42-776c-4aff-b699-2bac42b7c793	03221d24-92ea-4ccc-a6a2-bd88dbfcd9fb	2001_2002_Africa_fmtrpt.tsv	Malawi	MWI	DoS Africa Region, Malawi, International Military Education and Training (IMET), FY01	LANG LAB MAINT / CASSETTE		SIGNALS WORKSHOP-ZOMBA	6/4/01	2001-06-04	7/27/01	2001-07-27	LACKLAND AFB, TX 78236	1	7667	https://2009-2017.state.gov/documents/organization/10964.pdf	Not checked against source; verify accuracy before use	2002-03	2019-07-16	251d96f73f4c8953fd1e08541cc434c1
8158597a-a342-4103-810a-ee5ab91876e6	03221d24-92ea-4ccc-a6a2-bd88dbfcd9fb	2001_2002_Africa_fmtrpt.tsv	Malawi	MWI	DoS Africa Region, Malawi, International Military Education and Training (IMET), FY01	LANGUAGE INSTRUCTOR/BASIC		ADMINISTRATIVE	1/8/01	2001-01-08	7/13/01	2001-07-13	LACKLAND AFB, TX 78236	1	16958	https://2009-2017.state.gov/documents/organization/10964.pdf	Not checked against source; verify accuracy before use	2002-03	2019-07-16	49fd87a0e9d822e3e549dba6175e0b44
1911cfd4-340c-4c0e-b967-44c13bb84e7f	03221d24-92ea-4ccc-a6a2-bd88dbfcd9fb	2001_2002_Africa_fmtrpt.tsv	Malawi	MWI	DoS Africa Region, Malawi, International Military Education and Training (IMET), FY01	LT WHEEL VEHICLE MECH		Vehicle Workshop-Zomba	4/16/01	2001-04-16	6/25/01	2001-06-25	FT JACKSON SC 29207-7040	1	8232	https://2009-2017.state.gov/documents/organization/10964.pdf	Not checked against source; verify accuracy before use	2002-03	2019-07-16	0f043b027f560c9b131194b3d4248ab2
329bd554-6aa8-4ed1-93e7-5579b99bcbf5	03221d24-92ea-4ccc-a6a2-bd88dbfcd9fb	2001_2002_Africa_fmtrpt.tsv	Malawi	MWI	DoS Africa Region, Malawi, International Military Education and Training (IMET), FY01	MEDICAL SPECIALIST		Administrative	7/16/01	2001-07-16	9/24/01	2001-09-24	FT SAM HOUSTON TX 78234-6100	1	11075	https://2009-2017.state.gov/documents/organization/10964.pdf	Not checked against source; verify accuracy before use	2002-03	2019-07-16	e75c4779375c0c0ed3db50be2f291e11
85c470ce-6379-4c47-a050-2c6bd6329a96	03221d24-92ea-4ccc-a6a2-bd88dbfcd9fb	2001_2002_Africa_fmtrpt.tsv	Malawi	MWI	DoS Africa Region, Malawi, International Military Education and Training (IMET), FY01	MET DIILS		Malawi Army, Members of Parliament, Office of Ombudsman, Min. Of Gender Youth and Community Services, Public Affairs Committee, National Domocratic Institute, Human Rights Resource Center, Malawi Institute of Democratic and Economic affairs, MoD, MoF, Press, Church	4/9/01	2001-04-09	4/19/01	2001-04-19	Malawi	46	37528	https://2009-2017.state.gov/documents/organization/10964.pdf	Not checked against source; verify accuracy before use	2002-03	2019-07-16	cec8ceabd0c1b2b5dd00b454627b7924
87e7bb36-1826-40f0-b503-acfce2c2eddd	03221d24-92ea-4ccc-a6a2-bd88dbfcd9fb	2001_2002_Africa_fmtrpt.tsv	Malawi	MWI	DoS Africa Region, Malawi, International Military Education and Training (IMET), FY01	OBC INTERNATION ENR PREP		COMBAT SUPPORT BATTALION	5/29/01	2001-05-29	6/1/01	2001-06-01	FT LEONARD WOOD MO 65473-5000	1	4370	https://2009-2017.state.gov/documents/organization/10964.pdf	Not checked against source; verify accuracy before use	2002-03	2019-07-16	3b0bb384c4af1b4faf1fb4e9c6173f01
e09408b9-9ed9-4197-8890-eb1667ca600b	03221d24-92ea-4ccc-a6a2-bd88dbfcd9fb	2001_2002_Africa_fmtrpt.tsv	Malawi	MWI	DoS Africa Region, Malawi, International Military Education and Training (IMET), FY01	OJT OPERATIONS TNG-CONUS		INFANTRY	3/12/01	2001-03-12	3/23/01	2001-03-23	FT BENNING GA 31905-5468	1	4604	https://2009-2017.state.gov/documents/organization/10964.pdf	Not checked against source; verify accuracy before use	2002-03	2019-07-16	e2daf81a2171b48db872c59d473cc653
567369ab-a88e-4e92-bf41-4a2876b01f4d	03221d24-92ea-4ccc-a6a2-bd88dbfcd9fb	2001_2002_Africa_fmtrpt.tsv	Malawi	MWI	DoS Africa Region, Malawi, International Military Education and Training (IMET), FY01	OJT OPERATIONS TNG-CONUS		2ND BATTALION MALAWI RIFLES	12/18/00	2000-12-18	12/29/00	2000-12-29	FT BENNING GA 31905-5468	1	4778	https://2009-2017.state.gov/documents/organization/10964.pdf	Not checked against source; verify accuracy before use	2002-03	2019-07-16	714bda87be5fbdd96c37af51216e4e37
ce37cdf7-a221-4bfd-9630-06833dd3ca67	03221d24-92ea-4ccc-a6a2-bd88dbfcd9fb	2001_2002_Africa_fmtrpt.tsv	Malawi	MWI	DoS Africa Region, Malawi, International Military Education and Training (IMET), FY01	PATHFINDER		INFANTRY	4/2/01	2001-04-02	4/20/01	2001-04-20	FT BENNING GA 31905-5468	1	1451	https://2009-2017.state.gov/documents/organization/10964.pdf	Not checked against source; verify accuracy before use	2002-03	2019-07-16	973962aca9540fd550752ac05a1075b0
e9972088-efe2-4be7-8c0d-aec0b136f3ba	03221d24-92ea-4ccc-a6a2-bd88dbfcd9fb	2001_2002_Africa_fmtrpt.tsv	Malawi	MWI	DoS Africa Region, Malawi, International Military Education and Training (IMET), FY01	RANGER		2ND BATTALION MALAWI RIFLES	2/12/01	2001-02-12	4/12/01	2001-04-12	FT BENNING GA 31905-5468	1	3688	https://2009-2017.state.gov/documents/organization/10964.pdf	Not checked against source; verify accuracy before use	2002-03	2019-07-16	c65fcd337fc3e9f9d7e58041bbb798ed
0f7c978d-e9cd-4a84-b283-d37f462d1311	03221d24-92ea-4ccc-a6a2-bd88dbfcd9fb	2001_2002_Africa_fmtrpt.tsv	Malawi	MWI	DoS Africa Region, Malawi, International Military Education and Training (IMET), FY01	RANGER		2ND BATTALION MALAWI RIFLES	1/15/01	2001-01-15	3/15/01	2001-03-15	FT BENNING GA 31905-5468	1	7575	https://2009-2017.state.gov/documents/organization/10964.pdf	Not checked against source; verify accuracy before use	2002-03	2019-07-16	79bbb5f5a1c59fc84dea398122853efa
bc5e297c-04c1-4801-8115-a3d328ff4a7c	03221d24-92ea-4ccc-a6a2-bd88dbfcd9fb	2001_2002_Africa_fmtrpt.tsv	Malawi	MWI	DoS Africa Region, Malawi, International Military Education and Training (IMET), FY01	TRANS OFFICER BASIC		SUPPORT BATTALION	1/16/01	2001-01-16	5/18/01	2001-05-18	FT EUSTIS VA 23604-5481	1	13307	https://2009-2017.state.gov/documents/organization/10964.pdf	Not checked against source; verify accuracy before use	2002-03	2019-07-16	54d8ac2ca065db7b98727b13bf84d5e7
831cd99e-01dd-4c5d-9077-3f215dc512cc	03221d24-92ea-4ccc-a6a2-bd88dbfcd9fb	2001_2002_Africa_fmtrpt.tsv	Malawi	MWI	DoS Africa Region, Malawi, International Military Education and Training (IMET), FY01	USA C&GSC OFF PREPARATORY		DIRECTORATE OF MILITARY OPERATIONS	7/9/01	2001-07-09	7/20/01	2001-07-20	FT LEAVENWORTH KS 66027-1352	1	1590	https://2009-2017.state.gov/documents/organization/10964.pdf	Not checked against source; verify accuracy before use	2002-03	2019-07-16	22d8ea4be99ed98ea640904625786a15
00f91ee6-e5a9-4e24-a189-c8ba0bf1bd0a	03221d24-92ea-4ccc-a6a2-bd88dbfcd9fb	2001_2002_Africa_fmtrpt.tsv	Malawi	MWI	Africa Region, Malawi, African Crisis Response Initiative, FY01	ACRI FT-5	3RD SFGA	ARMY	7/10/01	2001-07-10	7/27/01	2001-07-27	MALAWI	43	45000	https://2009-2017.state.gov/documents/organization/10964.pdf	Not checked against source; verify accuracy before use	2002-03	2019-07-16	d998df3b637e28bdea5a6200d3cba8b6
d3a6a92f-d46a-4412-8044-dd0abf3f97b5	03221d24-92ea-4ccc-a6a2-bd88dbfcd9fb	2001_2002_Africa_fmtrpt.tsv	Malawi	MWI	DoS Africa Region, Malawi, Africa Center for Strategic Studies, FY01	Senior Leader Seminar		MOD	1/29/01	2001-01-29	2/9/01	2001-02-09	Libreville Gabon	2	8365	https://2009-2017.state.gov/documents/organization/10964.pdf	Not checked against source; verify accuracy before use	2002-03	2019-07-16	4661225f2b7b10dd4503d2727bcdfc31
f3b51da9-7a16-4c9c-aa33-3a3a93254b03	03221d24-92ea-4ccc-a6a2-bd88dbfcd9fb	2001_2002_Africa_fmtrpt.tsv	Mali	MLI	DoS Africa Region, Mali, International Military Education and Training (IMET), FY01	ALLIED OFF PREP-INF OAC		33 Para BN (Army)	1/8/01	2001-01-08	1/12/01	2001-01-12	FT BENNING GA 31905-5468	1	1974	https://2009-2017.state.gov/documents/organization/10964.pdf	Not checked against source; verify accuracy before use	2002-03	2019-07-16	39f0461d91ae64323ed2758319b5a307
0064d5f9-905f-459e-bfeb-73ce222d1160	03221d24-92ea-4ccc-a6a2-bd88dbfcd9fb	2001_2002_Africa_fmtrpt.tsv	Mali	MLI	DoS Africa Region, Mali, International Military Education and Training (IMET), FY01	AMERICAN LANGUAGE COURSE		Air Force, Staff Officer	3/26/01	2001-03-26	6/8/01	2001-06-08	LACKLAND AFB, TX 78236	1	9672	https://2009-2017.state.gov/documents/organization/10964.pdf	Not checked against source; verify accuracy before use	2002-03	2019-07-16	b203718af89e593d6ae6b52276cc3560
0d816867-e672-4ead-9c2d-2c39caffefe6	03221d24-92ea-4ccc-a6a2-bd88dbfcd9fb	2001_2002_Africa_fmtrpt.tsv	Mali	MLI	DoS Africa Region, Mali, International Military Education and Training (IMET), FY01	AMERICAN LANGUAGE CRS		Army, Artillery	6/4/01	2001-06-04	9/21/01	2001-09-21	LACKLAND AFB, TX 78236-5259	1	11822	https://2009-2017.state.gov/documents/organization/10964.pdf	Not checked against source; verify accuracy before use	2002-03	2019-07-16	047fe176a202b7a9e81c0a5e8b47ba6a
f585bc3b-5b74-4dd9-808b-9e40632f76c8	03221d24-92ea-4ccc-a6a2-bd88dbfcd9fb	2001_2002_Africa_fmtrpt.tsv	Mali	MLI	DoS Africa Region, Mali, International Military Education and Training (IMET), FY01	AMERICAN LANGUAGE CRS		Army, 33 bcp	4/16/01	2001-04-16	8/3/01	2001-08-03	LACKLAND AFB, TX 78236-5259	1	11362	https://2009-2017.state.gov/documents/organization/10964.pdf	Not checked against source; verify accuracy before use	2002-03	2019-07-16	564a2ac5f2cfdfcb76a177fe682e284e
40181a4b-b581-4591-8efd-933afd266071	03221d24-92ea-4ccc-a6a2-bd88dbfcd9fb	2001_2002_Africa_fmtrpt.tsv	Mali	MLI	DoS Africa Region, Mali, International Military Education and Training (IMET), FY01	AMERICAN LANGUAGE CRS		Army, Infantry	5/7/01	2001-05-07	8/24/01	2001-08-24	LACKLAND AFB, TX 78236-5259	1	12092	https://2009-2017.state.gov/documents/organization/10964.pdf	Not checked against source; verify accuracy before use	2002-03	2019-07-16	5f9b9a299b95d1e8bc7cf17a3f65d184
14139a91-fd91-44b5-ab01-a74cbbb8928e	03221d24-92ea-4ccc-a6a2-bd88dbfcd9fb	2001_2002_Africa_fmtrpt.tsv	Mali	MLI	DoS Africa Region, Mali, International Military Education and Training (IMET), FY01	AMERICAN LANGUAGE CRS		Army, Infantry	5/7/01	2001-05-07	8/24/01	2001-08-24	LACKLAND AFB, TX 78236-5259	1	12092	https://2009-2017.state.gov/documents/organization/10964.pdf	Not checked against source; verify accuracy before use	2002-03	2019-07-16	5f9b9a299b95d1e8bc7cf17a3f65d184
fa102159-e69b-422a-9218-f9d486e474c1	03221d24-92ea-4ccc-a6a2-bd88dbfcd9fb	2001_2002_Africa_fmtrpt.tsv	Mali	MLI	DoS Africa Region, Mali, International Military Education and Training (IMET), FY01	DRMI SEMINAR - OVERSEAS		Navy	6/4/01	2001-06-04	6/15/01	2001-06-15	Mali	1	2378	https://2009-2017.state.gov/documents/organization/10964.pdf	Not checked against source; verify accuracy before use	2002-03	2019-07-16	daf453e30c1488156f2a21064cc20332
37593ea8-affb-4c09-9c8b-0a1d67ad59c5	03221d24-92ea-4ccc-a6a2-bd88dbfcd9fb	2001_2002_Africa_fmtrpt.tsv	Mali	MLI	DoS Africa Region, Mali, International Military Education and Training (IMET), FY01	DRMI SEMINAR - OVERSEAS		Air Force, Base 100 MGP	6/4/01	2001-06-04	6/15/01	2001-06-15	Mali	1	4025	https://2009-2017.state.gov/documents/organization/10964.pdf	Not checked against source; verify accuracy before use	2002-03	2019-07-16	540387d67ff4cacab0af85ac5dfee5f7
e2e88980-30ee-4c32-b88b-0dcb17d770a7	03221d24-92ea-4ccc-a6a2-bd88dbfcd9fb	2001_2002_Africa_fmtrpt.tsv	Mali	MLI	DoS Africa Region, Mali, International Military Education and Training (IMET), FY01	ENGLISH LANGUAGE CRSE		Army, Artilllery	4/23/01	2001-04-23	8/10/01	2001-08-10	SAN ANTONIO TX 78236-5259	1	11553	https://2009-2017.state.gov/documents/organization/10964.pdf	Not checked against source; verify accuracy before use	2002-03	2019-07-16	2b65573c2107dc79cc4ba095aeaed0be
02e1172b-27d9-49f0-b480-8db5deaff404	03221d24-92ea-4ccc-a6a2-bd88dbfcd9fb	2001_2002_Africa_fmtrpt.tsv	Mali	MLI	DoS Africa Region, Mali, International Military Education and Training (IMET), FY01	ENGLISH LANGUAGE CRSE		Army, Artilllery	4/23/01	2001-04-23	8/10/01	2001-08-10	SAN ANTONIO TX 78236-5259	1	11553	https://2009-2017.state.gov/documents/organization/10964.pdf	Not checked against source; verify accuracy before use	2002-03	2019-07-16	2b65573c2107dc79cc4ba095aeaed0be
a6748857-b275-4b07-9904-8779566e0f66	03221d24-92ea-4ccc-a6a2-bd88dbfcd9fb	2001_2002_Africa_fmtrpt.tsv	Mali	MLI	DoS Africa Region, Mali, International Military Education and Training (IMET), FY01	FA OFF ADV PREP-ALLIED OFF		Army, Artilllery	8/22/01	2001-08-22	9/14/01	2001-09-14	FT SILL OK 73503	1	3822	https://2009-2017.state.gov/documents/organization/10964.pdf	Not checked against source; verify accuracy before use	2002-03	2019-07-16	6232bcecf9b467daac5be2107b1bfd7d
d5ad9ab6-c7cc-431f-aaa9-3f2ed07535dd	03221d24-92ea-4ccc-a6a2-bd88dbfcd9fb	2001_2002_Africa_fmtrpt.tsv	Mali	MLI	DoS Africa Region, Mali, International Military Education and Training (IMET), FY01	INFANTRY CAPTS CAREER CRS		33 Para BN (Army)	1/16/01	2001-01-16	5/22/01	2001-05-22	FT BENNING GA 31905-5468	1	10179	https://2009-2017.state.gov/documents/organization/10964.pdf	Not checked against source; verify accuracy before use	2002-03	2019-07-16	598c9ebf078312f7f4ddcb911364878d
c8ac8c3a-4ca1-4205-86a8-c4e803284d1b	03221d24-92ea-4ccc-a6a2-bd88dbfcd9fb	2001_2002_Africa_fmtrpt.tsv	Mali	MLI	DoS Africa Region, Mali, International Military Education and Training (IMET), FY01	INTERNATIONAL OFFICER PREP		Army, Armor	6/19/01	2001-06-19	7/6/01	2001-07-06	FT LEAVENWORTH KS 66027-1352	1	2992	https://2009-2017.state.gov/documents/organization/10964.pdf	Not checked against source; verify accuracy before use	2002-03	2019-07-16	cbb978219f0ed6baa88232b012468130
4de45a30-a2ba-4c7e-9dd9-8d9a274892bc	03221d24-92ea-4ccc-a6a2-bd88dbfcd9fb	2001_2002_Africa_fmtrpt.tsv	Mali	MLI	DoS Africa Region, Mali, International Military Education and Training (IMET), FY01	INTL OFF SCH & SOS		Air Force, Base 101 Senou Airport	4/9/01	2001-04-09	6/29/01	2001-06-29	MAXWELL AFB, AL 36112-6323	1	7837	https://2009-2017.state.gov/documents/organization/10964.pdf	Not checked against source; verify accuracy before use	2002-03	2019-07-16	991bc0bf79b99ad9f9a32dc3d15dc0aa
1738583c-b102-406b-81e6-74db0602c844	03221d24-92ea-4ccc-a6a2-bd88dbfcd9fb	2001_2002_Africa_fmtrpt.tsv	Mali	MLI	DoS Africa Region, Mali, International Military Education and Training (IMET), FY01	INTL OFF SCH (FOR AC&SC)		Air Force, Staff Officer	6/18/01	2001-06-18	7/27/01	2001-07-27	MAXWELL AFB, AL 36112-6323	1	5596	https://2009-2017.state.gov/documents/organization/10964.pdf	Not checked against source; verify accuracy before use	2002-03	2019-07-16	2bc0bd8034faf50ec87227377072d82b
26c7abdd-f469-45e8-b713-31432db6ce67	03221d24-92ea-4ccc-a6a2-bd88dbfcd9fb	2001_2002_Africa_fmtrpt.tsv	Mali	MLI	DoS Africa Region, Mali, International Military Education and Training (IMET), FY01	MET DIILS		Gendarmerie, Army, Air Force and National Guard	9/10/01	2001-09-10	9/14/01	2001-09-14	Mali	38	32313	https://2009-2017.state.gov/documents/organization/10964.pdf	Not checked against source; verify accuracy before use	2002-03	2019-07-16	eb8bdb6da744432058a51929bc3c5dfd
50d5260a-41b9-4f76-9c9c-030376acd97e	03221d24-92ea-4ccc-a6a2-bd88dbfcd9fb	2001_2002_Africa_fmtrpt.tsv	Mali	MLI	DoS Africa Region, Mali, International Military Education and Training (IMET), FY01	PATHFINDER		33 Para BN (Army)	6/18/01	2001-06-18	7/9/01	2001-07-09	FT BENNING GA 31905-5468	1	3143	https://2009-2017.state.gov/documents/organization/10964.pdf	Not checked against source; verify accuracy before use	2002-03	2019-07-16	841aa977643951579930cdb903a5c808
279d4a9d-951c-4cec-8c4e-0b16840b5982	03221d24-92ea-4ccc-a6a2-bd88dbfcd9fb	2001_2002_Africa_fmtrpt.tsv	Mali	MLI	DoS Africa Region, Mali, International Military Education and Training (IMET), FY01	SPECIALIZED ENG LANG TNG		Army, Armor	4/9/01	2001-04-09	6/8/01	2001-06-08	SAN ANTONIO TX 78236-5259	1	8172	https://2009-2017.state.gov/documents/organization/10964.pdf	Not checked against source; verify accuracy before use	2002-03	2019-07-16	0d2a640b6ca910758d9a39197c48a17d
22d72703-1a7a-4012-a4c5-7c3e552da56a	03221d24-92ea-4ccc-a6a2-bd88dbfcd9fb	2001_2002_Africa_fmtrpt.tsv	Mali	MLI	DoS Africa Region, Mali, International Military Education and Training (IMET), FY01	SPECIALIZED ENG LANG TNG		Air Force, Base 101 Senou Airport	2/5/01	2001-02-05	4/6/01	2001-04-06	LACKLAND AFB, TX 78236	1	8240	https://2009-2017.state.gov/documents/organization/10964.pdf	Not checked against source; verify accuracy before use	2002-03	2019-07-16	01e83f3df30da6fb8953218dd0e4d989
5c077afa-aea5-4e6c-8478-b9309d1f16f8	03221d24-92ea-4ccc-a6a2-bd88dbfcd9fb	2001_2002_Africa_fmtrpt.tsv	Mali	MLI	DoS Africa Region, Mali, International Military Education and Training (IMET), FY01	SR INTERNATIONAL DEF MGT		Air Force, Base 100 MGP	6/25/01	2001-06-25	7/20/01	2001-07-20	MONTEREY, CA 93943-5201	1	9207	https://2009-2017.state.gov/documents/organization/10964.pdf	Not checked against source; verify accuracy before use	2002-03	2019-07-16	dc45a3265234bee253eaf64a449b1781
bf32e609-c193-4d74-886d-4555d42d7fca	03221d24-92ea-4ccc-a6a2-bd88dbfcd9fb	2001_2002_Africa_fmtrpt.tsv	Mali	MLI	DoS Africa Region, Mali, International Military Education and Training (IMET), FY01	USA C&GSC OFF PREPARATORY		Army, Armor	7/9/01	2001-07-09	7/20/01	2001-07-20	FT LEAVENWORTH KS 66027-1352	1	1725	https://2009-2017.state.gov/documents/organization/10964.pdf	Not checked against source; verify accuracy before use	2002-03	2019-07-16	93c3fe3e0ef06a42d5bd3344c835c549
15777cda-e0d3-45cc-be29-a83a2eca8458	03221d24-92ea-4ccc-a6a2-bd88dbfcd9fb	2001_2002_Africa_fmtrpt.tsv	Mali	MLI	DoS Africa Region, Mali, Foreign Military Financing (FMF), FY01	MTT-MISCELLANEOUS OPNS		Army, Air Force, Gendarmerie and National Guard	4/15/01	2001-04-15	7/30/01	2001-07-30	Mali	30	377800	https://2009-2017.state.gov/documents/organization/10964.pdf	Not checked against source; verify accuracy before use	2002-03	2019-07-16	1500c3e23d542a1eb36f916c8eea0f55
5d3d637d-4b6a-4612-b0ae-9e56a2f8abd5	03221d24-92ea-4ccc-a6a2-bd88dbfcd9fb	2001_2002_Africa_fmtrpt.tsv	Mali	MLI	DoS Africa Region, Mali, African Crisis Response Initiative, FY01	ACRI FT-3	SRD SFGA	ARMY	10/30/00	2000-10-30	11/17/00	2000-11-17	MALI	42	65000	https://2009-2017.state.gov/documents/organization/10964.pdf	Not checked against source; verify accuracy before use	2002-03	2019-07-16	7331334ab857a393fb046bea23abd761
7197ad15-7870-4ebb-9b6e-a82b0ddb0067	03221d24-92ea-4ccc-a6a2-bd88dbfcd9fb	2001_2002_Africa_fmtrpt.tsv	Mali	MLI	DoS Africa Region, Mali, African Crisis Response Initiative, FY01	ACRI FT-4	3RD SFGA	ARMY	5/7/01	2001-05-07	6/1/01	2001-06-01	MALI	780	400000	https://2009-2017.state.gov/documents/organization/10964.pdf	Not checked against source; verify accuracy before use	2002-03	2019-07-16	f27833568dbc92da74d5e867a65db396
2f234344-b278-4e13-adad-8f1f14bc9128	03221d24-92ea-4ccc-a6a2-bd88dbfcd9fb	2001_2002_Africa_fmtrpt.tsv	Mali	MLI	DoS Africa Region, Mali, Africa Center for Strategic Studies, FY01	Senior Leader Seminar		Ministry of Foreign Affairs Civilian Government	1/29/01	2001-01-29	2/9/01	2001-02-09	Libreville Gabon	4	8041	https://2009-2017.state.gov/documents/organization/10964.pdf	Not checked against source; verify accuracy before use	2002-03	2019-07-16	689338215c6c48ee487169cce59949fe
d344c745-0b3a-426c-b22e-a8bcbe93121e	03221d24-92ea-4ccc-a6a2-bd88dbfcd9fb	2001_2002_Africa_fmtrpt.tsv	Mali	MLI	DoS Africa Region, Mali, Africa Center for Strategic Studies, FY01	Sub-Regional Seminar		MOD MFA	8/20/01	2001-08-20	8/24/01	2001-08-24	Accra Ghana	5	5478	https://2009-2017.state.gov/documents/organization/10964.pdf	Not checked against source; verify accuracy before use	2002-03	2019-07-16	36518a94c8deb66b3bd94e3b9cc4c6e7
0e93fe6e-8241-4e77-8ede-b33a03ae068c	03221d24-92ea-4ccc-a6a2-bd88dbfcd9fb	2001_2002_Africa_fmtrpt.tsv	Mauritania	MRT	DoS Africa Region, Mauritania, International Military Education and Training (IMET), FY01	ARMY-PCHT			7/18/01	2001-07-18	9/30/01	2001-09-30		0	5636	https://2009-2017.state.gov/documents/organization/10964.pdf	Not checked against source; verify accuracy before use	2002-03	2019-07-16	565b442e6878166557fc466f12a0622e
53c7b459-d212-4c19-8fe3-593c8631ae8e	03221d24-92ea-4ccc-a6a2-bd88dbfcd9fb	2001_2002_Africa_fmtrpt.tsv	Mauritania	MRT	DoS Africa Region, Mauritania, International Military Education and Training (IMET), FY01	MET CIV-MILITARY RELATIONS		MOD Assessment Visit	8/2/01	2001-08-02	8/6/01	2001-08-06	Mauritania	0	8746	https://2009-2017.state.gov/documents/organization/10964.pdf	Not checked against source; verify accuracy before use	2002-03	2019-07-16	d170f658ed71ebf9e8b4303073638f19
3f46d707-c025-4d12-b294-e13588fbfbef	03221d24-92ea-4ccc-a6a2-bd88dbfcd9fb	2001_2002_Africa_fmtrpt.tsv	Mauritania	MRT	DoS Africa Region, Mauritania, International Military Education and Training (IMET), FY01	MET DIILS ASSESS OF ISSUES		MOD Assessment Visit	7/9/01	2001-07-09	7/13/01	2001-07-13	Mauritania	0	10468	https://2009-2017.state.gov/documents/organization/10964.pdf	Not checked against source; verify accuracy before use	2002-03	2019-07-16	222c8f8dc35df59ae49d5a9a715ebc08
666aa7cc-fabf-4780-bbc6-4bb404682bfe	03221d24-92ea-4ccc-a6a2-bd88dbfcd9fb	2001_2002_Africa_fmtrpt.tsv	Mauritania	MRT	DoS Africa Region, Mauritania, International Military Education and Training (IMET), FY01	SURVEY/ *		EMIA	8/5/01	2001-08-05	8/11/01	2001-08-11	Mauritania	0	3653	https://2009-2017.state.gov/documents/organization/10964.pdf	Not checked against source; verify accuracy before use	2002-03	2019-07-16	4d69c958237177999302952be2fa37f8
90126f96-e249-4b96-a47e-aa9d37109206	03221d24-92ea-4ccc-a6a2-bd88dbfcd9fb	2001_2002_Africa_fmtrpt.tsv	Mauritania	MRT	DoS Africa Region, Mauritania, International Military Education and Training (IMET), FY01	TAT-LANGUAGE LAB INSTALL		Ecole Militaire Inter-Armes (EMIA)	5/22/01	2001-05-22	6/14/01	2001-06-14	Mauritania	0	7000	https://2009-2017.state.gov/documents/organization/10964.pdf	Not checked against source; verify accuracy before use	2002-03	2019-07-16	c4bfc2271eb21031db3bb57b1f45f5df
1bdc60e5-c82d-408e-a6d4-cca63b775e48	03221d24-92ea-4ccc-a6a2-bd88dbfcd9fb	2001_2002_Africa_fmtrpt.tsv	Mauritania	MRT	DoS Africa Region, Mauritania, International Military Education and Training (IMET), FY01	TRAINING AIDS & DEVICES			7/18/01	2001-07-18	9/30/01	2001-09-30		0	1180	https://2009-2017.state.gov/documents/organization/10964.pdf	Not checked against source; verify accuracy before use	2002-03	2019-07-16	2a02c608de326dbd29374fdaded54bed
bb10b40d-508a-4b6b-b72f-967f8987dd67	03221d24-92ea-4ccc-a6a2-bd88dbfcd9fb	2001_2002_Africa_fmtrpt.tsv	Mauritania	MRT	DoS Africa Region, Mauritania, International Military Education and Training (IMET), FY01	TRAINING AIDS & DEVICES			7/18/01	2001-07-18	9/30/01	2001-09-30		0	21809	https://2009-2017.state.gov/documents/organization/10964.pdf	Not checked against source; verify accuracy before use	2002-03	2019-07-16	6e7a83625955114a2c8224bf9d1c62ce
39224a3a-9473-4524-aacc-4d4e752d71be	03221d24-92ea-4ccc-a6a2-bd88dbfcd9fb	2001_2002_Africa_fmtrpt.tsv	Mauritania	MRT	DoS Africa Region, Mauritania, International Military Education and Training (IMET), FY01	TRAINING AIDS & DEVICES			7/18/01	2001-07-18	9/30/01	2001-09-30		0	5187	https://2009-2017.state.gov/documents/organization/10964.pdf	Not checked against source; verify accuracy before use	2002-03	2019-07-16	e9577e5fd64a7862da54f9c45f2f11ad
197590bb-d1d5-474f-9533-a15671462be7	03221d24-92ea-4ccc-a6a2-bd88dbfcd9fb	2001_2002_Africa_fmtrpt.tsv	Mauritania	MRT	DoS Africa Region, Mauritania, Africa Center for Strategic Studies, FY01	Senior Leader Seminar		Ministry of Foreign Affairs MOD	1/29/01	2001-01-29	2/9/01	2001-02-09	Libreville Gabon	4	8153	https://2009-2017.state.gov/documents/organization/10964.pdf	Not checked against source; verify accuracy before use	2002-03	2019-07-16	4628bf166c4f143242812cce64cc6d65
0cbbb3c4-6986-4992-a69b-89a6167268d2	03221d24-92ea-4ccc-a6a2-bd88dbfcd9fb	2001_2002_Africa_fmtrpt.tsv	Mauritania	MRT	DoS Africa Region, Mauritania, Africa Center for Strategic Studies, FY01	Sub-Regional Seminar		MOD MFA	8/20/01	2001-08-20	8/24/01	2001-08-24	Accra Ghana	4	5939	https://2009-2017.state.gov/documents/organization/10964.pdf	Not checked against source; verify accuracy before use	2002-03	2019-07-16	73e830265a5b5cfab0b4f290414b56ea
9805de40-c3ba-4322-9917-2d18fbf06d01	03221d24-92ea-4ccc-a6a2-bd88dbfcd9fb	2001_2002_Africa_fmtrpt.tsv	Mauritius	MUS	DoS Africa Region, Mauritius, International Military Education and Training (IMET), FY01	COXSWAIN C		Coast Guard	3/5/01	2001-03-05	3/30/01	2001-03-30	YORKTOWN, VA 23690-5000	1	3899	https://2009-2017.state.gov/documents/organization/10964.pdf	Not checked against source; verify accuracy before use	2002-03	2019-07-16	ef68baba46c0ea821efde10b56d81daa
382ce95a-d87f-423b-8b96-a2f8c1c0838a	03221d24-92ea-4ccc-a6a2-bd88dbfcd9fb	2001_2002_Africa_fmtrpt.tsv	Mauritius	MUS	DoS Africa Region, Mauritius, International Military Education and Training (IMET), FY01	COXSWAIN SMALL BOAT		Coast Guard	2/20/01	2001-02-20	3/3/01	2001-03-03	YORKTOWN, VA 23690-5000	1	5685	https://2009-2017.state.gov/documents/organization/10964.pdf	Not checked against source; verify accuracy before use	2002-03	2019-07-16	5847057f0d7ba20fac721487838bcf52
7e0b5283-1e1e-4f7c-bd09-bb943482f6ad	03221d24-92ea-4ccc-a6a2-bd88dbfcd9fb	2001_2002_Africa_fmtrpt.tsv	Mauritius	MUS	DoS Africa Region, Mauritius, International Military Education and Training (IMET), FY01	CRISIS CMD/CTRL - SR MGRS		Coast Guard	6/11/01	2001-06-11	6/22/01	2001-06-22	YORKTOWN, VA 23690-5000	1	5782	https://2009-2017.state.gov/documents/organization/10964.pdf	Not checked against source; verify accuracy before use	2002-03	2019-07-16	c1ef1ac6187104446b55ebf24670f562
f0db59d2-bb01-435c-9141-f811e616817a	03221d24-92ea-4ccc-a6a2-bd88dbfcd9fb	2001_2002_Africa_fmtrpt.tsv	Mauritius	MUS	DoS Africa Region, Mauritius, International Military Education and Training (IMET), FY01	INTL MARITIME OFF		Coast Guard	7/2/01	2001-07-02	9/7/01	2001-09-07	YORKTOWN, VA 23690-5000	1	9600	https://2009-2017.state.gov/documents/organization/10964.pdf	Not checked against source; verify accuracy before use	2002-03	2019-07-16	c298105e663e70ee8f7626f4f137b0ec
698ecfb8-783c-490f-9353-6b679752f72a	03221d24-92ea-4ccc-a6a2-bd88dbfcd9fb	2001_2002_Africa_fmtrpt.tsv	Mauritius	MUS	DoS Africa Region, Mauritius, International Military Education and Training (IMET), FY01	MET DIILS		Coast Guard	6/11/01	2001-06-11	6/15/01	2001-06-15	Mauritius	41	13200	https://2009-2017.state.gov/documents/organization/10964.pdf	Not checked against source; verify accuracy before use	2002-03	2019-07-16	f186fb9aaaef8e05cfd7a30b572ee911
bfb1d084-8950-42c3-964a-fb4864ad2f2f	03221d24-92ea-4ccc-a6a2-bd88dbfcd9fb	2001_2002_Africa_fmtrpt.tsv	Mauritius	MUS	DoS Africa Region, Mauritius, Asia-Pacific Center, FY01	Executive Course 01-1	U.S. military staff and faculty	Special Mobile Force	1/22/01	2001-01-22	4/12/01	2001-04-12	Asia-Pacific Center for Security Studies Honolulu, Hawaii	1	15133	https://2009-2017.state.gov/documents/organization/10964.pdf	Not checked against source; verify accuracy before use	2002-03	2019-07-16	8bd1250293575519e2d3b31978a9db69
1b46c312-5d7f-4030-91f7-25fc5247730d	03221d24-92ea-4ccc-a6a2-bd88dbfcd9fb	2001_2002_Africa_fmtrpt.tsv	Mauritius	MUS	Africa Region, Mauritius, Asia-Pacific Center, FY01	Executive Course 01-2	U.S. military staff and faculty	Coast Guard	1/22/01	2001-01-22	4/12/01	2001-04-12	Asia-Pacific Center for Security Studies Honolulu, Hawaii	1	15816	https://2009-2017.state.gov/documents/organization/10964.pdf	Not checked against source; verify accuracy before use	2002-03	2019-07-16	705dea40054eb2950090ef34e114246c
575aea87-6be0-461f-8036-595de39c4dca	03221d24-92ea-4ccc-a6a2-bd88dbfcd9fb	2001_2002_Africa_fmtrpt.tsv	Mauritius	MUS	DoS Africa Region, Mauritius, Africa Center for Strategic Studies, FY01	Senior Leader Seminar		MOD	1/29/01	2001-01-29	2/9/01	2001-02-09	Libreville Gabon	2	8896	https://2009-2017.state.gov/documents/organization/10964.pdf	Not checked against source; verify accuracy before use	2002-03	2019-07-16	a4982dd3ee0dba12e68e7dca17c7cd1a
c2cdb6b6-b81a-4e0c-a5e2-d91042459599	03221d24-92ea-4ccc-a6a2-bd88dbfcd9fb	2001_2002_Africa_fmtrpt.tsv	Mozambique	MOZ	DoS Africa Region, Mozambique, International Military Education and Training (IMET), FY01	ALLIED OFF PREP-INF OAC		CC, BCC	9/17/01	2001-09-17	9/21/01	2001-09-21	FT BENNING GA 31905-5468	1	1974	https://2009-2017.state.gov/documents/organization/10964.pdf	Not checked against source; verify accuracy before use	2002-03	2019-07-16	e8d743b2245bc2dfa8775bda7413c7f8
7b8484e5-b8db-4636-9ed3-b10581e91a70	03221d24-92ea-4ccc-a6a2-bd88dbfcd9fb	2001_2002_Africa_fmtrpt.tsv	Mozambique	MOZ	DoS Africa Region, Mozambique, International Military Education and Training (IMET), FY01	AMERICAN LANGUAGE COURSE		Staff, HQ Army Public Affairs	12/26/00	2000-12-26	6/1/01	2001-06-01	LACKLAND AFB, TX 78236	1	14522	https://2009-2017.state.gov/documents/organization/10964.pdf	Not checked against source; verify accuracy before use	2002-03	2019-07-16	6d313d697ae3d8ada3548f38079498d9
f2c0d5f6-25db-4640-b97f-95e64e0d09af	03221d24-92ea-4ccc-a6a2-bd88dbfcd9fb	2001_2002_Africa_fmtrpt.tsv	Mozambique	MOZ	DoS Africa Region, Mozambique, International Military Education and Training (IMET), FY01	ARMY-PCHT			1/1/01	2001-01-01	9/30/01	2001-09-30		0	5636	https://2009-2017.state.gov/documents/organization/10964.pdf	Not checked against source; verify accuracy before use	2002-03	2019-07-16	bb359aaa646b3f6fda4430ca43ba6432
93161ba9-23e3-4620-99ff-57e8de6f04c4	03221d24-92ea-4ccc-a6a2-bd88dbfcd9fb	2001_2002_Africa_fmtrpt.tsv	Mozambique	MOZ	DoS Africa Region, Mozambique, International Military Education and Training (IMET), FY01	CIV-MIL SID - AFRICA		Air Defense Commander	10/16/00	2000-10-16	10/27/00	2000-10-27	HURLBURT FIELD, FL 32544-5826	1	6284	https://2009-2017.state.gov/documents/organization/10964.pdf	Not checked against source; verify accuracy before use	2002-03	2019-07-16	73e15d7a02072930fe87a369fa1dbc03
69677ff0-45c5-411d-b2f1-8e509963d9ae	03221d24-92ea-4ccc-a6a2-bd88dbfcd9fb	2001_2002_Africa_fmtrpt.tsv	Mozambique	MOZ	DoS Africa Region, Mozambique, International Military Education and Training (IMET), FY01	CIV-MIL SID - AFRICA		MOD	10/16/00	2000-10-16	10/27/00	2000-10-27	HURLBURT FIELD, FL 32544-5826	1	6284	https://2009-2017.state.gov/documents/organization/10964.pdf	Not checked against source; verify accuracy before use	2002-03	2019-07-16	728376d355bd0dca695e8807cc39d0d5
51ddfb3f-735c-4faa-b596-d723ea8e902b	03221d24-92ea-4ccc-a6a2-bd88dbfcd9fb	2001_2002_Africa_fmtrpt.tsv	Mozambique	MOZ	DoS Africa Region, Mozambique, International Military Education and Training (IMET), FY01	ENGLISH LANGUAGE CRSE		CC, Boanne Commando Company	5/7/01	2001-05-07	8/24/01	2001-08-24	SAN ANTONIO TX 78236-5259	1	11551	https://2009-2017.state.gov/documents/organization/10964.pdf	Not checked against source; verify accuracy before use	2002-03	2019-07-16	1a3c1d06ef1c79ad5a4a1b09ed0194e1
2413a36d-4b60-4ae5-b9b9-680dc5987229	03221d24-92ea-4ccc-a6a2-bd88dbfcd9fb	2001_2002_Africa_fmtrpt.tsv	Mozambique	MOZ	DoS Africa Region, Mozambique, International Military Education and Training (IMET), FY01	LANGUAGE INSTRUCTOR/ADV		Army, Logistic Training Center	12/11/00	2000-12-11	3/30/01	2001-03-30	LACKLAND AFB, TX 78236	1	11327	https://2009-2017.state.gov/documents/organization/10964.pdf	Not checked against source; verify accuracy before use	2002-03	2019-07-16	3d9eae3fb5d525400739311c82cbf5ca
7573790d-d355-4ffe-bb1b-208407af0bde	03221d24-92ea-4ccc-a6a2-bd88dbfcd9fb	2001_2002_Africa_fmtrpt.tsv	Mozambique	MOZ	DoS Africa Region, Mozambique, International Military Education and Training (IMET), FY01	MET M/MARITIME SVC PH I		VADM Nhalungo, CC-Mozambican Navy, Vice Min of Defense Banze, FADM Chief of Staff Lidimo	1/22/01	2001-01-22	1/26/01	2001-01-26	Mozambique	0	11522	https://2009-2017.state.gov/documents/organization/10964.pdf	Not checked against source; verify accuracy before use	2002-03	2019-07-16	30882a7dfd1560fab4eedc0e24793b83
7fbeb714-d31b-46e3-9de4-766fd0a653a7	03221d24-92ea-4ccc-a6a2-bd88dbfcd9fb	2001_2002_Africa_fmtrpt.tsv	Mozambique	MOZ	DoS Africa Region, Mozambique, International Military Education and Training (IMET), FY01	MET M/MARITIME SVC PH II		Maj Lichado, Staff-MOC Training and Doctrine Command, CAPT's Antonio Podja and Nazario Zandamela, HQ Staff, Moz Navy	8/13/01	2001-08-13	8/17/01	2001-08-17	Mozambique	0	44000	https://2009-2017.state.gov/documents/organization/10964.pdf	Not checked against source; verify accuracy before use	2002-03	2019-07-16	e843e94426e8c2f44933c66c938a1143
0f678797-d104-4617-9ac9-a13da31b4670	03221d24-92ea-4ccc-a6a2-bd88dbfcd9fb	2001_2002_Africa_fmtrpt.tsv	Mozambique	MOZ	DoS Africa Region, Mozambique, International Military Education and Training (IMET), FY01	TAT-LANGUAGE LAB INSTALL		Nampula Military Academy (Logistic Training Center)	5/21/01	2001-05-21	9/30/01	2001-09-30	Mozambique	0	15000	https://2009-2017.state.gov/documents/organization/10964.pdf	Not checked against source; verify accuracy before use	2002-03	2019-07-16	4153abb9eb6dbfbc069b2b608cad4fe7
008b96ff-32c7-4c94-b2dd-91f773c2c878	03221d24-92ea-4ccc-a6a2-bd88dbfcd9fb	2001_2002_Africa_fmtrpt.tsv	Mozambique	MOZ	DoS Africa Region, Mozambique, International Military Education and Training (IMET), FY01	TRAINING AIDS & DEVICES			1/1/01	2001-01-01	9/30/01	2001-09-30		0	21809	https://2009-2017.state.gov/documents/organization/10964.pdf	Not checked against source; verify accuracy before use	2002-03	2019-07-16	1d8cdba6c6d27a524e0a64272073235f
2f13de0f-8736-4455-9607-1f114a2e302d	03221d24-92ea-4ccc-a6a2-bd88dbfcd9fb	2001_2002_Africa_fmtrpt.tsv	Mozambique	MOZ	DoS Africa Region, Mozambique, International Military Education and Training (IMET), FY01	TRAINING AIDS & DEVICES			1/1/01	2001-01-01	9/30/01	2001-09-30		0	5187	https://2009-2017.state.gov/documents/organization/10964.pdf	Not checked against source; verify accuracy before use	2002-03	2019-07-16	1fe6c0a867fc03ed4c4c9d6c981fc272
baf290d8-e384-43e8-b339-4919b1fb8b24	03221d24-92ea-4ccc-a6a2-bd88dbfcd9fb	2001_2002_Africa_fmtrpt.tsv	Mozambique	MOZ	DoS Africa Region, Mozambique, International Military Education and Training (IMET), FY01	TRAINING AIDS & DEVICES			1/1/01	2001-01-01	9/30/01	2001-09-30		0	1180	https://2009-2017.state.gov/documents/organization/10964.pdf	Not checked against source; verify accuracy before use	2002-03	2019-07-16	5c9e6d30990659d245ef760e4d626c2f
55b8272f-08ea-4086-ab4c-9db320c4c1f6	03221d24-92ea-4ccc-a6a2-bd88dbfcd9fb	2001_2002_Africa_fmtrpt.tsv	Namibia	NAM	DoS Africa Region, Namibia, International Military Education and Training (IMET), FY01	ACADEMIC INSTRUCTOR		AIR WING	4/2/01	2001-04-02	4/27/01	2001-04-27	MAXWELL AFB, AL 36112-6323	1	1849	https://2009-2017.state.gov/documents/organization/10964.pdf	Not checked against source; verify accuracy before use	2002-03	2019-07-16	55ed11488f52a7fdb6a7118766a451d5
1ff14f0d-2ef7-444d-8a6c-2b76ac0ef18f	03221d24-92ea-4ccc-a6a2-bd88dbfcd9fb	2001_2002_Africa_fmtrpt.tsv	Namibia	NAM	DoS Africa Region, Namibia, International Military Education and Training (IMET), FY01	SCHOOL										https://2009-2017.state.gov/documents/organization/10964.pdf	Not checked against source; verify accuracy before use	2002-03	2019-07-16	5b6a358a6062fcf0a4f5f09bbf7a26ca
13368324-aeb0-451b-83f4-67bc279fefb5	03221d24-92ea-4ccc-a6a2-bd88dbfcd9fb	2001_2002_Africa_fmtrpt.tsv	Namibia	NAM	DoS Africa Region, Namibia, International Military Education and Training (IMET), FY01	ADJ GEN OFFICER BASIC		MOD HQ WINDHOEK	11/7/00	2000-11-07	3/2/01	2001-03-02	FT JACKSON SC 29207-7040	1	11754	https://2009-2017.state.gov/documents/organization/10964.pdf	Not checked against source; verify accuracy before use	2002-03	2019-07-16	88892ead121ced3ec3b39444730d5201
66368a18-a110-47bc-a608-7cdd98d7d6aa	03221d24-92ea-4ccc-a6a2-bd88dbfcd9fb	2001_2002_Africa_fmtrpt.tsv	Namibia	NAM	DoS Africa Region, Namibia, International Military Education and Training (IMET), FY01	AMERICAN LANGUAGE COURSE		ROOIKOP - WALVIS BAY	1/16/01	2001-01-16	6/1/01	2001-06-01	LACKLAND AFB, TX 78236	1	9270	https://2009-2017.state.gov/documents/organization/10964.pdf	Not checked against source; verify accuracy before use	2002-03	2019-07-16	0223e7c17429c80f2c0bbbb56f8b3f72
a638c2ab-b167-448f-acd5-1d770c2c1d51	03221d24-92ea-4ccc-a6a2-bd88dbfcd9fb	2001_2002_Africa_fmtrpt.tsv	Namibia	NAM	DoS Africa Region, Namibia, International Military Education and Training (IMET), FY01	APPRENTICE CID SP AGENT		MILITARY POLICE	2/22/01	2001-02-22	6/7/01	2001-06-07	FT LEONARD WOOD MO 65473-5000	1	12282	https://2009-2017.state.gov/documents/organization/10964.pdf	Not checked against source; verify accuracy before use	2002-03	2019-07-16	119cbc43e32ca990bfe5e0dcdeadbb23
26b8a9f0-4413-421c-9ee3-42fec9c383f8	03221d24-92ea-4ccc-a6a2-bd88dbfcd9fb	2001_2002_Africa_fmtrpt.tsv	Namibia	NAM	Africa Region, Namibia, International Military Education and Training (IMET), FY01	CIV-MIL SID - AFRICA		AIR WING	10/16/00	2000-10-16	10/27/00	2000-10-27	HURLBURT FIELD, FL 32544-5826	1	7352	https://2009-2017.state.gov/documents/organization/10964.pdf	Not checked against source; verify accuracy before use	2002-03	2019-07-16	f8cee5027b3137be51738029c4717c44
5b7097a9-6878-4515-9b86-f3f0c4917193	03221d24-92ea-4ccc-a6a2-bd88dbfcd9fb	2001_2002_Africa_fmtrpt.tsv	Namibia	NAM	Africa Region, Namibia, International Military Education and Training (IMET), FY01	CIV-MIL SID - AFRICA		AIR WING	10/16/00	2000-10-16	10/27/00	2000-10-27	HURLBURT FIELD, FL 32544-5826	1	7352	https://2009-2017.state.gov/documents/organization/10964.pdf	Not checked against source; verify accuracy before use	2002-03	2019-07-16	f8cee5027b3137be51738029c4717c44
517c8734-709c-47a2-8b64-6d5176e79889	03221d24-92ea-4ccc-a6a2-bd88dbfcd9fb	2001_2002_Africa_fmtrpt.tsv	Namibia	NAM	Africa Region, Namibia, International Military Education and Training (IMET), FY01	COMBINED LOG CPT CAREER		DEPOT - WINDHOEK	6/20/01	2001-06-20	8/3/01	2001-08-03	FT LEE VA 23801-1705	1	3775	https://2009-2017.state.gov/documents/organization/10964.pdf	Not checked against source; verify accuracy before use	2002-03	2019-07-16	abadd556025d23ca0ca9a013831aae58
c187fc05-eb11-426c-aaf2-300dda07545f	03221d24-92ea-4ccc-a6a2-bd88dbfcd9fb	2001_2002_Africa_fmtrpt.tsv	Namibia	NAM	Africa Region, Namibia, International Military Education and Training (IMET), FY01	COMBINED LOG OFF		DEPOT - WINDHOEK	8/7/01	2001-08-07	9/11/01	2001-09-11	FT EUSTIS VA 23604-5481	1	4073	https://2009-2017.state.gov/documents/organization/10964.pdf	Not checked against source; verify accuracy before use	2002-03	2019-07-16	73e51a971ab48016bbed3bd385d6bc5d
f03d53fd-7931-4813-abd7-203a30b57334	03221d24-92ea-4ccc-a6a2-bd88dbfcd9fb	2001_2002_Africa_fmtrpt.tsv	Namibia	NAM	Africa Region, Namibia, International Military Education and Training (IMET), FY01	ENGLISH LANGUAGE CRSE		COMPOSITE DEPOT	5/7/01	2001-05-07	7/20/01	2001-07-20	SAN ANTONIO TX 78236-5259	1	10204	https://2009-2017.state.gov/documents/organization/10964.pdf	Not checked against source; verify accuracy before use	2002-03	2019-07-16	5a44575b3f09388b8d1e50f81185f6fb
6f5bf0be-9075-416f-bdb8-597ed9d7ceb7	03221d24-92ea-4ccc-a6a2-bd88dbfcd9fb	2001_2002_Africa_fmtrpt.tsv	Namibia	NAM	Africa Region, Namibia, International Military Education and Training (IMET), FY01	INTERNATIONAL OFF LOG PREP		COMPOSITE DEPOT	7/30/01	2001-07-30	8/10/01	2001-08-10	FT LEE VA 23801-1705	1	2422	https://2009-2017.state.gov/documents/organization/10964.pdf	Not checked against source; verify accuracy before use	2002-03	2019-07-16	fc0fe24a65bd75f548461d6a6061880a
6f888ca5-3c53-4445-ad75-ea3c116e4e1a	03221d24-92ea-4ccc-a6a2-bd88dbfcd9fb	2001_2002_Africa_fmtrpt.tsv	Namibia	NAM	Africa Region, Namibia, International Military Education and Training (IMET), FY01	INTERNATIONAL OFF LOG PREP		DEPOT - WINDHOEK	6/4/01	2001-06-04	6/15/01	2001-06-15	FT LEE VA 23801-1705	1	6665	https://2009-2017.state.gov/documents/organization/10964.pdf	Not checked against source; verify accuracy before use	2002-03	2019-07-16	67bcf39b6965e394b14ef7973b69715f
406fd1d8-b639-4f52-b33b-1a54f2e725d6	03221d24-92ea-4ccc-a6a2-bd88dbfcd9fb	2001_2002_Africa_fmtrpt.tsv	Namibia	NAM	Africa Region, Namibia, International Military Education and Training (IMET), FY01	INTL OFF SCH & SOS		AIR WING	1/8/01	2001-01-08	3/31/01	2001-03-31	MAXWELL AFB, AL 36112-6323	1	11687	https://2009-2017.state.gov/documents/organization/10964.pdf	Not checked against source; verify accuracy before use	2002-03	2019-07-16	f28eb6f30f698719f9eb9838579f89dc
39464c5d-66ba-491f-83e8-a7a5313a2e1f	03221d24-92ea-4ccc-a6a2-bd88dbfcd9fb	2001_2002_Africa_fmtrpt.tsv	Namibia	NAM	Africa Region, Namibia, International Military Education and Training (IMET), FY01	LANGUAGE INSTRUCTOR/BASIC		LANGUAGE TRAINING - OSONA	1/8/01	2001-01-08	7/13/01	2001-07-13	LACKLAND AFB, TX 78236	1	17284	https://2009-2017.state.gov/documents/organization/10964.pdf	Not checked against source; verify accuracy before use	2002-03	2019-07-16	8819fe8fe4a9f81f67d92a847b94edc1
32c09dd5-374a-4174-a7cb-9002bd7520da	03221d24-92ea-4ccc-a6a2-bd88dbfcd9fb	2001_2002_Africa_fmtrpt.tsv	Namibia	NAM	Africa Region, Namibia, International Military Education and Training (IMET), FY01	LANGUAGE INSTRUCTOR/BASIC		ROOIKOP - WALVIS BAY	1/8/01	2001-01-08	1/12/01	2001-01-12	LACKLAND AFB, TX 78236	1	11106	https://2009-2017.state.gov/documents/organization/10964.pdf	Not checked against source; verify accuracy before use	2002-03	2019-07-16	3b232e15beb45afc804165c73cc05cca
994e0a3b-55b6-4054-abd3-8a5100b17813	03221d24-92ea-4ccc-a6a2-bd88dbfcd9fb	2001_2002_Africa_fmtrpt.tsv	Namibia	NAM	Africa Region, Namibia, International Military Education and Training (IMET), FY01	MET REGIONAL CIV-MIL RELS		PUBLIC RELATIONS AT MINISTRY OF DEFENSE Quantity should be 1 - not 30	6/25/01	2001-06-25	6/25/01	2001-06-25	Namibia	1	640	https://2009-2017.state.gov/documents/organization/10964.pdf	Not checked against source; verify accuracy before use	2002-03	2019-07-16	c692a17c36f8a5b0c0acf5b9d031c139
d2e8ef28-b8a0-48a4-ac00-05e7d9e15840	03221d24-92ea-4ccc-a6a2-bd88dbfcd9fb	2001_2002_Africa_fmtrpt.tsv	Namibia	NAM	Africa Region, Namibia, International Military Education and Training (IMET), FY01	MET REGIONAL CIV-MIL RELS		C/OPERATIONS Quantity should be 1 - not 30	6/25/01	2001-06-25	6/25/01	2001-06-25	Namibia	1	640	https://2009-2017.state.gov/documents/organization/10964.pdf	Not checked against source; verify accuracy before use	2002-03	2019-07-16	ae600a5d32031418f430a50f14f33209
b842bcf1-8606-4130-8d77-90192009a716	03221d24-92ea-4ccc-a6a2-bd88dbfcd9fb	2001_2002_Africa_fmtrpt.tsv	Namibia	NAM	Africa Region, Namibia, International Military Education and Training (IMET), FY01	NAVAL STAFF COLLEGE		MARITIME WING	1/11/01	2001-01-11	6/15/01	2001-06-15	NEWPORT, RI 02841-1207	1	27056	https://2009-2017.state.gov/documents/organization/10964.pdf	Not checked against source; verify accuracy before use	2002-03	2019-07-16	148d7ed428cc63ede1f496834ad106c3
e045389b-6801-4de8-a941-535014c3f98c	03221d24-92ea-4ccc-a6a2-bd88dbfcd9fb	2001_2002_Africa_fmtrpt.tsv	Namibia	NAM	Africa Region, Namibia, International Military Education and Training (IMET), FY01	PROTECTIVE SERVICES TNG		MILITARY POLICE	6/11/01	2001-06-11	6/29/01	2001-06-29	FT LEONARD WOOD MO 65473-5000	1	1887	https://2009-2017.state.gov/documents/organization/10964.pdf	Not checked against source; verify accuracy before use	2002-03	2019-07-16	023a507cf542ed6b4e505088de35cfbf
dfd9e98c-8243-497b-b29f-2e75c7f8d308	03221d24-92ea-4ccc-a6a2-bd88dbfcd9fb	2001_2002_Africa_fmtrpt.tsv	Namibia	NAM	Africa Region, Namibia, International Military Education and Training (IMET), FY01	U.S. ARMY SGT MAJOR PREP		MOD HQ SPEC ASST TO SGT MAJ	7/23/01	2001-07-23	8/10/01	2001-08-10	FT BLISS TX 79918-8002	1	6242	https://2009-2017.state.gov/documents/organization/10964.pdf	Not checked against source; verify accuracy before use	2002-03	2019-07-16	33bd08af9f15766b0bf089a4702bcb41
8df5043c-9144-4ef1-954d-94a7deac4c1d	03221d24-92ea-4ccc-a6a2-bd88dbfcd9fb	2001_2002_Africa_fmtrpt.tsv	Namibia	NAM	DoS Africa Region, Namibia, Africa Center for Strategic Studies, FY01	Senior Leader Seminar		MOD	1/29/01	2001-01-29	2/9/01	2001-02-09	Libreville Gabon	2	9467	https://2009-2017.state.gov/documents/organization/10964.pdf	Not checked against source; verify accuracy before use	2002-03	2019-07-16	496b9b2e2a4a77e0dddbddbe21d1883f
93515891-b45b-44c9-b354-749caf838ed8	03221d24-92ea-4ccc-a6a2-bd88dbfcd9fb	2001_2002_Africa_fmtrpt.tsv	Niger	NER	DoS Africa Region, Niger, International Military Education and Training (IMET), FY01	ARMY-PCHT			1/15/01	2001-01-15	9/30/01	2001-09-30		0	5636	https://2009-2017.state.gov/documents/organization/10964.pdf	Not checked against source; verify accuracy before use	2002-03	2019-07-16	26d377de8f6fc1020261cebbcb436e76
9e4088aa-4a05-4c7a-95e3-ab91cb878b50	03221d24-92ea-4ccc-a6a2-bd88dbfcd9fb	2001_2002_Africa_fmtrpt.tsv	Niger	NER	DoS Africa Region, Niger, International Military Education and Training (IMET), FY01	DRMI SEMINAR - OVERSEAS		Head of investment Nigerien Ministry of Plan Quantify should be 1 - not 30	6/4/01	2001-06-04	6/15/01	2001-06-15	Niger	1	4500	https://2009-2017.state.gov/documents/organization/10964.pdf	Not checked against source; verify accuracy before use	2002-03	2019-07-16	6527cc3a46806a92d58dab7ac1503a42
b8c8b10b-2403-4bde-a5b8-bc04b01e34c1	03221d24-92ea-4ccc-a6a2-bd88dbfcd9fb	2001_2002_Africa_fmtrpt.tsv	Niger	NER	DoS Africa Region, Niger, International Military Education and Training (IMET), FY01	DRMI SEMINAR - OVERSEAS		Head of administrative and Financial Directorate Nigerien Ministry of National Defense. Quantify should be 1 - not 30	6/4/01	2001-06-04	6/15/01	2001-06-15	Niger	1	4500	https://2009-2017.state.gov/documents/organization/10964.pdf	Not checked against source; verify accuracy before use	2002-03	2019-07-16	173e3edf34a58c06e7587d31cdb966b8
5d94f4f1-4fa9-4d23-9467-9c8e19b960cd	03221d24-92ea-4ccc-a6a2-bd88dbfcd9fb	2001_2002_Africa_fmtrpt.tsv	Niger	NER	DoS Africa Region, Niger, International Military Education and Training (IMET), FY01	DRMI SEMINAR - OVERSEAS		Member of Parliament, Nigerien National Assemble Quantify should be 1 - not 30	6/4/01	2001-06-04	6/15/01	2001-06-15	Niger	1	4500	https://2009-2017.state.gov/documents/organization/10964.pdf	Not checked against source; verify accuracy before use	2002-03	2019-07-16	2cab7fad4481a08e4ce838b5674dee32
bc3a484f-28cd-4e82-b930-2a7748d8a7bb	03221d24-92ea-4ccc-a6a2-bd88dbfcd9fb	2001_2002_Africa_fmtrpt.tsv	Niger	NER	DoS Africa Region, Niger, International Military Education and Training (IMET), FY01	DRMI SEMINAR - OVERSEAS		Head of studies and programming at Nigerien Army Chief of staff's Office Quantify should be 1 - not 30	6/4/01	2001-06-04	6/15/01	2001-06-15	Niger	1	4500	https://2009-2017.state.gov/documents/organization/10964.pdf	Not checked against source; verify accuracy before use	2002-03	2019-07-16	349fd333fc20b306d77897e8facd9f2f
de608071-b345-4c18-aea5-cf6738a61ee1	03221d24-92ea-4ccc-a6a2-bd88dbfcd9fb	2001_2002_Africa_fmtrpt.tsv	Niger	NER	DoS Africa Region, Niger, International Military Education and Training (IMET), FY01	MET REGIONAL DIILS		Cancelled - 0 students	7/23/01	2001-07-23	7/27/01	2001-07-27	Niger	1	1199	https://2009-2017.state.gov/documents/organization/10964.pdf	Not checked against source; verify accuracy before use	2002-03	2019-07-16	5985d1fd53c869cc100f4cff70c8d7e7
a5fe1eaa-2a7d-40c9-a70e-90e1842b3596	03221d24-92ea-4ccc-a6a2-bd88dbfcd9fb	2001_2002_Africa_fmtrpt.tsv	Niger	NER	DoS Africa Region, Niger, International Military Education and Training (IMET), FY01	MET REGIONAL DIILS		Cancelled - 0 students	7/23/01	2001-07-23	7/27/01	2001-07-27	Niger	1	1199	https://2009-2017.state.gov/documents/organization/10964.pdf	Not checked against source; verify accuracy before use	2002-03	2019-07-16	5985d1fd53c869cc100f4cff70c8d7e7
aad14809-2468-4a30-ae1e-d2884cb1233e	03221d24-92ea-4ccc-a6a2-bd88dbfcd9fb	2001_2002_Africa_fmtrpt.tsv	Niger	NER	Africa Region, Niger, International Military Education and Training (IMET), FY01	TAT-LANGUAGE LAB INSTALL		Lab installation team - no students	5/22/01	2001-05-22	9/30/01	2001-09-30	Niger	0	6000	https://2009-2017.state.gov/documents/organization/10964.pdf	Not checked against source; verify accuracy before use	2002-03	2019-07-16	65520a212c16b8c4af9543f464c7c9f4
c814dc2d-6631-4af1-a0f6-49c568aa6a6b	03221d24-92ea-4ccc-a6a2-bd88dbfcd9fb	2001_2002_Africa_fmtrpt.tsv	Niger	NER	Africa Region, Niger, International Military Education and Training (IMET), FY01	TRAINING AIDS & DEVICES			1/15/01	2001-01-15	9/30/01	2001-09-30		0	1180	https://2009-2017.state.gov/documents/organization/10964.pdf	Not checked against source; verify accuracy before use	2002-03	2019-07-16	d144a8eb29e243a7b51b59d6779d2243
782b7c5d-2cc7-4b48-9be3-34aaa880bcb8	03221d24-92ea-4ccc-a6a2-bd88dbfcd9fb	2001_2002_Africa_fmtrpt.tsv	Niger	NER	Africa Region, Niger, International Military Education and Training (IMET), FY01	TRAINING AIDS & DEVICES			1/15/01	2001-01-15	9/30/01	2001-09-30		0	5187	https://2009-2017.state.gov/documents/organization/10964.pdf	Not checked against source; verify accuracy before use	2002-03	2019-07-16	c9183002cc710d7ed26efa80d4608682
77929b03-a0a0-4f29-b5a2-07774a502084	03221d24-92ea-4ccc-a6a2-bd88dbfcd9fb	2001_2002_Africa_fmtrpt.tsv	Niger	NER	Africa Region, Niger, International Military Education and Training (IMET), FY01	TRAINING AIDS & DEVICES			1/15/01	2001-01-15	9/30/01	2001-09-30		0	21809	https://2009-2017.state.gov/documents/organization/10964.pdf	Not checked against source; verify accuracy before use	2002-03	2019-07-16	b17b3aed5cdcf9cbbb456007e499ece4
cfee0c58-a3af-4a65-8721-35aea1fa2839	03221d24-92ea-4ccc-a6a2-bd88dbfcd9fb	2001_2002_Africa_fmtrpt.tsv	Niger	NER	DoS Africa Region, Niger, Africa Center for Strategic Studies, FY01	Senior Leader Seminar		Presidential Advisor	1/29/01	2001-01-29	2/9/01	2001-02-09	Libreville Gabon	4	8155	https://2009-2017.state.gov/documents/organization/10964.pdf	Not checked against source; verify accuracy before use	2002-03	2019-07-16	4431a1ffb1d0a7472d3f3d6255810468
0db810d0-47c8-4188-9c6f-795e37ffa4a3	03221d24-92ea-4ccc-a6a2-bd88dbfcd9fb	2001_2002_Africa_fmtrpt.tsv	Niger	NER	DoS Africa Region, Niger, Africa Center for Strategic Studies, FY01	Sub-Regional Seminar		MOD MFA	8/20/01	2001-08-20	8/24/01	2001-08-24	Accra Ghana	4	5949	https://2009-2017.state.gov/documents/organization/10964.pdf	Not checked against source; verify accuracy before use	2002-03	2019-07-16	3392f82b0de3449c2fc9a3f2243084c5
da099a4a-f3a5-4e85-9223-71cc3a1679ad	03221d24-92ea-4ccc-a6a2-bd88dbfcd9fb	2001_2002_Africa_fmtrpt.tsv	Nigeria	NGA	DoS Africa Region, Nigeria, International Military Education and Training (IMET), FY01	ALLIED OFF PREP-INF OAC		Cancelled	1/8/01	2001-01-08	1/12/01	2001-01-12	FT BENNING GA 31905-5468	1	249	https://2009-2017.state.gov/documents/organization/10964.pdf	Not checked against source; verify accuracy before use	2002-03	2019-07-16	e8b2eaa5ee9e3047b1d280948345fa30
61246ac5-c7cf-4ae7-a34b-59c863166b7d	03221d24-92ea-4ccc-a6a2-bd88dbfcd9fb	2001_2002_Africa_fmtrpt.tsv	Nigeria	NGA	DoS Africa Region, Nigeria, International Military Education and Training (IMET), FY01	ARMOR CAPTAINS CAREER		Cancelled	1/22/01	2001-01-22	5/25/01	2001-05-25	FT KNOX KY 40121-5234	1	1978	https://2009-2017.state.gov/documents/organization/10964.pdf	Not checked against source; verify accuracy before use	2002-03	2019-07-16	a9ba97bd51ab459d0262abde0cc279ce
2b977447-fd2e-4b92-963a-ba9dfd92a431	03221d24-92ea-4ccc-a6a2-bd88dbfcd9fb	2001_2002_Africa_fmtrpt.tsv	Nigeria	NGA	DoS Africa Region, Nigeria, International Military Education and Training (IMET), FY01	ARMOR CPT CAREER CRS PREP		Cancelled	1/8/01	2001-01-08	1/19/01	2001-01-19	FT KNOX KY 40121-5234	1	630	https://2009-2017.state.gov/documents/organization/10964.pdf	Not checked against source; verify accuracy before use	2002-03	2019-07-16	79aa92aac9ebc351fac45ff9a2618fb3
8a8c80ee-1d68-403e-b116-a3329021e8cb	03221d24-92ea-4ccc-a6a2-bd88dbfcd9fb	2001_2002_Africa_fmtrpt.tsv	Nigeria	NGA	DoS Africa Region, Nigeria, International Military Education and Training (IMET), FY01	CRISIS CMD/CTRL - SR MGRS		Cancelled	6/11/01	2001-06-11	6/22/01	2001-06-22	YORKTOWN, VA 23690-5000	1	1909	https://2009-2017.state.gov/documents/organization/10964.pdf	Not checked against source; verify accuracy before use	2002-03	2019-07-16	3e5d8c257d57f20096c32960fbc2a8c1
fc916b0b-b341-4802-abeb-83c4c77e1bce	03221d24-92ea-4ccc-a6a2-bd88dbfcd9fb	2001_2002_Africa_fmtrpt.tsv	Nigeria	NGA	DoS Africa Region, Nigeria, International Military Education and Training (IMET), FY01	CRISIS CMD/CTRL - SR MGRS		Cancelled	6/11/01	2001-06-11	6/22/01	2001-06-22	YORKTOWN, VA 23690-5000	1	1909	https://2009-2017.state.gov/documents/organization/10964.pdf	Not checked against source; verify accuracy before use	2002-03	2019-07-16	3e5d8c257d57f20096c32960fbc2a8c1
35f8c7e6-e98c-49c0-8324-c5655d8fb4fa	03221d24-92ea-4ccc-a6a2-bd88dbfcd9fb	2001_2002_Africa_fmtrpt.tsv	Nigeria	NGA	DoS Africa Region, Nigeria, International Military Education and Training (IMET), FY01	CRISIS CMD/CTRL - SR MGRS		Cancelled	6/11/01	2001-06-11	6/22/01	2001-06-22	YORKTOWN, VA 23690-5000	1	1909	https://2009-2017.state.gov/documents/organization/10964.pdf	Not checked against source; verify accuracy before use	2002-03	2019-07-16	3e5d8c257d57f20096c32960fbc2a8c1
6811dadc-6a4c-4317-9330-6d63ec433912	03221d24-92ea-4ccc-a6a2-bd88dbfcd9fb	2001_2002_Africa_fmtrpt.tsv	Nigeria	NGA	DoS Africa Region, Nigeria, International Military Education and Training (IMET), FY01	ENTRY LEVEL PORT OPS GMRP3		Cancelled	8/6/01	2001-08-06	8/31/01	2001-08-31	YORKTOWN, VA 23690-5000	1	680	https://2009-2017.state.gov/documents/organization/10964.pdf	Not checked against source; verify accuracy before use	2002-03	2019-07-16	742802b4409fc8753860e10a5255926b
92c77fbf-76a4-46ec-ab84-3b9b9fc663c4	03221d24-92ea-4ccc-a6a2-bd88dbfcd9fb	2001_2002_Africa_fmtrpt.tsv	Nigeria	NGA	DoS Africa Region, Nigeria, International Military Education and Training (IMET), FY01	ENTRY LEVEL PORT OPS GMRP3		Cancelled	4/23/01	2001-04-23	5/18/01	2001-05-18	YORKTOWN, VA 23690-5000	1	680	https://2009-2017.state.gov/documents/organization/10964.pdf	Not checked against source; verify accuracy before use	2002-03	2019-07-16	4342101161cc3cac2fff96f1fda51bdd
57c28371-2d98-417b-b550-314ccc259e03	03221d24-92ea-4ccc-a6a2-bd88dbfcd9fb	2001_2002_Africa_fmtrpt.tsv	Nigeria	NGA	DoS Africa Region, Nigeria, International Military Education and Training (IMET), FY01	ENTRY LEVEL PORT OPS GMRP3		Cancelled	8/6/01	2001-08-06	8/31/01	2001-08-31	YORKTOWN, VA 23690-5000	1	680	https://2009-2017.state.gov/documents/organization/10964.pdf	Not checked against source; verify accuracy before use	2002-03	2019-07-16	742802b4409fc8753860e10a5255926b
19cde3a7-5f81-4706-b60b-9c1950d43dff	03221d24-92ea-4ccc-a6a2-bd88dbfcd9fb	2001_2002_Africa_fmtrpt.tsv	Nigeria	NGA	DoS Africa Region, Nigeria, International Military Education and Training (IMET), FY01	EXEC PRGM IN CIV-MIL REL		NAVAL COLL, Navy	6/11/01	2001-06-11	6/22/01	2001-06-22	MONTEREY, CA 93943-5001	1	9158	https://2009-2017.state.gov/documents/organization/10964.pdf	Not checked against source; verify accuracy before use	2002-03	2019-07-16	b8b53f7e85238dce38862ddfe11fa15a
171c8fae-8a6c-455f-a6f0-338ff2132fe0	03221d24-92ea-4ccc-a6a2-bd88dbfcd9fb	2001_2002_Africa_fmtrpt.tsv	Nigeria	NGA	DoS Africa Region, Nigeria, International Military Education and Training (IMET), FY01	EXEC PRGM IN CIV-MIL REL		Joint Services, MOD	6/11/01	2001-06-11	6/22/01	2001-06-22	MONTEREY, CA 93943-5001	1	9158	https://2009-2017.state.gov/documents/organization/10964.pdf	Not checked against source; verify accuracy before use	2002-03	2019-07-16	a71c4a982ee9efa92a20cfa26482f15d
0719cf30-821f-4915-9bdf-46939e452a33	03221d24-92ea-4ccc-a6a2-bd88dbfcd9fb	2001_2002_Africa_fmtrpt.tsv	Nigeria	NGA	DoS Africa Region, Nigeria, International Military Education and Training (IMET), FY01	FA OFF ADV PREP-ALLIED OFF		Cancelled	12/4/00	2000-12-04	1/9/01	2001-01-09	FT SILL OK 73503	1	1572	https://2009-2017.state.gov/documents/organization/10964.pdf	Not checked against source; verify accuracy before use	2002-03	2019-07-16	bf76afb8872cf26ad9a2ee17f3c81baf
1048f355-972f-4cdc-b3ab-3f7f3e81d3dd	03221d24-92ea-4ccc-a6a2-bd88dbfcd9fb	2001_2002_Africa_fmtrpt.tsv	Nigeria	NGA	DoS Africa Region, Nigeria, International Military Education and Training (IMET), FY01	FIELD ARTY CAPTAINS CAREER		Cancelled	1/18/01	2001-01-18	5/24/01	2001-05-24	FT SILL OK 73503	1	2173	https://2009-2017.state.gov/documents/organization/10964.pdf	Not checked against source; verify accuracy before use	2002-03	2019-07-16	9f731c2f472a0000b1720b1cd30ddd2e
8c213e83-17c5-44bd-a925-d1140b559ec9	03221d24-92ea-4ccc-a6a2-bd88dbfcd9fb	2001_2002_Africa_fmtrpt.tsv	Nigeria	NGA	DoS Africa Region, Nigeria, International Military Education and Training (IMET), FY01	INFANTRY CAPTS CAREER CRS		Cancelled	1/16/01	2001-01-16	5/22/01	2001-05-22	FT BENNING GA 31905-5468	1	1840	https://2009-2017.state.gov/documents/organization/10964.pdf	Not checked against source; verify accuracy before use	2002-03	2019-07-16	db4aa3fdf5cc0490a3ed806f1d6159ba
dc824f71-b208-43a7-91bc-9d7a2ece0b81	03221d24-92ea-4ccc-a6a2-bd88dbfcd9fb	2001_2002_Africa_fmtrpt.tsv	Nigeria	NGA	DoS Africa Region, Nigeria, International Military Education and Training (IMET), FY01	INTERNATIONAL OFFICER PREP		SI LIST Army	6/19/01	2001-06-19	7/6/01	2001-07-06	FT LEAVENWORTH KS 66027-1352	1	5833	https://2009-2017.state.gov/documents/organization/10964.pdf	Not checked against source; verify accuracy before use	2002-03	2019-07-16	05a9a28f0f22ba5865c75a6e672991fd
1be46141-abbc-4be5-953f-3f72643b6490	03221d24-92ea-4ccc-a6a2-bd88dbfcd9fb	2001_2002_Africa_fmtrpt.tsv	Nigeria	NGA	DoS Africa Region, Nigeria, International Military Education and Training (IMET), FY01	INTL MARITIME OFF		Cancelled	7/2/01	2001-07-02	9/7/01	2001-09-07	YORKTOWN, VA 23690-5000	1	7675	https://2009-2017.state.gov/documents/organization/10964.pdf	Not checked against source; verify accuracy before use	2002-03	2019-07-16	f3d830e7bc97f1bc738d5af05a4989b5
9101b1a6-7014-495b-b782-548def4a5181	03221d24-92ea-4ccc-a6a2-bd88dbfcd9fb	2001_2002_Africa_fmtrpt.tsv	Nigeria	NGA	DoS Africa Region, Nigeria, International Military Education and Training (IMET), FY01	INTL MARITIME OFF		Cancelled	7/2/01	2001-07-02	9/8/01	2001-09-08	YORKTOWN, VA 23690-5000	1	7675	https://2009-2017.state.gov/documents/organization/10964.pdf	Not checked against source; verify accuracy before use	2002-03	2019-07-16	b5645b2bf906debd77273574db015be3
dbf5725b-0e19-44bc-b131-7ea1cb881356	03221d24-92ea-4ccc-a6a2-bd88dbfcd9fb	2001_2002_Africa_fmtrpt.tsv	Nigeria	NGA	DoS Africa Region, Nigeria, International Military Education and Training (IMET), FY01	INTL MARITIME OFF		Cancelled	7/2/01	2001-07-02	9/7/01	2001-09-07	YORKTOWN, VA 23690-5000	1	7675	https://2009-2017.state.gov/documents/organization/10964.pdf	Not checked against source; verify accuracy before use	2002-03	2019-07-16	f3d830e7bc97f1bc738d5af05a4989b5
887ed44c-fb57-4306-a639-b76d3090e015	03221d24-92ea-4ccc-a6a2-bd88dbfcd9fb	2001_2002_Africa_fmtrpt.tsv	Nigeria	NGA	DoS Africa Region, Nigeria, International Military Education and Training (IMET), FY01	INTL OFF SCH (FOR AC&SC)		HQ Nigerian Air Force	6/18/01	2001-06-18	7/27/01	2001-07-27	MAXWELL AFB, AL 36112-6323	1	10895	https://2009-2017.state.gov/documents/organization/10964.pdf	Not checked against source; verify accuracy before use	2002-03	2019-07-16	7e1638e9e72f6b6e77986181bb8c44f7
b61e215f-1521-410c-83ad-ab47c009b7e2	03221d24-92ea-4ccc-a6a2-bd88dbfcd9fb	2001_2002_Africa_fmtrpt.tsv	Nigeria	NGA	DoS Africa Region, Nigeria, International Military Education and Training (IMET), FY01	INTL OFF SCH (FOR AC&SC)		HQ Nigerian Air Force	6/18/01	2001-06-18	7/27/01	2001-07-27	MAXWELL AFB, AL 36112-6323	1	10895	https://2009-2017.state.gov/documents/organization/10964.pdf	Not checked against source; verify accuracy before use	2002-03	2019-07-16	7e1638e9e72f6b6e77986181bb8c44f7
702bf1ad-1453-4fc5-929e-85ddd7e4c65e	03221d24-92ea-4ccc-a6a2-bd88dbfcd9fb	2001_2002_Africa_fmtrpt.tsv	Nigeria	NGA	DoS Africa Region, Nigeria, International Military Education and Training (IMET), FY01	INTL OFF SCH (FOR AWC)		HQ Nigerian Air Force	6/11/01	2001-06-11	7/20/01	2001-07-20	MAXWELL AFB, AL 36112-6323	1	11005	https://2009-2017.state.gov/documents/organization/10964.pdf	Not checked against source; verify accuracy before use	2002-03	2019-07-16	db89aaae20d1ea7ef016462815f9f952
bfd60211-5623-4243-9c27-0f8622b59a94	03221d24-92ea-4ccc-a6a2-bd88dbfcd9fb	2001_2002_Africa_fmtrpt.tsv	Nigeria	NGA	DoS Africa Region, Nigeria, International Military Education and Training (IMET), FY01	LAW OF WAR		DHQ TRG Army	9/17/01	2001-09-17	9/19/01	2001-09-19	CAMP LEJEUNE, NC 28542-0004	1	623	https://2009-2017.state.gov/documents/organization/10964.pdf	Not checked against source; verify accuracy before use	2002-03	2019-07-16	dc88c91754dcd198cde68cf2594083a4
4bf57d9f-b029-46d9-9bb7-184e448626ec	03221d24-92ea-4ccc-a6a2-bd88dbfcd9fb	2001_2002_Africa_fmtrpt.tsv	Nigeria	NGA	DoS Africa Region, Nigeria, International Military Education and Training (IMET), FY01	LAW OF WAR		Legal Dept, MOD	9/17/01	2001-09-17	9/19/01	2001-09-19	CAMP LEJEUNE, NC 28542-0004	1	623	https://2009-2017.state.gov/documents/organization/10964.pdf	Not checked against source; verify accuracy before use	2002-03	2019-07-16	b0b118d2e4b005ff4d083422dac75aca
93976536-3a57-4feb-944a-20e8e4d750a2	03221d24-92ea-4ccc-a6a2-bd88dbfcd9fb	2001_2002_Africa_fmtrpt.tsv	Nigeria	NGA	DoS Africa Region, Nigeria, International Military Education and Training (IMET), FY01	MANAGING INTL CONFLICT MIC		Dept Army Ops	5/21/01	2001-05-21	5/25/01	2001-05-25	NEWPORT, RI 02841-1523	1	910	https://2009-2017.state.gov/documents/organization/10964.pdf	Not checked against source; verify accuracy before use	2002-03	2019-07-16	13c7c507198dcaa326141f5fac69ea35
98e2db18-e728-4e7e-9342-3c19d031c647	03221d24-92ea-4ccc-a6a2-bd88dbfcd9fb	2001_2002_Africa_fmtrpt.tsv	Nigeria	NGA	DoS Africa Region, Nigeria, International Military Education and Training (IMET), FY01	MET DIILS		Cancelled	9/17/01	2001-09-17	9/21/01	2001-09-21	Nigeria	30	11320	https://2009-2017.state.gov/documents/organization/10964.pdf	Not checked against source; verify accuracy before use	2002-03	2019-07-16	0ef9f744489238b085b4b954524a8876
992db6cb-9ef4-488c-9b90-401a4238c05f	03221d24-92ea-4ccc-a6a2-bd88dbfcd9fb	2001_2002_Africa_fmtrpt.tsv	Nigeria	NGA	DoS Africa Region, Nigeria, International Military Education and Training (IMET), FY01	MIL & PCKEEP OPS IAW ROL		Dept Army Ops	4/16/01	2001-04-16	5/18/01	2001-05-18	NEWPORT, RI 02841-1523	1	15992	https://2009-2017.state.gov/documents/organization/10964.pdf	Not checked against source; verify accuracy before use	2002-03	2019-07-16	03413c228746a4fa68acd0b1f329d818
ac950547-6fe9-4480-b46b-36adf1e6742f	03221d24-92ea-4ccc-a6a2-bd88dbfcd9fb	2001_2002_Africa_fmtrpt.tsv	Nigeria	NGA	Africa Region, Nigeria, International Military Education and Training (IMET), FY01	MIL OPS OTHER THAN WAR		Legal Dept, MOD	9/10/01	2001-09-10	9/14/01	2001-09-14	NORFOLK, VA 23521-2740	1	4800	https://2009-2017.state.gov/documents/organization/10964.pdf	Not checked against source; verify accuracy before use	2002-03	2019-07-16	a836cddc12922c7bf5f185df955f1d3f
a8bddb1f-b623-4bd2-8b09-5599673ab215	03221d24-92ea-4ccc-a6a2-bd88dbfcd9fb	2001_2002_Africa_fmtrpt.tsv	Nigeria	NGA	Africa Region, Nigeria, International Military Education and Training (IMET), FY01	MIL OPS OTHER THAN WAR		DHQ TRG Army	9/10/01	2001-09-10	9/14/01	2001-09-14	NORFOLK, VA 23521-2740	1	4800	https://2009-2017.state.gov/documents/organization/10964.pdf	Not checked against source; verify accuracy before use	2002-03	2019-07-16	3a4edfa9acd5be045a146d11f7bd14a9
ffab8573-6604-47e2-879b-74226a750978	03221d24-92ea-4ccc-a6a2-bd88dbfcd9fb	2001_2002_Africa_fmtrpt.tsv	Nigeria	NGA	Africa Region, Nigeria, International Military Education and Training (IMET), FY01	NAVAL STAFF COLLEGE		Naval HQ	1/11/01	2001-01-11	6/15/01	2001-06-15	NEWPORT, RI 02841-1207	1	26512	https://2009-2017.state.gov/documents/organization/10964.pdf	Not checked against source; verify accuracy before use	2002-03	2019-07-16	b37e67b722853210ca2de0b3f16da87f
96504dc8-b20b-4e78-8034-5d3f34765886	03221d24-92ea-4ccc-a6a2-bd88dbfcd9fb	2001_2002_Africa_fmtrpt.tsv	Nigeria	NGA	Africa Region, Nigeria, International Military Education and Training (IMET), FY01	OJT OFF MAR SAF GULF COAST		Cancelled	9/17/01	2001-09-17	9/28/01	2001-09-28	NEW ORLEANS, LA 70130-3396	1	313	https://2009-2017.state.gov/documents/organization/10964.pdf	Not checked against source; verify accuracy before use	2002-03	2019-07-16	e4ef31357557bb46f792d3455ecb538c
737ad240-a317-472b-98b2-9873ade5c3e6	03221d24-92ea-4ccc-a6a2-bd88dbfcd9fb	2001_2002_Africa_fmtrpt.tsv	Nigeria	NGA	Africa Region, Nigeria, International Military Education and Training (IMET), FY01	OJT OFF MAR SAF GULF COAST		Cancelled	9/3/01	2001-09-03	9/14/01	2001-09-14	NEW ORLEANS, LA 70130-3396	1	313	https://2009-2017.state.gov/documents/organization/10964.pdf	Not checked against source; verify accuracy before use	2002-03	2019-07-16	e675b6dcf82d7f8c16a77e8905316e4b
c277598e-d6b8-4d89-997b-91f3dc8bf3db	03221d24-92ea-4ccc-a6a2-bd88dbfcd9fb	2001_2002_Africa_fmtrpt.tsv	Nigeria	NGA	Africa Region, Nigeria, International Military Education and Training (IMET), FY01	OJT OFF MAR SAF GULF COAST		Cancelled	9/17/01	2001-09-17	9/28/01	2001-09-28	NEW ORLEANS, LA 70130-3396	1	313	https://2009-2017.state.gov/documents/organization/10964.pdf	Not checked against source; verify accuracy before use	2002-03	2019-07-16	e4ef31357557bb46f792d3455ecb538c
228f6fe7-8743-40f4-ace4-c95d6c9fea9f	03221d24-92ea-4ccc-a6a2-bd88dbfcd9fb	2001_2002_Africa_fmtrpt.tsv	Nigeria	NGA	Africa Region, Nigeria, International Military Education and Training (IMET), FY01	OJT OFF MAR SAF GULF COAST		Cancelled	9/3/01	2001-09-03	9/14/01	2001-09-14	NEW ORLEANS, LA 70130-3396	1	313	https://2009-2017.state.gov/documents/organization/10964.pdf	Not checked against source; verify accuracy before use	2002-03	2019-07-16	e675b6dcf82d7f8c16a77e8905316e4b
e66d8179-553d-4cc3-bf8d-2e4386fdb89f	03221d24-92ea-4ccc-a6a2-bd88dbfcd9fb	2001_2002_Africa_fmtrpt.tsv	Nigeria	NGA	Africa Region, Nigeria, International Military Education and Training (IMET), FY01	OJT PROFL/SPEC-CONUS		Army	6/11/01	2001-06-11	7/6/01	2001-07-06	CARLISLE BKS PA 17013-5050	1	2796	https://2009-2017.state.gov/documents/organization/10964.pdf	Not checked against source; verify accuracy before use	2002-03	2019-07-16	5822845cded6398bb89107091445b716
dc1fd534-cebe-4e21-b9e0-33801980ce68	03221d24-92ea-4ccc-a6a2-bd88dbfcd9fb	2001_2002_Africa_fmtrpt.tsv	Nigeria	NGA	Africa Region, Nigeria, International Military Education and Training (IMET), FY01	SIG OFF ADV PREP-INTER OFF		Cancelled	10/26/00	2000-10-26	11/13/00	2000-11-13	FT GORDON GA 30905-5154	1	1644	https://2009-2017.state.gov/documents/organization/10964.pdf	Not checked against source; verify accuracy before use	2002-03	2019-07-16	1cc5ebddfd9f60348e2a2e0eda46f328
dcb9f3f6-f1b2-4036-b824-2bf07d0a0438	03221d24-92ea-4ccc-a6a2-bd88dbfcd9fb	2001_2002_Africa_fmtrpt.tsv	Nigeria	NGA	Africa Region, Nigeria, International Military Education and Training (IMET), FY01	SIGNAL CAPTAINS CAREER CRS		Cancelled	11/15/00	2000-11-15	4/6/01	2001-04-06	FT GORDON GA 30905-5154	1	2169	https://2009-2017.state.gov/documents/organization/10964.pdf	Not checked against source; verify accuracy before use	2002-03	2019-07-16	e38a9902cff85e8fbd6d65bdc041c26a
0f9ec69f-5aec-4a65-ab97-eff4bdb3c4b2	03221d24-92ea-4ccc-a6a2-bd88dbfcd9fb	2001_2002_Africa_fmtrpt.tsv	Nigeria	NGA	Africa Region, Nigeria, International Military Education and Training (IMET), FY01	SR INTERNATIONAL DEF MGT		SEA TRG, Navy	6/25/01	2001-06-25	7/20/01	2001-07-20	MONTEREY, CA 93943-5201	1	9555	https://2009-2017.state.gov/documents/organization/10964.pdf	Not checked against source; verify accuracy before use	2002-03	2019-07-16	4c94d837fbb86cdebae7cfae42a0018e
8dbf35dd-0ead-4d9d-a6b4-6f2fdea86b24	03221d24-92ea-4ccc-a6a2-bd88dbfcd9fb	2001_2002_Africa_fmtrpt.tsv	Nigeria	NGA	Africa Region, Nigeria, International Military Education and Training (IMET), FY01	USA C&GSC OFF PREPARATORY		SI LIST Army	7/9/01	2001-07-09	7/20/01	2001-07-20	FT LEAVENWORTH KS 66027-1352	1	1380	https://2009-2017.state.gov/documents/organization/10964.pdf	Not checked against source; verify accuracy before use	2002-03	2019-07-16	9bb811435ed6d5c5d34186bc17b36bb3
65ec2a95-382e-41d1-8d87-1f2a9a17bdc5	03221d24-92ea-4ccc-a6a2-bd88dbfcd9fb	2001_2002_Africa_fmtrpt.tsv	Nigeria	NGA	DoS Africa Region, Nigeria, Africa Center for Strategic Studies, FY01	Senior Leader Seminar		MOD NGO	1/29/01	2001-01-29	2/9/01	2001-02-09	Libreville Gabon	4	7793	https://2009-2017.state.gov/documents/organization/10964.pdf	Not checked against source; verify accuracy before use	2002-03	2019-07-16	e99f66a10988b522158d1c0097fbdeda
f7475290-c90c-4016-91fc-ba170721a6d0	03221d24-92ea-4ccc-a6a2-bd88dbfcd9fb	2001_2002_Africa_fmtrpt.tsv	Nigeria	NGA	DoS Africa Region, Nigeria, Africa Center for Strategic Studies, FY01	Sub-Regional Seminar		MOD MFA	8/20/01	2001-08-20	8/24/01	2001-08-24	Accra Ghana	9	5212	https://2009-2017.state.gov/documents/organization/10964.pdf	Not checked against source; verify accuracy before use	2002-03	2019-07-16	307a5c47d08925902e2093b36e927d38
5f5c6526-cca4-479f-b6fd-57c54c8433c3	03221d24-92ea-4ccc-a6a2-bd88dbfcd9fb	2001_2002_Africa_fmtrpt.tsv	Republic of Congo (Congo - Brazzaville)	COG	DoS Africa Region, Republic of Congo (Congo - Brazzaville), International Military Education and Training (IMET), FY01	ARMY-PCHT			7/18/01	2001-07-18	9/30/01	2001-09-30		0	5634	https://2009-2017.state.gov/documents/organization/10964.pdf	Not checked against source; verify accuracy before use	2002-03	2019-07-16	22ad3a420895045eefc47cc1d8be7f58
b0634f30-e41b-434a-82b5-68120c5b4ed4	03221d24-92ea-4ccc-a6a2-bd88dbfcd9fb	2001_2002_Africa_fmtrpt.tsv	Republic of Congo (Congo - Brazzaville)	COG	DoS Africa Region, Republic of Congo (Congo - Brazzaville), International Military Education and Training (IMET), FY01	ENGLISH LANGUAGE SURVEY		Air Force	7/14/01	2001-07-14	7/20/01	2001-07-20	Congo	0	5638	https://2009-2017.state.gov/documents/organization/10964.pdf	Not checked against source; verify accuracy before use	2002-03	2019-07-16	c86a7e8a0370f98e6f111070dd1937d5
46e3db9e-eafc-4564-98c9-c81a7547402e	03221d24-92ea-4ccc-a6a2-bd88dbfcd9fb	2001_2002_Africa_fmtrpt.tsv	Republic of Congo (Congo - Brazzaville)	COG	DoS Africa Region, Republic of Congo (Congo - Brazzaville), International Military Education and Training (IMET), FY01	ENGLISH LANGUAGE SURVEY		Air Force	7/14/01	2001-07-14	7/20/01	2001-07-20	Congo	0	1333	https://2009-2017.state.gov/documents/organization/10964.pdf	Not checked against source; verify accuracy before use	2002-03	2019-07-16	0c882f79e6907eadf54d76682ca9568c
ea9873eb-9c00-4439-9bbd-81d1109ca735	03221d24-92ea-4ccc-a6a2-bd88dbfcd9fb	2001_2002_Africa_fmtrpt.tsv	Republic of Congo (Congo - Brazzaville)	COG	DoS Africa Region, Republic of Congo (Congo - Brazzaville), International Military Education and Training (IMET), FY01	MET DIILS ASSESS OF ISSUES		Navy	8/20/01	2001-08-20	8/24/01	2001-08-24	Congo	0	11362	https://2009-2017.state.gov/documents/organization/10964.pdf	Not checked against source; verify accuracy before use	2002-03	2019-07-16	0a6df7be242cd611f1a99d1a8f41bc2a
86f0ffa3-944a-47b5-a863-88a0d51c6b15	03221d24-92ea-4ccc-a6a2-bd88dbfcd9fb	2001_2002_Africa_fmtrpt.tsv	Republic of Congo (Congo - Brazzaville)	COG	DoS Africa Region, Republic of Congo (Congo - Brazzaville), International Military Education and Training (IMET), FY01	TRAINING AIDS & DEVICES			7/18/01	2001-07-18	9/30/01	2001-09-30		0	5187	https://2009-2017.state.gov/documents/organization/10964.pdf	Not checked against source; verify accuracy before use	2002-03	2019-07-16	cfabe68e7770367577f0769d53c575da
c0558079-ab30-424f-be5e-8ca768fc790f	03221d24-92ea-4ccc-a6a2-bd88dbfcd9fb	2001_2002_Africa_fmtrpt.tsv	Republic of Congo (Congo - Brazzaville)	COG	DoS Africa Region, Republic of Congo (Congo - Brazzaville), International Military Education and Training (IMET), FY01	TRAINING AIDS & DEVICES			7/18/01	2001-07-18	9/30/01	2001-09-30		0	1180	https://2009-2017.state.gov/documents/organization/10964.pdf	Not checked against source; verify accuracy before use	2002-03	2019-07-16	62d9b353f79220458416584438a84603
23a0f105-5ec6-48c3-8702-d80bc3ca1a72	03221d24-92ea-4ccc-a6a2-bd88dbfcd9fb	2001_2002_Africa_fmtrpt.tsv	Republic of Congo (Congo - Brazzaville)	COG	DoS Africa Region, Republic of Congo (Congo - Brazzaville), International Military Education and Training (IMET), FY01	TRAINING AIDS & DEVICES			7/18/01	2001-07-18	9/30/01	2001-09-30		0	21801	https://2009-2017.state.gov/documents/organization/10964.pdf	Not checked against source; verify accuracy before use	2002-03	2019-07-16	0e5bd9c625b02bf6810ed1404f139443
04a5b7ab-dc68-4d61-b38c-3ed16a7d4936	03221d24-92ea-4ccc-a6a2-bd88dbfcd9fb	2001_2002_Africa_fmtrpt.tsv	Republic of Congo (Congo - Brazzaville)	COG	DoS Africa Region, Republic of Congo (Congo - Brazzaville), Africa Center for Strategic Studies, FY01	Senior Leader Seminar		MOD	1/29/01	2001-01-29	2/9/01	2001-02-09	Libreville Gabon	4	7652	https://2009-2017.state.gov/documents/organization/10964.pdf	Not checked against source; verify accuracy before use	2002-03	2019-07-16	1fbba9b144e46b15edbc36dfd9976ba9
306ef329-8ab8-44db-9e4b-049c9e3735a5	03221d24-92ea-4ccc-a6a2-bd88dbfcd9fb	2001_2002_Africa_fmtrpt.tsv	Rwanda	RWA	DoS Africa Region, Rwanda, Africa Center for Strategic Studies, FY01	Senior Leader Seminar		MOD	1/29/01	2001-01-29	2/9/01	2001-02-09	Libreville Gabon	2	8933	https://2009-2017.state.gov/documents/organization/10964.pdf	Not checked against source; verify accuracy before use	2002-03	2019-07-16	36e9ca81de84d9005d0b8c67194c8927
82f02363-6e8b-442a-a978-2a1a453b60cb	03221d24-92ea-4ccc-a6a2-bd88dbfcd9fb	2001_2002_Africa_fmtrpt.tsv	Sao Tome and Principe	STP	DoS Africa Region, Sao Tome and Principe, International Military Education and Training (IMET), FY01	AMERICAN LANGUAGE COURSE		Army - Infantry Batallion	6/18/01	2001-06-18	7/27/01	2001-07-27	LACKLAND AFB, TX 78236	1	8299	https://2009-2017.state.gov/documents/organization/10964.pdf	Not checked against source; verify accuracy before use	2002-03	2019-07-16	35f94bdfb14b8fd0a35babd755da3d78
33a542bd-5e58-493d-8127-40b5d42319ef	03221d24-92ea-4ccc-a6a2-bd88dbfcd9fb	2001_2002_Africa_fmtrpt.tsv	Sao Tome and Principe	STP	DoS Africa Region, Sao Tome and Principe, International Military Education and Training (IMET), FY01	ARMY-PCHT			7/19/01	2001-07-19	9/30/01	2001-09-30		0	5902	https://2009-2017.state.gov/documents/organization/10964.pdf	Not checked against source; verify accuracy before use	2002-03	2019-07-16	297c60ce48efd335c7c868fcbcb1df97
e3835ee0-646e-4c8d-808e-857f746585c9	03221d24-92ea-4ccc-a6a2-bd88dbfcd9fb	2001_2002_Africa_fmtrpt.tsv	Sao Tome and Principe	STP	DoS Africa Region, Sao Tome and Principe, International Military Education and Training (IMET), FY01	TRAINING AIDS & DEVICES			7/19/01	2001-07-19	9/30/01	2001-09-30		0	5187	https://2009-2017.state.gov/documents/organization/10964.pdf	Not checked against source; verify accuracy before use	2002-03	2019-07-16	93217d56de1c60d40f713450d6d872cd
f9b64780-3de5-47ae-b032-0bbcf3f5f381	03221d24-92ea-4ccc-a6a2-bd88dbfcd9fb	2001_2002_Africa_fmtrpt.tsv	Sao Tome and Principe	STP	DoS Africa Region, Sao Tome and Principe, International Military Education and Training (IMET), FY01	TRAINING AIDS & DEVICES			7/19/01	2001-07-19	9/30/01	2001-09-30		0	1180	https://2009-2017.state.gov/documents/organization/10964.pdf	Not checked against source; verify accuracy before use	2002-03	2019-07-16	36d3022900a291f5db1a1a25b9c0e80b
dc2d66d0-38d0-403b-8a84-9e18732fff22	03221d24-92ea-4ccc-a6a2-bd88dbfcd9fb	2001_2002_Africa_fmtrpt.tsv	Sao Tome and Principe	STP	DoS Africa Region, Sao Tome and Principe, International Military Education and Training (IMET), FY01	TRAINING AIDS & DEVICES			6/1/01	2001-06-01	9/30/01	2001-09-30		0	300	https://2009-2017.state.gov/documents/organization/10964.pdf	Not checked against source; verify accuracy before use	2002-03	2019-07-16	6fafb138c6a3d1bdecdb2bfa7e6942cd
607c2ecc-f025-45fc-a177-6ad655ec5e17	03221d24-92ea-4ccc-a6a2-bd88dbfcd9fb	2001_2002_Africa_fmtrpt.tsv	Sao Tome and Principe	STP	DoS Africa Region, Sao Tome and Principe, International Military Education and Training (IMET), FY01	TRAINING AIDS & DEVICES			7/19/01	2001-07-19	9/30/01	2001-09-30		0	23139	https://2009-2017.state.gov/documents/organization/10964.pdf	Not checked against source; verify accuracy before use	2002-03	2019-07-16	1ecd4fd5fbcc2bfb3213f4c015b6d9c9
2e774061-8cb5-47f8-99a9-57317173e6e1	03221d24-92ea-4ccc-a6a2-bd88dbfcd9fb	2001_2002_Africa_fmtrpt.tsv	Sao Tome and Principe	STP	DoS Africa Region, Sao Tome and Principe, Africa Center for Strategic Studies, FY01	Senior Leader Seminar		MOD	1/29/01	2001-01-29	2/9/01	2001-02-09	Libreville Gabon	2	7517	https://2009-2017.state.gov/documents/organization/10964.pdf	Not checked against source; verify accuracy before use	2002-03	2019-07-16	25f0b60cd1567fada508a806dd9bc872
b3a8d195-5b06-4db9-866b-67dc0aece09b	03221d24-92ea-4ccc-a6a2-bd88dbfcd9fb	2001_2002_Africa_fmtrpt.tsv	Senegal	SEN	DoS Africa Region, Senegal, International Military Education and Training (IMET), FY01	ADJUTANT GEN CAPT'S CAREER		Administration	5/7/01	2001-05-07	9/12/01	2001-09-12	FT JACKSON SC 29207-7040	1	5683	https://2009-2017.state.gov/documents/organization/10964.pdf	Not checked against source; verify accuracy before use	2002-03	2019-07-16	967600b3e43c3d5b315fbceb07298e52
258a99eb-39c2-4361-9b62-e6871e749896	03221d24-92ea-4ccc-a6a2-bd88dbfcd9fb	2001_2002_Africa_fmtrpt.tsv	Senegal	SEN	DoS Africa Region, Senegal, International Military Education and Training (IMET), FY01	ADV LANG PROFICIENCY SKILL		General's Staff	5/28/01	2001-05-28	8/17/01	2001-08-17	LACKLAND AFB, TX 78236	1	3010	https://2009-2017.state.gov/documents/organization/10964.pdf	Not checked against source; verify accuracy before use	2002-03	2019-07-16	ccc6c1729d7c575244b348225d3780b4
4e2e04d5-ab54-45e4-a7b1-b88d0f8550b2	03221d24-92ea-4ccc-a6a2-bd88dbfcd9fb	2001_2002_Africa_fmtrpt.tsv	Senegal	SEN	DoS Africa Region, Senegal, International Military Education and Training (IMET), FY01	ALLIED OFF PREP-INF OAC		12th Infantry BTN	1/8/01	2001-01-08	1/12/01	2001-01-12	FT BENNING GA 31905-5468	1	249	https://2009-2017.state.gov/documents/organization/10964.pdf	Not checked against source; verify accuracy before use	2002-03	2019-07-16	87456695d9a4e8304f1357cac9007293
78170c31-b8cc-4578-b147-7dc2e32bbee4	03221d24-92ea-4ccc-a6a2-bd88dbfcd9fb	2001_2002_Africa_fmtrpt.tsv	Senegal	SEN	DoS Africa Region, Senegal, International Military Education and Training (IMET), FY01	AMERICAN LANGUAGE COURSE		Air Force Pilot	3/19/01	2001-03-19	6/8/01	2001-06-08	LACKLAND AFB, TX 78236	1	3005	https://2009-2017.state.gov/documents/organization/10964.pdf	Not checked against source; verify accuracy before use	2002-03	2019-07-16	8cc1a028b40167a36988ee1e2b73204b
4d0d0a4a-f9d9-46b2-b8c2-8b5a2b005b7a	03221d24-92ea-4ccc-a6a2-bd88dbfcd9fb	2001_2002_Africa_fmtrpt.tsv	Senegal	SEN	DoS Africa Region, Senegal, International Military Education and Training (IMET), FY01	AMERICAN LANGUAGE COURSE		General's Staff	5/7/01	2001-05-07	7/27/01	2001-07-27	LACKLAND AFB, TX 78236	1	3005	https://2009-2017.state.gov/documents/organization/10964.pdf	Not checked against source; verify accuracy before use	2002-03	2019-07-16	9fad6735be6e8a6a3908bf251974d1e8
8797ba28-73f0-496e-b621-8a1827e68670	03221d24-92ea-4ccc-a6a2-bd88dbfcd9fb	2001_2002_Africa_fmtrpt.tsv	Senegal	SEN	DoS Africa Region, Senegal, International Military Education and Training (IMET), FY01	AMERICAN LANGUAGE COURSE		Support Group of Air Force	4/23/01	2001-04-23	7/13/01	2001-07-13	LACKLAND AFB, TX 78236	1	3005	https://2009-2017.state.gov/documents/organization/10964.pdf	Not checked against source; verify accuracy before use	2002-03	2019-07-16	c39651cf05aa4f8df1274956a0e81618
f3dbf4c5-748d-4e2f-80bc-610fa74cbc5a	03221d24-92ea-4ccc-a6a2-bd88dbfcd9fb	2001_2002_Africa_fmtrpt.tsv	Senegal	SEN	DoS Africa Region, Senegal, International Military Education and Training (IMET), FY01	AMERICAN LANGUAGE CRS		Support Group of the Navy	4/16/01	2001-04-16	7/5/01	2001-07-05	LACKLAND AFB, TX 78236-5259	1	3005	https://2009-2017.state.gov/documents/organization/10964.pdf	Not checked against source; verify accuracy before use	2002-03	2019-07-16	4c31280c7816f02aa52fad2c32081129
7d961577-7f8e-4ea2-a41b-b7d37ff1848b	03221d24-92ea-4ccc-a6a2-bd88dbfcd9fb	2001_2002_Africa_fmtrpt.tsv	Senegal	SEN	DoS Africa Region, Senegal, International Military Education and Training (IMET), FY01	AMERICAN LANGUAGE CRS		Naval OPS Group	4/9/01	2001-04-09	7/13/01	2001-07-13	LACKLAND AFB, TX 78236-5259	1	3495	https://2009-2017.state.gov/documents/organization/10964.pdf	Not checked against source; verify accuracy before use	2002-03	2019-07-16	48ef5406c71c8601917b376026da1329
7d7ac8f1-3e8e-43bc-985a-826cd15e8fdb	03221d24-92ea-4ccc-a6a2-bd88dbfcd9fb	2001_2002_Africa_fmtrpt.tsv	Senegal	SEN	DoS Africa Region, Senegal, International Military Education and Training (IMET), FY01	AMERICAN LANGUAGE CRS		12th Infantry BTN	3/5/01	2001-03-05	5/25/01	2001-05-25	LACKLAND AFB, TX 78236-5259	1	3005	https://2009-2017.state.gov/documents/organization/10964.pdf	Not checked against source; verify accuracy before use	2002-03	2019-07-16	1035238fff8737b013b2d6fc639f9f5e
37c3625f-ac2f-4679-94c5-b64e0c3686b5	03221d24-92ea-4ccc-a6a2-bd88dbfcd9fb	2001_2002_Africa_fmtrpt.tsv	Senegal	SEN	DoS Africa Region, Senegal, International Military Education and Training (IMET), FY01	AMERICAN LANGUAGE CRS		Naval OPS Group	4/9/01	2001-04-09	7/6/01	2001-07-06	LACKLAND AFB, TX 78236-5259	1	3250	https://2009-2017.state.gov/documents/organization/10964.pdf	Not checked against source; verify accuracy before use	2002-03	2019-07-16	e30ab830031d8791cd9b6d22050b3bb1
6ecbb3d5-1a7c-4cf5-b268-6f4b0941449c	03221d24-92ea-4ccc-a6a2-bd88dbfcd9fb	2001_2002_Africa_fmtrpt.tsv	Senegal	SEN	DoS Africa Region, Senegal, International Military Education and Training (IMET), FY01	ARMOR CAPTAINS CAREER		Armor BTN	11/13/00	2000-11-13	4/6/01	2001-04-06	FT KNOX KY 40121-5234	1	3956	https://2009-2017.state.gov/documents/organization/10964.pdf	Not checked against source; verify accuracy before use	2002-03	2019-07-16	9fc0ca16bc18132706547e47beec0c7e
e284caa6-7a17-462e-98ae-a9619fe82a3c	03221d24-92ea-4ccc-a6a2-bd88dbfcd9fb	2001_2002_Africa_fmtrpt.tsv	Senegal	SEN	DoS Africa Region, Senegal, International Military Education and Training (IMET), FY01	ARMOR CPT CAREER CRS PREP		Armor BTN	10/30/00	2000-10-30	11/10/00	2000-11-10	FT KNOX KY 40121-5234	1	1260	https://2009-2017.state.gov/documents/organization/10964.pdf	Not checked against source; verify accuracy before use	2002-03	2019-07-16	e6ed352c8acb3fea4c75d8ab14a4d9a6
cbad57c4-7ae1-4f88-b7a0-f3542fa80c75	03221d24-92ea-4ccc-a6a2-bd88dbfcd9fb	2001_2002_Africa_fmtrpt.tsv	Senegal	SEN	DoS Africa Region, Senegal, International Military Education and Training (IMET), FY01	ARMOR CPT CAREER CRS PREP		Armored BN	7/16/01	2001-07-16	8/3/01	2001-08-03	FT KNOX KY 40121-5234	1	1260	https://2009-2017.state.gov/documents/organization/10964.pdf	Not checked against source; verify accuracy before use	2002-03	2019-07-16	21781c0d7374099f0176955d2d99642f
bb059f0d-9b4f-42e5-955b-f83622857437	03221d24-92ea-4ccc-a6a2-bd88dbfcd9fb	2001_2002_Africa_fmtrpt.tsv	Senegal	SEN	DoS Africa Region, Senegal, International Military Education and Training (IMET), FY01	CIV-MIL SID - AFRICA		General's Staff	10/16/00	2000-10-16	10/27/00	2000-10-27	HURLBURT FIELD, FL 32544-5826	1	1790	https://2009-2017.state.gov/documents/organization/10964.pdf	Not checked against source; verify accuracy before use	2002-03	2019-07-16	95e2d09c808e86f6c11b3c342fca392f
6cca2dd3-8b62-4a7c-af23-54b3667d9707	03221d24-92ea-4ccc-a6a2-bd88dbfcd9fb	2001_2002_Africa_fmtrpt.tsv	Senegal	SEN	DoS Africa Region, Senegal, International Military Education and Training (IMET), FY01	CIV-MIL SID - AFRICA		Engineers BTN	10/16/00	2000-10-16	10/27/00	2000-10-27	HURLBURT FIELD, FL 32544-5826	1	1790	https://2009-2017.state.gov/documents/organization/10964.pdf	Not checked against source; verify accuracy before use	2002-03	2019-07-16	55376fafce6a631f29b97ce7aa0e08e9
7088b4c1-f724-4ce2-95c4-29edba9d6164	03221d24-92ea-4ccc-a6a2-bd88dbfcd9fb	2001_2002_Africa_fmtrpt.tsv	Senegal	SEN	DoS Africa Region, Senegal, International Military Education and Training (IMET), FY01	ENGINEER OFFICER BASIC		Engineer BTN	4/30/01	2001-04-30	8/28/01	2001-08-28	FT LEONARD WOOD MO 65473-5000	1	2930	https://2009-2017.state.gov/documents/organization/10964.pdf	Not checked against source; verify accuracy before use	2002-03	2019-07-16	1055851aa420ff80f75d229df5c3b235
2ad74d95-fd80-46d4-9bec-c7bc5cd66f12	03221d24-92ea-4ccc-a6a2-bd88dbfcd9fb	2001_2002_Africa_fmtrpt.tsv	Senegal	SEN	DoS Africa Region, Senegal, International Military Education and Training (IMET), FY01	ENGLISH LANGUAGE CRSE		Engineer OPS BTN	3/19/01	2001-03-19	6/8/01	2001-06-08	SAN ANTONIO TX 78236-5259	1	3005	https://2009-2017.state.gov/documents/organization/10964.pdf	Not checked against source; verify accuracy before use	2002-03	2019-07-16	1d525a6681915b3cadd3e05d78bb1c6f
6445fea3-b0c4-4f8a-88fb-719b6119c09a	03221d24-92ea-4ccc-a6a2-bd88dbfcd9fb	2001_2002_Africa_fmtrpt.tsv	Senegal	SEN	DoS Africa Region, Senegal, International Military Education and Training (IMET), FY01	ENGLISH LANGUAGE CRSE		26th Reconnaissance & Support BN	4/9/01	2001-04-09	6/29/01	2001-06-29	SAN ANTONIO TX 78236-5259	1	3005	https://2009-2017.state.gov/documents/organization/10964.pdf	Not checked against source; verify accuracy before use	2002-03	2019-07-16	7aea4491129f73a394a1cf450c00d3f1
de72e653-7d52-4782-a9f1-dc0ffbcd1e85	03221d24-92ea-4ccc-a6a2-bd88dbfcd9fb	2001_2002_Africa_fmtrpt.tsv	Senegal	SEN	DoS Africa Region, Senegal, International Military Education and Training (IMET), FY01	ENGLISH LANGUAGE CRSE		Air Force Staff	3/26/01	2001-03-26	6/15/01	2001-06-15	SAN ANTONIO TX 78236-5259	1	3005	https://2009-2017.state.gov/documents/organization/10964.pdf	Not checked against source; verify accuracy before use	2002-03	2019-07-16	b412eace32e4208666bd2681c97cf0b1
4263117f-1908-4a5d-a4b4-f053b9411f89	03221d24-92ea-4ccc-a6a2-bd88dbfcd9fb	2001_2002_Africa_fmtrpt.tsv	Senegal	SEN	DoS Africa Region, Senegal, International Military Education and Training (IMET), FY01	ENGLISH LANGUAGE CRSE		Engineer BTN	1/22/01	2001-01-22	4/13/01	2001-04-13	SAN ANTONIO TX 78236-5259	1	3005	https://2009-2017.state.gov/documents/organization/10964.pdf	Not checked against source; verify accuracy before use	2002-03	2019-07-16	a8b65b7e343039c633ca244bb4fa4c22
9b4f14c1-1894-4ef7-b27b-30307010a95f	03221d24-92ea-4ccc-a6a2-bd88dbfcd9fb	2001_2002_Africa_fmtrpt.tsv	Senegal	SEN	Africa Region, Senegal, International Military Education and Training (IMET), FY01	ENGLISH LANGUAGE CRSE		Engineer BN	4/30/01	2001-04-30	7/20/01	2001-07-20	SAN ANTONIO TX 78236-5259	1	3005	https://2009-2017.state.gov/documents/organization/10964.pdf	Not checked against source; verify accuracy before use	2002-03	2019-07-16	5c47e325deba93023209c22ec707666d
e09f3027-7c19-46a5-be3a-ff7819204b4b	03221d24-92ea-4ccc-a6a2-bd88dbfcd9fb	2001_2002_Africa_fmtrpt.tsv	Senegal	SEN	Africa Region, Senegal, International Military Education and Training (IMET), FY01	ENGLISH LANGUAGE CRSE		Administration	1/1/01	2001-01-01	4/20/01	2001-04-20	SAN ANTONIO TX 78236-5259	1	3985	https://2009-2017.state.gov/documents/organization/10964.pdf	Not checked against source; verify accuracy before use	2002-03	2019-07-16	07d59d360c5a625658483dacfa9d1c27
4822520b-2b7a-4649-bc1d-8ba91597171f	03221d24-92ea-4ccc-a6a2-bd88dbfcd9fb	2001_2002_Africa_fmtrpt.tsv	Senegal	SEN	Africa Region, Senegal, International Military Education and Training (IMET), FY01	ENGLISH LANGUAGE CRSE		12th Infantry BN	4/16/01	2001-04-16	7/6/01	2001-07-06	SAN ANTONIO TX 78236-5259	1	3005	https://2009-2017.state.gov/documents/organization/10964.pdf	Not checked against source; verify accuracy before use	2002-03	2019-07-16	51b16de31f05288261715b1ea8eaf3df
49ea13c4-5c24-4759-ab08-cb592e406467	03221d24-92ea-4ccc-a6a2-bd88dbfcd9fb	2001_2002_Africa_fmtrpt.tsv	Senegal	SEN	Africa Region, Senegal, International Military Education and Training (IMET), FY01	ENGLISH LANGUAGE CRSE		Armored BN	4/9/01	2001-04-09	6/29/01	2001-06-29	SAN ANTONIO TX 78236-5259	1	3005	https://2009-2017.state.gov/documents/organization/10964.pdf	Not checked against source; verify accuracy before use	2002-03	2019-07-16	2bed7124d139a0c6b3c3e1b102c2d657
b0f900b9-f41a-4250-ae55-a68849348a98	03221d24-92ea-4ccc-a6a2-bd88dbfcd9fb	2001_2002_Africa_fmtrpt.tsv	Senegal	SEN	Africa Region, Senegal, International Military Education and Training (IMET), FY01	ENGLISH LANGUAGE CRSE		Artillery BN	4/9/01	2001-04-09	6/29/01	2001-06-29	SAN ANTONIO TX 78236-5259	1	3005	https://2009-2017.state.gov/documents/organization/10964.pdf	Not checked against source; verify accuracy before use	2002-03	2019-07-16	323ce54d57f4160766c2f8fb6c8b0f54
f64ffa9a-1f2b-4589-a239-078cf23f3921	03221d24-92ea-4ccc-a6a2-bd88dbfcd9fb	2001_2002_Africa_fmtrpt.tsv	Senegal	SEN	Africa Region, Senegal, International Military Education and Training (IMET), FY01	FA OFF ADV PREP-ALLIED OFF		Artillery BN	7/12/01	2001-07-12	8/3/01	2001-08-03	FT SILL OK 73503	1	1572	https://2009-2017.state.gov/documents/organization/10964.pdf	Not checked against source; verify accuracy before use	2002-03	2019-07-16	2c324a087566fe2cf0824072b6996c04
2077dd00-7e04-4019-b6e4-fad1396c73f1	03221d24-92ea-4ccc-a6a2-bd88dbfcd9fb	2001_2002_Africa_fmtrpt.tsv	Senegal	SEN	Africa Region, Senegal, International Military Education and Training (IMET), FY01	GUNNERS MATE A		Support Group of the Navy	7/9/01	2001-07-09	9/10/01	2001-09-10	YORKTOWN, VA 23690-5000	1	2705	https://2009-2017.state.gov/documents/organization/10964.pdf	Not checked against source; verify accuracy before use	2002-03	2019-07-16	f4ca04cc3a957a833730a077a675e6f8
0f7f7c67-add6-4afe-be55-34754c180b4b	03221d24-92ea-4ccc-a6a2-bd88dbfcd9fb	2001_2002_Africa_fmtrpt.tsv	Senegal	SEN	Africa Region, Senegal, International Military Education and Training (IMET), FY01	INFANTRY CAPTS CAREER CRS		12th Infantry BTN	1/16/01	2001-01-16	5/22/01	2001-05-22	FT BENNING GA 31905-5468	1	3679	https://2009-2017.state.gov/documents/organization/10964.pdf	Not checked against source; verify accuracy before use	2002-03	2019-07-16	9c01973914a6b7f5b69780152d6fe7dd
2c0cd6a7-a79f-4a62-98ab-62c43ccc46fe	03221d24-92ea-4ccc-a6a2-bd88dbfcd9fb	2001_2002_Africa_fmtrpt.tsv	Senegal	SEN	Africa Region, Senegal, International Military Education and Training (IMET), FY01	INFANTRY OFFICER CRS USMC		Infantry Bataillon	1/19/01	2001-01-19	3/30/01	2001-03-30	QUANTICO, VA 22134	1	6051	https://2009-2017.state.gov/documents/organization/10964.pdf	Not checked against source; verify accuracy before use	2002-03	2019-07-16	4a80e19c11e2843e44991a77a158009a
988a39dc-f556-41b7-b15f-accceb332c6d	03221d24-92ea-4ccc-a6a2-bd88dbfcd9fb	2001_2002_Africa_fmtrpt.tsv	Senegal	SEN	Africa Region, Senegal, International Military Education and Training (IMET), FY01	INFO SYSTEMS OPER-ANALYST		Administration BTN	11/6/00	2000-11-06	3/26/01	2001-03-26	FT GORDON GA 30905-5154	1	2891	https://2009-2017.state.gov/documents/organization/10964.pdf	Not checked against source; verify accuracy before use	2002-03	2019-07-16	4ddc92f5c54aed51651403f9e895de67
8d3a8380-4160-4c79-9a7d-129e803e5a7e	03221d24-92ea-4ccc-a6a2-bd88dbfcd9fb	2001_2002_Africa_fmtrpt.tsv	Senegal	SEN	Africa Region, Senegal, International Military Education and Training (IMET), FY01	INTERNATIONAL OFF LOG PREP		Material BTN	1/2/01	2001-01-02	1/12/01	2001-01-12	FT LEE VA 23801-1705	1	1005	https://2009-2017.state.gov/documents/organization/10964.pdf	Not checked against source; verify accuracy before use	2002-03	2019-07-16	f628bf5d02d96ef8dcebe2740c355260
dce6cd0f-3fe3-4e23-826f-dcbc472ec87a	03221d24-92ea-4ccc-a6a2-bd88dbfcd9fb	2001_2002_Africa_fmtrpt.tsv	Senegal	SEN	Africa Region, Senegal, International Military Education and Training (IMET), FY01	INTERNATIONAL OFFICER PREP		Engineer OPS BTN	6/19/01	2001-06-19	7/6/01	2001-07-06	FT LEAVENWORTH KS 66027-1352	1	847	https://2009-2017.state.gov/documents/organization/10964.pdf	Not checked against source; verify accuracy before use	2002-03	2019-07-16	2d060c29e7d2b07bf7d8d88475835c95
e71d9cd8-e6d6-401c-81ed-506a42e0a350	03221d24-92ea-4ccc-a6a2-bd88dbfcd9fb	2001_2002_Africa_fmtrpt.tsv	Senegal	SEN	Africa Region, Senegal, International Military Education and Training (IMET), FY01	INTL OFF SCH (FOR AC&SC)		Air Force Pilot	6/18/01	2001-06-18	7/27/01	2001-07-27	MAXWELL AFB, AL 36112-6323	1	3360	https://2009-2017.state.gov/documents/organization/10964.pdf	Not checked against source; verify accuracy before use	2002-03	2019-07-16	2b0393f23d667befcce34190888c301b
1acd102d-7a42-443c-89ed-904d2b19174a	03221d24-92ea-4ccc-a6a2-bd88dbfcd9fb	2001_2002_Africa_fmtrpt.tsv	Senegal	SEN	Africa Region, Senegal, International Military Education and Training (IMET), FY01	LOG EXEC DEV		Material BTN	1/16/01	2001-01-16	5/3/01	2001-05-03	FT LEE VA 23801-1705	1	3924	https://2009-2017.state.gov/documents/organization/10964.pdf	Not checked against source; verify accuracy before use	2002-03	2019-07-16	4c1e1e976281a52c2dd202ec17515d75
a9474a79-cc4a-427d-969e-15ed6159290d	03221d24-92ea-4ccc-a6a2-bd88dbfcd9fb	2001_2002_Africa_fmtrpt.tsv	Senegal	SEN	Africa Region, Senegal, International Military Education and Training (IMET), FY01	MANAGING ENG LANG		Air Force OPS	12/11/00	2000-12-11	2/2/01	2001-02-02	LACKLAND AFB, TX 78236	1	2030	https://2009-2017.state.gov/documents/organization/10964.pdf	Not checked against source; verify accuracy before use	2002-03	2019-07-16	2404d567b88e86edec1be9bc368ca8f0
18577acd-5a05-4db9-befd-2d9adc8abad2	03221d24-92ea-4ccc-a6a2-bd88dbfcd9fb	2001_2002_Africa_fmtrpt.tsv	Senegal	SEN	Africa Region, Senegal, International Military Education and Training (IMET), FY01	MET DRMI - OVERSEAS		Presidency Security Office Inspector for Logistics Presidency Military Advisor Office Defense Commission National Assembly MOD Director for Admin., Equipment, and Budget Technical Inspector Gendarmerie General Services Office Gendarmerie Division Studies and Planification Tresaury Inspector Ministry of Foreign Affairs Techical Advisor Ministry of Technical Studies Air Force Logistics Division Army Training Office Naval OPS Group Chief Quartermaster Services MOD Inspector General Air force Staff - Togo Commandant 3RD RIA - Togo Division OPS Togolese Armed Forces Human Resource Office - Chad Asst. Director Military Cooperation - Chad Bureau of Studies and Program - Niger Director Financial Affairs - Niger Parlementary Reporter for Financial Commission - Niger Director of Investment Financing - Niger Technical Advisor Air Force - Mali Commandant 1st Bureau Army - Guinea	6/4/01	2001-06-04	6/15/01	2001-06-15	Senegal	21	59834	https://2009-2017.state.gov/documents/organization/10964.pdf	Not checked against source; verify accuracy before use	2002-03	2019-07-16	2963f2beac699fb21c9c0bd1e0d05471
955472d1-19a5-468e-9ae9-c8056dcf9030	03221d24-92ea-4ccc-a6a2-bd88dbfcd9fb	2001_2002_Africa_fmtrpt.tsv	Senegal	SEN	Africa Region, Senegal, International Military Education and Training (IMET), FY01	OAC INTL STUDENT ENGR PREP		Engineer BN	8/6/01	2001-08-06	8/10/01	2001-08-10	FT LEONARD WOOD MO 65473-5000	1	209	https://2009-2017.state.gov/documents/organization/10964.pdf	Not checked against source; verify accuracy before use	2002-03	2019-07-16	da24225a81761651c8491ba69dfea8d3
a13b141d-f44f-4996-97a5-6c5ad5223681	03221d24-92ea-4ccc-a6a2-bd88dbfcd9fb	2001_2002_Africa_fmtrpt.tsv	Senegal	SEN	Africa Region, Senegal, International Military Education and Training (IMET), FY01	OBC INTERNATION ENR PREP		Engineer BTN	4/23/01	2001-04-23	4/27/01	2001-04-27	FT LEONARD WOOD MO 65473-5000	1	209	https://2009-2017.state.gov/documents/organization/10964.pdf	Not checked against source; verify accuracy before use	2002-03	2019-07-16	573985a245f7845415f1fd23ae1014b3
e7d07486-9554-46db-94b9-a5291a8abb17	03221d24-92ea-4ccc-a6a2-bd88dbfcd9fb	2001_2002_Africa_fmtrpt.tsv	Senegal	SEN	Africa Region, Senegal, International Military Education and Training (IMET), FY01	OBS MARINE CORPS		Infantry Bataillon	12/4/00	2000-12-04	1/18/01	2001-01-18	QUANTICO, VA 22134	1	414	https://2009-2017.state.gov/documents/organization/10964.pdf	Not checked against source; verify accuracy before use	2002-03	2019-07-16	71cb50254726d8eb5d5f8d183aa2ae18
da11a82b-0b72-4707-b938-25bdce0eb5fd	03221d24-92ea-4ccc-a6a2-bd88dbfcd9fb	2001_2002_Africa_fmtrpt.tsv	Senegal	SEN	Africa Region, Senegal, International Military Education and Training (IMET), FY01	OBSERVER		Material BTN	4/15/01	2001-04-15	4/17/01	2001-04-17	W-P AFB, OH 45433-7803	1	60	https://2009-2017.state.gov/documents/organization/10964.pdf	Not checked against source; verify accuracy before use	2002-03	2019-07-16	687362e56a008d3e7e90e2bde7f2c567
8f81c3ec-1546-4f6b-8921-257be07f813a	03221d24-92ea-4ccc-a6a2-bd88dbfcd9fb	2001_2002_Africa_fmtrpt.tsv	Senegal	SEN	Africa Region, Senegal, International Military Education and Training (IMET), FY01	SEC ASST MGT-STUDENT		Material BTN	4/2/01	2001-04-02	4/13/01	2001-04-13	W-P AFB, OH 45433-7803	1	1660	https://2009-2017.state.gov/documents/organization/10964.pdf	Not checked against source; verify accuracy before use	2002-03	2019-07-16	a5e6b6a66cf8da7999a785004c00680c
e7aee4e9-ae27-462e-9837-1f1aa5ec1d46	03221d24-92ea-4ccc-a6a2-bd88dbfcd9fb	2001_2002_Africa_fmtrpt.tsv	Senegal	SEN	Africa Region, Senegal, International Military Education and Training (IMET), FY01	SPECIALIZED ENG LANG TNG		Material BTN	10/23/00	2000-10-23	12/22/00	2000-12-22	SAN ANTONIO TX 78236-5259	1	2270	https://2009-2017.state.gov/documents/organization/10964.pdf	Not checked against source; verify accuracy before use	2002-03	2019-07-16	5eb249c9a0c22cf8e015447b1ba472a7
6deba2cd-eb44-4cea-904e-8d3c05ea0224	03221d24-92ea-4ccc-a6a2-bd88dbfcd9fb	2001_2002_Africa_fmtrpt.tsv	Senegal	SEN	Africa Region, Senegal, International Military Education and Training (IMET), FY01	SPECIALIZED ENG LANG TNG		Material BTN	1/29/01	2001-01-29	3/30/01	2001-03-30	LACKLAND AFB, TX 78236	1	2270	https://2009-2017.state.gov/documents/organization/10964.pdf	Not checked against source; verify accuracy before use	2002-03	2019-07-16	8630d38f76c8567983e78d864e8c1d3d
70a87e1d-993d-44ec-b0fe-777afa3abc00	03221d24-92ea-4ccc-a6a2-bd88dbfcd9fb	2001_2002_Africa_fmtrpt.tsv	Senegal	SEN	Africa Region, Senegal, International Military Education and Training (IMET), FY01	USA C&GSC OFF PREPARATORY		Engineer OPS BTN	7/9/01	2001-07-09	7/20/01	2001-07-20	FT LEAVENWORTH KS 66027-1352	1	680	https://2009-2017.state.gov/documents/organization/10964.pdf	Not checked against source; verify accuracy before use	2002-03	2019-07-16	75236313fa2e86fa665f03ae590487a6
8c91986b-55b0-4cb4-beb3-c9f500da8bb6	03221d24-92ea-4ccc-a6a2-bd88dbfcd9fb	2001_2002_Africa_fmtrpt.tsv	Senegal	SEN	DoS Africa Region, Senegal, Foreign Military Financing (FMF), FY01	MTT-MISCELLANEOUS OPNS		Senegal Brigade HQ	10/1/00	2000-10-01	9/30/01	2001-09-30	Senegal	30	250000	https://2009-2017.state.gov/documents/organization/10964.pdf	Not checked against source; verify accuracy before use	2002-03	2019-07-16	908230171b423bade368892c961c4ef7
919212fb-e1c7-4b6a-89c6-5e41c30746d2	03221d24-92ea-4ccc-a6a2-bd88dbfcd9fb	2001_2002_Africa_fmtrpt.tsv	Senegal	SEN	DoS Africa Region, Senegal, African Crisis Response Initiative, FY01	ACRI Brigade FT-1	SETAF	ARMY	7/9/01	2001-07-09	7/27/01	2001-07-27	SENEGAL	80	340000	https://2009-2017.state.gov/documents/organization/10964.pdf	Not checked against source; verify accuracy before use	2002-03	2019-07-16	23e59a1b6e70fe896bc46f46cdc5d6fd
8870bd42-b9e5-4d74-aca6-c114f6bee9b7	03221d24-92ea-4ccc-a6a2-bd88dbfcd9fb	2001_2002_Africa_fmtrpt.tsv	Senegal	SEN	DoS Africa Region, Senegal, African Crisis Response Initiative, FY01	ACRI FT-4	3RD SFGA	ARMY	2/5/01	2001-02-05	3/4/01	2001-03-04	SENEGAL	629	410000	https://2009-2017.state.gov/documents/organization/10964.pdf	Not checked against source; verify accuracy before use	2002-03	2019-07-16	91803080dc775f5178366716ae18fa21
2390ab74-37b9-4d28-b2cd-94aa32c3541f	03221d24-92ea-4ccc-a6a2-bd88dbfcd9fb	2001_2002_Africa_fmtrpt.tsv	Senegal	SEN	DoS Africa Region, Senegal, African Crisis Response Initiative, FY01	MTT-MISCELLANEOUS OPNS		1st Infantry BTN	1/3/01	2001-01-03	9/30/01	2001-09-30	Senegal	30	400500	https://2009-2017.state.gov/documents/organization/10964.pdf	Not checked against source; verify accuracy before use	2002-03	2019-07-16	0c6ff67c8ef6f3016afa7e00d87ddbd1
4e1614be-656d-4b38-a74a-79b5f4a9f968	03221d24-92ea-4ccc-a6a2-bd88dbfcd9fb	2001_2002_Africa_fmtrpt.tsv	Senegal	SEN	DoS Africa Region, Senegal, Africa Center for Strategic Studies, FY01	Senior Leader Seminar		MOD Ministry of Internal Affairs Ministry of Foreign Affairs	1/29/01	2001-01-29	2/9/01	2001-02-09	Libreville Gabon	4	8569	https://2009-2017.state.gov/documents/organization/10964.pdf	Not checked against source; verify accuracy before use	2002-03	2019-07-16	19d419fcdf3a6c590cdcfc1e79abd3cb
1dcf7e3f-0b2e-4072-9423-a6ac425e3d18	03221d24-92ea-4ccc-a6a2-bd88dbfcd9fb	2001_2002_Africa_fmtrpt.tsv	Senegal	SEN	DoS Africa Region, Senegal, Africa Center for Strategic Studies, FY01	Sub-Regional Seminar		MOD MFA	8/20/01	2001-08-20	8/24/01	2001-08-24	Accra Ghana	4	5875	https://2009-2017.state.gov/documents/organization/10964.pdf	Not checked against source; verify accuracy before use	2002-03	2019-07-16	5c0fcde087ee4c558313e1f8c10591cd
adda051b-f687-4af5-9cf1-131df17ece44	03221d24-92ea-4ccc-a6a2-bd88dbfcd9fb	2001_2002_Africa_fmtrpt.tsv	Seychelles	SYC	DoS Africa Region, Seychelles, Non-Security Assistance, Unified Command (Note 4), FY01	JCET	NSWU-3, SBU-12, SDVT-1, PC-6	SEYCHELLES COAST GUARD	7/2/01	2001-07-02	7/20/01	2001-07-20	VICTORIA, ISLAND OF MAHE	20	65000	https://2009-2017.state.gov/documents/organization/10964.pdf	Not checked against source; verify accuracy before use	2002-03	2019-07-16	cba10fc016ca43452e35df4e1b2a11b8
8638be53-0cb2-48a3-ae7e-2744ed10db47	03221d24-92ea-4ccc-a6a2-bd88dbfcd9fb	2001_2002_Africa_fmtrpt.tsv	Seychelles	SYC	DoS Africa Region, Seychelles, International Military Education and Training (IMET), FY01	MET DIILS ASSESS OF ISSUES		Seychelles Coast Guard/Army	6/25/01	2001-06-25	6/29/01	2001-06-29	Seychelles	0	29300	https://2009-2017.state.gov/documents/organization/10964.pdf	Not checked against source; verify accuracy before use	2002-03	2019-07-16	0aa049b23a6b6775b9639d8afc587120
acdb08bb-baf0-45fc-adba-c1efcbbfe3aa	03221d24-92ea-4ccc-a6a2-bd88dbfcd9fb	2001_2002_Africa_fmtrpt.tsv	Seychelles	SYC	DoS Africa Region, Seychelles, Foreign Military Financing (FMF), FY01	MTT SMALL BOAT OPS CG11		Seychelles Coast Guard	10/19/00	2000-10-19	10/29/00	2000-10-29	Seychelles	30	0	https://2009-2017.state.gov/documents/organization/10964.pdf	Not checked against source; verify accuracy before use	2002-03	2019-07-16	bcccdb58060082763b69c4ea03b3a3d3
88d79d42-1b49-4dc7-ad2a-5d50bba96d27	03221d24-92ea-4ccc-a6a2-bd88dbfcd9fb	2001_2002_Africa_fmtrpt.tsv	Seychelles	SYC	DoS Africa Region, Seychelles, Africa Center for Strategic Studies, FY01	Senior Leader Seminar		Civilian Government	1/29/01	2001-01-29	2/9/01	2001-02-09	Libreville Gabon	2	8128	https://2009-2017.state.gov/documents/organization/10964.pdf	Not checked against source; verify accuracy before use	2002-03	2019-07-16	29c2d314f80ea85302a04f854cbedd54
e084ceb2-4730-40f4-a05b-b6d7685ee8b4	03221d24-92ea-4ccc-a6a2-bd88dbfcd9fb	2001_2002_Africa_fmtrpt.tsv	Sierra Leone	SLE	DoS Africa Region, Sierra Leone, International Military Education and Training (IMET), FY01	DRMI SEMINAR - OVERSEAS		Cancellation	6/4/01	2001-06-04	6/15/01	2001-06-15	Sierra Leone	1	2378	https://2009-2017.state.gov/documents/organization/10964.pdf	Not checked against source; verify accuracy before use	2002-03	2019-07-16	4f2eb31cd8f06bfa2ac80435363351aa
6875e2b8-7581-43ac-a059-eec1ac2e27ac	03221d24-92ea-4ccc-a6a2-bd88dbfcd9fb	2001_2002_Africa_fmtrpt.tsv	Sierra Leone	SLE	DoS Africa Region, Sierra Leone, International Military Education and Training (IMET), FY01	DRMI SEMINAR - OVERSEAS		Cancellation	6/4/01	2001-06-04	6/15/01	2001-06-15	Sierra Leone	1	2378	https://2009-2017.state.gov/documents/organization/10964.pdf	Not checked against source; verify accuracy before use	2002-03	2019-07-16	4f2eb31cd8f06bfa2ac80435363351aa
1c76364c-4d34-4b1c-91f5-78aef9eea4fd	03221d24-92ea-4ccc-a6a2-bd88dbfcd9fb	2001_2002_Africa_fmtrpt.tsv	Sierra Leone	SLE	DoS Africa Region, Sierra Leone, International Military Education and Training (IMET), FY01	ELECTRICIAN		Army: Army Engineer Defense HQ, SL	2/12/01	2001-02-12	3/29/01	2001-03-29	FT LEONARD WOOD MO 65473-5000	1	3644	https://2009-2017.state.gov/documents/organization/10964.pdf	Not checked against source; verify accuracy before use	2002-03	2019-07-16	f1ed5313f5649965526cff01bfef25e0
d50521f7-fd51-4987-bb76-89112c1930a4	03221d24-92ea-4ccc-a6a2-bd88dbfcd9fb	2001_2002_Africa_fmtrpt.tsv	Sierra Leone	SLE	DoS Africa Region, Sierra Leone, International Military Education and Training (IMET), FY01	INFANTRY OFFICER BASIC		Army: Rep. Of Sierra Leone Armed Forces Recce Unit, Infantry Trng Ctr Hastings, SL	1/22/01	2001-01-22	5/18/01	2001-05-18	FT BENNING GA 31905-5468	1	13542	https://2009-2017.state.gov/documents/organization/10964.pdf	Not checked against source; verify accuracy before use	2002-03	2019-07-16	de04c1bd00d632b6ffde98d3ccf90660
e4b62929-0202-4c37-9f48-4b482843b30a	03221d24-92ea-4ccc-a6a2-bd88dbfcd9fb	2001_2002_Africa_fmtrpt.tsv	Sierra Leone	SLE	DoS Africa Region, Sierra Leone, International Military Education and Training (IMET), FY01	OAC INTL STUDENT ENGR PREP		Army: HQ Armed Forces Wilberforce Barracks Freetown SL	8/6/01	2001-08-06	8/10/01	2001-08-10	FT LEONARD WOOD MO 65473-5000	1	5020	https://2009-2017.state.gov/documents/organization/10964.pdf	Not checked against source; verify accuracy before use	2002-03	2019-07-16	c27dbe3102ba9df114a7879a4f4b5f4a
abd8a51d-f5e6-42b4-a59c-833bf0888552	03221d24-92ea-4ccc-a6a2-bd88dbfcd9fb	2001_2002_Africa_fmtrpt.tsv	Sierra Leone	SLE	DoS Africa Region, Sierra Leone, International Military Education and Training (IMET), FY01	OBC INTERNATION ENR PREP		Army : Defense HQ. Freeetown, SL	9/10/01	2001-09-10	9/14/01	2001-09-14	FT LEONARD WOOD MO 65473-5000	1	4816	https://2009-2017.state.gov/documents/organization/10964.pdf	Not checked against source; verify accuracy before use	2002-03	2019-07-16	55191f16f2c3d0624a2b4a7a3e6cbb43
406123e2-74a1-468a-99d6-ebb7dddea2f0	03221d24-92ea-4ccc-a6a2-bd88dbfcd9fb	2001_2002_Africa_fmtrpt.tsv	Sierra Leone	SLE	DoS Africa Region, Sierra Leone, International Military Education and Training (IMET), FY01	RANGER		Army: Rep. Of Sierra Leone Armed Forces Recce Unit, Infantry Trng Ctr Hastings, SL	6/11/01	2001-06-11	7/10/01	2001-07-10	FT BENNING GA 31905-5468	1	4838	https://2009-2017.state.gov/documents/organization/10964.pdf	Not checked against source; verify accuracy before use	2002-03	2019-07-16	e519933a9b8a114f2dbfcf4d07b9258a
cdd73808-45be-4c21-99ee-7b85e448fcce	03221d24-92ea-4ccc-a6a2-bd88dbfcd9fb	2001_2002_Africa_fmtrpt.tsv	Sierra Leone	SLE	DoS Africa Region, Sierra Leone, International Military Education and Training (IMET), FY01	SIG OFF ADV PREP-INTER OFF		Army:HQ Armed Forces, Wilberforce Barracks Freetown, SL	6/8/01	2001-06-08	6/25/01	2001-06-25	FT GORDON GA 30905-5154	1	6811	https://2009-2017.state.gov/documents/organization/10964.pdf	Not checked against source; verify accuracy before use	2002-03	2019-07-16	aaef9f3252b99388c2d9d9f7f740dab2
24475a78-8a12-425e-9947-80f4182bef93	03221d24-92ea-4ccc-a6a2-bd88dbfcd9fb	2001_2002_Africa_fmtrpt.tsv	Sierra Leone	SLE	DoS Africa Region, Sierra Leone, International Military Education and Training (IMET), FY01	TATS BRIDGE CREWMAN		Army: Army Engineer Defense HQ, SL	10/30/00	2000-10-30	12/7/00	2000-12-07	FT LEONARD WOOD MO 65473-5000	1	7239	https://2009-2017.state.gov/documents/organization/10964.pdf	Not checked against source; verify accuracy before use	2002-03	2019-07-16	666f0a5ee9b72ae791a66c352947810e
2680c720-4f0d-4e06-b9e2-b51e53c97b46	03221d24-92ea-4ccc-a6a2-bd88dbfcd9fb	2001_2002_Africa_fmtrpt.tsv	Sierra Leone	SLE	DoS Africa Region, Sierra Leone, International Military Education and Training (IMET), FY01	TATS COMBAT ENGINEER		Army: Army Engineer Defense HQ, SL	1/8/01	2001-01-08	2/15/01	2001-02-15	FT LEONARD WOOD MO 65473-5000	1	4467	https://2009-2017.state.gov/documents/organization/10964.pdf	Not checked against source; verify accuracy before use	2002-03	2019-07-16	70f934cafd8a8e0b2865d7328ff2a5dd
024b3e7e-ff7b-4d9c-be07-c98752baba05	03221d24-92ea-4ccc-a6a2-bd88dbfcd9fb	2001_2002_Africa_fmtrpt.tsv	Sierra Leone	SLE	DoS Africa Region, Sierra Leone, Africa Center for Strategic Studies, FY01	Senior Leader Seminar		MOD	1/29/01	2001-01-29	2/9/01	2001-02-09	Libreville Gabon	2	9329	https://2009-2017.state.gov/documents/organization/10964.pdf	Not checked against source; verify accuracy before use	2002-03	2019-07-16	dcff716b59a3a18525ec898578424e7c
c9ae5331-d665-4850-be74-46ffb1b921b0	03221d24-92ea-4ccc-a6a2-bd88dbfcd9fb	2001_2002_Africa_fmtrpt.tsv	Sierra Leone	SLE	DoS Africa Region, Sierra Leone, Africa Center for Strategic Studies, FY01	Sub-Regional Seminar		MOD MFA	8/20/01	2001-08-20	8/24/01	2001-08-24	Accra Ghana	5	5322	https://2009-2017.state.gov/documents/organization/10964.pdf	Not checked against source; verify accuracy before use	2002-03	2019-07-16	997283d20d93a8edb88ee1fb7d66aaeb
21485dcf-754d-47bc-879e-7e47b9aa06e6	03221d24-92ea-4ccc-a6a2-bd88dbfcd9fb	2001_2002_Africa_fmtrpt.tsv	South Africa	ZAF	DoS Africa Region, South Africa, International Military Education and Training (IMET), FY01	AIR TRAFFIC CONTROL OPER		Approach Controller, CFS Langebaanweg	6/11/01	2001-06-11	9/20/01	2001-09-20	KEESLER AFB, MS 39534-2354	1	1180	https://2009-2017.state.gov/documents/organization/10964.pdf	Not checked against source; verify accuracy before use	2002-03	2019-07-16	b9e1858eaab74debec7c2f8e5e7645c7
13aeddd7-5aec-41d6-92b4-fe60b80c09f0	03221d24-92ea-4ccc-a6a2-bd88dbfcd9fb	2001_2002_Africa_fmtrpt.tsv	South Africa	ZAF	DoS Africa Region, South Africa, International Military Education and Training (IMET), FY01	ARMOR CAPTAINS CAREER		SANDF- Armour	5/7/01	2001-05-07	9/14/01	2001-09-14	FT KNOX KY 40121-5234	1	3956	https://2009-2017.state.gov/documents/organization/10964.pdf	Not checked against source; verify accuracy before use	2002-03	2019-07-16	5341fab23d1b07958d7bbbad43a824e9
2d1afeae-17ba-40c2-af77-fabeb1a64ae9	03221d24-92ea-4ccc-a6a2-bd88dbfcd9fb	2001_2002_Africa_fmtrpt.tsv	South Africa	ZAF	DoS Africa Region, South Africa, International Military Education and Training (IMET), FY01	ARMOR CPT CAREER CRS PREP		SANDF- Armour	4/16/01	2001-04-16	5/4/01	2001-05-04	FT KNOX KY 40121-5234	1	1260	https://2009-2017.state.gov/documents/organization/10964.pdf	Not checked against source; verify accuracy before use	2002-03	2019-07-16	331f96b23ed6fc18585958c990017adc
67a81c4a-3904-4311-a843-9a261b37639c	03221d24-92ea-4ccc-a6a2-bd88dbfcd9fb	2001_2002_Africa_fmtrpt.tsv	South Africa	ZAF	DoS Africa Region, South Africa, International Military Education and Training (IMET), FY01	CIV-MIL SID - AFRICA		Sec of Def: Policy & Planning	10/16/00	2000-10-16	10/27/00	2000-10-27	HURLBURT FIELD, FL 32544-5826	1	1790	https://2009-2017.state.gov/documents/organization/10964.pdf	Not checked against source; verify accuracy before use	2002-03	2019-07-16	7154ea58bf008f37fd5a65909990c805
1c5dcbd1-25df-4800-9c02-f9416c99b07f	03221d24-92ea-4ccc-a6a2-bd88dbfcd9fb	2001_2002_Africa_fmtrpt.tsv	South Africa	ZAF	DoS Africa Region, South Africa, International Military Education and Training (IMET), FY01	CIV-MIL SID - AFRICA		Project Officer: Project PROFUSION, C Joint Trng	10/16/00	2000-10-16	10/27/00	2000-10-27	HURLBURT FIELD, FL 32544-5826	1	1790	https://2009-2017.state.gov/documents/organization/10964.pdf	Not checked against source; verify accuracy before use	2002-03	2019-07-16	bc83d643768396d1c481906d5eab187b
4b506020-efb7-4164-acff-3c84ebec7eb8	03221d24-92ea-4ccc-a6a2-bd88dbfcd9fb	2001_2002_Africa_fmtrpt.tsv	South Africa	ZAF	DoS Africa Region, South Africa, International Military Education and Training (IMET), FY01	CIV-MIL SID - AFRICA		University of Stellenbosch: Lecturer - Faculty of Military Science	10/16/00	2000-10-16	10/27/00	2000-10-27	HURLBURT FIELD, FL 32544-5826	1	1790	https://2009-2017.state.gov/documents/organization/10964.pdf	Not checked against source; verify accuracy before use	2002-03	2019-07-16	3c081b13505d4dcaecb052da75ad0141
a9093178-4054-47c9-bb11-e274f81d454d	03221d24-92ea-4ccc-a6a2-bd88dbfcd9fb	2001_2002_Africa_fmtrpt.tsv	South Africa	ZAF	DoS Africa Region, South Africa, International Military Education and Training (IMET), FY01	COMB STRAT INTEL TNG PRGM		Cancellation Penalty	1/16/01	2001-01-16	3/2/01	2001-03-02	WASHINGTON DC 20340-5100	1	3080	https://2009-2017.state.gov/documents/organization/10964.pdf	Not checked against source; verify accuracy before use	2002-03	2019-07-16	2241048f0f27fa016096a6ee0c519b56
f01648a0-3789-4b08-ad53-ec03c0d210a2	03221d24-92ea-4ccc-a6a2-bd88dbfcd9fb	2001_2002_Africa_fmtrpt.tsv	South Africa	ZAF	DoS Africa Region, South Africa, International Military Education and Training (IMET), FY01	COMB STRAT INTEL TNG PRGM		Air Force	10/2/00	2000-10-02	11/17/00	2000-11-17	WASHINGTON DC 20340-5100	1	1540	https://2009-2017.state.gov/documents/organization/10964.pdf	Not checked against source; verify accuracy before use	2002-03	2019-07-16	8ebec47ed8c17bd5671c77ab07ac61d2
329cde3e-713f-4f35-abf3-1135333a226d	03221d24-92ea-4ccc-a6a2-bd88dbfcd9fb	2001_2002_Africa_fmtrpt.tsv	South Africa	ZAF	DoS Africa Region, South Africa, International Military Education and Training (IMET), FY01	DEF RES MGT CRS		SANDF Finance Division - Finance Functionary	4/23/01	2001-04-23	5/17/01	2001-05-17	MONTEREY, CA 93943-5201	1	4102	https://2009-2017.state.gov/documents/organization/10964.pdf	Not checked against source; verify accuracy before use	2002-03	2019-07-16	d8f90fcc7a7c7c1a4933cd713432c6dc
f91806b4-e9cd-4d38-9377-f1904163ab57	03221d24-92ea-4ccc-a6a2-bd88dbfcd9fb	2001_2002_Africa_fmtrpt.tsv	South Africa	ZAF	DoS Africa Region, South Africa, International Military Education and Training (IMET), FY01	DEF RES MGT CRS		SANDF - Health	4/23/01	2001-04-23	5/17/01	2001-05-17	MONTEREY, CA 93943-5201	1	4102	https://2009-2017.state.gov/documents/organization/10964.pdf	Not checked against source; verify accuracy before use	2002-03	2019-07-16	a9fd93afb43fe5c7b3bd94876499acae
8842aaa3-af3f-4930-af7d-1554ad8a4007	03221d24-92ea-4ccc-a6a2-bd88dbfcd9fb	2001_2002_Africa_fmtrpt.tsv	South Africa	ZAF	DoS Africa Region, South Africa, International Military Education and Training (IMET), FY01	DEF RES MGT CRS		Logistics: SSO Material Policy Management	1/8/01	2001-01-08	2/1/01	2001-02-01	MONTEREY, CA 93943-5201	1	4102	https://2009-2017.state.gov/documents/organization/10964.pdf	Not checked against source; verify accuracy before use	2002-03	2019-07-16	4ae5979c480b13b0f9b905fc917dec84
ab6cf84f-c91e-4b8d-97cd-2b19a3cd23f6	03221d24-92ea-4ccc-a6a2-bd88dbfcd9fb	2001_2002_Africa_fmtrpt.tsv	South Africa	ZAF	DoS Africa Region, South Africa, International Military Education and Training (IMET), FY01	DEF RES MGT CRS		SAAF Logistics	1/8/01	2001-01-08	2/1/01	2001-02-01	MONTEREY, CA 93943-5201	1	4102	https://2009-2017.state.gov/documents/organization/10964.pdf	Not checked against source; verify accuracy before use	2002-03	2019-07-16	ed9c7b52f0b00415773055fcd869e4b4
d7109f19-0421-403f-94ac-c7837949e1a3	03221d24-92ea-4ccc-a6a2-bd88dbfcd9fb	2001_2002_Africa_fmtrpt.tsv	South Africa	ZAF	DoS Africa Region, South Africa, International Military Education and Training (IMET), FY01	DEF RES MGT CRS		Intelligence	5/21/01	2001-05-21	6/14/01	2001-06-14	MONTEREY, CA 93943-5201	1	4102	https://2009-2017.state.gov/documents/organization/10964.pdf	Not checked against source; verify accuracy before use	2002-03	2019-07-16	11c30116e4b2ba688a476b084408d726
c5f4e131-9df8-4fbb-b851-7d24ceadc2c6	03221d24-92ea-4ccc-a6a2-bd88dbfcd9fb	2001_2002_Africa_fmtrpt.tsv	South Africa	ZAF	DoS Africa Region, South Africa, International Military Education and Training (IMET), FY01	DEF RES MGT CRS		Logistics	5/21/01	2001-05-21	6/14/01	2001-06-14	MONTEREY, CA 93943-5201	1	4102	https://2009-2017.state.gov/documents/organization/10964.pdf	Not checked against source; verify accuracy before use	2002-03	2019-07-16	b3b25e04b52e494a64f620533ec460b2
1b045e82-4e12-481b-82a5-6715a3294944	03221d24-92ea-4ccc-a6a2-bd88dbfcd9fb	2001_2002_Africa_fmtrpt.tsv	South Africa	ZAF	DoS Africa Region, South Africa, International Military Education and Training (IMET), FY01	DEOMI		EO Directorate	8/12/01	2001-08-12	8/26/01	2001-08-26	South Africa	82	21042	https://2009-2017.state.gov/documents/organization/10964.pdf	Not checked against source; verify accuracy before use	2002-03	2019-07-16	1284c967b66eadefbb8abc9c01d9a2bc
fc77e4a1-36e5-462a-b0cf-185795bd2e73	03221d24-92ea-4ccc-a6a2-bd88dbfcd9fb	2001_2002_Africa_fmtrpt.tsv	South Africa	ZAF	DoS Africa Region, South Africa, International Military Education and Training (IMET), FY01	DEOMI		As in 0304A	8/12/01	2001-08-12	8/26/01	2001-08-26	South Africa	0	3198	https://2009-2017.state.gov/documents/organization/10964.pdf	Not checked against source; verify accuracy before use	2002-03	2019-07-16	55e2572b1043b50126e2b35357f9a4dd
9432bbd9-f342-4172-ae38-071a14b9caa4	03221d24-92ea-4ccc-a6a2-bd88dbfcd9fb	2001_2002_Africa_fmtrpt.tsv	South Africa	ZAF	DoS Africa Region, South Africa, International Military Education and Training (IMET), FY01	DEOMI		EO Directorate	2/16/01	2001-02-16	3/4/01	2001-03-04	South Africa	79	0	https://2009-2017.state.gov/documents/organization/10964.pdf	Not checked against source; verify accuracy before use	2002-03	2019-07-16	022ee40f4ca8bd73f354574d856bbf1d
9f59ef3a-dba4-4f9d-8a75-61a2f3f67e02	03221d24-92ea-4ccc-a6a2-bd88dbfcd9fb	2001_2002_Africa_fmtrpt.tsv	South Africa	ZAF	DoS Africa Region, South Africa, International Military Education and Training (IMET), FY01	DEOMI		EO Directorate	2/16/01	2001-02-16	3/4/01	2001-03-04	South Africa	0	2931	https://2009-2017.state.gov/documents/organization/10964.pdf	Not checked against source; verify accuracy before use	2002-03	2019-07-16	b40bd2837ec08732707c110b1fffdc85
d5f75543-c7a9-41c1-860e-0f8bff0f5645	03221d24-92ea-4ccc-a6a2-bd88dbfcd9fb	2001_2002_Africa_fmtrpt.tsv	South Africa	ZAF	DoS Africa Region, South Africa, International Military Education and Training (IMET), FY01	EQUAL OPP STAFF ADVISOR		Navy: Human Resources EO Directorate	5/14/01	2001-05-14	8/17/01	2001-08-17	PATRICK AFB, FL 32925-3399	1	4450	https://2009-2017.state.gov/documents/organization/10964.pdf	Not checked against source; verify accuracy before use	2002-03	2019-07-16	bbe42cf47a42c36fb3d641a4cf4125d1
19012919-644b-4ff5-8455-2a3c7b1dc52d	03221d24-92ea-4ccc-a6a2-bd88dbfcd9fb	2001_2002_Africa_fmtrpt.tsv	South Africa	ZAF	DoS Africa Region, South Africa, International Military Education and Training (IMET), FY01	EQUAL OPP STAFF ADVISOR		SAMHS - Human Resources	5/14/01	2001-05-14	8/17/01	2001-08-17	PATRICK AFB, FL 32925-3399	1	4450	https://2009-2017.state.gov/documents/organization/10964.pdf	Not checked against source; verify accuracy before use	2002-03	2019-07-16	da349c224a26ba1f2cbabb9f88253fff
b01dc990-eb69-489f-8b13-4f4af128193e	03221d24-92ea-4ccc-a6a2-bd88dbfcd9fb	2001_2002_Africa_fmtrpt.tsv	South Africa	ZAF	DoS Africa Region, South Africa, International Military Education and Training (IMET), FY01	EQUAL OPP STAFF ADVISOR		SO1 EO Directorate DoD	5/14/01	2001-05-14	8/17/01	2001-08-17	PATRICK AFB, FL 32925-3399	1	4450	https://2009-2017.state.gov/documents/organization/10964.pdf	Not checked against source; verify accuracy before use	2002-03	2019-07-16	1b5b99dc00636c8ebacb747810c718a6
694b1b59-ed0b-4644-800b-c4368e73c0f8	03221d24-92ea-4ccc-a6a2-bd88dbfcd9fb	2001_2002_Africa_fmtrpt.tsv	South Africa	ZAF	DoS Africa Region, South Africa, International Military Education and Training (IMET), FY01	EQUAL OPP STAFF ADVISOR		SAMHS Personnel	5/14/01	2001-05-14	8/17/01	2001-08-17	PATRICK AFB, FL 32925-3399	1	4450	https://2009-2017.state.gov/documents/organization/10964.pdf	Not checked against source; verify accuracy before use	2002-03	2019-07-16	dd09dc2df0704e6e1e269abf9daeefce
3c72b99d-e11c-4ab2-86ea-251d87a69be2	03221d24-92ea-4ccc-a6a2-bd88dbfcd9fb	2001_2002_Africa_fmtrpt.tsv	South Africa	ZAF	DoS Africa Region, South Africa, International Military Education and Training (IMET), FY01	EQUAL OPP STAFF ADVISOR		SAAF - Human Resources	1/16/01	2001-01-16	4/20/01	2001-04-20	PATRICK AFB, FL 32925-3399	1	4450	https://2009-2017.state.gov/documents/organization/10964.pdf	Not checked against source; verify accuracy before use	2002-03	2019-07-16	3c040ae4abc97e4b920ae2fbfe7d3341
724adfeb-f249-4abf-831c-d992f7462280	03221d24-92ea-4ccc-a6a2-bd88dbfcd9fb	2001_2002_Africa_fmtrpt.tsv	South Africa	ZAF	DoS Africa Region, South Africa, International Military Education and Training (IMET), FY01	EQUAL OPP STAFF ADVISOR		APLA Veterans	5/14/01	2001-05-14	8/17/01	2001-08-17	PATRICK AFB, FL 32925-3399	1	4450	https://2009-2017.state.gov/documents/organization/10964.pdf	Not checked against source; verify accuracy before use	2002-03	2019-07-16	cd6733e08975b3c8050ea725362db410
983a7d9d-977d-4a6d-b3eb-71ab3d786adf	03221d24-92ea-4ccc-a6a2-bd88dbfcd9fb	2001_2002_Africa_fmtrpt.tsv	South Africa	ZAF	DoS Africa Region, South Africa, International Military Education and Training (IMET), FY01	EQUAL OPP STAFF ADVISOR		SANDF - Infantry Corps	1/16/01	2001-01-16	4/20/01	2001-04-20	PATRICK AFB, FL 32925-3399	1	4450	https://2009-2017.state.gov/documents/organization/10964.pdf	Not checked against source; verify accuracy before use	2002-03	2019-07-16	6b0058f1cf35b740db8d7d8824d503be
536e9e16-2e44-4414-996b-2a4647299e97	03221d24-92ea-4ccc-a6a2-bd88dbfcd9fb	2001_2002_Africa_fmtrpt.tsv	South Africa	ZAF	DoS Africa Region, South Africa, International Military Education and Training (IMET), FY01	EQUAL OPP STAFF ADVISOR		SANDF - EO Labour Relations	1/16/01	2001-01-16	4/20/01	2001-04-20	PATRICK AFB, FL 32925-3399	1	4450	https://2009-2017.state.gov/documents/organization/10964.pdf	Not checked against source; verify accuracy before use	2002-03	2019-07-16	a61d5bfc156e7b761437ca65511ede8c
b7d92a63-4d4f-4331-9a10-de7b2e25b16e	03221d24-92ea-4ccc-a6a2-bd88dbfcd9fb	2001_2002_Africa_fmtrpt.tsv	South Africa	ZAF	DoS Africa Region, South Africa, International Military Education and Training (IMET), FY01	EQUAL OPP STAFF ADVISOR		EO Labour Relations SANDF	1/16/01	2001-01-16	4/20/01	2001-04-20	PATRICK AFB, FL 32925-3399	1	4450	https://2009-2017.state.gov/documents/organization/10964.pdf	Not checked against source; verify accuracy before use	2002-03	2019-07-16	ab4fde7a4400bd259a27d6e57443e8ac
f5dbbd83-943a-4318-bd95-417fa291130c	03221d24-92ea-4ccc-a6a2-bd88dbfcd9fb	2001_2002_Africa_fmtrpt.tsv	South Africa	ZAF	DoS Africa Region, South Africa, International Military Education and Training (IMET), FY01	EQUAL OPPORT STAFF ADV OJT		SANDF - EO Directorate	4/12/01	2001-04-12	4/21/01	2001-04-21	PATRICK AFB, FL 32925-3399	1	0	https://2009-2017.state.gov/documents/organization/10964.pdf	Not checked against source; verify accuracy before use	2002-03	2019-07-16	71fb7804e9c5e8009915a90508e4e481
0c07b53d-f604-496e-a0e7-d7489c8122f7	03221d24-92ea-4ccc-a6a2-bd88dbfcd9fb	2001_2002_Africa_fmtrpt.tsv	South Africa	ZAF	DoS Africa Region, South Africa, International Military Education and Training (IMET), FY01	EQUAL OPPORT STAFF ADV OJT		EO Directorate	7/30/01	2001-07-30	8/17/01	2001-08-17	PATRICK AFB, FL 32925-3399	1	0	https://2009-2017.state.gov/documents/organization/10964.pdf	Not checked against source; verify accuracy before use	2002-03	2019-07-16	aa0e621a84a00c91c1e6c11fc86b4056
f83eebc3-9604-4b47-89c9-c6293fa6974f	03221d24-92ea-4ccc-a6a2-bd88dbfcd9fb	2001_2002_Africa_fmtrpt.tsv	South Africa	ZAF	DoS Africa Region, South Africa, International Military Education and Training (IMET), FY01	EQUAL OPPORT STAFF ADV OJT		SAAF - Human Resources	3/29/01	2001-03-29	4/19/01	2001-04-19	PATRICK AFB, FL 32925-3399	1	0	https://2009-2017.state.gov/documents/organization/10964.pdf	Not checked against source; verify accuracy before use	2002-03	2019-07-16	13861f82ba05a2949acc5b3814a29f7d
155e045d-b08e-4bac-8096-bf84a11222c3	03221d24-92ea-4ccc-a6a2-bd88dbfcd9fb	2001_2002_Africa_fmtrpt.tsv	South Africa	ZAF	DoS Africa Region, South Africa, International Military Education and Training (IMET), FY01	EQUAL OPPORT STAFF ADV OJT		EO Directorate	11/28/00	2000-11-28	12/15/00	2000-12-15	PATRICK AFB, FL 32925-3399	1	0	https://2009-2017.state.gov/documents/organization/10964.pdf	Not checked against source; verify accuracy before use	2002-03	2019-07-16	1ee4ec5f8e02a854d73c67a126237ae2
4d77a188-43fc-4d91-aab5-371c089d114c	03221d24-92ea-4ccc-a6a2-bd88dbfcd9fb	2001_2002_Africa_fmtrpt.tsv	South Africa	ZAF	DoS Africa Region, South Africa, International Military Education and Training (IMET), FY01	EXEC PRGM IN CIV-MIL REL		Parliament	6/11/01	2001-06-11	6/22/01	2001-06-22	MONTEREY, CA 93943-5001	1	4358	https://2009-2017.state.gov/documents/organization/10964.pdf	Not checked against source; verify accuracy before use	2002-03	2019-07-16	9239da8f3d227b5ff60c0129ad276d26
e467d06a-e2b2-4a8d-a9d0-31523d8a82e0	03221d24-92ea-4ccc-a6a2-bd88dbfcd9fb	2001_2002_Africa_fmtrpt.tsv	South Africa	ZAF	DoS Africa Region, South Africa, International Military Education and Training (IMET), FY01	EXEC PRGM IN CIV-MIL REL		Parliament	6/11/01	2001-06-11	6/22/01	2001-06-22	MONTEREY, CA 93943-5001	1	4358	https://2009-2017.state.gov/documents/organization/10964.pdf	Not checked against source; verify accuracy before use	2002-03	2019-07-16	9239da8f3d227b5ff60c0129ad276d26
d3ae63f7-b0e8-4ca9-98b5-fb115e4a8579	03221d24-92ea-4ccc-a6a2-bd88dbfcd9fb	2001_2002_Africa_fmtrpt.tsv	South Africa	ZAF	DoS Africa Region, South Africa, International Military Education and Training (IMET), FY01	EXEC PRGM IN CIV-MIL REL		Canellation Penalty	6/11/01	2001-06-11	6/22/01	2001-06-22	MONTEREY, CA 93943-5001	1	4358	https://2009-2017.state.gov/documents/organization/10964.pdf	Not checked against source; verify accuracy before use	2002-03	2019-07-16	41ba1ea28f97392058e83d689c4c5543
90353667-0923-4a8f-8caa-d02bcc03a4c8	03221d24-92ea-4ccc-a6a2-bd88dbfcd9fb	2001_2002_Africa_fmtrpt.tsv	South Africa	ZAF	DoS Africa Region, South Africa, International Military Education and Training (IMET), FY01	EXEC PRGM IN CIV-MIL REL		Parliament	6/11/01	2001-06-11	6/22/01	2001-06-22	MONTEREY, CA 93943-5001	1	4358	https://2009-2017.state.gov/documents/organization/10964.pdf	Not checked against source; verify accuracy before use	2002-03	2019-07-16	9239da8f3d227b5ff60c0129ad276d26
14c957a9-01e6-44f1-8ff0-ef6d9d3bf9c7	03221d24-92ea-4ccc-a6a2-bd88dbfcd9fb	2001_2002_Africa_fmtrpt.tsv	South Africa	ZAF	Africa Region, South Africa, International Military Education and Training (IMET), FY01	FA OFF ADV PREP-ALLIED OFF		Cancellation Penalty	7/12/01	2001-07-12	8/3/01	2001-08-03	FT SILL OK 73503	1	1572	https://2009-2017.state.gov/documents/organization/10964.pdf	Not checked against source; verify accuracy before use	2002-03	2019-07-16	5a1a78d856331d97ecaefa72831d4ab4
467943c8-3bc4-436f-b6dc-c05226af18b5	03221d24-92ea-4ccc-a6a2-bd88dbfcd9fb	2001_2002_Africa_fmtrpt.tsv	South Africa	ZAF	Africa Region, South Africa, International Military Education and Training (IMET), FY01	FLT SAFETY OFF (SATP/FSO)		SAAF Navigator	6/22/01	2001-06-22	8/31/01	2001-08-31	KIRTLAND AFB, NM 87117-5608	1	5380	https://2009-2017.state.gov/documents/organization/10964.pdf	Not checked against source; verify accuracy before use	2002-03	2019-07-16	5a07926bfd295fd8a87cbb052db45e4c
4ebeaa35-b50c-4957-834f-3b74c9646ee4	03221d24-92ea-4ccc-a6a2-bd88dbfcd9fb	2001_2002_Africa_fmtrpt.tsv	South Africa	ZAF	Africa Region, South Africa, International Military Education and Training (IMET), FY01	FLT SAFETY OFF (SATP/FSO)		SAAF Pilot	6/22/01	2001-06-22	8/31/01	2001-08-31	KIRTLAND AFB, NM 87117-5608	1	5380	https://2009-2017.state.gov/documents/organization/10964.pdf	Not checked against source; verify accuracy before use	2002-03	2019-07-16	588c0457120c3ca6ff8ff9d5315c6d6f
a9744739-7f34-465a-a4a7-d60b8981579c	03221d24-92ea-4ccc-a6a2-bd88dbfcd9fb	2001_2002_Africa_fmtrpt.tsv	South Africa	ZAF	Africa Region, South Africa, International Military Education and Training (IMET), FY01	FLT SAFETY OFF (SATP/FSO)		SAAF 19 Sqn FSO	6/22/01	2001-06-22	8/31/01	2001-08-31	KIRTLAND AFB, NM 87117-5608	1	5380	https://2009-2017.state.gov/documents/organization/10964.pdf	Not checked against source; verify accuracy before use	2002-03	2019-07-16	6f95c623434e32ce3ff4118835fc36dd
13e578b8-80db-4a19-8af5-683f98a0a5ce	03221d24-92ea-4ccc-a6a2-bd88dbfcd9fb	2001_2002_Africa_fmtrpt.tsv	South Africa	ZAF	Africa Region, South Africa, International Military Education and Training (IMET), FY01	FLYING SAFETY		Avaition Safety: SAAF, ODC Namibia	9/10/01	2001-09-10	9/28/01	2001-09-28	South Africa	33	88569	https://2009-2017.state.gov/documents/organization/10964.pdf	Not checked against source; verify accuracy before use	2002-03	2019-07-16	a78887538aa151f144f18a2b92e600b9
e8ae143e-fd8e-4366-ab45-195d23e9573f	03221d24-92ea-4ccc-a6a2-bd88dbfcd9fb	2001_2002_Africa_fmtrpt.tsv	South Africa	ZAF	Africa Region, South Africa, International Military Education and Training (IMET), FY01	INTL DEFENSE MGT CRS		SANDF - Logistics	2/5/01	2001-02-05	4/18/01	2001-04-18	MONTEREY, CA 93943-5201	1	11326	https://2009-2017.state.gov/documents/organization/10964.pdf	Not checked against source; verify accuracy before use	2002-03	2019-07-16	de8c07d8a10506cf20b510cbef0487c0
29c24ea4-0c89-4c79-a781-0caf98df25b4	03221d24-92ea-4ccc-a6a2-bd88dbfcd9fb	2001_2002_Africa_fmtrpt.tsv	South Africa	ZAF	Africa Region, South Africa, International Military Education and Training (IMET), FY01	INTL MARITIME OFF		SA Navy - Combat Officer	1/16/01	2001-01-16	3/23/01	2001-03-23	YORKTOWN, VA 23690-5000	1	7675	https://2009-2017.state.gov/documents/organization/10964.pdf	Not checked against source; verify accuracy before use	2002-03	2019-07-16	4a9e8f0c18637e585c9a8b6d0c76d98a
751ee77f-8436-4f81-893d-49ba9019e8dd	03221d24-92ea-4ccc-a6a2-bd88dbfcd9fb	2001_2002_Africa_fmtrpt.tsv	South Africa	ZAF	Africa Region, South Africa, International Military Education and Training (IMET), FY01	JET ENGINE MISHAP INV		SAAF Pilot	9/4/01	2001-09-04	9/14/01	2001-09-14	SHEPPARD AFB TX 76311-2367	1	200	https://2009-2017.state.gov/documents/organization/10964.pdf	Not checked against source; verify accuracy before use	2002-03	2019-07-16	19d1d2b67ec6745148051c95634e135d
e15f25d9-2aae-4f33-9d0f-1990fcbe5f36	03221d24-92ea-4ccc-a6a2-bd88dbfcd9fb	2001_2002_Africa_fmtrpt.tsv	South Africa	ZAF	Africa Region, South Africa, International Military Education and Training (IMET), FY01	JET ENGINE MISHAP INV		SAAF 19 Sqn FSO	9/4/01	2001-09-04	9/14/01	2001-09-14	SHEPPARD AFB TX 76311-2367	1	200	https://2009-2017.state.gov/documents/organization/10964.pdf	Not checked against source; verify accuracy before use	2002-03	2019-07-16	a4d183029b45b61347056527ba28d1be
5568dd33-c1ad-4a57-928b-cbcdb2ce27b0	03221d24-92ea-4ccc-a6a2-bd88dbfcd9fb	2001_2002_Africa_fmtrpt.tsv	South Africa	ZAF	Africa Region, South Africa, International Military Education and Training (IMET), FY01	JET ENGINE MISHAP INV		SAAF Navigator	9/4/01	2001-09-04	9/14/01	2001-09-14	SHEPPARD AFB TX 76311-2367	1	200	https://2009-2017.state.gov/documents/organization/10964.pdf	Not checked against source; verify accuracy before use	2002-03	2019-07-16	847702aaa1a43ea3668763afd897f2c0
6960e650-8b8c-450b-af52-3647e687e3ca	03221d24-92ea-4ccc-a6a2-bd88dbfcd9fb	2001_2002_Africa_fmtrpt.tsv	South Africa	ZAF	Africa Region, South Africa, International Military Education and Training (IMET), FY01	LDRSHIP PGM DIS. RESP.		South African Military Health Services, ODC Swaziland, ODC Leostho, ODC Zambia, ODC Mozambique, ODC Namibia and United Kingdom	8/16/01	2001-08-16	8/25/01	2001-08-25	South Africa	18	56178	https://2009-2017.state.gov/documents/organization/10964.pdf	Not checked against source; verify accuracy before use	2002-03	2019-07-16	5367c372367dec90b8c014745dc510c6
a40e8ac0-a819-412d-ad15-3423ed69e9db	03221d24-92ea-4ccc-a6a2-bd88dbfcd9fb	2001_2002_Africa_fmtrpt.tsv	South Africa	ZAF	Africa Region, South Africa, International Military Education and Training (IMET), FY01	MEDICAL STRATEGIC LDR CRS		SAMHS - Tempe Bloemfontein	6/4/01	2001-06-04	7/6/01	2001-07-06	FT SAM HOUSTON TX 78234-6100	1	179	https://2009-2017.state.gov/documents/organization/10964.pdf	Not checked against source; verify accuracy before use	2002-03	2019-07-16	0af5886d8fffc01f9f73c620b5a02eaf
88263675-f541-459b-b810-abb013d93bde	03221d24-92ea-4ccc-a6a2-bd88dbfcd9fb	2001_2002_Africa_fmtrpt.tsv	South Africa	ZAF	Africa Region, South Africa, International Military Education and Training (IMET), FY01	MET ACQUISITION PHASE III		ARMSCOR & SANDF Acquisition	6/25/01	2001-06-25	6/29/01	2001-06-29	South Africa	24	19944	https://2009-2017.state.gov/documents/organization/10964.pdf	Not checked against source; verify accuracy before use	2002-03	2019-07-16	1fd2e2410ed6f9cbdf423aa37061fa20
8317e408-f284-4055-a2b6-a9ffe9b40741	03221d24-92ea-4ccc-a6a2-bd88dbfcd9fb	2001_2002_Africa_fmtrpt.tsv	South Africa	ZAF	Africa Region, South Africa, International Military Education and Training (IMET), FY01	MET CIV-MIL REL CONT ED		Public Service Act Personnel - SANDF	3/26/01	2001-03-26	3/30/01	2001-03-30	South Africa	90	18377	https://2009-2017.state.gov/documents/organization/10964.pdf	Not checked against source; verify accuracy before use	2002-03	2019-07-16	fc93309b92d3a1524e7bb22b40f6fd3e
cc7e9e0b-6ada-4fd6-a990-0b554857e244	03221d24-92ea-4ccc-a6a2-bd88dbfcd9fb	2001_2002_Africa_fmtrpt.tsv	South Africa	ZAF	Africa Region, South Africa, International Military Education and Training (IMET), FY01	MET CIV-MILITARY RELATIONS		SA Department of Labor, SANDF Service Corps, NGO's	2/10/01	2001-02-10	2/22/01	2001-02-22	South Africa	107	7830	https://2009-2017.state.gov/documents/organization/10964.pdf	Not checked against source; verify accuracy before use	2002-03	2019-07-16	f1d3f535f814c09dd9a289d006610909
c59cca0c-5c58-43c1-8df9-e8092decdb81	03221d24-92ea-4ccc-a6a2-bd88dbfcd9fb	2001_2002_Africa_fmtrpt.tsv	South Africa	ZAF	Africa Region, South Africa, International Military Education and Training (IMET), FY01	MET DIILS		Department Foreign Affairs	6/11/01	2001-06-11	6/15/01	2001-06-15	South Africa	42	20350	https://2009-2017.state.gov/documents/organization/10964.pdf	Not checked against source; verify accuracy before use	2002-03	2019-07-16	3697db4af80ee2227bda2bcd3e67d275
2bcf7f0e-914d-4186-aa47-f4da13f66592	03221d24-92ea-4ccc-a6a2-bd88dbfcd9fb	2001_2002_Africa_fmtrpt.tsv	South Africa	ZAF	Africa Region, South Africa, International Military Education and Training (IMET), FY01	MET DIILS		SANDF Legal Division	6/4/01	2001-06-04	6/8/01	2001-06-08	South Africa	37	33750	https://2009-2017.state.gov/documents/organization/10964.pdf	Not checked against source; verify accuracy before use	2002-03	2019-07-16	dcf8cb5227b1609e6d6cb9b55bd39dbe
68830865-1260-49fc-b7e9-c9029fb21058	03221d24-92ea-4ccc-a6a2-bd88dbfcd9fb	2001_2002_Africa_fmtrpt.tsv	South Africa	ZAF	Africa Region, South Africa, International Military Education and Training (IMET), FY01	MET REGIONAL CIV-MIL RELS		MET	8/27/01	2001-08-27	8/31/01	2001-08-31	South Africa	1	30272	https://2009-2017.state.gov/documents/organization/10964.pdf	Not checked against source; verify accuracy before use	2002-03	2019-07-16	10de0425e7a1e708e7a82e18d19e1086
a790ceb2-fbdc-4ba0-ae3b-0482396b96f8	03221d24-92ea-4ccc-a6a2-bd88dbfcd9fb	2001_2002_Africa_fmtrpt.tsv	South Africa	ZAF	Africa Region, South Africa, International Military Education and Training (IMET), FY01	MIL & PCKEEP OPS IAW ROL		Project PROFUSION Design Team	4/16/01	2001-04-16	5/18/01	2001-05-18	NEWPORT, RI 02841-1523	1	10352	https://2009-2017.state.gov/documents/organization/10964.pdf	Not checked against source; verify accuracy before use	2002-03	2019-07-16	7e4f55fb233e61a46734bd8350b7e532
48417406-cb35-4b51-84ae-83d21bde4135	03221d24-92ea-4ccc-a6a2-bd88dbfcd9fb	2001_2002_Africa_fmtrpt.tsv	South Africa	ZAF	Africa Region, South Africa, International Military Education and Training (IMET), FY01	MIL & PCKEEP OPS IAW ROL		South African Defense Secretariate	4/16/01	2001-04-16	5/18/01	2001-05-18	NEWPORT, RI 02841-1523	1	10352	https://2009-2017.state.gov/documents/organization/10964.pdf	Not checked against source; verify accuracy before use	2002-03	2019-07-16	e3530486354c184b0dcfcc4f1588043d
7285fe3e-dc17-41a7-88fc-480420b168e8	03221d24-92ea-4ccc-a6a2-bd88dbfcd9fb	2001_2002_Africa_fmtrpt.tsv	South Africa	ZAF	Africa Region, South Africa, International Military Education and Training (IMET), FY01	MTT-OTHER-OS		Chief Logitics SANDF	5/21/01	2001-05-21	9/30/01	2001-09-30	South Africa	135	103000	https://2009-2017.state.gov/documents/organization/10964.pdf	Not checked against source; verify accuracy before use	2002-03	2019-07-16	5c0aaa9e080c90e9267a794cb3148520
9c077bde-9ca4-4efb-88f6-a7e6af2af9e2	03221d24-92ea-4ccc-a6a2-bd88dbfcd9fb	2001_2002_Africa_fmtrpt.tsv	South Africa	ZAF	Africa Region, South Africa, International Military Education and Training (IMET), FY01	MTT/TRAINING AIDS		Wokring lunch for WCN0301A	9/10/01	2001-09-10	9/28/01	2001-09-28	South Africa	0	18000	https://2009-2017.state.gov/documents/organization/10964.pdf	Not checked against source; verify accuracy before use	2002-03	2019-07-16	6a0ff78a168778097c41b887ed6b1cd2
3e56e48c-34cc-4f9f-b973-66dfe0c15886	03221d24-92ea-4ccc-a6a2-bd88dbfcd9fb	2001_2002_Africa_fmtrpt.tsv	South Africa	ZAF	Africa Region, South Africa, International Military Education and Training (IMET), FY01	MTT/TRAINING AIDS		Working lunch funding	8/12/01	2001-08-12	8/26/01	2001-08-26	South Africa	0	6000	https://2009-2017.state.gov/documents/organization/10964.pdf	Not checked against source; verify accuracy before use	2002-03	2019-07-16	6dd8dc26f2f5ae4a589fed912e7fb073
9eab6576-be15-4b7c-9d57-368e1d9969d1	03221d24-92ea-4ccc-a6a2-bd88dbfcd9fb	2001_2002_Africa_fmtrpt.tsv	South Africa	ZAF	Africa Region, South Africa, International Military Education and Training (IMET), FY01	MTT/TRAINING AIDS		As in 0301A	8/16/01	2001-08-16	8/25/01	2001-08-25	South Africa	0	28464	https://2009-2017.state.gov/documents/organization/10964.pdf	Not checked against source; verify accuracy before use	2002-03	2019-07-16	5a90548cb8599e12c37d62694ed8b092
29692baa-7aa8-47d8-8c2f-ee6ab12abf06	03221d24-92ea-4ccc-a6a2-bd88dbfcd9fb	2001_2002_Africa_fmtrpt.tsv	South Africa	ZAF	Africa Region, South Africa, International Military Education and Training (IMET), FY01	NAVAL STAFF COLLEGE		SAN, Executive (Combat Officer)	1/11/01	2001-01-11	6/15/01	2001-06-15	NEWPORT, RI 02841-1207	1	11862	https://2009-2017.state.gov/documents/organization/10964.pdf	Not checked against source; verify accuracy before use	2002-03	2019-07-16	712f87d7e83960ca3e16b4f63fcc8895
47feb3f0-9324-445d-93ae-1bca9d5c1042	03221d24-92ea-4ccc-a6a2-bd88dbfcd9fb	2001_2002_Africa_fmtrpt.tsv	South Africa	ZAF	Africa Region, South Africa, International Military Education and Training (IMET), FY01	ORIENTATION TOUR D/V		Navy	6/11/01	2001-06-11	6/16/01	2001-06-16	MONTEREY, CA 93943-5001	1	48045	https://2009-2017.state.gov/documents/organization/10964.pdf	Not checked against source; verify accuracy before use	2002-03	2019-07-16	91690c510a8612a2ac95e2d116be219f
6647f7e4-8d73-4dab-829b-afaff3dc4054	03221d24-92ea-4ccc-a6a2-bd88dbfcd9fb	2001_2002_Africa_fmtrpt.tsv	South Africa	ZAF	Africa Region, South Africa, International Military Education and Training (IMET), FY01	SPEC INVES CRS (SIC)		Military Police Agency	1/4/01	2001-01-04	3/16/01	2001-03-16	ANDREWS AFB, MD 20331-5064	1	1770	https://2009-2017.state.gov/documents/organization/10964.pdf	Not checked against source; verify accuracy before use	2002-03	2019-07-16	5a9257440300705f5d30c583b0afbf0a
524161f9-12fa-4bbf-8f58-cc3529be8bc1	03221d24-92ea-4ccc-a6a2-bd88dbfcd9fb	2001_2002_Africa_fmtrpt.tsv	South Africa	ZAF	Africa Region, South Africa, International Military Education and Training (IMET), FY01	SPECIALIZED ENG LANG TNG		Cancellation Penalty	5/7/01	2001-05-07	7/6/01	2001-07-06	LACKLAND AFB, TX 78236	1	1135	https://2009-2017.state.gov/documents/organization/10964.pdf	Not checked against source; verify accuracy before use	2002-03	2019-07-16	a53025aa795dadcafc5af4005a25f2d1
563f1710-869c-4c41-ad4f-4445f7eb6dc0	03221d24-92ea-4ccc-a6a2-bd88dbfcd9fb	2001_2002_Africa_fmtrpt.tsv	South Africa	ZAF	Africa Region, South Africa, International Military Education and Training (IMET), FY01	SPECIALIZED ENG LANG TNG		Approach Controller, CFS Langebaanweg	4/9/01	2001-04-09	6/8/01	2001-06-08	LACKLAND AFB, TX 78236	1	2270	https://2009-2017.state.gov/documents/organization/10964.pdf	Not checked against source; verify accuracy before use	2002-03	2019-07-16	197a05db7edd0bd444f5c45becd51f72
c77ad806-5c79-4ea1-a676-20217bb4c9a2	03221d24-92ea-4ccc-a6a2-bd88dbfcd9fb	2001_2002_Africa_fmtrpt.tsv	South Africa	ZAF	Africa Region, South Africa, International Military Education and Training (IMET), FY01	SR INTERNATIONAL DEF MGT		Air Force-Policy & Plans	6/25/01	2001-06-25	7/20/01	2001-07-20	MONTEREY, CA 93943-5201	1	4315	https://2009-2017.state.gov/documents/organization/10964.pdf	Not checked against source; verify accuracy before use	2002-03	2019-07-16	e9fe7b2e3940fec8b486fbea0904812f
f3059f8b-ec7f-46df-8ab5-933676fb4b34	03221d24-92ea-4ccc-a6a2-bd88dbfcd9fb	2001_2002_Africa_fmtrpt.tsv	South Africa	ZAF	Africa Region, South Africa, International Military Education and Training (IMET), FY01	SR INTERNATIONAL DEF MGT		SANDF - Finance	6/25/01	2001-06-25	7/20/01	2001-07-20	MONTEREY, CA 93943-5201	1	4315	https://2009-2017.state.gov/documents/organization/10964.pdf	Not checked against source; verify accuracy before use	2002-03	2019-07-16	82c800b0589f8889d24bbe2aac910893
a99b03a7-b9e8-4df2-b284-1ad22198637d	03221d24-92ea-4ccc-a6a2-bd88dbfcd9fb	2001_2002_Africa_fmtrpt.tsv	South Africa	ZAF	Africa Region, South Africa, International Military Education and Training (IMET), FY01	SURVEY/ *		Site Survey: Lt Col Dorlac USAFSG	7/24/01	2001-07-24	7/31/01	2001-07-31	South Africa	0	0	https://2009-2017.state.gov/documents/organization/10964.pdf	Not checked against source; verify accuracy before use	2002-03	2019-07-16	726cb58ccb8eb661678926258207b043
af39c850-880d-4a2f-86e1-fd24c39f817e	03221d24-92ea-4ccc-a6a2-bd88dbfcd9fb	2001_2002_Africa_fmtrpt.tsv	South Africa	ZAF	Africa Region, South Africa, International Military Education and Training (IMET), FY01	TRAUMA REFRESHER COURSE		7 Med BN GP	12/4/00	2000-12-04	12/8/00	2000-12-08	LACKLAND AFB, TX 78236	1	200	https://2009-2017.state.gov/documents/organization/10964.pdf	Not checked against source; verify accuracy before use	2002-03	2019-07-16	801c2301048696bfb3f9ed9654df4f3b
cf991d7e-93fb-4143-bb44-1ec9a2ca843d	03221d24-92ea-4ccc-a6a2-bd88dbfcd9fb	2001_2002_Africa_fmtrpt.tsv	South Africa	ZAF	Africa Region, South Africa, International Military Education and Training (IMET), FY01	TRAUMA REFRESHER COURSE		Chief Medical Officer - 2 Military Hospital	12/4/00	2000-12-04	12/8/00	2000-12-08	LACKLAND AFB, TX 78236	1	200	https://2009-2017.state.gov/documents/organization/10964.pdf	Not checked against source; verify accuracy before use	2002-03	2019-07-16	f51050da0b538fc67a07373fcd52ef94
bd760b85-6f4a-4e1c-acca-1e2abcb0a234	03221d24-92ea-4ccc-a6a2-bd88dbfcd9fb	2001_2002_Africa_fmtrpt.tsv	South Africa	ZAF	Africa Region, South Africa, International Military Education and Training (IMET), FY01	TRAUMA REFRESHER COURSE		7 Med BN GP	12/4/00	2000-12-04	12/8/00	2000-12-08	LACKLAND AFB, TX 78236	1	200	https://2009-2017.state.gov/documents/organization/10964.pdf	Not checked against source; verify accuracy before use	2002-03	2019-07-16	801c2301048696bfb3f9ed9654df4f3b
7c6b2e05-a91c-411e-b573-b81add476d1e	03221d24-92ea-4ccc-a6a2-bd88dbfcd9fb	2001_2002_Africa_fmtrpt.tsv	South Africa	ZAF	Africa Region, South Africa, International Military Education and Training (IMET), FY01	U.S. ARMY SGT MAJOR PREP		SANDF - Infantry	7/23/01	2001-07-23	8/10/01	2001-08-10	FT BLISS TX 79918-8002	1	556	https://2009-2017.state.gov/documents/organization/10964.pdf	Not checked against source; verify accuracy before use	2002-03	2019-07-16	9fb2f906ef29d0d109778a2a1dfd8e9b
35b3895c-7cc8-4891-9a23-0dcd5bef14e4	03221d24-92ea-4ccc-a6a2-bd88dbfcd9fb	2001_2002_Africa_fmtrpt.tsv	South Africa	ZAF	DoS Africa Region, South Africa, Enhanced International Peacekeeping Capabilities (EPIC), FY01	EIPC INSTRUCTORS COURSE		Navy	7/16/01	2001-07-16	7/27/01	2001-07-27	MONTEREY, CA 93943-5001	1	4584	https://2009-2017.state.gov/documents/organization/10964.pdf	Not checked against source; verify accuracy before use	2002-03	2019-07-16	0a8eb2a0b9d8f5fe6731dc042f184c6d
7222b010-4b83-48b6-b564-144382f3e010	03221d24-92ea-4ccc-a6a2-bd88dbfcd9fb	2001_2002_Africa_fmtrpt.tsv	South Africa	ZAF	DoS Africa Region, South Africa, Enhanced International Peacekeeping Capabilities (EPIC), FY01	EIPC INSTRUCTORS COURSE		Navy	7/16/01	2001-07-16	7/27/01	2001-07-27	MONTEREY, CA 93943-5001	1	4584	https://2009-2017.state.gov/documents/organization/10964.pdf	Not checked against source; verify accuracy before use	2002-03	2019-07-16	0a8eb2a0b9d8f5fe6731dc042f184c6d
3f240d8c-898a-4aa7-a86c-96023ea990c1	03221d24-92ea-4ccc-a6a2-bd88dbfcd9fb	2001_2002_Africa_fmtrpt.tsv	South Africa	ZAF	DoS Africa Region, South Africa, Enhanced International Peacekeeping Capabilities (EPIC), FY01	EIPC INSTRUCTORS COURSE		Project Officer: Project Profusion	2/26/01	2001-02-26	3/9/01	2001-03-09	MONTEREY, CA 93943-5001	1	3779	https://2009-2017.state.gov/documents/organization/10964.pdf	Not checked against source; verify accuracy before use	2002-03	2019-07-16	3685fe4863921ea344b7522cbd2a324f
a6e36f8e-8112-4efe-a1d8-b99b8fdebf6f	03221d24-92ea-4ccc-a6a2-bd88dbfcd9fb	2001_2002_Africa_fmtrpt.tsv	South Africa	ZAF	DoS Africa Region, South Africa, Enhanced International Peacekeeping Capabilities (EPIC), FY01	EIPC INSTRUCTORS COURSE		Navy	2/26/01	2001-02-26	3/9/01	2001-03-09	MONTEREY, CA 93943-5001	1	3779	https://2009-2017.state.gov/documents/organization/10964.pdf	Not checked against source; verify accuracy before use	2002-03	2019-07-16	34401caecfc273a3ba0d98453a221995
0f31c519-5420-49c9-8e88-133b08a443d5	03221d24-92ea-4ccc-a6a2-bd88dbfcd9fb	2001_2002_Africa_fmtrpt.tsv	South Africa	ZAF	DoS Africa Region, South Africa, Enhanced International Peacekeeping Capabilities (EPIC), FY01	EIPC INSTRUCTORS COURSE		Navy	7/16/01	2001-07-16	7/27/01	2001-07-27	MONTEREY, CA 93943-5001	1	4584	https://2009-2017.state.gov/documents/organization/10964.pdf	Not checked against source; verify accuracy before use	2002-03	2019-07-16	0a8eb2a0b9d8f5fe6731dc042f184c6d
27547ae4-9587-4980-97a5-9d6ce53d9205	03221d24-92ea-4ccc-a6a2-bd88dbfcd9fb	2001_2002_Africa_fmtrpt.tsv	South Africa	ZAF	DoS Africa Region, South Africa, Enhanced International Peacekeeping Capabilities (EPIC), FY01	EIPC INSTRUCTORS COURSE		Navy	2/26/01	2001-02-26	3/9/01	2001-03-09	MONTEREY, CA 93943-5001	1	3779	https://2009-2017.state.gov/documents/organization/10964.pdf	Not checked against source; verify accuracy before use	2002-03	2019-07-16	34401caecfc273a3ba0d98453a221995
df527a9d-6bed-4338-b22c-b2a26f3dba38	03221d24-92ea-4ccc-a6a2-bd88dbfcd9fb	2001_2002_Africa_fmtrpt.tsv	South Africa	ZAF	DoS Africa Region, South Africa, Enhanced International Peacekeeping Capabilities (EPIC), FY01	EIPC INSTRUCTORS COURSE		Navy	2/26/01	2001-02-26	3/9/01	2001-03-09	MONTEREY, CA 93943-5001	1	3779	https://2009-2017.state.gov/documents/organization/10964.pdf	Not checked against source; verify accuracy before use	2002-03	2019-07-16	34401caecfc273a3ba0d98453a221995
a332453d-9d4b-4f30-8d56-6eb34de49609	03221d24-92ea-4ccc-a6a2-bd88dbfcd9fb	2001_2002_Africa_fmtrpt.tsv	South Africa	ZAF	DoS Africa Region, South Africa, Enhanced International Peacekeeping Capabilities (EPIC), FY01	EIPC INSTRUCTORS COURSE		Project Officer Project Profusion	2/26/01	2001-02-26	3/9/01	2001-03-09	MONTEREY, CA 93943-5001	1	3779	https://2009-2017.state.gov/documents/organization/10964.pdf	Not checked against source; verify accuracy before use	2002-03	2019-07-16	2010bbcce3365612697012efbef67cd0
a860269c-872d-4db4-b2c6-8f323a067757	03221d24-92ea-4ccc-a6a2-bd88dbfcd9fb	2001_2002_Africa_fmtrpt.tsv	South Africa	ZAF	DoS Africa Region, South Africa, Enhanced International Peacekeeping Capabilities (EPIC), FY01	EIPC INSTRUCTORS COURSE		Project Officer Project Profusion	2/26/01	2001-02-26	3/9/01	2001-03-09	MONTEREY, CA 93943-5001	1	3779	https://2009-2017.state.gov/documents/organization/10964.pdf	Not checked against source; verify accuracy before use	2002-03	2019-07-16	2010bbcce3365612697012efbef67cd0
f9e01ca1-1a5c-44fa-abda-e10b730bcdca	03221d24-92ea-4ccc-a6a2-bd88dbfcd9fb	2001_2002_Africa_fmtrpt.tsv	South Africa	ZAF	DoS Africa Region, South Africa, Marshall Center, FY01	Conferences	N/A	MOD	11/11/00	2000-11-11	9/28/01	2001-09-28	Various	1	850	https://2009-2017.state.gov/documents/organization/10964.pdf	Not checked against source; verify accuracy before use	2002-03	2019-07-16	a04c87868479d931c5fac28e0398a6a3
9ce5091f-ff0f-4880-ad44-a1fb53af24f2	03221d24-92ea-4ccc-a6a2-bd88dbfcd9fb	2001_2002_Africa_fmtrpt.tsv	South Africa	ZAF	DoS Africa Region, South Africa, Africa Center for Strategic Studies, FY01	Senior Leader Seminar		DOD MOD	1/29/01	2001-01-29	2/9/01	2001-02-09	Libreville Gabon	1	8624	https://2009-2017.state.gov/documents/organization/10964.pdf	Not checked against source; verify accuracy before use	2002-03	2019-07-16	9689c72a693cfccbbb6c4809d4fa1235
f98a1e78-d666-4f2f-a4e7-d0556e02db5e	03221d24-92ea-4ccc-a6a2-bd88dbfcd9fb	2001_2002_Africa_fmtrpt.tsv	Swaziland	SWZ	DoS Africa Region, Swaziland, Non-Security Assistance, Unified Command (Note 4), FY01	JCET	3/3 SFG	UMBUTFO SWAZILAND DEFENSE FORCE	2/15/01	2001-02-15	3/31/01	2001-03-31	MBABANE	40	82000	https://2009-2017.state.gov/documents/organization/10964.pdf	Not checked against source; verify accuracy before use	2002-03	2019-07-16	5cb52a1b8a07c03f87b217ec32185528
badef1e4-74a8-4365-9e07-ccaacccbd2a2	03221d24-92ea-4ccc-a6a2-bd88dbfcd9fb	2001_2002_Africa_fmtrpt.tsv	Swaziland	SWZ	DoS Africa Region, Swaziland, International Military Education and Training (IMET), FY01	ALLIED OFF PREP-INF OAC		3rd Infantry Bat.USDF/ Army	9/17/01	2001-09-17	9/21/01	2001-09-21	FT BENNING GA 31905-5468	1	5583	https://2009-2017.state.gov/documents/organization/10964.pdf	Not checked against source; verify accuracy before use	2002-03	2019-07-16	0a28b84c83b7f0b83f5c853c23f4b3ad
2655e6c3-12d3-48c3-9541-3f3c65e1caa9	03221d24-92ea-4ccc-a6a2-bd88dbfcd9fb	2001_2002_Africa_fmtrpt.tsv	Swaziland	SWZ	DoS Africa Region, Swaziland, International Military Education and Training (IMET), FY01	CIV-MIL SID - AFRICA		Swazi Gov /Civilian Doctor ACSS	10/16/00	2000-10-16	10/27/00	2000-10-27	HURLBURT FIELD, FL 32544-5826	1	6862	https://2009-2017.state.gov/documents/organization/10964.pdf	Not checked against source; verify accuracy before use	2002-03	2019-07-16	5f1638fcfa7838adb596995adae6d67b
77dd91df-7e53-4761-b905-5fa2dc7ce42a	03221d24-92ea-4ccc-a6a2-bd88dbfcd9fb	2001_2002_Africa_fmtrpt.tsv	Swaziland	SWZ	DoS Africa Region, Swaziland, International Military Education and Training (IMET), FY01	CIV-MIL SID - AFRICA		Civilian /Min of Def.ACSS	10/16/00	2000-10-16	10/27/00	2000-10-27	HURLBURT FIELD, FL 32544-5826	1	6862	https://2009-2017.state.gov/documents/organization/10964.pdf	Not checked against source; verify accuracy before use	2002-03	2019-07-16	03fc1fd8e5a4dc2712c9e4f5aa80beb8
fb89056d-24ea-4f0f-83a5-14319f6046b8	03221d24-92ea-4ccc-a6a2-bd88dbfcd9fb	2001_2002_Africa_fmtrpt.tsv	Swaziland	SWZ	DoS Africa Region, Swaziland, International Military Education and Training (IMET), FY01	INFANTRY OFFICER BASIC		Infantry USDF/ Army	6/4/01	2001-06-04	9/27/01	2001-09-27	FT BENNING GA 31905-5468	1	4675	https://2009-2017.state.gov/documents/organization/10964.pdf	Not checked against source; verify accuracy before use	2002-03	2019-07-16	5aba6f24d594edc6ea784708928ebfc9
23b419a3-04a5-4965-b77b-b4d21e82b375	03221d24-92ea-4ccc-a6a2-bd88dbfcd9fb	2001_2002_Africa_fmtrpt.tsv	Swaziland	SWZ	DoS Africa Region, Swaziland, International Military Education and Training (IMET), FY01	MET DIILS		Army/USDF 18 & UDF 12 DIIL in Swaziland	2/12/01	2001-02-12	2/16/01	2001-02-16	Swaziland	29	24812	https://2009-2017.state.gov/documents/organization/10964.pdf	Not checked against source; verify accuracy before use	2002-03	2019-07-16	72bd0f7226f1b1d0a86482929a83c783
3def16e1-f1ab-4b2d-ad28-f567eb30dd53	03221d24-92ea-4ccc-a6a2-bd88dbfcd9fb	2001_2002_Africa_fmtrpt.tsv	Swaziland	SWZ	DoS Africa Region, Swaziland, Africa Center for Strategic Studies, FY01	Senior Leader Seminar		MOD	1/29/01	2001-01-29	2/9/01	2001-02-09	Libreville Gabon	1	8843	https://2009-2017.state.gov/documents/organization/10964.pdf	Not checked against source; verify accuracy before use	2002-03	2019-07-16	f3c03040c14c4afcae05e563869fa1de
52350f3a-77ca-4975-bdce-d9dd6268d1ce	03221d24-92ea-4ccc-a6a2-bd88dbfcd9fb	2001_2002_Africa_fmtrpt.tsv	Tanzania	TZA	DoS Africa Region, Tanzania, International Military Education and Training (IMET), FY01	ALLIED OFF PREP-INF OAC		12 Infantry Battalion Army	1/8/01	2001-01-08	1/12/01	2001-01-12	FT BENNING GA 31905-5468	1	249	https://2009-2017.state.gov/documents/organization/10964.pdf	Not checked against source; verify accuracy before use	2002-03	2019-07-16	52e48c29cad7604ec0d80cdaa4b62a25
6a3d6f1f-1e5a-4b16-b04b-2d138deb18f9	03221d24-92ea-4ccc-a6a2-bd88dbfcd9fb	2001_2002_Africa_fmtrpt.tsv	Tanzania	TZA	DoS Africa Region, Tanzania, International Military Education and Training (IMET), FY01	COMB STRAT INTEL TNG PRGM		School of Intelligence All Services	7/9/01	2001-07-09	8/24/01	2001-08-24	WASHINGTON DC 20340-5100	1	3080	https://2009-2017.state.gov/documents/organization/10964.pdf	Not checked against source; verify accuracy before use	2002-03	2019-07-16	7f566bf4ffbf693a27eda6e6d258fbea
b4d83d48-f578-4a6e-9198-0a7301dd4d9c	03221d24-92ea-4ccc-a6a2-bd88dbfcd9fb	2001_2002_Africa_fmtrpt.tsv	Tanzania	TZA	DoS Africa Region, Tanzania, International Military Education and Training (IMET), FY01	COMB STRAT INTEL TNG PRGM		Defense Head Quarters	10/2/00	2000-10-02	11/17/00	2000-11-17	WASHINGTON DC 20340-5100	1	3080	https://2009-2017.state.gov/documents/organization/10964.pdf	Not checked against source; verify accuracy before use	2002-03	2019-07-16	3ce81eaec0e62b197f696214aef6dbd6
35dfc258-95f7-41da-8401-7920d8178fc0	03221d24-92ea-4ccc-a6a2-bd88dbfcd9fb	2001_2002_Africa_fmtrpt.tsv	Tanzania	TZA	DoS Africa Region, Tanzania, International Military Education and Training (IMET), FY01	ENGLISH LANGUAGE CRSE		School of Communications	1/22/01	2001-01-22	3/30/01	2001-03-30	SAN ANTONIO TX 78236-5259	1	2515	https://2009-2017.state.gov/documents/organization/10964.pdf	Not checked against source; verify accuracy before use	2002-03	2019-07-16	8d19df59b7aae2c907b3c54fa31d6018
b92acbe7-179b-4641-a3e0-a101310c6c32	03221d24-92ea-4ccc-a6a2-bd88dbfcd9fb	2001_2002_Africa_fmtrpt.tsv	Tanzania	TZA	DoS Africa Region, Tanzania, International Military Education and Training (IMET), FY01	FA OFF ADV PREP-ALLIED OFF		431 Field Artillery Regiment Army	8/22/01	2001-08-22	9/14/01	2001-09-14	FT SILL OK 73503	1	1572	https://2009-2017.state.gov/documents/organization/10964.pdf	Not checked against source; verify accuracy before use	2002-03	2019-07-16	1839011d3b265a6bfc716a6f87dcb05e
d13c571d-5c7b-43c9-a9cf-e72282c7cd1b	03221d24-92ea-4ccc-a6a2-bd88dbfcd9fb	2001_2002_Africa_fmtrpt.tsv	Tanzania	TZA	DoS Africa Region, Tanzania, International Military Education and Training (IMET), FY01	INFANTRY CAPTS CAREER CRS		12 Infantry Battalion Army	1/16/01	2001-01-16	5/22/01	2001-05-22	FT BENNING GA 31905-5468	1	3679	https://2009-2017.state.gov/documents/organization/10964.pdf	Not checked against source; verify accuracy before use	2002-03	2019-07-16	0252d60b17024a14552dcf7a1c443c8f
1e7a64b8-c153-48e5-8558-1209a41f3f92	03221d24-92ea-4ccc-a6a2-bd88dbfcd9fb	2001_2002_Africa_fmtrpt.tsv	Tanzania	TZA	DoS Africa Region, Tanzania, International Military Education and Training (IMET), FY01	INTERNATIONAL OFF LOG PREP		School of Logistics Army	7/30/01	2001-07-30	8/10/01	2001-08-10	FT LEE VA 23801-1705	1	1005	https://2009-2017.state.gov/documents/organization/10964.pdf	Not checked against source; verify accuracy before use	2002-03	2019-07-16	2f2600d115accf19c68a6fcc40bbc422
44175bfd-30eb-4c7b-a4c2-8a41709a6a02	03221d24-92ea-4ccc-a6a2-bd88dbfcd9fb	2001_2002_Africa_fmtrpt.tsv	Tanzania	TZA	DoS Africa Region, Tanzania, International Military Education and Training (IMET), FY01	JOINT TRANSITION COURSE		Defense Forces Headquarters	7/2/01	2001-07-02	7/6/01	2001-07-06	NORFOLK, VA 23511-1702	1	456	https://2009-2017.state.gov/documents/organization/10964.pdf	Not checked against source; verify accuracy before use	2002-03	2019-07-16	6957d8b7db893dae2d8311a42191e879
4061fd45-4a48-4a8b-aba2-026c038a39af	03221d24-92ea-4ccc-a6a2-bd88dbfcd9fb	2001_2002_Africa_fmtrpt.tsv	Tanzania	TZA	DoS Africa Region, Tanzania, International Military Education and Training (IMET), FY01	JT/COMB STAFF OFFICER SCHL		Defense Forces Headquarters	7/9/01	2001-07-09	9/28/01	2001-09-28	NORFOLK, VA 23511-1702	1	4965	https://2009-2017.state.gov/documents/organization/10964.pdf	Not checked against source; verify accuracy before use	2002-03	2019-07-16	9ee1051dc8cd4724e1c26302804c55f0
13aa1b80-a504-4ea8-a99d-d7ab5372bbd8	03221d24-92ea-4ccc-a6a2-bd88dbfcd9fb	2001_2002_Africa_fmtrpt.tsv	Tanzania	TZA	DoS Africa Region, Tanzania, International Military Education and Training (IMET), FY01	MEDICAL STRATEGIC LDR CRS		General Military Hospital All Services	6/4/01	2001-06-04	7/6/01	2001-07-06	FT SAM HOUSTON TX 78234-6100	1	179	https://2009-2017.state.gov/documents/organization/10964.pdf	Not checked against source; verify accuracy before use	2002-03	2019-07-16	9ea99c64b0f06cf2ebab2fe5d86e5d04
a53e02d1-dc0b-4e1a-a7a2-cbfd24e8673e	03221d24-92ea-4ccc-a6a2-bd88dbfcd9fb	2001_2002_Africa_fmtrpt.tsv	Tanzania	TZA	DoS Africa Region, Tanzania, International Military Education and Training (IMET), FY01	NAVAL STAFF COLLEGE		Defense Forces Headquarters	1/11/01	2001-01-11	6/15/01	2001-06-15	NEWPORT, RI 02841-1207	1	11862	https://2009-2017.state.gov/documents/organization/10964.pdf	Not checked against source; verify accuracy before use	2002-03	2019-07-16	4624ed4adda52d120edd579c3afb1532
4edbb397-43e4-49a2-a4ba-93f20b660bba	03221d24-92ea-4ccc-a6a2-bd88dbfcd9fb	2001_2002_Africa_fmtrpt.tsv	Tanzania	TZA	DoS Africa Region, Tanzania, International Military Education and Training (IMET), FY01	SIG OFF ADV PREP-INTER OFF		School of Communications Army	1/3/01	2001-01-03	1/19/01	2001-01-19	FT GORDON GA 30905-5154	1	1644	https://2009-2017.state.gov/documents/organization/10964.pdf	Not checked against source; verify accuracy before use	2002-03	2019-07-16	b8960401688fcb34641277c520f75e3d
0697b505-f763-4fca-8ed6-a52a04d2d8f7	03221d24-92ea-4ccc-a6a2-bd88dbfcd9fb	2001_2002_Africa_fmtrpt.tsv	Tanzania	TZA	DoS Africa Region, Tanzania, International Military Education and Training (IMET), FY01	SIGNAL CAPTAINS CAREER CRS		School of Communications Army	1/22/01	2001-01-22	5/24/01	2001-05-24	FT GORDON GA 30905-5154	1	4338	https://2009-2017.state.gov/documents/organization/10964.pdf	Not checked against source; verify accuracy before use	2002-03	2019-07-16	e575109c5787002bc8b97cac27f72a77
4b937f9c-3265-4766-9fde-e5768cbd9d6a	03221d24-92ea-4ccc-a6a2-bd88dbfcd9fb	2001_2002_Africa_fmtrpt.tsv	Tanzania	TZA	DoS Africa Region, Tanzania, International Military Education and Training (IMET), FY01	SIGNAL OFFICER BASIC		School of Communications Army	4/19/01	2001-04-19	8/24/01	2001-08-24	FT GORDON GA 30905-5154	1	3188	https://2009-2017.state.gov/documents/organization/10964.pdf	Not checked against source; verify accuracy before use	2002-03	2019-07-16	158a807473840bce47bad84afa197e9d
c57025c3-b601-4206-b106-56c72f574d92	03221d24-92ea-4ccc-a6a2-bd88dbfcd9fb	2001_2002_Africa_fmtrpt.tsv	Tanzania	TZA	DoS Africa Region, Tanzania, International Military Education and Training (IMET), FY01	SPECIALIZED ENG LANG TNG		School of Logistics Army	5/21/01	2001-05-21	7/20/01	2001-07-20	SAN ANTONIO TX 78236-5259	1	2270	https://2009-2017.state.gov/documents/organization/10964.pdf	Not checked against source; verify accuracy before use	2002-03	2019-07-16	70192aad83d6fae852a35df29f0615de
3bb3da4a-480b-42c4-9816-ff24df450b32	03221d24-92ea-4ccc-a6a2-bd88dbfcd9fb	2001_2002_Africa_fmtrpt.tsv	Tanzania	TZA	DoS Africa Region, Tanzania, Africa Center for Strategic Studies, FY01	Senior Leader Seminar		MOD DOD NGO	1/29/01	2001-01-29	2/9/01	2001-02-09	Libreville Gabon	3	8329	https://2009-2017.state.gov/documents/organization/10964.pdf	Not checked against source; verify accuracy before use	2002-03	2019-07-16	87379face417ae5906c01234f3c4e921
4d40b787-5efb-4615-86d3-1966af4b34aa	03221d24-92ea-4ccc-a6a2-bd88dbfcd9fb	2001_2002_Africa_fmtrpt.tsv	Togo	TGO	DoS Africa Region, Togo, International Military Education and Training (IMET), FY01	DRMI SEMINAR - OVERSEAS		Chief of Operations, Etat Major	6/4/01	2001-06-04	6/15/01	2001-06-15	Togo	1	2378	https://2009-2017.state.gov/documents/organization/10964.pdf	Not checked against source; verify accuracy before use	2002-03	2019-07-16	b22cfa3b91f159f8d80451daab6fdbe7
982e2178-929e-4b69-990c-0fc9af0c5558	03221d24-92ea-4ccc-a6a2-bd88dbfcd9fb	2001_2002_Africa_fmtrpt.tsv	Togo	TGO	DoS Africa Region, Togo, International Military Education and Training (IMET), FY01	DRMI SEMINAR - OVERSEAS		Commander, 3rd Inter-Army Regiment	6/4/01	2001-06-04	6/15/01	2001-06-15	Togo	1	2378	https://2009-2017.state.gov/documents/organization/10964.pdf	Not checked against source; verify accuracy before use	2002-03	2019-07-16	c30c38e78c100f6a78624659f8b7ceef
9e6a850f-8bd6-4548-8ecb-77ab013d483c	03221d24-92ea-4ccc-a6a2-bd88dbfcd9fb	2001_2002_Africa_fmtrpt.tsv	Togo	TGO	DoS Africa Region, Togo, International Military Education and Training (IMET), FY01	DRMI SEMINAR - OVERSEAS		Air Force Chief of Staff	6/4/01	2001-06-04	6/15/01	2001-06-15	Togo	1	2378	https://2009-2017.state.gov/documents/organization/10964.pdf	Not checked against source; verify accuracy before use	2002-03	2019-07-16	b5e6f1b05c161218666a568fde67c47b
d2f321fc-9bcd-4152-9d77-c44c523688c7	03221d24-92ea-4ccc-a6a2-bd88dbfcd9fb	2001_2002_Africa_fmtrpt.tsv	Togo	TGO	DoS Africa Region, Togo, International Military Education and Training (IMET), FY01	MET REGIONAL DIILS		Ministry of Foreign Affairs	7/23/01	2001-07-23	7/27/01	2001-07-27	Togo	1	799	https://2009-2017.state.gov/documents/organization/10964.pdf	Not checked against source; verify accuracy before use	2002-03	2019-07-16	56028ff5db3281c0386dbdb70f7c5a31
73f64ac1-5439-48b1-876e-647a8ef4808a	03221d24-92ea-4ccc-a6a2-bd88dbfcd9fb	2001_2002_Africa_fmtrpt.tsv	Togo	TGO	DoS Africa Region, Togo, International Military Education and Training (IMET), FY01	MET REGIONAL DIILS		President of Togolese Human Rights League	7/23/01	2001-07-23	7/27/01	2001-07-27	Togo	1	799	https://2009-2017.state.gov/documents/organization/10964.pdf	Not checked against source; verify accuracy before use	2002-03	2019-07-16	293e032e67a7e080d11215017b1056aa
b732266c-15d1-4002-bf4a-959ba7a20e4f	03221d24-92ea-4ccc-a6a2-bd88dbfcd9fb	2001_2002_Africa_fmtrpt.tsv	Togo	TGO	DoS Africa Region, Togo, International Military Education and Training (IMET), FY01	MET REGIONAL DIILS		President of the Court of Appeals of Kara	7/23/01	2001-07-23	7/27/01	2001-07-27	Togo	1	799	https://2009-2017.state.gov/documents/organization/10964.pdf	Not checked against source; verify accuracy before use	2002-03	2019-07-16	7a3f511313d518bb49c2b289d3a1d907
99e97e51-e973-48b0-b08d-093d54a8d297	03221d24-92ea-4ccc-a6a2-bd88dbfcd9fb	2001_2002_Africa_fmtrpt.tsv	Togo	TGO	DoS Africa Region, Togo, International Military Education and Training (IMET), FY01	MET REGIONAL DIILS		Lawyer	7/23/01	2001-07-23	7/27/01	2001-07-27	Togo	1	799	https://2009-2017.state.gov/documents/organization/10964.pdf	Not checked against source; verify accuracy before use	2002-03	2019-07-16	5be9220290c185460de865510c21f8fb
c32d50b8-cc20-419f-80b8-a1c618de77c6	03221d24-92ea-4ccc-a6a2-bd88dbfcd9fb	2001_2002_Africa_fmtrpt.tsv	Togo	TGO	Africa Region, Togo, International Military Education and Training (IMET), FY01	MET REGIONAL DIILS		Army, Chief of Operations	7/23/01	2001-07-23	7/27/01	2001-07-27	Togo	1	799	https://2009-2017.state.gov/documents/organization/10964.pdf	Not checked against source; verify accuracy before use	2002-03	2019-07-16	e5d69d5a8ac0cca3c3e7da051a0cfdbc
ef6921bd-b037-4a21-babb-581a11bb2c8e	03221d24-92ea-4ccc-a6a2-bd88dbfcd9fb	2001_2002_Africa_fmtrpt.tsv	Togo	TGO	Africa Region, Togo, International Military Education and Training (IMET), FY01	TAT-LANGUAGE LAB INSTALL		Lab Installation - Army	5/22/01	2001-05-22	9/30/01	2001-09-30	Togo	0	5000	https://2009-2017.state.gov/documents/organization/10964.pdf	Not checked against source; verify accuracy before use	2002-03	2019-07-16	b019659a507d0ed94df7d7182602f829
8b8fbee1-aede-42e2-88e1-547f3cff5cb7	03221d24-92ea-4ccc-a6a2-bd88dbfcd9fb	2001_2002_Africa_fmtrpt.tsv	Togo	TGO	DoS Africa Region, Togo, Africa Center for Strategic Studies, FY01	Senior Leader Seminar		MOD Ministry of Foreign Affairs	1/29/01	2001-01-29	2/9/01	2001-02-09	Libreville Gabon	2	8002	https://2009-2017.state.gov/documents/organization/10964.pdf	Not checked against source; verify accuracy before use	2002-03	2019-07-16	8feffd4616f11c52f524c3fc212d0a06
6d8f62a9-bc7f-45c7-98a7-4c846aaacd30	03221d24-92ea-4ccc-a6a2-bd88dbfcd9fb	2001_2002_Africa_fmtrpt.tsv	Togo	TGO	DoS Africa Region, Togo, Africa Center for Strategic Studies, FY01	Sub-Regional Seminar		MOD MFA	8/20/01	2001-08-20	8/24/01	2001-08-24	Accra Ghana	7	5072	https://2009-2017.state.gov/documents/organization/10964.pdf	Not checked against source; verify accuracy before use	2002-03	2019-07-16	5d126338cbc38d4c82c9c0227c5ccaf5
d38545ef-482b-42cc-b75f-7d422e49eed6	03221d24-92ea-4ccc-a6a2-bd88dbfcd9fb	2001_2002_Africa_fmtrpt.tsv	Uganda	UGA	DoS Africa Region, Uganda, Africa Center for Strategic Studies, FY01	Senior Leader Seminar		MOD	1/29/01	2001-01-29	2/9/01	2001-02-09	Libreville Gabon	3	9282	https://2009-2017.state.gov/documents/organization/10964.pdf	Not checked against source; verify accuracy before use	2002-03	2019-07-16	f88bd3c10d9ff3cd8381ab9b402de35e
c5f817e1-b486-47c7-9b96-3823050683e5	03221d24-92ea-4ccc-a6a2-bd88dbfcd9fb	2001_2002_Africa_fmtrpt.tsv	Zambia	ZMB	DoS Africa Region, Zambia, Non-Security Assistance, Unified Command (Note 4), FY01	JCET	3/3 SFG	FIRST COMMANDO BATTALION IN NDOLA	2/15/01	2001-02-15	3/31/01	2001-03-31	LUSAKA	120	82000	https://2009-2017.state.gov/documents/organization/10964.pdf	Not checked against source; verify accuracy before use	2002-03	2019-07-16	252028297166d7a092716e38e1c16d43
1c23b5a3-c96f-4a1b-b4a6-fc6468419675	03221d24-92ea-4ccc-a6a2-bd88dbfcd9fb	2001_2002_Africa_fmtrpt.tsv	Zambia	ZMB	DoS Africa Region, Zambia, International Military Education and Training (IMET), FY01	ARMOR CPT CAREER CRS PREP		4TH BN ZR	7/16/01	2001-07-16	8/3/01	2001-08-03	FT KNOX KY 40121-5234	1	7302	https://2009-2017.state.gov/documents/organization/10964.pdf	Not checked against source; verify accuracy before use	2002-03	2019-07-16	3fdc0bc57d16477921a89dd8d5f8c0a5
94ca405a-5988-4a72-8f15-0b7f911739c3	03221d24-92ea-4ccc-a6a2-bd88dbfcd9fb	2001_2002_Africa_fmtrpt.tsv	Zambia	ZMB	DoS Africa Region, Zambia, International Military Education and Training (IMET), FY01	CHAPLAIN OFFICER BASIC		4TH BN ZR	2/5/01	2001-02-05	4/6/01	2001-04-06	FT JACKSON SC 29207-7040	1	10608	https://2009-2017.state.gov/documents/organization/10964.pdf	Not checked against source; verify accuracy before use	2002-03	2019-07-16	6e35751f5799e07fe4426c1be6bcd0d5
c4e18bce-8ced-4246-bd11-795299d98fa7	03221d24-92ea-4ccc-a6a2-bd88dbfcd9fb	2001_2002_Africa_fmtrpt.tsv	Zambia	ZMB	DoS Africa Region, Zambia, International Military Education and Training (IMET), FY01	CIV-MIL SID - AFRICA		SIG SQN	10/16/00	2000-10-16	10/27/00	2000-10-27	HURLBURT FIELD, FL 32544-5826	1	6550	https://2009-2017.state.gov/documents/organization/10964.pdf	Not checked against source; verify accuracy before use	2002-03	2019-07-16	dd40c286ae3b3151c84fa9eb1e1c2b3e
ca2a41fd-19fa-4211-a94f-7fad6e8df8cb	03221d24-92ea-4ccc-a6a2-bd88dbfcd9fb	2001_2002_Africa_fmtrpt.tsv	Zambia	ZMB	DoS Africa Region, Zambia, International Military Education and Training (IMET), FY01	CIV-MIL SID - AFRICA		SIG SQN	10/16/00	2000-10-16	10/27/00	2000-10-27	HURLBURT FIELD, FL 32544-5826	1	6550	https://2009-2017.state.gov/documents/organization/10964.pdf	Not checked against source; verify accuracy before use	2002-03	2019-07-16	dd40c286ae3b3151c84fa9eb1e1c2b3e
79fd51a9-fc39-4c9b-8b36-376d07b7d5f1	03221d24-92ea-4ccc-a6a2-bd88dbfcd9fb	2001_2002_Africa_fmtrpt.tsv	Zambia	ZMB	DoS Africa Region, Zambia, International Military Education and Training (IMET), FY01	COMB LOG OFF		3 BN ORD COY	5/4/01	2001-05-04	6/8/01	2001-06-08	APG MD 21005-5299	1	4327	https://2009-2017.state.gov/documents/organization/10964.pdf	Not checked against source; verify accuracy before use	2002-03	2019-07-16	1b3b3c680fd53050c01bac0b4fa00bbe
741fdaa7-bd47-4474-a9ee-34b2c1fd2cbd	03221d24-92ea-4ccc-a6a2-bd88dbfcd9fb	2001_2002_Africa_fmtrpt.tsv	Zambia	ZMB	DoS Africa Region, Zambia, International Military Education and Training (IMET), FY01	COMBINED LOG CPT CAREER		3 BN ORD COY	6/11/01	2001-06-11	7/26/01	2001-07-26	FT LEE VA 23801-1705	1	4126	https://2009-2017.state.gov/documents/organization/10964.pdf	Not checked against source; verify accuracy before use	2002-03	2019-07-16	73964c99bec80ddf1793338491d9a36a
686a5df1-e560-46ef-8f64-d32c0fe6e7e0	03221d24-92ea-4ccc-a6a2-bd88dbfcd9fb	2001_2002_Africa_fmtrpt.tsv	Zambia	ZMB	DoS Africa Region, Zambia, International Military Education and Training (IMET), FY01	INFANTRY MORTAR LEADER		1 BN SIZ SQ	4/23/01	2001-04-23	6/1/01	2001-06-01	FT BENNING GA 31905-5468	1	5603	https://2009-2017.state.gov/documents/organization/10964.pdf	Not checked against source; verify accuracy before use	2002-03	2019-07-16	f333bbd1f2aade6bde0e29843954d7d0
fd761ccb-b15d-46c9-8568-74d2b219d7e1	03221d24-92ea-4ccc-a6a2-bd88dbfcd9fb	2001_2002_Africa_fmtrpt.tsv	Zambia	ZMB	DoS Africa Region, Zambia, International Military Education and Training (IMET), FY01	INFANTRY OFFICER BASIC		1 BN SIG SQ	12/4/00	2000-12-04	4/12/01	2001-04-12	FT BENNING GA 31905-5468	1	14122	https://2009-2017.state.gov/documents/organization/10964.pdf	Not checked against source; verify accuracy before use	2002-03	2019-07-16	efd43880c10704d100cd351ff44e0645
6cc60909-c62d-4010-8adf-89049263e0da	03221d24-92ea-4ccc-a6a2-bd88dbfcd9fb	2001_2002_Africa_fmtrpt.tsv	Zambia	ZMB	DoS Africa Region, Zambia, International Military Education and Training (IMET), FY01	INTERNATIONAL OFF LOG PREP		3 BN ORD COY	3/5/01	2001-03-05	3/16/01	2001-03-16	FT LEE VA 23801-1705	1	5915	https://2009-2017.state.gov/documents/organization/10964.pdf	Not checked against source; verify accuracy before use	2002-03	2019-07-16	6f6979fd1b33b6ff57b964d51e357248
42f69fae-b19c-4180-baab-c5c778867e3c	03221d24-92ea-4ccc-a6a2-bd88dbfcd9fb	2001_2002_Africa_fmtrpt.tsv	Zambia	ZMB	DoS Africa Region, Zambia, International Military Education and Training (IMET), FY01	INTL OFF SCH & SOS		Air Force	4/9/01	2001-04-09	6/29/01	2001-06-29	MAXWELL AFB, AL 36112-6323	1	12281	https://2009-2017.state.gov/documents/organization/10964.pdf	Not checked against source; verify accuracy before use	2002-03	2019-07-16	0696d296823474da0a2500f8b8fa8698
c6b7772e-8fa1-4daa-95d8-6b6e37d7fc61	03221d24-92ea-4ccc-a6a2-bd88dbfcd9fb	2001_2002_Africa_fmtrpt.tsv	Zambia	ZMB	DoS Africa Region, Zambia, International Military Education and Training (IMET), FY01	INTL OFF SCH (FOR AC&SC)		Air Force	6/18/01	2001-06-18	7/27/01	2001-07-27	MAXWELL AFB, AL 36112-6323	1	10989	https://2009-2017.state.gov/documents/organization/10964.pdf	Not checked against source; verify accuracy before use	2002-03	2019-07-16	ec394349856ab3598456884ab6fe2e5d
edb018f5-6cf7-4d35-abc2-1dc1896fb888	03221d24-92ea-4ccc-a6a2-bd88dbfcd9fb	2001_2002_Africa_fmtrpt.tsv	Zambia	ZMB	DoS Africa Region, Zambia, International Military Education and Training (IMET), FY01	MET REGIONAL CIV-MIL RELS		MOD (MET Regional)	6/25/01	2001-06-25	6/29/01	2001-06-29	Zambia	1	998	https://2009-2017.state.gov/documents/organization/10964.pdf	Not checked against source; verify accuracy before use	2002-03	2019-07-16	7e86807c083c26c55c8cc7c118253f56
bc42142f-3e44-40da-8aa6-efa46974eed9	03221d24-92ea-4ccc-a6a2-bd88dbfcd9fb	2001_2002_Africa_fmtrpt.tsv	Zambia	ZMB	DoS Africa Region, Zambia, International Military Education and Training (IMET), FY01	MET REGIONAL CIV-MIL RELS		MOD (MET Regional)	6/25/01	2001-06-25	6/29/01	2001-06-29	Zambia	1	998	https://2009-2017.state.gov/documents/organization/10964.pdf	Not checked against source; verify accuracy before use	2002-03	2019-07-16	7e86807c083c26c55c8cc7c118253f56
24b6eba5-9155-43d6-a75f-b1c7773e5328	03221d24-92ea-4ccc-a6a2-bd88dbfcd9fb	2001_2002_Africa_fmtrpt.tsv	Zambia	ZMB	DoS Africa Region, Zambia, International Military Education and Training (IMET), FY01	MET REGIONAL CIV-MIL RELS		MOD (MET Regional)	6/25/01	2001-06-25	6/29/01	2001-06-29	Zambia	1	998	https://2009-2017.state.gov/documents/organization/10964.pdf	Not checked against source; verify accuracy before use	2002-03	2019-07-16	7e86807c083c26c55c8cc7c118253f56
c867568e-916a-458b-b4be-6bc42f35bd83	03221d24-92ea-4ccc-a6a2-bd88dbfcd9fb	2001_2002_Africa_fmtrpt.tsv	Zambia	ZMB	DoS Africa Region, Zambia, International Military Education and Training (IMET), FY01	MET REGIONAL CIV-MIL RELS		MOD (MET Regional)	6/25/01	2001-06-25	6/29/01	2001-06-29	Zambia	1	998	https://2009-2017.state.gov/documents/organization/10964.pdf	Not checked against source; verify accuracy before use	2002-03	2019-07-16	7e86807c083c26c55c8cc7c118253f56
cbaebd97-c601-4f05-a810-bd14700d3449	03221d24-92ea-4ccc-a6a2-bd88dbfcd9fb	2001_2002_Africa_fmtrpt.tsv	Zambia	ZMB	DoS Africa Region, Zambia, Africa Center for Strategic Studies, FY01	Senior Leader Seminar		MOD	1/29/01	2001-01-29	2/9/01	2001-02-09	Libreville Gabon	2	8471	https://2009-2017.state.gov/documents/organization/10964.pdf	Not checked against source; verify accuracy before use	2002-03	2019-07-16	712bc3e9039e2926e29dadff54f62d49
02df69fa-69a0-4bbf-96d2-5971437402bb	03221d24-92ea-4ccc-a6a2-bd88dbfcd9fb	2001_2002_Africa_fmtrpt.tsv	Australia	AUS	DoS East Asia and Pacific Region, Australia, Non-Security Assistance, Unified Command (Note 4), FY01	JCET	NSWU-1, 353 SOG	1ST COMMANDO REG, 1ST COMMANDO CO, 1ST COMMANDO REG, 2ND COMMANDO CO (40 PAX)	3/3/01	2001-03-03	3/31/01	2001-03-31	SYDNEY	40	133000	https://2009-2017.state.gov/documents/organization/10964.pdf	Not checked against source; verify accuracy before use	2002-03	2019-07-16	81e271022730acf99ef475280ccceb9e
658acd88-80d8-48e2-8b2a-a19d6e0fcab3	03221d24-92ea-4ccc-a6a2-bd88dbfcd9fb	2001_2002_Africa_fmtrpt.tsv	Australia	AUS	DoS East Asia and Pacific Region, Australia, Non-Security Assistance, Unified Command (Note 4), FY01	JCET		AUSTRLIAN SPECIAL AIR SERVICE 353 SOG, 320 STS, 22 STS REGIMENT (70 PAX), RAAF: 36 SQUADRON (20 PAX), 75 SQUADRON (15 PAX)	3/18/01	2001-03-18	4/11/01	2001-04-11	EXMOUTH, RAF LEARMONTH	105	180000	https://2009-2017.state.gov/documents/organization/10964.pdf	Not checked against source; verify accuracy before use	2002-03	2019-07-16	df4e66f09d730d4d6f266a71713170f2
7ce5c83b-e196-47f8-b013-0950e877c5b0	03221d24-92ea-4ccc-a6a2-bd88dbfcd9fb	2001_2002_Africa_fmtrpt.tsv	Australia	AUS	DoS East Asia and Pacific Region, Australia, PME Exchanges, FY01	INTERNATIONAL OFFICER PREP		HTC SYDNEY	6/19/01	2001-06-19	7/6/01	2001-07-06	FT LEAVENWORTH KS 66027-1352	1	0	https://2009-2017.state.gov/documents/organization/10964.pdf	Not checked against source; verify accuracy before use	2002-03	2019-07-16	1c7e1d5780b794554d17b3b412bccef7
c334b85d-8485-48fc-87a0-b7b007171b50	03221d24-92ea-4ccc-a6a2-bd88dbfcd9fb	2001_2002_Africa_fmtrpt.tsv	Australia	AUS	DoS East Asia and Pacific Region, Australia, PME Exchanges, FY01	INTERNATIONAL OFFICER PREP		HTC SYDNEY	6/19/01	2001-06-19	7/6/01	2001-07-06	FT LEAVENWORTH KS 66027-1352	1	0	https://2009-2017.state.gov/documents/organization/10964.pdf	Not checked against source; verify accuracy before use	2002-03	2019-07-16	1c7e1d5780b794554d17b3b412bccef7
a20b1f7e-7f48-4162-885c-041d65ef64e8	03221d24-92ea-4ccc-a6a2-bd88dbfcd9fb	2001_2002_Africa_fmtrpt.tsv	Australia	AUS	DoS East Asia and Pacific Region, Australia, PME Exchanges, FY01	U.S. ARMY SGT MAJOR PREP		HTC SYDNEY	7/23/01	2001-07-23	8/10/01	2001-08-10	FT BLISS TX 79918-8002	1	0	https://2009-2017.state.gov/documents/organization/10964.pdf	Not checked against source; verify accuracy before use	2002-03	2019-07-16	770aa5ee66ce1992a742925a72b06887
3e784759-e6fb-45da-a118-11d8e2106910	03221d24-92ea-4ccc-a6a2-bd88dbfcd9fb	2001_2002_Africa_fmtrpt.tsv	Australia	AUS	DoS East Asia and Pacific Region, Australia, PME Exchanges, FY01	USA C&GSC OFF PREPARATORY		HTC SYDNEY	7/9/01	2001-07-09	7/20/01	2001-07-20	FT LEAVENWORTH KS 66027-1352	1	0	https://2009-2017.state.gov/documents/organization/10964.pdf	Not checked against source; verify accuracy before use	2002-03	2019-07-16	48d6500bccd2edb20986003d38f72f4b
0313c67f-3038-4917-8a05-fa3beba0464c	03221d24-92ea-4ccc-a6a2-bd88dbfcd9fb	2001_2002_Africa_fmtrpt.tsv	Australia	AUS	DoS East Asia and Pacific Region, Australia, PME Exchanges, FY01	USA C&GSC OFF PREPARATORY		HTC SYDNEY	7/9/01	2001-07-09	7/20/01	2001-07-20	FT LEAVENWORTH KS 66027-1352	1	0	https://2009-2017.state.gov/documents/organization/10964.pdf	Not checked against source; verify accuracy before use	2002-03	2019-07-16	48d6500bccd2edb20986003d38f72f4b
c51d8438-69f0-49e7-8243-b74e2825b965	03221d24-92ea-4ccc-a6a2-bd88dbfcd9fb	2001_2002_Africa_fmtrpt.tsv	Australia	AUS	DoS East Asia and Pacific Region, Australia, Asia-Pacific Center, FY01	Executive Course 01-1	U.S. military staff and faculty	Defence and Intel Policy Section; Department of Defence	1/22/01	2001-01-22	4/12/01	2001-04-12	Asia-Pacific Center for Security Studies Honolulu, Hawaii	2	1884	https://2009-2017.state.gov/documents/organization/10964.pdf	Not checked against source; verify accuracy before use	2002-03	2019-07-16	8db7cbd8f9bf32a9e0b1a77a3fb574aa
31b0c343-44d0-437c-aef7-4368d49b1731	03221d24-92ea-4ccc-a6a2-bd88dbfcd9fb	2001_2002_Africa_fmtrpt.tsv	Australia	AUS	DoS East Asia and Pacific Region, Australia, Asia-Pacific Center, FY01	Executive Course 01-2	U.S. military staff and faculty	Australian Defence Headquarters	5/21/01	2001-05-21	8/9/01	2001-08-09	Asia-Pacific Center for Security Studies Honolulu, Hawaii	1	942	https://2009-2017.state.gov/documents/organization/10964.pdf	Not checked against source; verify accuracy before use	2002-03	2019-07-16	71e3365c018423abf04c2a2faf2fa4a4
8a79a27f-9eb0-47a0-a780-7247f43d2b1c	03221d24-92ea-4ccc-a6a2-bd88dbfcd9fb	2001_2002_Africa_fmtrpt.tsv	Brunei	BRN	DoS East Asia and Pacific Region, Brunei, Asia-Pacific Center, FY01	Executive Course 00-3	U.S. military staff and faculty	Ministry of Defense	10/2/00	2000-10-02	12/15/00	2000-12-15	Asia-Pacific Center for Security Studies Honolulu, Hawaii	1	942	https://2009-2017.state.gov/documents/organization/10964.pdf	Not checked against source; verify accuracy before use	2002-03	2019-07-16	dbe4b97b117606e2afb4375e546ef257
72e6b62c-8c23-4bb4-8b26-8d0c2976980c	03221d24-92ea-4ccc-a6a2-bd88dbfcd9fb	2001_2002_Africa_fmtrpt.tsv	Brunei	BRN	DoS East Asia and Pacific Region, Brunei, Asia-Pacific Center, FY01	Executive Course 01-1	U.S. military staff and faculty	Ministry of Defense; MOFA	1/22/01	2001-01-22	4/12/01	2001-04-12	Asia-Pacific Center for Security Studies Honolulu, Hawaii	2	1884	https://2009-2017.state.gov/documents/organization/10964.pdf	Not checked against source; verify accuracy before use	2002-03	2019-07-16	99b3c354eb6789fb6a84d73ca9b48cd3
033e9b46-cf31-4727-8568-812991fec84b	03221d24-92ea-4ccc-a6a2-bd88dbfcd9fb	2001_2002_East_Asia_and_Pacific_fmtrpt.tsv	Zambia	ZMB	DoS Africa Region, Zambia, Africa Center for Strategic Studies, FY01	Senior Leader Seminar		MOD	1/29/01	2001-01-29	2/9/01	2001-02-09	Libreville Gabon	2	8471	https://2009-2017.state.gov/documents/organization/10965.pdf	Not checked against source; verify accuracy before use	2002-03	2019-07-16	ccba2783e7e336e37550b181bb7b0392
b3f54668-1c80-4f03-b8bb-eaddd34c46df	03221d24-92ea-4ccc-a6a2-bd88dbfcd9fb	2001_2002_East_Asia_and_Pacific_fmtrpt.tsv	Australia	AUS	DoS East Asia and Pacific Region, Australia, Non-Security Assistance, Unified Command (Note 4), FY01	JCET	NSWU-1, 353 SOG	1ST COMMANDO REG, 1ST COMMANDO CO, 1ST COMMANDO REG, 2ND COMMANDO CO (40 PAX)	3/3/01	2001-03-03	3/31/01	2001-03-31	SYDNEY	40	133000	https://2009-2017.state.gov/documents/organization/10965.pdf	Not checked against source; verify accuracy before use	2002-03	2019-07-16	a588fc12669526263883bff39bca5974
a7cbbe05-74cd-442d-a116-460ac9a9026b	03221d24-92ea-4ccc-a6a2-bd88dbfcd9fb	2001_2002_East_Asia_and_Pacific_fmtrpt.tsv	Australia	AUS	DoS East Asia and Pacific Region, Australia, Non-Security Assistance, Unified Command (Note 4), FY01	JCET		AUSTRLIAN SPECIAL AIR SERVICE 353 SOG, 320 STS, 22 STS REGIMENT (70 PAX), RAAF: 36 SQUADRON (20 PAX), 75 SQUADRON (15 PAX)	3/18/01	2001-03-18	4/11/01	2001-04-11	EXMOUTH, RAF LEARMONTH	105	180000	https://2009-2017.state.gov/documents/organization/10965.pdf	Not checked against source; verify accuracy before use	2002-03	2019-07-16	d23c5e599038e59d71d8e802613fac64
a1b2f7ee-5333-4531-b27f-fcc49d0fc2d7	03221d24-92ea-4ccc-a6a2-bd88dbfcd9fb	2001_2002_East_Asia_and_Pacific_fmtrpt.tsv	Australia	AUS	DoS East Asia and Pacific Region, Australia, PME Exchanges, FY01	INTERNATIONAL OFFICER PREP		HTC SYDNEY	6/19/01	2001-06-19	7/6/01	2001-07-06	FT LEAVENWORTH KS 66027-1352	1	0	https://2009-2017.state.gov/documents/organization/10965.pdf	Not checked against source; verify accuracy before use	2002-03	2019-07-16	7bbaf4f40bc7af739f0a875fb67357f8
96f9e26a-7f69-4078-b014-67ea950ef75e	03221d24-92ea-4ccc-a6a2-bd88dbfcd9fb	2001_2002_East_Asia_and_Pacific_fmtrpt.tsv	Australia	AUS	DoS East Asia and Pacific Region, Australia, PME Exchanges, FY01	INTERNATIONAL OFFICER PREP		HTC SYDNEY	6/19/01	2001-06-19	7/6/01	2001-07-06	FT LEAVENWORTH KS 66027-1352	1	0	https://2009-2017.state.gov/documents/organization/10965.pdf	Not checked against source; verify accuracy before use	2002-03	2019-07-16	7bbaf4f40bc7af739f0a875fb67357f8
7a9776f8-a738-48a3-9285-5c22ad452c6e	03221d24-92ea-4ccc-a6a2-bd88dbfcd9fb	2001_2002_East_Asia_and_Pacific_fmtrpt.tsv	Australia	AUS	DoS East Asia and Pacific Region, Australia, PME Exchanges, FY01	U.S. ARMY SGT MAJOR PREP		HTC SYDNEY	7/23/01	2001-07-23	8/10/01	2001-08-10	FT BLISS TX 79918-8002	1	0	https://2009-2017.state.gov/documents/organization/10965.pdf	Not checked against source; verify accuracy before use	2002-03	2019-07-16	8e03c779e83ffcf7a2076ecd227d16f1
1bac7b5e-18a6-4aed-b62c-c80d21d637d4	03221d24-92ea-4ccc-a6a2-bd88dbfcd9fb	2001_2002_East_Asia_and_Pacific_fmtrpt.tsv	Australia	AUS	DoS East Asia and Pacific Region, Australia, PME Exchanges, FY01	USA C&GSC OFF PREPARATORY		HTC SYDNEY	7/9/01	2001-07-09	7/20/01	2001-07-20	FT LEAVENWORTH KS 66027-1352	1	0	https://2009-2017.state.gov/documents/organization/10965.pdf	Not checked against source; verify accuracy before use	2002-03	2019-07-16	978520fb72e59fa3bcd8ba70b9c7e1af
30a860f1-2f5b-46fe-9d3c-1519f6f27eda	03221d24-92ea-4ccc-a6a2-bd88dbfcd9fb	2001_2002_East_Asia_and_Pacific_fmtrpt.tsv	Australia	AUS	DoS East Asia and Pacific Region, Australia, PME Exchanges, FY01	USA C&GSC OFF PREPARATORY		HTC SYDNEY	7/9/01	2001-07-09	7/20/01	2001-07-20	FT LEAVENWORTH KS 66027-1352	1	0	https://2009-2017.state.gov/documents/organization/10965.pdf	Not checked against source; verify accuracy before use	2002-03	2019-07-16	978520fb72e59fa3bcd8ba70b9c7e1af
97624d83-4e38-4d4a-ae82-6a6e769f120a	03221d24-92ea-4ccc-a6a2-bd88dbfcd9fb	2001_2002_East_Asia_and_Pacific_fmtrpt.tsv	Australia	AUS	DoS East Asia and Pacific Region, Australia, Asia-Pacific Center, FY01	Executive Course 01-1	U.S. military staff and faculty	Defence and Intel Policy Section; Department of Defence	1/22/01	2001-01-22	4/12/01	2001-04-12	Asia-Pacific Center for Security Studies Honolulu, Hawaii	2	1884	https://2009-2017.state.gov/documents/organization/10965.pdf	Not checked against source; verify accuracy before use	2002-03	2019-07-16	81152abb7ea09cfd483ace91ba7e7dfd
da78f045-dcd1-4bfb-884c-deb1b0f7f305	03221d24-92ea-4ccc-a6a2-bd88dbfcd9fb	2001_2002_East_Asia_and_Pacific_fmtrpt.tsv	Australia	AUS	DoS East Asia and Pacific Region, Australia, Asia-Pacific Center, FY01	Executive Course 01-2	U.S. military staff and faculty	Australian Defence Headquarters	5/21/01	2001-05-21	8/9/01	2001-08-09	Asia-Pacific Center for Security Studies Honolulu, Hawaii	1	942	https://2009-2017.state.gov/documents/organization/10965.pdf	Not checked against source; verify accuracy before use	2002-03	2019-07-16	d66e4e20cebf0fe1d4cf14142adce37d
960ebaf4-29f7-4c7d-83ed-d0a78105066d	03221d24-92ea-4ccc-a6a2-bd88dbfcd9fb	2001_2002_East_Asia_and_Pacific_fmtrpt.tsv	Brunei	BRN	DoS East Asia and Pacific Region, Brunei, Asia-Pacific Center, FY01	Executive Course 00-3	U.S. military staff and faculty	Ministry of Defense	10/2/00	2000-10-02	12/15/00	2000-12-15	Asia-Pacific Center for Security Studies Honolulu, Hawaii	1	942	https://2009-2017.state.gov/documents/organization/10965.pdf	Not checked against source; verify accuracy before use	2002-03	2019-07-16	c211f8b984d8e64b4aa4cb65d07667ee
1560ccd6-fc55-410e-b1d6-74b99af97203	03221d24-92ea-4ccc-a6a2-bd88dbfcd9fb	2001_2002_East_Asia_and_Pacific_fmtrpt.tsv	Brunei	BRN	DoS East Asia and Pacific Region, Brunei, Asia-Pacific Center, FY01	Executive Course 01-1	U.S. military staff and faculty	Ministry of Defense; MOFA	1/22/01	2001-01-22	4/12/01	2001-04-12	Asia-Pacific Center for Security Studies Honolulu, Hawaii	2	1884	https://2009-2017.state.gov/documents/organization/10965.pdf	Not checked against source; verify accuracy before use	2002-03	2019-07-16	123c083ad626ae2a4bd79905b604f55a
d7bcb6d5-e7b6-4426-aed8-a426b5911407	03221d24-92ea-4ccc-a6a2-bd88dbfcd9fb	2001_2002_East_Asia_and_Pacific_fmtrpt.tsv	China (Peoples Republic of)	CHN	DoS East Asia and Pacific Region, China (Peoples Republic of), Asia-Pacific Center, FY01	Executive Course 00-3	U.S. military staff and faculty	Ministry of Natl Defense; Natl Defense Unv; Asian Dept; MOFA	10/2/00	2000-10-02	12/15/00	2000-12-15	Asia-Pacific Center for Security Studies Honolulu, Hawaii	4	45443	https://2009-2017.state.gov/documents/organization/10965.pdf	Not checked against source; verify accuracy before use	2002-03	2019-07-16	6c94b2166ba256feaa0a1ac299d6ee30
9b1c21ad-059a-4578-b52c-4b9828ef4967	03221d24-92ea-4ccc-a6a2-bd88dbfcd9fb	2001_2002_East_Asia_and_Pacific_fmtrpt.tsv	China (Peoples Republic of)	CHN	DoS East Asia and Pacific Region, China (Peoples Republic of), Asia-Pacific Center, FY01	Executive Course 01-1	U.S. military staff and faculty	MOFA; MOFA	1/22/01	2001-01-22	4/12/01	2001-04-12	Asia-Pacific Center for Security Studies Honolulu, Hawaii	2	28101	https://2009-2017.state.gov/documents/organization/10965.pdf	Not checked against source; verify accuracy before use	2002-03	2019-07-16	86c26dc95166e7a32783c5ee6ef79073
2bee1d83-ca87-4b53-9bcf-0ecf8db7855e	03221d24-92ea-4ccc-a6a2-bd88dbfcd9fb	2001_2002_East_Asia_and_Pacific_fmtrpt.tsv	Cook Islands	COK	DoS East Asia and Pacific Region, Cook Islands, Asia-Pacific Center, FY01	Executive Course 00-3	U.S. military staff and faculty	Police	10/2/00	2000-10-02	12/15/00	2000-12-15	Asia-Pacific Center for Security Studies Honolulu, Hawaii	1	11810	https://2009-2017.state.gov/documents/organization/10965.pdf	Not checked against source; verify accuracy before use	2002-03	2019-07-16	08f42389becf8db920cda93ce05abfd0
cd6776fe-d326-44c4-99cc-0026fef95ebf	03221d24-92ea-4ccc-a6a2-bd88dbfcd9fb	2001_2002_East_Asia_and_Pacific_fmtrpt.tsv	Cook Islands	COK	DoS East Asia and Pacific Region, Cook Islands, Asia-Pacific Center, FY01	Executive Course 01-2	U.S. military staff and faculty	Police	5/21/01	2001-05-21	8/9/01	2001-08-09	Asia-Pacific Center for Security Studies Honolulu, Hawaii	1	14060	https://2009-2017.state.gov/documents/organization/10965.pdf	Not checked against source; verify accuracy before use	2002-03	2019-07-16	e96b2ee9af9a572e68e3f49f06cfa7d0
bde55694-76a5-41fc-937f-2f869b6c841c	03221d24-92ea-4ccc-a6a2-bd88dbfcd9fb	2001_2002_East_Asia_and_Pacific_fmtrpt.tsv	Fiji	FJI	DoS East Asia and Pacific Region, Fiji, Asia-Pacific Center, FY01	Executive Course 00-3	U.S. military staff and faculty	Fiji Military Forces	10/2/00	2000-10-02	12/15/00	2000-12-15	Asia-Pacific Center for Security Studies Honolulu, Hawaii	1	11396	https://2009-2017.state.gov/documents/organization/10965.pdf	Not checked against source; verify accuracy before use	2002-03	2019-07-16	9f176de4e970bee1f8342e03864d5d3d
71bcd252-213a-4dd2-9f34-20d6c300030d	03221d24-92ea-4ccc-a6a2-bd88dbfcd9fb	2001_2002_East_Asia_and_Pacific_fmtrpt.tsv	Fiji	FJI	DoS East Asia and Pacific Region, Fiji, Asia-Pacific Center, FY01	Executive Course 01-1	U.S. military staff and faculty	Military Forces	1/22/01	2001-01-22	4/12/01	2001-04-12	Asia-Pacific Center for Security Studies Honolulu, Hawaii	1	13283	https://2009-2017.state.gov/documents/organization/10965.pdf	Not checked against source; verify accuracy before use	2002-03	2019-07-16	607b2cde1aa77649f3b3c7e9c951bf2d
56d5c996-0636-4a0a-bc10-33f5abd4c5f6	03221d24-92ea-4ccc-a6a2-bd88dbfcd9fb	2001_2002_East_Asia_and_Pacific_fmtrpt.tsv	Fiji	FJI	DoS East Asia and Pacific Region, Fiji, Asia-Pacific Center, FY01	Executive Course 01-2	U.S. military staff and faculty	Land Force Command	5/21/01	2001-05-21	8/9/01	2001-08-09	Asia-Pacific Center for Security Studies Honolulu, Hawaii	1	13158	https://2009-2017.state.gov/documents/organization/10965.pdf	Not checked against source; verify accuracy before use	2002-03	2019-07-16	53739063faa1acc0947ba3055d7a10b2
7164e844-0a6d-4e88-a8ac-f8a5c1d84ab4	03221d24-92ea-4ccc-a6a2-bd88dbfcd9fb	2001_2002_East_Asia_and_Pacific_fmtrpt.tsv	Japan	JPN	DoS East Asia and Pacific Region, Japan, Exchange Training, FY01	Foreign Academy Exchg. Pr.	USMA	Japanese Army	7/20/01	2001-07-20	8/3/01	2001-08-03	West Point	2		https://2009-2017.state.gov/documents/organization/10965.pdf	Not checked against source; verify accuracy before use	2002-03	2019-07-16	800f39fa8c5e86b4b23e85320560d502
67350e4d-8ad4-4143-9578-52bfdb154fd3	03221d24-92ea-4ccc-a6a2-bd88dbfcd9fb	2001_2002_East_Asia_and_Pacific_fmtrpt.tsv	Japan	JPN	DoS East Asia and Pacific Region, Japan, Exchange Training, FY01	JCET		JAPANESE GROUND SELF DEFENSE FORCE 1ST AIRBORNE BRIGADE			6/1/01	2001-06-01	USMC CAMP HANSEN, USMC CAMP FUJI, FUJI TRAIN AREA	50		https://2009-2017.state.gov/documents/organization/10965.pdf	Not checked against source; verify accuracy before use	2002-03	2019-07-16	651156bbca7b63c5aed840dbd6d61179
6f75e041-e270-473d-a50b-906803a68009	03221d24-92ea-4ccc-a6a2-bd88dbfcd9fb	2001_2002_East_Asia_and_Pacific_fmtrpt.tsv	Japan	JPN	DoS East Asia and Pacific Region, Japan, Exchange Training, FY01	JCET		JAPANESE SELF DEFENSE FORCE NSWG-1 SPECIAL BOARDING UNIT	6/20/01	2001-06-20	7/18/01	2001-07-18	ETAJIMA	32	59000	https://2009-2017.state.gov/documents/organization/10965.pdf	Not checked against source; verify accuracy before use	2002-03	2019-07-16	495d3549d7520fc15a39b665840872d8
0e677460-7d57-4d34-a26e-1056b3b7adea	03221d24-92ea-4ccc-a6a2-bd88dbfcd9fb	2001_2002_East_Asia_and_Pacific_fmtrpt.tsv	Japan	JPN	DoS East Asia and Pacific Region, Japan, Exchange Training, FY01	NATL STRIKE FORCE INDOC		JMSDF	9/10/01	2001-09-10	9/14/01	2001-09-14	ELIZABETH CITY, NC 27909	1	1073	https://2009-2017.state.gov/documents/organization/10965.pdf	Not checked against source; verify accuracy before use	2002-03	2019-07-16	5d2459f672e404ca0bae54b409ca9b7e
a82a0ccd-64ca-4898-835d-389005bf93b6	03221d24-92ea-4ccc-a6a2-bd88dbfcd9fb	2001_2002_East_Asia_and_Pacific_fmtrpt.tsv	Japan	JPN	East Asia and Pacific Region, Japan, Asia-Pacific Center, FY01	Executive Course 01-2	U.S. military staff and faculty	Japan Embassy; Maritime Self-Dfense Force	5/21/01	2001-05-21	8/9/01	2001-08-09	Asia-Pacific Center for Security Studies Honolulu, Hawaii	2	1884	https://2009-2017.state.gov/documents/organization/10965.pdf	Not checked against source; verify accuracy before use	2002-03	2019-07-16	986659032aabfe321471469f366e7d48
34f54976-be7e-4b3c-89f7-1477c0be6efb	03221d24-92ea-4ccc-a6a2-bd88dbfcd9fb	2001_2002_East_Asia_and_Pacific_fmtrpt.tsv	Kiribati	KIR	DoS East Asia and Pacific Region, Kiribati, Asia-Pacific Center, FY01	Executive Course 01-1	U.S. military staff and faculty	Police	1/22/01	2001-01-22	4/12/01	2001-04-12	Asia-Pacific Center for Security Studies Honolulu, Hawaii	1	13244	https://2009-2017.state.gov/documents/organization/10965.pdf	Not checked against source; verify accuracy before use	2002-03	2019-07-16	6e127dec4f396223b8ead41ae4040907
0362a436-81d6-4749-a400-0bcb321ec4e5	03221d24-92ea-4ccc-a6a2-bd88dbfcd9fb	2001_2002_East_Asia_and_Pacific_fmtrpt.tsv	Kiribati	KIR	DoS East Asia and Pacific Region, Kiribati, Asia-Pacific Center, FY01	Executive Course 01-2	U.S. military staff and faculty	Police	5/21/01	2001-05-21	8/9/01	2001-08-09	Asia-Pacific Center for Security Studies Honolulu, Hawaii	1	14437	https://2009-2017.state.gov/documents/organization/10965.pdf	Not checked against source; verify accuracy before use	2002-03	2019-07-16	40334e75df4f5e722ad2a1c32b745727
f718e986-c0de-4b26-81ff-8c3be9119afe	03221d24-92ea-4ccc-a6a2-bd88dbfcd9fb	2001_2002_East_Asia_and_Pacific_fmtrpt.tsv	Korea - South (Republic of)	KOR	DoS East Asia and Pacific Region, Korea - South (Republic of), Miscellaneous, DOS/DOD, Non-Security Assistance (Note 3), FY01	Comb Intel Training (CIT)	B/532d MI Bn, 527th MI Bn, B/3d MI Bn (10 officers, 5 NCOs max of 2 hours per day)	ROK officers and NCOs from around the Korean Penninsula that are scheduled for assignment to the 1998 ROK Intelligence unit that also mans the facility.	5/14/01	2001-05-14	5/19/01	2001-05-19	Camp Humphreys, ROK	20	1310	https://2009-2017.state.gov/documents/organization/10965.pdf	Not checked against source; verify accuracy before use	2002-03	2019-07-16	f5af5b6d1ec20a7d998a4001ed0a6345
b1261be8-6ce6-4a3c-be85-f7b2f5954ae8	03221d24-92ea-4ccc-a6a2-bd88dbfcd9fb	2001_2002_East_Asia_and_Pacific_fmtrpt.tsv	Korea - South (Republic of)	KOR	DoS East Asia and Pacific Region, Korea - South (Republic of), Miscellaneous, DOS/DOD, Non-Security Assistance (Note 3), FY01	DISE/GO Team Orientation	1 X 3 man CI/HUMINT Response Team (GO TEAM 1XCWO, 2 x NCO), 532s MI Bn DISE (15 soldiers; 1 x LT, 2 X CWO, 12 XNCO). ROK INTEL School provides billeting and food for all soldiers participating.	ROK Officers	5/30/01	2001-05-30	6/1/01	2001-06-01	ROK Intelligence School	100	9095	https://2009-2017.state.gov/documents/organization/10965.pdf	Not checked against source; verify accuracy before use	2002-03	2019-07-16	2fc0180cfe6e69338fb6ee36efe0519c
b292190d-f8d2-4061-b9a6-d09e87c9bac4	03221d24-92ea-4ccc-a6a2-bd88dbfcd9fb	2001_2002_East_Asia_and_Pacific_fmtrpt.tsv	Korea - South (Republic of)	KOR	DoS East Asia and Pacific Region, Korea - South (Republic of), Miscellaneous, DOS/DOD, Non-Security Assistance (Note 3), FY01	Foreign Academy Exchg. Pr.	USMA	Korean Army	7/20/01	2001-07-20	8/3/01	2001-08-03	West Point	2		https://2009-2017.state.gov/documents/organization/10965.pdf	Not checked against source; verify accuracy before use	2002-03	2019-07-16	dc07bd8de8aff289b580670be83e6387
ef96163c-8c18-4b83-b29e-28156024d3ed	03221d24-92ea-4ccc-a6a2-bd88dbfcd9fb	2001_2002_East_Asia_and_Pacific_fmtrpt.tsv	Korea - South (Republic of)	KOR	DoS East Asia and Pacific Region, Korea - South (Republic of), Miscellaneous, DOS/DOD, Non-Security Assistance (Note 3), FY01	JCET	1/1 SFG	707TH SPECIAL MISSION BATTALION	7/16/01	2001-07-16	8/17/01	2001-08-17	MAE SAN RI, CAMP CASEY	65	50000	https://2009-2017.state.gov/documents/organization/10965.pdf	Not checked against source; verify accuracy before use	2002-03	2019-07-16	98fc02dffbce24447b9bc6fed44658b6
1c1f9595-f3ea-46df-b807-065f159fa701	03221d24-92ea-4ccc-a6a2-bd88dbfcd9fb	2001_2002_East_Asia_and_Pacific_fmtrpt.tsv	Korea - South (Republic of)	KOR	DoS East Asia and Pacific Region, Korea - South (Republic of), Miscellaneous, DOS/DOD, Non-Security Assistance (Note 3), FY01	JCET	17 SOS, 31 SOS, 353 SOG, CSBR-1, ST-5	ROK NAVAL SPEICAL WARFARE BRIGADE, ST 3, FLOTILLA	10/9/00	2000-10-09	10/18/00	2000-10-18		0	84000	https://2009-2017.state.gov/documents/organization/10965.pdf	Not checked against source; verify accuracy before use	2002-03	2019-07-16	ae63d2143ba20fbf5227025543e0488b
ef35e85c-2ee0-4f9e-bbfd-599369aab143	03221d24-92ea-4ccc-a6a2-bd88dbfcd9fb	2001_2002_East_Asia_and_Pacific_fmtrpt.tsv	Korea - South (Republic of)	KOR	DoS East Asia and Pacific Region, Korea - South (Republic of), Miscellaneous, DOS/DOD, Non-Security Assistance (Note 3), FY01	JCET	160 SOAR, 353 SOG, 17 SOS, 1 SOS, 31 SOS	ROK AF: 255 SOS (4)ROK ARMY: 1ST ROK SF BRIGADE (5), 707 SPECIAL MISSION BN (5)	11/30/00	2000-11-30	12/15/00	2000-12-15	OSAN AB	14	65000	https://2009-2017.state.gov/documents/organization/10965.pdf	Not checked against source; verify accuracy before use	2002-03	2019-07-16	3f1f31f69b932af661ca5d98ba649720
83e3f3ea-8343-4296-95cf-09c82e348026	03221d24-92ea-4ccc-a6a2-bd88dbfcd9fb	2001_2002_East_Asia_and_Pacific_fmtrpt.tsv	Korea - South (Republic of)	KOR	DoS East Asia and Pacific Region, Korea - South (Republic of), Miscellaneous, DOS/DOD, Non-Security Assistance (Note 3), FY01	JCET	2/1 SFG	ROK ARMY: 1ST BRIGADE (13), 11TH BRIGADE (13), 13TH BRIGADE (13)	5/15/01	2001-05-15	6/15/01	2001-06-15	KIMPO, DAMYANG, JEUNGPYUNG	39	192000	https://2009-2017.state.gov/documents/organization/10965.pdf	Not checked against source; verify accuracy before use	2002-03	2019-07-16	a413ac0f30b2e34e1782aea560311840
148add39-c9f0-4a49-be01-77c97af64adb	03221d24-92ea-4ccc-a6a2-bd88dbfcd9fb	2001_2002_East_Asia_and_Pacific_fmtrpt.tsv	Korea - South (Republic of)	KOR	DoS East Asia and Pacific Region, Korea - South (Republic of), Miscellaneous, DOS/DOD, Non-Security Assistance (Note 3), FY01	JCET	353 SOG, 320 STS	1ST SPECIAL FORCES BRIGADE (52), 9TH SPECIAL FORCES BRIGADE (65), 255 SPECIAL OPERATIONS SQUADRON	6/4/01	2001-06-04	6/26/01	2001-06-26	K-2 AFB, TAEGU	117	135000	https://2009-2017.state.gov/documents/organization/10965.pdf	Not checked against source; verify accuracy before use	2002-03	2019-07-16	3df90dd8dd077ca3f56c06dc6eb0302d
0064a014-81a0-416b-9536-dd17d6077c81	03221d24-92ea-4ccc-a6a2-bd88dbfcd9fb	2001_2002_East_Asia_and_Pacific_fmtrpt.tsv	Korea - South (Republic of)	KOR	DoS East Asia and Pacific Region, Korea - South (Republic of), Miscellaneous, DOS/DOD, Non-Security Assistance (Note 3), FY01	JCET	1/19 SFG, 3/1 SFG, 353 SOG, 4 POG, 426 CA BN, 7 POG	BRIGADE (39), JCS J7 (10)MND PSYOP GROUP (5)	7/1/01	2001-07-01	7/27/01	2001-07-27	SUNGNAM,SEOUL,PILSUNG,MAESANRI ROK SPECIAL FORCES: 3RD SF	54	193000	https://2009-2017.state.gov/documents/organization/10965.pdf	Not checked against source; verify accuracy before use	2002-03	2019-07-16	8c07d7647803f3cfdf0d907cc81485c0
1f520a84-4100-4be0-9ca1-f8077b14608f	03221d24-92ea-4ccc-a6a2-bd88dbfcd9fb	2001_2002_East_Asia_and_Pacific_fmtrpt.tsv	Korea - South (Republic of)	KOR	DoS East Asia and Pacific Region, Korea - South (Republic of), Miscellaneous, DOS/DOD, Non-Security Assistance (Note 3), FY01	JCET	353 SOG, 426 CA BN, 5/19 SFG, 96 CA BN	7TH SPECIAL FORCES BRIGADE	6/5/01	2001-06-05	6/27/01	2001-06-27	KUMMA, OUNG JONG SAN, BUNYSAN, MAESANRI	52	147000	https://2009-2017.state.gov/documents/organization/10965.pdf	Not checked against source; verify accuracy before use	2002-03	2019-07-16	76f608be090aeaad042992fab49c0ec3
23b4a9b9-4f7e-4ac0-a6a9-17b900d9bbaf	03221d24-92ea-4ccc-a6a2-bd88dbfcd9fb	2001_2002_East_Asia_and_Pacific_fmtrpt.tsv	Korea - South (Republic of)	KOR	DoS East Asia and Pacific Region, Korea - South (Republic of), Miscellaneous, DOS/DOD, Non-Security Assistance (Note 3), FY01	KATUSA Training	KATUSA Training Academy	ROK Army	9/9/01	2001-09-09	9/27/01	2001-09-27	Camp Jackson, Ui-jong-bu, Korea	168	36968	https://2009-2017.state.gov/documents/organization/10965.pdf	Not checked against source; verify accuracy before use	2002-03	2019-07-16	f1b33c18d1485f1d37bcd90bacec3cc5
6e06f91c-8720-4738-bca4-890e4314b2df	03221d24-92ea-4ccc-a6a2-bd88dbfcd9fb	2001_2002_East_Asia_and_Pacific_fmtrpt.tsv	Korea - South (Republic of)	KOR	DoS East Asia and Pacific Region, Korea - South (Republic of), Miscellaneous, DOS/DOD, Non-Security Assistance (Note 3), FY01	KATUSA Training	KATUSA Training Academy	ROK Army	8/10/01	2001-08-10	8/30/01	2001-08-30	Camp Jackson, Ui-jong-bu, Korea	173	38068	https://2009-2017.state.gov/documents/organization/10965.pdf	Not checked against source; verify accuracy before use	2002-03	2019-07-16	ca2263c1b0131bb10a3225433ba242a8
a259fedb-3e57-4d25-bb6f-3150ce1f79e7	03221d24-92ea-4ccc-a6a2-bd88dbfcd9fb	2001_2002_East_Asia_and_Pacific_fmtrpt.tsv	Korea - South (Republic of)	KOR	DoS East Asia and Pacific Region, Korea - South (Republic of), Miscellaneous, DOS/DOD, Non-Security Assistance (Note 3), FY01	KATUSA Training	KATUSA Training Academy	ROK Army	7/20/01	2001-07-20	8/9/01	2001-08-09	Camp Jackson, Ui-jong-bu, Korea	164	36088	https://2009-2017.state.gov/documents/organization/10965.pdf	Not checked against source; verify accuracy before use	2002-03	2019-07-16	ac2129e83499c14ab8c6d7174dcc05e3
ea9f6d2d-2ff7-46f0-b80b-d28ecc0edef9	03221d24-92ea-4ccc-a6a2-bd88dbfcd9fb	2001_2002_East_Asia_and_Pacific_fmtrpt.tsv	Korea - South (Republic of)	KOR	DoS East Asia and Pacific Region, Korea - South (Republic of), Miscellaneous, DOS/DOD, Non-Security Assistance (Note 3), FY01	KATUSA Training	KATUSA Training Academy	ROK Army	6/22/01	2001-06-22	7/12/01	2001-07-12	Camp Jackson, Ui-jong-bu, Korea	161	35428	https://2009-2017.state.gov/documents/organization/10965.pdf	Not checked against source; verify accuracy before use	2002-03	2019-07-16	ada7e980211ea615af4d6eaab3893e40
cd228e4c-525a-4962-ba30-1ff39f77c0e4	03221d24-92ea-4ccc-a6a2-bd88dbfcd9fb	2001_2002_East_Asia_and_Pacific_fmtrpt.tsv	Korea - South (Republic of)	KOR	DoS East Asia and Pacific Region, Korea - South (Republic of), Miscellaneous, DOS/DOD, Non-Security Assistance (Note 3), FY01	KATUSA Training	KATUSA Training Academy	ROK Army	5/11/01	2001-05-11	5/31/01	2001-05-31	Camp Jackson, Ui-jong-bu, Korea	159	34987	https://2009-2017.state.gov/documents/organization/10965.pdf	Not checked against source; verify accuracy before use	2002-03	2019-07-16	591b0bc3f0aa1bbb082ca8c587a68724
0aa71c09-7a42-44dc-8ac4-a6861e946e5f	03221d24-92ea-4ccc-a6a2-bd88dbfcd9fb	2001_2002_East_Asia_and_Pacific_fmtrpt.tsv	Korea - South (Republic of)	KOR	DoS East Asia and Pacific Region, Korea - South (Republic of), Miscellaneous, DOS/DOD, Non-Security Assistance (Note 3), FY01	KATUSA Training	KATUSA Training Academy	ROK Army	4/20/01	2001-04-20	5/10/01	2001-05-10	Camp Jackson, Ui-jong-bu, Korea	163	35868	https://2009-2017.state.gov/documents/organization/10965.pdf	Not checked against source; verify accuracy before use	2002-03	2019-07-16	5ff1b4112daf9f8574c73d630ee72ff7
b7fec44c-5f19-45a8-9824-c24e3bbaafc0	03221d24-92ea-4ccc-a6a2-bd88dbfcd9fb	2001_2002_East_Asia_and_Pacific_fmtrpt.tsv	Korea - South (Republic of)	KOR	DoS East Asia and Pacific Region, Korea - South (Republic of), Miscellaneous, DOS/DOD, Non-Security Assistance (Note 3), FY01	KATUSA Training	KATUSA Training Academy	ROK Army	3/30/01	2001-03-30	4/19/01	2001-04-19	Camp Jackson, Ui-jong-bu, Korea	166	36528	https://2009-2017.state.gov/documents/organization/10965.pdf	Not checked against source; verify accuracy before use	2002-03	2019-07-16	36f9bc4148858f533bb9f17128b057bc
2da77544-5e7d-4dbe-b76e-a1c6c5ecd55c	03221d24-92ea-4ccc-a6a2-bd88dbfcd9fb	2001_2002_East_Asia_and_Pacific_fmtrpt.tsv	Korea - South (Republic of)	KOR	DoS East Asia and Pacific Region, Korea - South (Republic of), Miscellaneous, DOS/DOD, Non-Security Assistance (Note 3), FY01	KATUSA Training	KATUSA Training Academy	ROK Army	3/9/01	2001-03-09	3/29/01	2001-03-29	Camp Jackson, Ui-jong-bu, Korea	162	35648	https://2009-2017.state.gov/documents/organization/10965.pdf	Not checked against source; verify accuracy before use	2002-03	2019-07-16	960b70b5009112432679fd2de7a066ee
614c9af4-eead-4eac-8b85-581ecb127442	03221d24-92ea-4ccc-a6a2-bd88dbfcd9fb	2001_2002_East_Asia_and_Pacific_fmtrpt.tsv	Korea - South (Republic of)	KOR	DoS East Asia and Pacific Region, Korea - South (Republic of), Miscellaneous, DOS/DOD, Non-Security Assistance (Note 3), FY01	KATUSA Training	KATUSA Training Academy	ROK Army	1/19/01	2001-01-19	2/8/01	2001-02-08	Camp Jackson, Ui-jong-bu, Korea	163	35868	https://2009-2017.state.gov/documents/organization/10965.pdf	Not checked against source; verify accuracy before use	2002-03	2019-07-16	fef42d98a0d8bcdb70b90854db6280d1
65a14dfd-1753-4e02-87fe-f27bd6789ac6	03221d24-92ea-4ccc-a6a2-bd88dbfcd9fb	2001_2002_East_Asia_and_Pacific_fmtrpt.tsv	Korea - South (Republic of)	KOR	DoS East Asia and Pacific Region, Korea - South (Republic of), Miscellaneous, DOS/DOD, Non-Security Assistance (Note 3), FY01	KATUSA Training	KATUSA Training Academy	ROK Army	12/8/00	2000-12-08	1/4/01	2001-01-04	Camp Jackson, Ui-jong-bu, Korea	166	36528	https://2009-2017.state.gov/documents/organization/10965.pdf	Not checked against source; verify accuracy before use	2002-03	2019-07-16	9357cd30b9364a4db8f968943107d40e
d61d38a6-338a-40c7-a734-a3a17537110e	03221d24-92ea-4ccc-a6a2-bd88dbfcd9fb	2001_2002_East_Asia_and_Pacific_fmtrpt.tsv	Korea - South (Republic of)	KOR	DoS East Asia and Pacific Region, Korea - South (Republic of), Miscellaneous, DOS/DOD, Non-Security Assistance (Note 3), FY01	KATUSA Training	KATUSA Training Academy	ROK Army	11/17/00	2000-11-17	12/7/00	2000-12-07	Camp Jackson, Ui-jong-bu, Korea	163	35868	https://2009-2017.state.gov/documents/organization/10965.pdf	Not checked against source; verify accuracy before use	2002-03	2019-07-16	1e74bcae008d29d46004e9bca96b57e8
ca32c43b-dfc7-4de1-befe-ebcab2f970f6	03221d24-92ea-4ccc-a6a2-bd88dbfcd9fb	2001_2002_East_Asia_and_Pacific_fmtrpt.tsv	Korea - South (Republic of)	KOR	DoS East Asia and Pacific Region, Korea - South (Republic of), Miscellaneous, DOS/DOD, Non-Security Assistance (Note 3), FY01	KATUSA Training	KATUSA Training Academy	ROK Army	10/27/00	2000-10-27	11/16/00	2000-11-16	Camp Jackson, Ui-jong-bu, Korea	170	37408	https://2009-2017.state.gov/documents/organization/10965.pdf	Not checked against source; verify accuracy before use	2002-03	2019-07-16	97939bc26f2906ca330443611bb7011e
13d942be-945d-48e0-bae7-f0e797838b36	03221d24-92ea-4ccc-a6a2-bd88dbfcd9fb	2001_2002_East_Asia_and_Pacific_fmtrpt.tsv	Korea - South (Republic of)	KOR	DoS East Asia and Pacific Region, Korea - South (Republic of), Miscellaneous, DOS/DOD, Non-Security Assistance (Note 3), FY01	KATUSA Training	KATUSA Training Academy	ROK Army	6/1/01	2001-06-01	6/21/01	2001-06-21	Camp Jackson, Ui-jong-bu, Korea	163	35868	https://2009-2017.state.gov/documents/organization/10965.pdf	Not checked against source; verify accuracy before use	2002-03	2019-07-16	ebd0bebbd5c5a2c7b494da9eca910116
b489f721-9885-4136-973f-12c11594b54b	03221d24-92ea-4ccc-a6a2-bd88dbfcd9fb	2001_2002_East_Asia_and_Pacific_fmtrpt.tsv	Korea - South (Republic of)	KOR	DoS East Asia and Pacific Region, Korea - South (Republic of), Miscellaneous, DOS/DOD, Non-Security Assistance (Note 3), FY01	KATUSA Training	KATUSA Training Academy	ROK Army	10/6/00	2000-10-06	10/26/00	2000-10-26	Camp Jackson, Ui-jong-bu, Korea	168	36968	https://2009-2017.state.gov/documents/organization/10965.pdf	Not checked against source; verify accuracy before use	2002-03	2019-07-16	e0b82f7fd2eb2a8d8653cc58dc70b821
55cdabb8-ea42-4b98-9dd9-f6ffb19105d9	03221d24-92ea-4ccc-a6a2-bd88dbfcd9fb	2001_2002_East_Asia_and_Pacific_fmtrpt.tsv	Korea - South (Republic of)	KOR	DoS East Asia and Pacific Region, Korea - South (Republic of), PME Exchanges, FY01	INTERNATIONAL OFFICER PREP		39TH INF DIV	6/19/01	2001-06-19	7/6/01	2001-07-06	FT LEAVENWORTH KS 66027-1352	1	1218	https://2009-2017.state.gov/documents/organization/10965.pdf	Not checked against source; verify accuracy before use	2002-03	2019-07-16	f5e41a855b0805d2a56be3b58bda7e6c
5ae36e77-f0bf-43fc-a339-41f6304728d7	03221d24-92ea-4ccc-a6a2-bd88dbfcd9fb	2001_2002_East_Asia_and_Pacific_fmtrpt.tsv	Korea - South (Republic of)	KOR	DoS East Asia and Pacific Region, Korea - South (Republic of), PME Exchanges, FY01	INTERNATIONAL OFFICER PREP		AIDE, MINISTRY OF NATIONAL DEFENSE	6/19/01	2001-06-19	7/6/01	2001-07-06	FT LEAVENWORTH KS 66027-1352	1	1218	https://2009-2017.state.gov/documents/organization/10965.pdf	Not checked against source; verify accuracy before use	2002-03	2019-07-16	bdf30166c83dadedfdd223cbd7f5f2f9
b0bcdf43-22db-4140-a801-e3b5f647829c	03221d24-92ea-4ccc-a6a2-bd88dbfcd9fb	2001_2002_East_Asia_and_Pacific_fmtrpt.tsv	Korea - South (Republic of)	KOR	DoS East Asia and Pacific Region, Korea - South (Republic of), PME Exchanges, FY01	USA C&GSC OFF PREPARATORY		39TH INF DIV	7/9/01	2001-07-09	7/20/01	2001-07-20	FT LEAVENWORTH KS 66027-1352	1	823	https://2009-2017.state.gov/documents/organization/10965.pdf	Not checked against source; verify accuracy before use	2002-03	2019-07-16	94bee7f103687a2c82c238a4d2071054
1b6c0996-9a9d-4a0e-b39f-26c2d4dd7e17	03221d24-92ea-4ccc-a6a2-bd88dbfcd9fb	2001_2002_East_Asia_and_Pacific_fmtrpt.tsv	Korea - South (Republic of)	KOR	DoS East Asia and Pacific Region, Korea - South (Republic of), PME Exchanges, FY01	USA C&GSC OFF PREPARATORY		AIDE, MINISTRY OF NATIONAL DEFENSE	7/9/01	2001-07-09	7/20/01	2001-07-20	FT LEAVENWORTH KS 66027-1352	1	823	https://2009-2017.state.gov/documents/organization/10965.pdf	Not checked against source; verify accuracy before use	2002-03	2019-07-16	7ea90c32192bdb93f1a0dee8d268d3be
a4099163-51ee-45fd-8788-c41fca72bc67	03221d24-92ea-4ccc-a6a2-bd88dbfcd9fb	2001_2002_East_Asia_and_Pacific_fmtrpt.tsv	Korea - South (Republic of)	KOR	DoS East Asia and Pacific Region, Korea - South (Republic of), Asia-Pacific Center, FY01	Executive Course 00-3	U.S. military staff and faculty	Army HQ; Office Chief Naval Ops	10/2/00	2000-10-02	12/15/00	2000-12-15	Asia-Pacific Center for Security Studies Honolulu, Hawaii	2	1884	https://2009-2017.state.gov/documents/organization/10965.pdf	Not checked against source; verify accuracy before use	2002-03	2019-07-16	85686125205b927f47629af2ac20989d
634bfde3-6d9d-469d-a1ec-8d22218f009e	03221d24-92ea-4ccc-a6a2-bd88dbfcd9fb	2001_2002_East_Asia_and_Pacific_fmtrpt.tsv	Korea - South (Republic of)	KOR	DoS East Asia and Pacific Region, Korea - South (Republic of), Asia-Pacific Center, FY01	Executive Course 01-2	U.S. military staff and faculty	Air Force; Navy HQ	5/21/01	2001-05-21	8/9/01	2001-08-09	Asia-Pacific Center for Security Studies Honolulu, Hawaii	2	1884	https://2009-2017.state.gov/documents/organization/10965.pdf	Not checked against source; verify accuracy before use	2002-03	2019-07-16	075cfae779ffd58a7f04a263c04274ef
159ea5b7-8f34-453a-8912-4368900a27db	03221d24-92ea-4ccc-a6a2-bd88dbfcd9fb	2001_2002_East_Asia_and_Pacific_fmtrpt.tsv	Malaysia	MYS	DoS East Asia and Pacific Region, Malaysia, Non-Security Assistance, Unified Command (Note 4), FY01	JCET	NSWU-1	NSS: QUICK REACTION FORCES TO INCLUDED MEDICAL (15), COAST GUARD INCLUDING COAST GUARD DIVERS AND MEDICAL TEAM (15), PRESIDENTIAL SECURITY GUARD (15) AND AIRPORT SECURITY (10)	7/1/01	2001-07-01	7/29/01	2001-07-29	MALE,GIRIFUSHI,MADIVARU	55	42000	https://2009-2017.state.gov/documents/organization/10965.pdf	Not checked against source; verify accuracy before use	2002-03	2019-07-16	6001eba0ed670cce83045e061df09d9f
85683ab2-26a5-4686-af85-eb9535142c63	03221d24-92ea-4ccc-a6a2-bd88dbfcd9fb	2001_2002_East_Asia_and_Pacific_fmtrpt.tsv	Malaysia	MYS	East Asia and Pacific Region, Malaysia, Non-Security Assistance, Unified Command (Note 4), FY01	JCET	5/19 SFG	ROYAL MALAYSIAN ARMY: 21ST COMMANDO REGIMENT (24)	8/6/01	2001-08-06	8/31/01	2001-08-31	GUAM,NAVY MARIANAS,ANDERSEN AB,BARRIGADA	24	74000	https://2009-2017.state.gov/documents/organization/10965.pdf	Not checked against source; verify accuracy before use	2002-03	2019-07-16	3498fead78297b919e68af85aded924e
2bd670db-71dd-475a-ba67-7c2111ea709d	03221d24-92ea-4ccc-a6a2-bd88dbfcd9fb	2001_2002_East_Asia_and_Pacific_fmtrpt.tsv	Malaysia	MYS	East Asia and Pacific Region, Malaysia, Non-Security Assistance, Unified Command (Note 4), FY01	JCET	1/1 SFG, SOTSE PAC	ROYAL MALAYSIAN POLICE:A AND B SQUADRONSSPECIAL OPERATIONS FORCE	1/29/01	2001-01-29	3/21/01	2001-03-21	ULU KINTO, IPOH, KUALA LUMPUR	50	70000	https://2009-2017.state.gov/documents/organization/10965.pdf	Not checked against source; verify accuracy before use	2002-03	2019-07-16	bb4cd585218c960dda6b7f6db2b63334
d7441a2f-1d88-4681-bb95-8a93c3836c3a	03221d24-92ea-4ccc-a6a2-bd88dbfcd9fb	2001_2002_East_Asia_and_Pacific_fmtrpt.tsv	Malaysia	MYS	DoS East Asia and Pacific Region, Malaysia, International Military Education and Training (IMET), FY01	ALLIED OFF PREP-INF OAC		Staff Officer Grade-3 (Admin), Infantry Division	7/30/01	2001-07-30	8/3/01	2001-08-03	FT BENNING GA 31905-5468	1	1299	https://2009-2017.state.gov/documents/organization/10965.pdf	Not checked against source; verify accuracy before use	2002-03	2019-07-16	7b5bea6aa33fff42b524a0678199b100
b1c42cde-14d7-4fa8-beb2-9da75282830d	03221d24-92ea-4ccc-a6a2-bd88dbfcd9fb	2001_2002_East_Asia_and_Pacific_fmtrpt.tsv	Malaysia	MYS	DoS East Asia and Pacific Region, Malaysia, International Military Education and Training (IMET), FY01	AMPHIB PLAN SR OFF-INTL		Instructor, Joint Warfare Center and Staff Officer-2 Airborne	2/26/01	2001-02-26	5/4/01	2001-05-04	SAN DIEGO, CA 92155-5099	1	5840	https://2009-2017.state.gov/documents/organization/10965.pdf	Not checked against source; verify accuracy before use	2002-03	2019-07-16	11e412048072094f6c027859f850bf39
6c7d84c9-7204-4373-bcbe-0378d88bbf9a	03221d24-92ea-4ccc-a6a2-bd88dbfcd9fb	2001_2002_East_Asia_and_Pacific_fmtrpt.tsv	Malaysia	MYS	DoS East Asia and Pacific Region, Malaysia, International Military Education and Training (IMET), FY01	ARMOR CAPTAINS CAREER		Staff Officer Grade-3, Coordination, Armor Directorate	5/7/01	2001-05-07	9/14/01	2001-09-14	FT KNOX KY 40121-5234	1	11211	https://2009-2017.state.gov/documents/organization/10965.pdf	Not checked against source; verify accuracy before use	2002-03	2019-07-16	d07b2b2fd07f142439c108090e3e1b01
2f21af77-0004-48a1-a72e-ecb3fe4496b6	03221d24-92ea-4ccc-a6a2-bd88dbfcd9fb	2001_2002_East_Asia_and_Pacific_fmtrpt.tsv	Malaysia	MYS	DoS East Asia and Pacific Region, Malaysia, International Military Education and Training (IMET), FY01	ARMOR CPT CAREER CRS PREP		Staff Officer Grade-3, Coordination, Armor Directorate	4/16/01	2001-04-16	5/4/01	2001-05-04	FT KNOX KY 40121-5234	1	3480	https://2009-2017.state.gov/documents/organization/10965.pdf	Not checked against source; verify accuracy before use	2002-03	2019-07-16	4d54dadb26b64605defc522fe72ad8af
9f5dd2ef-9f84-4793-86bf-e0c763438cce	03221d24-92ea-4ccc-a6a2-bd88dbfcd9fb	2001_2002_East_Asia_and_Pacific_fmtrpt.tsv	Malaysia	MYS	DoS East Asia and Pacific Region, Malaysia, International Military Education and Training (IMET), FY01	BASIC FINAN MGMT OFFICER		Staff Officer Grade-2, Pay/Finance - 1st Division HQ	3/13/01	2001-03-13	6/13/01	2001-06-13	SHEPPARD AFB TX 76311-2367	1	4860	https://2009-2017.state.gov/documents/organization/10965.pdf	Not checked against source; verify accuracy before use	2002-03	2019-07-16	b28af47ef4f0ef2889b2e7d592bcb0b7
aa82b567-58e0-480f-bebd-d5ebcbda701d	03221d24-92ea-4ccc-a6a2-bd88dbfcd9fb	2001_2002_East_Asia_and_Pacific_fmtrpt.tsv	Malaysia	MYS	DoS East Asia and Pacific Region, Malaysia, International Military Education and Training (IMET), FY01	BASIC FINAN MGMT OFFICER		Staff Officer Grade-2, Financial Bravo, 3rd Division RMAF	3/13/01	2001-03-13	6/13/01	2001-06-13	SHEPPARD AFB TX 76311-2367	1	4860	https://2009-2017.state.gov/documents/organization/10965.pdf	Not checked against source; verify accuracy before use	2002-03	2019-07-16	1eca356808fd8cff32e8bfc264b7a3d2
885b3e54-46a5-43ba-ada1-965c87ac10c4	03221d24-92ea-4ccc-a6a2-bd88dbfcd9fb	2001_2002_East_Asia_and_Pacific_fmtrpt.tsv	Malaysia	MYS	DoS East Asia and Pacific Region, Malaysia, International Military Education and Training (IMET), FY01	BASIC MANPOWER & QUAL MGT		Staff Officer Grade-2, Human Resource Department	3/12/01	2001-03-12	4/26/01	2001-04-26	KEESLER AFB, MS 39534-2354	1	2727	https://2009-2017.state.gov/documents/organization/10965.pdf	Not checked against source; verify accuracy before use	2002-03	2019-07-16	4b0488df7b9a1251b800a0ac7e7437fd
dc669275-12f1-4319-aa72-4fddf95058f8	03221d24-92ea-4ccc-a6a2-bd88dbfcd9fb	2001_2002_East_Asia_and_Pacific_fmtrpt.tsv	Malaysia	MYS	DoS East Asia and Pacific Region, Malaysia, International Military Education and Training (IMET), FY01	COMM & INFO OFFICER (BCOT)		Communication Strategic Officer, Strategic Comm Regiment	5/7/01	2001-05-07	8/7/01	2001-08-07	KEESLER AFB, MS 39534-2354	1	5131	https://2009-2017.state.gov/documents/organization/10965.pdf	Not checked against source; verify accuracy before use	2002-03	2019-07-16	b300e005a3bc1a85379d0dfcc850dfd8
b19ac913-32d1-41bd-b130-67eb54640057	03221d24-92ea-4ccc-a6a2-bd88dbfcd9fb	2001_2002_East_Asia_and_Pacific_fmtrpt.tsv	Malaysia	MYS	DoS East Asia and Pacific Region, Malaysia, International Military Education and Training (IMET), FY01	DEF RES MGT CRS		Staff Officer Grade-1, Defense Logistics Division	8/20/01	2001-08-20	9/14/01	2001-09-14	MONTEREY, CA 93943-5201	1	5422	https://2009-2017.state.gov/documents/organization/10965.pdf	Not checked against source; verify accuracy before use	2002-03	2019-07-16	c9ff32ad70a518868f6e8586406d1c68
2684862b-0b16-423e-a516-bad2590c9ca9	03221d24-92ea-4ccc-a6a2-bd88dbfcd9fb	2001_2002_East_Asia_and_Pacific_fmtrpt.tsv	Malaysia	MYS	DoS East Asia and Pacific Region, Malaysia, International Military Education and Training (IMET), FY01	DEF RES MGT CRS		Staff Officer Grade-2, Secretariat, MAF HQ	8/20/01	2001-08-20	9/14/01	2001-09-14	MONTEREY, CA 93943-5201	1	5422	https://2009-2017.state.gov/documents/organization/10965.pdf	Not checked against source; verify accuracy before use	2002-03	2019-07-16	d343aa8d144c502de6a6150b3e9f7b12
d8962291-a244-44c2-afff-3839c03acd4d	03221d24-92ea-4ccc-a6a2-bd88dbfcd9fb	2001_2002_East_Asia_and_Pacific_fmtrpt.tsv	Malaysia	MYS	DoS East Asia and Pacific Region, Malaysia, International Military Education and Training (IMET), FY01	DEF RES MGT CRS		Executive Officer, No 5 SQN, RMAF Labuan	4/23/01	2001-04-23	5/17/01	2001-05-17	MONTEREY, CA 93943-5201	1	5422	https://2009-2017.state.gov/documents/organization/10965.pdf	Not checked against source; verify accuracy before use	2002-03	2019-07-16	cef99c21a451a79333a89f2915715d03
39f7a7fa-68c3-45ba-b2d5-47e93aa32246	03221d24-92ea-4ccc-a6a2-bd88dbfcd9fb	2001_2002_East_Asia_and_Pacific_fmtrpt.tsv	Malaysia	MYS	DoS East Asia and Pacific Region, Malaysia, International Military Education and Training (IMET), FY01	DEF RES MGT CRS		Principal Assistant Secretary, 8th Procurement Unit	4/23/01	2001-04-23	5/17/01	2001-05-17	MONTEREY, CA 93943-5201	1	5422	https://2009-2017.state.gov/documents/organization/10965.pdf	Not checked against source; verify accuracy before use	2002-03	2019-07-16	814c56fafbd76a5fc55ae78aa3e06e33
42b6a5ab-d6d9-4e7b-934b-8e0ddad59381	03221d24-92ea-4ccc-a6a2-bd88dbfcd9fb	2001_2002_East_Asia_and_Pacific_fmtrpt.tsv	Malaysia	MYS	DoS East Asia and Pacific Region, Malaysia, International Military Education and Training (IMET), FY01	DEF RES MGT CRS		Staff Officer Grade-1, Operations & Training Division, MAF HQ	1/8/01	2001-01-08	2/2/01	2001-02-02	MONTEREY, CA 93943-5201	1	5422	https://2009-2017.state.gov/documents/organization/10965.pdf	Not checked against source; verify accuracy before use	2002-03	2019-07-16	ffff998bc4e5a85e96e7c1cc476a91ad
4f76ccdd-cc78-431c-84ed-5516a4d3e538	03221d24-92ea-4ccc-a6a2-bd88dbfcd9fb	2001_2002_East_Asia_and_Pacific_fmtrpt.tsv	Malaysia	MYS	DoS East Asia and Pacific Region, Malaysia, International Military Education and Training (IMET), FY01	EWO STAFF OFFICER (SATP)		Staff Officer Grade-2, Communication and Electrical Division	8/8/01	2001-08-08	9/26/01	2001-09-26	RANDOLPH AFB, TX 78150-4302	1	5352	https://2009-2017.state.gov/documents/organization/10965.pdf	Not checked against source; verify accuracy before use	2002-03	2019-07-16	39f82306d83962bf805fa69ffee67cd3
97c93802-c3ca-47a8-aafd-65a5a292a1d7	03221d24-92ea-4ccc-a6a2-bd88dbfcd9fb	2001_2002_East_Asia_and_Pacific_fmtrpt.tsv	Malaysia	MYS	DoS East Asia and Pacific Region, Malaysia, International Military Education and Training (IMET), FY01	FA OFF ADV PREP-ALLIED OFF		Battery Captain, 1st Royal Artillery Regiment (Para)	5/31/01	2001-05-31	6/22/01	2001-06-22	FT SILL OK 73503	1	3322	https://2009-2017.state.gov/documents/organization/10965.pdf	Not checked against source; verify accuracy before use	2002-03	2019-07-16	babd9d4fb8240b75650dedfb6ec4ce5b
6b5c3112-e718-4887-b9b6-1c3aa3b9ff9f	03221d24-92ea-4ccc-a6a2-bd88dbfcd9fb	2001_2002_East_Asia_and_Pacific_fmtrpt.tsv	Malaysia	MYS	DoS East Asia and Pacific Region, Malaysia, International Military Education and Training (IMET), FY01	INTERNATIO INTEL OFF BASIC		Staff Officer Grade-2, PSYOP & Intelligence, Defense Intelligence Staff Dept	3/23/01	2001-03-23	6/8/01	2001-06-08	FT HUACHUCA AZ 85613-7000	1	9508	https://2009-2017.state.gov/documents/organization/10965.pdf	Not checked against source; verify accuracy before use	2002-03	2019-07-16	0baae8f0e32c0c43b12d2f14d555539b
c4bec622-e478-4ad5-b117-3fe89f08506b	03221d24-92ea-4ccc-a6a2-bd88dbfcd9fb	2001_2002_East_Asia_and_Pacific_fmtrpt.tsv	Malaysia	MYS	DoS East Asia and Pacific Region, Malaysia, International Military Education and Training (IMET), FY01	INTERNATIONAL OFFICER PREP		Staff Officer Grade-2, Training, Electrical & Mechanical Engineering (EME) Directorate	6/19/01	2001-06-19	7/6/01	2001-07-06	FT LEAVENWORTH KS 66027-1352	1	2617	https://2009-2017.state.gov/documents/organization/10965.pdf	Not checked against source; verify accuracy before use	2002-03	2019-07-16	7803cf6048d970b233391b8b69e54881
de626e26-e637-4f50-b849-5f3e14adcd8f	03221d24-92ea-4ccc-a6a2-bd88dbfcd9fb	2001_2002_East_Asia_and_Pacific_fmtrpt.tsv	Malaysia	MYS	DoS East Asia and Pacific Region, Malaysia, International Military Education and Training (IMET), FY01	INTL AIR WEAPONS CONTR CRS		Weapon Director, 320 SQN, RMAF Kuantan	7/9/01	2001-07-09	8/31/01	2001-08-31	TYNDALL AFB, FL 32403-5016	1	5300	https://2009-2017.state.gov/documents/organization/10965.pdf	Not checked against source; verify accuracy before use	2002-03	2019-07-16	2ff7e8a83731548a025b1f70eb40a269
ef7957d4-c2cd-4161-af51-013cfdb4591f	03221d24-92ea-4ccc-a6a2-bd88dbfcd9fb	2001_2002_East_Asia_and_Pacific_fmtrpt.tsv	Malaysia	MYS	East Asia and Pacific Region, Malaysia, International Military Education and Training (IMET), FY01	INTL DEFENSE MGT CRS		Commandant, RMAF Ipoh	2/5/01	2001-02-05	4/18/01	2001-04-18	MONTEREY, CA 93943-5201	1	14566	https://2009-2017.state.gov/documents/organization/10965.pdf	Not checked against source; verify accuracy before use	2002-03	2019-07-16	c7714ce58a7f6186f951a6f3222eb2a2
ed1e38a7-5bbb-4d8e-bbb9-771e21e436d2	03221d24-92ea-4ccc-a6a2-bd88dbfcd9fb	2001_2002_East_Asia_and_Pacific_fmtrpt.tsv	Malaysia	MYS	East Asia and Pacific Region, Malaysia, International Military Education and Training (IMET), FY01	INTL HYDROG MGT & ENG PGM		Staff Officer onboard KD PERANTAU	3/26/01	2001-03-26	9/27/01	2001-09-27	STENNIS SPACE CENTER, MS 39522-5001	1	20488	https://2009-2017.state.gov/documents/organization/10965.pdf	Not checked against source; verify accuracy before use	2002-03	2019-07-16	78afec43c18d682f407869180a477037
9404a270-2b3c-40f3-a6ba-d3e8e2f7d7ea	03221d24-92ea-4ccc-a6a2-bd88dbfcd9fb	2001_2002_East_Asia_and_Pacific_fmtrpt.tsv	Malaysia	MYS	East Asia and Pacific Region, Malaysia, International Military Education and Training (IMET), FY01	INTL INTELL APPL OFFICER		Staff Officer Grade-2, Air Intelligence Operation, RMAF HQ	5/1/01	2001-05-01	8/3/01	2001-08-03	GOODFELLOW AFB, TX 76908-4213	1	5587	https://2009-2017.state.gov/documents/organization/10965.pdf	Not checked against source; verify accuracy before use	2002-03	2019-07-16	03f185c9e5c4857222a1fd026eda31f0
d8ad92c8-b1b7-4469-a601-30a84d5edadb	03221d24-92ea-4ccc-a6a2-bd88dbfcd9fb	2001_2002_East_Asia_and_Pacific_fmtrpt.tsv	Malaysia	MYS	East Asia and Pacific Region, Malaysia, International Military Education and Training (IMET), FY01	INTL OFF SCH & SOS		Staff Officer Grade-3, Application Maintenance, Directorate of IT	1/8/01	2001-01-08	3/31/01	2001-03-31	MAXWELL AFB, AL 36112-6323	1	7707	https://2009-2017.state.gov/documents/organization/10965.pdf	Not checked against source; verify accuracy before use	2002-03	2019-07-16	2cca8f9b8eca60527eb79e612c916745
57e25fe2-5524-4042-96db-2d46d3f23593	03221d24-92ea-4ccc-a6a2-bd88dbfcd9fb	2001_2002_East_Asia_and_Pacific_fmtrpt.tsv	Malaysia	MYS	East Asia and Pacific Region, Malaysia, International Military Education and Training (IMET), FY01	INTL OFF SCH (FOR AC&SC)		Officer in charge (OC) Basic Flying, 1st Flight Training School	6/18/01	2001-06-18	7/27/01	2001-07-27	MAXWELL AFB, AL 36112-6323	1	6415	https://2009-2017.state.gov/documents/organization/10965.pdf	Not checked against source; verify accuracy before use	2002-03	2019-07-16	16e38720317beece57eb22a28edd85a3
bf66b519-b273-43ba-b284-8903a0ecbd4b	03221d24-92ea-4ccc-a6a2-bd88dbfcd9fb	2001_2002_East_Asia_and_Pacific_fmtrpt.tsv	Malaysia	MYS	East Asia and Pacific Region, Malaysia, International Military Education and Training (IMET), FY01	INTRO TO LIFE CYCLE COST		Research Officer, MINDEF	5/7/01	2001-05-07	5/18/01	2001-05-18	W-P AFB, OH 45433-7765	1	1389	https://2009-2017.state.gov/documents/organization/10965.pdf	Not checked against source; verify accuracy before use	2002-03	2019-07-16	c319d8b90550e64c34d03bebada97dca
7171bc13-c778-4f10-b769-b44ec1dff262	03221d24-92ea-4ccc-a6a2-bd88dbfcd9fb	2001_2002_East_Asia_and_Pacific_fmtrpt.tsv	Malaysia	MYS	East Asia and Pacific Region, Malaysia, International Military Education and Training (IMET), FY01	LOG MGT DEV		Staff Officer Grade-2, Defense Logistics Division	6/4/01	2001-06-04	6/29/01	2001-06-29	FT LEE VA 23801-1705	1	2632	https://2009-2017.state.gov/documents/organization/10965.pdf	Not checked against source; verify accuracy before use	2002-03	2019-07-16	a16fcd9a905090ac86319adcecfa81ae
d29985dd-6e62-4e6d-bf5e-498becc5eb83	03221d24-92ea-4ccc-a6a2-bd88dbfcd9fb	2001_2002_East_Asia_and_Pacific_fmtrpt.tsv	Malaysia	MYS	East Asia and Pacific Region, Malaysia, International Military Education and Training (IMET), FY01	MATERIEL ACQUISITION MGT		Staff Officer Grade-2, Defense Logistics Division	7/16/01	2001-07-16	8/31/01	2001-08-31	FT LEE VA 23801-1705	1	4585	https://2009-2017.state.gov/documents/organization/10965.pdf	Not checked against source; verify accuracy before use	2002-03	2019-07-16	a5f5160b3c9f1b8275ea13b9bc737c33
19e22778-723a-4654-b4f4-de5007dc5ff0	03221d24-92ea-4ccc-a6a2-bd88dbfcd9fb	2001_2002_East_Asia_and_Pacific_fmtrpt.tsv	Malaysia	MYS	East Asia and Pacific Region, Malaysia, International Military Education and Training (IMET), FY01	MED OFF UNDERSEA INTL		Medical Officer, 95 Armed Forces Hospital	7/9/01	2001-07-09	9/7/01	2001-09-07	GROTON, CT 06349-5159	1	3352	https://2009-2017.state.gov/documents/organization/10965.pdf	Not checked against source; verify accuracy before use	2002-03	2019-07-16	342920331cd8fb1d63ad8c67e9d8ce03
c614316a-cc8f-4c8a-af5b-8675c62fffbb	03221d24-92ea-4ccc-a6a2-bd88dbfcd9fb	2001_2002_East_Asia_and_Pacific_fmtrpt.tsv	Malaysia	MYS	East Asia and Pacific Region, Malaysia, International Military Education and Training (IMET), FY01	NAVAL STAFF COLLEGE		Principal Warfare Officer on board KD Lekir	1/11/01	2001-01-11	6/15/01	2001-06-15	NEWPORT, RI 02841-1207	1	21222	https://2009-2017.state.gov/documents/organization/10965.pdf	Not checked against source; verify accuracy before use	2002-03	2019-07-16	c4d8777afc85a7e36495d9b950d5bffa
159077bf-4ea4-4e5d-a95c-0b5f0ea7073e	03221d24-92ea-4ccc-a6a2-bd88dbfcd9fb	2001_2002_East_Asia_and_Pacific_fmtrpt.tsv	Malaysia	MYS	East Asia and Pacific Region, Malaysia, International Military Education and Training (IMET), FY01	OJT OFF SAR NORTHWEST		Supervisor, Air Traffic Control SQN, RMAF Kuantan	7/2/01	2001-07-02	7/13/01	2001-07-13	SEATTLE, WA 98174-1067	1	970	https://2009-2017.state.gov/documents/organization/10965.pdf	Not checked against source; verify accuracy before use	2002-03	2019-07-16	8918ef3322d68100b3044814d8d2adeb
845cb6e3-836f-47ff-836f-fb269da9de61	03221d24-92ea-4ccc-a6a2-bd88dbfcd9fb	2001_2002_East_Asia_and_Pacific_fmtrpt.tsv	Malaysia	MYS	East Asia and Pacific Region, Malaysia, International Military Education and Training (IMET), FY01	PLAN,PROG,BUDG & EXEC SYS		Staff Officer Grade-3 Financial, RMAF HQ	9/4/01	2001-09-04	9/14/01	2001-09-14	FT JACKSON SC 29207-7040	1	1665	https://2009-2017.state.gov/documents/organization/10965.pdf	Not checked against source; verify accuracy before use	2002-03	2019-07-16	0c05e8ad5609ae0d8e92226fcee76e58
20c46f8e-2138-454f-86d5-8ad3d5a48fd9	03221d24-92ea-4ccc-a6a2-bd88dbfcd9fb	2001_2002_East_Asia_and_Pacific_fmtrpt.tsv	Malaysia	MYS	East Asia and Pacific Region, Malaysia, International Military Education and Training (IMET), FY01	PSYCHOLOGICAL OPERATIONS		Staff Officer Grade-2, PSYOP & Intelligence, Defense Intelligence Staff Dept	2/12/01	2001-02-12	3/16/01	2001-03-16	FT BRAGG NC 28310	1	2998	https://2009-2017.state.gov/documents/organization/10965.pdf	Not checked against source; verify accuracy before use	2002-03	2019-07-16	6ca3da56f259727f978adebf912b601c
846a5066-b919-4610-9127-a187d7b0f0a5	03221d24-92ea-4ccc-a6a2-bd88dbfcd9fb	2001_2002_East_Asia_and_Pacific_fmtrpt.tsv	Malaysia	MYS	East Asia and Pacific Region, Malaysia, International Military Education and Training (IMET), FY01	PUBLIC AFFAIRS OFFICER		Staff Officer Grade-3, Visit & Information Dept.	3/19/01	2001-03-19	5/16/01	2001-05-16	FT GEORGE G. MEADE MD 20755-5620	1	6941	https://2009-2017.state.gov/documents/organization/10965.pdf	Not checked against source; verify accuracy before use	2002-03	2019-07-16	3f1a5269265ca8693446ebded2618435
4724e295-dbe8-45cf-869d-7f55834e9cd4	03221d24-92ea-4ccc-a6a2-bd88dbfcd9fb	2001_2002_East_Asia_and_Pacific_fmtrpt.tsv	Malaysia	MYS	East Asia and Pacific Region, Malaysia, International Military Education and Training (IMET), FY01	SEARCH/RESCUE INLAND PLNG		Supervisor, Air Traffic Control SQN, RMAF Kuantan	6/4/01	2001-06-04	6/8/01	2001-06-08	YORKTOWN, VA 23690-5000	1	1104	https://2009-2017.state.gov/documents/organization/10965.pdf	Not checked against source; verify accuracy before use	2002-03	2019-07-16	533473c1f4a768b6d1e533d781627c5d
9514c3bd-ef55-47a6-96fd-c3a51ba565dc	03221d24-92ea-4ccc-a6a2-bd88dbfcd9fb	2001_2002_East_Asia_and_Pacific_fmtrpt.tsv	Malaysia	MYS	East Asia and Pacific Region, Malaysia, International Military Education and Training (IMET), FY01	SEARCH/RESCUE MARITIME		Supervisor, Air Traffic Control SQN, RMAF Kuantan	6/11/01	2001-06-11	6/28/01	2001-06-28	YORKTOWN, VA 23690-5000	1	1621	https://2009-2017.state.gov/documents/organization/10965.pdf	Not checked against source; verify accuracy before use	2002-03	2019-07-16	6085f762d48251ecc855e2e3ae7e57fd
3ce21291-066c-42ef-93fe-d494c4fa3ab3	03221d24-92ea-4ccc-a6a2-bd88dbfcd9fb	2001_2002_East_Asia_and_Pacific_fmtrpt.tsv	Malaysia	MYS	East Asia and Pacific Region, Malaysia, International Military Education and Training (IMET), FY01	SPEC ENG LANG TRNG (SET)		OC, PASKAL Sp Forces, Lumut Naval Base	7/23/01	2001-07-23	9/21/01	2001-09-21	LACKLAND AFB, TX 78236-5259	1	4648	https://2009-2017.state.gov/documents/organization/10965.pdf	Not checked against source; verify accuracy before use	2002-03	2019-07-16	20d944caa143a378e696ffa1c58a7fae
61c69176-1a4a-40c6-8a2a-73ea8231e618	03221d24-92ea-4ccc-a6a2-bd88dbfcd9fb	2001_2002_East_Asia_and_Pacific_fmtrpt.tsv	Malaysia	MYS	East Asia and Pacific Region, Malaysia, International Military Education and Training (IMET), FY01	SPEC ENG LANG TRNG (SET)		Medical Officer, 95 Armed Forces Hospital	5/7/01	2001-05-07	7/6/01	2001-07-06	LACKLAND AFB, TX 78236-5259	1	4582	https://2009-2017.state.gov/documents/organization/10965.pdf	Not checked against source; verify accuracy before use	2002-03	2019-07-16	7fc59897a392677965af68727feaa9be
c37f6913-833d-4e68-86fc-854f94198f57	03221d24-92ea-4ccc-a6a2-bd88dbfcd9fb	2001_2002_East_Asia_and_Pacific_fmtrpt.tsv	Malaysia	MYS	East Asia and Pacific Region, Malaysia, International Military Education and Training (IMET), FY01	SPECIALIZED ENG LANG TNG		Weapon Director, 320 SQN, RMAF Kuantan	5/7/01	2001-05-07	7/6/01	2001-07-06	LACKLAND AFB, TX 78236	1	4448	https://2009-2017.state.gov/documents/organization/10965.pdf	Not checked against source; verify accuracy before use	2002-03	2019-07-16	76f118fc164fdc610ba2b27e7f72907b
b139d692-0081-4ace-8509-9835eb79e64b	03221d24-92ea-4ccc-a6a2-bd88dbfcd9fb	2001_2002_East_Asia_and_Pacific_fmtrpt.tsv	Malaysia	MYS	East Asia and Pacific Region, Malaysia, International Military Education and Training (IMET), FY01	SPECIALIZED ENG LANG TNG		Staff Officer Grade-3, Visit & Information Dept.	1/8/01	2001-01-08	3/9/01	2001-03-09	SAN ANTONIO TX 78236-5259	1	4614	https://2009-2017.state.gov/documents/organization/10965.pdf	Not checked against source; verify accuracy before use	2002-03	2019-07-16	f5f02eece31da8a42f4045d348e2f17b
5828b9ea-ede0-40cf-990e-572ce63f05f0	03221d24-92ea-4ccc-a6a2-bd88dbfcd9fb	2001_2002_East_Asia_and_Pacific_fmtrpt.tsv	Malaysia	MYS	East Asia and Pacific Region, Malaysia, International Military Education and Training (IMET), FY01	SPECIALIZED ENG LANG TNG		Communication Strategic Officer, Strategic Comm Regiment	3/5/01	2001-03-05	5/4/01	2001-05-04	LACKLAND AFB, TX 78236	1	4448	https://2009-2017.state.gov/documents/organization/10965.pdf	Not checked against source; verify accuracy before use	2002-03	2019-07-16	3d0df7bc118aeae0e0ba627c6ea83b6b
998794bc-5573-4012-8e86-b7c8efd20c6e	03221d24-92ea-4ccc-a6a2-bd88dbfcd9fb	2001_2002_East_Asia_and_Pacific_fmtrpt.tsv	Malaysia	MYS	East Asia and Pacific Region, Malaysia, International Military Education and Training (IMET), FY01	SPECIALIZED ENG LANG TNG		Staff Officer Grade-2, Communication and Electrical Division	6/4/01	2001-06-04	8/3/01	2001-08-03	LACKLAND AFB, TX 78236	1	4448	https://2009-2017.state.gov/documents/organization/10965.pdf	Not checked against source; verify accuracy before use	2002-03	2019-07-16	76e57d03c368e4477a846628b0a0a25c
3791a057-a146-4ce7-b629-1902ccd31c0d	03221d24-92ea-4ccc-a6a2-bd88dbfcd9fb	2001_2002_East_Asia_and_Pacific_fmtrpt.tsv	Malaysia	MYS	East Asia and Pacific Region, Malaysia, International Military Education and Training (IMET), FY01	SR INTERNATIONAL DEF MGT		Deputy Director General, Defence Intelligence	6/25/01	2001-06-25	7/20/01	2001-07-20	MONTEREY, CA 93943-5201	1	5675	https://2009-2017.state.gov/documents/organization/10965.pdf	Not checked against source; verify accuracy before use	2002-03	2019-07-16	b2ec3aa029e91b6ecfcfec1dfc0fd6a7
ae1b9fcc-89e8-4ca9-aa29-5fed3bf53df7	03221d24-92ea-4ccc-a6a2-bd88dbfcd9fb	2001_2002_East_Asia_and_Pacific_fmtrpt.tsv	Malaysia	MYS	East Asia and Pacific Region, Malaysia, International Military Education and Training (IMET), FY01	SR INTERNATIONAL DEF MGT		Fleet Operations Commander, TLDM Lumut	6/25/01	2001-06-25	7/20/01	2001-07-20	MONTEREY, CA 93943-5201	1	5635	https://2009-2017.state.gov/documents/organization/10965.pdf	Not checked against source; verify accuracy before use	2002-03	2019-07-16	8172629aac9a15b8bfb88240a95b2dad
12ef2109-0e8b-4c9d-b55e-1f67ce36041f	03221d24-92ea-4ccc-a6a2-bd88dbfcd9fb	2001_2002_East_Asia_and_Pacific_fmtrpt.tsv	Malaysia	MYS	East Asia and Pacific Region, Malaysia, International Military Education and Training (IMET), FY01	TOEFL TEST		Joint Service	7/2/01	2001-07-02	9/28/01	2001-09-28	Malaysia	0	660	https://2009-2017.state.gov/documents/organization/10965.pdf	Not checked against source; verify accuracy before use	2002-03	2019-07-16	a5ee7265593bf3b2b021ab8485af4b6b
f8ce00de-a8b1-4682-9964-32ddad736789	03221d24-92ea-4ccc-a6a2-bd88dbfcd9fb	2001_2002_East_Asia_and_Pacific_fmtrpt.tsv	Malaysia	MYS	East Asia and Pacific Region, Malaysia, International Military Education and Training (IMET), FY01	USA C&GSC OFF PREPARATORY		Staff Officer Grade-2, Training, Electrical & Mechanical Engineering (EME) Directorate	7/9/01	2001-07-09	7/20/01	2001-07-20	FT LEAVENWORTH KS 66027-1352	1	1725	https://2009-2017.state.gov/documents/organization/10965.pdf	Not checked against source; verify accuracy before use	2002-03	2019-07-16	60a25afff900f7261cd13496b28c24ce
55f0a172-0fac-40af-9954-02593bba4881	03221d24-92ea-4ccc-a6a2-bd88dbfcd9fb	2001_2002_East_Asia_and_Pacific_fmtrpt.tsv	Malaysia	MYS	DoS East Asia and Pacific Region, Malaysia, Section 1004 (Note 1), FY01	LT INF PDSS	1ST SFG	Royal Malaysian Police	9/1/01	2001-09-01	9/8/01	2001-09-08	Kuala Lumpur, Malaysia	0	5000	https://2009-2017.state.gov/documents/organization/10965.pdf	Not checked against source; verify accuracy before use	2002-03	2019-07-16	ede33cfbcb87cd5334e2411bdea51f1c
0d4603ea-ec7a-4b53-b88f-9edf728b39c4	03221d24-92ea-4ccc-a6a2-bd88dbfcd9fb	2001_2002_East_Asia_and_Pacific_fmtrpt.tsv	Malaysia	MYS	DoS East Asia and Pacific Region, Malaysia, Section 1004 (Note 1), FY01	LT INF TNG	1ST SFG	Royal Malaysian Police	10/16/00	2000-10-16	11/23/00	2000-11-23	Ipoh, Malaysia	60	140000	https://2009-2017.state.gov/documents/organization/10965.pdf	Not checked against source; verify accuracy before use	2002-03	2019-07-16	75ae3be4dc4f27a60a2ec02cca9dcb54
affed242-878c-453d-971f-6dbbc139823c	03221d24-92ea-4ccc-a6a2-bd88dbfcd9fb	2001_2002_East_Asia_and_Pacific_fmtrpt.tsv	Malaysia	MYS	DoS East Asia and Pacific Region, Malaysia, Asia-Pacific Center, FY01	Executive Course 00-3	U.S. military staff and faculty	Sprecial Warfare Centre; Air Force; Development Division	10/2/00	2000-10-02	12/15/00	2000-12-15	Asia-Pacific Center for Security Studies Honolulu, Hawaii	3	33897	https://2009-2017.state.gov/documents/organization/10965.pdf	Not checked against source; verify accuracy before use	2002-03	2019-07-16	d0e53afbe71823fa58e7b00cfba15ca3
e2ffa89e-b0e9-4d61-9bc9-282ebc23dcaf	03221d24-92ea-4ccc-a6a2-bd88dbfcd9fb	2001_2002_East_Asia_and_Pacific_fmtrpt.tsv	Malaysia	MYS	DoS East Asia and Pacific Region, Malaysia, Asia-Pacific Center, FY01	Executive Course 01-1	U.S. military staff and faculty	Air Force College; Ministry of Defence; KD Malaya	1/22/01	2001-01-22	4/12/01	2001-04-12	Asia-Pacific Center for Security Studies Honolulu, Hawaii	3	43168	https://2009-2017.state.gov/documents/organization/10965.pdf	Not checked against source; verify accuracy before use	2002-03	2019-07-16	5660b1022918d481e77bcaffc1a3dcbe
62d098a8-cbdf-449c-ad0d-210feddc8f85	03221d24-92ea-4ccc-a6a2-bd88dbfcd9fb	2001_2002_East_Asia_and_Pacific_fmtrpt.tsv	Malaysia	MYS	DoS East Asia and Pacific Region, Malaysia, Asia-Pacific Center, FY01	Executive Course 01-2	U.S. military staff and faculty	Army Field Cmd; Armed Forces HQ; Armed Forces Staff College	5/21/01	2001-05-21	8/9/01	2001-08-09	Asia-Pacific Center for Security Studies Honolulu, Hawaii	3	44127	https://2009-2017.state.gov/documents/organization/10965.pdf	Not checked against source; verify accuracy before use	2002-03	2019-07-16	b7e76935f281999ecbaa1888b9bed3d0
a312af18-686e-4f19-a4b2-08a58bf0b8f8	03221d24-92ea-4ccc-a6a2-bd88dbfcd9fb	2001_2002_East_Asia_and_Pacific_fmtrpt.tsv	Marshall Islands	MHL	DoS East Asia and Pacific Region, Marshall Islands, Asia-Pacific Center, FY01	Executive Course 00-3	U.S. military staff and faculty	MOFA	10/2/00	2000-10-02	12/15/00	2000-12-15	Asia-Pacific Center for Security Studies Honolulu, Hawaii	1	11588	https://2009-2017.state.gov/documents/organization/10965.pdf	Not checked against source; verify accuracy before use	2002-03	2019-07-16	632fba7fd4bb3d1bd5499b230be91f93
52bd8d31-9744-4fb0-85a6-9dbcd302cf5b	03221d24-92ea-4ccc-a6a2-bd88dbfcd9fb	2001_2002_East_Asia_and_Pacific_fmtrpt.tsv	Marshall Islands	MHL	DoS East Asia and Pacific Region, Marshall Islands, Asia-Pacific Center, FY01	Executive Course 01-1	U.S. military staff and faculty	Police	1/22/01	2001-01-22	4/12/01	2001-04-12	Asia-Pacific Center for Security Studies Honolulu, Hawaii	1	13461	https://2009-2017.state.gov/documents/organization/10965.pdf	Not checked against source; verify accuracy before use	2002-03	2019-07-16	0049475e84a30513f26d201de5ed8192
8cd8f438-55d4-45ac-a022-767b8aed8933	03221d24-92ea-4ccc-a6a2-bd88dbfcd9fb	2001_2002_East_Asia_and_Pacific_fmtrpt.tsv	Micronesia	FSM	DoS East Asia and Pacific Region, Micronesia, Asia-Pacific Center, FY01	Executive Course 01-1	U.S. military staff and faculty	MOFA	1/22/01	2001-01-22	4/12/01	2001-04-12	Asia-Pacific Center for Security Studies Honolulu, Hawaii	1	13934	https://2009-2017.state.gov/documents/organization/10965.pdf	Not checked against source; verify accuracy before use	2002-03	2019-07-16	a0dba70466e5a8746f5e6ef3f4a73b9f
06d3a41c-38ba-4eca-93f3-29734743f6fa	03221d24-92ea-4ccc-a6a2-bd88dbfcd9fb	2001_2002_East_Asia_and_Pacific_fmtrpt.tsv	Micronesia	FSM	DoS East Asia and Pacific Region, Micronesia, Asia-Pacific Center, FY01	Executive Course 01-2	U.S. military staff and faculty	FSM Embassy Tokyo	5/21/01	2001-05-21	8/9/01	2001-08-09	Asia-Pacific Center for Security Studies Honolulu, Hawaii	1	14298	https://2009-2017.state.gov/documents/organization/10965.pdf	Not checked against source; verify accuracy before use	2002-03	2019-07-16	ed0de348753f7aeb09ec66a64340c124
e8926f82-0237-4389-b945-5abf0dcbd8c3	03221d24-92ea-4ccc-a6a2-bd88dbfcd9fb	2001_2002_East_Asia_and_Pacific_fmtrpt.tsv	Mongolia	MNG	DoS East Asia and Pacific Region, Mongolia, Non-Security Assistance, Unified Command (Note 4), FY01	JCET	353 SOG, 426 CA BN, 96 CA BN, 19 SFG	MONGOLIAN CIVIL DEFENSE FORCE (35 PAX), MONGOLIAN AIR AND AIR DEFENSE FORCE (10 PAX), MONGOLIAN MINISTRY OF HEALTH (10 PAX), MONGOLIAN RED CROSS (20	9/1/01	2001-09-01	9/26/01	2001-09-26	UB,KHOVD,TSETSERLEG	75	148000	https://2009-2017.state.gov/documents/organization/10965.pdf	Not checked against source; verify accuracy before use	2002-03	2019-07-16	4c840318e16876913518b388a9d73bda
8f3bb068-161d-49b9-995c-52de6f16ed47	03221d24-92ea-4ccc-a6a2-bd88dbfcd9fb	2001_2002_East_Asia_and_Pacific_fmtrpt.tsv	Mongolia	MNG	DoS East Asia and Pacific Region, Mongolia, International Military Education and Training (IMET), FY01	AMERICAN LANGUAGE COURSE		Foreign language department, National defense University of Mongolia	4/23/01	2001-04-23	9/7/01	2001-09-07	LACKLAND AFB, TX 78236	1	12568	https://2009-2017.state.gov/documents/organization/10965.pdf	Not checked against source; verify accuracy before use	2002-03	2019-07-16	e88bfc84ea8b238fc68f6cdf712a6fcf
b99eda48-a482-4de9-8e68-d658d45779b7	03221d24-92ea-4ccc-a6a2-bd88dbfcd9fb	2001_2002_East_Asia_and_Pacific_fmtrpt.tsv	Mongolia	MNG	DoS East Asia and Pacific Region, Mongolia, International Military Education and Training (IMET), FY01	AMERICAN LANGUAGE CRS		Strategic Management Planning Directorate, Ministry of Defense	5/28/01	2001-05-28	9/21/01	2001-09-21	LACKLAND AFB, TX 78236-5259	1	11057	https://2009-2017.state.gov/documents/organization/10965.pdf	Not checked against source; verify accuracy before use	2002-03	2019-07-16	a2c8425a3e5244237afe81e831120cb5
bdcbf03f-eccd-4bcc-ae56-7b6c85d9f088	03221d24-92ea-4ccc-a6a2-bd88dbfcd9fb	2001_2002_East_Asia_and_Pacific_fmtrpt.tsv	Mongolia	MNG	DoS East Asia and Pacific Region, Mongolia, International Military Education and Training (IMET), FY01	CIV-MIL SID - EURO		Senior Officer, Strategic Management Planning directorate, MOD	2/5/01	2001-02-05	2/16/01	2001-02-16	HURLBURT FIELD, FL 32544-5826	1	5415	https://2009-2017.state.gov/documents/organization/10965.pdf	Not checked against source; verify accuracy before use	2002-03	2019-07-16	c9675055733682c53a507c4ab7b64297
02199b86-92aa-494d-ac18-fc28e1f37708	03221d24-92ea-4ccc-a6a2-bd88dbfcd9fb	2001_2002_East_Asia_and_Pacific_fmtrpt.tsv	Mongolia	MNG	DoS East Asia and Pacific Region, Mongolia, International Military Education and Training (IMET), FY01	CIV-MIL SID - EURO		Policy Department, Ministry of Foreign Affairs of Mongolia	2/5/01	2001-02-05	2/16/01	2001-02-16	HURLBURT FIELD, FL 32544-5826	1	6282	https://2009-2017.state.gov/documents/organization/10965.pdf	Not checked against source; verify accuracy before use	2002-03	2019-07-16	6635ec432bf0903e5c6b61e5f25d3d60
51e9e56f-b31f-4751-9bb1-ba2ee57e3913	03221d24-92ea-4ccc-a6a2-bd88dbfcd9fb	2001_2002_East_Asia_and_Pacific_fmtrpt.tsv	Mongolia	MNG	DoS East Asia and Pacific Region, Mongolia, International Military Education and Training (IMET), FY01	DLI ENGLISH LANGUAGE TECH		Ministry of Defense - 4 General Staff Headquarters - 11 Defense University - 4 Civil Defense - 2	3/25/01	2001-03-25	7/22/01	2001-07-22	Mongolia	20	25472	https://2009-2017.state.gov/documents/organization/10965.pdf	Not checked against source; verify accuracy before use	2002-03	2019-07-16	d1b8eff6e84109319f8f60a7f05f62f4
1e01c279-9f65-4e41-84e1-3992be6b5c2e	03221d24-92ea-4ccc-a6a2-bd88dbfcd9fb	2001_2002_East_Asia_and_Pacific_fmtrpt.tsv	Mongolia	MNG	DoS East Asia and Pacific Region, Mongolia, International Military Education and Training (IMET), FY01	DLI ENGLISH LANGUAGE TECH		n/a	3/25/01	2001-03-25	7/22/01	2001-07-22	Mongolia	0	22648	https://2009-2017.state.gov/documents/organization/10965.pdf	Not checked against source; verify accuracy before use	2002-03	2019-07-16	7e29817fd39b60177f3aaca36f304ef6
3d0d1965-0ebc-4a66-8536-8bb268b0b4a5	03221d24-92ea-4ccc-a6a2-bd88dbfcd9fb	2001_2002_East_Asia_and_Pacific_fmtrpt.tsv	Mongolia	MNG	DoS East Asia and Pacific Region, Mongolia, International Military Education and Training (IMET), FY01	DLI ENGLISH LANGUAGE TECH		n/a	11/30/00	2000-11-30	3/24/01	2001-03-24	Mongolia	0	22492	https://2009-2017.state.gov/documents/organization/10965.pdf	Not checked against source; verify accuracy before use	2002-03	2019-07-16	9dd9ea431f0c9ab92822551bc63719a8
c5b18764-0a2b-4f43-9b6b-70f8411fcf41	03221d24-92ea-4ccc-a6a2-bd88dbfcd9fb	2001_2002_East_Asia_and_Pacific_fmtrpt.tsv	Mongolia	MNG	DoS East Asia and Pacific Region, Mongolia, International Military Education and Training (IMET), FY01	DLI ENGLISH LANGUAGE TECH		Ministry of Defense - 3 General Staff Headquarters - 11 Defense University - 6 Civil Defense Headquarters - 2	11/30/00	2000-11-30	3/24/01	2001-03-24	Mongolia	20	25106	https://2009-2017.state.gov/documents/organization/10965.pdf	Not checked against source; verify accuracy before use	2002-03	2019-07-16	67f170711e11f9494fa12bff6af4d20c
9938207e-79cf-4709-9fb2-1d61849d706a	03221d24-92ea-4ccc-a6a2-bd88dbfcd9fb	2001_2002_East_Asia_and_Pacific_fmtrpt.tsv	Mongolia	MNG	DoS East Asia and Pacific Region, Mongolia, International Military Education and Training (IMET), FY01	ENGLISH LANGUAGE CRSE		Central Armed Forces Hospital, Mongolia	12/11/00	2000-12-11	4/27/01	2001-04-27	SAN ANTONIO TX 78236-5259	1	14019	https://2009-2017.state.gov/documents/organization/10965.pdf	Not checked against source; verify accuracy before use	2002-03	2019-07-16	d047f220a385db6c3524208203a3077f
5b4857f0-9c02-4c7e-b403-36cc074bf593	03221d24-92ea-4ccc-a6a2-bd88dbfcd9fb	2001_2002_East_Asia_and_Pacific_fmtrpt.tsv	Mongolia	MNG	DoS East Asia and Pacific Region, Mongolia, International Military Education and Training (IMET), FY01	ENGLISH LANGUAGE CRSE		General Staff Headquarters, MAF	2/19/01	2001-02-19	7/6/01	2001-07-06	SAN ANTONIO TX 78236-5259	1	13951	https://2009-2017.state.gov/documents/organization/10965.pdf	Not checked against source; verify accuracy before use	2002-03	2019-07-16	db3ef4f70bf9f38c8d0e364a3067bf62
49b4d046-caec-47c9-bd06-5e831ce2ffbb	03221d24-92ea-4ccc-a6a2-bd88dbfcd9fb	2001_2002_East_Asia_and_Pacific_fmtrpt.tsv	Mongolia	MNG	DoS East Asia and Pacific Region, Mongolia, International Military Education and Training (IMET), FY01	ENGLISH LANGUAGE CRSE		234th BN, Mongolian Armed Forces	6/18/01	2001-06-18	8/24/01	2001-08-24	SAN ANTONIO TX 78236-5259	1	9121	https://2009-2017.state.gov/documents/organization/10965.pdf	Not checked against source; verify accuracy before use	2002-03	2019-07-16	2e1cb4e18bdaac03dd8565dfd45b15a3
3d3a2e20-fe79-404f-b31d-0671973c2e59	03221d24-92ea-4ccc-a6a2-bd88dbfcd9fb	2001_2002_East_Asia_and_Pacific_fmtrpt.tsv	Mongolia	MNG	DoS East Asia and Pacific Region, Mongolia, International Military Education and Training (IMET), FY01	ENGLISH LANGUAGE CRSE		Unit # 150; General Staff Headquarters	2/19/01	2001-02-19	7/6/01	2001-07-06	SAN ANTONIO TX 78236-5259	1	13951	https://2009-2017.state.gov/documents/organization/10965.pdf	Not checked against source; verify accuracy before use	2002-03	2019-07-16	869a57944f6016e3e226f270e7387e1b
27da2588-a9e6-40d0-9f95-a64ed81728be	03221d24-92ea-4ccc-a6a2-bd88dbfcd9fb	2001_2002_East_Asia_and_Pacific_fmtrpt.tsv	Mongolia	MNG	DoS East Asia and Pacific Region, Mongolia, International Military Education and Training (IMET), FY01	MET CIV-MILITARY RELATIONS		Government Chancery Office - 1 Ministry of Justice and Home Affairs - 1 Defense Auditing Agency, Ministry of Defense - 13 General Staff Headquarters - 6 Institute for Defense Studies - 6 Civil Defense Headquarters - 2 Border Troops Headquarters - 2 Ministry of Defense - 7 Parliamnet's Secretariat Office - 2	9/24/01	2001-09-24	9/28/01	2001-09-28	Mongolia	40	43195	https://2009-2017.state.gov/documents/organization/10965.pdf	Not checked against source; verify accuracy before use	2002-03	2019-07-16	cf9dffa322e6348882793abf9d3635cd
f27e5e32-6434-451a-abc7-4148eae9f121	03221d24-92ea-4ccc-a6a2-bd88dbfcd9fb	2001_2002_East_Asia_and_Pacific_fmtrpt.tsv	Mongolia	MNG	East Asia and Pacific Region, Mongolia, International Military Education and Training (IMET), FY01	MET CMR CONUS PLANNING		Peacekeeping Operations Office, General Staff Headquarters	10/18/00	2000-10-18	10/24/00	2000-10-24	MONTEREY, CA 93943-5001	1	47964	https://2009-2017.state.gov/documents/organization/10965.pdf	Not checked against source; verify accuracy before use	2002-03	2019-07-16	8da31b66a56385ed37a4b7af74c983b4
adae738b-2270-4241-9d14-4b4402bf301e	03221d24-92ea-4ccc-a6a2-bd88dbfcd9fb	2001_2002_East_Asia_and_Pacific_fmtrpt.tsv	Mongolia	MNG	East Asia and Pacific Region, Mongolia, International Military Education and Training (IMET), FY01	MET DIILS		Government Chancery Office - 2 Parliament's Secretariat Office - 2 Ministry of Justice and Home Affairs - 2 Ministry of Defense - 10 General Police Department - 2 Law Enforcement Agency - 4 General Staff Headquarters - 4 Civil Defense Headquarters - 2 Manageent Academy - 2 General Intelligence Agency - 3 Border Troops Headquarters - 2 Defense University - 4 Institute for Defense Studies - 2 Ministry of Foreign Affairs -1	8/20/01	2001-08-20	8/24/01	2001-08-24	Mongolia	44	41200	https://2009-2017.state.gov/documents/organization/10965.pdf	Not checked against source; verify accuracy before use	2002-03	2019-07-16	59fe87e3c560a296b268efee6876a063
45de456e-810b-4826-bb13-3e4c8a35bf65	03221d24-92ea-4ccc-a6a2-bd88dbfcd9fb	2001_2002_East_Asia_and_Pacific_fmtrpt.tsv	Mongolia	MNG	East Asia and Pacific Region, Mongolia, International Military Education and Training (IMET), FY01	MET IHRM PH IV		State Administration & Management Directorate of MOD - 2 Financial Policy Implementation Department of MOD - 1 Strategic Management Planning Directorate of MOD - 2 Central Armed Forces Hospital, GSHQ - 7 Personnel Department, GSHQ - 1 Military Construction Engineering Corps, GSHQ - 2 The Capitol Civil Defens eAnd Miniltary Staff - 1 UNAIDS program - 1 Ministry of Health - 3 Health Management Information Center - 3 Chingeltei District Health Center - 1 Sukhbaatar District Health Center - 2 Ministry of Education - 1 State Special Servant's Hospital - 3	10/16/00	2000-10-16	10/20/00	2000-10-20	Mongolia	30	17602	https://2009-2017.state.gov/documents/organization/10965.pdf	Not checked against source; verify accuracy before use	2002-03	2019-07-16	c14cfd2f40c405cbdadabb970fc88c58
e78b2a1f-f5f1-4bd4-94c9-c4d1f85d6e25	03221d24-92ea-4ccc-a6a2-bd88dbfcd9fb	2001_2002_East_Asia_and_Pacific_fmtrpt.tsv	Mongolia	MNG	East Asia and Pacific Region, Mongolia, International Military Education and Training (IMET), FY01	OBC INTERNATION ENR PREP		234th BN, Mongolian Armed Forces	9/10/01	2001-09-10	9/14/01	2001-09-14	FT LEONARD WOOD MO 65473-5000	1	1605	https://2009-2017.state.gov/documents/organization/10965.pdf	Not checked against source; verify accuracy before use	2002-03	2019-07-16	ea8074c15d61dc860e5d6dcbf40c879e
8475dbda-c569-4fd7-a58a-0fce7d44a4b4	03221d24-92ea-4ccc-a6a2-bd88dbfcd9fb	2001_2002_East_Asia_and_Pacific_fmtrpt.tsv	Mongolia	MNG	East Asia and Pacific Region, Mongolia, International Military Education and Training (IMET), FY01	SEC ASST MGT-STUDENT		Logistics Department, General Staff Headquarters, Mongolia	10/23/00	2000-10-23	11/3/00	2000-11-03	W-P AFB, OH 45433-7803	1	6631	https://2009-2017.state.gov/documents/organization/10965.pdf	Not checked against source; verify accuracy before use	2002-03	2019-07-16	e7a5ba90fbd1f1c0c1ba727c18b1b45f
49136e34-c2af-48d9-82d4-ed1804ee8efa	03221d24-92ea-4ccc-a6a2-bd88dbfcd9fb	2001_2002_East_Asia_and_Pacific_fmtrpt.tsv	Mongolia	MNG	East Asia and Pacific Region, Mongolia, International Military Education and Training (IMET), FY01	SIG OFF ADV PREP-INTER OFF		Border Troops Headquarters	1/3/01	2001-01-03	1/19/01	2001-01-19	FT GORDON GA 30905-5154	1	7040	https://2009-2017.state.gov/documents/organization/10965.pdf	Not checked against source; verify accuracy before use	2002-03	2019-07-16	70ffb9fe861e6196c99c981394e21de7
feb78ba0-60bd-44b5-bbd9-26c31734b8f9	03221d24-92ea-4ccc-a6a2-bd88dbfcd9fb	2001_2002_East_Asia_and_Pacific_fmtrpt.tsv	Mongolia	MNG	East Asia and Pacific Region, Mongolia, International Military Education and Training (IMET), FY01	SIGNAL CAPTAINS CAREER CRS		Border Troops Headquarters	1/22/01	2001-01-22	5/24/01	2001-05-24	FT GORDON GA 30905-5154	1	11369	https://2009-2017.state.gov/documents/organization/10965.pdf	Not checked against source; verify accuracy before use	2002-03	2019-07-16	a87fdd8ae50ffc5246b04cba2b97ffc1
a96eea73-7e27-445f-ae4d-94a26d6e3e71	03221d24-92ea-4ccc-a6a2-bd88dbfcd9fb	2001_2002_East_Asia_and_Pacific_fmtrpt.tsv	Mongolia	MNG	East Asia and Pacific Region, Mongolia, International Military Education and Training (IMET), FY01	SR INTERNATIONAL DEF MGT		Parliament of Mongolia	6/25/01	2001-06-25	7/20/01	2001-07-20	MONTEREY, CA 93943-5201	1	7939	https://2009-2017.state.gov/documents/organization/10965.pdf	Not checked against source; verify accuracy before use	2002-03	2019-07-16	b5f016d6b970430e16a1b236fd012d9c
2621b119-3c74-49d9-a74c-4086a42249c7	03221d24-92ea-4ccc-a6a2-bd88dbfcd9fb	2001_2002_East_Asia_and_Pacific_fmtrpt.tsv	Mongolia	MNG	East Asia and Pacific Region, Mongolia, International Military Education and Training (IMET), FY01	VET SPEC FOOD INSP (BASIC)		Central Armed Forces Hospital, Mongolia	5/7/01	2001-05-07	7/2/01	2001-07-02	FT SAM HOUSTON TX 78234-6100	1	13188	https://2009-2017.state.gov/documents/organization/10965.pdf	Not checked against source; verify accuracy before use	2002-03	2019-07-16	f8f2a4f26b85be7b6f0022f4ddb78e72
65af4147-cfd5-4ad8-8554-4ab53f6048c0	03221d24-92ea-4ccc-a6a2-bd88dbfcd9fb	2001_2002_East_Asia_and_Pacific_fmtrpt.tsv	Mongolia	MNG	DoS East Asia and Pacific Region, Mongolia, Enhanced International Peacekeeping Capabilities (EPIC), FY01	MET PEACE SUP OPS PH III		Ministry of Defense - 3 General Staff Headquarters - 17 Defense University - 2 Civil Defense Headquarters - 3 Mongolian Red Cross - 1 National Commission on Human Rights - 1 Ministry of Justice and Home Affairs - 1 Border Troops Headquarters - 1 General Police Department - 2	8/6/01	2001-08-06	8/10/01	2001-08-10	Mongolia	30	85823	https://2009-2017.state.gov/documents/organization/10965.pdf	Not checked against source; verify accuracy before use	2002-03	2019-07-16	c88795d093df5a460c2e43abb13a24e9
61944582-e613-49e1-8d84-50fcf8a78762	03221d24-92ea-4ccc-a6a2-bd88dbfcd9fb	2001_2002_East_Asia_and_Pacific_fmtrpt.tsv	Mongolia	MNG	DoS East Asia and Pacific Region, Mongolia, Asia-Pacific Center, FY01	Executive Course 01-1	U.S. military staff and faculty	Office of Natl Security Council; Institute of Strategic Studies	1/22/01	2001-01-22	4/12/01	2001-04-12	Asia-Pacific Center for Security Studies Honolulu, Hawaii	2	29316	https://2009-2017.state.gov/documents/organization/10965.pdf	Not checked against source; verify accuracy before use	2002-03	2019-07-16	023286101007c39a2c824289b1d664b6
1e66b6b1-b64b-4993-9271-86e0aa4f3c5f	03221d24-92ea-4ccc-a6a2-bd88dbfcd9fb	2001_2002_East_Asia_and_Pacific_fmtrpt.tsv	Mongolia	MNG	DoS East Asia and Pacific Region, Mongolia, Asia-Pacific Center, FY01	Executive Course 01-2	U.S. military staff and faculty	Ministry of Defense; MOFA	5/21/01	2001-05-21	8/9/01	2001-08-09	Asia-Pacific Center for Security Studies Honolulu, Hawaii	2	28506	https://2009-2017.state.gov/documents/organization/10965.pdf	Not checked against source; verify accuracy before use	2002-03	2019-07-16	fb8b2af689b2c990596c12cb6d9441b0
067f58b6-ab95-4e3c-ac7f-63872cc73ec4	03221d24-92ea-4ccc-a6a2-bd88dbfcd9fb	2001_2002_East_Asia_and_Pacific_fmtrpt.tsv	Nauru	NRU	DoS East Asia and Pacific Region, Nauru, Asia-Pacific Center, FY01	Executive Course 01-1	U.S. military staff and faculty	Police Superintendent	1/22/01	2001-01-22	4/12/01	2001-04-12	Asia-Pacific Center for Security Studies Honolulu, Hawaii	1	14559	https://2009-2017.state.gov/documents/organization/10965.pdf	Not checked against source; verify accuracy before use	2002-03	2019-07-16	fdd0f197a05ff2f8e8d1760e1b69b052
dab8c8bd-a151-438a-b243-0730869f033b	03221d24-92ea-4ccc-a6a2-bd88dbfcd9fb	2001_2002_East_Asia_and_Pacific_fmtrpt.tsv	New Zealand	NZL	DoS East Asia and Pacific Region, New Zealand, Asia-Pacific Center, FY01	Executive Course 01-1	U.S. military staff and faculty	Defence Force	1/22/01	2001-01-22	4/12/01	2001-04-12	Asia-Pacific Center for Security Studies Honolulu, Hawaii	1	942	https://2009-2017.state.gov/documents/organization/10965.pdf	Not checked against source; verify accuracy before use	2002-03	2019-07-16	14b4cb48076991cbbec36128ffbdd7e1
d90d5e33-ff9d-472c-8372-8cc051c41d9a	03221d24-92ea-4ccc-a6a2-bd88dbfcd9fb	2001_2002_East_Asia_and_Pacific_fmtrpt.tsv	New Zealand	NZL	DoS East Asia and Pacific Region, New Zealand, Asia-Pacific Center, FY01	Executive Course 01-2	U.S. military staff and faculty	Air Force	5/21/01	2001-05-21	8/9/01	2001-08-09	Asia-Pacific Center for Security Studies Honolulu, Hawaii	1	942	https://2009-2017.state.gov/documents/organization/10965.pdf	Not checked against source; verify accuracy before use	2002-03	2019-07-16	512fb208645f5cca4f77ab3c13580f46
72806112-c280-47a0-8289-75d4a010af97	03221d24-92ea-4ccc-a6a2-bd88dbfcd9fb	2001_2002_East_Asia_and_Pacific_fmtrpt.tsv	Papua New Guinea	PNG	East Asia and Pacific Region, Papua New Guinea, International Military Education and Training (IMET), FY01	ALLIED OFF PREP-INF OAC		PNG Defense Force - Army	3/12/01	2001-03-12	3/16/01	2001-03-16	FT BENNING GA 31905-5468	1	4371	https://2009-2017.state.gov/documents/organization/10965.pdf	Not checked against source; verify accuracy before use	2002-03	2019-07-16	c7fca2591fa9abf6e692fa858c11730e
4166e4b6-0fb6-4470-89f2-034c8c4641d4	03221d24-92ea-4ccc-a6a2-bd88dbfcd9fb	2001_2002_East_Asia_and_Pacific_fmtrpt.tsv	Papua New Guinea	PNG	East Asia and Pacific Region, Papua New Guinea, International Military Education and Training (IMET), FY01	INFANTRY CAPTS CAREER CRS		PNG Defense Force - Army	3/19/01	2001-03-19	7/24/01	2001-07-24	FT BENNING GA 31905-5468	1	10479	https://2009-2017.state.gov/documents/organization/10965.pdf	Not checked against source; verify accuracy before use	2002-03	2019-07-16	a153eb10a21485375ed1a906148241ae
475622eb-be67-4f2a-ae47-d7f37e3d2859	03221d24-92ea-4ccc-a6a2-bd88dbfcd9fb	2001_2002_East_Asia_and_Pacific_fmtrpt.tsv	Papua New Guinea	PNG	East Asia and Pacific Region, Papua New Guinea, International Military Education and Training (IMET), FY01	INTERNATIONAL OFFICER PREP		PNG Defense Force - Army	6/19/01	2001-06-19	7/6/01	2001-07-06	FT LEAVENWORTH KS 66027-1352	1	5269	https://2009-2017.state.gov/documents/organization/10965.pdf	Not checked against source; verify accuracy before use	2002-03	2019-07-16	1c62c062c31956a2f7492935d2d29b3d
f64532f5-6c29-43f5-9e15-d69af5e4e9f5	03221d24-92ea-4ccc-a6a2-bd88dbfcd9fb	2001_2002_East_Asia_and_Pacific_fmtrpt.tsv	Papua New Guinea	PNG	East Asia and Pacific Region, Papua New Guinea, International Military Education and Training (IMET), FY01	INTL MARITIME OFF		PNG Defense Force - Navy	1/16/01	2001-01-16	3/23/01	2001-03-23	YORKTOWN, VA 23690-5000	1	13206	https://2009-2017.state.gov/documents/organization/10965.pdf	Not checked against source; verify accuracy before use	2002-03	2019-07-16	93af4dd8a90216b807ebdb44eecc92e7
cd5c14d5-f32a-4431-a0c2-fa5aeefc8715	03221d24-92ea-4ccc-a6a2-bd88dbfcd9fb	2001_2002_East_Asia_and_Pacific_fmtrpt.tsv	Papua New Guinea	PNG	East Asia and Pacific Region, Papua New Guinea, International Military Education and Training (IMET), FY01	MET CIV-MILITARY RELATIONS		PNG Defense Force	12/4/00	2000-12-04	12/8/00	2000-12-08	Papua New Guinea	19	46677	https://2009-2017.state.gov/documents/organization/10965.pdf	Not checked against source; verify accuracy before use	2002-03	2019-07-16	273c57216df675b24a6b160fb332dd6d
7af2b716-d0d2-4f4a-aaea-cd2d64706388	03221d24-92ea-4ccc-a6a2-bd88dbfcd9fb	2001_2002_East_Asia_and_Pacific_fmtrpt.tsv	Papua New Guinea	PNG	East Asia and Pacific Region, Papua New Guinea, International Military Education and Training (IMET), FY01	MET DIILS		PNG Defense Force	5/21/01	2001-05-21	6/1/01	2001-06-01	Papua New Guinea	56	20100	https://2009-2017.state.gov/documents/organization/10965.pdf	Not checked against source; verify accuracy before use	2002-03	2019-07-16	d267b448e4743135932ef412443cbca6
9de6613a-3808-4c43-a6c7-e743356ddd8d	03221d24-92ea-4ccc-a6a2-bd88dbfcd9fb	2001_2002_East_Asia_and_Pacific_fmtrpt.tsv	Papua New Guinea	PNG	East Asia and Pacific Region, Papua New Guinea, International Military Education and Training (IMET), FY01	OAC INTL STUDENT ENGR PREP		PNG Defense Force - Army	8/6/01	2001-08-06	8/10/01	2001-08-10	FT LEONARD WOOD MO 65473-5000	1	4350	https://2009-2017.state.gov/documents/organization/10965.pdf	Not checked against source; verify accuracy before use	2002-03	2019-07-16	23f87d2cad851396d78fc22b96355ef2
3e7997ba-e87f-45d4-9a56-9205128fea05	03221d24-92ea-4ccc-a6a2-bd88dbfcd9fb	2001_2002_East_Asia_and_Pacific_fmtrpt.tsv	Papua New Guinea	PNG	East Asia and Pacific Region, Papua New Guinea, International Military Education and Training (IMET), FY01	OFFICER INDOCTRINATION SCH		PNG Defense Force - Navy	6/2/01	2001-06-02	9/27/01	2001-09-27	NEW LONDON, CT 06320-4195	1	12243	https://2009-2017.state.gov/documents/organization/10965.pdf	Not checked against source; verify accuracy before use	2002-03	2019-07-16	e3df17cd50643e3aaf34b9d22c9f29df
c4520065-c2a6-4602-873a-ee40e7176027	03221d24-92ea-4ccc-a6a2-bd88dbfcd9fb	2001_2002_East_Asia_and_Pacific_fmtrpt.tsv	Papua New Guinea	PNG	East Asia and Pacific Region, Papua New Guinea, International Military Education and Training (IMET), FY01	OJT IMOC SOUTH PACIFIC		PNG Defense Force - Navy	3/26/01	2001-03-26	3/30/01	2001-03-30	HONOLULU, HI 96850-4982	1	1540	https://2009-2017.state.gov/documents/organization/10965.pdf	Not checked against source; verify accuracy before use	2002-03	2019-07-16	b171dd5d9c38fcc293c56091af2a2974
ac43db7f-3b0d-48d1-a7d6-5654bd810481	03221d24-92ea-4ccc-a6a2-bd88dbfcd9fb	2001_2002_East_Asia_and_Pacific_fmtrpt.tsv	Papua New Guinea	PNG	East Asia and Pacific Region, Papua New Guinea, International Military Education and Training (IMET), FY01	USA C&GSC OFF PREPARATORY		PNG Defense Force - Army	7/9/01	2001-07-09	7/20/01	2001-07-20	FT LEAVENWORTH KS 66027-1352	1	1380	https://2009-2017.state.gov/documents/organization/10965.pdf	Not checked against source; verify accuracy before use	2002-03	2019-07-16	f88fca6befb0d3d113e0fe5efbc38289
32f12f50-61f8-49ed-9ab7-156435141a3c	03221d24-92ea-4ccc-a6a2-bd88dbfcd9fb	2001_2002_East_Asia_and_Pacific_fmtrpt.tsv	Papua New Guinea	PNG	DoS East Asia and Pacific Region, Papua New Guinea, Asia-Pacific Center, FY01	Executive Course 00-3	U.S. military staff and faculty	Natl Intel Org	10/2/00	2000-10-02	12/15/00	2000-12-15	Asia-Pacific Center for Security Studies Honolulu, Hawaii	1	12922	https://2009-2017.state.gov/documents/organization/10965.pdf	Not checked against source; verify accuracy before use	2002-03	2019-07-16	ad71186e4a617cbcc94407afb3c82527
73efd733-6114-4dc1-add3-3990cd37edb0	03221d24-92ea-4ccc-a6a2-bd88dbfcd9fb	2001_2002_East_Asia_and_Pacific_fmtrpt.tsv	Papua New Guinea	PNG	DoS East Asia and Pacific Region, Papua New Guinea, Asia-Pacific Center, FY01	Executive Course 01-1	U.S. military staff and faculty	Defence Force; Defence Force	1/22/01	2001-01-22	4/12/01	2001-04-12	Asia-Pacific Center for Security Studies Honolulu, Hawaii	2	28763	https://2009-2017.state.gov/documents/organization/10965.pdf	Not checked against source; verify accuracy before use	2002-03	2019-07-16	1f6b71e5f49c472ba91154ac143bf88f
e00a829e-21da-42e0-a35b-fd9ab5123d0a	03221d24-92ea-4ccc-a6a2-bd88dbfcd9fb	2001_2002_East_Asia_and_Pacific_fmtrpt.tsv	Papua New Guinea	PNG	DoS East Asia and Pacific Region, Papua New Guinea, Asia-Pacific Center, FY01	Executive Course 01-2	U.S. military staff and faculty	Natl Research Inst; Natl Intel Org	5/21/01	2001-05-21	8/9/01	2001-08-09	Asia-Pacific Center for Security Studies Honolulu, Hawaii	2	30242	https://2009-2017.state.gov/documents/organization/10965.pdf	Not checked against source; verify accuracy before use	2002-03	2019-07-16	c989fbab9f720a8ce04a51de0c52ebc3
28d9c61a-2367-47e6-8cca-1d9c963caed4	03221d24-92ea-4ccc-a6a2-bd88dbfcd9fb	2001_2002_East_Asia_and_Pacific_fmtrpt.tsv	Philippines	PHL	DoS East Asia and Pacific Region, Philippines, Non-Security Assistance, Unified Command (Note 4), FY01	JCET		PHILIPPINE FORCES: SOTG(SPECIAL OPERATIONS TRAINING GROUP OF SOCOM) (4 PERS); SCOUT RANGER TRAINING SCHOOL (8 PERS); HQ, 1ST SRR (4 PERS); 20TH SCOUT RANGER CO (12 PERS); SPECIAL FORCES SCHOOL (12 PERS); 11TH SCOUT RANGER CO, (7 PERS); 1ST SPECIAL FORCES			6/11/01	2001-06-11	FORT MAGSAYSAY,CLARK IAP,CAMP TECSONAND O'DONNELL	99		https://2009-2017.state.gov/documents/organization/10965.pdf	Not checked against source; verify accuracy before use	2002-03	2019-07-16	a602e51b4aad2d9aa68cfc25b57b799e
90f5db85-ac5e-4138-8add-60f769dd92c2	03221d24-92ea-4ccc-a6a2-bd88dbfcd9fb	2001_2002_East_Asia_and_Pacific_fmtrpt.tsv	Philippines	PHL	DoS East Asia and Pacific Region, Philippines, Non-Security Assistance, Unified Command (Note 4), FY01	JCET	NSWU-1	PHILIPPINE NAVY SPECIAL WARFARE GROUP(20)	8/6/01	2001-08-06	8/31/01	2001-08-31	SUBIC BAY, CAVITE, CLARK	20	83000	https://2009-2017.state.gov/documents/organization/10965.pdf	Not checked against source; verify accuracy before use	2002-03	2019-07-16	4982a110ee9661669d5a7548618bfab4
88f2dbcc-ef35-4daf-8912-2c63d06e2631	03221d24-92ea-4ccc-a6a2-bd88dbfcd9fb	2001_2002_East_Asia_and_Pacific_fmtrpt.tsv	Philippines	PHL	DoS East Asia and Pacific Region, Philippines, Non-Security Assistance, Unified Command (Note 4), FY01	JCET	2/1 SFG, 3/1 SFG, 353 SOG, 4 POG, 426 CA BN, 7 POG, 96 CA BN	PHILIPPINE ARMY SF CO (38), 20TH SCOUT RANGER CO (44), LIGHT ARMORED BDE (22), CIVIL AFFAIRS GROUP (14), SOCOM (21), PHILIPPINE MARINE FORCE RECON BN (3), MARINE TRAINING CENTER (2)	5/23/01	2001-05-23	6/22/01	2001-06-22	FORT MAGSAYSAY, CAMP O'DONNELL, CLARK IAP, CAVITE	144	357000	https://2009-2017.state.gov/documents/organization/10965.pdf	Not checked against source; verify accuracy before use	2002-03	2019-07-16	07272d5f4c881f15e50f5fc082946d73
3c229e0b-2d17-4c8b-9503-43e813899def	03221d24-92ea-4ccc-a6a2-bd88dbfcd9fb	2001_2002_East_Asia_and_Pacific_fmtrpt.tsv	Philippines	PHL	DoS East Asia and Pacific Region, Philippines, Non-Security Assistance, Unified Command (Note 4), FY01	JCET	1/1 SFG, 353 SOG	PHILIPPINE ARMY: SOCOM (20), SOCOM SPECIAL OPERATIONS TRAINING GROUP (4) , SFR SPECIAL FORCES SCHOOL (8), SPECIAL FORCES REGIMENT (30), 1ST SCOUT REGIMENT (30), PHILIPPINE AIR FORCE: 1ST TACTICAL OPERATIONS WING (50), 5TH FIGHTER WING (50), 710TH SPECIAL	8/20/01	2001-08-20	9/25/01	2001-09-25	FORT MAGSAYSAY, BARANGAY,CLARK AB (AIR FORCE CITY)	310	90000	https://2009-2017.state.gov/documents/organization/10965.pdf	Not checked against source; verify accuracy before use	2002-03	2019-07-16	036114b6f43f76a292b8f1b756ec55a3
e766ec53-41d1-40be-bb65-8bc012016e5e	03221d24-92ea-4ccc-a6a2-bd88dbfcd9fb	2001_2002_East_Asia_and_Pacific_fmtrpt.tsv	Philippines	PHL	DoS East Asia and Pacific Region, Philippines, International Military Education and Training (IMET), FY01	ACFT PNEUDRAU SYS SPECL		16th Attack Squadron, 15th Strike Wing, Sangley Air Base, Cavite	5/18/01	2001-05-18	7/24/01	2001-07-24	SHEPPARD AFB TX 76311-2367	1	5878	https://2009-2017.state.gov/documents/organization/10965.pdf	Not checked against source; verify accuracy before use	2002-03	2019-07-16	3be6666431a47909ac29f5bf76447e7b
41b72f9f-a963-4986-be3b-5972e6d0c258	03221d24-92ea-4ccc-a6a2-bd88dbfcd9fb	2001_2002_East_Asia_and_Pacific_fmtrpt.tsv	Philippines	PHL	DoS East Asia and Pacific Region, Philippines, International Military Education and Training (IMET), FY01	ADVANCED ENGLISH LANG PGM		Chief, Public Affairs Office, Philippine Army, Fort Bonifacio, Makati City	1/29/01	2001-01-29	5/18/01	2001-05-18	SAN ANTONIO TX 78236-5259	1	9944	https://2009-2017.state.gov/documents/organization/10965.pdf	Not checked against source; verify accuracy before use	2002-03	2019-07-16	595b042693a53d6a3c1a60957a30676d
8ec71087-1773-44f9-b81e-6ce03a0df345	03221d24-92ea-4ccc-a6a2-bd88dbfcd9fb	2001_2002_East_Asia_and_Pacific_fmtrpt.tsv	Philippines	PHL	DoS East Asia and Pacific Region, Philippines, International Military Education and Training (IMET), FY01	AEROSPACE MEDICINE PRIMARY		Office of the Director, Health Services, Philippine Air Force	3/14/01	2001-03-14	5/4/01	2001-05-04	BROOKS AFB, TX 78235-5123	1	5492	https://2009-2017.state.gov/documents/organization/10965.pdf	Not checked against source; verify accuracy before use	2002-03	2019-07-16	7ce4ed1d4105552c119ee7cee4a85b7b
2b6f69c4-2411-4088-a1ac-e48574c36275	03221d24-92ea-4ccc-a6a2-bd88dbfcd9fb	2001_2002_East_Asia_and_Pacific_fmtrpt.tsv	Philippines	PHL	DoS East Asia and Pacific Region, Philippines, International Military Education and Training (IMET), FY01	AIRCRAFT ELECTRICIAN RPR		6th Tactical Fighter Squadron, PAF	4/16/01	2001-04-16	8/29/01	2001-08-29	FT EUSTIS VA 23604-5361	1	8871	https://2009-2017.state.gov/documents/organization/10965.pdf	Not checked against source; verify accuracy before use	2002-03	2019-07-16	c62c5d921cc30c76079392f1855fd241
d0da66cc-39d8-4871-b380-7726d9216147	03221d24-92ea-4ccc-a6a2-bd88dbfcd9fb	2001_2002_East_Asia_and_Pacific_fmtrpt.tsv	Philippines	PHL	DoS East Asia and Pacific Region, Philippines, International Military Education and Training (IMET), FY01	AIRCRAFT MAINTENANCE OFF		6th Tactical Fighter Squadron	1/4/01	2001-01-04	4/13/01	2001-04-13	SHEPPARD AFB TX 76311-2367	1	8060	https://2009-2017.state.gov/documents/organization/10965.pdf	Not checked against source; verify accuracy before use	2002-03	2019-07-16	6ad41045c0e0e08a9c8fb06cce161c3b
48a7cecb-4c3a-4c0b-83e3-4a0a24bd1a41	03221d24-92ea-4ccc-a6a2-bd88dbfcd9fb	2001_2002_East_Asia_and_Pacific_fmtrpt.tsv	Philippines	PHL	DoS East Asia and Pacific Region, Philippines, International Military Education and Training (IMET), FY01	AIRCRAFT STRUCTURAL RPR		452nd FDMS, 205th TOW, VAB, Pasay City	4/16/01	2001-04-16	7/27/01	2001-07-27	FT EUSTIS VA 23604-5361	1	7707	https://2009-2017.state.gov/documents/organization/10965.pdf	Not checked against source; verify accuracy before use	2002-03	2019-07-16	846f610e68ad864dafba1937b056fc32
f7eec1f2-a709-49ad-bd96-5d809629597a	03221d24-92ea-4ccc-a6a2-bd88dbfcd9fb	2001_2002_East_Asia_and_Pacific_fmtrpt.tsv	Philippines	PHL	DoS East Asia and Pacific Region, Philippines, International Military Education and Training (IMET), FY01	AIRCREW EGRESS SYS APPR		Air Force	2/23/01	2001-02-23	4/9/01	2001-04-09	SHEPPARD AFB TX 76311-2367	1	280	https://2009-2017.state.gov/documents/organization/10965.pdf	Not checked against source; verify accuracy before use	2002-03	2019-07-16	9f2e6bdd6dd538d25eb09e29f4e6b6a9
02eaeeed-04f5-4a68-bcd3-9d0d4869910e	03221d24-92ea-4ccc-a6a2-bd88dbfcd9fb	2001_2002_East_Asia_and_Pacific_fmtrpt.tsv	Philippines	PHL	DoS East Asia and Pacific Region, Philippines, International Military Education and Training (IMET), FY01	AIRCREW LIFE SPT APR		Air Force	1/25/01	2001-01-25	3/12/01	2001-03-12	SHEPPARD AFB TX 76311-2367	1	280	https://2009-2017.state.gov/documents/organization/10965.pdf	Not checked against source; verify accuracy before use	2002-03	2019-07-16	f287b98bc8420391a067dcab3f03a27b
3bf6d180-405e-42d1-9e93-c14e4008cd19	03221d24-92ea-4ccc-a6a2-bd88dbfcd9fb	2001_2002_East_Asia_and_Pacific_fmtrpt.tsv	Philippines	PHL	DoS East Asia and Pacific Region, Philippines, International Military Education and Training (IMET), FY01	ALLIED OFF PREP-INF OAC		Scout Ranger Training Sch, FSRR, SOCOM, PA, Sn Miguel, Bulacan	7/30/01	2001-07-30	8/3/01	2001-08-03	FT BENNING GA 31905-5468	1	3243	https://2009-2017.state.gov/documents/organization/10965.pdf	Not checked against source; verify accuracy before use	2002-03	2019-07-16	db3c285fb6fbd33bdb4e69c886f187fa
6acbf849-cd08-4327-97a7-8fc0b799eb8b	03221d24-92ea-4ccc-a6a2-bd88dbfcd9fb	2001_2002_East_Asia_and_Pacific_fmtrpt.tsv	Philippines	PHL	DoS East Asia and Pacific Region, Philippines, International Military Education and Training (IMET), FY01	AMMUNITION SPECIALIST		Office of the Deputy Chief of Staff for Logistics	5/7/01	2001-05-07	7/19/01	2001-07-19	REDSTONE ARS AL 35897-6400	1	7603	https://2009-2017.state.gov/documents/organization/10965.pdf	Not checked against source; verify accuracy before use	2002-03	2019-07-16	2c58167e7bf64ad8e92bcc5bb822e875
55718e81-901b-42b3-96e0-f0a21c451fb2	03221d24-92ea-4ccc-a6a2-bd88dbfcd9fb	2001_2002_East_Asia_and_Pacific_fmtrpt.tsv	Philippines	PHL	DoS East Asia and Pacific Region, Philippines, International Military Education and Training (IMET), FY01	AMPHIB PLAN SR OFF-INTL		ACofS for CMO & EM, MC7, Philippine Marines	2/26/01	2001-02-26	5/4/01	2001-05-04	SAN DIEGO, CA 92155-5099	1	7936	https://2009-2017.state.gov/documents/organization/10965.pdf	Not checked against source; verify accuracy before use	2002-03	2019-07-16	e3b77ce21f1d4e2be3eda1bafd257208
a4937064-7021-454a-837c-87d6cdeec41b	03221d24-92ea-4ccc-a6a2-bd88dbfcd9fb	2001_2002_East_Asia_and_Pacific_fmtrpt.tsv	Philippines	PHL	DoS East Asia and Pacific Region, Philippines, International Military Education and Training (IMET), FY01	ARMAMENT REPAIRER		Hqs & Hqs Spt Grp duty Office of the Chief, Odrnance, Philippine Army	12/5/00	2000-12-05	4/27/01	2001-04-27	APG MD 21005-5299	1	12671	https://2009-2017.state.gov/documents/organization/10965.pdf	Not checked against source; verify accuracy before use	2002-03	2019-07-16	2d3f0bfd87c3a0dc9f6573aaf5f787e1
0d152d34-b58f-43c7-a591-4fbd64ab1fde	03221d24-92ea-4ccc-a6a2-bd88dbfcd9fb	2001_2002_East_Asia_and_Pacific_fmtrpt.tsv	Philippines	PHL	DoS East Asia and Pacific Region, Philippines, International Military Education and Training (IMET), FY01	ARMOR CAPTAINS CAREER		Hqs Service Support Group, Philippine Navy	1/22/01	2001-01-22	5/25/01	2001-05-25	FT KNOX KY 40121-5234	1	10840	https://2009-2017.state.gov/documents/organization/10965.pdf	Not checked against source; verify accuracy before use	2002-03	2019-07-16	4cca0325dd96a946532cb5702fa6b080
dc89c1ca-0a5c-4ad3-ba09-3cb87d37199c	03221d24-92ea-4ccc-a6a2-bd88dbfcd9fb	2001_2002_East_Asia_and_Pacific_fmtrpt.tsv	Philippines	PHL	DoS East Asia and Pacific Region, Philippines, International Military Education and Training (IMET), FY01	ARMOR CAPTAINS CAREER		Hqs & Hqs Support Group duty OG6, PA, Fort Bonifacio, Makati City	1/22/01	2001-01-22	5/25/01	2001-05-25	FT KNOX KY 40121-5234	1	13204	https://2009-2017.state.gov/documents/organization/10965.pdf	Not checked against source; verify accuracy before use	2002-03	2019-07-16	200676e176abd86bc6eb810e5403e6e8
a9615069-c90a-4440-b764-2e7c71390f48	03221d24-92ea-4ccc-a6a2-bd88dbfcd9fb	2001_2002_East_Asia_and_Pacific_fmtrpt.tsv	Philippines	PHL	DoS East Asia and Pacific Region, Philippines, International Military Education and Training (IMET), FY01	ARMOR CPT CAREER CRS PREP		Hqs Service Support Group, Philippine Navy	1/8/01	2001-01-08	1/19/01	2001-01-19	FT KNOX KY 40121-5234	1	4841	https://2009-2017.state.gov/documents/organization/10965.pdf	Not checked against source; verify accuracy before use	2002-03	2019-07-16	2e13b4e409b5c389f2a841441a687c98
0fea2351-b24c-4021-a275-c481166a2ac2	03221d24-92ea-4ccc-a6a2-bd88dbfcd9fb	2001_2002_East_Asia_and_Pacific_fmtrpt.tsv	Philippines	PHL	DoS East Asia and Pacific Region, Philippines, International Military Education and Training (IMET), FY01	ARMOR CPT CAREER CRS PREP		Hqs & Hqs Support Group duty OG6, PA, Fort Bonifacio, Makati City	1/8/01	2001-01-08	1/19/01	2001-01-19	FT KNOX KY 40121-5234	1	4841	https://2009-2017.state.gov/documents/organization/10965.pdf	Not checked against source; verify accuracy before use	2002-03	2019-07-16	712a432cfb578f0614a9a22b946e55f4
d185ffae-d9a0-4616-9390-8c24fa537688	03221d24-92ea-4ccc-a6a2-bd88dbfcd9fb	2001_2002_East_Asia_and_Pacific_fmtrpt.tsv	Philippines	PHL	DoS East Asia and Pacific Region, Philippines, International Military Education and Training (IMET), FY01	AVIATION CAPTAINS CAREER		Aviation Battalion, Light Armor Brigade, Philippine Army	1/17/01	2001-01-17	5/24/01	2001-05-24	FT RUCKER AL 36362-5000	1	12092	https://2009-2017.state.gov/documents/organization/10965.pdf	Not checked against source; verify accuracy before use	2002-03	2019-07-16	0471e88531d9d65977753ac7d5fadd9e
0cce1238-7f23-4ac5-91f7-6c0ff32ebc2e	03221d24-92ea-4ccc-a6a2-bd88dbfcd9fb	2001_2002_East_Asia_and_Pacific_fmtrpt.tsv	Philippines	PHL	DoS East Asia and Pacific Region, Philippines, International Military Education and Training (IMET), FY01	AVIATION SAFETY OFFICER		Phil Air Force Flying School, Lipa City, Batangas	3/12/01	2001-03-12	4/20/01	2001-04-20	FT RUCKER AL 36362	1	6099	https://2009-2017.state.gov/documents/organization/10965.pdf	Not checked against source; verify accuracy before use	2002-03	2019-07-16	a7cc20790088200f22c17c1199540428
b0874c2d-b7d3-4309-a997-fd2067c9d977	03221d24-92ea-4ccc-a6a2-bd88dbfcd9fb	2001_2002_East_Asia_and_Pacific_fmtrpt.tsv	Philippines	PHL	East Asia and Pacific Region, Philippines, International Military Education and Training (IMET), FY01	BASIC INSTRUCTOR COURSE		ODCSforOperations, J3, Cp Aguinaldo, Quezon City	4/2/01	2001-04-02	5/4/01	2001-05-04	KEESLER AFB, MS 39534-2354	1	1834	https://2009-2017.state.gov/documents/organization/10965.pdf	Not checked against source; verify accuracy before use	2002-03	2019-07-16	b2780a6f2599c0ad3310b93bea2cab8e
cd2b0f62-a987-49c0-bf88-4d61f4240486	03221d24-92ea-4ccc-a6a2-bd88dbfcd9fb	2001_2002_East_Asia_and_Pacific_fmtrpt.tsv	Philippines	PHL	East Asia and Pacific Region, Philippines, International Military Education and Training (IMET), FY01	BASIC MANPOWER & QUAL MGT		Hqs & Hqs Support Group dy OG1, PA	2/5/01	2001-02-05	3/23/01	2001-03-23	KEESLER AFB, MS 39534-2354	1	5312	https://2009-2017.state.gov/documents/organization/10965.pdf	Not checked against source; verify accuracy before use	2002-03	2019-07-16	4d244fe5b235633b6d521ebde05a39e2
fb8d6cb4-3a40-4b19-bace-a09378e0db4b	03221d24-92ea-4ccc-a6a2-bd88dbfcd9fb	2001_2002_East_Asia_and_Pacific_fmtrpt.tsv	Philippines	PHL	East Asia and Pacific Region, Philippines, International Military Education and Training (IMET), FY01	BASIC MANPOWER & QUAL MGT		OSJS, AFP, Camp Aguinaldo, Quezon City	2/5/01	2001-02-05	3/23/01	2001-03-23	KEESLER AFB, MS 39534-2354	1	5390	https://2009-2017.state.gov/documents/organization/10965.pdf	Not checked against source; verify accuracy before use	2002-03	2019-07-16	1b69de16530d4982cce6411ae6b270a7
822b810e-3af3-41bf-ab88-4332a7ac35ff	03221d24-92ea-4ccc-a6a2-bd88dbfcd9fb	2001_2002_East_Asia_and_Pacific_fmtrpt.tsv	Philippines	PHL	East Asia and Pacific Region, Philippines, International Military Education and Training (IMET), FY01	BOARDING OFFICER EIMET		Air Force	2/20/01	2001-02-20	3/23/01	2001-03-23	YORKTOWN, VA 23690-5000	1	772	https://2009-2017.state.gov/documents/organization/10965.pdf	Not checked against source; verify accuracy before use	2002-03	2019-07-16	a7e830584180615fc84fbc0fa168412e
a7c1d68b-cd74-4521-96c1-a950c1489dd4	03221d24-92ea-4ccc-a6a2-bd88dbfcd9fb	2001_2002_East_Asia_and_Pacific_fmtrpt.tsv	Philippines	PHL	East Asia and Pacific Region, Philippines, International Military Education and Training (IMET), FY01	CIVIL AFFAIRS		Air Force Civil Relation Center, Jesus Villamor Air Base, Pasay City	2/12/01	2001-02-12	3/16/01	2001-03-16	FT BRAGG NC 28310	1	2899	https://2009-2017.state.gov/documents/organization/10965.pdf	Not checked against source; verify accuracy before use	2002-03	2019-07-16	01cd2ad9f9df3a4bb23c26916cfb34b1
3911dbda-3426-4543-a386-e0332e8dfd2f	03221d24-92ea-4ccc-a6a2-bd88dbfcd9fb	2001_2002_East_Asia_and_Pacific_fmtrpt.tsv	Philippines	PHL	East Asia and Pacific Region, Philippines, International Military Education and Training (IMET), FY01	CIVIL AFFAIRS		Naval Intelligence Security Force, Fort Bonifacio, Makati City, Philippines	2/12/01	2001-02-12	3/16/01	2001-03-16	FT BRAGG NC 28310	1	2936	https://2009-2017.state.gov/documents/organization/10965.pdf	Not checked against source; verify accuracy before use	2002-03	2019-07-16	3eac755f346fac504149353863ae5caf
3569038b-ea9b-49b6-b11e-f0d2808f594c	03221d24-92ea-4ccc-a6a2-bd88dbfcd9fb	2001_2002_East_Asia_and_Pacific_fmtrpt.tsv	Philippines	PHL	East Asia and Pacific Region, Philippines, International Military Education and Training (IMET), FY01	CIVIL AFFAIRS		Intel Div, GHQ & HSC, Camp Gen Emilio Aguinaldo, Quezon City	7/23/01	2001-07-23	8/22/01	2001-08-22	FT BRAGG NC 28310	1	2848	https://2009-2017.state.gov/documents/organization/10965.pdf	Not checked against source; verify accuracy before use	2002-03	2019-07-16	37962d5e4747e88bea5d939d0341eb70
57c898c8-295e-436f-90a0-87bc8cf68be0	03221d24-92ea-4ccc-a6a2-bd88dbfcd9fb	2001_2002_East_Asia_and_Pacific_fmtrpt.tsv	Philippines	PHL	East Asia and Pacific Region, Philippines, International Military Education and Training (IMET), FY01	COMB STRAT INTEL TNG PRGM		Office of the Assistant Chief of Staff for Intelligence, G2, Phil Army	7/9/01	2001-07-09	8/24/01	2001-08-24	WASHINGTON DC 20340-5100	1	7771	https://2009-2017.state.gov/documents/organization/10965.pdf	Not checked against source; verify accuracy before use	2002-03	2019-07-16	b1c08a89588ed5e8197e77a04eda6b1e
5c9250f1-45b0-43db-856a-c12e8fd7405d	03221d24-92ea-4ccc-a6a2-bd88dbfcd9fb	2001_2002_East_Asia_and_Pacific_fmtrpt.tsv	Philippines	PHL	East Asia and Pacific Region, Philippines, International Military Education and Training (IMET), FY01	COMM & INFO OFFICER (BCOT)		AC of Air Staff for Commel, A11, HPAF, Villamor Air Base, pasay City	10/2/00	2000-10-02	1/12/01	2001-01-12	KEESLER AFB, MS 39534-2354	1	6351	https://2009-2017.state.gov/documents/organization/10965.pdf	Not checked against source; verify accuracy before use	2002-03	2019-07-16	111e28bc3da2df70fb586cce17c5c431
013b38ab-40de-4a3d-8b0a-23d2d7ed02f6	03221d24-92ea-4ccc-a6a2-bd88dbfcd9fb	2001_2002_East_Asia_and_Pacific_fmtrpt.tsv	Philippines	PHL	East Asia and Pacific Region, Philippines, International Military Education and Training (IMET), FY01	COMMUNICATION INFO SYS OFR		Pilot PN 310, Naval Air Defense, Philippine Navy	4/9/01	2001-04-09	9/14/01	2001-09-14	QUANTICO, VA 22134	1	10915	https://2009-2017.state.gov/documents/organization/10965.pdf	Not checked against source; verify accuracy before use	2002-03	2019-07-16	561eca05d058f30d5c5bd10b53571a70
33b58673-6a49-4bf6-8648-2fc0328cca01	03221d24-92ea-4ccc-a6a2-bd88dbfcd9fb	2001_2002_East_Asia_and_Pacific_fmtrpt.tsv	Philippines	PHL	East Asia and Pacific Region, Philippines, International Military Education and Training (IMET), FY01	COMPUTER/AUTOMATION SYS		Army Management Information	11/6/00	2000-11-06	2/22/01	2001-02-22	FT GORDON GA 30905-5154	1	9248	https://2009-2017.state.gov/documents/organization/10965.pdf	Not checked against source; verify accuracy before use	2002-03	2019-07-16	3c7abab127a08e0c438e9c90a057dd17
46c00596-7557-450e-bc44-95d6ba319279	03221d24-92ea-4ccc-a6a2-bd88dbfcd9fb	2001_2002_East_Asia_and_Pacific_fmtrpt.tsv	Philippines	PHL	East Asia and Pacific Region, Philippines, International Military Education and Training (IMET), FY01	RP		Center, Philippine Army								https://2009-2017.state.gov/documents/organization/10965.pdf	Not checked against source; verify accuracy before use	2002-03	2019-07-16	85efb07cca2930502712164f183b7c0d
f085ba20-d56e-4bd6-a621-8a14adba9e5d	03221d24-92ea-4ccc-a6a2-bd88dbfcd9fb	2001_2002_East_Asia_and_Pacific_fmtrpt.tsv	Philippines	PHL	East Asia and Pacific Region, Philippines, International Military Education and Training (IMET), FY01	DEF RES MGT CRS		OTDCS for Opns, J3, GHQ, Armed Forces of the Philippines, Cp Aguinaldo, QC	7/23/01	2001-07-23	8/16/01	2001-08-16	MONTEREY, CA 93943-5201	1	7478	https://2009-2017.state.gov/documents/organization/10965.pdf	Not checked against source; verify accuracy before use	2002-03	2019-07-16	ffc48e70c09077335a708440d11dd995
ade57233-02fe-4894-826d-c5dadd1703bb	03221d24-92ea-4ccc-a6a2-bd88dbfcd9fb	2001_2002_East_Asia_and_Pacific_fmtrpt.tsv	Philippines	PHL	East Asia and Pacific Region, Philippines, International Military Education and Training (IMET), FY01	DEF RES MGT CRS		Headquarters Service Support Group, HPAF, OA-8	4/23/01	2001-04-23	5/17/01	2001-05-17	MONTEREY, CA 93943-5201	1	7478	https://2009-2017.state.gov/documents/organization/10965.pdf	Not checked against source; verify accuracy before use	2002-03	2019-07-16	2ae477ae705958084ce7b7bc9b9548fe
fd21c832-5869-428a-9f57-617e0444fbb1	03221d24-92ea-4ccc-a6a2-bd88dbfcd9fb	2001_2002_East_Asia_and_Pacific_fmtrpt.tsv	Philippines	PHL	East Asia and Pacific Region, Philippines, International Military Education and Training (IMET), FY01	DEF RES MGT CRS		AFP Logistics Command, Camp Aguinaldo, Quezon City	8/20/01	2001-08-20	9/14/01	2001-09-14	MONTEREY, CA 93943-5201	1	7022	https://2009-2017.state.gov/documents/organization/10965.pdf	Not checked against source; verify accuracy before use	2002-03	2019-07-16	78ec1d9217c7a30df39a96202fd6ef47
c8a8b837-f429-42c4-885e-fa5c16dfeb41	03221d24-92ea-4ccc-a6a2-bd88dbfcd9fb	2001_2002_East_Asia_and_Pacific_fmtrpt.tsv	Philippines	PHL	East Asia and Pacific Region, Philippines, International Military Education and Training (IMET), FY01	DEF RES MGT CRS		Liaison Office for Legislative Affairs	7/23/01	2001-07-23	8/16/01	2001-08-16	MONTEREY, CA 93943-5201	1	2051	https://2009-2017.state.gov/documents/organization/10965.pdf	Not checked against source; verify accuracy before use	2002-03	2019-07-16	6633e8a12e89325c49d2e24856fbafe0
d60b8b8d-9749-494e-9d7d-8eb4d7b94639	03221d24-92ea-4ccc-a6a2-bd88dbfcd9fb	2001_2002_East_Asia_and_Pacific_fmtrpt.tsv	Philippines	PHL	East Asia and Pacific Region, Philippines, International Military Education and Training (IMET), FY01	ENGINEER OFF CPT CAREER		Waterfront, Dredge Company, BNS, Ft Bonifacio, Makati City	3/19/01	2001-03-19	7/24/01	2001-07-24	FT LEONARD WOOD MO 65473-5000	1	11251	https://2009-2017.state.gov/documents/organization/10965.pdf	Not checked against source; verify accuracy before use	2002-03	2019-07-16	37cbae5498db361c890852ace13ec9ab
ca89fc2d-aeeb-4c0a-87b2-88f9332fdc21	03221d24-92ea-4ccc-a6a2-bd88dbfcd9fb	2001_2002_East_Asia_and_Pacific_fmtrpt.tsv	Philippines	PHL	East Asia and Pacific Region, Philippines, International Military Education and Training (IMET), FY01	ENGINEER OFF CPT CAREER		Air Logistics & Support Command, 355th Avn Engr'g Wing, Basa Air Base, Pampanga	3/19/01	2001-03-19	7/24/01	2001-07-24	FT LEONARD WOOD MO 65473-5000	1	11251	https://2009-2017.state.gov/documents/organization/10965.pdf	Not checked against source; verify accuracy before use	2002-03	2019-07-16	c86b9fb6e794e3df13a402c16c56d052
cd4613a2-0ba9-41b0-b245-31a819e5632e	03221d24-92ea-4ccc-a6a2-bd88dbfcd9fb	2001_2002_East_Asia_and_Pacific_fmtrpt.tsv	Philippines	PHL	East Asia and Pacific Region, Philippines, International Military Education and Training (IMET), FY01	EW OFFICER INTL		Technical Intelligence Group, Naval Intelligence Security Force, Bonifacio Naval Station, Ft Bonifacio, Makati City, Philippines	4/2/01	2001-04-02	4/20/01	2001-04-20	VIRGINIA BEACH, VA 23461-2098	1	4529	https://2009-2017.state.gov/documents/organization/10965.pdf	Not checked against source; verify accuracy before use	2002-03	2019-07-16	5f14284e1e928d4e09e318a66d0ec092
a53e4c38-63cf-4f2b-ae49-faf324b30ae9	03221d24-92ea-4ccc-a6a2-bd88dbfcd9fb	2001_2002_East_Asia_and_Pacific_fmtrpt.tsv	Philippines	PHL	East Asia and Pacific Region, Philippines, International Military Education and Training (IMET), FY01	FA OFF ADV PREP-ALLIED OFF		10th FA Bn, 4ID, Phil Army	4/12/01	2001-04-12	5/4/01	2001-05-04	FT SILL OK 73503	1	5266	https://2009-2017.state.gov/documents/organization/10965.pdf	Not checked against source; verify accuracy before use	2002-03	2019-07-16	ef1c961e77a046441b4e198f0f2996fb
a5c2ce63-7446-4ae8-978f-452a6ca03ee2	03221d24-92ea-4ccc-a6a2-bd88dbfcd9fb	2001_2002_East_Asia_and_Pacific_fmtrpt.tsv	Philippines	PHL	East Asia and Pacific Region, Philippines, International Military Education and Training (IMET), FY01	FA WEAPONS MAINT		OrdChem Dept, Cbt Svc Spt Schl, Training Doctrines, PA, Ft Magsaya, Nueva Ecija, Philippines	9/10/01	2001-09-10	9/28/01	2001-09-28	FT SILL OK 73503	1	2461	https://2009-2017.state.gov/documents/organization/10965.pdf	Not checked against source; verify accuracy before use	2002-03	2019-07-16	077a4532184da0e5e488e6f735046f51
5f025df0-c8e2-4a53-8393-4268a5ad4140	03221d24-92ea-4ccc-a6a2-bd88dbfcd9fb	2001_2002_East_Asia_and_Pacific_fmtrpt.tsv	Philippines	PHL	East Asia and Pacific Region, Philippines, International Military Education and Training (IMET), FY01	FIELD ARTY CAPTAINS CAREER		10th FA Bn, 4ID, Phil Army	5/8/01	2001-05-08	9/13/01	2001-09-13	FT SILL OK 73503	1	11815	https://2009-2017.state.gov/documents/organization/10965.pdf	Not checked against source; verify accuracy before use	2002-03	2019-07-16	824ac034c01e6da8a26765e8553e6bfc
75691378-3850-40b2-84a6-e13f9db7d931	03221d24-92ea-4ccc-a6a2-bd88dbfcd9fb	2001_2002_East_Asia_and_Pacific_fmtrpt.tsv	Philippines	PHL	East Asia and Pacific Region, Philippines, International Military Education and Training (IMET), FY01	INFO SYSTEMS ADMINISTRATOR		Recruit Training Unit, Naval Education & Training Command, Zambales	7/30/01	2001-07-30	9/24/01	2001-09-24	PENSACOLA, FL 32511-5138	1	6882	https://2009-2017.state.gov/documents/organization/10965.pdf	Not checked against source; verify accuracy before use	2002-03	2019-07-16	95abaf37b370fd249695fdbdfb6f47a2
8c8670c1-3ed8-4477-a8b3-19ef3b0f928d	03221d24-92ea-4ccc-a6a2-bd88dbfcd9fb	2001_2002_East_Asia_and_Pacific_fmtrpt.tsv	Philippines	PHL	East Asia and Pacific Region, Philippines, International Military Education and Training (IMET), FY01	INFO SYSTEMS OPER-ANALYST		Hqs & Hqs Support Group dy OG8, PA, Ft Bonifacio, Makati City	3/19/01	2001-03-19	7/19/01	2001-07-19	FT GORDON GA 30905-5154	1	10183	https://2009-2017.state.gov/documents/organization/10965.pdf	Not checked against source; verify accuracy before use	2002-03	2019-07-16	0079cbf0891a92dbc025e05a43b78ad5
fc721a62-2ea5-4520-9110-53cceefbe088	03221d24-92ea-4ccc-a6a2-bd88dbfcd9fb	2001_2002_East_Asia_and_Pacific_fmtrpt.tsv	Philippines	PHL	East Asia and Pacific Region, Philippines, International Military Education and Training (IMET), FY01	INFO SYSTEMS OPER-ANALYST		Philippine Military Academy	5/14/01	2001-05-14	9/14/01	2001-09-14	FT GORDON GA 30905-5154	1	10222	https://2009-2017.state.gov/documents/organization/10965.pdf	Not checked against source; verify accuracy before use	2002-03	2019-07-16	e30c3cb210145cb92a3730e865894027
238fec92-4b26-4aa7-a65c-62fe964c349d	03221d24-92ea-4ccc-a6a2-bd88dbfcd9fb	2001_2002_East_Asia_and_Pacific_fmtrpt.tsv	Philippines	PHL	East Asia and Pacific Region, Philippines, International Military Education and Training (IMET), FY01	INFORMATION SYSTEMS MGT		Commander, 11th ISU, Intelligence Service Group, PA	1/4/01	2001-01-04	5/23/01	2001-05-23	FT GORDON GA 30905-5154	1	11273	https://2009-2017.state.gov/documents/organization/10965.pdf	Not checked against source; verify accuracy before use	2002-03	2019-07-16	1b533a83f276d8e0a3caf5a8f25fd69b
cb6d7c14-2297-40ad-9110-e716dc80abe2	03221d24-92ea-4ccc-a6a2-bd88dbfcd9fb	2001_2002_East_Asia_and_Pacific_fmtrpt.tsv	Philippines	PHL	East Asia and Pacific Region, Philippines, International Military Education and Training (IMET), FY01	INFORMATION SYSTEMS MGT		Hqs Naval Intelligence Security Force, Philippine Navy	1/4/01	2001-01-04	5/23/01	2001-05-23	FT GORDON GA 30905-5154	1	13373	https://2009-2017.state.gov/documents/organization/10965.pdf	Not checked against source; verify accuracy before use	2002-03	2019-07-16	fb70677842f8116b63a96d87931288cb
55457ddb-c0c1-415a-bd12-2cb20f1b5def	03221d24-92ea-4ccc-a6a2-bd88dbfcd9fb	2001_2002_East_Asia_and_Pacific_fmtrpt.tsv	Philippines	PHL	East Asia and Pacific Region, Philippines, International Military Education and Training (IMET), FY01	INSTRUCTOR TRAINING COURSE		Reserve Command, Philippine Army, Tanza, Cavite, Philippines	9/10/01	2001-09-10	9/26/01	2001-09-26	FT LEE VA 23801-1509	1	3027	https://2009-2017.state.gov/documents/organization/10965.pdf	Not checked against source; verify accuracy before use	2002-03	2019-07-16	470fa7cf80975e6bce1134f8a39ba5fa
f18759a7-5634-4f96-890b-8e25733fca95	03221d24-92ea-4ccc-a6a2-bd88dbfcd9fb	2001_2002_East_Asia_and_Pacific_fmtrpt.tsv	Philippines	PHL	East Asia and Pacific Region, Philippines, International Military Education and Training (IMET), FY01	INT OFFICER INTEL ADVANCE		Intelligence Services, AFP, Cp Aguinaldo Q.C.	1/18/01	2001-01-18	5/4/01	2001-05-04	FT HUACHUCA AZ 85613-7000	1	16916	https://2009-2017.state.gov/documents/organization/10965.pdf	Not checked against source; verify accuracy before use	2002-03	2019-07-16	6743b688c8fe42d30a08b18b760ae7e1
82271010-ca2a-4f26-a0e1-90d5a1e3b381	03221d24-92ea-4ccc-a6a2-bd88dbfcd9fb	2001_2002_East_Asia_and_Pacific_fmtrpt.tsv	Philippines	PHL	East Asia and Pacific Region, Philippines, International Military Education and Training (IMET), FY01	INT OFFICER INTEL ADVANCE		3rd Intelligence Security Unit, Intelligence Security Group, Philppine Army	3/22/01	2001-03-22	7/6/01	2001-07-06	FT HUACHUCA AZ 85613-7000	1	16916	https://2009-2017.state.gov/documents/organization/10965.pdf	Not checked against source; verify accuracy before use	2002-03	2019-07-16	0232d797a3f4ae0ac042c2c3597da364
269a8241-8394-425e-bdca-918758ba48ba	03221d24-92ea-4ccc-a6a2-bd88dbfcd9fb	2001_2002_East_Asia_and_Pacific_fmtrpt.tsv	Philippines	PHL	East Asia and Pacific Region, Philippines, International Military Education and Training (IMET), FY01	INTERNATIONAL OFF LOG PREP		Deputy Chief of Staff for Logistics, OJ4	7/30/01	2001-07-30	8/10/01	2001-08-10	FT LEE VA 23801-1705	1	2422	https://2009-2017.state.gov/documents/organization/10965.pdf	Not checked against source; verify accuracy before use	2002-03	2019-07-16	7a482284f80c2bd8ca2544de6ac45c7e
926e3b8f-be98-4b00-9877-bb582c6d6afb	03221d24-92ea-4ccc-a6a2-bd88dbfcd9fb	2001_2002_East_Asia_and_Pacific_fmtrpt.tsv	Philippines	PHL	East Asia and Pacific Region, Philippines, International Military Education and Training (IMET), FY01	INTERNATIONAL OFFICER PREP		Headquarters & Headquarters Support Group, PA dy Office of the Asst Chief of Staff for Operations, G3, Fort Bonifacio, Makati City	6/19/01	2001-06-19	7/6/01	2001-07-06	FT LEAVENWORTH KS 66027-1352	1	4561	https://2009-2017.state.gov/documents/organization/10965.pdf	Not checked against source; verify accuracy before use	2002-03	2019-07-16	eadcbbf57724567ddbaa74a982a7b4ac
03df9d4f-cdb6-405d-8ea2-51f45b1ae57b	03221d24-92ea-4ccc-a6a2-bd88dbfcd9fb	2001_2002_East_Asia_and_Pacific_fmtrpt.tsv	Philippines	PHL	East Asia and Pacific Region, Philippines, International Military Education and Training (IMET), FY01	INTL OFF SCH & SOS		Office of Special Studies, Headquarters Philippine Air Force	1/8/01	2001-01-08	3/31/01	2001-03-31	MAXWELL AFB, AL 36112-6323	1	12411	https://2009-2017.state.gov/documents/organization/10965.pdf	Not checked against source; verify accuracy before use	2002-03	2019-07-16	8643e10083fb0218ea5fb44b6105c653
4b8dd381-c8ec-4430-b7c0-aff6835b35d3	03221d24-92ea-4ccc-a6a2-bd88dbfcd9fb	2001_2002_East_Asia_and_Pacific_fmtrpt.tsv	Philippines	PHL	East Asia and Pacific Region, Philippines, International Military Education and Training (IMET), FY01	INTL OFF SCH & SOS		16th Attack Squadron, 15th Strike wing	1/8/01	2001-01-08	3/31/01	2001-03-31	MAXWELL AFB, AL 36112-6323	1	12411	https://2009-2017.state.gov/documents/organization/10965.pdf	Not checked against source; verify accuracy before use	2002-03	2019-07-16	375df51674bdfdce4c6fe965fce5278b
1a313580-ad2e-4470-a109-81086bd339f1	03221d24-92ea-4ccc-a6a2-bd88dbfcd9fb	2001_2002_East_Asia_and_Pacific_fmtrpt.tsv	Philippines	PHL	East Asia and Pacific Region, Philippines, International Military Education and Training (IMET), FY01	INTL OFF SCH (FOR AC&SC)		Office of the Assistant Chief of Air Staff for Logistics, A-4	6/18/01	2001-06-18	7/27/01	2001-07-27	MAXWELL AFB, AL 36112-6323	1	10136	https://2009-2017.state.gov/documents/organization/10965.pdf	Not checked against source; verify accuracy before use	2002-03	2019-07-16	69f7f3c11f3270f51cee1388ffcb5544
8e8cd273-4d10-4428-886f-6f65dcdea861	03221d24-92ea-4ccc-a6a2-bd88dbfcd9fb	2001_2002_East_Asia_and_Pacific_fmtrpt.tsv	Philippines	PHL	East Asia and Pacific Region, Philippines, International Military Education and Training (IMET), FY01	INTL OFF SCH (FOR AWC)		250th Presidential Airlift Wing, Villamor Air Base, Pasay City	6/11/01	2001-06-11	7/20/01	2001-07-20	MAXWELL AFB, AL 36112-6323	1	10246	https://2009-2017.state.gov/documents/organization/10965.pdf	Not checked against source; verify accuracy before use	2002-03	2019-07-16	a08702e660601812077ee24c282335b8
279c9c6a-26ab-4c59-a7db-eaadd333ae22	03221d24-92ea-4ccc-a6a2-bd88dbfcd9fb	2001_2002_East_Asia_and_Pacific_fmtrpt.tsv	Philippines	PHL	East Asia and Pacific Region, Philippines, International Military Education and Training (IMET), FY01	INTL SAR MARITIME		Air Force	1/22/01	2001-01-22	2/2/01	2001-02-02	YORKTOWN, VA 23690-5000	1	457	https://2009-2017.state.gov/documents/organization/10965.pdf	Not checked against source; verify accuracy before use	2002-03	2019-07-16	48c7c4229568b83724378bb1147d1a6a
90703912-cbef-4b8e-87f8-2d17de8e58b1	03221d24-92ea-4ccc-a6a2-bd88dbfcd9fb	2001_2002_East_Asia_and_Pacific_fmtrpt.tsv	Philippines	PHL	East Asia and Pacific Region, Philippines, International Military Education and Training (IMET), FY01	JUDGE ADVOCATE STAFF OFF		Judge Advocate General Service	7/23/01	2001-07-23	9/21/01	2001-09-21	MAXWELL AFB, AL 36112-6323	1	7748	https://2009-2017.state.gov/documents/organization/10965.pdf	Not checked against source; verify accuracy before use	2002-03	2019-07-16	e3ca49db40f232a5407a97acd87b5f0f
67952e22-a1ae-4c18-a8e0-075fd8810905	03221d24-92ea-4ccc-a6a2-bd88dbfcd9fb	2001_2002_East_Asia_and_Pacific_fmtrpt.tsv	Philippines	PHL	East Asia and Pacific Region, Philippines, International Military Education and Training (IMET), FY01	MANAGING INTL CONFLICT MIC		Office of the Air Judge Advocate General, HPAF, Villamor Air Base, Pasay City	5/21/01	2001-05-21	5/25/01	2001-05-25	NEWPORT, RI 02841-1523	1	950	https://2009-2017.state.gov/documents/organization/10965.pdf	Not checked against source; verify accuracy before use	2002-03	2019-07-16	cc04cfcc9dad34697f5421ff2f8b62fa
1a23c721-1539-4ee2-8388-0723f3d4d6d3	03221d24-92ea-4ccc-a6a2-bd88dbfcd9fb	2001_2002_East_Asia_and_Pacific_fmtrpt.tsv	Philippines	PHL	East Asia and Pacific Region, Philippines, International Military Education and Training (IMET), FY01	MET ACQUISITION CONT ED		DCS for Logistics, J4, GHQ/AFP, Camp Aguinaldo, Quezon City	8/6/01	2001-08-06	8/6/01	2001-08-06	Philippines	41	26982	https://2009-2017.state.gov/documents/organization/10965.pdf	Not checked against source; verify accuracy before use	2002-03	2019-07-16	c97643ccf371d2a36f6fbf3a41a21ccc
df5281d0-57bb-4b00-ac07-139f7dec45f6	03221d24-92ea-4ccc-a6a2-bd88dbfcd9fb	2001_2002_East_Asia_and_Pacific_fmtrpt.tsv	Philippines	PHL	East Asia and Pacific Region, Philippines, International Military Education and Training (IMET), FY01	MIL & PCKEEP OPS IAW ROL		Office of the Air Judge Advocate General, HPAF, Villamor Air Base, Pasay City	4/16/01	2001-04-16	5/18/01	2001-05-18	NEWPORT, RI 02841-1523	1	14168	https://2009-2017.state.gov/documents/organization/10965.pdf	Not checked against source; verify accuracy before use	2002-03	2019-07-16	093c08d28f9009e7931a16de422012f1
6b6a4468-6132-4b54-9b71-86158145aaaf	03221d24-92ea-4ccc-a6a2-bd88dbfcd9fb	2001_2002_East_Asia_and_Pacific_fmtrpt.tsv	Philippines	PHL	East Asia and Pacific Region, Philippines, International Military Education and Training (IMET), FY01	NAVAL STAFF COLLEGE		General Headquarters & Headquarters Service Command duty, OTDCS for Personnel, J1	1/11/01	2001-01-11	6/15/01	2001-06-15	NEWPORT, RI 02841-1207	1	24222	https://2009-2017.state.gov/documents/organization/10965.pdf	Not checked against source; verify accuracy before use	2002-03	2019-07-16	62fb6570237907fc13a9e8e15142702b
c5259565-3159-459c-9d9b-b96f84457b6e	03221d24-92ea-4ccc-a6a2-bd88dbfcd9fb	2001_2002_East_Asia_and_Pacific_fmtrpt.tsv	Philippines	PHL	East Asia and Pacific Region, Philippines, International Military Education and Training (IMET), FY01	OAC INTL STUDENT ENGR PREP		Waterfront, Dredge Company, BNS, Ft Bonifacio, Makati City	3/12/01	2001-03-12	3/16/01	2001-03-16	FT LEONARD WOOD MO 65473-5000	1	3222	https://2009-2017.state.gov/documents/organization/10965.pdf	Not checked against source; verify accuracy before use	2002-03	2019-07-16	3b721b59632ffd50a6868874ff626e43
b88d581c-63d3-4491-9d2a-d20d1001b662	03221d24-92ea-4ccc-a6a2-bd88dbfcd9fb	2001_2002_East_Asia_and_Pacific_fmtrpt.tsv	Philippines	PHL	East Asia and Pacific Region, Philippines, International Military Education and Training (IMET), FY01	OAC INTL STUDENT ENGR PREP		Air Logistics & Support Command, 355th Avn Engr'g Wing, Basa Air Base, Pampanga	3/12/01	2001-03-12	3/16/01	2001-03-16	FT LEONARD WOOD MO 65473-5000	1	3222	https://2009-2017.state.gov/documents/organization/10965.pdf	Not checked against source; verify accuracy before use	2002-03	2019-07-16	d49e47178f3a5314653ee2a0b2214b16
2a37c77c-6e66-46c9-bc60-353dc45afec3	03221d24-92ea-4ccc-a6a2-bd88dbfcd9fb	2001_2002_East_Asia_and_Pacific_fmtrpt.tsv	Philippines	PHL	East Asia and Pacific Region, Philippines, International Military Education and Training (IMET), FY01	OBC INTERNATIONAL MP PREP		14th Fld Arty Btry, Div Arty Rgmt, 6th Infantry Divison, PA, Awang Dinaig, Maguindanao, Philippines	9/10/01	2001-09-10	9/14/01	2001-09-14	FT LEONARD WOOD MO 65473-5000	1	3125	https://2009-2017.state.gov/documents/organization/10965.pdf	Not checked against source; verify accuracy before use	2002-03	2019-07-16	f613f0807853aae5d94917a2ec40f872
04a3be93-602e-4341-aebd-7dc2c6f99c43	03221d24-92ea-4ccc-a6a2-bd88dbfcd9fb	2001_2002_East_Asia_and_Pacific_fmtrpt.tsv	Philippines	PHL	East Asia and Pacific Region, Philippines, International Military Education and Training (IMET), FY01	OJT OFF SAR ATLANTIC AREA		Air Force	2/5/01	2001-02-05	2/16/01	2001-02-16	PORTSMOUTH, VA 23666-5004	1	238	https://2009-2017.state.gov/documents/organization/10965.pdf	Not checked against source; verify accuracy before use	2002-03	2019-07-16	2096da6e7ffc0c8441a827e23e4aa613
8c0dc641-dfc5-47f9-8220-ea10c1237af9	03221d24-92ea-4ccc-a6a2-bd88dbfcd9fb	2001_2002_East_Asia_and_Pacific_fmtrpt.tsv	Philippines	PHL	East Asia and Pacific Region, Philippines, International Military Education and Training (IMET), FY01	OPNS RESOURCE MANAGEMENT		Air Force Management Information Center	1/11/01	2001-01-11	2/21/01	2001-02-21	KEESLER AFB, MS 39534-2354	1	4361	https://2009-2017.state.gov/documents/organization/10965.pdf	Not checked against source; verify accuracy before use	2002-03	2019-07-16	204f6a6ee9e9bb344bbd50e6784eedfb
2fa9cac7-bb9c-40ac-9a40-9fb3dd94f7a7	03221d24-92ea-4ccc-a6a2-bd88dbfcd9fb	2001_2002_East_Asia_and_Pacific_fmtrpt.tsv	Philippines	PHL	East Asia and Pacific Region, Philippines, International Military Education and Training (IMET), FY01	OPNS RESOURCE MANAGEMENT		ODCSforOperations, J3, Cp Aguinaldo, Quezon City	2/8/01	2001-02-08	3/20/01	2001-03-20	KEESLER AFB, MS 39534-2354	1	4332	https://2009-2017.state.gov/documents/organization/10965.pdf	Not checked against source; verify accuracy before use	2002-03	2019-07-16	285c4ded2c89048a4b72728f285541e8
83207ad3-d6f8-4d4b-88b4-f7f63b40f1df	03221d24-92ea-4ccc-a6a2-bd88dbfcd9fb	2001_2002_East_Asia_and_Pacific_fmtrpt.tsv	Philippines	PHL	East Asia and Pacific Region, Philippines, International Military Education and Training (IMET), FY01	PLAN,PROG,BUDG & EXEC SYS		OTDCS for Education & Training, J8, Camp Aguinaldo, Quezon City	2/5/01	2001-02-05	2/15/01	2001-02-15	FT JACKSON SC 29207-7040	1	3609	https://2009-2017.state.gov/documents/organization/10965.pdf	Not checked against source; verify accuracy before use	2002-03	2019-07-16	f8067849c4ef35b9bbcdaccc135ba878
41691108-5c4e-4515-b9fd-b1ba99862e92	03221d24-92ea-4ccc-a6a2-bd88dbfcd9fb	2001_2002_East_Asia_and_Pacific_fmtrpt.tsv	Philippines	PHL	East Asia and Pacific Region, Philippines, International Military Education and Training (IMET), FY01	PRINCIPLES OF INSTRUCTION		16th Attack Squadron, 15th Strike wing	4/9/01	2001-04-09	4/20/01	2001-04-20	SHEPPARD AFB TX 76311-2367	1	2125	https://2009-2017.state.gov/documents/organization/10965.pdf	Not checked against source; verify accuracy before use	2002-03	2019-07-16	8de65320aa5b8a0e0dce5219c7bbaee8
7946bcc7-d8df-44dc-b6fc-71c3bb3f9e09	03221d24-92ea-4ccc-a6a2-bd88dbfcd9fb	2001_2002_East_Asia_and_Pacific_fmtrpt.tsv	Philippines	PHL	East Asia and Pacific Region, Philippines, International Military Education and Training (IMET), FY01	PRINCIPLES OF INSTRUCTION		Air Education & Training Command, Fernando Air Base, Lipa City	4/23/01	2001-04-23	5/4/01	2001-05-04	SHEPPARD AFB TX 76311-2367	1	971	https://2009-2017.state.gov/documents/organization/10965.pdf	Not checked against source; verify accuracy before use	2002-03	2019-07-16	2ed38617431a0d3a3559270b11b98f05
1c9824ad-608c-43a3-8320-fa0b0f8d25e0	03221d24-92ea-4ccc-a6a2-bd88dbfcd9fb	2001_2002_East_Asia_and_Pacific_fmtrpt.tsv	Philippines	PHL	East Asia and Pacific Region, Philippines, International Military Education and Training (IMET), FY01	PRINCIPLES OF INSTRUCTION		Office of Special Studies, Headquarters Philippine Air Force	4/9/01	2001-04-09	4/20/01	2001-04-20	SHEPPARD AFB TX 76311-2367	1	2125	https://2009-2017.state.gov/documents/organization/10965.pdf	Not checked against source; verify accuracy before use	2002-03	2019-07-16	b3d61f74102a49593d2abe1d4220be54
78496d47-dbdf-486f-b44f-bb95cc60af15	03221d24-92ea-4ccc-a6a2-bd88dbfcd9fb	2001_2002_East_Asia_and_Pacific_fmtrpt.tsv	Philippines	PHL	East Asia and Pacific Region, Philippines, International Military Education and Training (IMET), FY01	PRINCIPLES OF INSTRUCTION		Office of the Director, Health Services, Philippine Air Force	5/7/01	2001-05-07	5/18/01	2001-05-18	SHEPPARD AFB TX 76311-2367	1	1306	https://2009-2017.state.gov/documents/organization/10965.pdf	Not checked against source; verify accuracy before use	2002-03	2019-07-16	c7943082a9f7320b689807e5408dc748
d5bd0ae9-a796-4842-8f47-c5c7a56fb555	03221d24-92ea-4ccc-a6a2-bd88dbfcd9fb	2001_2002_East_Asia_and_Pacific_fmtrpt.tsv	Philippines	PHL	East Asia and Pacific Region, Philippines, International Military Education and Training (IMET), FY01	PRINCIPLES OF INSTRUCTION		Air Force	2/5/01	2001-02-05	2/16/01	2001-02-16	SHEPPARD AFB TX 76311-2367	1	120	https://2009-2017.state.gov/documents/organization/10965.pdf	Not checked against source; verify accuracy before use	2002-03	2019-07-16	d2519ce135210debfc90fdc3f807123a
c1744673-a1ed-4271-8383-a15d7f7ee25c	03221d24-92ea-4ccc-a6a2-bd88dbfcd9fb	2001_2002_East_Asia_and_Pacific_fmtrpt.tsv	Philippines	PHL	East Asia and Pacific Region, Philippines, International Military Education and Training (IMET), FY01	PRINCIPLES OF INSTRUCTION		Air Force Management Information Center	2/26/01	2001-02-26	3/9/01	2001-03-09	SHEPPARD AFB TX 76311-2367	1	1145	https://2009-2017.state.gov/documents/organization/10965.pdf	Not checked against source; verify accuracy before use	2002-03	2019-07-16	bb513876f66ac66127d4a330f6e864ba
cdf811f9-56a9-47da-a54a-0f35e4ec7283	03221d24-92ea-4ccc-a6a2-bd88dbfcd9fb	2001_2002_East_Asia_and_Pacific_fmtrpt.tsv	Philippines	PHL	East Asia and Pacific Region, Philippines, International Military Education and Training (IMET), FY01	PROSP ELECTRONICS MATL OFF		Technical Intelligence Group, Naval Intelligence Security Force, Bonifacio Naval Station, Ft Bonifacio, Makati City, Philippines	6/4/01	2001-06-04	6/29/01	2001-06-29	NORFOLK, VA 23511-2594	1	3812	https://2009-2017.state.gov/documents/organization/10965.pdf	Not checked against source; verify accuracy before use	2002-03	2019-07-16	cedbcced2356223cee4fea699b7ffe59
8d666440-c0bd-4dbc-94f4-e3de8428efa4	03221d24-92ea-4ccc-a6a2-bd88dbfcd9fb	2001_2002_East_Asia_and_Pacific_fmtrpt.tsv	Philippines	PHL	East Asia and Pacific Region, Philippines, International Military Education and Training (IMET), FY01	PSYCHOLOGICAL OPERATIONS		Intel Div, GHQ & HSC, Camp Gen Emilio Aguinaldo, Quezon City	6/18/01	2001-06-18	7/19/01	2001-07-19	FT BRAGG NC 28310	1	4938	https://2009-2017.state.gov/documents/organization/10965.pdf	Not checked against source; verify accuracy before use	2002-03	2019-07-16	7f78dd23f88e5b5bb6b96def136f881c
33bcdf1c-d474-42b5-8c0f-93b06ea39a2c	03221d24-92ea-4ccc-a6a2-bd88dbfcd9fb	2001_2002_East_Asia_and_Pacific_fmtrpt.tsv	Philippines	PHL	East Asia and Pacific Region, Philippines, International Military Education and Training (IMET), FY01	PSYCHOLOGICAL OPERATIONS		Naval Intelligence Security Force, Fort Bonifacio, Makati City, Philippines	1/8/01	2001-01-08	2/9/01	2001-02-09	FT BRAGG NC 28310	1	5193	https://2009-2017.state.gov/documents/organization/10965.pdf	Not checked against source; verify accuracy before use	2002-03	2019-07-16	d658668556bde7d8a36e57b642b7bc43
40ddecb9-d2e1-4610-96b7-b2f35e2ca19d	03221d24-92ea-4ccc-a6a2-bd88dbfcd9fb	2001_2002_East_Asia_and_Pacific_fmtrpt.tsv	Philippines	PHL	East Asia and Pacific Region, Philippines, International Military Education and Training (IMET), FY01	PSYCHOLOGICAL OPERATIONS		Air Force Civil Relation Center, Jesus Villamor Air Base, Pasay City	1/8/01	2001-01-08	2/9/01	2001-02-09	FT BRAGG NC 28310	1	5193	https://2009-2017.state.gov/documents/organization/10965.pdf	Not checked against source; verify accuracy before use	2002-03	2019-07-16	9d8b40d76dde2c40c70a12c590d5ab1d
766875f6-2cf3-4853-92be-5f1bc5952ebe	03221d24-92ea-4ccc-a6a2-bd88dbfcd9fb	2001_2002_East_Asia_and_Pacific_fmtrpt.tsv	Philippines	PHL	East Asia and Pacific Region, Philippines, International Military Education and Training (IMET), FY01	PUBLIC AFFAIRS OFFICER		Chief, Public Affairs Office, Philippine Army, Fort Bonifacio, Makati City	7/30/01	2001-07-30	9/28/01	2001-09-28	FT GEORGE G. MEADE MD 20755-5620	1	7315	https://2009-2017.state.gov/documents/organization/10965.pdf	Not checked against source; verify accuracy before use	2002-03	2019-07-16	f9c268b7e36265f8d79618014525e181
c757f7a6-b861-41b3-ac52-60e1980c2732	03221d24-92ea-4ccc-a6a2-bd88dbfcd9fb	2001_2002_East_Asia_and_Pacific_fmtrpt.tsv	Philippines	PHL	East Asia and Pacific Region, Philippines, International Military Education and Training (IMET), FY01	READINESS APPRENTICE		Assistant Chief of Air Staff for Operations, A-3, HPAF, VAB, Pasay City	4/23/01	2001-04-23	7/6/01	2001-07-06	FT LEONARD WOOD, MO 65473	1	6325	https://2009-2017.state.gov/documents/organization/10965.pdf	Not checked against source; verify accuracy before use	2002-03	2019-07-16	e7a591e06d0b036c7735cacf0a23a72d
57fdb04a-11f6-49e9-8f45-5beb7862471b	03221d24-92ea-4ccc-a6a2-bd88dbfcd9fb	2001_2002_East_Asia_and_Pacific_fmtrpt.tsv	Philippines	PHL	East Asia and Pacific Region, Philippines, International Military Education and Training (IMET), FY01	RESOURCE MGT BUDGET		OTDCS for Education & Training, J8, Camp Aguinaldo, Quezon City	2/26/01	2001-02-26	3/9/01	2001-03-09	FT JACKSON SC 29207-7040	1	2072	https://2009-2017.state.gov/documents/organization/10965.pdf	Not checked against source; verify accuracy before use	2002-03	2019-07-16	59ea8260d366a8d977abd377e006376b
141368e3-0b72-4071-92e3-95d98333cb9f	03221d24-92ea-4ccc-a6a2-bd88dbfcd9fb	2001_2002_East_Asia_and_Pacific_fmtrpt.tsv	Philippines	PHL	East Asia and Pacific Region, Philippines, International Military Education and Training (IMET), FY01	SEC ASST MGT-STUDENT		Office of the Inspector General, CGEA, Quezon City	8/13/01	2001-08-13	8/24/01	2001-08-24	W-P AFB, OH 45433-7803	1	5025	https://2009-2017.state.gov/documents/organization/10965.pdf	Not checked against source; verify accuracy before use	2002-03	2019-07-16	1afc376399b0ef2f323fcf845edab15a
58755882-fab8-4c4c-bfa1-a2159aacbe53	03221d24-92ea-4ccc-a6a2-bd88dbfcd9fb	2001_2002_East_Asia_and_Pacific_fmtrpt.tsv	Philippines	PHL	East Asia and Pacific Region, Philippines, International Military Education and Training (IMET), FY01	SMALL ARMS/TOWED ARTILLERY		OrdChem Dept, Cbt Svc Spt Schl, Training Doctrines, PA, Ft Magsaya, Nueva Ecija, Philippines	5/29/01	2001-05-29	8/23/01	2001-08-23	APG MD 21005-5299	1	8519	https://2009-2017.state.gov/documents/organization/10965.pdf	Not checked against source; verify accuracy before use	2002-03	2019-07-16	faaad9c6935970a2155963f7588f8b22
1cab24e6-3ec1-499e-944e-5c95955e3a0b	03221d24-92ea-4ccc-a6a2-bd88dbfcd9fb	2001_2002_East_Asia_and_Pacific_fmtrpt.tsv	Philippines	PHL	East Asia and Pacific Region, Philippines, International Military Education and Training (IMET), FY01	SMALL ARMS/TOWED ARTILLERY		MIG19, ISAFP, CGEA, Q.C.	5/1/01	2001-05-01	7/27/01	2001-07-27	APG MD 21005-5299	1	8705	https://2009-2017.state.gov/documents/organization/10965.pdf	Not checked against source; verify accuracy before use	2002-03	2019-07-16	38b9c7d04c7deb394066d70ca24785b3
19a9af54-b47c-4ba4-8542-4fca400f02aa	03221d24-92ea-4ccc-a6a2-bd88dbfcd9fb	2001_2002_East_Asia_and_Pacific_fmtrpt.tsv	Philippines	PHL	East Asia and Pacific Region, Philippines, International Military Education and Training (IMET), FY01	SPEC ENG LANG TRNG (SET)		Philippine Military Academy, Fort Del Pilar, Baguio City	7/23/01	2001-07-23	9/21/01	2001-09-21	LACKLAND AFB, TX 78236-5259	1	6682	https://2009-2017.state.gov/documents/organization/10965.pdf	Not checked against source; verify accuracy before use	2002-03	2019-07-16	d5511e78c43c075a7f0a310828ce22a8
34c576aa-d5bb-4565-9ffe-a3f1bfd19926	03221d24-92ea-4ccc-a6a2-bd88dbfcd9fb	2001_2002_East_Asia_and_Pacific_fmtrpt.tsv	Philippines	PHL	East Asia and Pacific Region, Philippines, International Military Education and Training (IMET), FY01	SPEC ENG LANG TRNG (SET)		Pilot PN 310, Naval Air Defense, Philippine Navy	1/29/01	2001-01-29	3/30/01	2001-03-30	LACKLAND AFB, TX 78236-5259	1	7044	https://2009-2017.state.gov/documents/organization/10965.pdf	Not checked against source; verify accuracy before use	2002-03	2019-07-16	4c2f5d244d035c27fa0ac010f0dbf2bf
76b48845-1f52-479b-b9ac-9414b5508d2b	03221d24-92ea-4ccc-a6a2-bd88dbfcd9fb	2001_2002_East_Asia_and_Pacific_fmtrpt.tsv	Philippines	PHL	East Asia and Pacific Region, Philippines, International Military Education and Training (IMET), FY01	SPECIALIZED ENG LANG TNG		Air Force	3/5/01	2001-03-05	5/4/01	2001-05-04	LACKLAND AFB, TX 78236	1	1135	https://2009-2017.state.gov/documents/organization/10965.pdf	Not checked against source; verify accuracy before use	2002-03	2019-07-16	b13757310d2ac93530c8dc72955266d1
d77371e4-4407-4c27-ae36-875543be13ba	03221d24-92ea-4ccc-a6a2-bd88dbfcd9fb	2001_2002_East_Asia_and_Pacific_fmtrpt.tsv	Philippines	PHL	East Asia and Pacific Region, Philippines, International Military Education and Training (IMET), FY01	SPECIALIZED ENG LANG TNG		Air Education & Training Command, Fernando Air Base, Lipa City	2/19/01	2001-02-19	4/20/01	2001-04-20	LACKLAND AFB, TX 78236	1	6730	https://2009-2017.state.gov/documents/organization/10965.pdf	Not checked against source; verify accuracy before use	2002-03	2019-07-16	3e9a9e08a2c5fe939e7541caeabf1e2a
512688bd-35bf-4a8a-9728-cfe207666f33	03221d24-92ea-4ccc-a6a2-bd88dbfcd9fb	2001_2002_East_Asia_and_Pacific_fmtrpt.tsv	Philippines	PHL	East Asia and Pacific Region, Philippines, International Military Education and Training (IMET), FY01	SPECIALIZED ENG LANG TNG		Air Force	2/5/01	2001-02-05	4/6/01	2001-04-06	LACKLAND AFB, TX 78236	1	1135	https://2009-2017.state.gov/documents/organization/10965.pdf	Not checked against source; verify accuracy before use	2002-03	2019-07-16	234b318bd54011c61d2b5f875913c7f7
34492150-7bca-4232-9808-d1ec815685ad	03221d24-92ea-4ccc-a6a2-bd88dbfcd9fb	2001_2002_East_Asia_and_Pacific_fmtrpt.tsv	Philippines	PHL	East Asia and Pacific Region, Philippines, International Military Education and Training (IMET), FY01	SPECIALIZED ENG LANG TNG		Chief, Public Affairs Office, Philippine Army, Fort Bonifacio, Makati City	5/21/01	2001-05-21	7/20/01	2001-07-20	SAN ANTONIO TX 78236-5259	1	4444	https://2009-2017.state.gov/documents/organization/10965.pdf	Not checked against source; verify accuracy before use	2002-03	2019-07-16	9a04569b1795706514972fcd074d147f
0f30c732-7a61-495f-b1db-89fdbd4dd68f	03221d24-92ea-4ccc-a6a2-bd88dbfcd9fb	2001_2002_East_Asia_and_Pacific_fmtrpt.tsv	Philippines	PHL	East Asia and Pacific Region, Philippines, International Military Education and Training (IMET), FY01	SPECIALIZED ENG LANG TNG		300th AISG, Villamor Air Base, Pasay City	11/20/00	2000-11-20	1/19/01	2001-01-19	LACKLAND AFB, TX 78236	1	2270	https://2009-2017.state.gov/documents/organization/10965.pdf	Not checked against source; verify accuracy before use	2002-03	2019-07-16	fb974400b0bfe3546939c5dd383fa72f
bb434a4e-32d2-4dac-aaf1-e4837634cc38	03221d24-92ea-4ccc-a6a2-bd88dbfcd9fb	2001_2002_East_Asia_and_Pacific_fmtrpt.tsv	Philippines	PHL	East Asia and Pacific Region, Philippines, International Military Education and Training (IMET), FY01	SPECIALIZED ENG LANG TNG		Deputy Chief of Staff for Logistics, OJ4	5/21/01	2001-05-21	7/20/01	2001-07-20	SAN ANTONIO TX 78236-5259	1	6558	https://2009-2017.state.gov/documents/organization/10965.pdf	Not checked against source; verify accuracy before use	2002-03	2019-07-16	14a9889ce94779803b3230ebe0def74a
e4d1e291-d6f8-4530-a844-f7edfce61104	03221d24-92ea-4ccc-a6a2-bd88dbfcd9fb	2001_2002_East_Asia_and_Pacific_fmtrpt.tsv	Philippines	PHL	East Asia and Pacific Region, Philippines, International Military Education and Training (IMET), FY01	SR INTERNATIONAL DEF MGT		AFP, Modernization Program Mgmt Office	6/25/01	2001-06-25	7/20/01	2001-07-20	MONTEREY, CA 93943-5201	1	7731	https://2009-2017.state.gov/documents/organization/10965.pdf	Not checked against source; verify accuracy before use	2002-03	2019-07-16	1c4b5407332fb5fc2166ab4730110ea9
d63f1048-16b8-41f5-a686-eaa07f880c63	03221d24-92ea-4ccc-a6a2-bd88dbfcd9fb	2001_2002_East_Asia_and_Pacific_fmtrpt.tsv	Philippines	PHL	East Asia and Pacific Region, Philippines, International Military Education and Training (IMET), FY01	SUPPLY & SERVICE MGT OFF		Reserve Command, Philippine Army, Tanza, Cavite, Philippines	7/9/01	2001-07-09	8/15/01	2001-08-15	FT LEE VA 23801-1509	1	5253	https://2009-2017.state.gov/documents/organization/10965.pdf	Not checked against source; verify accuracy before use	2002-03	2019-07-16	cd453c4807123ae40293add3dbf32968
caab7e39-50a0-4540-935c-228a64ab7892	03221d24-92ea-4ccc-a6a2-bd88dbfcd9fb	2001_2002_East_Asia_and_Pacific_fmtrpt.tsv	Philippines	PHL	East Asia and Pacific Region, Philippines, International Military Education and Training (IMET), FY01	U.S. ARMY SGT MAJOR PREP		Armed Forces of the Philippines Commissary & Exchange Service	7/23/01	2001-07-23	8/10/01	2001-08-10	FT BLISS TX 79918-8002	1	3562	https://2009-2017.state.gov/documents/organization/10965.pdf	Not checked against source; verify accuracy before use	2002-03	2019-07-16	b563c24d2a286585ebe027934457f961
87e5f320-c8fd-4290-9dff-87fe092a5aef	03221d24-92ea-4ccc-a6a2-bd88dbfcd9fb	2001_2002_East_Asia_and_Pacific_fmtrpt.tsv	Philippines	PHL	East Asia and Pacific Region, Philippines, International Military Education and Training (IMET), FY01	USA C&GSC OFF PREPARATORY		Headquarters & Headquarters $1,725 Support Group, PA dy Office of the Asst Chief of Staff for Operations, G3, Fort Bonifacio, Makati City	7/9/01	2001-07-09	7/20/01	2001-07-20	FT LEAVENWORTH KS 66027-1352	1		https://2009-2017.state.gov/documents/organization/10965.pdf	Not checked against source; verify accuracy before use	2002-03	2019-07-16	6dfd75d30571e62be0f582fe49948f04
162b8f29-fdf1-4605-8a31-2e9355df85a9	03221d24-92ea-4ccc-a6a2-bd88dbfcd9fb	2001_2002_East_Asia_and_Pacific_fmtrpt.tsv	Philippines	PHL	East Asia and Pacific Region, Philippines, International Military Education and Training (IMET), FY01	USAF SENIOR NCO ACADEMY		Air Education & Training Command, Fernando Air Base, Lipa City	5/16/01	2001-05-16	6/27/01	2001-06-27	GUNTER AFB, AL 36114	1	2977	https://2009-2017.state.gov/documents/organization/10965.pdf	Not checked against source; verify accuracy before use	2002-03	2019-07-16	06e9ddd234efa16a36abc0a7a3a055ad
1deb60ff-aae2-4ddf-9ec7-f4987067af43	03221d24-92ea-4ccc-a6a2-bd88dbfcd9fb	2001_2002_East_Asia_and_Pacific_fmtrpt.tsv	Philippines	PHL	East Asia and Pacific Region, Philippines, International Military Education and Training (IMET), FY01	WIRE SYSTEMS EQUIPMENT RPR		Communication, Electronics & Information Service, AFP	1/22/01	2001-01-22	5/17/01	2001-05-17	FT GORDON GA 30905-5154	1	9897	https://2009-2017.state.gov/documents/organization/10965.pdf	Not checked against source; verify accuracy before use	2002-03	2019-07-16	cf669ddd0adf50576853b4d429150136
9de10d6e-1fb8-4a3a-bccc-db51372821c1	03221d24-92ea-4ccc-a6a2-bd88dbfcd9fb	2001_2002_East_Asia_and_Pacific_fmtrpt.tsv	Philippines	PHL	DoS East Asia and Pacific Region, Philippines, Asia-Pacific Center, FY01	Executive Course 00-3	U.S. military staff and faculty	Dept Natl Defense; Western Command; Natl defense College	10/2/00	2000-10-02	12/15/00	2000-12-15	Asia-Pacific Center for Security Studies Honolulu, Hawaii	3	34711	https://2009-2017.state.gov/documents/organization/10965.pdf	Not checked against source; verify accuracy before use	2002-03	2019-07-16	bd7be2e22d6816985ef46a3d298124ea
c66cd210-fa82-444f-9743-fa87badbe377	03221d24-92ea-4ccc-a6a2-bd88dbfcd9fb	2001_2002_East_Asia_and_Pacific_fmtrpt.tsv	Philippines	PHL	DoS East Asia and Pacific Region, Philippines, Asia-Pacific Center, FY01	Executive Course 01-1	U.S. military staff and faculty	MOFA; General HQ; Dept of Natl Defense	1/22/01	2001-01-22	4/12/01	2001-04-12	Asia-Pacific Center for Security Studies Honolulu, Hawaii	3	41019	https://2009-2017.state.gov/documents/organization/10965.pdf	Not checked against source; verify accuracy before use	2002-03	2019-07-16	892f7ad5f97670cfd26dad579726a764
5b1068c0-798b-47ec-bd70-f480170cf0df	03221d24-92ea-4ccc-a6a2-bd88dbfcd9fb	2001_2002_East_Asia_and_Pacific_fmtrpt.tsv	Philippines	PHL	DoS East Asia and Pacific Region, Philippines, Asia-Pacific Center, FY01	Executive Course 01-2	U.S. military staff and faculty	Dept of Natl Defense; WESCOM; Dept of Natl Defense	5/21/01	2001-05-21	8/9/01	2001-08-09	Asia-Pacific Center for Security Studies Honolulu, Hawaii	3	40412	https://2009-2017.state.gov/documents/organization/10965.pdf	Not checked against source; verify accuracy before use	2002-03	2019-07-16	bb6f2224fbd486e1b2665a25073c3db1
8565ed80-cc19-403a-b265-e2c1351f3243	03221d24-92ea-4ccc-a6a2-bd88dbfcd9fb	2001_2002_East_Asia_and_Pacific_fmtrpt.tsv	Philippines	PHL	DoS East Asia and Pacific Region, Philippines, Credit (Repayable), FY01	DEF RES MGT CRS		AFP Logistics Command, GHQ/AFP, Camp Aguinaldo, Quezon City	4/23/01	2001-04-23	5/17/01	2001-05-17	MONTEREY, CA 93943-5201	1	5241	https://2009-2017.state.gov/documents/organization/10965.pdf	Not checked against source; verify accuracy before use	2002-03	2019-07-16	3cb0eb94b437d2d91382ea529af9035a
4975f7fe-7bea-431e-b08c-12dc1d37d5f2	03221d24-92ea-4ccc-a6a2-bd88dbfcd9fb	2001_2002_East_Asia_and_Pacific_fmtrpt.tsv	Philippines	PHL	DoS East Asia and Pacific Region, Philippines, Credit (Repayable), FY01	DEF RES MGT CRS		DCS for Logistics, J4, GHQ/AFP, Camp Aguinaldo, Quezon City	4/23/01	2001-04-23	5/17/01	2001-05-17	MONTEREY, CA 93943-5201	1	5241	https://2009-2017.state.gov/documents/organization/10965.pdf	Not checked against source; verify accuracy before use	2002-03	2019-07-16	ccce2035902d19c55d5d5c4629fc9878
9868c67d-11e6-44bd-b8de-bff6b78d60c9	03221d24-92ea-4ccc-a6a2-bd88dbfcd9fb	2001_2002_East_Asia_and_Pacific_fmtrpt.tsv	Philippines	PHL	DoS East Asia and Pacific Region, Philippines, Credit (Repayable), FY01	INTL DEFENSE MGT CRS		DCS for Logistics, J4, GHQ/AFP, Camp Aguinaldo, Quezon City	2/5/01	2001-02-05	4/18/01	2001-04-18	MONTEREY, CA 93943-5201	1	14502	https://2009-2017.state.gov/documents/organization/10965.pdf	Not checked against source; verify accuracy before use	2002-03	2019-07-16	2cfb79b645c5e40a3457ea88c5d60ba0
