training:id:admin	training:source	qa:training_group	training:country	training:country_iso_3166_1	training:program	training:course_title	training:delivery_unit	training:recipient_unit	qa:training_start_date	training:start_date	qa:training_end_date	training:end_date	training:location	training:quantity	training:total_cost	qa:training_source_url	training:status:admin	qa:training_date_first_seen	qa:training_date_scraped	qa:hash
85ec3413-b629-4178-a48c-e823cb96c723	048fb2d9-6651-4ba0-b36a-a526539f4cfd	2002_2003_Africa_fmtrpt.tsv	Eritrea	ERI	Africa Region, Eritrea, International Military Education and Training (IMET), FY02	BOARDING TEAM MEMBER		Navy	8/19/02	2002-08-19	8/30/02	2002-08-30	PETALUMA, CA 94952-5000	1	1262	https://2009-2017.state.gov/documents/organization/21817.pdf	Not checked against source; verify accuracy before use	2003-05	2019-07-16	a8c43a102ad192e53309d86044be1f17
f5c8a0ca-b3f1-44f1-9466-d82a8dbc07de	048fb2d9-6651-4ba0-b36a-a526539f4cfd	2002_2003_Africa_fmtrpt.tsv	Eritrea	ERI	Africa Region, Eritrea, International Military Education and Training (IMET), FY02	EIMET										https://2009-2017.state.gov/documents/organization/21817.pdf	Not checked against source; verify accuracy before use	2003-05	2019-07-16	bf6b7d887695a89c55c8249fdbb84a18
6fa06d38-d3d2-4833-88da-1c131431ce8d	048fb2d9-6651-4ba0-b36a-a526539f4cfd	2002_2003_Africa_fmtrpt.tsv	Eritrea	ERI	Africa Region, Eritrea, International Military Education and Training (IMET), FY02	EXEC HLTHCARE RESOURCE		Navy	1/7/02	2002-01-07	1/16/02	2002-01-16	MONTEREY, CA 93943-5301	1	9320	https://2009-2017.state.gov/documents/organization/21817.pdf	Not checked against source; verify accuracy before use	2003-05	2019-07-16	de06e3d228302f15ec215cce4a303a5d
2566d64c-811f-472a-84ff-0dd7940effed	048fb2d9-6651-4ba0-b36a-a526539f4cfd	2002_2003_Africa_fmtrpt.tsv	Eritrea	ERI	Africa Region, Eritrea, International Military Education and Training (IMET), FY02	MGT										https://2009-2017.state.gov/documents/organization/21817.pdf	Not checked against source; verify accuracy before use	2003-05	2019-07-16	723f32a2279ccf9eb81d0fe67818b95a
ceac408b-1aa5-468b-8952-de80b3f7d065	048fb2d9-6651-4ba0-b36a-a526539f4cfd	2002_2003_Africa_fmtrpt.tsv	Mali	MLI	DOS Africa Region, Mali, International Military Education and Training (IMET), FY02	LANG LAB VOLTAGE		Direction of Military Schools	1/15/02	2002-01-15	3/31/02	2002-03-31		0	1180	https://2009-2017.state.gov/documents/organization/21817.pdf	Not checked against source; verify accuracy before use	2003-05	2019-07-16	6a369410989d03362d30cb888d6711ab
4ea6fa19-d425-48b2-ba0d-47e4e5979ced	048fb2d9-6651-4ba0-b36a-a526539f4cfd	2002_2003_Africa_fmtrpt.tsv	Mali	MLI	DOS Africa Region, Mali, International Military Education and Training (IMET), FY02	REGULATOR										https://2009-2017.state.gov/documents/organization/21817.pdf	Not checked against source; verify accuracy before use	2003-05	2019-07-16	79c6b5ad339c96aacb3b952855eb0631
f0b09383-a758-47e6-94c8-1a3a5ebfb2db	048fb2d9-6651-4ba0-b36a-a526539f4cfd	2002_2003_Africa_fmtrpt.tsv	Mauritania	MRT	DOS Africa Region, Mauritania, International Military Education and Training (IMET), FY02	LANG LAB VOLTAGE		Army	9/15/02	2002-09-15	9/30/02	2002-09-30		0	1180	https://2009-2017.state.gov/documents/organization/21817.pdf	Not checked against source; verify accuracy before use	2003-05	2019-07-16	4eaf06466938d10ef401c5d21c35e0bf
d7db33f6-b9ae-4ef9-ad16-e63d59e771e5	048fb2d9-6651-4ba0-b36a-a526539f4cfd	2002_2003_Africa_fmtrpt.tsv	Mauritania	MRT	DOS Africa Region, Mauritania, International Military Education and Training (IMET), FY02	REGULATOR										https://2009-2017.state.gov/documents/organization/21817.pdf	Not checked against source; verify accuracy before use	2003-05	2019-07-16	5c290cd76e47f22240f4681c5b6921af
1725b029-68c1-44ec-9da6-41935737703b	048fb2d9-6651-4ba0-b36a-a526539f4cfd	2002_2003_Africa_fmtrpt.tsv	Niger	NER	DOS Africa Region, Niger, International Military Education and Training (IMET), FY02	LANG LAB VOLTAGE		Army	2/22/02	2002-02-22	3/30/02	2002-03-30		0	1180	https://2009-2017.state.gov/documents/organization/21817.pdf	Not checked against source; verify accuracy before use	2003-05	2019-07-16	1482fdf236448d6b6fdb40979cddfb95
f30e7dca-21a3-4174-a15e-ae8258308c5b	048fb2d9-6651-4ba0-b36a-a526539f4cfd	2002_2003_Africa_fmtrpt.tsv	Niger	NER	DOS Africa Region, Niger, International Military Education and Training (IMET), FY02	REGULATOR										https://2009-2017.state.gov/documents/organization/21817.pdf	Not checked against source; verify accuracy before use	2003-05	2019-07-16	a16ede04f3ba1d2d948e321233131d67
8177592a-5973-41c2-861d-82dd85bb3a80	048fb2d9-6651-4ba0-b36a-a526539f4cfd	2002_2003_Africa_fmtrpt.tsv	Niger	NER	DOS Africa Region, Niger, International Military Education and Training (IMET), FY02	MANAGING ENG LANG		Air Force	12/10/01	2001-12-10	2/1/02	2002-02-01	LACKLAND AFB, TX 78236	1	8141	https://2009-2017.state.gov/documents/organization/21817.pdf	Not checked against source; verify accuracy before use	2003-05	2019-07-16	986af15d75453cd1451256fd163c14fb
b0d21cd4-3d09-4654-aad9-bfce7605c259	048fb2d9-6651-4ba0-b36a-a526539f4cfd	2002_2003_Africa_fmtrpt.tsv	Niger	NER	DOS Africa Region, Niger, International Military Education and Training (IMET), FY02	TNG(MELT										https://2009-2017.state.gov/documents/organization/21817.pdf	Not checked against source; verify accuracy before use	2003-05	2019-07-16	28109e2dd57353904c6a0aa992521c3a
9642cee5-d54d-4dbb-a6d0-684d682ee68c	048fb2d9-6651-4ba0-b36a-a526539f4cfd	2002_2003_Africa_fmtrpt.tsv	Republic of Congo (Congo - Brazzaville)	COG	DOS Africa Region, Republic of Congo (Congo - Brazzaville), International Military Education and Training (IMET), FY02	LANG LAB VOLTAGE		Army	5/14/02	2002-05-14	9/30/02	2002-09-30		0	1180	https://2009-2017.state.gov/documents/organization/21817.pdf	Not checked against source; verify accuracy before use	2003-05	2019-07-16	bd042a6ed8e5d3f205fa8decd1e068fb
0ce017eb-66d5-4364-b78e-11745750a575	048fb2d9-6651-4ba0-b36a-a526539f4cfd	2002_2003_Africa_fmtrpt.tsv	Republic of Congo (Congo - Brazzaville)	COG	DOS Africa Region, Republic of Congo (Congo - Brazzaville), International Military Education and Training (IMET), FY02	REGULATOR										https://2009-2017.state.gov/documents/organization/21817.pdf	Not checked against source; verify accuracy before use	2003-05	2019-07-16	1d2612fa34bf30c9769db7c37a9906a9
8d60cd66-2432-4f96-8b30-c449987330ac	048fb2d9-6651-4ba0-b36a-a526539f4cfd	2002_2003_Africa_fmtrpt.tsv	Sao Tome and Principe	STP	DOS Africa Region, Sao Tome and Principe, International Military Education and Training (IMET), FY02	LANG LAB VOLTAGE		Army	5/14/02	2002-05-14	9/30/02	2002-09-30		0	1180	https://2009-2017.state.gov/documents/organization/21817.pdf	Not checked against source; verify accuracy before use	2003-05	2019-07-16	9de618cc65fd22ad238800ff709bcf0d
c5ea178f-66d4-4faf-b204-47f212bbb117	048fb2d9-6651-4ba0-b36a-a526539f4cfd	2002_2003_Africa_fmtrpt.tsv	Sao Tome and Principe	STP	DOS Africa Region, Sao Tome and Principe, International Military Education and Training (IMET), FY02	REGULATOR										https://2009-2017.state.gov/documents/organization/21817.pdf	Not checked against source; verify accuracy before use	2003-05	2019-07-16	ff2ff05756cd5cee32f400343c135fe5
e2827672-9993-4684-95ca-07fc7c1297e2	048fb2d9-6651-4ba0-b36a-a526539f4cfd	2002_2003_Africa_fmtrpt.tsv	Senegal	SEN	Africa Region, Senegal, International Military Education and Training (IMET), FY02	LANG LAB VOLTAGE		Language laboratory for various	2/5/02	2002-02-05	9/30/02	2002-09-30		0	5187	https://2009-2017.state.gov/documents/organization/21817.pdf	Not checked against source; verify accuracy before use	2003-05	2019-07-16	e50c45d06f5d58fc7a8ca3dc878e21e7
e5a331d4-10f6-4d85-9f1d-79a01209654e	048fb2d9-6651-4ba0-b36a-a526539f4cfd	2002_2003_Africa_fmtrpt.tsv	Senegal	SEN	Africa Region, Senegal, International Military Education and Training (IMET), FY02	REGULATOR										https://2009-2017.state.gov/documents/organization/21817.pdf	Not checked against source; verify accuracy before use	2003-05	2019-07-16	d13c41f9de530a3b73786c0683e78165
155e35c6-71ac-498b-afbe-92e8b39d2eb3	048fb2d9-6651-4ba0-b36a-a526539f4cfd	2002_2003_East_Asia_and_Pacific_fmtrpt.tsv	Korea - South (Republic of)	KOR	DOD East Asia and Pacific Region, Korea - South (Republic of), Exchange Training,FY02	JCET	353 SOG, 1 SOS, 17 SOS, 320 STS, E/160 SOAR, 6 SOS, 4 SOS	1st Special Forces Brigade	11/26/01	2001-11-26	12/9/01	2001-12-09	Osan AB, Sungnam, Seoul, Byupyong,	57 Buchon	111448	https://2009-2017.state.gov/documents/organization/21818.pdf	Not checked against source; verify accuracy before use	2003-05	2019-07-16	aa108dfb9e60de09cfcb8c81ab4f4514
cc46779e-7ddc-4396-a468-f6230ff71028	048fb2d9-6651-4ba0-b36a-a526539f4cfd	2002_2003_East_Asia_and_Pacific_fmtrpt.tsv	Korea - South (Republic of)	KOR	DOD East Asia and Pacific Region, Korea - South (Republic of), Exchange Training,FY02	JCET	2/1 SFG, 353 SOG, E/160 SOAR	13th Special Forces Brigade	6/15/02	2002-06-15	7/29/02	2002-07-29	Seoul, Maesanri DZ, Pilsung Range,	26 Jeungpyong	33731	https://2009-2017.state.gov/documents/organization/21818.pdf	Not checked against source; verify accuracy before use	2003-05	2019-07-16	317021d2178b2edfc27c00a5a75a185a
6c87df3d-afe7-440f-a9c0-f94d77b27bfc	048fb2d9-6651-4ba0-b36a-a526539f4cfd	2002_2003_East_Asia_and_Pacific_fmtrpt.tsv	Malaysia	MYS	DOD East Asia and Pacific Region, Malaysia, Non-Security Assistance, Unified Command,FY02	JCET	1/19 SFG, 353 SOG, 320 STS	4th Troop Yankee Squadron, 21st Commando Regiment, 21st Special Services Group	8/10/02	2002-08-10	9/16/02	2002-09-16	Camp Sungai Udang (Malaka) Subang	50 (RMAFB)	99216	https://2009-2017.state.gov/documents/organization/21818.pdf	Not checked against source; verify accuracy before use	2003-05	2019-07-16	a7d629362023ca9cc0ac0722d61f1c90
a56895ce-8b85-4a62-914d-10d46b8616f0	048fb2d9-6651-4ba0-b36a-a526539f4cfd	2002_2003_East_Asia_and_Pacific_fmtrpt.tsv	Papua New Guinea	PNG	DOD East Asia and Pacific Region, Papua New Guinea, Asia-Pacific Center,FY02	Executive Course 2002-1		Army; National Intelligence Organization	$31,904		1/21/02 4/11/02	2002-01-21	Asia-Pacific Center for Security Studies	2		https://2009-2017.state.gov/documents/organization/21818.pdf	Not checked against source; verify accuracy before use	2003-05	2019-07-16	64661d8764dda52fda9e55e2e75652bf
a4ead72a-0aef-46f4-8ab2-c2c3b629d6f2	048fb2d9-6651-4ba0-b36a-a526539f4cfd	2002_2003_East_Asia_and_Pacific_fmtrpt.tsv	Philippines	PHL	DOD East Asia and Pacific Region, Philippines, Non-Security Assistance, Unified Command,FY02	JCET	3/1 SFG, 1/1 SFG, 2/1 SFG, SOTSE, 96 CA BN, 1 SOS, 17 SOS, 320 STS, E/160 SOAR, NSWU-1	Marine Force Recon Battalion	1/10/02	2002-01-10	2/18/02	2002-02-18	FT Magsaysay, Clark Air Base, Camp	334 Tecson	1286500	https://2009-2017.state.gov/documents/organization/21818.pdf	Not checked against source; verify accuracy before use	2003-05	2019-07-16	4143e1e966c6b986bac235f729be0248
6e2dfc57-e40c-4049-9248-2aff2b0789b2	048fb2d9-6651-4ba0-b36a-a526539f4cfd	2002_2003_East_Asia_and_Pacific_fmtrpt.tsv	Philippines	PHL	East Asia and Pacific Region, Philippines, International Military Education and Training (IMET), FY 02	INTL HYDROG MGT & ENG PGM		Headquarters Philippine Navy, Vice Commander, PN	4/1/02	2002-04-01	9/27/02	2002-09-27	STENNIS SPACE CENTER, MS	1 39522-5001	23470	https://2009-2017.state.gov/documents/organization/21818.pdf	Not checked against source; verify accuracy before use	2003-05	2019-07-16	b47db7ba2ca3ff0ece491c30e1e8fedf
447dad6d-4a73-4e7a-b4cc-0e3cc1911f0d	048fb2d9-6651-4ba0-b36a-a526539f4cfd	2002_2003_East_Asia_and_Pacific_fmtrpt.tsv	Philippines	PHL	East Asia and Pacific Region, Philippines, International Military Education and Training (IMET), FY 02	MET ACQUISITION CONT ED	AFP Joint Staff, GHQ	Camp Aguinaldo, Quezon City	$28,201		7/8/02 7/19/02	2002-07-08	AFP Joint Command & Staff College, Camp	32 Aguinaldo, Quezon City, Philippines		https://2009-2017.state.gov/documents/organization/21818.pdf	Not checked against source; verify accuracy before use	2003-05	2019-07-16	c67385f663cbf44de4f42aa1e9e2efaf
fc6adf78-ded1-40e0-a87c-0dee5258235c	048fb2d9-6651-4ba0-b36a-a526539f4cfd	2002_2003_East_Asia_and_Pacific_fmtrpt.tsv	Philippines	PHL	East Asia and Pacific Region, Philippines, International Military Education and Training (IMET), FY 02	PATROL CFT OPS RIVER ENV		Philippine Fleet, Naval Base Cavite, Sangley Point, Cavite City	3/15/02	2002-03-15	5/9/02	2002-05-09	STENNIS SPACE CENTER, MS	1 39529-7099	8886	https://2009-2017.state.gov/documents/organization/21818.pdf	Not checked against source; verify accuracy before use	2003-05	2019-07-16	1780d77ce779cb7b2430ec23a1f1d583
bc0c7ed9-ff07-4a75-98fa-e60e6896fd74	048fb2d9-6651-4ba0-b36a-a526539f4cfd	2002_2003_East_Asia_and_Pacific_fmtrpt.tsv	Thailand	THA	DOD East Asia and Pacific Region, Thailand, Non-Security Assistance, Unified Command,FY02	JCET	1/1 SFG, SOTSE, SBU-22, 426 CA BN, 4 POG, 7 POG, 353 SOG, 1 SOS, 17 SOS, 353 MXS, 353 OSS, E/160 SOAR, 96 CA BN	Task Force 399, 3rd Army Area, MAE Rim	4/7/02	2002-04-07	5/3/02	2002-05-03	Camp Mai Rim, Chang Mai, Camp Maraie	605 Lop Buri	605234	https://2009-2017.state.gov/documents/organization/21818.pdf	Not checked against source; verify accuracy before use	2003-05	2019-07-16	e2fff25ff0672209a2ce9396da6de1d9
9681e6eb-a9eb-4282-9bbd-22a2dd01898a	048fb2d9-6651-4ba0-b36a-a526539f4cfd	2002_2003_East_Asia_and_Pacific_fmtrpt.tsv	Thailand	THA	East Asia and Pacific Region, Thailand, International Military Education and Training (IMET), FY 02	MANAGING ENG LANG		Academic Sect, Education Div, RTAF	12/10/01	2001-12-10	2/1/02	2002-02-01	LACKLAND AFB, TX 78236	1	4070	https://2009-2017.state.gov/documents/organization/21818.pdf	Not checked against source; verify accuracy before use	2003-05	2019-07-16	0bdb407c156b6a3247ba966e78daafbe
a1fb15bb-7170-45b9-bef8-9472b88eb70b	048fb2d9-6651-4ba0-b36a-a526539f4cfd	2002_2003_East_Asia_and_Pacific_fmtrpt.tsv	Thailand	THA	East Asia and Pacific Region, Thailand, International Military Education and Training (IMET), FY 02	TNG(MELT		Flying Training School, Kampangsaen, Nakornpathom, Thailand								https://2009-2017.state.gov/documents/organization/21818.pdf	Not checked against source; verify accuracy before use	2003-05	2019-07-16	08658767c612c036f2f0a5075089a76c
acb82c70-e39b-4434-8588-acbbbfc3bf1f	048fb2d9-6651-4ba0-b36a-a526539f4cfd	2002_2003_Europe_fmtrpt.tsv	Bulgaria	BGR	DOS Europe Region, Bulgaria, International Military Education and Training (IMET),FY02	COMM-COMPUTER SYS CNTL		Educational Base, 1 Karel Shorpil Str.,	4/29/02	2002-04-29	8/20/02	2002-08-20	KEESLER AFB, MS 39534-2354	1	9135	https://2009-2017.state.gov/documents/organization/21819.pdf	Not checked against source; verify accuracy before use	2003-05	2019-07-16	808d1b1046fd0d7c25ed0477fc1425b2
ce53c651-816b-43c5-a53e-5a5e359cae9f	048fb2d9-6651-4ba0-b36a-a526539f4cfd	2002_2003_Europe_fmtrpt.tsv	Bulgaria	BGR	DOS Europe Region, Bulgaria, International Military Education and Training (IMET),FY02	SPC		Shumen								https://2009-2017.state.gov/documents/organization/21819.pdf	Not checked against source; verify accuracy before use	2003-05	2019-07-16	151270197ec7e3722bcf8ec347aa8343
e5da61c1-464e-41fa-863a-c1cddecafa15	048fb2d9-6651-4ba0-b36a-a526539f4cfd	2002_2003_Europe_fmtrpt.tsv	Bulgaria	BGR	Europe Region, Bulgaria, International Military Education and Training (IMET), FY 02	REGULATOR										https://2009-2017.state.gov/documents/organization/21819.pdf	Not checked against source; verify accuracy before use	2003-05	2019-07-16	034277270a933831095de0e326772622
f96d409b-7c27-4f1e-82b9-ef44f350cb15	048fb2d9-6651-4ba0-b36a-a526539f4cfd	2002_2003_Europe_fmtrpt.tsv	Croatia	HRV	DOS Europe Region, Croatia, International Military Education and Training (IMET),FY02	ESCORT OFFICER		U.S. escort officer, Ms. Yvonne Eaton, NDU	6/10/02	2002-06-10	6/21/02	2002-06-21	Washington DC and various locations	0 throughout U.S.	3282	https://2009-2017.state.gov/documents/organization/21819.pdf	Not checked against source; verify accuracy before use	2003-05	2019-07-16	888b53c1b1abd09db39124a0fc3b7784
918db55a-9d6d-46ec-9a4d-5ef4b773dd6c	048fb2d9-6651-4ba0-b36a-a526539f4cfd	2002_2003_Europe_fmtrpt.tsv	Croatia	HRV	Europe Region, Croatia, International Military Education and Training (IMET), FY 02	TATS COMBAT ENGINEER		43rd Engineer Company	6/18/02	2002-06-18	8/8/02	2002-08-08	FT LEONARD WOOD MO 65473-5000	1	1370	https://2009-2017.state.gov/documents/organization/21819.pdf	Not checked against source; verify accuracy before use	2003-05	2019-07-16	b88f992ed601679eff871c37ba4071b1
b739bd80-61cc-48b7-8648-b7949b1db59f	048fb2d9-6651-4ba0-b36a-a526539f4cfd	2002_2003_Europe_fmtrpt.tsv	Croatia	HRV	Europe Region, Croatia, International Military Education and Training (IMET), FY 02	ANCOC										https://2009-2017.state.gov/documents/organization/21819.pdf	Not checked against source; verify accuracy before use	2003-05	2019-07-16	7307a799e481712c2e71a09b463e995d
bd727769-9ec7-4709-8056-518d109afb1f	048fb2d9-6651-4ba0-b36a-a526539f4cfd	2002_2003_Europe_fmtrpt.tsv	Estonia	EST	Europe Region, Estonia, International Military Education and Training (IMET), FY 02	MANAGING ENG LANG		PEACE OPERATIONS CENTER	12/10/01	2001-12-10	2/1/02	2002-02-01	LACKLAND AFB, TX 78236	1	6888	https://2009-2017.state.gov/documents/organization/21819.pdf	Not checked against source; verify accuracy before use	2003-05	2019-07-16	52a10c5f1ceba3c5af1ec279eb1bf357
35f66efb-680f-4ae0-b1ec-ee2336998211	048fb2d9-6651-4ba0-b36a-a526539f4cfd	2002_2003_Europe_fmtrpt.tsv	Estonia	EST	Europe Region, Estonia, International Military Education and Training (IMET), FY 02	TNG(MELT		PALDISKI								https://2009-2017.state.gov/documents/organization/21819.pdf	Not checked against source; verify accuracy before use	2003-05	2019-07-16	d3a6c0917e03bd110b9d3a1e27b1322e
1b90344a-2a1c-48df-9cc6-ec2c76ec2b86	048fb2d9-6651-4ba0-b36a-a526539f4cfd	2002_2003_Europe_fmtrpt.tsv	Latvia	LVA	Europe Region, Latvia, International Military Education and Training (IMET), FY 02	MANAGING ENG LANG		Navy Training Centre, ELT Department	12/10/01	2001-12-10	2/1/02	2002-02-01	LACKLAND AFB, TX 78236	1	6176	https://2009-2017.state.gov/documents/organization/21819.pdf	Not checked against source; verify accuracy before use	2003-05	2019-07-16	e93b95ba26891b3a91a79fe765296b24
1b6e437c-616b-4a6a-90af-b6a4eff34267	048fb2d9-6651-4ba0-b36a-a526539f4cfd	2002_2003_Europe_fmtrpt.tsv	Latvia	LVA	Europe Region, Latvia, International Military Education and Training (IMET), FY 02	TNG(MELT										https://2009-2017.state.gov/documents/organization/21819.pdf	Not checked against source; verify accuracy before use	2003-05	2019-07-16	043237af2e6338b94e05944e1ceccd0d
288954b3-413d-4406-851f-c28f0fbbff6b	048fb2d9-6651-4ba0-b36a-a526539f4cfd	2002_2003_Europe_fmtrpt.tsv	Malta	MLT	DOS Europe Region, Malta, International Military Education and Training (IMET),FY02	MTT PORT SEC/VUL ASM		Maritime Autority Safety and Security Ofiicers (10); Maltese Customs Agents (8); Armed Forces of Malta (10); Director of MCAS-IMS (1)	8/19/02	2002-08-19	8/23/02	2002-08-23	Malta Collage of Science and Technology,	29 Institute of Maritime Studies, Kalkara, Malta	17296	https://2009-2017.state.gov/documents/organization/21819.pdf	Not checked against source; verify accuracy before use	2003-05	2019-07-16	3f578e21bc74af18085936b76746b768
6ae793e0-6b68-40b6-af34-e5a6d7c90f40	048fb2d9-6651-4ba0-b36a-a526539f4cfd	2002_2003_Europe_fmtrpt.tsv	Romania	ROU	Europe Region, Romania, International Military Education and Training (IMET), FY 02	MANAGING ENG LANG		MOD-HUMAN RESOURCE	12/10/01	2001-12-10	2/1/02	2002-02-01	LACKLAND AFB, TX 78236	1	6839	https://2009-2017.state.gov/documents/organization/21819.pdf	Not checked against source; verify accuracy before use	2003-05	2019-07-16	7fc0285c71832e262737c494e1189d1f
de8d5104-a359-497b-b2d2-7089cfc5c07a	048fb2d9-6651-4ba0-b36a-a526539f4cfd	2002_2003_Europe_fmtrpt.tsv	Romania	ROU	Europe Region, Romania, International Military Education and Training (IMET), FY 02	TNG(MELT		MANAGEMENT DIRECTORATE,ENGLISH LANGUAGE PROGRAM MANAGER								https://2009-2017.state.gov/documents/organization/21819.pdf	Not checked against source; verify accuracy before use	2003-05	2019-07-16	b4c22c95f2973c12f51cd1f6dc3ee138
f3a8d31c-cbc7-4b7e-a1f9-5c57598cd923	048fb2d9-6651-4ba0-b36a-a526539f4cfd	2002_2003_Europe_fmtrpt.tsv	Romania	ROU	DOS Europe Region, Romania, Foreign Military Financing (FMF),FY02	ETSS POST DEPLOY		US MARINE INSTRUCTORS FOR	7/1/02	2002-07-01	7/1/02	2002-07-01	Romania	30	0	https://2009-2017.state.gov/documents/organization/21819.pdf	Not checked against source; verify accuracy before use	2003-05	2019-07-16	91e2ac62be50ac0ed0ef60a3277d40ae
c808acee-a90c-4cd4-90a2-233dd6a3dd42	048fb2d9-6651-4ba0-b36a-a526539f4cfd	2002_2003_Europe_fmtrpt.tsv	Romania	ROU	DOS Europe Region, Romania, Foreign Military Financing (FMF),FY02	STANDDOWN		ROMANIAN NCO ACADEMY-PITESTI								https://2009-2017.state.gov/documents/organization/21819.pdf	Not checked against source; verify accuracy before use	2003-05	2019-07-16	eb85f5dfa2c470d3495e053be5ec21b0
2f3e5e11-825d-4ffa-a1b5-27f35d129daf	048fb2d9-6651-4ba0-b36a-a526539f4cfd	2002_2003_Europe_fmtrpt.tsv	Slovakia	SVK	DOD Europe Region, Slovakia, PME Exchanges,FY02	MET PEACE SUP OPS PH I		Peace Keeping Forces Training Base, Nitra; General Staff, Armed Forces SR; MOD SR	11/6/01	2001-11-06	11/8/01	2001-11-08	Peacekeeping Forces Training Base,Nitra;,	10 General Staff, Armed Forces SR; MOD SR, Slovakia	8100	https://2009-2017.state.gov/documents/organization/21819.pdf	Not checked against source; verify accuracy before use	2003-05	2019-07-16	7743835e1339fab0ba2a473beb09f2f6
01eeb6c8-7829-443b-a145-052f5e5fd257	048fb2d9-6651-4ba0-b36a-a526539f4cfd	2002_2003_Europe_fmtrpt.tsv	Slovenia	SVN	DOS Europe Region, Slovenia, International Military Education and Training (IMET),FY02	ACADEMIC INSTRUCTOR		NCO SCHOOL	2/25/02	2002-02-25	3/22/02	2002-03-22	MAXWELL AFB, AL 36112-6323	1	2097	https://2009-2017.state.gov/documents/organization/21819.pdf	Not checked against source; verify accuracy before use	2003-05	2019-07-16	640d84d643cb4357548d8c3922248eb9
26e88613-a98a-4d96-aac8-74f58deacc77	048fb2d9-6651-4ba0-b36a-a526539f4cfd	2002_2003_Europe_fmtrpt.tsv	Slovenia	SVN	DOS Europe Region, Slovenia, International Military Education and Training (IMET),FY02	SCHOOL										https://2009-2017.state.gov/documents/organization/21819.pdf	Not checked against source; verify accuracy before use	2003-05	2019-07-16	9d64ec27ae96ab89bc7f3066a1ec5ef1
dd69ab1e-106a-4e0c-a073-33f3c5c97160	048fb2d9-6651-4ba0-b36a-a526539f4cfd	2002_2003_Near_East_fmtrpt.tsv	Egypt	EGY	Near East Region, Egypt, Foreign Military Financing (FMF), FY 02	AEROSPACE		Air Force: Aerospace Medical Institute,	1/28/02	2002-01-28	2/28/02	2002-02-28	BROOKS AFB, TX 78235-5123	1	10918	https://2009-2017.state.gov/documents/organization/21820.pdf	Not checked against source; verify accuracy before use	2003-05	2019-07-16	d73e1f68c8f036bc8479d5c8d36c65c1
73868638-9c99-46d1-8a30-64db134d2ca3	048fb2d9-6651-4ba0-b36a-a526539f4cfd	2002_2003_Near_East_fmtrpt.tsv	Egypt	EGY	Near East Region, Egypt, Foreign Military Financing (FMF), FY 02	PHYSIOLOGY(SATP)		Cairo								https://2009-2017.state.gov/documents/organization/21820.pdf	Not checked against source; verify accuracy before use	2003-05	2019-07-16	a0f9a2fa80e4f2091f06cc12d9796536
5f4e4bd0-3a27-4f0b-84de-ac8be8750d9b	048fb2d9-6651-4ba0-b36a-a526539f4cfd	2002_2003_Near_East_fmtrpt.tsv	Egypt	EGY	Near East Region, Egypt, Foreign Military Financing (FMF), FY 02	EIMSS HARDWARE		Air Force: Mansoura Air Base	4/8/02	2002-04-08	4/19/02	2002-04-19	GERMANTOWN MD 20871	1	3201	https://2009-2017.state.gov/documents/organization/21820.pdf	Not checked against source; verify accuracy before use	2003-05	2019-07-16	f046ccf22ab809f7d6e5ff3a1856e0dd
f0c31f88-d901-411e-a4d7-3f284591e82c	048fb2d9-6651-4ba0-b36a-a526539f4cfd	2002_2003_Near_East_fmtrpt.tsv	Egypt	EGY	Near East Region, Egypt, Foreign Military Financing (FMF), FY 02	MAINTENANCE										https://2009-2017.state.gov/documents/organization/21820.pdf	Not checked against source; verify accuracy before use	2003-05	2019-07-16	a7f8b735c2132a55a66ca49fee8c9d06
8bdcbb20-7be5-4146-a40f-5819568f5f37	048fb2d9-6651-4ba0-b36a-a526539f4cfd	2002_2003_Near_East_fmtrpt.tsv	Egypt	EGY	Near East Region, Egypt, Foreign Military Financing (FMF), FY 02	EIMSS HARDWARE		Egyptian Air Force	4/8/02	2002-04-08	4/19/02	2002-04-19	GERMANTOWN MD 20871	1	3201	https://2009-2017.state.gov/documents/organization/21820.pdf	Not checked against source; verify accuracy before use	2003-05	2019-07-16	995d26d711527cebfd59827e05d7d26a
6642b474-9b46-4fa2-b73d-bc6a346d8ab1	048fb2d9-6651-4ba0-b36a-a526539f4cfd	2002_2003_Near_East_fmtrpt.tsv	Egypt	EGY	Near East Region, Egypt, Foreign Military Financing (FMF), FY 02	MAINTENANCE										https://2009-2017.state.gov/documents/organization/21820.pdf	Not checked against source; verify accuracy before use	2003-05	2019-07-16	a7f8b735c2132a55a66ca49fee8c9d06
5da60fe3-5592-43a2-9823-994f653b0ec4	048fb2d9-6651-4ba0-b36a-a526539f4cfd	2002_2003_Near_East_fmtrpt.tsv	Egypt	EGY	Near East Region, Egypt, Foreign Military Financing (FMF), FY 02	EIMSS HARDWARE		Air Force: Ganaklies Air Base	4/8/02	2002-04-08	4/19/02	2002-04-19	GERMANTOWN MD 20871	1	3201	https://2009-2017.state.gov/documents/organization/21820.pdf	Not checked against source; verify accuracy before use	2003-05	2019-07-16	514ac8c015864136e3d526388ee40728
3da6c22a-b7e4-4c0b-ac25-83a5be038a9f	048fb2d9-6651-4ba0-b36a-a526539f4cfd	2002_2003_Near_East_fmtrpt.tsv	Egypt	EGY	Near East Region, Egypt, Foreign Military Financing (FMF), FY 02	MAINTENANCE										https://2009-2017.state.gov/documents/organization/21820.pdf	Not checked against source; verify accuracy before use	2003-05	2019-07-16	a7f8b735c2132a55a66ca49fee8c9d06
9d83b10b-ede6-4c18-924d-58735fc9912e	048fb2d9-6651-4ba0-b36a-a526539f4cfd	2002_2003_Near_East_fmtrpt.tsv	Israel	ISR	Near East Region, Israel, Foreign Military Financing (FMF), FY 02	COMMAND AND CONTROL		Navy	2/25/02	2002-02-25	4/12/02	2002-04-12	QUANTICO, VA 22134	1	1102	https://2009-2017.state.gov/documents/organization/21820.pdf	Not checked against source; verify accuracy before use	2003-05	2019-07-16	a6046acfe6be0c30f1dd833cc67d16ca
249e39a4-fc1f-486d-9bd5-b1c17f8cf4e0	048fb2d9-6651-4ba0-b36a-a526539f4cfd	2002_2003_Near_East_fmtrpt.tsv	Israel	ISR	Near East Region, Israel, Foreign Military Financing (FMF), FY 02	SYSTEM										https://2009-2017.state.gov/documents/organization/21820.pdf	Not checked against source; verify accuracy before use	2003-05	2019-07-16	c91199d1198ebb78c0dc19480028838e
b68fb495-4ee6-4d8a-ad2f-cffca4440969	048fb2d9-6651-4ba0-b36a-a526539f4cfd	2002_2003_Near_East_fmtrpt.tsv	Israel	ISR	Near East Region, Israel, Foreign Military Financing (FMF), FY 02	COMMAND AND CONTROL		Navy	2/25/02	2002-02-25	4/12/02	2002-04-12	QUANTICO, VA 22134	1	1102	https://2009-2017.state.gov/documents/organization/21820.pdf	Not checked against source; verify accuracy before use	2003-05	2019-07-16	a6046acfe6be0c30f1dd833cc67d16ca
7d54b8a6-98af-4916-9e62-aa5daa00cd1f	048fb2d9-6651-4ba0-b36a-a526539f4cfd	2002_2003_Near_East_fmtrpt.tsv	Israel	ISR	Near East Region, Israel, Foreign Military Financing (FMF), FY 02	SYSTEM										https://2009-2017.state.gov/documents/organization/21820.pdf	Not checked against source; verify accuracy before use	2003-05	2019-07-16	c91199d1198ebb78c0dc19480028838e
53dc1d70-9a50-49d2-83de-5ef2d7032637	048fb2d9-6651-4ba0-b36a-a526539f4cfd	2002_2003_Near_East_fmtrpt.tsv	Israel	ISR	Near East Region, Israel, Foreign Military Financing (FMF), FY 02	CRS										https://2009-2017.state.gov/documents/organization/21820.pdf	Not checked against source; verify accuracy before use	2003-05	2019-07-16	ae0aa64bacc5e5385095d750abbdd548
fc94a9cc-a132-4a02-b471-a5811c5d9b5a	048fb2d9-6651-4ba0-b36a-a526539f4cfd	2002_2003_Near_East_fmtrpt.tsv	Jordan	JOR	DOS Near East Region, Jordan, International Military Education and Training (IMET),FY02	ACADEMIC INSTRUCTOR		COMMINICATIONS DIR	8/5/02	2002-08-05	8/30/02	2002-08-30	MAXWELL AFB, AL 36112-6323	1	2747	https://2009-2017.state.gov/documents/organization/21820.pdf	Not checked against source; verify accuracy before use	2003-05	2019-07-16	85cda492dfd7610f34656aa6883b393e
7cf2cf0c-e4d2-433b-8b9e-2d67720a2873	048fb2d9-6651-4ba0-b36a-a526539f4cfd	2002_2003_Near_East_fmtrpt.tsv	Jordan	JOR	Near East Region, Jordan, International Military Education and Training (IMET), FY 02	SCHOOL										https://2009-2017.state.gov/documents/organization/21820.pdf	Not checked against source; verify accuracy before use	2003-05	2019-07-16	aefe0b4c35f1eda8252837b0389f65ec
27b38b33-eed4-4d6f-b592-bc163e35cbb8	048fb2d9-6651-4ba0-b36a-a526539f4cfd	2002_2003_Near_East_fmtrpt.tsv	Jordan	JOR	Near East Region, Jordan, International Military Education and Training (IMET), FY 02	ACADEMIC INSTRUCTOR		AIR TRANSPORT DIR	4/1/02	2002-04-01	4/26/02	2002-04-26	MAXWELL AFB, AL 36112-6323	1	2935	https://2009-2017.state.gov/documents/organization/21820.pdf	Not checked against source; verify accuracy before use	2003-05	2019-07-16	444f7004a386ba947b9f8026bbfa6961
38a407d2-e301-4426-a608-71c5138dc065	048fb2d9-6651-4ba0-b36a-a526539f4cfd	2002_2003_Near_East_fmtrpt.tsv	Jordan	JOR	Near East Region, Jordan, International Military Education and Training (IMET), FY 02	SCHOOL										https://2009-2017.state.gov/documents/organization/21820.pdf	Not checked against source; verify accuracy before use	2003-05	2019-07-16	aefe0b4c35f1eda8252837b0389f65ec
690e2da2-eac8-4381-9806-f506f2294986	048fb2d9-6651-4ba0-b36a-a526539f4cfd	2002_2003_Near_East_fmtrpt.tsv	Jordan	JOR	Near East Region, Jordan, International Military Education and Training (IMET), FY 02	ACADEMIC INSTRUCTOR		MOWAFAQ AL SALTI AIR BASE	4/1/02	2002-04-01	4/26/02	2002-04-26	MAXWELL AFB, AL 36112-6323	1	2232	https://2009-2017.state.gov/documents/organization/21820.pdf	Not checked against source; verify accuracy before use	2003-05	2019-07-16	43e1f4e46e48535940922f1a0d008557
4c20a69e-76bb-45b6-8087-a993d6b52478	048fb2d9-6651-4ba0-b36a-a526539f4cfd	2002_2003_Near_East_fmtrpt.tsv	Jordan	JOR	Near East Region, Jordan, International Military Education and Training (IMET), FY 02	SCHOOL										https://2009-2017.state.gov/documents/organization/21820.pdf	Not checked against source; verify accuracy before use	2003-05	2019-07-16	aefe0b4c35f1eda8252837b0389f65ec
cee6cf6b-f4d0-4de9-99e0-61291eb2904b	048fb2d9-6651-4ba0-b36a-a526539f4cfd	2002_2003_Near_East_fmtrpt.tsv	Jordan	JOR	Near East Region, Jordan, International Military Education and Training (IMET), FY 02	INTL HYDROG MGT & ENG PGM		HOUSING DIR	3/25/02	2002-03-25	9/27/02	2002-09-27	STENNIS SPACE CENTER, MS	1 39522-5001	24775	https://2009-2017.state.gov/documents/organization/21820.pdf	Not checked against source; verify accuracy before use	2003-05	2019-07-16	0b0e88bb6c2845d6410106151b37dee4
d7946609-4e78-4f5a-adfe-b157a52c05f3	048fb2d9-6651-4ba0-b36a-a526539f4cfd	2002_2003_Near_East_fmtrpt.tsv	Jordan	JOR	Near East Region, Jordan, International Military Education and Training (IMET), FY 02	MTT OUTBOARD MTR MAINT		JAF Navy	9/9/02	2002-09-09	9/13/02	2002-09-13	Jordan	6	16488	https://2009-2017.state.gov/documents/organization/21820.pdf	Not checked against source; verify accuracy before use	2003-05	2019-07-16	ebca231ddb1003ae0258f6f732cda1cd
bdd5a91a-de3b-4a62-85a9-88e8a25cc732	048fb2d9-6651-4ba0-b36a-a526539f4cfd	2002_2003_Near_East_fmtrpt.tsv	Jordan	JOR	Near East Region, Jordan, International Military Education and Training (IMET), FY 02	CG9										https://2009-2017.state.gov/documents/organization/21820.pdf	Not checked against source; verify accuracy before use	2003-05	2019-07-16	625a3a361d119b47316efb8d95f3812e
8fccbeae-543e-4b1d-ab66-ac040670c4f9	048fb2d9-6651-4ba0-b36a-a526539f4cfd	2002_2003_Near_East_fmtrpt.tsv	Lebanon	LBN	Near East Region, Lebanon, International Military Education and Training (IMET), FY 02	MTT OUTBOARD MTR MAINT		7 Jounieh Naval Base, 7 Beirut Naval	9/2/02	2002-09-02	9/6/02	2002-09-06	Lebanon	16	7635	https://2009-2017.state.gov/documents/organization/21820.pdf	Not checked against source; verify accuracy before use	2003-05	2019-07-16	15fcb477e4b8e81b968caf0d2305c276
0789c6bb-abad-4762-87a5-f30aae90f8e9	048fb2d9-6651-4ba0-b36a-a526539f4cfd	2002_2003_Near_East_fmtrpt.tsv	Lebanon	LBN	Near East Region, Lebanon, International Military Education and Training (IMET), FY 02	CG9		Base and 2 Navy Equipment								https://2009-2017.state.gov/documents/organization/21820.pdf	Not checked against source; verify accuracy before use	2003-05	2019-07-16	d6915d18f3cde67b3882128f28f925d4
cfae31eb-44bf-41d6-a15c-5b418b64e3c0	048fb2d9-6651-4ba0-b36a-a526539f4cfd	2002_2003_Near_East_fmtrpt.tsv	Morocco	MAR	Near East Region, Morocco, International Military Education and Training (IMET), FY 02	MANAGING ENG LANG		ERN-casablanca	12/10/01	2001-12-10	2/1/02	2002-02-01	LACKLAND AFB, TX 78236	1	3830	https://2009-2017.state.gov/documents/organization/21820.pdf	Not checked against source; verify accuracy before use	2003-05	2019-07-16	82ddea914783e8ad60f9e3e3d69117ae
dd289de5-cfce-4e57-984c-f283d7dbd79d	048fb2d9-6651-4ba0-b36a-a526539f4cfd	2002_2003_Near_East_fmtrpt.tsv	Morocco	MAR	Near East Region, Morocco, International Military Education and Training (IMET), FY 02	TNG(MELT										https://2009-2017.state.gov/documents/organization/21820.pdf	Not checked against source; verify accuracy before use	2003-05	2019-07-16	f115b04044c0de06a0084e3e0536ebca
d15bba0b-5503-444d-bbbe-8637bea2046b	048fb2d9-6651-4ba0-b36a-a526539f4cfd	2002_2003_Near_East_fmtrpt.tsv	Morocco	MAR	Near East Region, Morocco, International Military Education and Training (IMET), FY 02	MANAGING ENG LANG		3base-kenitra	12/10/01	2001-12-10	2/1/02	2002-02-01	LACKLAND AFB, TX 78236	1	6673	https://2009-2017.state.gov/documents/organization/21820.pdf	Not checked against source; verify accuracy before use	2003-05	2019-07-16	0b97fc45987eddc5c0d1e1696ed8ef28
5e975365-8b91-42eb-ba2e-dcf9f280b73c	048fb2d9-6651-4ba0-b36a-a526539f4cfd	2002_2003_Near_East_fmtrpt.tsv	Morocco	MAR	Near East Region, Morocco, International Military Education and Training (IMET), FY 02	TNG(MELT										https://2009-2017.state.gov/documents/organization/21820.pdf	Not checked against source; verify accuracy before use	2003-05	2019-07-16	f115b04044c0de06a0084e3e0536ebca
48a97c08-1e5a-4427-8b47-b482819b9700	048fb2d9-6651-4ba0-b36a-a526539f4cfd	2002_2003_Near_East_fmtrpt.tsv	Oman	OMN	DOS Near East Region, Oman, International Military Education and Training (IMET),FY02	COMB AEROSPACE OPS SNR		OIC, 14th Squadron, Seeb Airbase,	3/11/02	2002-03-11	3/15/02	2002-03-15	HURLBURT FIELD, FL 32544-5826	1	1650	https://2009-2017.state.gov/documents/organization/21820.pdf	Not checked against source; verify accuracy before use	2003-05	2019-07-16	b7bf79c36838380c40b77aaa098e811e
9fdc78be-25b8-4c00-add1-3af279eb12e5	048fb2d9-6651-4ba0-b36a-a526539f4cfd	2002_2003_Near_East_fmtrpt.tsv	Oman	OMN	DOS Near East Region, Oman, International Military Education and Training (IMET),FY02	STF		Oman								https://2009-2017.state.gov/documents/organization/21820.pdf	Not checked against source; verify accuracy before use	2003-05	2019-07-16	01a491fb237057ec7371e13a7da53efc
992d1e82-6c08-412c-989e-f85098e13f80	048fb2d9-6651-4ba0-b36a-a526539f4cfd	2002_2003_Near_East_fmtrpt.tsv	Oman	OMN	DOS Near East Region, Oman, International Military Education and Training (IMET),FY02	COMB AEROSPACE OPS SNR		Staff Officer 1, ATC, HQ Royal Air	3/11/02	2002-03-11	3/15/02	2002-03-15	HURLBURT FIELD, FL 32544-5826	1	1650	https://2009-2017.state.gov/documents/organization/21820.pdf	Not checked against source; verify accuracy before use	2003-05	2019-07-16	6aa17a1a9d502e9a3db7922c4703c954
ad8b920d-5431-4b87-8efa-09a839995c29	048fb2d9-6651-4ba0-b36a-a526539f4cfd	2002_2003_Near_East_fmtrpt.tsv	Oman	OMN	DOS Near East Region, Oman, International Military Education and Training (IMET),FY02	STF		Force, MAM								https://2009-2017.state.gov/documents/organization/21820.pdf	Not checked against source; verify accuracy before use	2003-05	2019-07-16	6888122b5e8ce8860a5cbc6b030ca349
abb508bf-3774-4532-a14b-784352f57ef5	048fb2d9-6651-4ba0-b36a-a526539f4cfd	2002_2003_Near_East_fmtrpt.tsv	Tunisia	TUN	Near East Region, Tunisia, International Military Education and Training (IMET), FY 02	INTL HYDROG MGT & ENG PGM		12 Intervention and Support Division	3/25/02	2002-03-25	9/27/02	2002-09-27	STENNIS SPACE CENTER, MS	1 39522-5001	21401	https://2009-2017.state.gov/documents/organization/21820.pdf	Not checked against source; verify accuracy before use	2003-05	2019-07-16	3683f9ccb386dd1f45d3d52e0dd5c6c9
1f9c2c3e-ffb8-4ea6-a298-112c7f686255	048fb2d9-6651-4ba0-b36a-a526539f4cfd	2002_2003_Near_East_fmtrpt.tsv	Tunisia	TUN	Near East Region, Tunisia, International Military Education and Training (IMET), FY 02	MANAGING ENG LANG		Language Center El Aouina AB	12/10/01	2001-12-10	2/1/02	2002-02-01	LACKLAND AFB, TX 78236	1	6553	https://2009-2017.state.gov/documents/organization/21820.pdf	Not checked against source; verify accuracy before use	2003-05	2019-07-16	88438dc8c7024884f828bfb2c24f20a0
359d9f10-f25f-480d-a813-d369977cf84e	048fb2d9-6651-4ba0-b36a-a526539f4cfd	2002_2003_Near_East_fmtrpt.tsv	Tunisia	TUN	Near East Region, Tunisia, International Military Education and Training (IMET), FY 02	TNG(MELT										https://2009-2017.state.gov/documents/organization/21820.pdf	Not checked against source; verify accuracy before use	2003-05	2019-07-16	a34bfd051f2b7ccd6f0f92cc3266ac59
4cc1fb95-e5e1-4252-a740-6636724336f9	048fb2d9-6651-4ba0-b36a-a526539f4cfd	2002_2003_Newly_Independent_States_fmtrpt.tsv	Armenia	ARM	DOD NIS Region, Armenia, Non-Security Assistance, Unified Command,FY02	Humanitarian Demining TRNG		Armenian Humanitarian Demining Center			5/3/02 9/16/02	2002-05-03	Yerevan	48		https://2009-2017.state.gov/documents/organization/21821.pdf	Not checked against source; verify accuracy before use	2003-05	2019-07-16	37b539e31999786fe10fa358a3df3353
6c6d96b8-7063-432c-84aa-898e9835a18f	048fb2d9-6651-4ba0-b36a-a526539f4cfd	2002_2003_Newly_Independent_States_fmtrpt.tsv	Armenia	ARM	DOS NIS Region, Armenia, International Military Education and Training (IMET),FY02	DVOT/OT CONTRACTOR		Contractor Support for the OT	9/15/02	2002-09-15	9/28/02	2002-09-28	Armenia	0	15000	https://2009-2017.state.gov/documents/organization/21821.pdf	Not checked against source; verify accuracy before use	2003-05	2019-07-16	b7ce6f97f72f511df7946c83e95c3f25
56e984e4-afbe-47cf-b60b-5aa8f428cca2	048fb2d9-6651-4ba0-b36a-a526539f4cfd	2002_2003_Newly_Independent_States_fmtrpt.tsv	Armenia	ARM	DOS NIS Region, Armenia, International Military Education and Training (IMET),FY02	SUPPORT										https://2009-2017.state.gov/documents/organization/21821.pdf	Not checked against source; verify accuracy before use	2003-05	2019-07-16	7ef1418c6b3def7843859055bc09aa16
5609a34b-2753-4a97-93fe-e3b94966b1cd	048fb2d9-6651-4ba0-b36a-a526539f4cfd	2002_2003_Newly_Independent_States_fmtrpt.tsv	Azerbaijan	AZE	DOS NIS Region, Azerbaijan, International Military Education and Training (IMET),FY02	DVOT/OT CONTRACTOR		Cancelled	9/16/02	2002-09-16	9/30/02	2002-09-30	Azerbaijan	0	10050	https://2009-2017.state.gov/documents/organization/21821.pdf	Not checked against source; verify accuracy before use	2003-05	2019-07-16	cfc1dff41d21134ef3cce7c71e574237
8f657a9f-c97f-4d2b-8d19-d34a0cee8352	048fb2d9-6651-4ba0-b36a-a526539f4cfd	2002_2003_Newly_Independent_States_fmtrpt.tsv	Azerbaijan	AZE	DOS NIS Region, Azerbaijan, International Military Education and Training (IMET),FY02	SUPPORT										https://2009-2017.state.gov/documents/organization/21821.pdf	Not checked against source; verify accuracy before use	2003-05	2019-07-16	21fd99f9954774e0367f85381aade056
6ea18879-cdfa-4003-8e90-a868122a3b3b	048fb2d9-6651-4ba0-b36a-a526539f4cfd	2002_2003_Newly_Independent_States_fmtrpt.tsv	Azerbaijan	AZE	NIS Region, Azerbaijan, International Military Education and Training (IMET), FY 02	REGULATOR										https://2009-2017.state.gov/documents/organization/21821.pdf	Not checked against source; verify accuracy before use	2003-05	2019-07-16	85fb74d90861e8e490483b3a47693bbd
de21700a-3c21-4d48-b8d9-ad094e9b6d69	048fb2d9-6651-4ba0-b36a-a526539f4cfd	2002_2003_Newly_Independent_States_fmtrpt.tsv	Azerbaijan	AZE	NIS Region, Azerbaijan, International Military Education and Training (IMET), FY 02	REGULATOR										https://2009-2017.state.gov/documents/organization/21821.pdf	Not checked against source; verify accuracy before use	2003-05	2019-07-16	85fb74d90861e8e490483b3a47693bbd
d726647a-6aa3-41ee-bcc7-b1ad3af10302	048fb2d9-6651-4ba0-b36a-a526539f4cfd	2002_2003_Newly_Independent_States_fmtrpt.tsv	Georgia	GEO	DOS NIS Region, Georgia, Foreign Military Financing (FMF),FY02	ACFT PWRTRN RPR SUPV		Air Force, Alexeevka AF Base, Tbilisi,	10/23/01	2001-10-23	1/15/02	2002-01-15	FT EUSTIS VA 23604-5361	1	2017	https://2009-2017.state.gov/documents/organization/21821.pdf	Not checked against source; verify accuracy before use	2003-05	2019-07-16	92a2508937e1965ae63ca262687c8287
7cf89415-b0d0-4f33-89de-f2ac71940489	048fb2d9-6651-4ba0-b36a-a526539f4cfd	2002_2003_Newly_Independent_States_fmtrpt.tsv	Georgia	GEO	DOS NIS Region, Georgia, Foreign Military Financing (FMF),FY02	BNCOC		Georgia								https://2009-2017.state.gov/documents/organization/21821.pdf	Not checked against source; verify accuracy before use	2003-05	2019-07-16	aeffca845ebe9db6c61ef59201d5c253
388b2791-3b5c-43f7-bbac-5582e1a8a87c	048fb2d9-6651-4ba0-b36a-a526539f4cfd	2002_2003_Newly_Independent_States_fmtrpt.tsv	Kazakhstan	KAZ	DOS NIS Region, Kazakhstan, International Military Education and Training (IMET),FY02	REGULATOR										https://2009-2017.state.gov/documents/organization/21821.pdf	Not checked against source; verify accuracy before use	2003-05	2019-07-16	1a2c134514d6896adac56cf5cfd606de
5e1394f2-01c6-4b9f-89fb-439f14c5c4b0	048fb2d9-6651-4ba0-b36a-a526539f4cfd	2002_2003_Newly_Independent_States_fmtrpt.tsv	Kazakhstan	KAZ	NIS Region, Kazakhstan, International Military Education and Training (IMET), FY 02	MANAGING ENG LANG		HEAD OF GROUP OF THE	12/10/01	2001-12-10	2/1/02	2002-02-01	LACKLAND AFB, TX 78236	1	4070	https://2009-2017.state.gov/documents/organization/21821.pdf	Not checked against source; verify accuracy before use	2003-05	2019-07-16	1f8f2f91a025672008e49d672a8c23a6
aac864f7-83e8-4339-9a1b-462b708e88a3	048fb2d9-6651-4ba0-b36a-a526539f4cfd	2002_2003_Newly_Independent_States_fmtrpt.tsv	Kazakhstan	KAZ	NIS Region, Kazakhstan, International Military Education and Training (IMET), FY 02	TNG(MELT		ENGLISH LANGUAGE DEPARTMENT								https://2009-2017.state.gov/documents/organization/21821.pdf	Not checked against source; verify accuracy before use	2003-05	2019-07-16	aeb80f179b3732a7b2caf90be6bdb903
264cee2e-03c0-48e9-b0e9-e78311de41fb	048fb2d9-6651-4ba0-b36a-a526539f4cfd	2002_2003_Newly_Independent_States_fmtrpt.tsv	Kyrgyzstan	KGZ	DOS NIS Region, Kyrgyzstan, International Military Education and Training (IMET),FY02	PREP FOR & MANAG CONSEQ		Army, Head, Commo Department , Civil	2/24/02	2002-02-24	3/1/02	2002-03-01	San Luis Obispo CA 93403-4209	1	3178	https://2009-2017.state.gov/documents/organization/21821.pdf	Not checked against source; verify accuracy before use	2003-05	2019-07-16	648d2c6bf8284656c5910ab9a3fb602c
255f60c0-7549-4810-9e2a-75225f600e82	048fb2d9-6651-4ba0-b36a-a526539f4cfd	2002_2003_Newly_Independent_States_fmtrpt.tsv	Kyrgyzstan	KGZ	DOS NIS Region, Kyrgyzstan, International Military Education and Training (IMET),FY02	TE		Defense HQ, Ministry of Ecology and Emergencies								https://2009-2017.state.gov/documents/organization/21821.pdf	Not checked against source; verify accuracy before use	2003-05	2019-07-16	e00cdd13175641e1c8237dfe32ebfe62
e7b276f0-fa2c-476a-99eb-f829d6985d05	048fb2d9-6651-4ba0-b36a-a526539f4cfd	2002_2003_Newly_Independent_States_fmtrpt.tsv	Ukraine	UKR	DOD NIS Region, Ukraine, Non-Security Assistance, Unified Command,FY02	JCET		Ukranian A1594 Special Operations Unit	$31,000		7/31/02 8/15/02	2002-07-31	Odessa	20	-2	https://2009-2017.state.gov/documents/organization/21821.pdf	Not checked against source; verify accuracy before use	2003-05	2019-07-16	cfa2f37b4503cf75972b7ad3abbe0ce6
ceeefcd5-cf08-4499-9a8f-32c552812d7c	048fb2d9-6651-4ba0-b36a-a526539f4cfd	2002_2003_Newly_Independent_States_fmtrpt.tsv	Ukraine	UKR	NIS Region, Ukraine, International Military Education and Training (IMET), FY 02	MET DIILS SEMINARS		Directorate, MOD	$45,382		8/5/02 8/9/02	2002-08-05	Multinational Staffs Officer Courses, National	33 Defense Academy		https://2009-2017.state.gov/documents/organization/21821.pdf	Not checked against source; verify accuracy before use	2003-05	2019-07-16	157921601e6df1f7c7948a101e4e8c53
18561dcc-9b35-4ced-ac42-29e3633218ab	048fb2d9-6651-4ba0-b36a-a526539f4cfd	2002_2003_Newly_Independent_States_fmtrpt.tsv	Ukraine	UKR	DOS NIS Region, Ukraine, Foreign Military Financing (FMF),FY02	MTT-WHEEL VEHICLE MAINT		Officers and NCOs from various Western, Northern and Southern Operational Command units	12/15/01	2001-12-15	7/30/02	2002-07-30	Yavoriv Training Area, m/u #A 4150,	64 Western Operational Command, MOD	102532	https://2009-2017.state.gov/documents/organization/21821.pdf	Not checked against source; verify accuracy before use	2003-05	2019-07-16	8acbeb76c7ba9a311c2377d2491c0fe8
da355730-78f8-4999-aa2f-002d62627458	048fb2d9-6651-4ba0-b36a-a526539f4cfd	2002_2003_Newly_Independent_States_fmtrpt.tsv	Ukraine	UKR	DOD NIS Region, Ukraine, PME Exchanges,FY02	MET PEACE SUP OPS PH III		HQ	$13,869		9/11/02 9/12/02	2002-09-11	Multinational Staffs Officer Courses, National	22 defense Academy, MOD		https://2009-2017.state.gov/documents/organization/21821.pdf	Not checked against source; verify accuracy before use	2003-05	2019-07-16	60d869645d45b61c63ad998b95dab226
ef62579c-3e51-415c-b9d7-532fdec67419	048fb2d9-6651-4ba0-b36a-a526539f4cfd	2002_2003_South_Asia_fmtrpt.tsv	India	IND	South Asia Region, India, International Military Education and Training (IMET), FY 02	INTL HYDROG MGT & ENG PGM		Hydrographic Surveyor	4/1/02	2002-04-01	9/27/02	2002-09-27	STENNIS SPACE CENTER, MS	1 39522-5001	24133	https://2009-2017.state.gov/documents/organization/21822.pdf	Not checked against source; verify accuracy before use	2003-05	2019-07-16	871256e4160b887a3aa9f8678d4e9fa1
ab4cc663-4c47-477b-9ff2-128674afa37d	048fb2d9-6651-4ba0-b36a-a526539f4cfd	2002_2003_South_Asia_fmtrpt.tsv	Sri Lanka	LKA	DOD South Asia Region, Sri Lanka, Near East South Asia Center(NESA),FY02	JCET	Sri Lankan Navy, Special Boat	Squadron, Fast Attack Flotilla	$68,000		1/18/02 2/18/02	2002-01-18	Dakshana Naval Base, Rahuna Naval Base,	58 Hambantota		https://2009-2017.state.gov/documents/organization/21822.pdf	Not checked against source; verify accuracy before use	2003-05	2019-07-16	c76c4217b994eec25f8b7480d7adc934
5586d95a-351e-470d-aba1-f8a83dd37244	048fb2d9-6651-4ba0-b36a-a526539f4cfd	2002_2003_South_Asia_fmtrpt.tsv	Sri Lanka	LKA	DOD South Asia Region, Sri Lanka, Near East South Asia Center(NESA),FY02	JCET		Sri Lankan Navy, Number One and Two Commando Regiments, Special Boat Squadron	$89,000		8/5/02 8/26/02	2002-08-05	Kudo Oya, Hambantota, Kaluthra	40		https://2009-2017.state.gov/documents/organization/21822.pdf	Not checked against source; verify accuracy before use	2003-05	2019-07-16	2e82c755222048c939242fc8cbfd2dc3
5060b59f-c1a2-4895-8f02-69810aff93c4	048fb2d9-6651-4ba0-b36a-a526539f4cfd	2002_2003_Western_Hemisphere_fmtrpt.tsv	Argentina	ARG	Western Hemisphere Region, Argentina, International Military Education and Training (IMET), FY 02	REGULATOR										https://2009-2017.state.gov/documents/organization/21823.pdf	Not checked against source; verify accuracy before use	2003-05	2019-07-16	74c5e0b3185a169fc6817a089f6347be
47e5be56-2682-491a-9697-1347c5ed5ef3	048fb2d9-6651-4ba0-b36a-a526539f4cfd	2002_2003_Western_Hemisphere_fmtrpt.tsv	Argentina	ARG	Western Hemisphere Region, Argentina, International Military Education and Training (IMET), FY 02	REGULATOR										https://2009-2017.state.gov/documents/organization/21823.pdf	Not checked against source; verify accuracy before use	2003-05	2019-07-16	74c5e0b3185a169fc6817a089f6347be
2c37cd1b-50fa-4375-befb-d157f307bacd	048fb2d9-6651-4ba0-b36a-a526539f4cfd	2002_2003_Western_Hemisphere_fmtrpt.tsv	Argentina	ARG	Western Hemisphere Region, Argentina, International Military Education and Training (IMET), FY 02	MTT MARINE CORPS		11 students from the Infantry School 2 students from the Amphibious Commands 18 students from Infantry Base 6 students from Second Marine Battalion 2 students from Command and Logistic Support Battalion 2 students from Artillery Battalion 2 students from Communications Battalion 4 students from Amphibious Ingereers Battalion 2 students from Antiaereal Battalion	9/9/02	2002-09-09	9/21/02	2002-09-21	Baterías, Marine Base Puerto Belgrano,	49 Argentina	40920	https://2009-2017.state.gov/documents/organization/21823.pdf	Not checked against source; verify accuracy before use	2003-05	2019-07-16	c2959410105dfa97b1160545bb396d48
46b43b50-fb17-4050-8fa9-0b2c63bdd00b	048fb2d9-6651-4ba0-b36a-a526539f4cfd	2002_2003_Western_Hemisphere_fmtrpt.tsv	Argentina	ARG	Western Hemisphere Region, Argentina, International Military Education and Training (IMET), FY 02	NCO PROFESSIONAL		Material Command	5/2/02	2002-05-02	6/21/02	2002-06-21	LACKLAND AFB, TX 78236-5706	1	4562	https://2009-2017.state.gov/documents/organization/21823.pdf	Not checked against source; verify accuracy before use	2003-05	2019-07-16	ee0a97aded2a4ad02aabf3005478a36a
df04127d-1845-4206-a6e7-560322515db2	048fb2d9-6651-4ba0-b36a-a526539f4cfd	2002_2003_Western_Hemisphere_fmtrpt.tsv	Argentina	ARG	Western Hemisphere Region, Argentina, International Military Education and Training (IMET), FY 02	DEVLOPMNT										https://2009-2017.state.gov/documents/organization/21823.pdf	Not checked against source; verify accuracy before use	2003-05	2019-07-16	ee80dddcd324ab1f4834875ffc6e160d
fe42e494-02ce-4038-b763-369289eabdb3	048fb2d9-6651-4ba0-b36a-a526539f4cfd	2002_2003_Western_Hemisphere_fmtrpt.tsv	Argentina	ARG	Western Hemisphere Region, Argentina, International Military Education and Training (IMET), FY 02	NCO PROFESSIONAL		Jefatura III - Planning	5/2/02	2002-05-02	6/21/02	2002-06-21	LACKLAND AFB, TX 78236-5706	1	4562	https://2009-2017.state.gov/documents/organization/21823.pdf	Not checked against source; verify accuracy before use	2003-05	2019-07-16	325df26743f61c8df01fa0f4c9ea0cee
e1b47f05-7163-421b-8b51-804149a7b5d1	048fb2d9-6651-4ba0-b36a-a526539f4cfd	2002_2003_Western_Hemisphere_fmtrpt.tsv	Argentina	ARG	Western Hemisphere Region, Argentina, International Military Education and Training (IMET), FY 02	DEVLOPMNT										https://2009-2017.state.gov/documents/organization/21823.pdf	Not checked against source; verify accuracy before use	2003-05	2019-07-16	ee80dddcd324ab1f4834875ffc6e160d
70032099-a084-4bb1-9e82-b6bcdf906a16	048fb2d9-6651-4ba0-b36a-a526539f4cfd	2002_2003_Western_Hemisphere_fmtrpt.tsv	Argentina	ARG	DOD Western Hemisphere Region, Argentina, Center For Hemispheric Defense Studies(CHDS),FY02	CHDS Programs	Center for Hemispheric Defense Studies	Techint Organization, Universidad de la Plata, Intelligence Institute of Argentina, Government for the city of Buenos Aires	$31,996		1/28/02 2/15/02	2002-01-28	Washington, DC	4		https://2009-2017.state.gov/documents/organization/21823.pdf	Not checked against source; verify accuracy before use	2003-05	2019-07-16	cf787fa2e55ae8ff4299fa63c61b1248
8e3978a4-bdd0-4f56-81f1-8801dfea3a5d	048fb2d9-6651-4ba0-b36a-a526539f4cfd	2002_2003_Western_Hemisphere_fmtrpt.tsv	Bahamas	BHS	Western Hemisphere Region, Bahamas, Section 1004, FY 02	OUTBOARD MTR MT & OVHL		Royal Bahamas Defence Force	6/21/02	2002-06-21	8/15/02	2002-08-15	STENNIS SPACE CENTER, MS	1 39529-7099	3564	https://2009-2017.state.gov/documents/organization/21823.pdf	Not checked against source; verify accuracy before use	2003-05	2019-07-16	e095b60a8ba6a3d3ad339f2742ac8ab3
7df93004-35d0-46ca-85bd-27965f8b3f43	048fb2d9-6651-4ba0-b36a-a526539f4cfd	2002_2003_Western_Hemisphere_fmtrpt.tsv	Bahamas	BHS	Western Hemisphere Region, Bahamas, Section 1004, FY 02	OUTBOARD MTR MT & OVHL		Royal Bahamas Defence Force	3/15/02	2002-03-15	5/9/02	2002-05-09	STENNIS SPACE CENTER, MS	1 39529-7099	3564	https://2009-2017.state.gov/documents/organization/21823.pdf	Not checked against source; verify accuracy before use	2003-05	2019-07-16	246456dee877dde384e7f1ef3766089a
34e48154-4ac6-4bc9-8e09-0ad54856504c	048fb2d9-6651-4ba0-b36a-a526539f4cfd	2002_2003_Western_Hemisphere_fmtrpt.tsv	Bahamas	BHS	Western Hemisphere Region, Bahamas, Section 1004, FY 02	OUTBOARD MTR MT & OVHL		Royal Bahamas Defence Force	3/15/02	2002-03-15	5/9/02	2002-05-09	STENNIS SPACE CENTER, MS	1 39529-7099	3564	https://2009-2017.state.gov/documents/organization/21823.pdf	Not checked against source; verify accuracy before use	2003-05	2019-07-16	246456dee877dde384e7f1ef3766089a
8abe5c71-5ea9-47b5-af0c-3ffcabac3bc7	048fb2d9-6651-4ba0-b36a-a526539f4cfd	2002_2003_Western_Hemisphere_fmtrpt.tsv	Bahamas	BHS	Western Hemisphere Region, Bahamas, Section 1004, FY 02	OUTBOARD MTR MT & OVHL		Royal Bahamas Police Force	6/21/02	2002-06-21	8/15/02	2002-08-15	STENNIS SPACE CENTER, MS	1 39529-7099	3564	https://2009-2017.state.gov/documents/organization/21823.pdf	Not checked against source; verify accuracy before use	2003-05	2019-07-16	705f42e138e020f396f8583d5d9b4bc1
12a8daa0-009e-415f-bcb8-6a21f2d679e2	048fb2d9-6651-4ba0-b36a-a526539f4cfd	2002_2003_Western_Hemisphere_fmtrpt.tsv	Bahamas	BHS	Western Hemisphere Region, Bahamas, Section 1004, FY 02	OUTBOARD MTR MT & OVHL		Royal Bahamas Police Force	6/21/02	2002-06-21	8/15/02	2002-08-15	STENNIS SPACE CENTER, MS	1 39529-7099	3564	https://2009-2017.state.gov/documents/organization/21823.pdf	Not checked against source; verify accuracy before use	2003-05	2019-07-16	705f42e138e020f396f8583d5d9b4bc1
db043980-3f3c-4cd0-b7d0-8fc5ed383864	048fb2d9-6651-4ba0-b36a-a526539f4cfd	2002_2003_Western_Hemisphere_fmtrpt.tsv	Bahamas	BHS	Western Hemisphere Region, Bahamas, Section 1004, FY 02	OUTBOARD MTR MT & OVHL		Royal Bahamas Defence Force	6/21/02	2002-06-21	8/15/02	2002-08-15	STENNIS SPACE CENTER, MS	1 39529-7099	3564	https://2009-2017.state.gov/documents/organization/21823.pdf	Not checked against source; verify accuracy before use	2003-05	2019-07-16	e095b60a8ba6a3d3ad339f2742ac8ab3
e9ca90d2-84ce-47b9-b327-1a180471059c	048fb2d9-6651-4ba0-b36a-a526539f4cfd	2002_2003_Western_Hemisphere_fmtrpt.tsv	Bahamas	BHS	Western Hemisphere Region, Bahamas, Section 1004, FY 02	OUTBOARD MTR MT & OVHL		Royal Bahamas Defence Force	6/21/02	2002-06-21	8/15/02	2002-08-15	STENNIS SPACE CENTER, MS	1 39529-7099	3564	https://2009-2017.state.gov/documents/organization/21823.pdf	Not checked against source; verify accuracy before use	2003-05	2019-07-16	e095b60a8ba6a3d3ad339f2742ac8ab3
c106c1c4-11da-4a08-af31-a516dc027dc6	048fb2d9-6651-4ba0-b36a-a526539f4cfd	2002_2003_Western_Hemisphere_fmtrpt.tsv	Bahamas	BHS	Western Hemisphere Region, Bahamas, Section 1004, FY 02	PATROL CRAFT OPERATOR		Royal Bahamas Defence Force	3/15/02	2002-03-15	5/9/02	2002-05-09	STENNIS SPACE CENTER, MS	1 39529-7099	3564	https://2009-2017.state.gov/documents/organization/21823.pdf	Not checked against source; verify accuracy before use	2003-05	2019-07-16	0bb97c03fc4456c6560323659e3fa86c
82ce18de-0a72-46ac-ae8c-c74344463888	048fb2d9-6651-4ba0-b36a-a526539f4cfd	2002_2003_Western_Hemisphere_fmtrpt.tsv	Bahamas	BHS	Western Hemisphere Region, Bahamas, Section 1004, FY 02	PATROL CRAFT OPERATOR		Royal Bahamas Defence Force	3/15/02	2002-03-15	5/9/02	2002-05-09	STENNIS SPACE CENTER, MS	1 39529-7099	3564	https://2009-2017.state.gov/documents/organization/21823.pdf	Not checked against source; verify accuracy before use	2003-05	2019-07-16	0bb97c03fc4456c6560323659e3fa86c
29a59e20-c3fe-4b21-af3b-d8a39d26a435	048fb2d9-6651-4ba0-b36a-a526539f4cfd	2002_2003_Western_Hemisphere_fmtrpt.tsv	Bahamas	BHS	Western Hemisphere Region, Bahamas, Section 1004, FY 02	PATROL CRAFT PROP SYS MT		Royal Bahamas Defence Force	6/21/02	2002-06-21	8/15/02	2002-08-15	STENNIS SPACE CENTER, MS	1 39529-7099	3564	https://2009-2017.state.gov/documents/organization/21823.pdf	Not checked against source; verify accuracy before use	2003-05	2019-07-16	b6ccf3e0ada53e8869dd78e6fffbb997
58b0e99a-11b2-48d7-8440-898e9c0670e9	048fb2d9-6651-4ba0-b36a-a526539f4cfd	2002_2003_Western_Hemisphere_fmtrpt.tsv	Bahamas	BHS	Western Hemisphere Region, Bahamas, Section 1004, FY 02	PATROL CRAFT PROP SYS MT		Royal Bahamas Defence Force	6/21/02	2002-06-21	8/15/02	2002-08-15	STENNIS SPACE CENTER, MS	1 39529-7099	3564	https://2009-2017.state.gov/documents/organization/21823.pdf	Not checked against source; verify accuracy before use	2003-05	2019-07-16	b6ccf3e0ada53e8869dd78e6fffbb997
57da5992-e88d-47b7-a55e-17336dc8dcdc	048fb2d9-6651-4ba0-b36a-a526539f4cfd	2002_2003_Western_Hemisphere_fmtrpt.tsv	Bahamas	BHS	Western Hemisphere Region, Bahamas, Section 1004, FY 02	PATROL CRAFT PROP SYS MT		Royal Bahamas Defence Force	6/21/02	2002-06-21	8/15/02	2002-08-15	STENNIS SPACE CENTER, MS	1 39529-7099	3564	https://2009-2017.state.gov/documents/organization/21823.pdf	Not checked against source; verify accuracy before use	2003-05	2019-07-16	b6ccf3e0ada53e8869dd78e6fffbb997
285fe6dc-938d-4717-bfcb-14cbb470ca21	048fb2d9-6651-4ba0-b36a-a526539f4cfd	2002_2003_Western_Hemisphere_fmtrpt.tsv	Barbados	BRB	DOS Western Hemisphere Region, Barbados, International Military Education and Training (IMET),FY02	PATROL CFT OPS RIVER ENV		Coast Guard	3/15/02	2002-03-15	5/9/02	2002-05-09	STENNIS SPACE CENTER, MS	1 39529-7099	7706	https://2009-2017.state.gov/documents/organization/21823.pdf	Not checked against source; verify accuracy before use	2003-05	2019-07-16	ee1aebbc0cd0e89b5c67d8d71e0fcb14
1b6e652f-2741-4df0-90d7-6a1bfa3b813d	048fb2d9-6651-4ba0-b36a-a526539f4cfd	2002_2003_Western_Hemisphere_fmtrpt.tsv	Belize (UK)	BLZ	DOS Western Hemisphere Region, Belize (UK), International Military Education and Training (IMET),FY02	OUTBOARD MTR MT & OVHL		MARITIME WING	3/15/02	2002-03-15	5/9/02	2002-05-09	STENNIS SPACE CENTER, MS	1 39529-7099	7872	https://2009-2017.state.gov/documents/organization/21823.pdf	Not checked against source; verify accuracy before use	2003-05	2019-07-16	222a4fa161307f02ba38e1d5d8f5a904
416ad829-8af5-44ac-aa7a-2fb92c2fe473	048fb2d9-6651-4ba0-b36a-a526539f4cfd	2002_2003_Western_Hemisphere_fmtrpt.tsv	Belize (UK)	BLZ	DOS Western Hemisphere Region, Belize (UK), International Military Education and Training (IMET),FY02	OUTBOARD MTR MT & OVHL		MARITIME WING	3/15/02	2002-03-15	5/9/02	2002-05-09	STENNIS SPACE CENTER, MS	1 39529-7099	7872	https://2009-2017.state.gov/documents/organization/21823.pdf	Not checked against source; verify accuracy before use	2003-05	2019-07-16	222a4fa161307f02ba38e1d5d8f5a904
850bc3e7-2892-464d-a214-e86a10836f60	048fb2d9-6651-4ba0-b36a-a526539f4cfd	2002_2003_Western_Hemisphere_fmtrpt.tsv	Belize (UK)	BLZ	DOS Western Hemisphere Region, Belize (UK), International Military Education and Training (IMET),FY02	OUTBOARD MTR MT & OVHL		MARITIME WING	6/21/02	2002-06-21	8/15/02	2002-08-15	STENNIS SPACE CENTER, MS	1 39529-7099	7292	https://2009-2017.state.gov/documents/organization/21823.pdf	Not checked against source; verify accuracy before use	2003-05	2019-07-16	4c2b02433ec14ef547339837d29438d7
ab544748-e323-4e6b-b19f-db4ae456b20d	048fb2d9-6651-4ba0-b36a-a526539f4cfd	2002_2003_Western_Hemisphere_fmtrpt.tsv	Belize (UK)	BLZ	DOS Western Hemisphere Region, Belize (UK), International Military Education and Training (IMET),FY02	RULE OF LAW&DISCP MIL OPS		MARITIME WING	5/13/02	2002-05-13	5/17/02	2002-05-17	STENNIS SPACE CENTER, MS	1 39529-7099	320	https://2009-2017.state.gov/documents/organization/21823.pdf	Not checked against source; verify accuracy before use	2003-05	2019-07-16	09d550d537d6b0dab5d407f5b50aca3f
5197ac8e-6f4b-40b5-90d6-19efdafd0304	048fb2d9-6651-4ba0-b36a-a526539f4cfd	2002_2003_Western_Hemisphere_fmtrpt.tsv	Belize (UK)	BLZ	DOS Western Hemisphere Region, Belize (UK), International Military Education and Training (IMET),FY02	RULE OF LAW&DISCP MIL OPS		MARITIME WING	5/13/02	2002-05-13	5/17/02	2002-05-17	STENNIS SPACE CENTER, MS	1 39529-7099	320	https://2009-2017.state.gov/documents/organization/21823.pdf	Not checked against source; verify accuracy before use	2003-05	2019-07-16	09d550d537d6b0dab5d407f5b50aca3f
92256d36-31e6-4d14-895b-d56ec3a1548d	048fb2d9-6651-4ba0-b36a-a526539f4cfd	2002_2003_Western_Hemisphere_fmtrpt.tsv	Bolivia	BOL	DOD Western Hemisphere Region, Bolivia, Non-Security Assistance, Unified Command,FY02	JCET	1/20 SFG, 16 SOW, 23 STS, 720 STG, 25 IS	GAI, Tocopillo BN, Victoria BN (CITE), Jordan BN, SF Command, Condor School, Mendez Arcos BN, Manchego BN	5/13/02	2002-05-13	6/12/02	2002-06-12	El Paso, Cochanbamba, Sandanita, Ororu	300 Provence	154700	https://2009-2017.state.gov/documents/organization/21823.pdf	Not checked against source; verify accuracy before use	2003-05	2019-07-16	00da8777cd30f6c863ff06961df21ad4
fef87f2b-b78f-43ec-a92c-b4e2c43b3be7	048fb2d9-6651-4ba0-b36a-a526539f4cfd	2002_2003_Western_Hemisphere_fmtrpt.tsv	Bolivia	BOL	Western Hemisphere Region, Bolivia, Section 1004, FY 02	PATROL CRAFT OPERATOR		BL Navy, Blue Devils Riverine Task Force, Trinidad	4/19/02	2002-04-19	6/13/02	2002-06-13	STENNIS SPACE CENTER, MS	1 39529-7099	3564	https://2009-2017.state.gov/documents/organization/21823.pdf	Not checked against source; verify accuracy before use	2003-05	2019-07-16	04a60180aba35d6932c682fb6c5a538d
e13c94a1-a3f5-484e-9451-29e815f1274a	048fb2d9-6651-4ba0-b36a-a526539f4cfd	2002_2003_Western_Hemisphere_fmtrpt.tsv	Bolivia	BOL	Western Hemisphere Region, Bolivia, Section 1004, FY 02	PATROL CRAFT OPERATOR		BL Navy, Blue Devils Riverine Task Force, Trinidad	4/19/02	2002-04-19	6/13/02	2002-06-13	STENNIS SPACE CENTER, MS	1 39529-7099	3564	https://2009-2017.state.gov/documents/organization/21823.pdf	Not checked against source; verify accuracy before use	2003-05	2019-07-16	04a60180aba35d6932c682fb6c5a538d
c38f3852-324c-4576-a056-073403ddfa64	048fb2d9-6651-4ba0-b36a-a526539f4cfd	2002_2003_Western_Hemisphere_fmtrpt.tsv	Bolivia	BOL	Western Hemisphere Region, Bolivia, Section 1004, FY 02	PATROL CRAFT OPERATOR		BL Navy, Blue Devils Riverine Task Force, Trinidad	4/19/02	2002-04-19	6/13/02	2002-06-13	STENNIS SPACE CENTER, MS	1 39529-7099	3564	https://2009-2017.state.gov/documents/organization/21823.pdf	Not checked against source; verify accuracy before use	2003-05	2019-07-16	04a60180aba35d6932c682fb6c5a538d
8f32cbca-4f6f-4f08-8c42-0c12303840b1	048fb2d9-6651-4ba0-b36a-a526539f4cfd	2002_2003_Western_Hemisphere_fmtrpt.tsv	Bolivia	BOL	Western Hemisphere Region, Bolivia, Section 1004, FY 02	PATROL CRAFT OPERATOR		BL Navy, Blue Devils Riverine Task Force, Trinidad	4/19/02	2002-04-19	6/13/02	2002-06-13	STENNIS SPACE CENTER, MS	1 39529-7099	3564	https://2009-2017.state.gov/documents/organization/21823.pdf	Not checked against source; verify accuracy before use	2003-05	2019-07-16	04a60180aba35d6932c682fb6c5a538d
423c1231-a374-496c-8373-9e9bf808ed1d	048fb2d9-6651-4ba0-b36a-a526539f4cfd	2002_2003_Western_Hemisphere_fmtrpt.tsv	Bolivia	BOL	Western Hemisphere Region, Bolivia, Section 1004, FY 02	PATROL CRAFT WEAPONS MT		BL Navy, Blue Devils Riverine Task Force, Trinidad	6/17/02	2002-06-17	7/12/02	2002-07-12	STENNIS SPACE CENTER, MS	1 39529-7099	1782	https://2009-2017.state.gov/documents/organization/21823.pdf	Not checked against source; verify accuracy before use	2003-05	2019-07-16	f539c5347787673ca8429c43aea47849
6c39aacf-696b-4efb-94cc-f1b517076972	048fb2d9-6651-4ba0-b36a-a526539f4cfd	2002_2003_Western_Hemisphere_fmtrpt.tsv	Bolivia	BOL	Western Hemisphere Region, Bolivia, Section 1004, FY 02	PATROL CRAFT WEAPONS MT		BL Navy, Blue Devils Riverine Task Force, Trinidad	6/17/02	2002-06-17	7/12/02	2002-07-12	STENNIS SPACE CENTER, MS	1 39529-7099	1782	https://2009-2017.state.gov/documents/organization/21823.pdf	Not checked against source; verify accuracy before use	2003-05	2019-07-16	f539c5347787673ca8429c43aea47849
27ea6605-cec3-4cc0-b680-7ef072d95a34	048fb2d9-6651-4ba0-b36a-a526539f4cfd	2002_2003_Western_Hemisphere_fmtrpt.tsv	Bolivia	BOL	Western Hemisphere Region, Bolivia, Section 1004, FY 02	PATROL CRAFT WEAPONS MT		BL Navy, Blue Devils Riverine Task Force, Trinidad	6/17/02	2002-06-17	7/12/02	2002-07-12	STENNIS SPACE CENTER, MS	1 39529-7099	1782	https://2009-2017.state.gov/documents/organization/21823.pdf	Not checked against source; verify accuracy before use	2003-05	2019-07-16	f539c5347787673ca8429c43aea47849
358cfa00-e143-4f56-b86f-df080a529e86	048fb2d9-6651-4ba0-b36a-a526539f4cfd	2002_2003_Western_Hemisphere_fmtrpt.tsv	Bolivia	BOL	Western Hemisphere Region, Bolivia, Section 1004, FY 02	PATROL CRAFT WEAPONS MT		BL Navy, Blue Devils RiverineTask Force, Trinidad	6/17/02	2002-06-17	7/12/02	2002-07-12	STENNIS SPACE CENTER, MS	1 39529-7099	1782	https://2009-2017.state.gov/documents/organization/21823.pdf	Not checked against source; verify accuracy before use	2003-05	2019-07-16	f539c5347787673ca8429c43aea47849
819afefe-4843-45ad-9b6d-d46c8feea67e	048fb2d9-6651-4ba0-b36a-a526539f4cfd	2002_2003_Western_Hemisphere_fmtrpt.tsv	Brazil	BRA	DOD Western Hemisphere Region, Brazil, Center For Hemispheric Defense Studies(CHDS),FY02	CHDS Programs	Center for Hemispheric Defense Studies	Ministry of Defense, National Congress, Universidade Federal de Minas Gerais, Brazilian Senate, Getulio Vargas Foundation	$63,992		7/15/02 8/2/02	2002-07-15	Washington, DC	8		https://2009-2017.state.gov/documents/organization/21823.pdf	Not checked against source; verify accuracy before use	2003-05	2019-07-16	6dfceb7e49987215f7cba35b58a38ac2
eba5fe5c-4487-4879-a368-1752003d84ce	048fb2d9-6651-4ba0-b36a-a526539f4cfd	2002_2003_Western_Hemisphere_fmtrpt.tsv	Chile	RCH	DOD Western Hemisphere Region, Chile, Non-Security Assistance, Unified Command,FY02	JCET	ST-4, 8 SOS, 16 SOW, 23 STS	Buzos Tacticos De Le Armada De Chile	$152,000		6/18/02 7/14/02	2002-06-18	Iquique, Vina Del Mar, La Serena	30		https://2009-2017.state.gov/documents/organization/21823.pdf	Not checked against source; verify accuracy before use	2003-05	2019-07-16	ad15a40c1b165543bee94bf600e3ba4e
3168e325-aa33-483e-af65-51c8cd690236	048fb2d9-6651-4ba0-b36a-a526539f4cfd	2002_2003_Western_Hemisphere_fmtrpt.tsv	Colombia	COL	Western Hemisphere Region, Colombia, International Military Education and Training (IMET), FY 02	INSTRUCTOR DEVELOPMENT		ARC Poablo Jose Porto, Cartagena	8/19/02	2002-08-19	8/30/02	2002-08-30	STENNIS SPACE CENTER, MS	1	891	https://2009-2017.state.gov/documents/organization/21823.pdf	Not checked against source; verify accuracy before use	2003-05	2019-07-16	636932dd00e74f661a8f20c3668df2b9
41698fa9-b4e6-499c-9f49-5a0575bb92b6	048fb2d9-6651-4ba0-b36a-a526539f4cfd	2002_2003_Western_Hemisphere_fmtrpt.tsv	Colombia	COL	Western Hemisphere Region, Colombia, International Military Education and Training (IMET), FY 02	CRS		(Coast Guard)						39529-7099		https://2009-2017.state.gov/documents/organization/21823.pdf	Not checked against source; verify accuracy before use	2003-05	2019-07-16	6e4a0110ecc0b21e7758d00e078a673a
3c5484fd-50b7-447b-9905-b8030ee3cbac	048fb2d9-6651-4ba0-b36a-a526539f4cfd	2002_2003_Western_Hemisphere_fmtrpt.tsv	Colombia	COL	Western Hemisphere Region, Colombia, International Military Education and Training (IMET), FY 02	INSTRUCTOR DEVELOPMENT		Marine Batt 90	7/15/02	2002-07-15	7/26/02	2002-07-26	STENNIS SPACE CENTER, MS	1	891	https://2009-2017.state.gov/documents/organization/21823.pdf	Not checked against source; verify accuracy before use	2003-05	2019-07-16	fcf1a74f64310d101c6f8e5c41425d61
11945b25-6075-4d2f-92e4-78b4727ba140	048fb2d9-6651-4ba0-b36a-a526539f4cfd	2002_2003_Western_Hemisphere_fmtrpt.tsv	Colombia	COL	Western Hemisphere Region, Colombia, International Military Education and Training (IMET), FY 02	CRS								39529-7099		https://2009-2017.state.gov/documents/organization/21823.pdf	Not checked against source; verify accuracy before use	2003-05	2019-07-16	cd4ad2c73d3e6518079d02299695784a
791f2304-d03e-4515-9fd4-0f122c0601e9	048fb2d9-6651-4ba0-b36a-a526539f4cfd	2002_2003_Western_Hemisphere_fmtrpt.tsv	Colombia	COL	Western Hemisphere Region, Colombia, International Military Education and Training (IMET), FY 02	PATROL CFT OPS RIVER ENV		Mil Police Battallion-Bogota	6/21/02	2002-06-21	8/15/02	2002-08-15	STENNIS SPACE CENTER, MS	1 39529-7099	4944	https://2009-2017.state.gov/documents/organization/21823.pdf	Not checked against source; verify accuracy before use	2003-05	2019-07-16	514ee2a151108494983cb4df799f87b2
1c832d1d-9649-4ba2-a1aa-4a910c9fae28	048fb2d9-6651-4ba0-b36a-a526539f4cfd	2002_2003_Western_Hemisphere_fmtrpt.tsv	Colombia	COL	Western Hemisphere Region, Colombia, International Military Education and Training (IMET), FY 02	PATROL CRAFT HULL MAINT		ARC Poablo Jose Porto, Cartagena (Coast Guard)	6/21/02	2002-06-21	8/15/02	2002-08-15	STENNIS SPACE CENTER, MS	1 39529-7099	4944	https://2009-2017.state.gov/documents/organization/21823.pdf	Not checked against source; verify accuracy before use	2003-05	2019-07-16	daec67f1380237a56fbab538cef62752
094460ac-69b8-4f3b-8a6c-3a1f6bdc29c2	048fb2d9-6651-4ba0-b36a-a526539f4cfd	2002_2003_Western_Hemisphere_fmtrpt.tsv	Colombia	COL	Western Hemisphere Region, Colombia, International Military Education and Training (IMET), FY 02	PATROL CRAFT WEAPONS MT		Marine Batt 90	6/17/02	2002-06-17	7/12/02	2002-07-12	STENNIS SPACE CENTER, MS	1 39529-7099	3162	https://2009-2017.state.gov/documents/organization/21823.pdf	Not checked against source; verify accuracy before use	2003-05	2019-07-16	4b8ad6884a317a98ea2df3e872bf190e
d98b8303-995d-4d9f-951b-1d6f8ecfe357	048fb2d9-6651-4ba0-b36a-a526539f4cfd	2002_2003_Western_Hemisphere_fmtrpt.tsv	Colombia	COL	Western Hemisphere Region, Colombia, International Military Education and Training (IMET), FY 02	RULE OF LAW&DISCP MIL OPS		Marine training base 2, Tumaco	8/19/02	2002-08-19	8/23/02	2002-08-23	STENNIS SPACE CENTER, MS	1 39529-7099	1380	https://2009-2017.state.gov/documents/organization/21823.pdf	Not checked against source; verify accuracy before use	2003-05	2019-07-16	a8d010c4b1ea97535a58d58bcc633467
46105d99-6475-45ad-b27e-2ae9ff6ccb1e	048fb2d9-6651-4ba0-b36a-a526539f4cfd	2002_2003_Western_Hemisphere_fmtrpt.tsv	Colombia	COL	Western Hemisphere Region, Colombia, Section 1004, FY 02	INSTRUCTOR DEVELOPMENT		BOGOTA RIV BAT	8/19/02	2002-08-19	8/30/02	2002-08-30	STENNIS SPACE CENTER, MS	1	891	https://2009-2017.state.gov/documents/organization/21823.pdf	Not checked against source; verify accuracy before use	2003-05	2019-07-16	65224157d298b8cc63be918cf51ef5a4
3d52b343-e74a-4672-b6a8-f8e0c9942279	048fb2d9-6651-4ba0-b36a-a526539f4cfd	2002_2003_Western_Hemisphere_fmtrpt.tsv	Colombia	COL	Western Hemisphere Region, Colombia, Section 1004, FY 02	CRS								39529-7099		https://2009-2017.state.gov/documents/organization/21823.pdf	Not checked against source; verify accuracy before use	2003-05	2019-07-16	b21b19750af15d5c3e58fbf8850f0e10
8050657b-1cfd-4a08-b3ca-c4b393c5f100	048fb2d9-6651-4ba0-b36a-a526539f4cfd	2002_2003_Western_Hemisphere_fmtrpt.tsv	Colombia	COL	Western Hemisphere Region, Colombia, Section 1004, FY 02	INSTRUCTOR DEVELOPMENT		RIV BAT 90 PTO LEGUIZAMO	8/19/02	2002-08-19	8/30/02	2002-08-30	STENNIS SPACE CENTER, MS	1	891	https://2009-2017.state.gov/documents/organization/21823.pdf	Not checked against source; verify accuracy before use	2003-05	2019-07-16	0157557d4aab0aeff3b616d2aea048a8
c7d6aa5c-f599-4cf3-8853-68fef40de98f	048fb2d9-6651-4ba0-b36a-a526539f4cfd	2002_2003_Western_Hemisphere_fmtrpt.tsv	Colombia	COL	Western Hemisphere Region, Colombia, Section 1004, FY 02	CRS								39529-7099		https://2009-2017.state.gov/documents/organization/21823.pdf	Not checked against source; verify accuracy before use	2003-05	2019-07-16	b21b19750af15d5c3e58fbf8850f0e10
3c019ecc-bae4-483e-bc3b-75ac8126f597	048fb2d9-6651-4ba0-b36a-a526539f4cfd	2002_2003_Western_Hemisphere_fmtrpt.tsv	Colombia	COL	Western Hemisphere Region, Colombia, Section 1004, FY 02	INSTRUCTOR DEVELOPMENT		BAFLIM 50 TURBO	8/19/02	2002-08-19	8/30/02	2002-08-30	STENNIS SPACE CENTER, MS	1	891	https://2009-2017.state.gov/documents/organization/21823.pdf	Not checked against source; verify accuracy before use	2003-05	2019-07-16	0382c618d74c32b4d3694b0d2395e759
ed5c29dd-340a-4dcd-a05e-9b5b06b005d8	048fb2d9-6651-4ba0-b36a-a526539f4cfd	2002_2003_Western_Hemisphere_fmtrpt.tsv	Colombia	COL	Western Hemisphere Region, Colombia, Section 1004, FY 02	CRS								39529-7099		https://2009-2017.state.gov/documents/organization/21823.pdf	Not checked against source; verify accuracy before use	2003-05	2019-07-16	b21b19750af15d5c3e58fbf8850f0e10
51fe62e4-999e-41cd-a287-55305f45204c	048fb2d9-6651-4ba0-b36a-a526539f4cfd	2002_2003_Western_Hemisphere_fmtrpt.tsv	Colombia	COL	Western Hemisphere Region, Colombia, Section 1004, FY 02	INSTRUCTOR DEVELOPMENT		RIV BAT 27 BOGOTA	8/19/02	2002-08-19	8/30/02	2002-08-30	STENNIS SPACE CENTER, MS	1	891	https://2009-2017.state.gov/documents/organization/21823.pdf	Not checked against source; verify accuracy before use	2003-05	2019-07-16	611ebd924696ab01ba1b0598ad264e38
2b0a1212-7e9d-47eb-b29e-4ea21254d092	048fb2d9-6651-4ba0-b36a-a526539f4cfd	2002_2003_Western_Hemisphere_fmtrpt.tsv	Colombia	COL	Western Hemisphere Region, Colombia, Section 1004, FY 02	CRS								39529-7099		https://2009-2017.state.gov/documents/organization/21823.pdf	Not checked against source; verify accuracy before use	2003-05	2019-07-16	b21b19750af15d5c3e58fbf8850f0e10
5e845d97-3525-4903-b0b1-2073298b8c6b	048fb2d9-6651-4ba0-b36a-a526539f4cfd	2002_2003_Western_Hemisphere_fmtrpt.tsv	Colombia	COL	Western Hemisphere Region, Colombia, Section 1004, FY 02	INSTRUCTOR DEVELOPMENT		RIVERINE BRIG BOGOTA	7/15/02	2002-07-15	7/26/02	2002-07-26	STENNIS SPACE CENTER, MS	1	891	https://2009-2017.state.gov/documents/organization/21823.pdf	Not checked against source; verify accuracy before use	2003-05	2019-07-16	120acea081a943d111521b4b7591f183
87eabfbf-595e-41bd-8842-57da63ddb601	048fb2d9-6651-4ba0-b36a-a526539f4cfd	2002_2003_Western_Hemisphere_fmtrpt.tsv	Colombia	COL	Western Hemisphere Region, Colombia, Section 1004, FY 02	CRS								39529-7099		https://2009-2017.state.gov/documents/organization/21823.pdf	Not checked against source; verify accuracy before use	2003-05	2019-07-16	b21b19750af15d5c3e58fbf8850f0e10
28714f0f-2920-4419-b5be-4412902f4db4	048fb2d9-6651-4ba0-b36a-a526539f4cfd	2002_2003_Western_Hemisphere_fmtrpt.tsv	Colombia	COL	Western Hemisphere Region, Colombia, Section 1004, FY 02	INSTRUCTOR DEVELOPMENT		RIV BAT 90 PTO LEGUIZAMO	7/15/02	2002-07-15	7/26/02	2002-07-26	STENNIS SPACE CENTER, MS	1	891	https://2009-2017.state.gov/documents/organization/21823.pdf	Not checked against source; verify accuracy before use	2003-05	2019-07-16	32022191b90057b11a573adf80797da5
83f71e17-4271-48e8-90b9-8bc0d21db145	048fb2d9-6651-4ba0-b36a-a526539f4cfd	2002_2003_Western_Hemisphere_fmtrpt.tsv	Colombia	COL	Western Hemisphere Region, Colombia, Section 1004, FY 02	CRS								39529-7099		https://2009-2017.state.gov/documents/organization/21823.pdf	Not checked against source; verify accuracy before use	2003-05	2019-07-16	b21b19750af15d5c3e58fbf8850f0e10
7e61408a-9faf-4233-91c1-fb79d286e1d7	048fb2d9-6651-4ba0-b36a-a526539f4cfd	2002_2003_Western_Hemisphere_fmtrpt.tsv	Colombia	COL	Western Hemisphere Region, Colombia, Section 1004, FY 02	PATROL CRAFT HULL MAINT		BAFLIM 50 TURBO	6/21/02	2002-06-21	8/15/02	2002-08-15	STENNIS SPACE CENTER, MS	1 39529-7099	3564	https://2009-2017.state.gov/documents/organization/21823.pdf	Not checked against source; verify accuracy before use	2003-05	2019-07-16	de1a8abd9032517d88ca40c169f7c0db
87ab4157-a771-4576-8684-d04e4d938e96	048fb2d9-6651-4ba0-b36a-a526539f4cfd	2002_2003_Western_Hemisphere_fmtrpt.tsv	Colombia	COL	Western Hemisphere Region, Colombia, Section 1004, FY 02	PATROL CRAFT HULL MAINT		RIV BAT 27 BOGOTA	6/21/02	2002-06-21	8/15/02	2002-08-15	STENNIS SPACE CENTER, MS	1 39529-7099	3564	https://2009-2017.state.gov/documents/organization/21823.pdf	Not checked against source; verify accuracy before use	2003-05	2019-07-16	fd04812af20acf847d2d32e5b57e03ec
9d99443b-2c31-4ee0-96e5-73b25eef496e	048fb2d9-6651-4ba0-b36a-a526539f4cfd	2002_2003_Western_Hemisphere_fmtrpt.tsv	Colombia	COL	Western Hemisphere Region, Colombia, Section 1004, FY 02	PATROL CRAFT PROP SYS MT		BOGOTA RIV BAT	6/21/02	2002-06-21	8/15/02	2002-08-15	STENNIS SPACE CENTER, MS	1 39529-7099	3564	https://2009-2017.state.gov/documents/organization/21823.pdf	Not checked against source; verify accuracy before use	2003-05	2019-07-16	a5d7b67b677d82f7a31ebd6200ac8fed
597ab72f-80ab-483d-9313-3b6b2de76296	048fb2d9-6651-4ba0-b36a-a526539f4cfd	2002_2003_Western_Hemisphere_fmtrpt.tsv	Colombia	COL	Western Hemisphere Region, Colombia, Section 1004, FY 02	PATROL CRAFT PROP SYS MT		RIV BAT 90 PTO LEGUIZAMO	6/21/02	2002-06-21	8/15/02	2002-08-15	STENNIS SPACE CENTER, MS	1 39529-7099	3564	https://2009-2017.state.gov/documents/organization/21823.pdf	Not checked against source; verify accuracy before use	2003-05	2019-07-16	b4eb839f9b9c3799608fe667c92e7e45
1a6dbfcd-ca2e-4d3c-8fcb-909ce26ad923	048fb2d9-6651-4ba0-b36a-a526539f4cfd	2002_2003_Western_Hemisphere_fmtrpt.tsv	Colombia	COL	Western Hemisphere Region, Colombia, Section 1004, FY 02	PATROL CRAFT WEAPONS MT		RIV BAT 90 PTO LEGUIZAMO	6/17/02	2002-06-17	7/12/02	2002-07-12	STENNIS SPACE CENTER, MS	1 39529-7099	1782	https://2009-2017.state.gov/documents/organization/21823.pdf	Not checked against source; verify accuracy before use	2003-05	2019-07-16	eaddc2af12d92c75bf617951119cb018
562a00f9-b082-447b-99ec-17837b7a2c42	048fb2d9-6651-4ba0-b36a-a526539f4cfd	2002_2003_Western_Hemisphere_fmtrpt.tsv	Colombia	COL	Western Hemisphere Region, Colombia, Section 1004, FY 02	PATROL CRAFT WEAPONS MT		RIVERINE BRIG BOGOTA	6/17/02	2002-06-17	7/12/02	2002-07-12	STENNIS SPACE CENTER, MS	1 39529-7099	1782	https://2009-2017.state.gov/documents/organization/21823.pdf	Not checked against source; verify accuracy before use	2003-05	2019-07-16	dc9b1f2e1f297c3cc307756fa36137d5
74bd919a-ec0e-4a59-ba04-259f32b6d631	048fb2d9-6651-4ba0-b36a-a526539f4cfd	2002_2003_Western_Hemisphere_fmtrpt.tsv	Colombia	COL	Western Hemisphere Region, Colombia, Section 1004, FY 02	Riverine	II MEF	Colombian Marine Corps	8/10/02	2002-08-10	9/21/02	2002-09-21	Pto Carreno, Cartegena, Pto Inirida, and	150 Tres Esquinas	250000	https://2009-2017.state.gov/documents/organization/21823.pdf	Not checked against source; verify accuracy before use	2003-05	2019-07-16	da8efdb088fb8f40489c960ea13f72ee
2a065d95-4e03-46cc-9750-dc79a1148209	048fb2d9-6651-4ba0-b36a-a526539f4cfd	2002_2003_Western_Hemisphere_fmtrpt.tsv	Colombia	COL	Western Hemisphere Region, Colombia, Section 1004, FY 02	Staff Training	Colombian Army		$125,000		4/10/02 5/30/02	2002-04-10	Larandia, Tolemeida, Tres Esquinas, Espinal	250		https://2009-2017.state.gov/documents/organization/21823.pdf	Not checked against source; verify accuracy before use	2003-05	2019-07-16	2731bbda9d51c12cdb212cc72bc4e6f0
a67b0ae9-1b04-444e-a004-541796eba801	048fb2d9-6651-4ba0-b36a-a526539f4cfd	2002_2003_Western_Hemisphere_fmtrpt.tsv	Colombia	COL	DOD Western Hemisphere Region, Colombia, Center For Hemispheric Defense Studies(CHDS),FY02	CHDS Programs	Center for Hemispheric Defense Studies	Comptroller General, National Planning Dept., Ferrostaal de Colombia	$23,997		4/8/02 4/26/02	2002-04-08	Washington, DC	3		https://2009-2017.state.gov/documents/organization/21823.pdf	Not checked against source; verify accuracy before use	2003-05	2019-07-16	7b37e636d78d39b10d8b8fa2e1578710
111b209b-1a02-4ef4-9e4f-0ba0cec73d2b	048fb2d9-6651-4ba0-b36a-a526539f4cfd	2002_2003_Western_Hemisphere_fmtrpt.tsv	Costa Rica	CRI	Western Hemisphere Region, Costa Rica, International Military Education and Training (IMET), FY 02	NCO PROFESSIONAL		Public Forces	5/2/02	2002-05-02	6/21/02	2002-06-21	LACKLAND AFB, TX 78236-5706	1	4802	https://2009-2017.state.gov/documents/organization/21823.pdf	Not checked against source; verify accuracy before use	2003-05	2019-07-16	86f3d2d3a0beed0cbe2a4eb88f1a72ed
74748296-e0fa-4fd6-9953-a4e98faf9174	048fb2d9-6651-4ba0-b36a-a526539f4cfd	2002_2003_Western_Hemisphere_fmtrpt.tsv	Costa Rica	CRI	Western Hemisphere Region, Costa Rica, International Military Education and Training (IMET), FY 02	DEVLOPMNT										https://2009-2017.state.gov/documents/organization/21823.pdf	Not checked against source; verify accuracy before use	2003-05	2019-07-16	100242e96235943a5fc009684f1b33b1
30ac9ebc-a30b-460d-8094-97b1335b5b10	048fb2d9-6651-4ba0-b36a-a526539f4cfd	2002_2003_Western_Hemisphere_fmtrpt.tsv	Costa Rica	CRI	Western Hemisphere Region, Costa Rica, International Military Education and Training (IMET), FY 02	NCO PROFESSIONAL		Public Forces	5/2/02	2002-05-02	6/21/02	2002-06-21	LACKLAND AFB, TX 78236-5706	1	4802	https://2009-2017.state.gov/documents/organization/21823.pdf	Not checked against source; verify accuracy before use	2003-05	2019-07-16	86f3d2d3a0beed0cbe2a4eb88f1a72ed
78b20ba9-38d0-426e-bd7a-cdbc26fa39b6	048fb2d9-6651-4ba0-b36a-a526539f4cfd	2002_2003_Western_Hemisphere_fmtrpt.tsv	Costa Rica	CRI	Western Hemisphere Region, Costa Rica, International Military Education and Training (IMET), FY 02	DEVLOPMNT										https://2009-2017.state.gov/documents/organization/21823.pdf	Not checked against source; verify accuracy before use	2003-05	2019-07-16	100242e96235943a5fc009684f1b33b1
27619ebf-8290-41b7-ad7b-11468a67fea6	048fb2d9-6651-4ba0-b36a-a526539f4cfd	2002_2003_Western_Hemisphere_fmtrpt.tsv	Costa Rica	CRI	Western Hemisphere Region, Costa Rica, International Military Education and Training (IMET), FY 02	NCO PROFESSIONAL		National Police Academy	5/2/02	2002-05-02	6/21/02	2002-06-21	LACKLAND AFB, TX 78236-5706	1	4802	https://2009-2017.state.gov/documents/organization/21823.pdf	Not checked against source; verify accuracy before use	2003-05	2019-07-16	42bd0ba596872d41c71a029802a46cb6
a69932db-0534-448a-a946-ca4fb1042df6	048fb2d9-6651-4ba0-b36a-a526539f4cfd	2002_2003_Western_Hemisphere_fmtrpt.tsv	Costa Rica	CRI	Western Hemisphere Region, Costa Rica, International Military Education and Training (IMET), FY 02	DEVLOPMNT										https://2009-2017.state.gov/documents/organization/21823.pdf	Not checked against source; verify accuracy before use	2003-05	2019-07-16	100242e96235943a5fc009684f1b33b1
407c3bdb-a469-43a0-b4c1-f03eeac8e726	048fb2d9-6651-4ba0-b36a-a526539f4cfd	2002_2003_Western_Hemisphere_fmtrpt.tsv	Costa Rica	CRI	Western Hemisphere Region, Costa Rica, International Military Education and Training (IMET), FY 02	PATROL CRAFT HULL MAINT		National Coast Guard Service	6/21/02	2002-06-21	8/15/02	2002-08-15	STENNIS SPACE CENTER, MS	1 39529-7099	7624	https://2009-2017.state.gov/documents/organization/21823.pdf	Not checked against source; verify accuracy before use	2003-05	2019-07-16	8b130fe135489bf9c61cb16845d0e3b1
96059adb-0445-4d92-90e9-077788292336	048fb2d9-6651-4ba0-b36a-a526539f4cfd	2002_2003_Western_Hemisphere_fmtrpt.tsv	Costa Rica	CRI	Western Hemisphere Region, Costa Rica, International Military Education and Training (IMET), FY 02	PATROL CRAFT OPERATOR		National Coast Guard Service	4/19/02	2002-04-19	6/13/02	2002-06-13	STENNIS SPACE CENTER, MS	1 39529-7099	8214	https://2009-2017.state.gov/documents/organization/21823.pdf	Not checked against source; verify accuracy before use	2003-05	2019-07-16	ddbfddcd56a2148f4adac194df8959f0
e200c245-c34a-4fca-a7d7-29dc6bde6b1b	048fb2d9-6651-4ba0-b36a-a526539f4cfd	2002_2003_Western_Hemisphere_fmtrpt.tsv	Costa Rica	CRI	Western Hemisphere Region, Costa Rica, International Military Education and Training (IMET), FY 02	PATROL CRAFT OPERATOR		National Coast Guard Service	4/19/02	2002-04-19	6/13/02	2002-06-13	STENNIS SPACE CENTER, MS	1 39529-7099	8214	https://2009-2017.state.gov/documents/organization/21823.pdf	Not checked against source; verify accuracy before use	2003-05	2019-07-16	ddbfddcd56a2148f4adac194df8959f0
32455666-b3e3-4655-833e-962cf7f4a3ae	048fb2d9-6651-4ba0-b36a-a526539f4cfd	2002_2003_Western_Hemisphere_fmtrpt.tsv	Costa Rica	CRI	Western Hemisphere Region, Costa Rica, International Military Education and Training (IMET), FY 02	PATROL CRAFT PROP SYS MT		National Coast Guard Service	6/21/02	2002-06-21	8/15/02	2002-08-15	STENNIS SPACE CENTER, MS	1 39529-7099	7624	https://2009-2017.state.gov/documents/organization/21823.pdf	Not checked against source; verify accuracy before use	2003-05	2019-07-16	99515ee8f32761a1e3e9595f45852505
f4f3f3dc-e07a-4762-be31-a2e2527c93f6	048fb2d9-6651-4ba0-b36a-a526539f4cfd	2002_2003_Western_Hemisphere_fmtrpt.tsv	Costa Rica	CRI	Western Hemisphere Region, Costa Rica, International Military Education and Training (IMET), FY 02	PATROL CRAFT PROP SYS MT		National Coast Guard Service	6/21/02	2002-06-21	8/15/02	2002-08-15	STENNIS SPACE CENTER, MS	1 39529-7099	7624	https://2009-2017.state.gov/documents/organization/21823.pdf	Not checked against source; verify accuracy before use	2003-05	2019-07-16	99515ee8f32761a1e3e9595f45852505
6510acf1-1af6-4762-bc22-f648002d529d	048fb2d9-6651-4ba0-b36a-a526539f4cfd	2002_2003_Western_Hemisphere_fmtrpt.tsv	Costa Rica	CRI	Western Hemisphere Region, Costa Rica, International Military Education and Training (IMET), FY 02	PATROL CRAFT WEAPONS MT		National Coast Guard Service	6/17/02	2002-06-17	7/12/02	2002-07-12	STENNIS SPACE CENTER, MS	1 39529-7099	4722	https://2009-2017.state.gov/documents/organization/21823.pdf	Not checked against source; verify accuracy before use	2003-05	2019-07-16	457a95b040f56cb352c2ea4e1424e59c
f20064d6-7291-47ad-93a5-b588e5385ea9	048fb2d9-6651-4ba0-b36a-a526539f4cfd	2002_2003_Western_Hemisphere_fmtrpt.tsv	Costa Rica	CRI	Western Hemisphere Region, Costa Rica, International Military Education and Training (IMET), FY 02	RULE OF LAW&DISCP MIL OPS		National Coast Guard Service	8/19/02	2002-08-19	8/23/02	2002-08-23	STENNIS SPACE CENTER, MS	1 39529-7099	2100	https://2009-2017.state.gov/documents/organization/21823.pdf	Not checked against source; verify accuracy before use	2003-05	2019-07-16	9f7dad6506faaf4d573ff43d3891da39
4a8262bf-82a3-465b-b5bb-bb86cf3e5e1c	048fb2d9-6651-4ba0-b36a-a526539f4cfd	2002_2003_Western_Hemisphere_fmtrpt.tsv	Costa Rica	CRI	Western Hemisphere Region, Costa Rica, International Military Education and Training (IMET), FY 02	RULE OF LAW&DISCP MIL OPS		National Coast Guard Service	8/19/02	2002-08-19	8/23/02	2002-08-23	STENNIS SPACE CENTER, MS	1 39529-7099	2100	https://2009-2017.state.gov/documents/organization/21823.pdf	Not checked against source; verify accuracy before use	2003-05	2019-07-16	9f7dad6506faaf4d573ff43d3891da39
80efbdbc-6188-4cbf-be41-2111a6c9475b	048fb2d9-6651-4ba0-b36a-a526539f4cfd	2002_2003_Western_Hemisphere_fmtrpt.tsv	Costa Rica	CRI	Western Hemisphere Region, Costa Rica, International Military Education and Training (IMET), FY 02	RULE OF LAW&DISCP MIL OPS		National Coast Guard Service	6/17/02	2002-06-17	6/21/02	2002-06-21	STENNIS SPACE CENTER, MS	1 39529-7099	320	https://2009-2017.state.gov/documents/organization/21823.pdf	Not checked against source; verify accuracy before use	2003-05	2019-07-16	1c17b23d5243d37c13fac64b037b8498
5b60ce81-7666-495b-8d77-64b17f4316dc	048fb2d9-6651-4ba0-b36a-a526539f4cfd	2002_2003_Western_Hemisphere_fmtrpt.tsv	Costa Rica	CRI	Western Hemisphere Region, Costa Rica, International Military Education and Training (IMET), FY 02	RULE OF LAW&DISCP MIL OPS		National Coast Guard Service	6/17/02	2002-06-17	6/21/02	2002-06-21	STENNIS SPACE CENTER, MS	1 39529-7099	320	https://2009-2017.state.gov/documents/organization/21823.pdf	Not checked against source; verify accuracy before use	2003-05	2019-07-16	1c17b23d5243d37c13fac64b037b8498
7cb6b54f-4f50-46aa-9ccb-4e14be62f77e	048fb2d9-6651-4ba0-b36a-a526539f4cfd	2002_2003_Western_Hemisphere_fmtrpt.tsv	Costa Rica	CRI	Western Hemisphere Region, Costa Rica, International Military Education and Training (IMET), FY 02	RULE OF LAW&DISCP MIL OPS		National Coast Guard Service	8/19/02	2002-08-19	8/23/02	2002-08-23	STENNIS SPACE CENTER, MS	1 39529-7099	320	https://2009-2017.state.gov/documents/organization/21823.pdf	Not checked against source; verify accuracy before use	2003-05	2019-07-16	67bc748d5c478c491b94c2d26f083d2e
adef6820-0b94-4ddb-be1c-c4184b8ccf69	048fb2d9-6651-4ba0-b36a-a526539f4cfd	2002_2003_Western_Hemisphere_fmtrpt.tsv	Costa Rica	CRI	Western Hemisphere Region, Costa Rica, International Military Education and Training (IMET), FY 02	RULE OF LAW&DISCP MIL OPS		National Coast Guard Service	8/19/02	2002-08-19	8/23/02	2002-08-23	STENNIS SPACE CENTER, MS	1 39529-7099	320	https://2009-2017.state.gov/documents/organization/21823.pdf	Not checked against source; verify accuracy before use	2003-05	2019-07-16	67bc748d5c478c491b94c2d26f083d2e
b55c8ee2-7be4-4756-a174-f1cad29caa2a	048fb2d9-6651-4ba0-b36a-a526539f4cfd	2002_2003_Western_Hemisphere_fmtrpt.tsv	Costa Rica	CRI	Western Hemisphere Region, Costa Rica, International Military Education and Training (IMET), FY 02	RULE OF LAW&DISCP MIL OPS		National Coast Guard Service	8/19/02	2002-08-19	8/23/02	2002-08-23	STENNIS SPACE CENTER, MS	1 39529-7099	2100	https://2009-2017.state.gov/documents/organization/21823.pdf	Not checked against source; verify accuracy before use	2003-05	2019-07-16	9f7dad6506faaf4d573ff43d3891da39
1dbb3b52-9558-40b3-8f51-723abccb245e	048fb2d9-6651-4ba0-b36a-a526539f4cfd	2002_2003_Western_Hemisphere_fmtrpt.tsv	Costa Rica	CRI	Western Hemisphere Region, Costa Rica, International Military Education and Training (IMET), FY 02	RULE OF LAW&DISCP MIL OPS		National Coast Guard Service	8/19/02	2002-08-19	8/23/02	2002-08-23	STENNIS SPACE CENTER, MS	1 39529-7099	2100	https://2009-2017.state.gov/documents/organization/21823.pdf	Not checked against source; verify accuracy before use	2003-05	2019-07-16	9f7dad6506faaf4d573ff43d3891da39
3dea457c-a4d5-4de4-ba6c-80159be66304	048fb2d9-6651-4ba0-b36a-a526539f4cfd	2002_2003_Western_Hemisphere_fmtrpt.tsv	Costa Rica	CRI	Western Hemisphere Region, Costa Rica, International Military Education and Training (IMET), FY 02	RULE OF LAW&DISCP MIL OPS		National Coast Guard Service	8/19/02	2002-08-19	8/23/02	2002-08-23	STENNIS SPACE CENTER, MS	1 39529-7099	2100	https://2009-2017.state.gov/documents/organization/21823.pdf	Not checked against source; verify accuracy before use	2003-05	2019-07-16	9f7dad6506faaf4d573ff43d3891da39
1f579723-4d71-4044-91c4-eda8ef9aca64	048fb2d9-6651-4ba0-b36a-a526539f4cfd	2002_2003_Western_Hemisphere_fmtrpt.tsv	Costa Rica	CRI	Western Hemisphere Region, Costa Rica, International Military Education and Training (IMET), FY 02	RULE OF LAW&DISCP MIL OPS		National Coast Guard Service	8/19/02	2002-08-19	8/23/02	2002-08-23	STENNIS SPACE CENTER, MS	1 39529-7099	320	https://2009-2017.state.gov/documents/organization/21823.pdf	Not checked against source; verify accuracy before use	2003-05	2019-07-16	67bc748d5c478c491b94c2d26f083d2e
30cc7433-7bf2-4bc1-920b-a0522890ff6a	048fb2d9-6651-4ba0-b36a-a526539f4cfd	2002_2003_Western_Hemisphere_fmtrpt.tsv	Costa Rica	CRI	DOD Western Hemisphere Region, Costa Rica, Center For Hemispheric Defense Studies(CHDS),FY02	CHDS Programs	Center for Hemispheric Defense Studies	Public Ministry, National Center for Drug Prevention, Ministry of Foreign Affairs	$23,997		1/28/02 2/15/02	2002-01-28	Washington, DC	3		https://2009-2017.state.gov/documents/organization/21823.pdf	Not checked against source; verify accuracy before use	2003-05	2019-07-16	57dbb39c2e118a0a39c646336bcacbb3
139c2788-86c9-49da-804f-cd79e2e093d5	048fb2d9-6651-4ba0-b36a-a526539f4cfd	2002_2003_Western_Hemisphere_fmtrpt.tsv	Ecuador	ECU	Western Hemisphere Region, Ecuador, Section 1004, FY 02	PATROL CRAFT OPERATOR		Brigada de Selva 19	4/19/02	2002-04-19	6/13/02	2002-06-13	STENNIS SPACE CENTER, MS	1 39529-7099	3564	https://2009-2017.state.gov/documents/organization/21823.pdf	Not checked against source; verify accuracy before use	2003-05	2019-07-16	2f7f3ef768d244068035f844752a89fb
4057e385-c49e-4f80-9ab7-12a74edbb591	048fb2d9-6651-4ba0-b36a-a526539f4cfd	2002_2003_Western_Hemisphere_fmtrpt.tsv	Ecuador	ECU	Western Hemisphere Region, Ecuador, Section 1004, FY 02	PATROL CRAFT OPERATOR		Brigada de Selva No. 19	4/19/02	2002-04-19	6/13/02	2002-06-13	STENNIS SPACE CENTER, MS	1 39529-7099	3564	https://2009-2017.state.gov/documents/organization/21823.pdf	Not checked against source; verify accuracy before use	2003-05	2019-07-16	1e879622fe0b624c73b891d453e3b4f9
58b1d37a-88a2-4d90-9783-7b2ac0b109b2	048fb2d9-6651-4ba0-b36a-a526539f4cfd	2002_2003_Western_Hemisphere_fmtrpt.tsv	El Salvador	SLV	Western Hemisphere Region, El Salvador, International Military Education and Training (IMET), FY 02	REGULATOR										https://2009-2017.state.gov/documents/organization/21823.pdf	Not checked against source; verify accuracy before use	2003-05	2019-07-16	de5f527dd21ae64394dc0f29c77bff65
c751c408-f7e2-49cb-b644-596366db51b0	048fb2d9-6651-4ba0-b36a-a526539f4cfd	2002_2003_Western_Hemisphere_fmtrpt.tsv	Guatemala	GTM	Western Hemisphere Region, Guatemala, International Military Education and Training (IMET), FY 02	REGULATOR										https://2009-2017.state.gov/documents/organization/21823.pdf	Not checked against source; verify accuracy before use	2003-05	2019-07-16	55abcc347b2b6de53d049cc81e0f83c4
dd0f20ba-5d3b-4180-8818-33e8de92baca	048fb2d9-6651-4ba0-b36a-a526539f4cfd	2002_2003_Western_Hemisphere_fmtrpt.tsv	Guatemala	GTM	Western Hemisphere Region, Guatemala, International Military Education and Training (IMET), FY 02	REGULATOR										https://2009-2017.state.gov/documents/organization/21823.pdf	Not checked against source; verify accuracy before use	2003-05	2019-07-16	55abcc347b2b6de53d049cc81e0f83c4
5b0efabd-7823-466a-873e-5af576206a70	048fb2d9-6651-4ba0-b36a-a526539f4cfd	2002_2003_Western_Hemisphere_fmtrpt.tsv	Haiti	HTI	DOD Western Hemisphere Region, Haiti, Center For Hemispheric Defense Studies(CHDS),FY02	CHDS Programs	Center for Hemispheric Defense Studies	National Police, Haitian Embassy in the Dominican Republic, Ministry of Interior, Ministry of Justice and Public Safety	$39,995		4/8/02 4/26/02	2002-04-08	Washington, DC	5		https://2009-2017.state.gov/documents/organization/21823.pdf	Not checked against source; verify accuracy before use	2003-05	2019-07-16	fe739411d36526a6b914d3924cc6bcf3
3102efe5-9e30-4059-906d-b6c311eea920	048fb2d9-6651-4ba0-b36a-a526539f4cfd	2002_2003_Western_Hemisphere_fmtrpt.tsv	Honduras	HND	Western Hemisphere Region, Honduras, International Military Education and Training (IMET), FY 02	MET CIV-MILITARY RELATIONS		HONDURAN ARMY - 9 NATIONAL SECURITY MINISTRY - 4 SOCIAL SECURITY OFFICE FOR THE HONDURAN PUBLIC UNIVERSITY - 1 PRIVATE SECTOR (INDEPENDENT PARTICIPANTS) - 4 SOCIAL SECURITY INSTITUTE FOR THE PUBLIC TEACHERS - 3 COMMAND & STAFF COLLEGE - 3 HO ARMED FORCES JOINT STAFF - 4 SOCIAL SECURITY INSTITUTE FOR THE MILITARY - 1 PUBLIC EDUCATION MINISTRY - 1 HONDURAN AIR FORCE - 2 FOREIGN RELATIONS MINISTRY - 1 HONDURAN ECONOMISTS COLLEGE - 1 NATIONAL DEFENSE COLLEGE - 3 NATIONAL ELECTRICITY COMPANY - 1	7/8/02	2002-07-08	7/12/02	2002-07-12	NATIONAL DEFENSE COLLEGE,	39 TEGUCIGALPA	25484	https://2009-2017.state.gov/documents/organization/21823.pdf	Not checked against source; verify accuracy before use	2003-05	2019-07-16	d493be1dac1c7b2e7f5fba66bc5516cf
857f61b0-dfa9-4d6a-a529-3c25436dbcfe	048fb2d9-6651-4ba0-b36a-a526539f4cfd	2002_2003_Western_Hemisphere_fmtrpt.tsv	Honduras	HND	Western Hemisphere Region, Honduras, International Military Education and Training (IMET), FY 02	MET DRMI (MIDMC)		ARMY - 9 NATONAL SECURITY MINISTRY - 4 SOCIAL SECURITY OFFICE FOR THE HONDURAN PUBLIC UNIVERSITY - 1 PRIVATE SECTOR (INDEPENDENT PARTICIPANTS) - 3 SOCIAL SECURITY OFFICE FOR THE PUBLIC TEACHERS - 3 COMMAND & STAFF COLLEGE - 2 HO ARMED FORCES JOINT STAFF - 3 SOCIAL SECURITY INSTITUTE FOR THE MILITARY - 1 MINISTRY OF PUBLIC HEALTH - 1 LIAISON OFFICE FOR THE HONDURAN BLACK WOMEN - 1 PUBLIC EDUCATION MINISTRY - 1 HONDURAN AIR FORCE - 1 BUSINESS ADMINISTRATION COLLEGE - 1 FOREIGN RELATIONS MINISTRY - 1 HONDURAN ECONOMISTS COLLEGE - 1 NATIONAL DEFENSE COLLEGE - 1 NATIONAL ELECTRICITY COMPANY - 1 HONDURAN CATHOLIC UNIVERSITY - 1	4/8/02	2002-04-08	4/19/02	2002-04-19	NATIONAL DEFENSE COLLEGE,	37 TEGUCIGALPA	56998	https://2009-2017.state.gov/documents/organization/21823.pdf	Not checked against source; verify accuracy before use	2003-05	2019-07-16	1ef6ecc2c54a4f72119667c1e476c7b9
40b73061-3249-4f96-b111-243e2595a555	048fb2d9-6651-4ba0-b36a-a526539f4cfd	2002_2003_Western_Hemisphere_fmtrpt.tsv	Honduras	HND	Western Hemisphere Region, Honduras, International Military Education and Training (IMET), FY 02	PATROL CRAFT HULL MAINT		BASE NAVAL DE AMAPALA	6/21/02	2002-06-21	8/15/02	2002-08-15	STENNIS SPACE CENTER, MS	1 39529-7099	7356	https://2009-2017.state.gov/documents/organization/21823.pdf	Not checked against source; verify accuracy before use	2003-05	2019-07-16	74d07b1f279e62ee997c27dffe74d9c0
314a9049-4ece-4edf-acb5-71572a84ed69	048fb2d9-6651-4ba0-b36a-a526539f4cfd	2002_2003_Western_Hemisphere_fmtrpt.tsv	Honduras	HND	Western Hemisphere Region, Honduras, International Military Education and Training (IMET), FY 02	PATROL CRAFT OPERATOR		BASE NAVAL DE AMAPALA	4/19/02	2002-04-19	6/13/02	2002-06-13	STENNIS SPACE CENTER, MS	1 39529-7099	7946	https://2009-2017.state.gov/documents/organization/21823.pdf	Not checked against source; verify accuracy before use	2003-05	2019-07-16	708d30a3a6f4b44631c5f8d0080486ba
b50e125b-3f57-4a20-accb-5e9680749ced	048fb2d9-6651-4ba0-b36a-a526539f4cfd	2002_2003_Western_Hemisphere_fmtrpt.tsv	Honduras	HND	Western Hemisphere Region, Honduras, International Military Education and Training (IMET), FY 02	PATROL CRAFT PROP SYS MT		NAVY BASE, PUERTO CASTILLA	6/21/02	2002-06-21	8/15/02	2002-08-15	STENNIS SPACE CENTER, MS	1 39529-7099	7356	https://2009-2017.state.gov/documents/organization/21823.pdf	Not checked against source; verify accuracy before use	2003-05	2019-07-16	394632df4b308cacfc68af76e4032a04
70558262-ada3-4c81-a6db-7f5b8cae8c1a	048fb2d9-6651-4ba0-b36a-a526539f4cfd	2002_2003_Western_Hemisphere_fmtrpt.tsv	Honduras	HND	Western Hemisphere Region, Honduras, International Military Education and Training (IMET), FY 02	PATROL CRAFT WEAPONS MT		NAVY BASE, PUERTO CORTES	6/17/02	2002-06-17	7/12/02	2002-07-12	STENNIS SPACE CENTER, MS	1 39529-7099	4454	https://2009-2017.state.gov/documents/organization/21823.pdf	Not checked against source; verify accuracy before use	2003-05	2019-07-16	bcc73eac32a2646eae55235d5e00b42c
f2d6445b-a745-44c3-b08e-95f1a6ff77ab	048fb2d9-6651-4ba0-b36a-a526539f4cfd	2002_2003_Western_Hemisphere_fmtrpt.tsv	Jamaica	JAM	DOS Western Hemisphere Region, Jamaica, International Military Education and Training (IMET),FY02	INSTRUCTOR DEVELOPMENT		JDF Coast Guard	5/13/02	2002-05-13	5/24/02	2002-05-24	STENNIS SPACE CENTER, MS	1	1491	https://2009-2017.state.gov/documents/organization/21823.pdf	Not checked against source; verify accuracy before use	2003-05	2019-07-16	d8aeb5e70b226218fedf93ba08003207
62b22d16-a875-45af-a19f-65a6c80d5947	048fb2d9-6651-4ba0-b36a-a526539f4cfd	2002_2003_Western_Hemisphere_fmtrpt.tsv	Jamaica	JAM	DOS Western Hemisphere Region, Jamaica, International Military Education and Training (IMET),FY02	CRS								39529-7099		https://2009-2017.state.gov/documents/organization/21823.pdf	Not checked against source; verify accuracy before use	2003-05	2019-07-16	f0a28bababf8a945e9966e2ac7e16b02
a4f4529b-d94d-4093-abdd-27759db12479	048fb2d9-6651-4ba0-b36a-a526539f4cfd	2002_2003_Western_Hemisphere_fmtrpt.tsv	Jamaica	JAM	Western Hemisphere Region, Jamaica, International Military Education and Training (IMET), FY 02	OUTBOARD MTR MT & OVHL		JDF Coast Guard	3/15/02	2002-03-15	5/9/02	2002-05-09	STENNIS SPACE CENTER, MS	1 39529-7099	7458	https://2009-2017.state.gov/documents/organization/21823.pdf	Not checked against source; verify accuracy before use	2003-05	2019-07-16	8079494a48546cd4a6f96d66b5e5524a
8f894227-92ca-4e2d-b345-c36d4079c2a6	048fb2d9-6651-4ba0-b36a-a526539f4cfd	2002_2003_Western_Hemisphere_fmtrpt.tsv	Jamaica	JAM	Western Hemisphere Region, Jamaica, International Military Education and Training (IMET), FY 02	PATROL CRAFT OPERATOR		JDF Coast Guard	3/15/02	2002-03-15	5/9/02	2002-05-09	STENNIS SPACE CENTER, MS	1 39529-7099	7508	https://2009-2017.state.gov/documents/organization/21823.pdf	Not checked against source; verify accuracy before use	2003-05	2019-07-16	e0cf40b21ac1e6b793d6575592a7f614
1c843bec-769e-4bad-a194-4971ec1c35ad	048fb2d9-6651-4ba0-b36a-a526539f4cfd	2002_2003_Western_Hemisphere_fmtrpt.tsv	Jamaica	JAM	Western Hemisphere Region, Jamaica, International Military Education and Training (IMET), FY 02	PATROL CRAFT OPERATOR		JDF Coast Guard	3/15/02	2002-03-15	5/9/02	2002-05-09	STENNIS SPACE CENTER, MS	1 39529-7099	7458	https://2009-2017.state.gov/documents/organization/21823.pdf	Not checked against source; verify accuracy before use	2003-05	2019-07-16	7fa7e087f8b7412c86c4fdb268280253
3d71f3f0-b214-4cf8-9644-f4e84d907e06	048fb2d9-6651-4ba0-b36a-a526539f4cfd	2002_2003_Western_Hemisphere_fmtrpt.tsv	Jamaica	JAM	Western Hemisphere Region, Jamaica, International Military Education and Training (IMET), FY 02	PATROL CRAFT WEAPONS MT		JDF Coast Guard	4/12/02	2002-04-12	5/9/02	2002-05-09	STENNIS SPACE CENTER, MS	1 39529-7099	4276	https://2009-2017.state.gov/documents/organization/21823.pdf	Not checked against source; verify accuracy before use	2003-05	2019-07-16	9d1b94eac4a09bb5a6600ca25f3f9e9f
9c339597-99d0-4925-9bf9-0ea0bf8db373	048fb2d9-6651-4ba0-b36a-a526539f4cfd	2002_2003_Western_Hemisphere_fmtrpt.tsv	Jamaica	JAM	Western Hemisphere Region, Jamaica, International Military Education and Training (IMET), FY 02	RULE OF LAW&DISCP MIL OPS		JDF Coast Guard	5/13/02	2002-05-13	5/17/02	2002-05-17	STENNIS SPACE CENTER, MS	1 39529-7099	320	https://2009-2017.state.gov/documents/organization/21823.pdf	Not checked against source; verify accuracy before use	2003-05	2019-07-16	4144601dd408a60391541ee04133a951
4dc65889-f7ef-4a5f-8b4f-5a1b088a6909	048fb2d9-6651-4ba0-b36a-a526539f4cfd	2002_2003_Western_Hemisphere_fmtrpt.tsv	Jamaica	JAM	Western Hemisphere Region, Jamaica, International Military Education and Training (IMET), FY 02	RULE OF LAW&DISCP MIL OPS		JDF Coast Guard	5/13/02	2002-05-13	5/17/02	2002-05-17	STENNIS SPACE CENTER, MS	1 39529-7099	320	https://2009-2017.state.gov/documents/organization/21823.pdf	Not checked against source; verify accuracy before use	2003-05	2019-07-16	4144601dd408a60391541ee04133a951
aa6c8c69-ce55-4870-93c6-c272b2994ef4	048fb2d9-6651-4ba0-b36a-a526539f4cfd	2002_2003_Western_Hemisphere_fmtrpt.tsv	Mexico	MEX	Western Hemisphere Region, Mexico, Section 1004, FY 02	MTT OUTBOARD MTR MAINT		BATEVAGO - 21	6/24/02	2002-06-24	6/24/02	2002-06-24	Tuxpan, Veracruz	22	9400	https://2009-2017.state.gov/documents/organization/21823.pdf	Not checked against source; verify accuracy before use	2003-05	2019-07-16	1a2d10cbd19a33b122003821d147c844
93b85943-02c1-4f41-97f3-c73f744c99ed	048fb2d9-6651-4ba0-b36a-a526539f4cfd	2002_2003_Western_Hemisphere_fmtrpt.tsv	Mexico	MEX	Western Hemisphere Region, Mexico, Section 1004, FY 02	CG9		BATSERGO - 1								https://2009-2017.state.gov/documents/organization/21823.pdf	Not checked against source; verify accuracy before use	2003-05	2019-07-16	91f781a60f5f393d901a08da674584b1
1a501d9c-9de8-4a04-a60e-941ec7271b10	048fb2d9-6651-4ba0-b36a-a526539f4cfd	2002_2003_Western_Hemisphere_fmtrpt.tsv	Nicaragua	NIC	DOS Western Hemisphere Region, Nicaragua, International Military Education and Training (IMET),FY02	PATROL CRAFT HULL MAINT		Maintenance Division	6/21/02	2002-06-21	8/15/02	2002-08-15	STENNIS SPACE CENTER, MS	1 39529-7099	7464	https://2009-2017.state.gov/documents/organization/21823.pdf	Not checked against source; verify accuracy before use	2003-05	2019-07-16	d85648d459e99f1ba5d2fe41dac94cd6
9ac995f8-61b7-44ee-b534-dcc69e8b47e1	048fb2d9-6651-4ba0-b36a-a526539f4cfd	2002_2003_Western_Hemisphere_fmtrpt.tsv	Nicaragua	NIC	DOS Western Hemisphere Region, Nicaragua, International Military Education and Training (IMET),FY02	PATROL CRAFT HULL MAINT		Pacific Naval District	6/21/02	2002-06-21	8/15/02	2002-08-15	STENNIS SPACE CENTER, MS	1 39529-7099	7464	https://2009-2017.state.gov/documents/organization/21823.pdf	Not checked against source; verify accuracy before use	2003-05	2019-07-16	457ae7c0f76c479223438313dad3d6b1
a9e10359-a0bf-42ba-9cb1-1f475e7a264b	048fb2d9-6651-4ba0-b36a-a526539f4cfd	2002_2003_Western_Hemisphere_fmtrpt.tsv	Nicaragua	NIC	DOS Western Hemisphere Region, Nicaragua, International Military Education and Training (IMET),FY02	PATROL CRAFT OPERATOR		Patrol Boat Squadron	4/19/02	2002-04-19	6/13/02	2002-06-13	STENNIS SPACE CENTER, MS	1 39529-7099	8004	https://2009-2017.state.gov/documents/organization/21823.pdf	Not checked against source; verify accuracy before use	2003-05	2019-07-16	16b96f1b190812435157b12f1c3f6a64
7c5ef362-f85f-4471-8d68-b99ee1293357	048fb2d9-6651-4ba0-b36a-a526539f4cfd	2002_2003_Western_Hemisphere_fmtrpt.tsv	Nicaragua	NIC	DOS Western Hemisphere Region, Nicaragua, International Military Education and Training (IMET),FY02	PATROL CRAFT OPERATOR		Patrol Boat Division	4/19/02	2002-04-19	6/13/02	2002-06-13	STENNIS SPACE CENTER, MS	1 39529-7099	8054	https://2009-2017.state.gov/documents/organization/21823.pdf	Not checked against source; verify accuracy before use	2003-05	2019-07-16	e0a52e2353d298458e26dbe1337792f7
45e575ac-450d-49d1-9323-7084d8b49c43	048fb2d9-6651-4ba0-b36a-a526539f4cfd	2002_2003_Western_Hemisphere_fmtrpt.tsv	Nicaragua	NIC	DOS Western Hemisphere Region, Nicaragua, International Military Education and Training (IMET),FY02	PATROL CRAFT PROP SYS MT		Patrol Boat Division	6/21/02	2002-06-21	8/15/02	2002-08-15	STENNIS SPACE CENTER, MS	1 39529-7099	7464	https://2009-2017.state.gov/documents/organization/21823.pdf	Not checked against source; verify accuracy before use	2003-05	2019-07-16	43136c7e028dc09b06944704e30259cc
53222e31-16ba-40da-8b06-2fa2add39655	048fb2d9-6651-4ba0-b36a-a526539f4cfd	2002_2003_Western_Hemisphere_fmtrpt.tsv	Nicaragua	NIC	DOS Western Hemisphere Region, Nicaragua, International Military Education and Training (IMET),FY02	PATROL CRAFT PROP SYS MT		Maintenance Division	6/21/02	2002-06-21	8/15/02	2002-08-15	STENNIS SPACE CENTER, MS	1 39529-7099	7464	https://2009-2017.state.gov/documents/organization/21823.pdf	Not checked against source; verify accuracy before use	2003-05	2019-07-16	546913992826e5e9628adbbf0b0edf4d
2a1b7bf0-3496-4dee-a687-b82e4e922329	048fb2d9-6651-4ba0-b36a-a526539f4cfd	2002_2003_Western_Hemisphere_fmtrpt.tsv	Nicaragua	NIC	DOS Western Hemisphere Region, Nicaragua, International Military Education and Training (IMET),FY02	RULE OF LAW&DISCP MIL OPS		Patrol Boat Squadron	6/17/02	2002-06-17	6/21/02	2002-06-21	STENNIS SPACE CENTER, MS	1 39529-7099	320	https://2009-2017.state.gov/documents/organization/21823.pdf	Not checked against source; verify accuracy before use	2003-05	2019-07-16	e04df4a5bee443a1a88e87b0edae0e55
ff109aee-ec84-48c8-a0c0-0b6d873cdf21	048fb2d9-6651-4ba0-b36a-a526539f4cfd	2002_2003_Western_Hemisphere_fmtrpt.tsv	Nicaragua	NIC	DOS Western Hemisphere Region, Nicaragua, International Military Education and Training (IMET),FY02	RULE OF LAW&DISCP MIL OPS		Atlantic Naval District	8/19/02	2002-08-19	8/23/02	2002-08-23	STENNIS SPACE CENTER, MS	1 39529-7099	1940	https://2009-2017.state.gov/documents/organization/21823.pdf	Not checked against source; verify accuracy before use	2003-05	2019-07-16	3f65801b53c828265e12a274cff5e41b
740544ff-7f95-4e21-a6d2-d90c61086481	048fb2d9-6651-4ba0-b36a-a526539f4cfd	2002_2003_Western_Hemisphere_fmtrpt.tsv	Nicaragua	NIC	DOS Western Hemisphere Region, Nicaragua, International Military Education and Training (IMET),FY02	RULE OF LAW&DISCP MIL OPS		Patrol Boat Division	6/17/02	2002-06-17	6/21/02	2002-06-21	STENNIS SPACE CENTER, MS	1 39529-7099	320	https://2009-2017.state.gov/documents/organization/21823.pdf	Not checked against source; verify accuracy before use	2003-05	2019-07-16	0cc2746ad60ed9bddde5542450e87212
cb89af4f-0c1e-4bcf-b87f-1dea66378aca	048fb2d9-6651-4ba0-b36a-a526539f4cfd	2002_2003_Western_Hemisphere_fmtrpt.tsv	Nicaragua	NIC	DOS Western Hemisphere Region, Nicaragua, International Military Education and Training (IMET),FY02	RULE OF LAW&DISCP MIL OPS		Patrol Boat Squadron	8/19/02	2002-08-19	8/23/02	2002-08-23	STENNIS SPACE CENTER, MS	1 39529-7099	1940	https://2009-2017.state.gov/documents/organization/21823.pdf	Not checked against source; verify accuracy before use	2003-05	2019-07-16	3fe020a677d7d508a52af6bc13d557e1
ab962d14-c5ca-4676-8179-d87db9ce1b5e	048fb2d9-6651-4ba0-b36a-a526539f4cfd	2002_2003_Western_Hemisphere_fmtrpt.tsv	Paraguay	PRY	Western Hemisphere Region, Paraguay, International Military Education and Training (IMET), FY 02	REGULATOR										https://2009-2017.state.gov/documents/organization/21823.pdf	Not checked against source; verify accuracy before use	2003-05	2019-07-16	736ddb5387fc794d8b730280caadcabb
f625c283-76cc-4ba5-8391-6e9b9e991427	048fb2d9-6651-4ba0-b36a-a526539f4cfd	2002_2003_Western_Hemisphere_fmtrpt.tsv	Paraguay	PRY	Western Hemisphere Region, Paraguay, International Military Education and Training (IMET), FY 02	NCO PROFESSIONAL		Air Force Command Hq	5/2/02	2002-05-02	6/21/02	2002-06-21	LACKLAND AFB, TX 78236-5706	1	2787	https://2009-2017.state.gov/documents/organization/21823.pdf	Not checked against source; verify accuracy before use	2003-05	2019-07-16	e83a615c195642a4328adc415fc69956
1470eef0-eb3c-4d6b-8ef9-1cde9ec1fb7b	048fb2d9-6651-4ba0-b36a-a526539f4cfd	2002_2003_Western_Hemisphere_fmtrpt.tsv	Paraguay	PRY	Western Hemisphere Region, Paraguay, International Military Education and Training (IMET), FY 02	DEVLOPMNT										https://2009-2017.state.gov/documents/organization/21823.pdf	Not checked against source; verify accuracy before use	2003-05	2019-07-16	7ec505a14ca8553bd3f1733b34527ce8
97f00331-7896-4b96-8fb0-4330e2c10cb2	048fb2d9-6651-4ba0-b36a-a526539f4cfd	2002_2003_Western_Hemisphere_fmtrpt.tsv	Paraguay	PRY	Western Hemisphere Region, Paraguay, International Military Education and Training (IMET), FY 02	NCO PROFESSIONAL		Navy Command Hq	5/2/02	2002-05-02	6/21/02	2002-06-21	LACKLAND AFB, TX 78236-5706	1	2787	https://2009-2017.state.gov/documents/organization/21823.pdf	Not checked against source; verify accuracy before use	2003-05	2019-07-16	af1344d15384a31885087e3547a5be80
968494d9-94de-476c-860d-9198470762a2	048fb2d9-6651-4ba0-b36a-a526539f4cfd	2002_2003_Western_Hemisphere_fmtrpt.tsv	Paraguay	PRY	Western Hemisphere Region, Paraguay, International Military Education and Training (IMET), FY 02	DEVLOPMNT										https://2009-2017.state.gov/documents/organization/21823.pdf	Not checked against source; verify accuracy before use	2003-05	2019-07-16	7ec505a14ca8553bd3f1733b34527ce8
383313de-0536-4be0-8ed4-ff5156d784a0	048fb2d9-6651-4ba0-b36a-a526539f4cfd	2002_2003_Western_Hemisphere_fmtrpt.tsv	Paraguay	PRY	Western Hemisphere Region, Paraguay, International Military Education and Training (IMET), FY 02	NCO PROFESSIONAL		Military Forces Command Hq	5/2/02	2002-05-02	6/21/02	2002-06-21	LACKLAND AFB, TX 78236-5706	1	2787	https://2009-2017.state.gov/documents/organization/21823.pdf	Not checked against source; verify accuracy before use	2003-05	2019-07-16	565fdfd70dd8e14ca3b456ae12d11e6c
80e07033-6f5b-4aea-a61d-464b9acfac60	048fb2d9-6651-4ba0-b36a-a526539f4cfd	2002_2003_Western_Hemisphere_fmtrpt.tsv	Paraguay	PRY	Western Hemisphere Region, Paraguay, International Military Education and Training (IMET), FY 02	DEVLOPMNT										https://2009-2017.state.gov/documents/organization/21823.pdf	Not checked against source; verify accuracy before use	2003-05	2019-07-16	7ec505a14ca8553bd3f1733b34527ce8
45e2a658-2109-4ed8-b8e1-720eb76efc33	048fb2d9-6651-4ba0-b36a-a526539f4cfd	2002_2003_Western_Hemisphere_fmtrpt.tsv	Paraguay	PRY	Western Hemisphere Region, Paraguay, International Military Education and Training (IMET), FY 02	NCO PROFESSIONAL		Logistic Command	5/2/02	2002-05-02	6/21/02	2002-06-21	LACKLAND AFB, TX 78236-5706	1	2787	https://2009-2017.state.gov/documents/organization/21823.pdf	Not checked against source; verify accuracy before use	2003-05	2019-07-16	c0146ca5dca9d2d69f014001bc2b5784
9ae02ae7-0324-46a2-bc35-cd5fb940c5d6	048fb2d9-6651-4ba0-b36a-a526539f4cfd	2002_2003_Western_Hemisphere_fmtrpt.tsv	Paraguay	PRY	Western Hemisphere Region, Paraguay, International Military Education and Training (IMET), FY 02	DEVLOPMNT										https://2009-2017.state.gov/documents/organization/21823.pdf	Not checked against source; verify accuracy before use	2003-05	2019-07-16	7ec505a14ca8553bd3f1733b34527ce8
ddfc9b6c-d823-4655-9747-9204854af958	048fb2d9-6651-4ba0-b36a-a526539f4cfd	2002_2003_Western_Hemisphere_fmtrpt.tsv	Paraguay	PRY	Western Hemisphere Region, Paraguay, International Military Education and Training (IMET), FY 02	NCO PROFESSIONAL		Presidential Escort Regiment	5/2/02	2002-05-02	6/21/02	2002-06-21	LACKLAND AFB, TX 78236-5706	1	2787	https://2009-2017.state.gov/documents/organization/21823.pdf	Not checked against source; verify accuracy before use	2003-05	2019-07-16	6d248246669fa34bd43f1c820ae9d51e
5572cc32-0a26-40a2-80c3-e3198aae5957	048fb2d9-6651-4ba0-b36a-a526539f4cfd	2002_2003_Western_Hemisphere_fmtrpt.tsv	Paraguay	PRY	Western Hemisphere Region, Paraguay, International Military Education and Training (IMET), FY 02	DEVLOPMNT										https://2009-2017.state.gov/documents/organization/21823.pdf	Not checked against source; verify accuracy before use	2003-05	2019-07-16	7ec505a14ca8553bd3f1733b34527ce8
39942504-8b94-4bf1-9822-9c36fca63b63	048fb2d9-6651-4ba0-b36a-a526539f4cfd	2002_2003_Western_Hemisphere_fmtrpt.tsv	Peru	PER	Western Hemisphere Region, Peru, Section 1004, FY 02	INSTRUCTOR DEVELOPMENT		NAVY - ESCUELA DE OPS	8/19/02	2002-08-19	8/30/02	2002-08-30	STENNIS SPACE CENTER, MS	1	891	https://2009-2017.state.gov/documents/organization/21823.pdf	Not checked against source; verify accuracy before use	2003-05	2019-07-16	666ffaaadf082b38914de131a5e1766d
d7c62762-be18-40da-b9f9-71c5356fcd0f	048fb2d9-6651-4ba0-b36a-a526539f4cfd	2002_2003_Western_Hemisphere_fmtrpt.tsv	Peru	PER	Western Hemisphere Region, Peru, Section 1004, FY 02	CRS		RIBERENAS						39529-7099		https://2009-2017.state.gov/documents/organization/21823.pdf	Not checked against source; verify accuracy before use	2003-05	2019-07-16	9cffb4c7efa107b4ea9882e77383deb1
a60057df-bad5-4733-ab0f-25892a050ce0	048fb2d9-6651-4ba0-b36a-a526539f4cfd	2002_2003_Western_Hemisphere_fmtrpt.tsv	Peru	PER	Western Hemisphere Region, Peru, Section 1004, FY 02	INSTRUCTOR DEVELOPMENT		PNP-DIRANDRO	8/19/02	2002-08-19	8/30/02	2002-08-30	STENNIS SPACE CENTER, MS	1	891	https://2009-2017.state.gov/documents/organization/21823.pdf	Not checked against source; verify accuracy before use	2003-05	2019-07-16	185d0748a9fd7bed4f2b2be4e289cc4a
aa66509f-2b56-4589-a807-bc57ac3d813d	048fb2d9-6651-4ba0-b36a-a526539f4cfd	2002_2003_Western_Hemisphere_fmtrpt.tsv	Peru	PER	Western Hemisphere Region, Peru, Section 1004, FY 02	CRS								39529-7099		https://2009-2017.state.gov/documents/organization/21823.pdf	Not checked against source; verify accuracy before use	2003-05	2019-07-16	df45abffd213df7155b22d9a49ed7449
d2c29463-12b6-4432-8597-60e1c9ca97d9	048fb2d9-6651-4ba0-b36a-a526539f4cfd	2002_2003_Western_Hemisphere_fmtrpt.tsv	Peru	PER	Western Hemisphere Region, Peru, Section 1004, FY 02	INSTRUCTOR DEVELOPMENT		PNP - DIRANDRO	8/19/02	2002-08-19	8/30/02	2002-08-30	STENNIS SPACE CENTER, MS	1	891	https://2009-2017.state.gov/documents/organization/21823.pdf	Not checked against source; verify accuracy before use	2003-05	2019-07-16	185d0748a9fd7bed4f2b2be4e289cc4a
eb0a2bdf-3570-443c-91a2-56fc9385be2b	048fb2d9-6651-4ba0-b36a-a526539f4cfd	2002_2003_Western_Hemisphere_fmtrpt.tsv	Peru	PER	Western Hemisphere Region, Peru, Section 1004, FY 02	CRS								39529-7099		https://2009-2017.state.gov/documents/organization/21823.pdf	Not checked against source; verify accuracy before use	2003-05	2019-07-16	df45abffd213df7155b22d9a49ed7449
f9a71113-ba5a-4f4a-9304-0eb68c66d65e	048fb2d9-6651-4ba0-b36a-a526539f4cfd	2002_2003_Western_Hemisphere_fmtrpt.tsv	Peru	PER	Western Hemisphere Region, Peru, Section 1004, FY 02	INSTRUCTOR DEVELOPMENT		Navy	11/9/01	2001-11-09	11/22/01	2001-11-22	STENNIS SPACE CENTER, MS	1	891	https://2009-2017.state.gov/documents/organization/21823.pdf	Not checked against source; verify accuracy before use	2003-05	2019-07-16	57135c5bcaa9d91b284a51f13c7d066e
b78d6647-c681-49a3-b52a-8c1ada04a33b	048fb2d9-6651-4ba0-b36a-a526539f4cfd	2002_2003_Western_Hemisphere_fmtrpt.tsv	Peru	PER	Western Hemisphere Region, Peru, Section 1004, FY 02	CRS								39529-7099		https://2009-2017.state.gov/documents/organization/21823.pdf	Not checked against source; verify accuracy before use	2003-05	2019-07-16	df45abffd213df7155b22d9a49ed7449
29a62dfb-0d99-4450-9b44-a9068d45f9f1	048fb2d9-6651-4ba0-b36a-a526539f4cfd	2002_2003_Western_Hemisphere_fmtrpt.tsv	Peru	PER	Western Hemisphere Region, Peru, Section 1004, FY 02	INSTRUCTOR DEVELOPMENT		Pe Nat Police - DIOTAD	11/9/01	2001-11-09	11/22/01	2001-11-22	STENNIS SPACE CENTER, MS	1	935	https://2009-2017.state.gov/documents/organization/21823.pdf	Not checked against source; verify accuracy before use	2003-05	2019-07-16	31e19badd20b7301213c158c865d73a3
0e9e6306-4909-4673-895c-264749dde448	048fb2d9-6651-4ba0-b36a-a526539f4cfd	2002_2003_Western_Hemisphere_fmtrpt.tsv	Peru	PER	Western Hemisphere Region, Peru, Section 1004, FY 02	CRS								39529-7099		https://2009-2017.state.gov/documents/organization/21823.pdf	Not checked against source; verify accuracy before use	2003-05	2019-07-16	df45abffd213df7155b22d9a49ed7449
4c5f7fe9-0c4c-4409-8523-55e72a0d5a23	048fb2d9-6651-4ba0-b36a-a526539f4cfd	2002_2003_Western_Hemisphere_fmtrpt.tsv	Peru	PER	Western Hemisphere Region, Peru, Section 1004, FY 02	INSTRUCTOR DEVELOPMENT		Pe Nat Police - DIRANDRO	11/9/01	2001-11-09	11/22/01	2001-11-22	STENNIS SPACE CENTER, MS	1	935	https://2009-2017.state.gov/documents/organization/21823.pdf	Not checked against source; verify accuracy before use	2003-05	2019-07-16	11b92e8b1790567e1d2639c4b3ba5c5a
1e5d19e4-5bc9-454c-8eea-9431ccac2827	048fb2d9-6651-4ba0-b36a-a526539f4cfd	2002_2003_Western_Hemisphere_fmtrpt.tsv	Peru	PER	Western Hemisphere Region, Peru, Section 1004, FY 02	CRS								39529-7099		https://2009-2017.state.gov/documents/organization/21823.pdf	Not checked against source; verify accuracy before use	2003-05	2019-07-16	df45abffd213df7155b22d9a49ed7449
e44292f7-5703-45a3-b605-9db7827ac1fe	048fb2d9-6651-4ba0-b36a-a526539f4cfd	2002_2003_Western_Hemisphere_fmtrpt.tsv	Peru	PER	Western Hemisphere Region, Peru, Section 1004, FY 02	INSTRUCTOR DEVELOPMENT		Navy	11/9/01	2001-11-09	11/22/01	2001-11-22	STENNIS SPACE CENTER, MS	1	891	https://2009-2017.state.gov/documents/organization/21823.pdf	Not checked against source; verify accuracy before use	2003-05	2019-07-16	57135c5bcaa9d91b284a51f13c7d066e
37af5027-e651-4793-8c79-08d6d67dbc96	048fb2d9-6651-4ba0-b36a-a526539f4cfd	2002_2003_Western_Hemisphere_fmtrpt.tsv	Peru	PER	Western Hemisphere Region, Peru, Section 1004, FY 02	CRS								39529-7099		https://2009-2017.state.gov/documents/organization/21823.pdf	Not checked against source; verify accuracy before use	2003-05	2019-07-16	df45abffd213df7155b22d9a49ed7449
b79a3747-f860-4776-980c-a1420171e6b0	048fb2d9-6651-4ba0-b36a-a526539f4cfd	2002_2003_Western_Hemisphere_fmtrpt.tsv	Peru	PER	Western Hemisphere Region, Peru, Section 1004, FY 02	PATROL CFT OPS RIVER ENV		PNP - DIRANDRO	6/21/02	2002-06-21	8/15/02	2002-08-15	STENNIS SPACE CENTER, MS	1 39529-7099	3564	https://2009-2017.state.gov/documents/organization/21823.pdf	Not checked against source; verify accuracy before use	2003-05	2019-07-16	170b5ed39fd27bbe8c9ebc0291b854dc
9d86aada-1a8b-4a72-9140-d1ff418d2f28	048fb2d9-6651-4ba0-b36a-a526539f4cfd	2002_2003_Western_Hemisphere_fmtrpt.tsv	Peru	PER	Western Hemisphere Region, Peru, Section 1004, FY 02	PATROL CFT OPS RIVER ENV		PNP-DIRANDRO	6/21/02	2002-06-21	8/15/02	2002-08-15	STENNIS SPACE CENTER, MS	1 39529-7099	3564	https://2009-2017.state.gov/documents/organization/21823.pdf	Not checked against source; verify accuracy before use	2003-05	2019-07-16	170b5ed39fd27bbe8c9ebc0291b854dc
3ebb1e92-4bbd-450a-bbf9-06e0ee81521a	048fb2d9-6651-4ba0-b36a-a526539f4cfd	2002_2003_Western_Hemisphere_fmtrpt.tsv	Peru	PER	Western Hemisphere Region, Peru, Section 1004, FY 02	PATROL CRAFT HULL MAINT		Navy	6/21/02	2002-06-21	8/15/02	2002-08-15	STENNIS SPACE CENTER, MS	1 39529-7099	1782	https://2009-2017.state.gov/documents/organization/21823.pdf	Not checked against source; verify accuracy before use	2003-05	2019-07-16	2cc0af443f50af6aeedd4384e571fe93
09f9bdf0-c748-4889-b16d-8e1be538b6d6	048fb2d9-6651-4ba0-b36a-a526539f4cfd	2002_2003_Western_Hemisphere_fmtrpt.tsv	Peru	PER	Western Hemisphere Region, Peru, Section 1004, FY 02	PATROL CRAFT HULL MAINT		Pe Nat Police-DIRANDRO	6/21/02	2002-06-21	8/15/02	2002-08-15	STENNIS SPACE CENTER, MS	1 39529-7099	3564	https://2009-2017.state.gov/documents/organization/21823.pdf	Not checked against source; verify accuracy before use	2003-05	2019-07-16	6dec88399cfc9ac0f8ff5edee62b0cc1
e172a557-e36e-40f5-b762-4f0716d778fa	048fb2d9-6651-4ba0-b36a-a526539f4cfd	2002_2003_Western_Hemisphere_fmtrpt.tsv	Peru	PER	Western Hemisphere Region, Peru, Section 1004, FY 02	PATROL CRAFT HULL MAINT		Pe Nat Police - DIRANDRO	6/21/02	2002-06-21	8/15/02	2002-08-15	STENNIS SPACE CENTER, MS	1 39529-7099	3564	https://2009-2017.state.gov/documents/organization/21823.pdf	Not checked against source; verify accuracy before use	2003-05	2019-07-16	6dec88399cfc9ac0f8ff5edee62b0cc1
6961c6a6-a8d0-417a-ab42-c4cdc4b26453	048fb2d9-6651-4ba0-b36a-a526539f4cfd	2002_2003_Western_Hemisphere_fmtrpt.tsv	Peru	PER	Western Hemisphere Region, Peru, Section 1004, FY 02	PATROL CRAFT HULL MAINT		Pe Nat Police-DIRANDRO	6/21/02	2002-06-21	8/15/02	2002-08-15	STENNIS SPACE CENTER, MS	1 39529-7099	3564	https://2009-2017.state.gov/documents/organization/21823.pdf	Not checked against source; verify accuracy before use	2003-05	2019-07-16	6dec88399cfc9ac0f8ff5edee62b0cc1
35f3b5b5-ef4b-4268-bc97-1c7cf5439dfb	048fb2d9-6651-4ba0-b36a-a526539f4cfd	2002_2003_Western_Hemisphere_fmtrpt.tsv	Peru	PER	Western Hemisphere Region, Peru, Section 1004, FY 02	PATROL CRAFT OPERATOR		PE NAT POLICE - DIOTAD	4/19/02	2002-04-19	6/13/02	2002-06-13	STENNIS SPACE CENTER, MS	1 39529-7099	3564	https://2009-2017.state.gov/documents/organization/21823.pdf	Not checked against source; verify accuracy before use	2003-05	2019-07-16	1ac97abab0e4f52f7834cb3d3e5e5306
b3ddb6d5-b259-4d0c-9c60-9356aff056c2	048fb2d9-6651-4ba0-b36a-a526539f4cfd	2002_2003_Western_Hemisphere_fmtrpt.tsv	Peru	PER	Western Hemisphere Region, Peru, Section 1004, FY 02	PATROL CRAFT OPERATOR		PE NAT POLICE - DIOTAD	4/19/02	2002-04-19	6/13/02	2002-06-13	STENNIS SPACE CENTER, MS	1 39529-7099	3564	https://2009-2017.state.gov/documents/organization/21823.pdf	Not checked against source; verify accuracy before use	2003-05	2019-07-16	1ac97abab0e4f52f7834cb3d3e5e5306
221a4b8e-1aa2-4041-9218-ce26358bc11b	048fb2d9-6651-4ba0-b36a-a526539f4cfd	2002_2003_Western_Hemisphere_fmtrpt.tsv	Peru	PER	Western Hemisphere Region, Peru, Section 1004, FY 02	PATROL CRAFT OPERATOR		PE NAT POLICE-DIOTAD	4/19/02	2002-04-19	6/13/02	2002-06-13	STENNIS SPACE CENTER, MS	1 39529-7099	3564	https://2009-2017.state.gov/documents/organization/21823.pdf	Not checked against source; verify accuracy before use	2003-05	2019-07-16	1ac97abab0e4f52f7834cb3d3e5e5306
11f53ab8-4b2d-48f7-b1ce-5a6ec8aaff7f	048fb2d9-6651-4ba0-b36a-a526539f4cfd	2002_2003_Western_Hemisphere_fmtrpt.tsv	Peru	PER	Western Hemisphere Region, Peru, Section 1004, FY 02	PATROL CRAFT OPERATOR		PE NAT POLICE - DIRANDRO	4/19/02	2002-04-19	6/13/02	2002-06-13	STENNIS SPACE CENTER, MS	1 39529-7099	3564	https://2009-2017.state.gov/documents/organization/21823.pdf	Not checked against source; verify accuracy before use	2003-05	2019-07-16	d2b46428e0b055f9ecad1228abd5f774
de2997ff-36d8-4478-a227-3dac233819d6	048fb2d9-6651-4ba0-b36a-a526539f4cfd	2002_2003_Western_Hemisphere_fmtrpt.tsv	Peru	PER	Western Hemisphere Region, Peru, Section 1004, FY 02	PATROL CRAFT WEAPONS MT		Pe Nat Police - DIOTAD	10/12/01	2001-10-12	11/8/01	2001-11-08	STENNIS SPACE CENTER, MS	1 39529-7099	1870	https://2009-2017.state.gov/documents/organization/21823.pdf	Not checked against source; verify accuracy before use	2003-05	2019-07-16	bb24ec42cfc8179e92e1da39116066db
a490975d-483b-499e-aeac-f4dabeb840b0	048fb2d9-6651-4ba0-b36a-a526539f4cfd	2002_2003_Western_Hemisphere_fmtrpt.tsv	Peru	PER	Western Hemisphere Region, Peru, Section 1004, FY 02	PATROL CRAFT WEAPONS MT		Pe Nat Police - UOTAD	10/12/01	2001-10-12	11/8/01	2001-11-08	STENNIS SPACE CENTER, MS	1 39529-7099	1870	https://2009-2017.state.gov/documents/organization/21823.pdf	Not checked against source; verify accuracy before use	2003-05	2019-07-16	ca98ab7508f1ee66efc45734fc143740
6aeb3e5c-ac13-4a9a-b8da-9de83a4a48f9	048fb2d9-6651-4ba0-b36a-a526539f4cfd	2002_2003_Western_Hemisphere_fmtrpt.tsv	Peru	PER	Western Hemisphere Region, Peru, Section 1004, FY 02	PATROL CRAFT WEAPONS MT		Pe Nat Police - DINANDRO	10/12/01	2001-10-12	11/8/01	2001-11-08	STENNIS SPACE CENTER, MS	1 39529-7099	1870	https://2009-2017.state.gov/documents/organization/21823.pdf	Not checked against source; verify accuracy before use	2003-05	2019-07-16	7e014fec306e02050b5d37e7c99983ef
b1b5d7d6-3082-4ad5-b8a2-0f3a6157a6cb	048fb2d9-6651-4ba0-b36a-a526539f4cfd	2002_2003_Western_Hemisphere_fmtrpt.tsv	Peru	PER	Western Hemisphere Region, Peru, Section 1004, FY 02	PATROL CRAFT WEAPONS MT		Navy	6/17/02	2002-06-17	7/12/02	2002-07-12	STENNIS SPACE CENTER, MS	1 39529-7099	891	https://2009-2017.state.gov/documents/organization/21823.pdf	Not checked against source; verify accuracy before use	2003-05	2019-07-16	4f36dd3c8c6afa3774c854015ea91aab
7d8f57c8-ffb5-4e37-b07c-06fa890187f9	048fb2d9-6651-4ba0-b36a-a526539f4cfd	2002_2003_Western_Hemisphere_fmtrpt.tsv	Peru	PER	Western Hemisphere Region, Peru, Section 1004, FY 02	PATROL CRAFT WEAPONS MT		Pe Nat Police - DINANDRO	10/12/01	2001-10-12	11/8/01	2001-11-08	STENNIS SPACE CENTER, MS	1 39529-7099	1870	https://2009-2017.state.gov/documents/organization/21823.pdf	Not checked against source; verify accuracy before use	2003-05	2019-07-16	7e014fec306e02050b5d37e7c99983ef
5fa676fd-9bbd-4efa-9135-b976a9b13fcc	048fb2d9-6651-4ba0-b36a-a526539f4cfd	2002_2003_Western_Hemisphere_fmtrpt.tsv	Peru	PER	Western Hemisphere Region, Peru, Section 1004, FY 02	PATROL CRAFT WEAPONS MT		PNP- DINANDRO	6/17/02	2002-06-17	7/12/02	2002-07-12	STENNIS SPACE CENTER, MS	1 39529-7099	1782	https://2009-2017.state.gov/documents/organization/21823.pdf	Not checked against source; verify accuracy before use	2003-05	2019-07-16	d0bff26e6a80f6f2a44dce35633f0f74
c6c774dc-ce0d-4365-9869-f06ba11d8dbb	048fb2d9-6651-4ba0-b36a-a526539f4cfd	2002_2003_Western_Hemisphere_fmtrpt.tsv	Peru	PER	Western Hemisphere Region, Peru, Section 1004, FY 02	PATROL CRAFT WEAPONS MT		PNP - DIRANDRO	6/17/02	2002-06-17	7/12/02	2002-07-12	STENNIS SPACE CENTER, MS	1 39529-7099	1782	https://2009-2017.state.gov/documents/organization/21823.pdf	Not checked against source; verify accuracy before use	2003-05	2019-07-16	ffa65ff963b700baa87c5d9d23bbee9c
4994bb61-6a6e-4d17-b846-f918643d5e37	048fb2d9-6651-4ba0-b36a-a526539f4cfd	2002_2003_Western_Hemisphere_fmtrpt.tsv	Peru	PER	Western Hemisphere Region, Peru, Section 1004, FY 02	PATROL CRAFT WEAPONS MT		Navy	6/17/02	2002-06-17	7/12/02	2002-07-12	STENNIS SPACE CENTER, MS	1 39529-7099	891	https://2009-2017.state.gov/documents/organization/21823.pdf	Not checked against source; verify accuracy before use	2003-05	2019-07-16	4f36dd3c8c6afa3774c854015ea91aab
c7b4ec44-7f7f-44ea-90ed-9eb525fd111e	048fb2d9-6651-4ba0-b36a-a526539f4cfd	2002_2003_Western_Hemisphere_fmtrpt.tsv	St Kitts And Nevis	KNA	DOS Western Hemisphere Region, St Kitts And Nevis, International Military Education and Training (IMET),FY02	BOARDING TEAM MEMBER		Coast Guard	1/28/02	2002-01-28	2/8/02	2002-02-08	PETALUMA, CA 94952-5000	1	1027	https://2009-2017.state.gov/documents/organization/21823.pdf	Not checked against source; verify accuracy before use	2003-05	2019-07-16	446b25b29adbae2e7fd40988723e1f9e
f2a9cc41-bd4d-4831-b298-440ebcf5ea6f	048fb2d9-6651-4ba0-b36a-a526539f4cfd	2002_2003_Western_Hemisphere_fmtrpt.tsv	St Kitts And Nevis	KNA	DOS Western Hemisphere Region, St Kitts And Nevis, International Military Education and Training (IMET),FY02	EIMET										https://2009-2017.state.gov/documents/organization/21823.pdf	Not checked against source; verify accuracy before use	2003-05	2019-07-16	95a20a46925796b35db14e08e34d937a
bada5dcc-a435-49cf-99d4-41863c2e5280	048fb2d9-6651-4ba0-b36a-a526539f4cfd	2002_2003_Western_Hemisphere_fmtrpt.tsv	St Kitts And Nevis	KNA	Western Hemisphere Region, St Kitts And Nevis, International Military Education and Training (IMET), FY 02	POWER GENERATION EQUIP		Defense Force	4/29/02	2002-04-29	8/2/02	2002-08-02	APG MD 21005-5299	1	9471	https://2009-2017.state.gov/documents/organization/21823.pdf	Not checked against source; verify accuracy before use	2003-05	2019-07-16	e64b4d6a2e7e460efc8a43182076f0ff
2ccafa18-24cd-45b8-913b-22db7c7dcad1	048fb2d9-6651-4ba0-b36a-a526539f4cfd	2002_2003_Western_Hemisphere_fmtrpt.tsv	St Kitts And Nevis	KNA	Western Hemisphere Region, St Kitts And Nevis, International Military Education and Training (IMET), FY 02	RPR										https://2009-2017.state.gov/documents/organization/21823.pdf	Not checked against source; verify accuracy before use	2003-05	2019-07-16	4fcd12b3fa4b80711cfe1877b8d91f18
3be6c57a-7d67-4319-842b-993569680ff5	048fb2d9-6651-4ba0-b36a-a526539f4cfd	2002_2003_Western_Hemisphere_fmtrpt.tsv	Trinidad -Tobago	TTO	DOD Western Hemisphere Region, Trinidad -Tobago, Non-Security Assistance, Unified Command,FY02	JCET	NSWG-2, 720 STG, ST-2	Special Operations Group	1/14/02	2002-01-14	2/8/02	2002-02-08	Port of Spain, Chaguaramas, Isla	50 Chacachacare	78000	https://2009-2017.state.gov/documents/organization/21823.pdf	Not checked against source; verify accuracy before use	2003-05	2019-07-16	abb73720b6810dc8d88fd4eef5d08e20
a25e2e93-49fb-43f6-975e-98883b801b89	048fb2d9-6651-4ba0-b36a-a526539f4cfd	2002_2003_Western_Hemisphere_fmtrpt.tsv	Venezuela	VEN	DOS Western Hemisphere Region, Venezuela, International Military Education and Training (IMET),FY02	LANG LAB VOLTAGE		DLI SUBMARINE SCHOOL, PUERTO	6/6/02	2002-06-06	9/30/02	2002-09-30		0	1180	https://2009-2017.state.gov/documents/organization/21823.pdf	Not checked against source; verify accuracy before use	2003-05	2019-07-16	cdc1e6cfef4efb8bb4a78826f2f33096
701e55ca-8726-4945-af10-a633633f26de	048fb2d9-6651-4ba0-b36a-a526539f4cfd	2002_2003_Western_Hemisphere_fmtrpt.tsv	Venezuela	VEN	DOS Western Hemisphere Region, Venezuela, International Military Education and Training (IMET),FY02	REGULATOR		CABELLO								https://2009-2017.state.gov/documents/organization/21823.pdf	Not checked against source; verify accuracy before use	2003-05	2019-07-16	6663bafd967a9d7f30d00dba70d87596
75201813-feb0-4d49-be50-dc23a89a19e0	048fb2d9-6651-4ba0-b36a-a526539f4cfd	2002_2003_Western_Hemisphere_fmtrpt.tsv	Venezuela	VEN	DOS Western Hemisphere Region, Venezuela, International Military Education and Training (IMET),FY02	LANG LAB VOLTAGE		DEFENSE LANGUAGE INSTITUTE	4/15/02	2002-04-15	4/30/02	2002-04-30		0	1180	https://2009-2017.state.gov/documents/organization/21823.pdf	Not checked against source; verify accuracy before use	2003-05	2019-07-16	28d341db5fe18a58f91886f86b1e46ce
6e634a26-465b-42cb-8a60-637962c75517	048fb2d9-6651-4ba0-b36a-a526539f4cfd	2002_2003_Western_Hemisphere_fmtrpt.tsv	Venezuela	VEN	DOS Western Hemisphere Region, Venezuela, International Military Education and Training (IMET),FY02	REGULATOR		AIR FORCE, MARACAY								https://2009-2017.state.gov/documents/organization/21823.pdf	Not checked against source; verify accuracy before use	2003-05	2019-07-16	718e0c4cd28ca018b7f76b5fa889011d
986d4bbc-295f-4402-94ac-614e4269b41f	048fb2d9-6651-4ba0-b36a-a526539f4cfd	2002_2003_Western_Hemisphere_fmtrpt.tsv	Venezuela	VEN	DOS Western Hemisphere Region, Venezuela, International Military Education and Training (IMET),FY02	PATROL CRAFT OPERATOR		COVICOGUARNAC	4/19/02	2002-04-19	6/13/02	2002-06-13	STENNIS SPACE CENTER, MS	1 39529-7099	3564	https://2009-2017.state.gov/documents/organization/21823.pdf	Not checked against source; verify accuracy before use	2003-05	2019-07-16	c8a19c8811cb363b0c0daa417be768b3
