country	program	course_title	us_unit	student_unit	start_date	end_date	location	quantity	total_cost	source
Jordan	IMET-1 - Fiscal Year 2012 Department of State Training	Engineer Captains Career	ENGINEER SCHOOL	EXPLOSIVE ORDINANCE DISPOSAL	5/11/2011	10/7/2011	ENGINEER SCHOOL	1	$16,014 	213466
Jordan	IMET-1 - Fiscal Year 2012 Department of State Training	EWO International	CENINFODOMINANCE LEARNING SITE NORFOLK VA	Royal Jordanian Air Force	4/2/2012	4/13/2012	CENINFODOMINANCE SITE NORFOLK VA	1	$3,017 	213466
Jordan	IMET-1 - Fiscal Year 2012 Department of State Training	FA OFF Advanced Preparatory IED Officer	FIELD ARTILLERY SCHOOL	20 Artillery Battalion	4/20/2012	5/14/2012	FIELD ARTILLERY SCHOOL	1	$13,160 	213466
Jordan	IMET-1 - Fiscal Year 2012 Department of State Training	FA OFF Advanced Preparatory IED Officer	FIELD ARTILLERY SCHOOL	Battalion Commander DEPUTY	4/20/2012	5/14/2012	FIELD ARTILLERY SCHOOL	1	$13,160 	213466
Jordan	IMET-1 - Fiscal Year 2012 Department of State Training	FA OFF Advanced Preparatory IED Officer	FIELD ARTILLERY SCHOOL	Artillery Battalion	8/16/2012	9/10/2012	FIELD ARTILLERY SCHOOL	1	$13,248 	213466
Jordan	IMET-1 - Fiscal Year 2012 Department of State Training	FIBER OPTIC CABLE INSTALL	SHEPPARD AFB, TX	Communication Directorate	4/16/2012	4/25/2012	SHEPPARD AFB, TX	1	$2,550 	213466
Jordan	IMET-1 - Fiscal Year 2012 Department of State Training	Field Artillery Captains Career	FIELD ARTILLERY SCHOOL	ROCKET LAUNCERS Battalion	7/12/2011	1/17/2012	FIELD ARTILLERY SCHOOL	1	$29,088 	213466
Jordan	IMET-1 - Fiscal Year 2012 Department of State Training	Field Artillery Captains Career	FIELD ARTILLERY SCHOOL	Special Forces Artillery	7/12/2011	1/17/2012	FIELD ARTILLERY SCHOOL	1	$29,088 	213466
Jordan	IMET-1 - Fiscal Year 2012 Department of State Training	Financial Management BOLC-B	FINANCE SCHOOL	Directorate of FINANCE	3/26/2012	6/18/2012	FINANCE SCHOOL	1	$24,344 	213466
Jordan	IMET-1 - Fiscal Year 2012 Department of State Training	Financial MGMT Staff OFF	KEESLER AFB, MS	Directorate of FINANCE	9/12/2011	10/12/2011	KEESLER AFB, MS	1	$3,970 	213466
Jordan	IMET-1 - Fiscal Year 2012 Department of State Training	FLT Safety OFF (SATP/FSO)	KIRTLAND AFB, NM	Royal Jordanian Air Force	5/4/2012	6/14/2012	KIRKLAND AFB, NM	1	$7,679 	213466
Jordan	IMET-1 - Fiscal Year 2012 Department of State Training	Flying Safety/ *	KIRTLAND AFB, NM	Royal Jordanian Air Force	6/18/2012	6/22/2012	KIRKLAND AFB, NM	1	$555 	213466
Jordan	IMET-1 - Fiscal Year 2012 Department of State Training	Force Support Officer	KEESLER AFB, MS	AirFIELD Directorate	1/10/2012	3/9/2012	KEESLER AFB, MS	1	$13,735 	213466
Jordan	IMET-1 - Fiscal Year 2012 Department of State Training	Fuels Quality Control	QUARTERMASTER SCHOOL	Maintenance Directorate	4/10/2012	4/10/2012	QUARTERMASTER SCHOOL	1	$232 	213466
Jordan	IMET-1 - Fiscal Year 2012 Department of State Training	GND Defense COMD (CERTIFY)	LACKLAND AFB, TX (OTHER THAN DLI AND IAAFA STUDENTS)	DEPUTY Command	3/26/2012	4/13/2012	LACKLAND AFB, TX (OTHER THAN DLI AND IAAFA STUDENTS)	1	$3,888 	213466
Jordan	IMET-1 - Fiscal Year 2012 Department of State Training	GND Defense COMD (CERTIFY)	LACKLAND AFB, TX (OTHER THAN DLI AND IAAFA STUDENTS)	Royal Jordanian Air Force	3/26/2012	4/13/2012	LACKLAND AFB, TX (OTHER THAN DLI AND IAAFA STUDENTS)	1	$3,888 	213466
Jordan	IMET-1 - Fiscal Year 2012 Department of State Training	IF Preparatory Course	NATIONAL WAR COLLEGE	Defence College-KING ABDULLAH	6/18/2012	8/10/2012	NATIONAL WAR COLLEGE	1	$64,999 	213466
Jordan	IMET-1 - Fiscal Year 2012 Department of State Training	ILE Officer PREP	COMMAND & GENERAL STAFF COLLEGE	SIMULATION Training	1/25/2012	2/3/2012	COMMAND & GENERAL STAFF COLLEGE	1	$2,781 	213466
Jordan	IMET-1 - Fiscal Year 2012 Department of State Training	Infantry Basic Officer Leader-Branch	INFANTRY SCHOOL	Royal RANGER BN 91	7/11/2011	10/27/2011	INFANTRY SCHOOL	1	$18,115 	213466
Jordan	IMET-1 - Fiscal Year 2012 Department of State Training	Information Systems Management	SIGNAL SCHOOL	Officers Affairs Directorate	11/22/2011	2/15/2012	SIGNAL SCHOOL	1	$11,817 	213466
Jordan	IMET-1 - Fiscal Year 2012 Department of State Training	Information Systems Management	SIGNAL SCHOOL	Officers Affairs Directorate	2/16/2012	7/6/2012	SIGNAL SCHOOL	1	$17,743 	213466
Jordan	IMET-1 - Fiscal Year 2012 Department of State Training	Instructor Training	SIGNAL SCHOOL	Officers Affairs Directorate	7/9/2012	7/20/2012	SIGNAL SCHOOL	1	$2,106 	213466
Jordan	IMET-1 - Fiscal Year 2012 Department of State Training	Intermediate Level EDUC	COMMAND & GENERAL STAFF COLLEGE	40TH Armored Brigade	8/10/2011	6/8/2012	COMMAND & GENERAL STAFF COLLEGE	1	$57,712 	213466
Jordan	IMET-1 - Fiscal Year 2012 Department of State Training	International Anti-Terrorism/ANTI Piracy (IATP)	NETSAFA INTERNATIONAL TRAINING CENTER PENSACOLA FL	MECHANICAL Department CHIEF	11/28/2011	12/21/2011	NETSAFA INTERNATIONAL TRAINING CENTER PENSACOLA FL	1	$15,844 	213466
Jordan	IMET-1 - Fiscal Year 2012 Department of State Training	International Boarding Officer Course	USCG MARITIME LAW ENFORCEMENT ACAD FLETC CHARLESTON	Royal Jordanian Navy Force	8/6/2012	8/31/2012	USCG MARITIME LAW ENFORCEMENT ACAD FLETC CHARLESTON	1	$7,277 	213466
Jordan	IMET-1 - Fiscal Year 2012 Department of State Training	International Fellows Orientation	ARMY WAR COLLEGE	Defence College-KING ABDULLAH II Academy	6/25/2012	8/3/2012	ARMY WAR COLLEGE	1	$22,335 	213466
Jordan	IMET-1 - Fiscal Year 2012 Department of State Training	International OFF INTEL Captains Career	INTELLIGENCE SCHOOL	DIRETORATE of Intelligence	7/11/2011	12/1/2011	INTELLIGENCE SCHOOL	1	$26,842 	213466
Jordan	IMET-1 - Fiscal Year 2012 Department of State Training	International Officer Logistics Preparatory-TLOG	ARMY LOGISTICS MANAGEMENT COLLEGE	AMMUnitION HEAD QUARTER	7/23/2012	8/3/2012	ARMY LOGISTICS MANAGEMENT COLLEGE	1	$4,522 	213466
Jordan	IMET-1 - Fiscal Year 2012 Department of State Training	International Officer Preparatory	COMMAND & GENERAL STAFF COLLEGE	SIMULATION Training	1/10/2012	1/30/2012	COMMAND & GENERAL STAFF COLLEGE	1	$14,495 	213466
Jordan	IMET-1 - Fiscal Year 2012 Department of State Training	International Officer Supply Course (IOSCO)-Resident	NAVSCSCOL CENSERVSUP SITE NEWPORT, RI	Directorate of SUPPLY	9/12/2011	10/21/2011	PSC3	1	$6,712 	213466
Jordan	IMET-1 - Fiscal Year 2012 Department of State Training	International Officer Supply Course (IOSCO)-Resident	NAVSCSCOL CENSERVSUP SITE NEWPORT, RI	Supply Directorate	5/21/2012	6/29/2012	PSC3	1	$6,771 	213466
Jordan	IMET-1 - Fiscal Year 2012 Department of State Training	INTL Air Weapons DIR Training	TYNDALL AFB, FL	REPort & Control Directorate	6/20/2012	8/17/2012	TYNDALL AFB, FL	1	$9,932 	213466
Jordan	IMET-1 - Fiscal Year 2012 Department of State Training	INTL Defense MGT CRS	DEFENSE RESOURCES MANAGEMENT INSTITUTE NPS MONTEREY CA	Communication Battalion	9/26/2011	12/9/2011	MONTEREY, CA	1	$36,216 	213466
Jordan	IMET-1 - Fiscal Year 2012 Department of State Training	INTL Defense MGT CRS	DEFENSE RESOURCES MANAGEMENT INSTITUTE NPS MONTEREY CA	Directorate of Training	9/26/2011	12/9/2011	MONTEREY, CA	1	$36,216 	213466
Jordan	IMET-1 - Fiscal Year 2012 Department of State Training	INTL Maritime OFF	COGARD TRAINING CENTER YORKTOWN VA	Navy	3/19/2012	6/29/2012	COGARD TRAINING CENTER YORKTOWN VA	1	$23,386 	213466
Jordan	IMET-1 - Fiscal Year 2012 Department of State Training	INTL OFF SCH (FOR AC&SC)	MAXWELL AFB, AL	NUMBER 1 Squadron	6/18/2012	8/1/2012	MAXWELL AFB, AL	1	$30,904 	213466
Jordan	IMET-1 - Fiscal Year 2012 Department of State Training	IT Fundamentals (3D0X1)	KEESLER AFB, MS	Computer Directorate	3/12/2012	3/23/2012	KEESLER AFB, MS	1	$9,260 	213466
Jordan	IMET-1 - Fiscal Year 2012 Department of State Training	IT Fundamentals (3D0X1)	KEESLER AFB, MS	Computer Directorate	5/21/2012	6/4/2012	KEESLER AFB, MS	1	$9,410 	213466
Jordan	IMET-1 - Fiscal Year 2012 Department of State Training	JET Engine MISHAP INV	SHEPPARD AFB, TX	Squadron Command	2/6/2012	2/16/2012	SHEPPARD AFB, TX	1	$8,996 	213466
Jordan	IMET-1 - Fiscal Year 2012 Department of State Training	JET Engine MISHAP INV	SHEPPARD AFB, TX	RJAF	4/9/2012	4/19/2012	SHEPPARD AFB, TX	1	$8,996 	213466
Jordan	IMET-1 - Fiscal Year 2012 Department of State Training	JET Engine MISHAP INV	SHEPPARD AFB, TX	Royal Jordanian Air Force	4/16/2012	4/26/2012	SHEPPARD AFB, TX	1	$8,996 	213466
Jordan	IMET-1 - Fiscal Year 2012 Department of State Training	KNOWLEDGE Operations Management	KEESLER AFB, MS	Computer Directorate	3/26/2012	5/7/2012	KEESLER AFB, MS	1	$4,325 	213466
Jordan	IMET-1 - Fiscal Year 2012 Department of State Training	KNOWLEDGE Operations Management	KEESLER AFB, MS	Computer Directorate	6/12/2012	7/25/2012	KEESLER AFB, MS	1	$4,625 	213466
Jordan	IMET-1 - Fiscal Year 2012 Department of State Training	MAINT MGMT Analysis Apprentice	SHEPPARD AFB, TX	Maintenance Directorate	5/4/2012	7/20/2012	SHEPPARD AFB, TX	1	$18,628 	213466
Jordan	IMET-1 - Fiscal Year 2012 Department of State Training	Maneuver Captains Career	USATC	Eastern Region	9/8/2011	11/9/2011	USATC	1	$9,919 	213466
Jordan	IMET-1 - Fiscal Year 2012 Department of State Training	Maneuver Captains Career	USATC	11TH Border Guard Battalion	9/12/2011	12/15/2011	USATC	1	$11,977 	213466
Jordan	IMET-1 - Fiscal Year 2012 Department of State Training	Maneuver Captains Career	USATC	Eastern Region	11/9/2011	3/5/2012	USATC	1	$16,604 	213466
Jordan	IMET-1 - Fiscal Year 2012 Department of State Training	Maneuver Captains Career	USATC	MARINS CORPS	1/31/2012	7/11/2012	USATC	1	$23,989 	213466
Jordan	IMET-1 - Fiscal Year 2012 Department of State Training	Maneuver CCC IMSO PREP	USATC	MARINS CORPS	1/3/2012	1/27/2012	USATC	1	$13,220 	213466
Jordan	IMET-1 - Fiscal Year 2012 Department of State Training	Marine CORPS War College (MCWAR)	COMMANDING GENERAL, EDUCATION COMMAND QUANTICO VA	LESSONS LEARNED Center	7/18/2011	6/6/2012	COMMANDING GENERAL, EDUCATION COMMAND QUANTICO VA	1	$132,756 	213466
Jordan	IMET-1 - Fiscal Year 2012 Department of State Training	Marines Awaiting Reconnaissance Training	SCHOOL OF INFANTRY WEST CAMP PENDELTON CA	Strategic Reconnaissance Company	4/23/2012	5/4/2012	SCHOOL OF INFANTRY WEST CAMP PENDELTON CA	1	$10,562 	213466
Jordan	IMET-1 - Fiscal Year 2012 Department of State Training	MICRO ELECT Repair(AVIA)	CSCS LEARNING SITE NORFOLK	Communication Directorate	8/6/2012	8/16/2012	CSCS LEARNING SITE NORFOLK	1	$1,623 	213466
Jordan	IMET-1 - Fiscal Year 2012 Department of State Training	MICROMINIATURE Electronics Repair	CSCS DETACHMENT MAYPORT FL	Communication Directorate	11/1/2011	11/14/2011	CSCS DETACHMENT MAYPORT FL	1	$1,832 	213466
Jordan	IMET-1 - Fiscal Year 2012 Department of State Training	Military Intelligence BOLC-Branch	INTELLIGENCE SCHOOL	Intelligence School	6/30/2011	10/28/2011	INTELLIGENCE SCHOOL	1	$25,722 	213466
Jordan	IMET-1 - Fiscal Year 2012 Department of State Training	Military Intelligence BOLC-Branch	INTELLIGENCE SCHOOL	Directorate of Military Intelligence	9/23/2011	2/9/2012	INTELLIGENCE SCHOOL	1	$30,898 	213466
Jordan	IMET-1 - Fiscal Year 2012 Department of State Training	Military Intelligence BOLC-Branch	INTELLIGENCE SCHOOL	Directorate of Military Intelligence	10/27/2011	3/12/2012	INTELLIGENCE SCHOOL	1	$25,006 	213466
Jordan	IMET-1 - Fiscal Year 2012 Department of State Training	Military Intelligence BOLC-Branch	INTELLIGENCE SCHOOL	Intelligence School	3/1/2012	6/27/2012	INTELLIGENCE SCHOOL	1	$33,113 	213466
Jordan	IMET-1 - Fiscal Year 2012 Department of State Training	Military Intelligence BOLC-Branch	INTELLIGENCE SCHOOL	Electronic RECCY Battalion	3/29/2012	7/26/2012	INTELLIGENCE SCHOOL	1	$30,938 	213466
Jordan	IMET-1 - Fiscal Year 2012 Department of State Training	Military Intelligence BOLC-Branch	INTELLIGENCE SCHOOL	Intelligence Directory	3/29/2012	7/26/2012	INTELLIGENCE SCHOOL	1	$30,938 	213466
Jordan	IMET-1 - Fiscal Year 2012 Department of State Training	Military Intelligence BOLC-Branch	INTELLIGENCE SCHOOL	PRINCE AL-HUSSEIN Battalion-3rd Armored Division	4/26/2012	8/23/2012	INTELLIGENCE SCHOOL	1	$29,350 	213466
Jordan	IMET-1 - Fiscal Year 2012 Department of State Training	Military Police Basic Officer Leader-Branch	MILITARY POLICE SCHOOL	Military Police Command	5/7/2012	8/30/2012	MILITARY POLICE SCHOOL	1	$16,018 	213466
Jordan	IMET-1 - Fiscal Year 2012 Department of State Training	MINI ELECT Repair	CSCS DETACHMENT MAYPORT FL	Communication Directorate	10/3/2011	10/31/2011	CSCS DETACHMENT MAYPORT FL	1	$11,315 	213466
Jordan	IMET-1 - Fiscal Year 2012 Department of State Training	MINI ELECT Repair(Surface)	CSCS LEARNING SITE NORFOLK	Communication Directorate	7/9/2012	8/3/2012	CSCS LEARNING SITE NORFOLK	1	$11,446 	213466
Jordan	IMET-1 - Fiscal Year 2012 Department of State Training	MP BOLC-B INT'L STU PREP	MANSCEN ARMY TRAINING CENTER	Military Police Command	4/16/2012	4/27/2012	MANSCEN ARMY TRAINING CENTER	1	$9,942 	213466
Jordan	IMET-1 - Fiscal Year 2012 Department of State Training	Multinational ELCTRNC WRFR INTL OFF CRSE (SATP)	479OSS/SPECTRA ADO	Electronic Warfare Center	7/9/2012	8/14/2012	DPEN479OSS	1	$3,945 	213466
Jordan	IMET-1 - Fiscal Year 2012 Department of State Training	Naval Command College	NAVAL COMMAND COLLEGE NEWPORT RI	Royal Naval Force	7/27/2011	6/15/2012	NAVAL COMMAND COLLEGE NEWPORT RI	1	$122,054 	213466
Jordan	IMET-1 - Fiscal Year 2012 Department of State Training	Naval Staff COL - 10 MONTH	NAVAL STAFF COLLEGE NEWPORT RI	Navy	7/27/2011	6/15/2012	NAVAL STAFF COLLEGE NEWPORT RI	1	$113,442 	213466
Jordan	IMET-1 - Fiscal Year 2012 Department of State Training	Naval Staff COL - 5 1/2 MO	NAVAL STAFF COLLEGE NEWPORT RI	MECHANICAL Department CHIEF	1/11/2012	6/15/2012	NAVAL STAFF COLLEGE NEWPORT RI	1	$56,862 	213466
Jordan	IMET-1 - Fiscal Year 2012 Department of State Training	NWC International Fellows	NATIONAL WAR COLLEGE	Royal Jordanian Air Force	8/8/2011	6/7/2012	NATIONAL WAR COLLEGE	1	$108,161 	213466
Jordan	IMET-1 - Fiscal Year 2012 Department of State Training	Observer Professional-General Course	DLIELC, LACKLAND AFB TX	Language INSTITUTE / JAF	6/18/2012	6/22/2012	DLIELC, LACKLAND AFB TX	1	$1,928 	213466
Jordan	IMET-1 - Fiscal Year 2012 Department of State Training	Observer Professional-General Course	DLIELC, LACKLAND AFB TX	PRINCE FAISAL Technical COLLAGE	6/18/2012	6/22/2012	DLIELC, LACKLAND AFB TX	1	$1,928 	213466
Jordan	IMET-1 - Fiscal Year 2012 Department of State Training	Ordnance Basic Officer Leader-Branch	ALU - Leader Courses	Royal Gurads	7/7/2011	11/3/2011	ARMY LOG MGT COLLEGE - HUNTSVILLE CAMPUS	1	$24,851 	213466
Jordan	IMET-1 - Fiscal Year 2012 Department of State Training	Ordnance Basic Officer Leader-Branch	ALU - Leader Courses	Maintenance CORP	4/2/2012	7/27/2012	ARMY LOG MGT COLLEGE - HUNTSVILLE CAMPUS	1	$25,169 	213466
Jordan	IMET-1 - Fiscal Year 2012 Department of State Training	PATHFINDER	INFANTRY SCHOOL	CT71	9/4/2012	9/21/2012	INFANTRY SCHOOL	1	$5,702 	213466
Jordan	IMET-1 - Fiscal Year 2012 Department of State Training	Physical Measurement & Calibration JNYMAN (USAF)	KEESLER AFB, MS	Communication Directorate	5/14/2012	7/12/2012	KEESLER AFB, MS	1	$7,160 	213466
Jordan	IMET-1 - Fiscal Year 2012 Department of State Training	PMEL Apprentice (USAF)	KEESLER AFB, MS	Communication Directorate	4/24/2012	8/23/2012	KEESLER AFB, MS	1	$12,140 	213466
Jordan	IMET-1 - Fiscal Year 2012 Department of State Training	PRINC DEF PROCUREM & CONTR	INTERNATIONAL DEFENSE ACQUISITION PROGRAM NPS MONTEREY CA	Directorate of Defence PROCURMENT	3/19/2012	3/23/2012	IDARM NAVAL POSTGRADUATE SCHOOL MONTEREY CA	1	$3,472 	213466
Jordan	IMET-1 - Fiscal Year 2012 Department of State Training	PRINC DEF PROCUREM & CONTR	INTERNATIONAL DEFENSE ACQUISITION PROGRAM NPS MONTEREY CA	Supply Directorate	3/19/2012	3/23/2012	IDARM NAVAL POSTGRADUATE SCHOOL MONTEREY CA	1	$3,472 	213466
Jordan	IMET-1 - Fiscal Year 2012 Department of State Training	Quality ASSURANCE (ACFT)	SHEPPARD AFB, TX	Maintenance Directorate	3/20/2012	3/29/2012	SHEPPARD AFB, TX	1	$2,150 	213466
Jordan	IMET-1 - Fiscal Year 2012 Department of State Training	Quality ASSURANCE (ACFT)	SHEPPARD AFB, TX	Maintenance Directorate	4/17/2012	4/26/2012	SHEPPARD AFB, TX	1	$2,150 	213466
Jordan	IMET-1 - Fiscal Year 2012 Department of State Training	Quartermaster Basic Officer Leader-Branch	ALU - Leader Courses	THE 5TH Air Defence Royal Battalion	11/7/2011	3/9/2012	ARMY LOG MGT COLLEGE - HUNTSVILLE CAMPUS	1	$18,108 	213466
Jordan	IMET-1 - Fiscal Year 2012 Department of State Training	Quartermaster Basic Officer Leader-Branch	ALU - Leader Courses	CENTRAL Region Military Command	6/11/2012	9/27/2012	ARMY LOG MGT COLLEGE - HUNTSVILLE CAMPUS	1	$23,787 	213466
Jordan	IMET-1 - Fiscal Year 2012 Department of State Training	RISK Management	DEFENSE RESOURCES MANAGEMENT INSTITUTE NPS MONTEREY CA	Training Directorate	4/9/2012	4/20/2012	MONTEREY, CA	1	$13,613 	213466
Jordan	IMET-1 - Fiscal Year 2012 Department of State Training	Signal Basic Officer Leader-Branch	SIGNAL SCHOOL	Command Control and Communication Directorate	7/11/2011	11/1/2011	SIGNAL SCHOOL	1	$21,123 	213466
Jordan	IMET-1 - Fiscal Year 2012 Department of State Training	Signal Basic Officer Leader-Branch	SIGNAL SCHOOL	South Military Division	8/1/2011	11/23/2011	SIGNAL SCHOOL	1	$21,461 	213466
Jordan	IMET-1 - Fiscal Year 2012 Department of State Training	Signal Basic Officer Leader-Branch	SIGNAL SCHOOL	Special Operation Communication Group	5/22/2012	9/13/2012	SIGNAL SCHOOL	1	$22,723 	213466
Jordan	IMET-1 - Fiscal Year 2012 Department of State Training	Signal Captains Career	SIGNAL SCHOOL	Command, Communication and Computer	9/27/2011	3/5/2012	SIGNAL SCHOOL	1	$21,489 	213466
Jordan	IMET-1 - Fiscal Year 2012 Department of State Training	SOS INT'L OFF SCH CRS	MAXWELL AFB, AL	LOCAL GROUND Defence Directorate	2/6/2012	3/21/2012	MAXWELL AFB, AL	1	$26,904 	213466
Jordan	IMET-1 - Fiscal Year 2012 Department of State Training	Special Forces Qualification IED (DET OFF)	JFK SPECIAL WARFARE CENTER	101 Special Forces BT	4/18/2011	11/9/2011	JFK SPECIAL WARFARE CENTER	1	$22,088 	213466
Jordan	IMET-1 - Fiscal Year 2012 Department of State Training	SPECTRUM Operations Apprentice	KEESLER AFB, MS	Communication Directorate	8/30/2011	12/8/2011	KEESLER AFB, MS	1	$22,850 	213466
Jordan	IMET-1 - Fiscal Year 2012 Department of State Training	Squadron Officer School	MAXWELL AFB, AL	LOCAL GROUND Defence Directorate	3/26/2012	5/18/2012	MAXWELL AFB, AL	1	$5,712 	213466
Jordan	IMET-1 - Fiscal Year 2012 Department of State Training	SR International DEF MGT	DEFENSE RESOURCES MANAGEMENT INSTITUTE NPS MONTEREY CA	Air TRAFFIC Control Directorate	6/25/2012	7/20/2012	MONTEREY, CA	1	$19,487 	213466
Jordan	IMET-1 - Fiscal Year 2012 Department of State Training	SR International DEF MGT	DEFENSE RESOURCES MANAGEMENT INSTITUTE NPS MONTEREY CA	INSPECTION OfficeGHQ	6/25/2012	7/20/2012	MONTEREY, CA	1	$19,487 	213466
Jordan	IMET-1 - Fiscal Year 2012 Department of State Training	Theater Air OPNS Course (TAOC)	TYNDALL AFB, FL	REPort & Control Directorate	8/20/2012	9/11/2012	TYNDALL AFB, FL	1	$3,580 	213466
Jordan	IMET-1 - Fiscal Year 2012 Department of State Training	TRACKED Vehicle Mechanic (W/O FTX)	ORDNANCE MUNITIONS & ELECTRONICS SCHOOL	Royal Maintenance CORP	4/9/2012	6/22/2012	091L	2	$38,174 	213466
Jordan	IMET-1 - Fiscal Year 2012 Department of State Training	U.S. Army Sergeants Major	SERGEANTS MAJOR ACADEMY	Military Police	8/16/2011	6/22/2012	SERGEANTS MAJOR ACADEMY	1	$65,579 	213466
Jordan	IMET-1 - Fiscal Year 2012 Department of State Training	UH-60A/L Flight Simulator	EASTERN AVIATION TRAINING SITE	Royal Squadron	12/5/2011	12/9/2011	EASTERN AVIATION TRAINING SITE	1	$3,376 	213466
Jordan	IMET-1 - Fiscal Year 2012 Department of State Training	UH-60A/L Flight Simulator	EASTERN AVIATION TRAINING SITE	Royal SQUDRON	12/5/2011	12/9/2011	EASTERN AVIATION TRAINING SITE	1	$3,376 	213466
Jordan	IMET-1 - Fiscal Year 2012 Department of State Training	UH-60A/L Flight Simulator	EASTERN AVIATION TRAINING SITE	Royal Squadron	12/26/2011	12/30/2011	EASTERN AVIATION TRAINING SITE	2	$6,752 	213466
Jordan	IMET-1 - Fiscal Year 2012 Department of State Training	UH-60A/L Flight Simulator	EASTERN AVIATION TRAINING SITE	Royal Squadron	1/30/2012	2/3/2012	EASTERN AVIATION TRAINING SITE	2	$7,156 	213466
Jordan	IMET-1 - Fiscal Year 2012 Department of State Training	UH-60A/L Flight Simulator	EASTERN AVIATION TRAINING SITE	Air LIFT Wing	2/6/2012	2/11/2012	EASTERN AVIATION TRAINING SITE	1	$3,904 	213466
Jordan	IMET-1 - Fiscal Year 2012 Department of State Training	UH-60A/L Flight Simulator	EASTERN AVIATION TRAINING SITE	CAPT	2/6/2012	2/11/2012	EASTERN AVIATION TRAINING SITE	1	$3,904 	213466
Jordan	IMET-1 - Fiscal Year 2012 Department of State Training	UH-60A/L Flight Simulator	EASTERN AVIATION TRAINING SITE	OHRB	2/13/2012	2/17/2012	EASTERN AVIATION TRAINING SITE	1	$3,376 	213466
Jordan	IMET-1 - Fiscal Year 2012 Department of State Training	UH-60A/L Flight Simulator	EASTERN AVIATION TRAINING SITE	P.H.R.B	2/13/2012	2/17/2012	EASTERN AVIATION TRAINING SITE	1	$3,376 	213466
Jordan	IMET-1 - Fiscal Year 2012 Department of State Training	UH-60A/L Flight Simulator	EASTERN AVIATION TRAINING SITE	Royal Squadron	2/15/2012	2/22/2012	EASTERN AVIATION TRAINING SITE	2	$7,150 	213466
Jordan	IMET-1 - Fiscal Year 2012 Department of State Training	UH-60A/L Flight Simulator	EASTERN AVIATION TRAINING SITE	Royal Squadron	4/2/2012	4/6/2012	EASTERN AVIATION TRAINING SITE	2	$6,752 	213466
Jordan	IMET-1 - Fiscal Year 2012 Department of State Training	UH-60A/L Flight Simulator	EASTERN AVIATION TRAINING SITE	PHRB	4/30/2012	5/6/2012	EASTERN AVIATION TRAINING SITE	2	$6,952 	213466
Jordan	IMET-1 - Fiscal Year 2012 Department of State Training	UH-60A/L Flight Simulator	EASTERN AVIATION TRAINING SITE	PRINCE HASHEM Royal Brigade	4/30/2012	5/6/2012	EASTERN AVIATION TRAINING SITE	2	$6,952 	213466
Jordan	IMET-1 - Fiscal Year 2012 Department of State Training	UH-60A/L Flight Simulator	EASTERN AVIATION TRAINING SITE	Royal Squadron	5/21/2012	5/25/2012	EASTERN AVIATION TRAINING SITE	2	$6,752 	213466
Jordan	IMET-1 - Fiscal Year 2012 Department of State Training	UH-60A/L Flight Simulator	EASTERN AVIATION TRAINING SITE	Air LIFT Wing	6/25/2012	6/29/2012	EASTERN AVIATION TRAINING SITE	1	$3,376 	213466
Jordan	IMET-1 - Fiscal Year 2012 Department of State Training	UH-60A/L Flight Simulator	EASTERN AVIATION TRAINING SITE	Air LIFT Wing	6/25/2012	6/30/2012	EASTERN AVIATION TRAINING SITE	1	$3,476 	213466
Jordan	IMET-1 - Fiscal Year 2012 Department of State Training	UH-60A/L Flight Simulator	EASTERN AVIATION TRAINING SITE	PRINCE HASHEM Royal Brigade	7/2/2012	7/6/2012	EASTERN AVIATION TRAINING SITE	2	$6,952 	213466
Jordan	IMET-1 - Fiscal Year 2012 Department of State Training	UH-60A/L Flight Simulator	EASTERN AVIATION TRAINING SITE	Royal SQN RJAF	7/2/2012	7/6/2012	EASTERN AVIATION TRAINING SITE	2	$6,752 	213466
Jordan	IMET-1 - Fiscal Year 2012 Department of State Training	UH-60A/L Flight Simulator	EASTERN AVIATION TRAINING SITE	Royal Squadron	7/9/2012	7/14/2012	EASTERN AVIATION TRAINING SITE	2	$7,350 	213466
Jordan	IMET-1 - Fiscal Year 2012 Department of State Training	UH-60A/L Flight Simulator	EASTERN AVIATION TRAINING SITE	PRINCE HASHEM Royal Brigade	7/30/2012	8/3/2012	EASTERN AVIATION TRAINING SITE	2	$6,752 	213466
Jordan	IMET-1 - Fiscal Year 2012 Department of State Training	UH-60A/L Flight Simulator	EASTERN AVIATION TRAINING SITE	PRINCE HASHEM Royal Brigade	8/13/2012	8/17/2012	EASTERN AVIATION TRAINING SITE	2	$6,752 	213466
Jordan	IMET-1 - Fiscal Year 2012 Department of State Training	UH-60A/L Flight Simulator	EASTERN AVIATION TRAINING SITE	P.H.R.B	9/3/2012	9/7/2012	EASTERN AVIATION TRAINING SITE	1	$3,476 	213466
Jordan	IMET-1 - Fiscal Year 2012 Department of State Training	UH-60A/L Flight Simulator	EASTERN AVIATION TRAINING SITE	PRINCE HASHIM Royal Brigade	9/3/2012	9/7/2012	EASTERN AVIATION TRAINING SITE	1	$3,476 	213466
Jordan	IMET-1 - Fiscal Year 2012 Department of State Training	UHF Systems Technician	CSCS LEARNING SITE NORFOLK	Electronic Communication Directorate	4/2/2012	6/18/2012	CSCS LEARNING SITE NORFOLK	1	$17,840 	213466
Jordan	IMET-1 - Fiscal Year 2012 Department of State Training	Welding Aluminum	COGARD TRAINING CENTER YORKTOWN VA	Maintenance Directorate	3/26/2012	4/20/2012	COGARD TRAINING CENTER YORKTOWN VA	1	$3,399 	213466
Jordan	IMET-1 - Fiscal Year 2012 Department of State Training	Wheeled Vehicle Mechanic	U.S. ARMY TRAINING CENTER	Electromechanical Directorate	4/9/2012	6/22/2012	U.S. ARMY TRAINING CENTER	1	$20,476 	213466
Jordan	IMET-1 - Fiscal Year 2012 Department of State Training	Fiscal Year 2012 Program Totals						231	$3,724,578 	213466
Jordan	Regional Centers - Fiscal Year 2012 Department of Defense Training	Combating Weapons of Mass Destruction & Terrorism	NESA	Jordanian Armed Forces	5/7/2012	5/23/2012	Washington, DC, United States	1	$9,096 	213466
Jordan	Regional Centers - Fiscal Year 2012 Department of Defense Training	IDEC Central and South Asia Working Group Regional Targeting Meeting	MC	Anti-Narcotics Department	9/10/2012	9/14/2012	Pravets, Bulgaria	1	$2,643 	213466
Jordan	Regional Centers - Fiscal Year 2012 Department of Defense Training	IDEC Central and South Asia Working Group Regional Targeting Meeting	MC	Jordan Anti Narcotics Department	9/10/2012	9/14/2012	Pravets, Bulgaria	1	$2,643 	213466
Jordan	Regional Centers - Fiscal Year 2012 Department of Defense Training	Language Testing Seminar, 12-02	MC	N/A	2/12/2012	2/25/2012	Garmisch, Germany	1	$931 	213466
Jordan	Regional Centers - Fiscal Year 2012 Department of Defense Training	NESA - Gulf Strategic Forum 2011	NESA	Embassy of Jordan	12/15/2011	12/18/2011	Rome, Italy	1	$5,044 	213466
Jordan	Regional Centers - Fiscal Year 2012 Department of Defense Training	NESA - Gulf Strategic Forum 2011	NESA	Embassy of Jordan in Italy	12/15/2011	12/18/2011	Rome, Italy	1	$5,044 	213466
Jordan	Regional Centers - Fiscal Year 2012 Department of Defense Training	NESA - Gulf Strategic Forum 2011	NESA	Energy & Mineral Resources	12/15/2011	12/18/2011	Rome, Italy	1	$5,044 	213466
