country	program	course_title	us_unit	student_unit	start_date	end_date	location	quantity	total_cost	source
Morocco	CTFP - Fiscal Year 2012 Department of Defense Training	Countering Narcotics and the Illicit Commons	ACSS	Ministry of National Defense	2/13/2012	2/17/2012	Washington, DC, United States	1	$5,070 	213466
Morocco	CTFP - Fiscal Year 2012 Department of Defense Training	International Counter Terrorism Fellows Program (PREP)	NATIONAL DEFENSE UNIVERSITY	Security Department-5B-FAR HDQTRS- RABAT	7/16/2012	8/20/2012	NATIONAL DEFENSE UNIVERSITY	1	$31,754 	213466
Morocco	CTFP - Fiscal Year 2012 Department of Defense Training	Legal Aspects CMBTerrorism	DEFENSE INSTITUTE OF INTERNATIONAL LEGAL STUDIES NEWPORT RI	Air Defense Territory- Sale AFB	8/20/2012	9/7/2012	NEWPORT, RI	1	$14,369 	213466
Morocco	CTFP - Fiscal Year 2012 Department of Defense Training	NESA Combating Transnational Threats Seminar CT 01-12	NESA	National ADMINISTRATION of DEF	1/17/2012	1/31/2012	Washington, DC, United States	1	$11,833 	213466
Morocco	CTFP - Fiscal Year 2012 Department of Defense Training	NESA Executive Seminar 01-12	NESA	Ministry of Foreign Affairs & Cooperation	10/18/2011	11/1/2011	Washington, DC, United States	1	$11,278 	213466
Morocco	CTFP - Fiscal Year 2012 Department of Defense Training	NESA Executive Seminar 02-12	NESA	Ministry of Foreign Affairs & Cooperation	4/24/2012	5/8/2012	Washington, DC, United States	1	$12,057 	213466
Morocco	CTFP - Fiscal Year 2012 Department of Defense Training	NESA Executive Seminar 02-12	NESA	Royal Moroccan Armed Forces	4/24/2012	5/8/2012	Washington, DC, United States	1	$12,057 	213466
Morocco	CTFP - Fiscal Year 2012 Department of Defense Training	NESA Senior Executive Seminar 01-12	NESA	Ministry of Foreign Affairs & Cooperation	2/6/2012	2/17/2012	Washington, DC, United States	1	$10,694 	213466
Morocco	CTFP - Fiscal Year 2012 Department of Defense Training	NESA Senior Executive Seminar 01-12	NESA	Royal Moroccan Armed Forces	2/6/2012	2/17/2012	Washington, DC, United States	2	$17,736 	213466
Morocco	CTFP - Fiscal Year 2012 Department of Defense Training	Next Generation of African Security Sector Leaders	ACSS	Ministry of National Defense	3/11/2012	3/30/2012	Washington, DC, United States	1	$17,090 	213466
Morocco	CTFP - Fiscal Year 2012 Department of Defense Training	Program in Advanced Security Studies	MARSHALL CENTER	BE/FRA- Marrakech	3/23/2012	5/31/2012	MARSHALL CENTER	1	$10,850 	213466
Morocco	CTFP - Fiscal Year 2012 Department of Defense Training	Program in Advanced Security Studies	MARSHALL CENTER	Police Headquarters -Rabat	3/23/2012	5/31/2012	MARSHALL CENTER	1	$10,850 	213466
Morocco	CTFP - Fiscal Year 2012 Department of Defense Training	Program in Advanced Security Studies (PASS)	MARSHALL CENTER	Army	9/23/2011	12/16/2011	MARSHALL CENTER	1	$11,900 	213466
Morocco	CTFP - Fiscal Year 2012 Department of Defense Training	Program in Advanced Security Studies (PASS)	MARSHALL CENTER	Gendarmerie Brigade Maritime - TEMARA	9/23/2011	12/16/2011	MARSHALL CENTER	1	$11,900 	213466
Morocco	CTFP - Fiscal Year 2012 Department of Defense Training	Program in Advanced Security Studies (PASS) 12-05	MC	BE FRA	3/23/2012	5/31/2012	Garmisch-Partenkirchen, Germany	1	$9,419 	213466
Morocco	CTFP - Fiscal Year 2012 Department of Defense Training	Program in Advanced Security Studies (PASS) 12-05	MC	Police	3/23/2012	5/31/2012	Garmisch-Partenkirchen, Germany	1	$9,419 	213466
Morocco	CTFP - Fiscal Year 2012 Department of Defense Training	Program on Terrorism and Security Studies	MARSHALL CENTER	Royal Gendarmerie	2/10/2012	3/16/2012	MARSHALL CENTER	1	$10,100 	213466
Morocco	CTFP - Fiscal Year 2012 Department of Defense Training	Program on Terrorism and Security Studies	MARSHALL CENTER	DOCUMENTATION DEP-Royal Gendarmerie HQTRS-RABAT	6/8/2012	7/13/2012	MARSHALL CENTER	1	$10,100 	213466
Morocco	CTFP - Fiscal Year 2012 Department of Defense Training	Program on Terrorism and Security Studies (PTSS)	MC	Royal Gendarmerie	6/8/2012	7/13/2012	Garmisch-Partenkirchen, Germany	1	$5,315 	213466
Morocco	CTFP - Fiscal Year 2012 Department of Defense Training	Program on Terrorism and Security Studies (PTSS) 12-03	MC	Royal Gendarmerie	2/10/2012	3/16/2012	Garmisch-Partenkirchen, Germany	1	$9,430 	213466
Morocco	CTFP - Fiscal Year 2012 Department of Defense Training	PTSS Alumni Community of Interest (COI) Workshop: "Our Threat Transforming: AQ and AQAM in a post-bin Laden Era"	MC	Brigade NAT`LE DE Police JUDIC	10/24/2011	10/27/2011	Garmisch-Partenkirchen, Germany	1	$567 	213466
Morocco	CTFP - Fiscal Year 2012 Department of Defense Training	PTSS Alumni Community of Interest (COI) Workshop: "Our Threat Transforming: AQ and AQAM in a post-bin Laden Era"	MC	Bulgaria Ministry of Interior	10/24/2011	10/27/2011	Garmisch-Partenkirchen, Germany	1	$2,137 	213466
Morocco	CTFP - Fiscal Year 2012 Department of Defense Training	Seminar on CBT WMD (SCWMD/T)	MARSHALL CENTER	Military Academy-MEKNES	3/2/2012	3/16/2012	MARSHALL CENTER	1	$2,500 	213466
Morocco	CTFP - Fiscal Year 2012 Department of Defense Training	Seminar on Combating Weapons of Mass Destruction and Terrorism	MC	Artillery Training Center, Military Academy- Meknes	3/2/2012	3/16/2012	Garmisch-Partenkirchen, Germany	1	$4,184 	213466
Morocco	CTFP - Fiscal Year 2012 Department of Defense Training	Senior Executive Seminar (SES)	MARSHALL CENTER	FAR Headquarters- RABAT	1/17/2012	1/27/2012	MARSHALL CENTER	1	$3,450 	213466
Morocco	CTFP - Fiscal Year 2012 Department of Defense Training	Senior Executive Seminar (SES)	MARSHALL CENTER	Royal Gendarmerie	1/17/2012	1/27/2012	MARSHALL CENTER	1	$3,450 	213466
Morocco	CTFP - Fiscal Year 2012 Department of Defense Training	Senior Executive Seminar (SES)	MC	Maghreb Arab Union Department	9/5/2012	9/13/2012	Garmisch-Partenkirchen, Germany	1	$4,720 	213466
Morocco	CTFP - Fiscal Year 2012 Department of Defense Training	Senior Executive Seminar (SES)	MC	Ministry of Justice and Liberties	9/5/2012	9/13/2012	Garmisch-Partenkirchen, Germany	1	$4,724 	213466
Morocco	CTFP - Fiscal Year 2012 Department of Defense Training	Senior Executive Seminar (SES)	MARSHALL CENTER	MAGREB ARAB UNION Department-MFA- RABAT	9/5/2012	9/13/2012	MARSHALL CENTER	1	$3,950 	213466
Morocco	CTFP - Fiscal Year 2012 Department of Defense Training	Senior Executive Seminar (SES)	MARSHALL CENTER	Terrorism and rganized crime Service-MOJ- RABAT	9/5/2012	9/13/2012	MARSHALL CENTER	1	$3,950 	213466
Morocco	CTFP - Fiscal Year 2012 Department of Defense Training	Senior Executive Seminar (SES) 12-01	MC	N/A	1/17/2012	1/27/2012	Garmisch-Partenkirchen, Germany	1	$2,678 	213466
Morocco	CTFP - Fiscal Year 2012 Department of Defense Training	Senior Executive Seminar (SES) 12-01	MC	Royal Gendarmery School	1/17/2012	1/27/2012	Garmisch-Partenkirchen, Germany	1	$2,859 	213466
Morocco	CTFP - Fiscal Year 2012 Department of Defense Training	Senior Leaders Seminar	ACSS	Ministry of Foreign Affairs and Cooperation	6/17/2012	6/29/2012	Washington, DC, United States	1	$11,036 	213466
Morocco	CTFP - Fiscal Year 2012 Department of Defense Training	Senior Leaders Seminar	ACSS	Ministry of National Defense	6/17/2012	6/29/2012	Washington, DC, United States	1	$9,061 	213466
Morocco	CTFP - Fiscal Year 2012 Department of Defense Training	Fiscal Year 2012 Program Totals						58	$515,753 	213466
Morocco	GPOI - Fiscal Year 2012 Department of State Training	UN PKO Contingent Commanders' Course (UNPKOCC)	UNK	Armor Regiment, Army	5/7/2012	5/18/2012	CCMR, Monterey, California, United States	1	$0 	213466
Morocco	GPOI - Fiscal Year 2012 Department of State Training	Fiscal Year 2012 Program Totals						1	$0 	213466
Morocco	IMET-1 - Fiscal Year 2012 Department of State Training	A/C NDI TECH CLASS C1	CO NAVAL AIR TECHNICAL TRAINING CENTER PENSACOLA FL	AMG/FRA	5/14/2012	8/27/2012	CO NAVAL AIR TECHNICAL TRAINING CENTER PENSACOLA FL	1	$20,020 	213466
Morocco	IMET-1 - Fiscal Year 2012 Department of State Training	ADV Calibration TECH	CENTER FOR NAVAL TECHNICAL TRAINING UNIT KEESLER AFB MS	3BA/FRA	5/10/2012	7/20/2012	CENTER FOR NAVAL TECHNICAL TRAINING UNIT KEESLER AFB MS	1	$13,932 	213466
Morocco	IMET-1 - Fiscal Year 2012 Department of State Training	Advanced English Language INSTR Course (AELIC)	DLIELC, LACKLAND AFB TX	1 Base- SALE	8/15/2011	11/25/2011	DLIELC, LACKLAND AFB TX	1	$17,056 	213466
Morocco	IMET-1 - Fiscal Year 2012 Department of State Training	Advanced English Language INSTR Course (AELIC)	DLIELC, LACKLAND AFB TX	DAT-SALE	8/15/2011	11/25/2011	DLIELC, LACKLAND AFB TX	1	$17,056 	213466
Morocco	IMET-1 - Fiscal Year 2012 Department of State Training	Air Command and Staff College	MAXWELL AFB, AL	1 Base- SALE	8/10/2011	6/11/2012	MAXWELL AFB, AL	1	$50,780 	213466
Morocco	IMET-1 - Fiscal Year 2012 Department of State Training	Air Command and Staff College	MAXWELL AFB, AL	2 Base-MEKNES	8/10/2011	6/11/2012	MAXWELL AFB, AL	1	$50,780 	213466
Morocco	IMET-1 - Fiscal Year 2012 Department of State Training	Air Defense Artillery Captains Career	Air Defense Artillery School	INSTRUCTION Center-Artillery	8/8/2011	1/12/2012	441S	1	$24,983 	213466
Morocco	IMET-1 - Fiscal Year 2012 Department of State Training	Air War College	MAXWELL AFB, AL	1 Base- SALE	7/25/2011	5/24/2012	MAXWELL AFB, AL	1	$65,412 	213466
Morocco	IMET-1 - Fiscal Year 2012 Department of State Training	ALC SpecialIzed English Training Only	DLIELC, LACKLAND AFB TX	Air Force	11/7/2011	1/6/2012	DLIELC, LACKLAND AFB TX	1	$13,256 	213466
Morocco	IMET-1 - Fiscal Year 2012 Department of State Training	ALC SpecialIzed English Training Only	DLIELC, LACKLAND AFB TX	Artillery/MEKNES	3/26/2012	5/25/2012	DLIELC, LACKLAND AFB TX	1	$15,606 	213466
Morocco	IMET-1 - Fiscal Year 2012 Department of State Training	ALC SpecialIzed English Training Only	DLIELC, LACKLAND AFB TX	Brigade LEGERE DE SECURITE/RABAT	4/2/2012	6/1/2012	DLIELC, LACKLAND AFB TX	1	$16,406 	213466
Morocco	IMET-1 - Fiscal Year 2012 Department of State Training	ALC SpecialIzed English Training Only	DLIELC, LACKLAND AFB TX	DAT	4/16/2012	6/15/2012	DLIELC, LACKLAND AFB TX	1	$15,206 	213466
Morocco	IMET-1 - Fiscal Year 2012 Department of State Training	ALC SpecialIzed English Training Only	DLIELC, LACKLAND AFB TX	5 BA/FRA	5/7/2012	7/6/2012	DLIELC, LACKLAND AFB TX	1	$15,206 	213466
Morocco	IMET-1 - Fiscal Year 2012 Department of State Training	ALC SpecialIzed English Training Only	DLIELC, LACKLAND AFB TX	Royal Navy 1ST BN	5/21/2012	7/19/2012	DLIELC, LACKLAND AFB TX	1	$10,177 	213466
Morocco	IMET-1 - Fiscal Year 2012 Department of State Training	ALPS I (Advanced LANG PROF Skills)	DLIELC, LACKLAND AFB TX	2nd BA/FRA	2/20/2012	5/11/2012	DLIELC, LACKLAND AFB TX	1	$15,769 	213466
Morocco	IMET-1 - Fiscal Year 2012 Department of State Training	American Language CRS General English Training Only	DLIELC, LACKLAND AFB TX	4 Navy Base	12/5/2011	1/6/2012	DLIELC, LACKLAND AFB TX	1	$11,990 	213466
Morocco	IMET-1 - Fiscal Year 2012 Department of State Training	Ammunition Specialist	ORDNANCE MUNITIONS & ELECTRONICS SCHOOL	2ND BA/FRA	4/30/2012	5/14/2012	091L	1	$7,639 	213466
Morocco	IMET-1 - Fiscal Year 2012 Department of State Training	Ammunition Specialist	ORDNANCE MUNITIONS & ELECTRONICS SCHOOL	2ND BA/FRA	5/15/2012	6/28/2012	091L	1	$6,623 	213466
Morocco	IMET-1 - Fiscal Year 2012 Department of State Training	Army War College (Resident Course)	ARMY WAR COLLEGE	INFRANTRY-SALE	8/2/2011	6/11/2012	ARMY WAR COLLEGE	1	$66,622 	213466
Morocco	IMET-1 - Fiscal Year 2012 Department of State Training	Basic ALC Instructor Course	DLIELC, LACKLAND AFB TX	Base ECOLE - MARRAKECH	7/18/2011	1/20/2012	DLIELC, LACKLAND AFB TX	1	$26,094 	213466
Morocco	IMET-1 - Fiscal Year 2012 Department of State Training	Basic American Language INSTR Course (BALIC)	DLIELC, LACKLAND AFB TX	4 Base-AGADIR	11/7/2011	5/11/2012	DLIELC, LACKLAND AFB TX	1	$29,014 	213466
Morocco	IMET-1 - Fiscal Year 2012 Department of State Training	Basic American Language INSTR Course (BALIC)	DLIELC, LACKLAND AFB TX	ENGLISH INSTRUCTOR	3/12/2012	9/14/2012	DLIELC, LACKLAND AFB TX	1	$34,854 	213466
Morocco	IMET-1 - Fiscal Year 2012 Department of State Training	Basic American Language INSTR Course (BALIC)	DLIELC, LACKLAND AFB TX	Royal Navy Center of INSTRUCTION	3/12/2012	9/14/2012	DLIELC, LACKLAND AFB TX	1	$35,622 	213466
Morocco	IMET-1 - Fiscal Year 2012 Department of State Training	BUD/S, DIVE, and SWIM PREP	NETSAFA INTERNATIONAL TRAINING CENTER PENSACOLA FL	Royal Navy 1ST BN	5/2/2012	5/16/2012	NETSAFA INTERNATIONAL TRAINING CENTER PENSACOLA FL	1	$8,135 	213466
Morocco	IMET-1 - Fiscal Year 2012 Department of State Training	Combined Logistices Captains Career (QM)	ALU - Leader Courses	Artillery INSPECTION Office-RABAT	2/6/2012	3/9/2012	ARMY LOG MGT COLLEGE - HUNTSVILLE CAMPUS	1	$5,066 	213466
Morocco	IMET-1 - Fiscal Year 2012 Department of State Training	Combined Logistics Captains Career (ALMC)	ALU - Leader Courses	Artillery INSPECTION Office-RABAT	10/4/2011	2/3/2012	ARMY LOG MGT COLLEGE - HUNTSVILLE CAMPUS	1	$17,927 	213466
Morocco	IMET-1 - Fiscal Year 2012 Department of State Training	Combined Logistics Captains Career (ALMC)	ALU - Leader Courses	Artillery INSPECTION Office-RABAT	3/12/2012	3/16/2012	ARMY LOG MGT COLLEGE - HUNTSVILLE CAMPUS	1	$1,381 	213466
Morocco	IMET-1 - Fiscal Year 2012 Department of State Training	Combined Logistics Captains Career (ALMC)	ALU - Leader Courses	ETABLISSEMNT SOUTIEN MATERIEL- FAR-CASA	5/30/2012	9/7/2012	ARMY LOG MGT COLLEGE - HUNTSVILLE CAMPUS	1	$16,111 	213466
Morocco	IMET-1 - Fiscal Year 2012 Department of State Training	EISENHOWER School	Eisenhower School for National Security	General INSPECTION-ARMOR Branch- RABAT	6/8/2012	6/22/2012	INDUSTRIAL COLLEGE OF THE ARMED FORCES	1	$5,390 	213466
Morocco	IMET-1 - Fiscal Year 2012 Department of State Training	EWO International	CENINFODOMINANCE LEARNING SITE NORFOLK VA	1ST Navy Base-CASABLANCA	4/2/2012	4/13/2012	CENINFODOMINANCE SITE NORFOLK VA	1	$7,367 	213466
Morocco	IMET-1 - Fiscal Year 2012 Department of State Training	FA OFF Advanced Preparatory IED Officer	FIELD ARTILLERY SCHOOL	Artillery/MEKNES	6/5/2012	6/27/2012	FIELD ARTILLERY SCHOOL	1	$6,060 	213466
Morocco	IMET-1 - Fiscal Year 2012 Department of State Training	Field Artillery Captains Career	FIELD ARTILLERY SCHOOL	5 Bureau-RABAT	7/12/2011	1/17/2012	FIELD ARTILLERY SCHOOL	1	$29,388 	213466
Morocco	IMET-1 - Fiscal Year 2012 Department of State Training	FLT Safety OFF (SATP/FSO)	KIRTLAND AFB, NM	1 AFB - SALE	7/6/2012	8/17/2012	KIRKLAND AFB, NM	1	$10,921 	213466
Morocco	IMET-1 - Fiscal Year 2012 Department of State Training	FLT Safety OFF (SATP/FSO)	KIRTLAND AFB, NM	2AFB- MEKNES	7/6/2012	8/17/2012	KIRKLAND AFB, NM	1	$10,921 	213466
Morocco	IMET-1 - Fiscal Year 2012 Department of State Training	GPOI Peace Support OPS CommanderS Course (PSOCC)	CENTER FOR CIVIL-MILITARY RELATIONS MONTEREY CA	DEPUTY Commander of 4TH ARMOR ESCARDON Group/SouthERN ZONE	5/7/2012	5/18/2012	CIVIL-MILITARY RELATIONS NPS CENTER FOR MONTEREY CA	1	$13,105 	213466
Morocco	IMET-1 - Fiscal Year 2012 Department of State Training	Human Resources Specialist	ADJUTANT GENERAL SCHOOL	HR Department- RMAF HDQTRS-RABAT	7/30/2012	9/26/2012	ADJUTANT GENERAL SCHOOL	1	$14,093 	213466
Morocco	IMET-1 - Fiscal Year 2012 Department of State Training	ICAF	Eisenhower School for National Security	General INSPECTION-ARMOR Branch- RABAT	8/8/2011	6/7/2012	INDUSTRIAL COLLEGE OF THE ARMED FORCES	1	$69,718 	213466
Morocco	IMET-1 - Fiscal Year 2012 Department of State Training	IF Preparatory Course	NATIONAL WAR COLLEGE	Intelligence-5TH B-HQTRS-RABAT	6/18/2012	8/10/2012	NATIONAL WAR COLLEGE	1	$62,458 	213466
Morocco	IMET-1 - Fiscal Year 2012 Department of State Training	ILE Officer PREP	COMMAND & GENERAL STAFF COLLEGE	Royal Artillery Group-16 Gar Batallion- Benslimane	7/23/2012	8/10/2012	COMMAND & GENERAL STAFF COLLEGE	1	$5,603 	213466
Morocco	IMET-1 - Fiscal Year 2012 Department of State Training	Intermediate Level EDUC	COMMAND & GENERAL STAFF COLLEGE	Security Brigade-RABAT	8/10/2011	6/8/2012	COMMAND & GENERAL STAFF COLLEGE	1	$57,912 	213466
Morocco	IMET-1 - Fiscal Year 2012 Department of State Training	International Fellows Orientation	ARMY WAR COLLEGE	Infantry INSPECTIO-Army HDQTRS-RABAT	6/25/2012	8/3/2012	ARMY WAR COLLEGE	1	$19,785 	213466
Morocco	IMET-1 - Fiscal Year 2012 Department of State Training	International Officer Intelligence CCC PREP	INTELLIGENCE SCHOOL	Brigade LEGERE DE SECURITE/RABAT	6/11/2012	6/22/2012	INTELLIGENCE SCHOOL	1	$5,794 	213466
Morocco	IMET-1 - Fiscal Year 2012 Department of State Training	International Officer Logistics Preparatory-CLC3	ARMY LOGISTICS MANAGEMENT COLLEGE	ETABLISSEMNT SOUTIEN MATERIEL- FAR-CASA	5/14/2012	5/25/2012	ARMY LOGISTICS MANAGEMENT COLLEGE	1	$8,689 	213466
Morocco	IMET-1 - Fiscal Year 2012 Department of State Training	International Officer Preparatory	COMMAND & GENERAL STAFF COLLEGE	Royal Artillery Group-16 Gar Batallion- Benslimane	7/2/2012	7/20/2012	COMMAND & GENERAL STAFF COLLEGE	1	$13,439 	213466
Morocco	IMET-1 - Fiscal Year 2012 Department of State Training	INTL Air Weapons DIR Training	TYNDALL AFB, FL	DAT	6/20/2012	8/17/2012	TYNDALL AFB, FL	1	$10,132 	213466
Morocco	IMET-1 - Fiscal Year 2012 Department of State Training	INTL OFF SCH (FOR AC&SC)	MAXWELL AFB, AL	1 AFB - SALE	6/18/2012	8/1/2012	MAXWELL AFB, AL	1	$28,354 	213466
Morocco	IMET-1 - Fiscal Year 2012 Department of State Training	INTL OFF SCH (FOR AC&SC)	MAXWELL AFB, AL	Air Defense TERRITORY Office-SALE	6/18/2012	8/1/2012	MAXWELL AFB, AL	1	$28,354 	213466
Morocco	IMET-1 - Fiscal Year 2012 Department of State Training	INTL OFF SCH (FOR AWC)	MAXWELL AFB, AL	1 Base- SALE	6/4/2012	7/18/2012	MAXWELL AFB, AL	1	$28,547 	213466
Morocco	IMET-1 - Fiscal Year 2012 Department of State Training	JT/COMB WARFIGHT	COMMANDANT JOINT FORCES STAFF COLLEGE NORFOLK VA	Royal Navy School-Csablanca	6/18/2012	9/3/2012	COMMANDANT JOINT FORCES STAFF COLLEGE NORFOLK VA	1	$20,099 	213466
Morocco	IMET-1 - Fiscal Year 2012 Department of State Training	JT/COMB WARFIGHT	COMMANDANT JOINT FORCES STAFF COLLEGE NORFOLK VA	4 Navy Base	6/25/2012	8/31/2012	COMMANDANT JOINT FORCES STAFF COLLEGE NORFOLK VA	1	$19,607 	213466
Morocco	IMET-1 - Fiscal Year 2012 Department of State Training	JT/COMB WARFIGHT	COMMANDANT JOINT FORCES STAFF COLLEGE NORFOLK VA	Army 5TH Bureau/RABAT	6/25/2012	8/31/2012	COMMANDANT JOINT FORCES STAFF COLLEGE NORFOLK VA	1	$19,407 	213466
Morocco	IMET-1 - Fiscal Year 2012 Department of State Training	Logistics Readiness Officer	LACKLAND AFB, TX (OTHER THAN DLI AND IAAFA STUDENTS)	Air Force	1/9/2012	3/13/2012	LACKLAND AFB, TX (OTHER THAN DLI AND IAAFA STUDENTS)	1	$4,849 	213466
Morocco	IMET-1 - Fiscal Year 2012 Department of State Training	Managing English Language Training (MELT)	DLIELC, LACKLAND AFB TX	Infantry Royal School-BENGUERIR	1/30/2012	3/30/2012	DLIELC, LACKLAND AFB TX	1	$12,782 	213466
Morocco	IMET-1 - Fiscal Year 2012 Department of State Training	Maneuver Captains Career	USATC	INSTRUCTION CENTRE of MANEUVER- MEKNES	9/12/2011	12/15/2011	USATC	1	$12,227 	213466
Morocco	IMET-1 - Fiscal Year 2012 Department of State Training	MINE CounterMEASURES for INT'L Officers	CSCS MINE WARFARE TRAINING CENTER SAN DIEGO CA	N Navy Base-CASABLANCA	7/16/2012	8/10/2012	PMWS	1	$3,697 	213466
Morocco	IMET-1 - Fiscal Year 2012 Department of State Training	MINE Warfare Orientation for International Officer	CSCS MINE WARFARE TRAINING CENTER SAN DIEGO CA	N Navy Base-CASABLANCA	6/18/2012	7/13/2012	PMWS	1	$8,622 	213466
Morocco	IMET-1 - Fiscal Year 2012 Department of State Training	Multinational ELCTRNC WRFR INTL OFF CRSE (SATP)	479OSS/SPECTRA ADO	5 BA/FRA	7/9/2012	8/14/2012	DPEN479OSS	1	$3,568 	213466
Morocco	IMET-1 - Fiscal Year 2012 Department of State Training	Naval Command College	NAVAL COMMAND COLLEGE NEWPORT RI	BNSG- Navy HQ RABAT	7/27/2011	6/15/2012	NAVAL COMMAND COLLEGE NEWPORT RI	1	$120,204 	213466
Morocco	IMET-1 - Fiscal Year 2012 Department of State Training	Naval Staff COL - 10 MONTH	NAVAL STAFF COLLEGE NEWPORT RI	Royal Navy School-Csablanca	7/27/2011	6/15/2012	NAVAL STAFF COLLEGE NEWPORT RI	1	$110,792 	213466
Morocco	IMET-1 - Fiscal Year 2012 Department of State Training	Naval Staff COL - 5 1/2 MO	NAVAL STAFF COLLEGE NEWPORT RI	4 Navy Base	1/11/2012	6/15/2012	NAVAL STAFF COLLEGE NEWPORT RI	1	$54,032 	213466
Morocco	IMET-1 - Fiscal Year 2012 Department of State Training	Naval Staff COL - 5 1/2 MO	NAVAL STAFF COLLEGE NEWPORT RI	Army 5TH Bureau/RABAT	1/11/2012	6/15/2012	NAVAL STAFF COLLEGE NEWPORT RI	1	$60,394 	213466
Morocco	IMET-1 - Fiscal Year 2012 Department of State Training	Observer	DLIELC, LACKLAND AFB TX	Army Language School-Rabat	9/24/2012	9/28/2012	DLIELC, LACKLAND AFB TX	1	$6,200 	213466
Morocco	IMET-1 - Fiscal Year 2012 Department of State Training	Safety APR	LACKLAND AFB, TX (OTHER THAN DLI AND IAAFA STUDENTS)	4 AirForce Base-LAAYOUNE	6/18/2012	8/6/2012	LACKLAND AFB, TX (OTHER THAN DLI AND IAAFA STUDENTS)	1	$7,551 	213466
Morocco	IMET-1 - Fiscal Year 2012 Department of State Training	Safety APR	LACKLAND AFB, TX (OTHER THAN DLI AND IAAFA STUDENTS)	LOGISITIC DEP-CASABLANCA	6/18/2012	8/6/2012	LACKLAND AFB, TX (OTHER THAN DLI AND IAAFA STUDENTS)	1	$7,551 	213466
Morocco	IMET-1 - Fiscal Year 2012 Department of State Training	Signal Captains Career PREP-International	SIGNAL SCHOOL	Signal BATALLION-TICHKA-South ZONE	6/19/2012	7/5/2012	SIGNAL SCHOOL	1	$9,236 	213466
Morocco	IMET-1 - Fiscal Year 2012 Department of State Training	SOS INT'L OFF SCH CRS	MAXWELL AFB, AL	2nd BA/FRA	2/6/2012	3/21/2012	MAXWELL AFB, AL	1	$24,404 	213466
Morocco	IMET-1 - Fiscal Year 2012 Department of State Training	Squadron Officer School	MAXWELL AFB, AL	2nd BA/FRA	3/26/2012	5/18/2012	MAXWELL AFB, AL	1	$5,762 	213466
Morocco	IMET-1 - Fiscal Year 2012 Department of State Training	Strategic Level Small Craft COMBTG TERR (SLSCCBT)	U S NAV SMALL CRAFT INSTR AND TECH TRNG SCH STENNIS SPACE CTR MS	Royal Navy 1ST BN	7/20/2012	8/16/2012	PNS1	1	$17,495 	213466
Morocco	IMET-1 - Fiscal Year 2012 Department of State Training	SWO ADV GAS Turbine ENGRG	SURFACE WARFARE OFFICERS SCHOOL COMMAND NEWPORT RI	2 Navy Base- EL HOUCEIMA	7/30/2012	9/28/2012	SURFACE WARFARE OFFICERS SCHOOL COMMAND NEWPORT RI	1	$18,232 	213466
Morocco	IMET-1 - Fiscal Year 2012 Department of State Training	SWO DH OPS SPEC INTL	SURFACE WARFARE OFFICERS SCHOOL COMMAND NEWPORT RI	1ST Navy Base-CASABLANCA	4/16/2012	7/27/2012	SURFACE WARFARE OFFICERS SCHOOL COMMAND NEWPORT RI	1	$22,448 	213466
Morocco	IMET-1 - Fiscal Year 2012 Department of State Training	Fiscal Year 2012 Program Totals						70	$1,633,912 	213466
Morocco	Regional Centers - Fiscal Year 2012 Department of Defense Training	AFRICOM Academic Symposium Tanzania	ACSS	Moroccan Center for Strategic Studies	7/8/2012	7/13/2012	Dar es Salaam, Tanzania	1	$1,947 	213466
Morocco	Regional Centers - Fiscal Year 2012 Department of Defense Training	CIT Alumni Community of Interest Workshop: Initiating a Dialog on Common Issues and Cooperation	MC	Gendarmerie	6/18/2012	6/21/2012	Garmisch-Partenkirchen, Germany	1	$3,134 	213466
Morocco	Regional Centers - Fiscal Year 2012 Department of Defense Training	CIT Alumni Community of Interest Workshop: Initiating a Dialog on Common Issues and Cooperation	MC	Gendarmerie Royale	6/18/2012	6/21/2012	Garmisch-Partenkirchen, Germany	3	$10,977 	213466
Morocco	Regional Centers - Fiscal Year 2012 Department of Defense Training	CIT Alumni Community of Interest Workshop: Initiating a Dialog on Common Issues and Cooperation	MC	Police	6/18/2012	6/21/2012	Garmisch-Partenkirchen, Germany	1	$3,134 	213466
Morocco	Regional Centers - Fiscal Year 2012 Department of Defense Training	NESA - Gulf Strategic Forum 2011	NESA	NATO Defense College	12/15/2011	12/18/2011	Rome, Italy	1	$5,044 	213466
Morocco	Regional Centers - Fiscal Year 2012 Department of Defense Training	NESA Combating Transnational Threats Seminar CT 01-12	NESA	Ministry of Foreign Affairs & Cooperation	1/17/2012	1/31/2012	Washington, DC, United States	1	$11,773 	213466
Morocco	Regional Centers - Fiscal Year 2012 Department of Defense Training	NESA Executive Seminar 01-12	NESA	Ministry of National Defense	10/18/2011	11/1/2011	Washington, DC, United States	1	$11,736 	213466
Morocco	Regional Centers - Fiscal Year 2012 Department of Defense Training	NESA Washington Embassy Orientation 01-12	NESA	Embassy of Morocco	10/3/2011	10/7/2011	Washington, DC, United States	3	$822 	213466
Morocco	Regional Centers - Fiscal Year 2012 Department of Defense Training	Program on Advanced Security Studies 11-10	MC	Gendarmerie Royale	9/23/2011	12/17/2011	Garmisch-Partenkirchen, Germany	1	$6,218 	213466
Morocco	Regional Centers - Fiscal Year 2012 Department of Defense Training	Program on Advanced Security Studies 11-10	MC	Ministry of Defense	9/23/2011	12/17/2011	Garmisch-Partenkirchen, Germany	1	$6,218 	213466
Morocco	Regional Centers - Fiscal Year 2012 Department of Defense Training	PTSS Alumni Community of Interest (COI) Workshop: "Our Threat Transforming: AQ and AQAM in a post-bin Laden Era"	MC	Police	10/24/2011	10/27/2011	Garmisch-Partenkirchen, Germany	1	$2,127 	213466
Morocco	Regional Centers - Fiscal Year 2012 Department of Defense Training	RSSC Regional Conference March 2012	NESA	University of Cadi Ayyad Marrakech	3/28/2012	3/31/2012	Beirut, Lebanon	1	$791 	213466
Morocco	Regional Centers - Fiscal Year 2012 Department of Defense Training	SSN Director's Meeting May 2012	NESA	Center for Study and Research in Social Sciences	5/28/2012	5/31/2012	Venice, Italy	1	$5,778 	213466
Morocco	Regional Centers - Fiscal Year 2012 Department of Defense Training	SSN Director's Meeting May 2012	NESA	Moroccan Center for Strategic Studies	5/28/2012	5/31/2012	Venice, Italy	1	$5,778 	213466
Morocco	Regional Centers - Fiscal Year 2012 Department of Defense Training	Fiscal Year 2012 Program Totals						18	$75,477 	213466
Oman	CTFP - Fiscal Year 2012 Department of Defense Training	COMB STRAT INTEL Training Program	Defense Intelligence Agency (CSITP)	COSSAF	4/2/2012	5/18/2012	Defense Intelligence Agency (CSITP)	1	$15,741 	213466
